Title,Description
"Data Scientist – Automated Market Making Team - Montréal, QC - Indeed.com","Data Scientist – Automated Market Making Team
Job Number:
3182760
POSTING DATE: Jul 29, 2021
PRIMARY LOCATION: Americas-Canada-Quebec-Montreal
JOB: Investment Banking/Sales/Trading/Research
EMPLOYMENT TYPE: Full Time
JOB LEVEL: Associate
DESCRIPTION
We offer:
- To work with some of the best professionals in the business - for a firm that values individual intellect as much as teamwork
State-of-the-art offices that are designed to maximize collaboration
Flexible working arrangements
Enriching challenges that provide opportunity for constant learning and advancement
An environment which is leveraging technology to its highest potential
Team Profile:
The Institutional Equity Division (IED) is a global leader in the origination, distribution and trading of cash and derivative products. The Firm’s Automated Market Making (AMM) group provides liquidity for options in automated markets worldwide. The AMM Team consists of quantitative traders, strategists, analysts, software developers, hardware developers, infrastructure and networking specialists, and data architects all collaborating to build and expand a cutting-edge system that trades over 1,000,000 securities on 2,500 underliers across 16 options exchanges. The desk operates at the intersection of finance and technology, and many of the models and system designs used to drive the engine sit on the forefront of innovation.
Position Description:
We are looking for truly exceptional talent to join the Automated Market Making team (AMM). AMM is one of the industry leading on-screen market makers for equity options globally.
AMM is made up of software and hardware developers, traders, data scientists and quantitative strategist. Together we train a system to make markets across 14 exchanges in the US and 2 in Europe. The system automatically prices, quotes, hedges, and risk manages the position.
The data scientist will:
Create innovative solutions to model various aspects of the electronic options market making, such as risk management, volatility fitting, microstructure analysis, and algorithmic trading
Analyze terabytes of equity and options market data to derive actionable intelligence to improve trading performance
Develop reporting, analytics, and visualization tools
Work together with other strategists, traders, and technology
QUALIFICATIONS
Skills Required:
Bachelor’s with 3+ years of experience or advanced degree in a related field
Prior programming experience in a scripting language such as Python/R
Interest in quantitative work and data analytics
Excellent communication skills and ability to interact with traders and technology
Nice to have:
Previous experience in machine learning/modeling is a plus
Strong programming skills in kdb+/Q
Knowledge of C++
About us:
Morgan Stanley is a global financial services firm and a market leader in investment banking, securities, investment management and wealth management services. At Morgan Stanley Montreal, we are shaping the future of our global business and contributing to our local community. Our team works across numerous areas.
Morgan Stanley is an equal opportunities employer. We work to provide a supportive and inclusive environment where all individuals can maximise their full potential. Our skilled and creative workforce is comprised of individuals drawn from a broad cross section of the global communities in which we operate and who reflect a variety of backgrounds, talents, perspectives and experiences. Our strong commitment to a culture of inclusion is evident through our constant focus on recruiting, developing and advancing individuals based on their skills and talents.
Knowledge of French and English is required.
Spotlight on our Montreal Technology Centre: https://www.youtube.com/watch?v=oo5GaXpCwKs
Video dated October 2019.
Build a career with impact. Visit morganstanley.com for more information."
"Production Labourer - Quesnel, BC - Indeed.com","Armtec Inc.
is one of Canada’s largest manufacturers of steel drainage and highway construction products. Armtec Inc. is a member of the WGI Westman Group of companies, a dynamic entrepreneurial group of companies who values safety, health, community, relationships, growth and fiscal responsibility.
Armtec Inc. has the following career opportunity in
Prince George, BC:
PRODUCTION LABOURER
Reporting to the Production Foreman, the successful candidate will be responsible for completing general labour tasks that include: operating various pieces of equipment, using a plasma and cutting torch. This position assists in all areas of production.
Duties and Responsibilities:
Assists mill operator and learn operation of mill to act as back up.
Recorr culvert.
Assists in inspections and repair of equipment.
Ships and receives product.
Maintains stock and yard in good condition.
Fabricates various components. This includes forming, cutting, welding, grinding, painting and other operations required to produce our products.
Loads materials into production machines.
Removes, packages and sorts raw materials and finished goods using manual or powered equipment.
Maintains a clean, uncluttered and safe work area as designated.
Performs all other work activities as assigned and required.
Qualifications and requirements:
One (1) to two (2) years related experience in manufacturing, preferably in metal forming or shaping
Ability to read and understand drawings
Experience operating forklift; certification an asset (will train if needed)
Working knowledge of hand and power tools
Experience with plasma cutting and welding
Mechanically inclined
Ability to follow directions and communicate effectively
High attention to detail
Armtec provides a competitive total rewards package including professional growth, career development and continuous learning.
Combine your talent and ambition with our team!
______________________________________________________________________________________________________
PLEASE READ CAREFULLY
By submitting your application you agree to the following:
The information contained on this application is accurate, complete and up-to-date to the best of my knowledge. I understand that any misrepresentation may disqualify me from employment or because for my dismissal. If hired, I agree to abide by all rules and regulations of the Company, including serving an initial probationary period. I provide my consent for this information to be used and/or disclosed in accordance with the Westman Group Privacy Code.
______________________________________________________________________________________________________
We thank all applicants for their interest. Only those selected for an interview will be contacted.
Job Types: Full-time, Permanent
Additional pay:
Overtime pay
Benefits:
Casual dress
Dental care
Disability insurance
Employee assistance program
Extended health care
Life insurance
On-site parking
Paid time off
Profit sharing
Tuition reimbursement
Vision care
Wellness program
Schedule:
8 hour shift
Day shift
Monday to Friday
Work remotely:
No"
"Software Developer - Inception (Job Req #2022-110) - Ottawa, ON - Indeed.com","Why Work at Ross Video? We have a great group of people working together to create and deliver cutting edge products that look amazing and are easy to use. We go all out so that our customers can have the best possible experience and achieve quality results. With a product focus, continual learning, results driven processes, and creative thinking, we constantly strive to improve our solutions and to deliver results. If you've ever watched live television, news, sports, or entertainment, you've seen our products in use. All of the major Hollywood award shows, most professional sports teams, and many of the largest broadcasters in the world use Ross Video technology. Get behind the scenes and learn about what it takes to make live events possible. If that resonates, and you’re someone with integrity, commitment, and a strong drive to deliver great products, we’d love to hear from you.
Inception – Software Developer Job Description
INCEPTION – YOUR MODERN NEWSROOM
The world has changed. It’s faster paced, and we’re bombarded with more information than ever before. For news organizations to succeed they must adapt to the quickly evolving world of social media and find new ways to plan and organize their content.
News productions must also leverage new platforms, no longer is it acceptable to simply broadcast over the air. To reach the broadest audience and be successful, content needs to be produced for all mediums, including broadcast, the Web, and social media. Audiences need to be engaged in a way that was never possible until now.
We need you to become part of the winning team that makes all this possible.
We are a team currently transitioning into an agile workflow and believe in incremental development and continual improvement. We know we’re not perfect and as we embark on this journey, we expect to make mistakes, but also to learn from those mistakes and grow as a result to become stronger, faster, better.
Customer satisfaction is our highest priority, so we are highly customer focused. If that means jumping on a plane and flying half-way around the world to address an issue, then that’s what we’ll do. If that means sticking our heads into a lion’s mouth, well… we won’t do that, but you get the idea •.
We believe in technical excellence and want to create craftspeople as opposed to developers and testers. We think that following best practices, such as TDD, clean code, adhering to SOLID design principles, clean architecture, test automation, and high levels of collaboration among the team produces the most maintainable and extendable applications.
While we have individual specialties, we are all full stack developers. Some of the technologies we work with include React, jQuery, HTML, CSS, Jetty, Ajax, Java, Eclipse, OSGi, Struts, and Hibernate.
WE'RE GROWING FAST
That means we are always looking for better ways to adapt our work environment and processes to meet the high demands of our customers. Our roles morph, we volunteer for extra tasks, we all care a lot about helping to make good things happen. If you don't like change, you’re in the wrong place, but if you do, then you can be part of an incredible journey.
WHY WORK FOR US?
We can help you flourish. You will get to develop and deliver cutting edge technological solutions for the entertainment industry. You will be part of the Ross Video team working together to make that happen, and we find that a pretty energizing environment.
We value our people and listen to their feedback. We also offer great perks, flexible hours, free coffee and soft drinks (and a commercial espresso machine for when you need that extra jolt), team building events, BBQ's, and other fun activities. You'll also get to work on real-world projects that have a meaningful impact to our customers and are in use all over the world, every day.
Equity, Diversity & Inclusion
At Ross, we embrace diversity, and we want you to bring your authentic self to work. We are committed to building a team that includes a variety of backgrounds, perspectives, and skills. Inclusivity drives innovation and creativity, and that’s something we’re passionate about at Ross! We believe everyone should be able to enjoy a rewarding career at Ross, regardless of race, colour, religion, sexual orientation, gender, gender identity or expression, marital status, age, veteran status, physical or mental disability. If a disability means that you need any additional support during the recruitment process, please contact Talent Acquisition and we will make all reasonable efforts to accommodate your request.
Mandatory Covid-19 Vaccination Policy
At Ross, we put the health and safety of our employees and their families first. It is our responsibility to provide a safe work environment, and as such, we strongly encourage all employees globally to get vaccinated against Covid-19. As a global company, we understand that policies and legislations may vary from country to country. In certain jurisdictions, Ross has implemented a Mandatory Covid-19 Vaccine Policy for all employees and proof of vaccination may be required during the hiring process. If you have any questions or concerns regarding this policy, please reach out to the Talent Acquisition team."
"Machine Learning Developer (English Services) - Toronto, ON - Indeed.com","Job Family Media Production
Primary Location Toronto
Position Language Requirement English Only
Language Skill Level (Reading) -
Language Skill Level (Writing) -
Language Skill Level (Speaking) -
Status of Employment Permanent
Work schedule(s) Full-time
Collaboration and performance at CBC is both a mindset and an approach. At CBC Digital Strategy and Products, we’re people- and outcome-focused. We believe that people are at their best when they have some flexibility in how and where they work. Due to the pandemic, our teams are currently working virtually, on a full-time basis. Once it is safe to do so, we will transition to our hybrid model. This model allows for virtual early- or later-starts, as well as on-site meetings.
Work at CBC/Radio-Canada
At the CBC, we all have a story to tell. What’s yours?
If you share our passion for Canadian storytelling and you wish to help us engage with individuals and communities across our various digital platforms, this is where you’ll want to be!
Every day, you will have an opportunity to shape the way in which Canadians see themselves reflected in our digital services. Your work will have a direct impact on how millions of Canadians from various communities connect with our products, with one another, and with the diverse voices that make our country so unique.
You will have the opportunity to play a part in enlightening and entertaining Canadians through our innovative work in building the mediums that deliver our content. We are an innovative hub, where the talented professionals we work with are respected and valued for their contributions. Our product teams are vibrant and our work culture strives to achieve the highest standards of diversity and inclusion. We believe that hiring people with different career paths and backgrounds is fundamental in our shared success and in building healthy and highly performant teams. When you join our mission, you are not only shaping the vision of the CBC, but the future of our country.
Why is this role important?
This isn’t your typical machine learning role. You are taking the best of data systems engineering, machine learning and software development, and applying it to interesting problems you wouldn’t normally get a chance to solve at a big enterprise or a startup.
As a Machine Learning Developer, you’ll be able to apply Machine Learning approaches to products, where the expected outcome is to show value to our audience, rather than to increase company revenue. We have several recommendation systems in production that we actively iterate on. At CBC Digital Products, we tackle the hard problems, while applying the very best solutions to serve the needs of Canadians. For more stories on what we have built and how we use Machine Intelligence at CBC, explore our blog posts on Medium.
As our new Machine Learning Developer, you will be responsible for development and deployment of Machine Learning algorithms, uniquely catered to our various product offerings and content areas, and their success metrics. With direct mentorship from senior members of our Machine Learning practice, this is an exciting opportunity to apply your knowledge and grow your hands-on skills using - and building - the latest tools and technologies.
If you're passionate about Canada and you love technology, learning and bringing out the best in others, you’ll love working at CBC.
Here’s why we should work together:
Our digital teams’ values - collaboration, learning, and continuous improvement - embody who we are as a people-focused, digital-forward employer. We follow lean startup principles and use an Agile approach. Our dedicated people managers work closely with every individual to ensure we are leveraging their strengths, championing their ideas and supporting their pursuit of new skills and their desired career progression.
Here at CBC Digital Strategy & Products, we want you to be happy and feel good at work. It is essential that work be a safe space where our employees are able to share their authentic selves with one another and to push each other to challenge conventions.
Perks you can look forward to:
Flexible work schedules, allowing you to prioritize yourself, your family and your work
Work from home opportunities
Competitive total rewards package
20% of time for innovation, learning and development; wherever your interests lie
Opportunities to work with cutting edge technology
Opportunities for continued learning and professional development
Opportunities to become a member of our Employee Resource Groups
Pair programming and mentorship opportunities, where you can learn from the best in the industry and help coach new talent
A creative and dynamic work environment, where your ideas and contributions can be heard, valued and respected
A supportive management team committed to upholding the highest standards of diversity and inclusivity
An environment which favours experimentation and an iterative approach in order to achieve the highest form of technical innovation
We are looking for a candidate with the following:
How you will make an impact:
You will build, Validate, and deploy machine learning solutions that will help us better engage with Canadians.
You will experiment with machine learning algorithms to create personalized experiences uniquely customized for Canadians.
You will help iterate on our machine learning infrastructure to ensure it continues to be robust and scalable.
You will collaborate with individuals, teams and community of practices to ensure the highest quality product is developed and best practices are followed.
You will continuously pursue knowledge through build, measure, learn processes in an Agile environment and stay on top of the latest technology developments.
What you could bring to our team:
The passion for machine learning and data. You like to experiment and explore bleeding edge technologies and techniques, and validate their effectiveness.You are comfortable with the level of ambiguity these new technologies and projects might bring.
The experience. You have strong software development principles and apply them rigorously. To that end, we will be asking you to complete a timed technical assessment. We want to respect your time, evaluate your skills and ensure you have the knowledge that will enable you to thrive and grow in our environment.
The education. A degree in Computer Science, Engineering, Math, or equivalent is preferred, but we know not everyone gains their programming skills this way.
The technical skills. You have strong software development skills in Python and knowledge of machine learning libraries (e.g. Tensorflow). You have an interest in Big Data technologies, NoSQL, ETL and Google Cloud Platform or AWS.
The bonus skills. Ideally, you have two years experience in building machine learning models and deploying them into production.
Candidates may be subject to skills and knowledge testing.
All employees of CBC/Radio-Canada are required to be fully vaccinated against COVID-19 as of
December 1st 2021
unless exempted based on a medical/religious ground. As per this requirement, employees must attest to their vaccination status. The requirement for employees to be fully vaccinated applies whether they are teleworking, working remotely or working on-site. This is a condition of employment and it applies to all employees. Should you reach the point in the selection process where it is necessary to verify if you meet the conditions of employment, you will be asked to provide an attestation confirming your COVID-19 vaccination status.
To Apply:
Think this job is meant for you but worried you don’t have it all? At CBC/Radio-Canada we know that not everyone takes the same path when it comes to building their skills. Hands-on experience, intelligence, innovation, a passion for learning and a team-focused approach can combine to form the best set of qualifications. If you feel you meet 70% of the requirements we are seeking and you are excited by the possibility of growing our company, take a chance and express your interest.
If this sounds interesting, please follow the link here. Please note, your application will be handled by TalentMinded (our external partner) and information received will be treated in complete confidence. We thank all applicants for their interest, but only candidates selected will be contacted.
If you’re interested in reading more about the various backgrounds of the talented people that make up our teams, our exciting new projects, and what we’re currently working on, check out our Digital Labs blog on Medium!
CBC/Radio-Canada is committed to being a leader in reflecting our country’s diversity. That’s because we can only create and tell the stories that connect Canadians, by having a workforce that mirrors the ever-changing makeup of our country. That’s why we, as an employer, value equal opportunity and nurture an inclusive workplace where our individual differences are not only recognized and valued, but also extend to and pervade all the services we provide as Canada’s public broadcaster. For more information, visit the Diversity and Inclusion section of our website. If you have accommodation needs at this stage of the recruitment process, please inform us as soon as possible by sending an e-mail to recruitment@cbc.ca.
You are invited to consult and familiarize yourself with our Code of Conduct, which can be found on our corporate website. All employees must adhere to the Code as a condition of employment. We also invite you to take a look at our policy on conflicts of interest. In the event that you become an employee, it will be important to inform us, as quickly as possible, of any situation that, because of your hiring, constitutes or could appear to constitute a conflict of interest.
Job Posting Date Oct 14, 2021, 12:01:02 PM
Unposting Date Dec 16, 2021, 1:59:00 AM"
