Title,Description
"Maintenance Technician-II, Fairlife - Peterborough, ON - Indeed.com","Why Join Coca-Cola North America?
It’s an exciting time to work in The Coca-Cola Company’s flagship market. We’re accelerating our momentum as the fastest-growing large consumer goods company in North America by putting people at the heart of our business and everything we do – whether we’re innovating to give consumers the drinks and packaging sizes they want, or building our eCommerce capabilities. People are our focus when we’re collaborating with our diverse network of locally-connected bottling partners, and when we’re returning every drop of water we use to communities and nature. And people – with the different backgrounds, skills and perspectives they bring to our workplace – are helping transform our business, one big idea at a time. We empower our employees to challenge the status quo, make bold recommendations, experiment and adapt, so we can grow together and make a great business even better.
This role will be a part of our new Fairlife dairy production plant in Peterborough, Ontario to manufacture Fairlife milk in Canada.
The primary role of the Maintenance Technician- II is to provide safe, timely, reliable and cost-effective troubleshooting, maintenance and repair service for processing, high speed packaging and facilities equipment to support plant operations. The technician must diagnose, troubleshoot, maintain and repair breakdowns and/or problems in all areas of processing equipment, high speed packaging lines, facilities, electrical, automation, instrumentation and controls systems. The technician must be independently able to troubleshoot, pin-point problems, remediate all problems and conducts problem solving along with team members to fix reoccurring issues.
Responsibilities and Duties:
Diagnose, troubleshoots, performs repair and maintenance, and rebuilds on processing equipment, high speed packaging lines, and facilities equipment such as separators, pasteurizers, membranes, control valves, blow molder, filler, sleever, case packer, palletizer, compressor, pumps, AHUs, cooling towers etc.
Diagnose, troubleshoot and configure Variable Frequency & Servo Drives, Programmable Logic Controllers (PLC), Human Machine Interface (HMI), sensors, actuators, instruments, industrial network pushbuttons, contactors, motor starters, electrical distribution system etc.
Troubleshoot, repair and/or replace faulty components in electrical, control, vacuum/pneumatics and hydraulic system to ensure reliable and uninterrupted plant operations
Perform effective troubleshooting, repairs, preventive maintenance (PM) or modifications in accordance with manufactures specifications and documentation on processing, packaging and facilities equipment
Develop and execute Cleaning, Lubrication, Inspection & Calibration schedules for entire plant equipment
Observes and test the plant equipment to diagnose malfunctions, using meters/analyzers, operator stations and other test/monitoring devices; and replace faulty components to keep equipment operational, drives standardization to maintain consistency
Ensures compliance to codes and standards, confined space entry, work at height, Lock-out-tag-out, Line Break Permit, hazardous materials, bench and hand tool safe use, etc. and maintain clean and orderly work areas
Defines preventive maintenance & calibration schedules and procedures in maintenance software, and executes the PM schedule tasks, assess plans with operators, supervisors, managers, OEMs and redefine frequencies to improve overall equipment performance
Maintain records and ensure inventory is made available for upcoming maintenance and calibration activities, and supports spare parts store setup & management activities
Maintain drawings, instructional manuals, program backups, certificates, procedures and make revisions as needed
Drives continuous improvement initiatives, identify & execute improvement projects, reliability centered maintenance programs, and demonstrate problem-solving mindset on the shop floor
Obtains complete operation and controls knowledge of plant's processing & packaging lines, facilities, cleaning and sanitation equipment
Supervise contractors work and safety during new installation and routine plant operations
Performs other tasks and duties as assigned by management
Qualifications:
Licensed Electrician or Millwright (442A or 309A or 443A) in the province of Ontario
Preferred to have additional qualification such as, additional Trade Ticket, Operating Engineer Certification OR Refrigeration Operator Certification etc.
3+ years of maintenance experience on automated high-speed packaging, processing and facilities equipment along with electrical and automation experience
Ability to use maintenance planning software (SAP) or willing to learn (SAP) to define and execute PM plans
Proficient in using computers and associated software programs for troubleshooting (Siemens, Allan Bradley, B&R)
Proficient in reading Piping & Instrumentation Diagrams, one-line diagrams, assembly drawings, schematics (pneumatic, hydraulic, electrical), PLC & HMI programs, and conducting Input/output checks
Must have proven experience with pump, valves, heat exchangers, hydraulic system, compressors, motors, power transmission rebuilds and repair
Must have familiarity with PLC and HMI software and ability to go online on controllers to troubleshoot
Experience with blow molding equipment an asset
Proficient in operating welding equipment, drill press, lathe, grinder, hand tools and other metal working equipment
Flexible to work any shift required and must be available on calls during off shifts
Must have the ability and willingness to cross train in other departments
Ability to stand for prolonged periods of time, and work on multiple levels, such as catwalks, ladders, etc. and ability work in refrigerated and extreme temperatures environment/confined space/narrow spaces
Able to lift, push or pull up to 50 pounds
Ability to travel outside of Canada and possess a valid passport
Coca-Cola Limited is committed to creating a diverse and inclusive workforce. We have a number of programs and policies in place to support this goal. If you require a disability-related accommodation in order to participate in the recruitment process, please contact our HR Shared Service team by calling
1-877-677-6774
. Coca-Cola Limited will consult with all applicants with a disability who request accommodation during the recruitment process to ensure that the accommodation provided takes into account the applicants individual accessibility needs.
Our Purpose and Growth Culture:
We are taking deliberate action to nurture an inclusive culture that is grounded in our company purpose, to refresh the world and make a difference. We act with a growth mindset, take an expansive approach to what’s possible and believe in continuous learning to improve our business and ourselves. We focus on four key behaviors – curious, empowered, inclusive and agile – and value how we work as much as what we achieve. We believe that our culture is one of the reasons our company continues to thrive after 130+ years. Visit Our Purpose and Vision to learn more about these behaviors and how you can bring them to life in your next role at Coca-Cola.
We are an Equal Opportunity Employer and do not discriminate against any employee or applicant for employment because of race, color, sex, age, national origin, religion, sexual orientation, gender identity and/or expression, status as a veteran, and basis of disability or any other federal, state or local protected class. When we collect your personal information as part of a job application or offer of employment, we do so in accordance with industry standards and best practices and in compliance with applicable privacy laws."
"Supervisor, Machine Shop - Ottawa, ON - Indeed.com","Job Title: Supervisor, Machine Shop
Reporting to: Manager, Machine Shop
Status: Full Time
Location: 1000 Morrison Drive
About Lee Valley:
Since 1978, Lee Valley has recognized that woodworking and gardening are not just hobbies, but are for many a lifestyle choice. Lee Valley Tools enjoys a proud 40-year history of providing high quality woodworking, gardening, hobby, hardware, gift and seasonal merchandise to customers worldwide. Our customer service is renowned. We pride ourselves in providing quality in all products, whether developed and manufactured internally or sourced elsewhere.
A position at Lee Valley is more than just a job – we honor the time and dedication that our people give by providing sustained and meaningful employment and we strive to provide an environment where learning and development are encouraged. Our innovation to grow as a business, our efforts towards customer satisfaction, quality goods and employee culture have won Lee Valley the 2021 Best Ottawa Business Award.
Overview:
Reporting to the Manager, Machine Shop, the Supervisor, Machine Shop is responsible for coordinating and organizing all activities associated with the execution of master production schedule in a manner that meets or exceeds all targets, in line with key performance indicators (KPI’s). He/She is responsible for organizing, training, coaching and motivating a group of employees in designated work posts in order to achieve Quality, Cost and On-time Delivery objectives.
The incumbent provides day-to-day guidance to others and co-ordinates the activity within the assigned area to ensures a smooth flow of work.
This position may involve shift work.
Key Responsibilities:
Safety
Provides coaching and training with respect to health and safety, and company rules and policies
Ensures that all health and safety procedures are adhered to
Quality (Continuous Quality Improvement)
Monitors production closely verifying that parts being produced are to the drawing
Monitor quality levels to reduce defects and eliminate waste
Provides coaching and training with respect to process operations
Works with Manager to assess performance and determine training requirements
Works with employees to plan, monitor and provide timely and useful feedback of individual performance of unit members as well as provide training and development where needed
Receives guidance in handling sensitive employee situations, such as performance issues, absenteeism, etc.
Works with operators to ensure that all required documents are completed and submitted
On-time Delivery
Monitors and Reviews production schedule and works with materials group, planning and production management to ensure that all forth-coming jobs are production ready and offer suggestions to help reduce capacity constraints – improve on time delivery
Manage resources effectively to ensure key work centers are appropriately staffed
Works with operators to remove obstacles and escalates all issues preventing the production of parts
Ensure production is tracked accurately using Macola (MRP System)
Takes accountability for the behaviour and performance of the assigned group and/or shift, and provides on-the-job training and mentoring to other team members
Cost (Lean Manufacturing, Elimination of Waste)
Communicates schedule to operators to ensure rapid set-ups and to improve set-up times
Reviews the manufacturing process in order to sustain or improve cycle times
Monitor, maintain and improve performance measures such as; Machine Utilization, Efficiency and Productivity by working directly with the manufacturing team
Is responsible for the overall efficiency and productivity of machine posts
Ensures that preventative maintenance schedules for all machines are adhered to
Provides updates at the daily production meeting pertaining to: parts produced, machine up and down time, resource issues and/or constraints, incorrect material and cycle-time standards, etc.
Participates in 5S activity and ensures that 5S audits are conducted per the audit schedule and procedure
Participate in the quoting of new product
Identifies and eliminates waste throughout the life cycle of all products
General
Responsible to ensure all equipment, tools, fixtures, etc. are operated and maintained to ensure they are functioning at a high level
Participates in the salary planning process.
Knowledge and Skills:
1-2 year college diploma, typically requires 5 years of experience in a manufacturing environment
Machinist license or applicable trade certificate or equivalent years of machine shop experience
A Manufacturing or Industrial Engineering background would be considered an asset
Excellent communication, both written and verbal
Ability to customize communication to influence others, with arguments that are supported by facts and research.
Strong change management and interpersonal skills
Strong motivational, organizational and leadership skills
Knowledgeable in respect to work holding and inspection fixtures
Above average ability to read and interpret drawings
A repertoire of problem solving tools such as Six Sigma
Job Specific Skills:
Experience in leading complex operations
Strong motivational, organizational and leadership skills
Demonstrated effectiveness in cross –functional collaboration
Previous leadership training and experience, supervising up to 25 employees.
Excellent understanding of all grinding and lapping processes.
A good understanding of Veritas quality and inspection methods
Previous experience working in a Lean Manufacturing environment.
Experience with MRP systems, preferably Macola"
Software Engineer Co-op (Winter 2022) - British Columbia - Indeed.com,"OVERVIEW
As a
Software Engineer
Co-op
you will join Terramera's multidisciplinary Research & Development (R&D) team to help develop on our full stack. On a multi-OS foundation of Windows, Linux, and Docker expect to learn about:
Java technologies (Servlets, Hibernate, Spring)
databases (Postgres)
reactive user interface implementation (Vue.js)
service-oriented architecture
web scraping
developing tools and scripts in Python
This position will play a key role in new application development to allow users to efficiently input scientific data and effectively present complex data sets to a wide variety of end users. You will join our Software Development team and work closely with Scientists, Machine Learning and Robotics Engineers, and other groups in R&D.
Co-op Term
: Winter 2022 (January - April 2022) with possibility of extension to 8 or 12 month work term
Location:
Remote based in Vancouver, BC
Reports to
:
Senior Software Engineer
Note
: Preference will be given to candidates who are a
Canadian citizen, permanent resident or person granted refugee status in Canada as per wage subsidy requirements
RESPONSIBILTIES
Gather requirements from business partners and codify these into Agile stories
Code RESTful Java web services (with Java, spring boot) and web-based front ends (with HTML 5, JavaScript, Vue.js) that extensively interact with various APIs
Write unit tests for the code you contribute
Help implement the enterprise's Service Oriented Architecture (SOA) design patterns
Perform analysis on data sets from both areas of the business
Support the complete software / hardware solutions that you help build
WHO YOU ARE
Currently working towards a Bachelor's Degree in Computer Science, Computer Engineering, or related discipline
Experience in Java programming or JavaScript programming background
Solid programming skills with a focus on writing clean/maintainable code
Capable of performing research on best practices and making it consumable for other team members
Able to apply domain knowledge to ambiguous and novel situations
PREFERENCES
Familiarity with Python
Exposure to common MVC and DOM frameworks (JavaScript side - e.g. jQuery, Vue.js, React)
Exposure to RESTful services
Knowledge of JSON / XML
Knowledge of the Agile project management methodology
Exposure to machine learning terminology and concepts
QUALITIES WE'RE LOOKING FOR
Effective team player demonstrating a positive attitude
High attention to detail
Responsive to feedback and applying it for continuous improvements
Takes initiative, generating new and innovative approaches to problems
OUR VALUES
We Make It Happen
We Raise The Bar
We > I
Terramera The Sh!t Out Of It
PS. Have Fun
PERKS
Ping pong table and meditation pods on site
Weekly company wide demo days
Free snacks and beverages on site
Health & Wellness initiatives
Company socials and events
Lunch and Learns
Emphasis on work-life balance
Hear what our past co-ops have to say:
""
My experience at Terramera was educational, challenging and fun! I was given the freedom to problem-solve which did more for my development as a scientist (and as a person) than any other job I've had
."" – Kai (
Research Assistant Co-op in In Vitro Fungicide Screening
)
""
My favourite memory at Terramera was going snowshoeing with the team for one of the monthly social events. Everyone was bonding and having a good time—the team knows how to have fun!
"" – Jacky (
Software Engineer Co-op
)
""I used to eat bagels with cream cheese and cucumbers for lunch every single day at Terramera. One day, my coworkers walked into the lunchroom without looking at me and put down their own bags of bagels, spreads, and vegetables and started preparing their own bagels. It was a memorable prank!
"" – Cherri (
Research Assistant Co-op in Plant Pathology
)
WHO WE ARE
Terramera is a cleantech leader focused on fusing AI, science and nature to create revolutionary technologies that transform how we grow food and solve other world-scale challenges. With its Actigate™ Targeted Performance technology and mission to unlock the intelligence in nature to ensure a world that thrives and provides for everyone, Terramera is committed to reducing global synthetic chemical loads in agriculture by 80 percent while increasing global farm productivity by 20 percent by 2030. The privately held company was founded in 2010 and has grown to include a world-class bench of engineers, scientists, advisors and investors. Terramera is headquartered in Vancouver, British Columbia, Canada, has integrated operations that include a research lab, greenhouse and farm, and has more than 185 patents in its IP portfolio.
Our success begins with our people. We're looking for A-Players who are passionate about making a difference as we are and thrive in environments that are dynamic, challenging and rewarding. Join our movement, as we set a new standard and change the world together as a highly dedicated, innovative, future-focused and solutions-oriented team.
While we thank all applicants for their interest, only short-listed candidates will be contacted. For more information on Terramera, please visit our website at www.terramera.com
Terramera is committed to a diverse workforce and we are an equal opportunity employer.
As we make serious efforts to learn more about how we can increase diversity in our candidate pool, we invite you to
voluntarily
provide demographic information in a confidential survey at the end of this application.
Providing this information is
optional
. It will not be used in the hiring process, and has no effect on your opportunity for employment.
APPLICATION DEADLINE
Applications will be accepted on a rolling basis."
"eMachine Research Engineer_ Flexible Work Arrangement - Chatham-Kent, ON - Indeed.com","Job ID: 9060
Location:
Chatham, CA
THE POSITION
Within the Technology & Innovation group in Vitesco Technologies, the candidate will focus on design and development criteria for the next generation of electric motors.
Daily Activities include but not are limited to:
Developing electric machine innovations that drive leadership in performance, efficiency, packaging and cost
Developing models of e-machines for component level analysis and to output data for system level analysis
Interfacing with internal and external resources to gain information on activities related to e-machine development and testing
Planning and implementation of testing activities for e-machines
Analysis of component level e-machine data to assess performance and identify opportunities for improvement of design or calibration
Technical scouting, creating innovation projects and developing new product opportunities
Professional development including attending technical conferences/seminars
Build- up technical competences and communication skills of team
WHY YOU SHOULD APPLY
Immediate Benefits
Paid Time Off
Tuition & Employee Discounts
Annual Bonus
Employer 401(k) Match
And more benefits that come with working for a global industry leader!
Job Requirements
Required:
Master’s degree or higher in Electrical or Mechanical Engineering, or related
2 plus years of technical engineering experience both individually & in a team setting
2 plus years in e-machine design/development and/or testing
2 plus years of project management experience
Multidisciplinary experience and ability to adapt to different domains
Experience with component/system engineering requirements
Experience with customer communications & technical presentations
Demonstration of excellent communication and collaboration skills
Preferred:
Advanced degree by thesis related to e-machine or powertrain topics
Fundamental knowledge of powertrain systems and/or components
Experience with powertrain testing, including dynamometer or vehicle level testing
Experience with e-machine simulation/modeling with packages such as ANSYS-Maxwell and MotorCAD
Experience with data processing and analysis, especially with Matlab-Simulink
Experience with technical scouting, innovation projects and developing new products
Ability to provide input on project management methods to track and communicate progress, coordinate team activities, identify obstacles and propose countermeasures
Ability to coordinate cross-divisional collaboration for related topics
Ability to build up technical competence and communication skills of team
Interest in professional development & new learning/leadership opportunities
Working Time:
Full time
Your Contact Partner:
Shasta Franklin
EEO Statement
EEO / AA / Disabled / Protected Veteran Employer. Vitesco Technologies offers equal employment opportunities to all qualified individuals, without regard to unlawful consideration to race, color, sex, sexual orientation, gender identity, age, religion, national origin, disability, veteran status, or any other status protected by applicable law. In addition, as a federal contractor, Continental complies with government regulations, including affirmative action responsibilities, where they apply. To be considered, you must apply for a specific position for which Continental has a current posted job opening. Qualifying applications will be considered only for the specific opening(s) to which you apply. If you would like to be considered for additional or future job openings, we encourage you to reapply for other opportunities as they become available. Further, Vitesco Technologies provides reasonable accommodations to qualified individuals with a disability. If you need assistance in the application process, please reply to like careers_usa&canada@vitesco.com or contact US Recruiting at
248-393-5566
. This telephone line and email address are reserved solely for job seekers with disabilities requesting accessibility assistance or an accommodation in the job application process. Please do not call about the status of your job application, if you do not require accessibility assistance or an accommodation. Messages left for other purposes, such as following up on an application or non-disability related technical issues, will not receive a call back.
Vitesco Technologies is a leading international developer and manufacturer of state-of-the-art powertrain technologies for sustainable mobility. With smart system solutions and components for electric, hybrid and internal combustion vehicles, Vitesco Technologies makes mobility clean, efficient and affordable. The product range includes electric drives, electronic control units, sensors and actuators, and exhaust-gas aftertreatment solutions. In 2020, Vitesco Technologies recorded sales of around 8 billion Euros and employs almost 40,000 people at around 50 locations worldwide. Vitesco Technologies is headquartered in Regensburg, Germany."
