Title,Description
"Research Engineer Intern, Simulation Technology - Summer 2022 - Canada - Indeed.com","For two decades, we have pioneered visual computing, the art and science of computer graphics. With our invention of the GPU - the engine of modern visual computing - the field has grown to encompass video games, movie production, product design, medical diagnosis and scientific research. Today, we stand at the beginning of the next era, the AI computing era, ignited by a new computing model, GPU deep learning. This new model - where deep neural networks are trained to recognize patterns from massive amounts of data - has shown to be deeply effective at solving the most complex problems in everyday life.
NVIDIA is searching for a world-class
Research Engineer Intern
to join our growing team. The ideal candidate will be converting state of the art AI research into cutting edge AI applications. With incredible resources in AI, graphics and robotics, you will be able to impact, contribute and advance these exciting domains. Topics include but are not limited to AI for simulation, 3D Deep Learning, DL for animation, content generation, transfer learning, domain adaptation, computer vision, and medical imaging. With its unique open culture, NVIDIA is one of the best industry labs to do AI research.
What you’ll be doing:
Build and launch interactive applications that connect real users to a new generation of AI-powered 3D tools
Learn practical skills and latest trends in Deep Learning research from leading experts in the field
Collaborate closely with other researchers and research engineers to ensure high-quality deliverables
What we need to see:
Currently pursuing a B.Sc, Master’s or Ph.D. in Computer Science/Engineering, Math/Physics/Statistics or a related field
Classwork background in core computer science areas, e.g.: algorithms, software design, UI design, computer graphics, machine learning
Good communications skills
Proficient in Python; experience with DL frameworks and UI toolkits a plus
Experience developing a larger software project, preferably with a collaborative component (e.g. in an industrial internship, larger class project, or an open source software project)
NVIDIA is widely considered to be one of the technology world’s most desirable employers. We have some of the most forward-thinking and hardworking people in the world working for us. Are you creative and autonomous? Do you love the challenge to find new ways to contribute to simulation technology? If so, we want to hear from you. Come, join our Research Team and help drive our success in this exciting and quickly growing field."
"Assets TA - Vancouver, BC - Indeed.com","Are you an Assets TA who enjoys supporting creative and visual objectives through pipeline troubleshooting, user support, technical assistance, and tool development?
We will be looking for an Assets TA to join the
Vancouver team
for our upcoming animated features!
What you'll get to do:
Quality control rigs and collaborate with the Animation department to bring our characters to life
Support the asset department artists and TDs with pipeline and asset issues
Ensure that highly optimised assets retain intended creative representations
Collaborate with other TDs and the R&D department
Be responsible for troubleshooting and user support within the rigging software and proprietary tools
Test and validate new releases of workflow tools with Maya
What you bring:
1+ years' experience on an animated/VFX feature, TV commercials or animated series, working as a TA is desirable but not essential
Experience supporting artists with technical issues in a production environment is preferable
Experience in at least one high end 3D software package, e.g. Maya
Programming experience in Python is a bonus
Good generalist skills with a solid understanding of all departments
A focus on quality control and active artist support
High level of organisation
Excellent attention to detail
Ability to multi-task, prioritise and problem solve
Ability to work within a strong team environment
Strong communication and interpersonal skills
What we bring:
The opportunity to join a growing, independently owned and operated, award-winning studio!
Conveniently located in Yaletown near the heart of downtown Vancouver
A chance to contribute to the success of ground-breaking animated feature films
A dedicated Learning and Development and Artist Management team focused on your personal career growth
Flexible work arrangements, with hybrid work options
A generous leave policy including paid annual leave, sick days, as well as 'Volunteer' days to support those causes close to your heart!
A variety of employee benefits including breakfast, free use of barista coffee machines, and snacks galore!"
"Design Verification Engineering - Oakville, ON - Indeed.com","Who we are:
Geotab is a global leader in IoT and connected transportation and certified “Great Place to Work.” We are a company of diverse and talented individuals who work together to help businesses grow and succeed, and increase the safety and sustainability of our communities.
Geotab is advancing security, connecting commercial vehicles to the internet and providing web-based analytics to help customers better manage their fleets. Geotab’s open platform and Marketplace, offering hundreds of third-party solution options, allows both small and large businesses to automate operations by integrating vehicle data with their other data assets. Processing billions of data points a day, Geotab leverages data analytics and machine learning to improve productivity, optimize fleets through the reduction of fuel consumption, enhance driver safety and achieve strong compliance to regulatory changes.
Our team is growing and we’re looking for people who follow their passion, think differently and want to make an impact. Ours is a fast paced, ever changing environment. Geotabbers accept that challenge and are willing to take on new tasks and activities - ones that may not always be described in the initial job description. Join us for a fulfilling career with opportunities to innovate, great benefits, and our fun and inclusive work culture. Reach your full potential with Geotab. To see what it’s like to be a Geotabber, check out our blog and follow us @InsideGeotab on Instagram, Twitter or Facebook. Join our talent network to learn more about job opportunities and company news.
At Geotab, all staff must be fully vaccinated in order to be eligible to work in our North American offices at this time. Accordingly, any job offer for an onsite position resulting from this posting will be conditional upon the successful candidate providing evidence of full vaccination. Accommodations may be made for those who cannot be vaccinated based on medical or other legally protected grounds.
Geotab policies and requirements are subject to change based on local or federal guidelines.
Who you are:
We are always looking for amazing talent who can contribute to our growth and deliver results! Geotab is seeking a Design Verification Engineering who is responsible for creating a functional suite of test cases and executing them as part of the product development cycle. If you love technology, and are keen to join an industry leader — we would love to hear from you!
What you’ll do:
As a Design Verification Engineering your key area of responsibility will be exercising both hardware and firmware verification testing to ensure the highest quality product is developed and produced. Emphasis is placed on detecting, reporting and tracking deficiencies within the Geotab product family in order to close the loop in the development life cycle. You will need to work closely with Geotab’s design verification team. To be successful in this role you will be a self-starter with strong written and verbal communication skills, and have the ability to quickly understand complex, technical concepts. In addition, the successful candidate will have strong analytical skills with an ability to identify needs, develop effective solutions, and manage projects through completion.
How you’ll make an impact:
Develop test plans and cases for integration.
Interface and collaborate with development teams to ensure comprehensive test coverage, understand design intent and close ongoing product improvement loop.
Perform functional testing of individual products within the Geotab portfolio.
Validate the interoperability of Geotab and third-party product lines.
Collaborate with Automation Engineering teams to automate cases and build a suite of test scripts to increase efficiency of future test cycles.
Identify and reproduce bugs and deficiencies to increase overall product quality. Generate and follow-up with defects tracked in the project management database.
Complete functional, integration and performance testing on new product during the release cycle; Provide detailed reports with results to the core engineering teams for analysis.
What you’ll bring to this role:
1-3 years experience in Design Verification or Quality Assurance.
High accuracy and meticulous attention to detail.
Experience in developing tests verifying specific features and/or products.
Great computational and spatial ability.
Proven experience using CAD software; experience with Jira is an asset.
Highly organized and able to manage multiple tasks and projects simultaneously.
Excellent verbal and written communication skills.A strong team-player with the ability to engage with all levels of the organization.
Technical competence using software programs, including, but not limited to, Google Suite for business (Sheets, Docs, Slides).Entrepreneurial mindset and comfortable in a flat organization.
Post-Secondary Degree/Diploma Specialization in Computer, Electrical, Systems Engineering, Computer Science or a related field.
Why job seekers choose Geotab:
Work from home and flex work arrangements
Baby bonus
Home office reimbursement program
Online learning and networking opportunities
Electric vehicle purchase incentive program
Competitive medical and dental benefits (full-time employees only)
Retirement savings program (full-time employees only)
How we work:
At Geotab, we understand that the world is always changing and that we need to change with it. Geotab has adopted a hybrid model for working, including a flexible work from home program, with the opportunity to work in our safe, clean offices. When working from home, you are required to have a reliable internet connection with at least 50mb DL/10mb UL. Virtual work is supported with cloud-based applications, collaboration tools and asynchronous working. The health and safety of employees are a top priority. We encourage work-life balance and keep the Geotab culture going strong with online social events, chat rooms and gatherings. Join us and help reshape the future of technology!
We believe that ensuring diversity is fundamental to our future growth and progress and is an integral part of our business. We believe that success happens where new ideas can flourish – in an environment that is rich in diversity and a place where people from various backgrounds can work together. Geotab encourages applications from all qualified individuals. We are committed to accommodating people with disabilities during the recruitment and assessment processes and when people are hired. We will ensure the accessibility needs of employees with disabilities are taken into account as part of performance management, career development, training and redeployment processes. If you require accommodation at any stage of the application process or want more information about our diversity and inclusion as well as accommodation policies and practices, please contact us at careers@geotab.com. Click here to learn more about what happens with your personal data."
"Data Scientist - Toronto, ON - Indeed.com","Analytics, Toronto, FT
Your Role:
Explore customer data to uncover insights using data mining and analytic skills.
Training and tuning modern machine learning and AI algorithms to maximize performance and speed.
Building presentations to explain methodology, convey insights and share value based outcomes.
Work independently with tasks assigned.
Skills Required:
Bachelors degree in Math, Statistics, Engineering or Computer Science
Fluency in Python
Strong Communication and problem solving skills.
Exposure to Tableau an asset."
"Software Developer - Montréal, QC - Indeed.com","Intelcom is a leading Canadian and Montreal operated last mile delivery platform provider. The company has generated exceptionally fast growth in the last years and projects to maintain this pace in the coming years. Intelcom is currently undertaking a technology transformation that will require new talent in the fields of logistics technologies, data platforms, marketing automation & CX, data science, machine learning, cybersecurity & business intelligence. The company will also expand its physical and market footprint and will require a strong technology operation platform & infrastructure to support this growth.
Overview of the role:
Reporting directly to the Manager Software Development, Logistics Technology, the software developers are responsible to develop Intelcom’s next-generation of technologies. The ideal candidate is a strong collaborator and partner positioned within a product delivery team. The candidate understands contemporary software design and engineering practices. Thriving in a fast-paced, multidisciplinary environment, working closely with a Technical Lead and Product Manager to determine requirements, improve quality, and speed up execution. We need our software developers to be versatile, display leadership qualities and be enthusiastic to take on new problems across the full stack (with a focus on backend) as we continue to push technology forward.
What does your day look like:
Write clean readable code, debug complex problems that span systems, prioritize work with a high level of effectiveness;
Write and review technical documents and review code;
Analyze, review and modify existing software solutions to increase operating efficiency or meet new requirements;
Develop tests and processes to ensure software stability and correctness;
Work closely with product management team to ensure we are re building the best products possible.
What will help you succeed:
Bachelor's degree in Computer Science (or equivalent) ;
3-7 years of software development experience using Python programming language. (As an asset: Perl, Java, PHP, or Node.js);
Experience with software development practices such as source control, code reviews, unit testing, debugging;
Experience within a cloud environment (AWS is required, Microsoft Azure, GCP);
Experience developing in a service-oriented architecture (SOA), using micro services (an asset);
Working experience with Agile delivery teams;
Bilingual. (Basic knowledge of French is required)
Advantages of joining our team :
Competitive salary;
100% remote home-officing
Group insurance plan and RRSP after 3 months;
Offices are located in Griffintown (Montreal), accessible by public transportation (Lucien-L’allier subway station);
At Intelcom, we encourage initiative and value creation through participatory projects and an open culture. Together we are building a knowledge-sharing community as well as developing numerous collaborative projects to offer a personalized and flexible delivery service."
"Software Development Engineer - Amazon Fulfillment Technologies - Toronto, ON - Indeed.com","2+ years of non-internship professional software development experience
Programming experience with at least one modern language such as Java, C++, or C# including object-oriented design
1+ years of experience contributing to the architecture and design (architecture, design patterns, reliability and scaling) of new and current systems.
Amazon Fulfillment Technologies (AFT) powers Amazon’s massive global fulfillment network by designing and building the software, hardware and processes that enable our customers to get what they want, when they want it. We don’t just talk about innovating, we put innovation into action, working alongside our employees in the FCs to move billions of customer orders through our Fulfillment Centers globally. We push the bounds of robotics, computer vision, machine learning, and operations research to improve quality, engage our workforce, and delight customers. AFT is creating the future of fulfillment, and we’re looking for people with big ideas and the drive to see them at work in the real world. Passionate about conceptualizing, building and operating massively scalable systems? Looking forward to being a key engineer for planetary scale initiatives? If so, this is the opportunity tailored just for you and we can't wait to hear from you.
What you’ll do?
Design and develop creative solutions to complex engineering problems of scale.
Effectively mentor junior engineers, helping to maintain appropriate unit test coverage, code documentation, software structure and support
Own and deliver end to end key initiatives, maintaining effective communication with management and stakeholders
Identify, evaluate and suggest mitigation strategies for risks during design
Contribute to system design, process and development standards documentation
Knowledge of professional software engineering practices & best practices for the full software development life cycle, including coding standards, code reviews, source control management, build processes, testing, and operations.
Ability to clearly and concisely communicate with technical and non-technical customers in order to understand ambiguous problems and articulate technical challenges and solutions to complex problem
Experience with building and supporting live high-volume production systems
Proficient with Object Oriented principles and software design patterns
By submitting your application here, you can apply once to be considered for multiple Software Engineer openings across various Amazon teams. If you are successful in passing through the initial application review and assessment, you will be asked to submit your career and personal preferences so that our dedicated recruiters can match you to the right role based on these preferences.
Amazon is committed to providing accommodations at all stages through recruitment and employment in accordance with applicable human rights and accommodation legislation. If contacted for an employment opportunity, advise Human Resources if you require accommodation, including in order to apply for a position."
Senior Member of Technical Staff - Canada - Indeed.com,"Senior Member of Technical Staff -21000XGP
Applicants are required to read, write, and speak the following languages
:
English
Preferred Qualifications
Department Description:
At Oracle Cloud Infrastructure (OCI), we build the future of the cloud for Enterprises as a diverse team of creators and inventors. We act with the speed and attitude of a start-up, with the scale and customer focus of the top-tier enterprise software company in the world.
Values are OCI’s foundation and how we deliver excellence. We strive for equity, inclusion, and respect for all. We are committed to the greater good in our products and our actions. We are constantly learning and taking opportunities to grow our careers and ourselves. We challenge each other to stretch beyond our past to build our future.
You are the builder here! You will be part of a team of really smart, motivated, and a diverse group of people and given the autonomy and support to do your best work. It is a dynamic and flexible workplace
where you’ll belong and be encouraged.
“Cloud Engineering Infrastructure Development”
Are you interested in building large-scale distributed infrastructure systems for the cloud? The OCI team is building new technologies that operate at high scale in a broadly distributed, multi-tenant cloud
environment. Our customers depend on our work to run their businesses and our mission is to provide them with the best in class set of cloud-based services.
Position Overview:
We are looking for hands-on, distributed systems engineers and architects with expertise and passion in solving difficult problems within large-scale, global platforms. If this is you, at Oracle you can design and build innovative new systems from the ground up. This is an exciting time in our journey - we are growing fast, still at an early stage, and working on ambitious new initiatives. An engineer at any level can have a significant technical and business impact.
The ideal candidate will have proven experience designing, building, and implementing distributed, cloud-scale systems. You should be both a rock-solid coder and a distributed systems generalist that is
comfortable diving deep into any part of the stack, including interaction with hardware. You should value simplicity and scale, work comfortably in a collaborative, agile environment, and be excited to learn.
Minimum Qualifications:
Bachelor’s degree in Computer Science or equivalent proven experience
5-8 years experience building and operating large scale, highly available, cloud-based distributed systems
Specialist skill in a modern programming language such as Java, C, C++, C#, Go, or Python, with proficiency in additional languages preferred
Validated understanding of operating system fundamentals
Strong understanding of data models and distributed persistence technologies
Thorough understanding of the latest security principles, techniques, and protocols
Strong troubleshooting and performance tuning skills
Proficiency in network, distributed, asynchronous, and concurrent programming
Knowledge of professional software engineering standard methodologies for the full software development process
Experience building and operating scalable infrastructure software or distributed systems
Experience using Amazon Web Services such as EC2, EBS, Lambda, Dynamo, and S3 or equivalents
Proven track record to achieve stretch goals in a highly innovative and fast-paced environment
Passion for technical leadership and mentoring
Strong verbal and written communication skills
Strong analytical skills, with excellent problem-solving abilities
Preferred Qualifications
Experience in Agile/SCRUM enterprise-scale software development
Experience with big data solutions
Direct experience with fleet orchestration for both virtual and containerized workloads
Knowledge of Machine Learning fundamentals
Working familiarity with networking protocols (TCP/IP, HTTP) and standard network architectures
Working familiarity with storage principles, protocols, and practices
Working familiarity with building secure software using modern security principles
Technical leadership experience
Detailed Description and Job Requirements
Design, develop, troubleshoot and debug software programs for databases, applications, tools, networks etc.
As a member of the software engineering division, you will assist in defining and developing software for tasks associated with the developing, debugging or designing of software applications or operating systems. Provide technical leadership to other software developers. Specify, design and implement modest changes to existing software architecture to meet changing needs.
Duties and tasks are varied and complex needing independent judgment. Fully competent in own area of expertise. May have project lead role and or supervise lower level personnel. BS or MS degree or equivalent experience relevant to functional area. 4 years of software engineering or related experience.
Job
:
Product Development
Location
:
Canada
Job Type
:
Regular Employee Hire
Organization
:
Oracle"
