Title,Description
"JavaScript Software Development Engineer - Ottawa, ON - Indeed.com","Overview:
We are looking for a
Junior or Intermediate JavaScript Software Development Engineer
to join our talented team to help create libraries used by our customers to build real-time communication applications. The position reports to the Manager of the Kandy Developer Experience team and is responsible for developing and designing new features for our WebRTC libraries. You will need strong technical skills in modern JavaScript development and a keen understanding of how other developers build applications. You will work with a team of other talented engineers to help shape the design, architecture as well as implementation of our JavaScript libraries. You will also collaborate with other internal teams using these libraries as well as help customers be successful at building applications running on the Kandy platform.
About the job:
At AVCTechnologies/Kandy, our mission is to connect humans faster and easier through rapid service creation and abstracting the RTC complexity underneath. To do this you will need to work with various Product Development teams, System and Solution Architects, Product Management, Operations and Customer Support in a collaborative team environment to service a fast paced and evolving market and set of customers.
Successful candidates will need to have a strong background in modern JavaScript application development as well strong general experience with other technologies. Since the team builds libraries, we require from you to have a strong capacity in understanding business logic algorithms including finite state machines, asynchronous event programming, and the desire to learn telecommunication technologies such as WebRTC.
The ability to empathize with other developers and understand their desires and behaviours pertaining to using JavaScript libraries is also vital.
We expect you to be able to shepherd complex feature sets with minimal supervision, advise less experienced team members on best practices, provide thorough code reviews and help drive completion of team objectives. It is also important that you have experience and a track record of delivering high quality software and help drive others to do so as well.
About the team:
We are the Kandy SDK team and we build libraries available for our customers to build Multimedia Real-time applications.
We are a team of highly skilled developers that love to live on the edge of technology.
We apply the latest software development practices using the most modern tools in an agile way.
We care deeply about the user experience of our customers and take time in crafting our APIs for the users first.
We love open-source. We apply the trends, lessons and best practices learned in the developer community.
We test our code with automated testing, both unit testing and end-to-end.
We encourage functional, modular programming for easy testability and reproducibility.
We work hard, but also like to have fun by playing Ping-Pong or Smash Bros. at lunch time.
Some of the technologies we use:
Modern JavaScript (ESNext)
Modern C++ (C++14, C++17)
WebRTC
Redux, Redux-Saga, lodash FP.
Jest and Tape for testing.
Slack, Github, Jenkins, JIRA, Artifactory.
Docker, Docker-Compose, Vagrant.
All members of the team have the latest MacBook Pro with a dual monitor setup.
All members of the team choose their preferred development environment tools.
Responsibilities:
Learn to bridge the gap between the Web development and Telecommunication worlds.
Implements complex WebRTC and messaging features in the Kandy SDK libraries.
Helps create tutorials and documentation for new features.
Join the team to help with the scoping, estimation and planning activities of future tasks.
Effectively prioritizes and execute tasks in a very dynamic, fast paced environment.
Delivers quality software in an agile continuous integration fashion.
Continuous learning through training, conferences and following the community trends.
Other responsibilities as assigned.
This employer will not sponsor applicants with work visas.
Qualifications:
1+ years of professional development experience in an enterprise environment (including Co-op experience).
Strong understanding of modern JavaScript (ESNext) and modern patterns such as ES Modules, reactive and functional programming.
Experience building JavaScript web applications using modern frameworks such as React, Angular, Vue, etc...
Experience using JavaScript build tools such as Webpack, Rollup, Babel, npm scripts, etc...
Familiar with the NPM ecosystem and best practices for publishing packages.
Strong capability at business logic programming using patterns such as finite state machines, middlewares, dependency injection and other design patterns.
Other Requirements:
Strong ability to resolve problems.
Excellent communication skills.
Able to communicate with customers effectively on technical issues.
Demonstrated personal traits: Proactive, initiator, 'do-it-yourself'.
Quick learner and demonstrate a desire to learn continuously to take on new challenges.
Experience in agile practices including code reviews, pull request flows as well as small and iterative contributions.
EEO Statement
AVCT is an equal opportunity employer, and all qualified applicants will receive consideration for employment without regard to race, color, religion, sex, national origin, disability status, protected veteran status, sexual orientation or any other characteristic protected by law."
"Azure Cloud Engineer - Toronto, ON - Indeed.com","Azure Cloud Engineer
Help us boldly shape retail in Canada
Canadian Tire Corporation’s (CTC) rich heritage of serving Canadians from coast-to-coast dates back to 1922. Our vision is to become the #1 retail brand in Canada and we are focused on innovating and making important investments in our business, especially when it comes to our people. To reach our goal, we need the best talent to help us evolve and drive change across the business – and boldly help shape Canada’s retail industry. As we strive to be at the forefront of a complex and vastly changing retail industry, it is an exciting time to join the Canadian Tire family of companies.
Our Technology team plays a critical role in enabling IT solutions for our businesses to make data driven decision. We have designed and built cloud-based machine-learning and analytics capability platforms on Azure to onboard multiple business teams.
Cloud DevOps Architect owns the end to end solution. Working in an agile team, you will leverage your cloud and DevOps experience in bringing a concept to life through defining technical requirement, solution design, POC in sandbox, automate production deployment through pipelines and code. You partner closely with architects, security engineers, operations support and will own the solution.
What you’ll do
Build and own the Data science platform solution in Azure.
Understand the business ask and convert it into technical requirements.
Design the solution in collaboration with CTC architects and vendor consultants.
Review the solution with the architecture board and get alignment.
Configure the solution in sandbox and automate infrastructure as code.
Use automation to validate compliance with corporate policies and standards
Create and maintain technical documentation
Contribute to the build of cloud strategies and target reference architectures.
Contribute to the design of new Azure services and incorporate them into existing solution.
Mentor and coach others in cloud and DevOps tools and practices
Communicate timelines, dependencies, constraints, and progress quickly and effectively
Who You Are
We are looking for individuals who are:
Creative and courageous, with the ability to manage in an environment of change and ambiguity
Action oriented, and comfortable taking calculated risks to better serve our customers and business
Outcome focused, critical thinkers with the ability to analyze and visualize, to ensure continuous improvement across our entire business
Have a growth mindset, eager to learn new service and bring them to market
If you're curious, ready to take on new challenges and open to doing things differently to help us evolve rapidly, then this is definitely the place to be.
What You Bring
Degree in Computer Science or Engineering, or equivalent relevant experience
5+ years of technical experience in Azure full-stack implementations
Demonstrated experience in building Machine learning solution in the cloud and MLOps
Experience with ML tools like Databricks, AML, Snowflake, PowerApps, PowerAutomate, ADO.
Azure Certification is essential.
Expert in developing infrastructure as code (Terraform, ARM templates, etc)
Expert networking fundamentals including VNETs, subnetting, NSGs, routing, firewalls, DNS
Experience with container technologies including Docker and Kubernetes
Excellent analytics, problem solving and solutioning skills
About Canadian Tire Corporation
Canadian Tire and its family of companies are boldly shaping retail in Canada and we continue to deliver a positive experience for our customers. As one of the most trusted brands in Canada, our employees take pride in the work we do across the country. It’s more than the iconic triangle that keeps our employees around. From benefits and perks, to learning and development opportunities, to our commitment to Jumpstart – these are some of the many reasons why Canadian Tire Corporation is one of Canada’s Best Managed Companies .
To learn more about this team and the Canadian Tire family of companies follow us on LinkedIn .
#LI-KS1
Canadian Tire is an equal opportunity employer. We are committed to a diverse and inclusive workplace for all. We recognize that our future success depends on the perspectives and contributions of all our employees - their diverse backgrounds, abilities and experiences make our business stronger. If you are contacted for a job opportunity, please advise us of any accommodations needed to ensure fair and equitable access throughout the recruitment and selection process. All accommodation information provided will be treated as confidential and used only for the purpose of providing an accessible candidate experience. Information Technology
Ontario-Toronto
Permanent
Full-time
Job Posting
: Nov 30, 2021, 8:40:16 AM"
"Developer, Machine Learning Engineer, Business Intelligence - Toronto, ON - Indeed.com","Req Id: 339033
At Bell, we do more than build world-class networks, develop innovative services and create original multiplatform media content – we advance how Canadians connect with each other and the world.
If you’re ready to bring game-changing ideas to life and join a community that values, professional growth and employee wellness, we want you on the Bell team.
Bell’s Field Services team is proud to be the face of the Bell brand, performing the best installation and repair services and maintaining Bell’s network for our residential and business customers.
As a Developer, Machine Learning Engineering, you are passionate about developing, delivering and maintaining efficient, repeatable and agile analytics solutions. You are curious to learn new approaches and techniques and keep up with market evolution. You look forward to joining a dynamic team of developers, analysts and data scientists responsible for end-to-end BI/AI/ML solutions for Bell’s field services team.
As a Developer, Machine Learning Engineering on the Bell Field BI Team, you will work closely with internal business primes, business analysts, data scientists, data engineers and software developers to rapidly create and deliver business insights that solve business problems. You will lead the development and deployment of automated ML pipelines and analytics solutions to solve specific business problems. You will gather business requirements and implement automated solutions that bring value to the business. Solutions may include hardware, software, or business processes. They will typically involve the movement, processing, and enrichment of data as it goes through a pipeline.
A key goal will be to bring consistency, reuse, and automation to the development of data pipelines and applications. You will help develop an agile, automated, and accelerated data supply chain that continuously improves and delivers value to the business.
If you love…
- DevOps. We are committed to following modern practices - CI/CD, Infra-As-Code, etc
Automation. You will have plenty of opportunities to automate tedious tasks using modern tools and your ingenuity
Support. You will maintain production system; troubleshoot issues affecting customers and fix outages
Responsibilities:
Automate provisioning and configuration of environments using infrastructure-as-code techniques Assist with APIs for ML model serving.
Participate in the Continuous Integration Continuous Delivery (CICD) cycle Develop preventive measures and build documentation
Develop and help maintain a virtualized / Containerized Infrastructure
Build and maintain the infrastructure and CI/CD pipelines
Contribute to project meeting and report on issue status
Maintain and improve the performance of existing infrastructure
Resolve operational problems in timely fashion, handle escalated issues and follow up on outstanding items promptly
Work with an agile team to develop, test, and maintain Infrastructure and supporting application
…then, you are the perfect fit for our team! We want to get to know you.
We are seeking a candidate that has passion for ML and automation with the following:
Key Technical Competencies:
2+ years of experience with Linux operating systems with different flavors CentOS and Debian
Good knowledge of Windows operating systems
Solid understanding of virtualization solutions (Openshift, Kubernetes, Docker)
Knowledge of security principles is an asset Good expertise with Test Driven Development (Molecule, Jfrog/Xray, Claire, SonarQube)
Good expertise of CI/CD pipelines using Gitlab
Runners and/or Jenkins Knowledge of monitoring software (Prometheus, Alert-Manager)
Deep knowledge of programming, Design Patterns and Software Architecture (Python, flask, bash, .NET) Solid understanding of API driven solutions Solid knowledge in data ingestion and enrichment (Logstach, Elasticsearch, and Kafka)
Key Personal Competencies:
Critical thinker – demonstrated ability to tackle complex problems effectively
Efficient at prioritizing tasks and manage balance between long-term goals and short-term emergencies. Team player – ability to work with a wide range of geographically distributed teammates
Great communicator – ability to communicate effectively at all levels of the organization
Avid learner – continuous learner of all things technical and process
Focus driven – ability to manage stress and pressure in a collaborative environment
Transformational agent – agile and ability to mobilize resources and execute on critical initiatives needed to transform our business Autonomous and self-organized
#EmployeeReferralProgram
#tech
Bilingualism is an asset (English and French); adequate knowledge of French is required for positions in Quebec.
Additional Information:
Position Type:
Management
Job Status:
Regular - Full Time
Job Location:
Canada : Ontario : Toronto
Flexible work profile:
Mobile
Application Deadline:
12/10/2021
Please apply directly online to be considered for this role. Applications through email will not be accepted.
At Bell, we don’t just accept difference - we celebrate it. We’re committed to fostering an inclusive, equitable, and accessible workplace where every team member feels valued, respected, and supported, and has the opportunity to reach their full potential. We welcome and encourage applications from people with disabilities.
Accommodations are available on request for candidates taking part in all aspects of the selection process. For a confidential inquiry, simply email your recruiter directly or recruitment@bell.ca to make arrangements. If you have questions regarding accessible employment at Bell please email our Diversity & Inclusion Team at inclusion@bell.ca.
Created: Canada, ON, Toronto
Bell, one of
Canada's Top 100 Employers."
"Accounting Clerk (Full Time) - Edmonton, AB - Indeed.com","Accounting Clerk (Full Time)
At Fairmont Hotel Macdonald, our financial operations thrive with the commitment of Colleagues who model our values of Respect, Integrity, Teamwork and Empowerment. Apply your passion for numbers as an Accounting Clerk, where your exacting standards will ensure accuracy in support of your team and hotel.
What is in it for you:
Employee benefit card offering discounted rates in Accor worldwide
Learning programs through our Academies
Opportunity to develop your talent and grow within your property and across the world!
Ability to make a difference through our Corporate Social Responsibility activities, like Planet 21
What you will be doing:
Ensuring proper documentation and approvals are obtained for all hotel invoices.
Inputting approved invoices accurately into the accounts payable system for payment.
Ensuring proper and timely payment of vendor invoices according to vendor terms and hotel’s cash availability.
Reconciling daily cash submissions from the various departments in the hotel and consolidating the bank deposits daily.
Ensuring that the cash machine is filled up & properly working so that all cash-handling employees have adequate monetary change throughout their work shifts
Performing house bank audits as required by the Company’s policies and procedures to ensure the safeguarding of all hotel cash.
Must be willing to work on a flexible schedule in order to accomplish all major responsibilities and tasks.
Must have a commitment to follow all local and corporate policies and procedures related to AP.
Verify that all invoices are supported by duly approved purchase orders when required, signed receiving documentation, and/or the approval of authorized management personnel.
Code invoices to the appropriate general ledger account, and record the vendor number.
Verify invoices to check the unit of issue, unit price, quantity, extension, and applicable taxes against the hotel purchase order and receiving advice.
Assist in maintaining an approved up-to-date vendor/supplier database on the accounts payable system.
Assist with the printing and submission of payment orders (wire transfers) with supporting documentation to the Controller and the General Manager for their signatures.
Maintain a close working relationship and communicate with the purchasing/receiving staff.
Assist with the Reconciliation of vendor statements monthly in order to ensure that the account is kept current.
Maintain proper filing order and alphabetical files by vendor containing complete invoices and backup attached to the bank (wire) transfers for efficient access after payment. All filing is to be kept current.
Process all Accounts Payable invoices and manual bank (wire) transfers through the computer system.
Forward all stopped payments (voided transfers) to the Accountant for journalizing.
Check vendor statements as they are received and resolve all discrepancies directly with the vendor.
Prepare manual payments orders (bank transfer or Cash) as required if directed by the Controller or Assistant Controller.
Consolidate and prepare the daily bank deposits in a timely manner
Prepare and maintain Over/Short Report by the cashier on a daily basis and forward to the Accountant and respective Department Heads on weekly basis.
Maintain daily cash over/short log.
Maintain current house bank agreements – all house bank agreements are to be not older than 15 months (if no change in the status of cashiers – a new bank agreement should be issued).
Conduct house bank audits on a regular basis according to established guidelines – minimum one audit per cashier in two months.
Make petty cash disbursements according to established guidelines.
Audit & Count the Cash Machine in the presence of another person (accounting staff and managers) as per policy - on monthly basis - and establish all counts/discrepancies in order to be properly reported to the Accountant.
Assist in cashier training and be available as needed to support cashiers in resolving problems in cash handling procedures
Strictly adhere to the hotels procedures for cash handling, cheque cashing, and petty cash disbursements.
Assisting in the store room stocking product and taking inventory as needed
Any other assigned by Accounting Department Management tasks, when they deem reasonable.
Your experience and skills include:
Experience in Accounting is a must.
Accounting education and previous Audit and/or Front Desk experience an asset.
Computer literacy is required, specifically in Excel, Micros, Opera and AccPac applications.
Strong guest service skills a must.
Excellent communications skills and professional demeanor required.
Physically fit to lift items repeatedly, stand and walk for a long duration of the shift.
Must be legally eligible to work in Canada. The hotel is unable to assist candidates in obtaining work authorization documents
In order to keep our employees and the general public safe from the threat of Covid 19 and the rise of variants in the community, the Hotel has implemented a Covid-19 Vaccination Policy.
Your team and working environment:
Edmonton's ""Chateau on the River"" For more than 100 years, Fairmont Hotel Macdonald has effortlessly delivered timeless luxury in the heart of downtown Edmonton. Nestled upon the North Saskachewan River Valley, the hotel's charm and ever-evolving elegance has earned it the spotlight as one of the city's most sought after locations. A storied past, an unparalleled present, and a future to be reckoned with, Fairmont Hotel Macdonald has set the stage for luxury in the heart of the city. Edmonton's only four-diamond ""Chateau on the River"" offers unparalleled views of North America's largest expance of urban parkland. Boasting dignified style and timeless grace, each of our 198 classically designed guestrooms, including specialty suites, are tastefully adorned with the finest amenities. In 2016, we forever changed the game in luxury was we unveiled a completely re-designed Fairmont Gold and Lounge. Delivering personalized and discreet service, this hotel within a hotel offers an unrivalled experience unlike any other the city has seen, and likely ever will. From seasonally inspired menus to dining experiences that will satisfy any craving, see what our chefs are preparing in our confederation lounge and our award winning restaurant, The Harvest Room.
Our commitment to Diversity & Inclusion:
We are an inclusive company and our ambition is to attract, recruit and promote diverse talent.
Why work for Accor?
We are far more than a worldwide leader. We welcome you as you are and you can find a job and brand that matches your personality. We support you to grow and learn every day, making sure that work brings purpose to your life, so that during your journey with us, you can continue to explore Accor’s limitless possibilities.
By joining Accor, every chapter of your story is yours to write and together we can imagine tomorrow's hospitality. Discover the life that awaits you at Accor, visit https://careers.accor.com/
Do what you love, care for the world, dare to challenge the status quo!
#BELIMITLESS"
