Title,Description
"Staff Software Developer, Machine Learning, Google Cloud AI - Waterloo, ON - Indeed.com","Minimum qualifications:
Bachelor’s degree or equivalent practical experience.
8 years of experience with software development in one or more programming languages (e.g., Java, C/C++, C#, Objective C, Python, JavaScript, or Go).
5 years of experience with machine learning algorithms and tools (e.g., TensorFlow), deep learning, and/or Natural Language Processing.
Preferred qualifications:
Master's degree or PhD in Computer Science or related technical field.
3 years of experience in a technical leadership role.
3 years of experience working in a complex, matrixed organization involving cross-functional, and/or cross-business projects.
Experience with one or more of the following: Natural Language Processing, text understanding, classification, pattern recognition, recommendation systems, targeting systems, ranking systems or similar.
Experience with relevant technologies (e.g., Tensorflow, Flume, machine learning libraries).
Relevant professional experience with applied data analytics and predictive modeling.
About the job
Google's software developers develop the next-generation technologies that change how billions of users connect, explore, and interact with information and one another. Our products need to handle information at massive scale, and extend well beyond web search. We're looking for software developers who bring fresh ideas from all areas, including information retrieval, distributed computing, large-scale system design, networking and data storage, security, artificial intelligence, natural language processing, UI design and mobile; the list goes on and is growing every day. As a software engineer, you will work on a specific project critical to Google’s needs with opportunities to switch teams and projects as you and our fast-paced business grow and evolve. We need our software developers to be versatile, display leadership qualities and be enthusiastic to take on new problems across the full-stack as we continue to push technology forward.
As a part of the Cloud Financial Services, our goal is to build cutting edge cloud-based products for the Financial Services industry that would help the Google Cloud business gain a competitive advantage in the Financial Services Industry. We aim to build disruptive solutions and technologies that would make Google Cloud the destination of choice for banks, hedge funds, and other financial services. We hope to build products that delight users by delivering domain-relevant data platforms, transformational AI, and cloud-computing services. As part of team, you will build high throughput estimated time to launch pipelines, use natural language processing/machine learning (NLP/ML) to build robust fair models and leverage the many aspects of Google Cloud (Security, AI, Databases, Visualization) effectively.
Google Cloud provides organizations with leading infrastructure, platform capabilities and industry solutions. We deliver enterprise-grade cloud solutions that leverage Google’s cutting-edge technology to help companies operate more efficiently and adapt to changing needs, giving customers a foundation for the future. Customers in more than 150 countries turn to Google Cloud as their trusted partner to solve their most critical business problems.
Responsibilities
Act as a thought leader, designing/building next-generation models.
Lead and grow machine learning software developers.
Improve, simplify, productionization, and launch of our cloud based models.
Design, run, and analyze experiments.
Collaborate with other modeling and research teams across Google.
Google is proud to be an equal opportunity workplace and is an affirmative action employer. We are committed to equal employment opportunity regardless of race, color, ancestry, religion, sex, national origin, sexual orientation, age, citizenship, marital status, disability, gender identity or Veteran status. We also consider qualified applicants regardless of criminal histories, consistent with legal requirements. See also Google's EEO Policy and EEO is the Law. If you have a disability or special need that requires accommodation, please let us know by completing our Accommodations for Applicants form."
"Mail Clerk - Toronto, ON - Indeed.com","About JLL –
We’re JLL—a leading professional services and investment management firm specializing in real estate. We have operations in over 80 countries and a workforce of over 91,000 individuals around the world who help real estate owners, occupiers and investors achieve their business ambitions. As a global Fortune 500 company, we also have an inherent responsibility to drive sustainability and corporate social responsibility. That’s why we’re committed to our purpose to shape the future of real estate for a better world. We’re using the most advanced technology to create rewarding opportunities, amazing spaces and sustainable real estate solutions for our clients, our people and our communities.
Our core values of teamwork, ethics and excellence are also fundamental to everything we do and we’re honored to be recognized with awards for our success by organizations both globally and locally.
Creating a diverse and inclusive culture where we all feel welcomed, valued and empowered to achieve our full potential is important to who we are today and where we’re headed in the future. And we know that unique backgrounds, experiences and perspectives help us think bigger, spark innovation and succeed together.
If this job description resonates with you, we encourage you to apply even if you don’t meet all of the requirements below. We’re interested in getting to know you and what you bring to the table!
On site Mail Clerk
RESPONSIBILITIES Mail Clerk
This position is responsible for processing and delivering all mail, courier packages, data and printing reproduction materials to various sites and mail stations on regular schedules, and assist in all mail center functions
Ensure all Canadian custom documentation and Commercial invoices are prepared accurately
Sort mail into pigeonholes of mail racks or into bags, according to address, mailing center, organization, department or other schema; label mail for distribution to campus sites or U.S./Canadian Post Office facilities as needed
Weigh mail on scale, compute postage, stamp mail by hand/postage meter and insert letters, circulars, or pamphlets into envelopes by hand or machine
Maintain records of incoming and outgoing Certified, Registered and Insured Mail
Respond to inquiries regarding postal charges and delivery options as needed
Perform duties of Mail Distributor daily
File Storage – take care for storage boxes, labelling and data.
Manage and order stock for Printer paper, Envelopes and Toners, Manage Toner Returns, and office supplies for various departments at the Site office
Manage and order stock for PPE for the Site office
Supplier Activity – Liaison with Property Management, JLL Suppliers to manage their activities (Mister Coffee, Cintas, Shred-it, Pitney Bowes, Janitorial/ Cleaners, HVAC, Electrician, Furniture etc)
Receive facility related requests from various office departments and action accordingly (Lights out, too hot / too cold, need a new chair, soap empty, toilet plugged, etc)
Process Invoices in Acon for Site activity Action Courier, Purolator, FedEx, Cintas, Mister Coffee
On site facility and furniture maintenance duties as required/requested
Assist with issuing/maintaining business cards for various departments
Monitor the Reception area
Inter-department support and other duties as required
Communication for site - sending out emails to all at site whether it be lost and found, FYI for various happenings throughout the office
Directly support the Facility Manager in executing the needs of managing the assigned portfolio
Maintain client satisfaction with delivery of Facility Management services and support programs to increase customer satisfaction
Support compliance with JLL minimum audit and compliance standards in facility management, financial management and operational policies and procedures
Meet or exceed site Key Performance Indicators (KPI’s); monitor Service Level Agreements (SLA’s) monthly to identify potential challenges and plan corrective actions accordingly
Conduct inspections addressing any deficiencies
Create and follow up on corrective work orders as necessary
Support work order management for in house staff and vendors as necessary
Support facility soft services as needed and directed such as:
meetings preparation, conference room reservations, food services, parking, vending, and badging
Support requests associated with JLL Management and Operations team
Demonstrate strong collaboration and teamwork within the account team, by including driving the development and implementation of IFM best practices and innovations
Manage all duties in compliance to Master Services Agreement and applicable performance measurements
Support the implementation of the EHS management systems
Enforce all Company policies and training requirements regarding safe and efficient operations and work practices
Implement and monitor hazard control and team safety practices, ensure compliance with local codes and regulations and JLL operations standards
Assist in the development and management of operational and capital budgets
Support development of monthly/quarterly variance reporting for operating budgets
Continuously identify cost savings opportunities
Coordinating supplier management program consisting of:
goal setting, performance criteria, and performance review
Supporting contract management for both short and long-term projects for the client
Driving cost savings through sourcing and supplier management activities which are consistent with client goals
What you can expect from us
We succeed together and believe the best inspire the best, so we invest in supporting each other, learning together and celebrating our success.
Our Total Rewards program reflects our commitment to helping you achieve your career ambitions, recognizing your contributions, investing in your well-being and providing competitive benefits and pay.
We can’t wait to see where your ambitions take you at JLL. Apply today!"
"Casino Technician - Carlyle, SK - Indeed.com","Job Type
Part-time
# of Hires Needed
1
Category
Operations
Location
Bear Claw Casino - Carlyle, SK S0C 0R0 CA (Primary)
Requisition #
21.12
Salary Range
$24.35 - $30.45
Closing Date
12/8/2021
Where You Will Succeed
Main Duties
Reporting to the Casino Technical Manager, this position maintains and repairs Casino gaming equipment (technological infrastructure) used in multiple departments, maximizing up-time to provide guests with a positive and exciting entertainment experience. Responsibilities include: Ensuring slot machines are in working order. Working with external agencies regarding technical issues. Carrying out preventative maintenance and repair of Cage bill and coin sorting and counting equipment. Assisting other departments with hardware, printer, and equipment troubleshooting and installation. Maintaining and repairing card, chip, roulette, and progressive equipment. Maintaining clean and tidy work spaces, and keeping an accurate inventory of tools and equipment. Participating in other projects and activities as required, to ensure Casino gaming equipment is operational.
SIGA deems this position as a Safety-Sensitive position, which is therefore subject to Pre-Employment, Post-Incident and Reasonable Cause – drug and alcohol testing. Safety-Sensitive positions are defined as any position in which impaired performance, impaired motor skills, or lack of judgment, could result in a significant incident affecting the health and safety of SIGA employees, patrons and/or contractors.
Conditions of Employment
The minimum age to work in a casino or any area where gaming can be seen is 19 years of age.
You may be required to work in an environment where you will be exposed to the use of tobacco smoke and high noise levels.
As a condition of employment, you will be required to work shift work. This may include days, evenings, graveyard, weekends and statutory holidays. SIGA’s goal is to treat all staff fairly and equitably; therefore, the distribution of the shifts will be fair to all staff.
SIGA deems this position as a Safety-Sensitive position, which is therefore subject to Pre-Access, Post-Incident and Reasonable Cause – drug and alcohol testing.
Qualifications
Education
Successful completion of a one year diploma or certificate in electronics from a recognized institution.
Experience
Experience in a casino slot department would be preferred including working with slot operations and diagnostics. Experience using mechanical and electronic tools as well as other delicate tools such as calipers, dial gauges, tap and die sets.
Core Organizational Competencies
Adapting to Change
Communication
Customer Service
Decision Making
Results Oriented
Working with Others
Once employed with SIGA there are many opportunities for learning, growth and advancement throughout the company. We take great pride in being a preferred employer and aspire to attract the very best and very brightest to become part of our family. We look forward to reviewing your application!
Job Type: Part-time"
"Statistician - Burlington, ON - Indeed.com","Sport Statistician
About us
North Pole Media INC is a small business in ADVERTISING_MARKETING in Burlington, ON. We are challenging and fast-paced, and our goal is to North Pole Hoops is a multi-layered pathway targeted to student athletes starting at 10 years old guiding them all the way to the professional level. As a Canadian basketball media and recruitment organization, our platform scouts, markets and provides exposure through showcases and camps for the student athletes. Our goal is to develop, track progress, and provide suitable opportunities for young student athletes, in helping them get to the next level in the sport. We help them acquire scholarships to continue their education and play basketball at the NCAA or Canadian University level. and to ultimately maximize the potential and continue to grow Canadian basketball. Our scouting service is the only NCAA certified service in Canada.
Our work environment includes:
Safe work environment
Food provided
Apply mathematical or statistical theory and methods to collect, organize, interpret, and summarize numerical data to provide usable information. May specialize in fields such as business statistics, or sports statistics. Includes mathematical and survey statisticians.
Adapt statistical methods to solve specific problems in many fields, such as economics, biology, and engineering.
Analyze and interpret statistical data to identify significant differences in relationships among sources of information.
Design research projects that apply valid scientific techniques and use information obtained from baselines or historical data to structure uncompromised and efficient analyses.
Determine whether statistical methods are appropriate, based on user needs or research questions of interest.
Evaluate sources of information to determine any limitations, in terms of reliability or usability.
Evaluate the statistical methods and procedures used to obtain data to ensure validity, applicability, efficiency, and accuracy.
Identify relationships and trends in data, as well as any factors that could affect the results of research.
Plan data collection methods for specific projects and determine the types and sizes of sample groups to be used.
Present statistical and nonstatistical results, using charts, bullets, and graphs, in meetings or
Contract length: 6 months
Part-time hours: 16 per week
Job Types: Part-time, Internship
Schedule:
8 hour shift
COVID-19 considerations:
Recommended to be double vaccinated.
Experience:
machine learning: 1 year (preferred)
Work remotely:
No"
"Instrumentation Scientist - Edmonton, AB - Indeed.com","Instrumentation Scientist
Coanda Research & Development Corporation is a rapidly growing research and development company specializing in solving the most difficult industrial problems. Our expertise is the application of fundamental scientific principles to tackle complex problems. To tackle such challenges, Coanda develops and leverages a range of advanced methodologies such as physical and computational (CFD) modelling, mathematical and statistical modelling, and custom instrumentation. Our scientific, logical, and comprehensive approach to industrial and engineering challenges often leads to fundamental, lasting solutions for clients and a rewarding place to work for our employees.
A challenging opportunity exists on our Instrumentation Science team at our Edmonton, AB facility. The successful candidate will engage in advanced research and development projects over a wide range of industrial sectors and technologies.
The key responsibilities will include:
· Taking responsibility for the measurement system on new and existing apparatus. These apparatus range from benchtop units measuring a few parameters to warehouse-sized systems with multiple flow loops and motion control axis controlled by a central system.
o Determining the physical quantities that need to be measured in an experimental system to characterize the physics
o Designing the measurement system to collect data on the above. This may include
§ Specification of commercially available instrumentation
§ Adaptation of existing instrumentation for non-standard applications
§ Development of new instrumentation from scratch
o Installing the measurement system
§ Pre-assembly and testing of instrumentation
§ Installing instrumentation on the apparatus
§ Wiring instrumentation back to the data acquisition / control cabinet
§ Assembly and installation of the data acquisition / control cabinet
o Commissioning the measurement system
§ Calibration
§ Troubleshooting
· Writing data analysis packages that allow non-expert users to extract relevant information from complex datasets
· Learning the fundamentals of how each instrument works to determine its utility in new applications and correctly interpret data
· Writing report content and memos related to the design and execution of measurement and control schemes.
· Specifying, procuring, calibrating, commissioning, and maintaining:
o Data acquisition systems
o Distributed wiring and control systems
o Commercial instrumentation
o Analytical equipment
o Process equipment such as pumps, compressors, valves, motors, drives, etc.
· Troubleshooting:
o Circuit board level debugging
o Process and analytical instrumentation diagnosis and repair
o Electrical noise and grounding issues between AC power, variable frequency drives and other sources, and distributed data acquisition systems
· Design, fabrication, and assembly of custom components, circuits, housings and enclosures, etc.
· Working closely with project managers and other research scientists to execute projects accurately and on time.
· Compiling and maintaining well-organized data reporting & documentation: lab books, data tables, circuit diagrams, photographs, etc.
· Data collection, sample analysis, and general laboratory support and assistance
· Contributions in at least one other area or with another team at Coanda, which may be one of:
o Working with our mathematical modeling or data science team on algorithm development and other advanced data science methods and analysis.
o Project management.
o Certified electrician.
o PLC/HMI programming.
o Software development.
o Identifying a need and making it happen.
Required skills and experience:
· Eagerness to learn new skills
· Critical thinker
· Sound understanding of analog and digital electronics systems and wiring techniques
· Experience with troubleshooting noise and grounding problems in data acquisition systems
· Experience troubleshooting and repairing instrumentation
· Operation and maintenance of sensitive lab equipment
· Hands-on experience with mechanical systems, process equipment, and fabrication (shop experience)
· Working safely in a lab & industrial environment
· Attention to detail and strong organization skills
· Strong data analysis experience using Excel and Python/Matlab (or similar language)
· Demonstrated leadership, ability to work in a team, and attention to detail (could be in a volunteer capacity)
Additional (preferred) skills and experience:
· Higher-level software coding (object oriented programming, GUIs)
· Data science and/or mathematical modelling
· Machine learning
· PCB design and rework (surface mount and through hole desoldering, cutting and patching traces on boards)
· Use of microcontrollers and embedded electronics (Arduino, Raspberry Pi, PLCs)
· Programming and commissioning of Siemens motor controllers/drives
· Experiments using ionising radiation or radioactive tracers
· Presenting talks/posters at conferences/meetings
· Publications in peer-reviewed journals
· Photography, videography, lighting, and camera setup
· Mechanical maintenance (ex automotive repair)
· Fabrication (machining, welding, etc.) and maintenance of such equipment
· Teaching, instruction, or curriculum development
Qualification requirements:
· Master’s, Doctorate or commensurate experience specializing in physics, measurement science, engineering, experimental hard-science, or equivalent
· 3+ yrs research experience with instrumentation, electronics and lab techniques in a scientific, academic, or industrial environment
· Must be eligible to work in Canada
· Excellent written and communication skills
Benefits available to our employees:
· RRSP matching
· Health spending account
· Dental, vision and extended health coverage
· Travel coverage
· Short- and long-term disability coverage
· Life Insurance and AD&D
· Flexible work hours
· Paid time off for sick days and medical reasons
This is an on-site job at Coanda’s Edmonton; however some travel may be required to our Burnaby facility to support projects on an as-needed, but infrequent basis. Participating in field projects at customer’s facilities is also a possibility for this position.
Coanda is committed to creating a diverse environment and is proud to be an Equal Opportunity Employer. We invite resumes from all interested parties including women, Indigenous persons, persons with disabilities, and members of visible minorities.
We thank all those that apply; however, only those selected for an interview will be contacted.
Job Types: Full-time, Permanent
Benefits:
Casual dress
Dental care
Disability insurance
Extended health care
Flexible schedule
Life insurance
On-site parking
Paid time off
RRSP match
Vision care
Schedule:
8 hour shift
Monday to Friday
Work remotely:
No"
