Title,Description
"Extruder Operator - Whitby, ON - Indeed.com","Extruder Operator
Whitby
Ontario
8787BR
Job Description and Requirements
EXTRUDER OPERATOR
TC Transcontinental is a leader in flexible packaging in North America, and Canada’s largest printer. The Corporation is also the leading Canadian French-language educational publishing group. For over 40 years, TC Transcontinental’s story has been one of innovation and transformation to meet our customers’ evolving needs. Our strong family values, entrepreneurial spirit and long-term vision have always been at the heart of our success. With our 3 business segments in Packaging, Print and Media, we continue to optimize, transform and grow while making impressions that count!
TC Transcontinental Packaging brings a distinctive blend of science, technology, and art together to create flexible packaging that preserves our customers' products and accentuates their brands on the store shelf. The Packaging sector has over 4,000 employees and 29 production facilities worldwide. We specialize in extrusion, lamination, flexographic printing and converting of plastic and paper products. You will join a high-performing team that is passionate about creating the perfect package, no matter what industry.
The
Extruder operator
will be responsible for the operation and routine maintenance of our extrusion equipment. Duties include ensuring work order specifications, all materials are available to run and all quality check requirements including any hazard assessment critical control points/safe quality food procedures are followed.
This position is part of a line of progression which requires employees to move into higher skilled/paid positions based on developing their skills. Assisting and learning from the senior operators at every opportunity will support new hires in becoming fully skilled operators.
This position will follow a continuous operation schedule working 12 hour rotating shifts (5:30am-5:30pm/5:30pm-5:30am). Four (4) week Shift Example: DDOONNN-OODDOOO-NNOODDD-OONNOOO (Days (“D”), Nights (“N”), Off (“O”).
What you will do
Support and contribute to a healthy and safe work environment by following all workplace regulations, policies, and initiatives including all first aid injuries, accidents and workplace hazards;
Responsible for producing a quality product while maintaining production performance;
Comfortable working with computers;
Assist in troubleshooting minor machine problems when equipment is down or not performing to standard;
Constantly monitor quality and waste for all orders being produced;
Continually learn the responsibilities of the various positions to advance in the line of progression;
Physical demands include lifting up to 40 pounds, walking/standing for long periods of time;
What you have to offer
Desire to fulfill TC Transcontinental Values in all interactions; Teamwork, Respect, Innovation & Performance;
Manufacturing experience is required and experience in blown film or flexible packaging preferred;
Highly motivated with the ability to work with minimal supervision and handle a wide variety of responsibilities in a busy and sometimes hot environment;
Must be able to work twelve (12) hour rotating continental shifts and every second weekend;
Must have own transportation as transit does not operate in area before 6:00am;
Will be required to complete a criminal background check;
What we have to offer
Opportunity to be part of a dynamic and highly motivating work environment where you can develop your potential and launch an exciting career;
Employee perks include an excellent benefit and pension plan, free coffee, subsidized cafeteria;
Social events include golf, baseball & hockey tournaments, annual BBQ’s and Children’s Christmas Party;
Weekly pay and the opportunity for overtime &double time is available;
Starting Rate
$19.83
Top Rate
$26.98/hour;
Learn more about us
https://tctranscontinental.com/en-ca
https://www.facebook.com/tc.transcontinental/
https://www.linkedin.com/company-beta/7331
https://www.youtube.com/user/1Transcontinental
Sector
TC Transcontinental Packaging
Job status
Regular
Full/Part-Time
Full-time
Job Function
Manufacturing"
"Instrumentation Controls Technician - Victoria, BC - Indeed.com","A willingness and ability to work any recognized shift, including weekends, is expected. From time to time, hours of work may be adjusted to suit operational needs.
Job Summary
As stewards of the campus, Facilities Management fosters and enriches an inviting and functional environment that welcomes and supports all who come here. Facilities Management clients include faculty, staff and students. As part of Facilities Management the Instrument & Controls Shop reflects high service delivery standards and requirements. The team works together to ensure effective, efficient and safe performance for the operation, maintenance and repair of building systems on campus.
Under general supervision, the Instrumentation & Controls Technician (I&CT) will provide journeyperson or technician level skills in the trade as defined by the Industrial Training Authority of BC (ITA), BC Safety Authority and/or recognized licensing or training institutions.). Technician will install, repair, maintain, replace, calibrate, program, and service all process monitoring and/or control instruments including indicators, recorders, control loops and computers. Control mediums such as pneumatics, hydraulic, electronic, electrical or maniacal shall be included in the scope of work.
Regulated work shall be performed only by incumbents holding required qualifications. Incumbent will perform related duties of similar scope and complexity in collaboration or independently within a multidisciplinary shop and full service facilities department which provides such services as plant and facilities engineering maintenance services. The incumbent will also assist in emergent situations, as reasonably declared by the employer, within the physical and skill capacity of the individual.
Shall conform to all best practices in relation to UVic, regulated and industry standards of work and behaviors, including compliance to Worksafe BC regulations.
Job Requirements
Skills:
Ability to use initiative and varied skills in diagnosing and effecting repairs.
Ability to carry out an effective work schedule, under general supervision and utilize materials and equipment for maximum benefit.
Ability to plan and organize work efficiently.
Ability to maintain cooperative working relationships with faculty, staff and students.
Ability to operate and maintain control systems.
Literate in the use of personal computers and the MS office suite.
Ability to use resources and supplies in an efficient and cost effective manner.
Excellent communication skills both written and oral.
Ability to use hand and power tools effectively (both fixed and portable) i.e. tools associated with mechanical trades including multi meters and other typical diagnostic equipment.
Competency in soldering, brazing, tack and cutting (with torch or electric).
As a staff member, this role should demonstrate UVic's Core Competencies which include Personal Effectiveness, Commitment to Quality, Navigating Change, Communication, Building Equitable Relationships, Teamwork, Service Focus, and University Community. These competencies represent the skills, knowledge and behaviours required to advance the initiatives of the unit/department and the university.
Specialized Knowledge/Education:
Completion of an approved apprenticeship or formal training program acceptable to employer.
Instrumentation & Controls Technician (Mechanic) TQ.
Limited Electrical Work TQ. (i.e. Heating, Low Energy or class C Endorsement)
Extensive Direct Digital Controls (DDC) experience.
Extensive pneumatic control experience.
Programmable Logic Controls (PLC) experience.
Extensive institutional HVAC experience or equivalent.
For All Crafts:
BC or IP Trade or Certificate of Qualification.
Valid British Columbia driver's license.
Good physical health, sufficient strength, stamina and coordination to perform a variety of routine heavy manual and machine operation tasks continuously.
Experience:
5 years at the journey person/technician level in applicable trade preferably in an institutional environment.
Additional Requirements:
Willingness and ability to work any recognized shift including weekends.
May be required to assist with departmental response to emergent and safety related concerns.
Equity and Diversity Statement
UVic is committed to upholding the values of equity, diversity, and inclusion in our living, learning and work environments. In pursuit of our values, we seek members who will work respectfully and constructively with differences and across levels of power. We actively encourage applications from members of groups experiencing barriers to equity.
Read our full equity statement here: www.uvic.ca/equitystatement.
Accessibility Statement
Persons with disabilities who anticipate needing accommodations for any part of the application and hiring process may contact: uviccareers@uvic.ca Any personal information provided will be maintained in confidence.
COVID 19 On-Campus Requirements
The University of Victoria requires all students, staff and faculty coming to campus to declare their COVID-19 vaccination status. Your declaration is confidential and will be securely stored. If you declare that you are not fully vaccinated or choose not to disclose your vaccination status, you must participate in weekly rapid testing."
"Supervisor, Garage - Fort Saskatchewan, AB - Indeed.com","Company Overview
Sherritt International is one of the world’s largest producers of nickel from lateritic sources with operations in Canada and Cuba. We pride ourselves on being a leading low-cost producer that generates sustainable prosperity for our employees, investors and the communities in which we operate. We are also the largest independent energy producer in Cuba, with extensive oil and power operations across the island.
Across all of Sherritt’s operations, safety is our top priority and we are committed to building a diverse and inclusive culture. Sherritt is proud to be an equal opportunity employer where all applicants will be considered for employment without attention to race, color, religion, sex, sexual orientation, gender identity, family/marital status, national origin or disability status. We believe our employees should feel comfortable bringing their whole self to work where everyone is welcomed as they are.
Position Summary
Reporting to the Manager, Maintenance Central Shop & Controls, the Supervisor, Garage is accountable for maintaining the site fleet comprised of as part of the overall alignment to the Fleet Management life cycle under the Asset Management department at the Fort Saskatchewan site.
Accountabilities
Direct and coordinate the activities of the workers engaged with the repairing and servicing of heavy & light equipment
Provide oversight and direction to ensure employees and contractors are performing tasks safely and accurately
Report, investigate and document all safety incidents and injuries appropriately
Maintains focus on daily and weekly maintenance activities to ensure compliance to department schedule
Provides Safety leadership with daily Info center meetings, daily toolbox talks and monthly safety meetings.
Ensure compliance to FLHA, JHA and PPE requirements for work in the garage and in onsite operating areas
Provides resources, tooling and direction as needed to ensure workforce can perform their tasks safely and efficiently
Provide employees and contractors access to SOP’s and OEM information
Develops and maintains communication with appropriate Operations personnel
Manage all repairs and maintenance activities through EAM work order system
Utilize scheduled oil sampling to monitor machine health
Work with Reliability and Long Range Planning to capture all warranty opportunities
Qualifications and Skills
Professional Certification Degree/Diploma/Trade Certification would be considered an asset
Minimum 5+ years related experience and/or training equivalent combination of education and experience in energy, minerals or chemical production industry
Proficient with EAM operating system
Highly skilled/proficient in technical writing requiring minimal assistance
Experience with regulators, industry standards and other external stakeholders
Exemplary organizational skills with the ability to multitask
Strong communication skills (written and verbal)
Experience managing a unionized workforce
Ability to foster an inclusive, harassment- free work environment
What Sherritt can Offer You
Competitive wage with comprehensive benefits and retirement savings programs that holistically support employee well-being
Generous paid time off to support and empower employee work/life balance
Ongoing learning and professional development opportunities within a diverse, inclusive and dynamic work environment
Application Deadline:
The job posting will remain open until qualified candidates are selected. We thank all candidates for their application.
Only qualified candidates will be contacted directly and engaged in the interview process.
3v3c1mWmT3
Job Type: Full-time"
"Deep Learning Software Engineer - Toronto, ON - Indeed.com","Deep Learning
Software
Engineer
Based in Montreal and Toronto, Deeplite is an AI software company dedicated to enabling AI for everyday life. Deeplite uses AI to automatically make other AI models faster, smaller and more energy efficient creating highly compact, high-performance deep neural networks for deployment on edge devices such as cameras, sensors, drones, phones and vehicles. Deeplite was named to the 2020 CB Insights AI100 list of top 100 privately held AI companies and has been featured by Gartner, Forbes, and ARM AI as a premier Edge AI innovator.
At Deeplite, we are tackling inference optimization of deep neural networks, making them faster and energy-efficient from cloud to edge computing. Our solution leverages state-of-the-art technology from elite universities to make deep neural networks applicable for any device, and our team works hard on the iterative evolution of the science behind deep neural networks to directly improve daily life.
Our team is growing and we’re looking to hire a
Deep Learning
Software
Engineer
.
Here’s what you’ll be doing:
Deeplite’s revolutionary platform “Neutrino” is being used and/or evaluated by many customers, including top consumer and automotive OEMs, semiconductor companies and computer vision pioneers, globally. As a member of the customer success team, you will be the bridge between our product team and our customers to enable them to optimize and run their Artificial Intelligence (AI) solutions on eco-friendly, small footprint devices for everyday use.
In this role, you will act as an external champion of our platform and work closely with our customers to solve issues and/or educate them to speed up their projects. You will also get an opportunity to work on development of faster & smaller models for small footprint devices.
Here’s what we need you to bring to the table:
Undergraduate in Computer Science or related field (master's degree is a plus).
More than 2 years' experience with the following skills
Hands on experience with Deep Learning frameworks like PyTorch, TensorFlow.
Proficiency in programming languages like Python and C/C++
Fundamentals of deep learning (CNN)
Experience with runtime environments (OpenVINO, ONNX runtime, TVM etc.) would be a huge plus.
Experience with deep learning model compression, speedup related project is a huge plus
Experience building systems based on machine learning and/or deep learning (Experience with embedded boards is a plus)
Customer facing skills.
2 years of industry experience working with clients for technical collaboration.
Willingness to work on multiple projects concurrently.
What we offer:
Strive in a highly innovative and collaborative environment.
Opportunity to advance state-of-the-art software in the fields of DNN model compression, AutoML, Neural Architecture Search (NAS) and more!
Have a major impact – what you build will translate directly into the customer’s needs.
Open and inclusive culture.
About Deeplite:
Deeplite, named to the 2020 CB Insights AI100 List of Most Innovative Artificial Intelligence Startups, is devoted to making fundamental advancements in accessible and efficient deep learning. Our solution helps deep learning engineers and experts automatically create faster, smaller and more energy-efficient deep neural networks. Industry leaders in computer vision, augmented reality and autonomous driving use our technology to unlock new possibilities for deep learning in the real world. At Deeplite, our vision is to create AI for everyday life.
Deeplite is an equal opportunity employer. We foster an inclusive workplace without regard to race, color, religion, sex, sexual orientation, national origin or nationality, age, disability, gender identity or expression, marital status, veteran status. Should you require special accommodation at any point during our selection process, please contact our hiring team at
careers@deeplite.ai
.
What can I expect when I submit my application?
Although we’d love to be able to speak with everyone that applies, only those selected to move forward in our selection process will be contacted by our hiring team within 5 business days."
"Recruit - Square One - Mississauga, ON - Indeed.com","Earls Kitchen + Bar
Some 35 years ago, Leroy “Bus” Earl Fuller and his son Stanley Earl Fuller had a simple idea: create a laid-back burger and beer joint. When the restaurant started there was no question what it would be called, it had to be Earls. The Edmonton Alberta restaurant quickly took off because, well, who says no to burgers and beer? Since then, much has changed. Yet Earls is still a family-owned business filled with people who are genuinely passionate about great food and drinks served in an inviting environment.
Today, Earls is based in Vancouver, British Columbia and has 67 locations across North America ranging from our west-coast hometown to Miami, Florida. With 6,500 employees, Earls remains committed to offering guests high-quality globally inspired food with great service in an authentic atmosphere.
The Dishwasher
The Dishwasher is the cog in the kitchen-machine that keeps things moving. Dishwashers help ensure that the line is well stocked with all the tools the kitchen needs and all the equipment guests require to enjoy their meal. It’s a role for those interested in starting their career in the restaurant industry; our President even started his career with Earls as a Dishwasher - so opportunities are truly endless.
How we elevate YOUR game:
Joining Earls comes with perks to support you in your personal and professional journey.
Teamwork: experience what being a part of the Earls family feels like. Be inspired by your leaders, be encouraged and cheered on by your teammates to live a big life, and be supported in your whole life working while you work with us.
Community: contribute to and connect with your local community by participating in meaningful events that make a difference.
Learning + Development: take on leadership development programs and goal setting to create big possibilities for your career and life. Develop within the company; be mentored and grown as a leader from the minute you’re hired. Check out our Leadership Log and get a taste of what’s in store for you.
Our ultimate goal is that you leave here with tools in your pocket to live a life you’re on fire for; whether you stay with the company for 5 weeks or 5 (or more!) years.
As a Dishwasher, you’ll:
Be a key contributor in the restaurant’s ability to deliver quality and engaging experiences for each guest.
Prioritize and process requests for clean tools and equipment, executing on flawless operations.
Prevent machinery downtime with proactive maintenance efforts and ongoing attention to working quality of all tools and equipment.
Be a business owner every shift you work, taking responsibility and accountability for the safety and cleanliness of your area, and quality and efficiency of your work.
What you bring to the team:
The belief that people are the source of extraordinary experiences, and the desire to contribute to something bigger than yourself, every day
A willingness to learn and an openness to feedback, coaching and mentorship
The ability to legally work in Canada (as a citizen, resident or holding other current and valid work permit)
How to apply:
Complete your online application through earlswantsyou.com. Due to loads of keen and skilled applicants ready to take their career to the next level with us, we will only be responding to candidates who we would like to move forward to the interview stage.
We can’t wait to hear from you!"
"Junior Software Developer - Vancouver, BC - Indeed.com","About:
Profitable Software Inc. is a Vancouver based start-up working in stealth mode. Our team is developing proprietary technology using machine learning and artificial intelligence to predict international economic trends.
Overview:
We are looking for creative, motivated, and talented developers to join us in building something from the ground up. This is a unique opportunity to work with a highly technology-focused start-up. You will be working hands-on to design and build essential features and gain in-depth knowledge in machine learning. We are a small and close-knit company, allowing you to interact closely and receive support from the whole team on a daily basis.
Job Title:
Junior Software Developer
Responsibilities:
- Write high-quality code to support the functionality of the project framework
- Directly involved in building system components from ground up
- Develop and test new features
- Proactively communicate on new ideas, suggestions, and bottlenecks with the entire team
- Support ad-hoc tasks and projects as required
Skills and Qualifications:
- 1 year+ experience working in related field
- Experience working under Linux environments
- Knowledge of networking protocol such as TCP and UDP
- Passion for software programming
- Responsible and patient in exploring and writing new code
- Great interpersonal skills and able to work collaboratively within a team environment
- Ability to self-organize and work independently
- Intellectual curiosity and ability to learn quickly
- Interest in world economics and public markets
Tech Stack:
- Python
- C++
- SQL
- Node.js
Other Information:
- This is currently a full-time remote position, subject to change
- Must be a Canadian citizen or Permanent Resident
- Preferably based in Vancouver
- Cover letter required
Job Types: Full-time, Contract, Permanent
Salary: $38,499.00-$70,459.00 per year
Schedule:
Monday to Friday
Ability to commute/relocate:
Vancouver, BC: reliably commute or plan to relocate before starting work (required)
Experience:
Software Development: 1 year (preferred)
Work remotely:
Temporarily due to COVID-19"
