Title,Description
"CLOUD SOFTWARE ENGINEER, MACHINE LEARNING (SOPHI) - Toronto, ON - Indeed.com","CLOUD SOFTWARE ENGINEER, MACHINE LEARNING (SOPHI)
POSITION CODE:
2021-099/119
LOCATION:
The Globe and Mail, Toronto (Temporarily Remote)
SALARY:
Commensurate with qualifications and experience
POSITION OVERVIEW:
Sophi.io is an award-winning team that builds enterprise SaaS solutions to drive business transformation through its suite of AI tools focusing on site automation, paywalls and predictive analytics for the media industry.
Machine Learning is a central function of the business using the most cutting-edge ML technology to solve large-scale business problems. Our team is continuing to grow, and we are looking for engineers with experience developing ML pipelines and infrastructure in AWS cloud.
In this role, you will use massive amounts of clickstream, image, video, and text data to create insight and solutions that are scalable and with high performance.
RESPONSIBILITIES:
Collaborate with data engineers to build a robust, high-scalable data pipeline and API to power our machine learning products.
Take ownership of developing high-quality products from concept to production, including requirements gathering, feature creation, testing, documentation, deployment, A/B testing evaluation and post production support.
Collaborate with devops to create AWS Infrastructure as code for all your applications.
Collaborate with data scientists to build products around ML models, reconcile the process and modularize work
Following AWS well-architected framework to bring and apply industry engineering best practices
Drive innovation through iteration.
TECHNICAL QUALIFICATIONS:
Degree in Computer Science or Software Engineering or any relevant background required
3+years of experience in software development or data engineering for an intermediate level
5+ years of experience for a senior level
Proficient and hands on with at least one programming language, prefer Python/Java
Experience in Event driven architecture using AWS Lambda, ECS/Fargate, API Gateway, Kinesis, DynamoDB, EventBridge, S3, SQS, SNS
Familiar with Twelve-Factor App methodology ( https://en.wikipedia.org/wiki/Twelve-Factor_App_methodology )
Understanding of IAM policies and roles
Familiar with cloud architecture and security
Familiar with Codepipleline and Codebuild
Familiar with test driven development methodologies
Nice to have: Familiar with continuous integration and continuous delivery
Nice to have: Infrastructure as code experience, such as Terraform or CloudFormation or CDK
GENERAL QUALIFICATIONS:
High level of personal accountability, self-motivated
Strong communication, verbal and written skills
Quick learner, solution-oriented, able to implement prototypes with new tools quickly
Comfortable taking on new challenges with a high willingness to learn
Creative and out-of-the-box thinking to come up with alternative solutions to meet the business requirements
VACCINATION POLICY:
All offers of employment with The Globe and Mail are conditional upon the candidate being Fully Vaccinated. To be Fully Vaccinated is defined as someone who has received the full series of a vaccine or a combination of vaccines accepted by the Government of Canada (currently Pfizer, Moderna, AstraZeneca, Janssen) and has received the last dose at least 14 days prior to their start date. To prove they are Fully Vaccinated, all new hires will be required to provide evidence by emailing a copy of their vaccine dose administration receipt(s) to Human Resources prior to their start date. Those seeking exemption based on one or more of the protected grounds in the Human Rights Code will need to provide their request for accommodation to Human Resources for approval. If the accommodation request is not approved and the candidate is not Fully Vaccinated, any offer of employment will be revoked.
THE GLOBE AND MAIL IS DEDICATED TO DIVERSITY AND INCLUSION IN THE WORKPLACE
The Globe and Mail is committed to fostering an inclusive, accessible work environment, where all employees feel valued, respected and supported. We believe this strengthens our business and our journalism. We welcome and encourage applications from individuals from all groups, regardless of race, ethnicity, culture, gender, sexual orientation, religion, socio-economic status, age, and physical ability. As required by the Federal Contractors Program, The Globe also tracks the proportion of staff in the four Employment Equity categories (Women, Aboriginal Peoples, Persons with Disabilities, and Members of Visible Minorities) to ensure we are reflecting the areas in which we work.
The Globe and Mail offers accommodation for applicants with disabilities as part of its recruitment process. If you are contacted to arrange for an interview, please advise us if you require an accommodation."
"Research Scientist Intern, Human-Computer Interaction (PhD) | Chercheur stagiaire, Interaction homme-machine (niveau doctoral) - Toronto, ON - Indeed.com","At Reality Labs, our goal is to invent the user interface technologies that will drive the next generation of augmented-reality experiences. Our aim is to unleash human potential by erasing the bottlenecks between intent and action. As a Research Intern, you will focus on developing novel interactions and interfaces for augmented reality glasses and wearable devices.We are looking for PhD candidates to work alongside experts researchers, designers, and software engineers. We are open to candidates from a broad scope of relevant backgrounds such as:*Human-computer interaction*Computer science*Software engineering & related engineering fields*Psychology, cognitive science, neuroscience*Design*Game development*Ergonomics & kinesiology *Statistics & machine learningMore specifically, we are looking for candidates with background in one or more of the following areas:Human-computer interaction*Input and interaction techniques*Multi-modal input*Adaptive user interfaces & personalization*Mixed-initiative interfaces*Collaborative interactions and multi-user systems*Gesture input and gesture learningHaptics*Experience design, feedback and guidance*Perception*Haptic hardware prototyping*Wearable hapticsVisual interfaces in AR/VR*3D user interaction & hybrid interfaces*Immersion, presence & agency*Locomotion & navigation*360 environments & videosSoftware engineering*Software architecture and design patterns*Application frameworks*Desktop, mobile and web platform development*Game developmentAccessibility in AR/VR*Assistive pointing techniques and technology*Assistive technologies such as screen readers, mobility aids, or braille interfaces*Fitness technology and/or exergaming*Game BalancingSensors and hardware*Prototyping*Wearables*Eye tracking*Graphics and audioUser-centered machine learning*Predictive modeling*Intent modeling*Computational interaction*Computer visionOur internships are sixteen (16) to twenty four (24) weeks long and we have various start dates throughout the year. This position is based in Toronto, Canada.-Chez Reality Labs, nous voulons inventer les technologies d'interface utilisateur qui seront à l'origine de la prochaine génération d'expériences de réalité augmentée. Nous avons pour but de libérer le potentiel humain en supprimant les goulots d’étranglement entre l’intention et l’action. En tant que chercheur stagiaire, vous vous concentrerez sur le développement de nouvelles interactions et interfaces pour les lunettes de réalité augmentée et les dispositifs portables.Nous recherchons des doctorants pour travailler aux côtés de chercheurs experts, de concepteurs et d’ingénieurs logiciels. Nous sommes ouverts aux doctorants disposant de toutes sortes d'expériences pertinentes en la matière, par exemple :* Interaction homme-machine* Informatique* Ingénierie logicielle et domaines d'ingénierie connexes* Psychologie, sciences cognitives, neurosciences* Conception* Développement de jeux* Ergonomie et kinésiologie * Statistiques et apprentissage automatiquePlus précisément, nous recherchons des doctorants ayant une expérience dans un ou plusieurs des domaines suivants :Interaction homme-machine* Techniques des données et de l'interaction* Programmation multimodale* Interfaces utilisateur adaptatives et personnalisation* Interfaces à initiative mixte* Interactions collaboratives et systèmes multi-utilisateurs* Saisie gestuelle et apprentissage des gestesHaptique* Conception de l'expérience, retour d'information et conseils* Perception* Prototypage de matériel haptique* Haptique portableInterfaces visuelles en RA/RV* Interaction utilisateur 3D et interfaces hybrides* Immersion, présence et agence* Locomotion et navigation* Environnements et vidéos à 360°Ingénierie logicielle* Architecture logicielle et modèles de conception* Cadres d’application* Développement de plateformes de bureau, mobiles et web* Développement de jeuxAccessibilité en RA/RV* Techniques et technologies d’aide au pointage* Technologies d’assistance telles que lecteurs d’écran, aides à la mobilité ou interfaces en braille* Technologie du fitness et/ou exergaming* Calibrage du jeuCapteurs et matériel* Prototypage* Vêtements* Traçage oculaire* Graphiques et audioApprentissage automatique centré sur l’utilisateur* Modélisation prédictive* Modélisation de l’intention* Interaction informatique* Vision par ordinateurNos stages sont d’une durée de seize(16) à vingt-quatre(24) semaines et nous avons plusieurs dates de début tout au long de l’année. Ce poste est basé à Toronto, au Canada.
Plan and execute cutting-edge research to advance human-computer interaction research. | Planifiez et exécutez des recherches de pointe pour faire progresser la recherche sur l’interaction homme-machine.
Collaborate with dynamic teams of engineers, designers and researchers. | Collaborez avec des équipes dynamiques d’ingénieurs, de concepteurs et de chercheurs.
Organize and lead research activities such as designing and building prototypes, experimental design as well as data collection and analysis. | Organisez et dirigez des activités de recherche telles que la conception et la construction de prototypes, la conception expérimentale ainsi que la collecte et l’analyse de données.
Write and publish high quality scientific articles. | Rédigez et publiez des articles scientifiques de haute qualité.
Communicate research activities and findings to collaborators across a variety of disciplines. | Communiquez vos activités de recherche et résultats à vos collaborateurs issus de diverses disciplines.
Currently has, or is in the process of obtaining, a PhD. | Actuellement doctorant.e ou titulaire d'un doctorat.
3+ years of experience with programming languages such as Python, R, C++, C#, Matlab. | Au moins trois ans d’expérience avec des langages de programmation tels que Python, R, C++, C#, Matlab.
1+ years of experience in experimental design of user studies and statistical analysis to interpret results. | Au moins un an d’expérience en conception expérimentale d’études sur les utilisateurs et en analyse statistique pour interpréter les résultats.
Interpersonal skills: cross-group collaboration and cross-culture collaboration. | Compétences interpersonnelles : collaboration transversale et collaboration interculturelle
Must obtain work authorization in the country of employment at the time of hire and maintain ongoing work authorization during employment. | Doit obtenir un permis de travail dans le pays où se trouve l’emploi à la date d’embauche et maintenir ce permis pendant la durée de l’emploi.
Familiarity with the HCI field. | Familiarité avec le domaine des IHM.
Familiarity with AR/VR technologies and literature. | Bonne connaissance des technologies et de la littérature en matière de réalité augmentée ou virtuelle.
Familiarity with Unity game engine. | Une aisance avec le moteur de jeu Unity.
Proven track record of achieving research results and innovation as demonstrated by minimum 2 patents or first-authored peer-reviewed publications in relevant venues such as ACM CHI, ACM UIST, ACM IMWUT, IEEE ISMAR or IEEE VR. | Une expérience avérée dans l’obtention de résultats de recherche et l’innovation, comme en témoignent au moins deux brevets ou des publications rédigées en tant qu'auteur principal, évaluées par les pairs et parues dans des revues pertinentes comme ACM CHI, ACM UIST, ACM IMWUT, IEEE ISMAR ou IEEE VR.
Intent to return to degree-program after the completion of the internship/co-op. | Intention de retourner au programme d’études après l’achèvement du stage ou du programme coopératif
Facebook's mission is to give people the power to build community and bring the world closer together. Through our family of apps and services, we're building a different kind of company that connects billions of people around the world, gives them ways to share what matters most to them, and helps bring people closer together. Whether we're creating new products or helping a small business expand its reach, people at Facebook are builders at heart. Our global teams are constantly iterating, solving problems, and working together to empower people around the world to build community and connect in meaningful ways. Together, we can help people build stronger communities - we're just getting started."
"Data Scientist (In Office and Remote Options) - London, ON - Indeed.com","Remote work options available.
Voices is the world’s #1 creative services marketplace.
We’ve helped tens of thousands of marketers, producers, instructors, and creative directors at the world’s biggest and most beloved brands find the right talent for their creative projects.
Headquartered in London, Canada, Voices matches clients with voice over, music, audio production, and translation professionals in over 160 countries.
We are looking to add a Data Scientist to our growing data science team to lead exciting machine learning initiatives on our creative services marketplace. You will be involved in projects ranging from job pricing recommendations, JobMatch invitations, and search optimization. This is an exciting opportunity to contribute to platform growth and retention by formulating and developing unique machine learning solutions.
Responsibilities
Manage machine learning projects with high revenue potential from ideation to deployment by envisioning solutions to business problems, collaborating with key stakeholders, and orchestrating effective project execution
Explore datasets and perform descriptive analysis to guide solutions
Synthesize model building datasets through data collection/access, preparation, and modification
Ideate, develop, and assess candidate machine learning models in meeting business objectives
Optimize model performance by assessing algorithms, tuning parameters, and using our in-house model optimization team
Build prediction sets and associated data pipelines to make predictions on live data, working alongside developers to deploy the model
Run model simulations to understand potential impacts on the platform
Perform quality assurance and documentation of deliverables
Skills Required
Ability to formulate, prioritize, and manage machine learning projects
Strong coding skills in Python and SQL
Experience with R, Amazon SageMaker, Tableau, Excel, Heap, and/or Salesforce is an added benefit
Presentation skills demonstrating the ability to tell a data story and communicate technical concepts
Stays current on published state-of-the-art methods, technologies, and applications
Thrives when presented with big, undefined problems; has an ability to structure and build a plan of attack to solve them
Work Experience & Educational Requirements
2-5 years of experience in a data science role
BSc or BA in a related discipline like computer science, engineering, business, math, or statistics
A master’s degree in a related discipline is preferred but not required
Equal Employment Opportunities
Voices values diversity. We're proud to be an equal opportunity employer and consider qualified applicants without regard to race, colour, religion, sex, national origin, ancestry, age, genetic information, sexual orientation, gender identity, marital or family status, veteran status, medical condition or disability.
Accommodation
Voices is committed to providing accommodation for applicants with disabilities; please let us know if you require accommodation during the recruitment process.
Application Process
Interested candidates are encouraged to send their cover letter and resume by completing the online application. By doing so, your resume is guaranteed to be reviewed."
"Machine Learning Engineer - North American Integrated Analytics Team - Toronto, ON - Indeed.com","Machine Learning Engineer - North American Integrated Analytics Team
The North American Integrated Analytics Team is looking for a Machine Learning Engineer for their Toronto or New York office.
In keeping with our global position as an industry leader and innovator, Munich Re is driving transformative change in the life insurance industry through data science.
Location
Toronto , Canada
As a Machine Learning Engineer, you will combine your knowledge of machine learning with your software engineering expertise to build solutions to core challenges in the life insurance industry. You will immerse in real-time business problems to deliver world-class, innovative solutions for our North American operations and clients. We see the use of data and models as instrumental in making it easier for people to buy insurance by reducing cost, and expanding the number of people insured.
Your job
Apply advanced statistical and machine learning techniques to build models for underwriting, pricing, and claims management.
Design, test, build, and maintain the backend infrastructure to manage the machine learning model lifecycle.
Collaborate closely with team members on developing machine learning systems from prototyping to production.
Help us drive innovation by enabling new risk assessment paradigms and distribution models.
Ensure data quality and integrity.
Work with existing data science groups at Munich Re to develop model management best practices.
Your profile
The successful candidate will demonstrate a natural desire to provide exceptional client service through their energy, enthusiasm, and initiative. In addition, we are looking for the following qualifications:
Undergraduate Degree in Computer Science, Engineering, Statistics, or Applied Mathematics, plus 3 years' experience OR Graduate Degree in Computer Science, Engineering, Statistics, or Applied Mathematics, plus 1 year of experience.
Ability to write robust code for deployable services in Python; working knowledge of SQL (familiarity with multiple languages considered an asset).
Experience working through the modeling lifecycle including gathering data, design, recommendations, testing, implementation, communication, monitoring, and retraining.
Experience with cloud computing platforms (e.g., Microsoft Azure, AWS, GCP).
Experience with software engineering best practices including Git, Docker, CI/CD, test driven development, and code review.
Familiarity with big data technologies (e.g., Apache Spark, Airflow, etc.), natural language processing and deep learning frameworks (e.g., TensorFlow, PyTorch) is an asset but not required.
Strong communication skills to explain complex ML systems to business leaders.
Capacity for abstraction and an aptitude for high-level software design.
Thrives in a dynamic environment and can successfully deliver on multiple assignments under tight deadlines.
About us
Munich Re is one of the world’s leading reinsurance companies with approximately 45,000 employees in over 50 locations around the globe. As an industry leader, we provide a unique opportunity to be part of a global success story. We offer our employees a diverse and challenging work environment which champions high performance, professional development, innovation and passion, and rewards top performers with a highly competitive total rewards package.
Apply now! Apply for this Job!
Munich Re Canada is committed to providing a work environment that is inclusive and free of employment barriers and discrimination. Accommodations will be made for qualified applicants with a disability throughout the recruitment process. If you receive a request for an interview and you have a disability which will require an accommodation to support your participation, please consult with Human Resources or contact AODARequestHR@munichre.ca as soon as practical so that suitable accommodations can be arranged."
"Scientist - R&D RNA Biology - Toronto, ON - Indeed.com","About Us
We are a Toronto-based startup company that is building an AI-powered discovery and development platform to significantly expand the universe of medicines available for genetically-defined diseases. Founded in 2015, we bring together a multidisciplinary team of world-leading experts in machine learning, genomics, chemistry, and biology. Together we are on a mission to rapidly discover and develop oligonucleotide drugs for the treatment of patients with severe disorders of the liver, central nervous system, and eye.
About the role
As a Scientist in R&D RNA biology, you will work with our multidisciplinary team of computational biologists, machine learning scientists, software engineers, and wet-lab scientists to identify and interrogate novel DNA and RNA regulatory mechanisms. You will use your molecular biology expertise to design proof-of-concept experiments to help identify how antisense oligonucleotide therapies give rise to their on- and off-target effects. You will collaborate with computational scientists to develop machine learning models of DNA and RNA biology and utilize these models to predict effective antisense oligonucleotides. You are an ambitious and creative molecular biologist with an interest in using your expertise in molecular biology to revolutionize drug development.
What will you do?
Utilize different gene expression assays to screen oligonucleotide compounds for their effect on target RNA and/or protein levels.
Interrogate how oligonucleotides can be used to impact expression regulation at the transcriptional, post-transcriptional, and translational levels using techniques including, but not limited to: reporter based assays, protein/nucleic acid pulldowns, or RNA stability/nascent RNA measurements.
Routine culture/treatments of iPSC derived neurons, hepatocytes, and other in vitro models and cell lines.
What do you bring?
A PhD in the biological sciences with at least 2 years of postgraduate experience, preferably in a biotechnology or pharmaceutical industry setting.
Graduate or postgraduate experience in developing assays to interrogate RNA biology.
Graduate or postgraduate experience with standard techniques in molecular and cell biology including, for example, general cell culture, genetic manipulation of mammalian cells (e.g. CRISPR/Cas9), DNA/RNA/Protein isolation and analysis, cell sorting, ELISAs, RT-qPCR.
Great communication and organization skills and comfort working with limited supervision in a fast-paced and rapidly growing work environment.
Outside-the-box thinking: a creative and innovative mindset.
Nice to have:
Previous experience working with antisense oligonucleotides, iPSCs, neural stem cells, hepatocytes, or immortalized/cancer cell lines.
What we offer?
A highly competitive salary and meaningful equity compensation (ESOPs).
A wide array of company-paid benefits.
Exceptional opportunities for learning and growth working alongside the world’s best team.
An opportunity to work alongside a bright, collegial, highly motivated team working at the intersection of the most exciting areas of science and technology
.
Deep Genomics encourages applications from all backgrounds who seek the opportunity to build the world's leading AI-driven genetic medicine company.
If you have a disability or special need, accommodation is available on request for candidates taking part in all aspects of the selection process."
