Title,Description
Statistical Data Analysts to Programming Leaders – UK – EU – US - CAN - Remote - Canada - Indeed.com,"Site Name:
GSK House, Belgium-Wavre, Canada - Ontario - Mississauga, Home Worker - GBR, Home Worker - NLD, USA - Massachusetts - Waltham, USA - Pennsylvania - Philadelphia, USA - Pennsylvania - Upper Providence
Posted Date:
Aug 19 2021
Once GSK were a traditional SAS programming group, today, we’re a modern, innovative, agile function powered by multilingual coders, data engineers and data scientists who are all conversant in the latest approaches, capabilities and technologies. We’re proud of our adoption of R and our leadership of open-source coding collaborations across the Pharma industry. Beyond this, we’re investing in a new modern data science and analytics platform that will allow us to surface and analyse every kind of clinical and non-clinical data using the latest in programming methodologies and languages.
We have career opportunities across a range of experience levels from junior programmers to industry experienced programmers and leaders to support multiple business areas. Join us to help people do more, feel better, live longer.
What do we do?
GSK is one of the world's foremost pharmaceutical and healthcare companies, with statisticians and programmers working in Research and Development with a global footprint spanning the UK, US, EU, Canada and India. GSK’s speed and success in discovering and developing new medicines, therapies and vaccines is increasingly decided by scientific data and the effectiveness with which it can be captured, interrogated and understood. It’s our job in Statistical Programming to equip our scientific experts with data that is seamlessly curated, analysed and visualised. We support every stage of the path that each potential drug progresses along, from non-clinical research to commercial launch and lifecycle management.
How do we do it?
We are transforming and becoming a modern, innovative, agile function powered by multilingual coders, data engineers and data scientists who are all conversant in the latest approaches, capabilities and technologies. We’re proud of our adoption of R and our leadership of open-source coding collaborations across the Pharma industry.
We are investing in a new statistical computing environment, a multimillion-pound modern data science and analytics platform that will allow us to surface and analyse every kind of clinical and non-clinical data using the latest in programming methodologies and languages (R, Python, SAS). Built-in automations will eliminate heavy manual and repetitive tasks and reduce cycle times from weeks to days. Additional initiatives include exploring machine learning to drive efficiencies for clinical reporting, developing desktop visualisation capabilities and we even have an annual challenge for Programmers who are rewarded for bringing new innovations into the department.
What can we offer you?
The data we deal with is increasingly complex and diverse, demanding a pioneering programming and analytics environment and a workforce who are continuously expanding their technical skills and looking for ways to innovate and experiment. Beyond the satisfaction of varied and interesting work in support of a really worthwhile mission, we will grow and develop you as an individual contributor and a potential leader in the field. And we don’t just invest in your technical competencies and capabilities. Communication, influencing and management skills as well as the ability to work in an agile and collaborative way are also important attributes of outstanding programmers and data specialists. Great results and high performers are rewarded, but also we’re a team with real camaraderie who care about each other and enjoy working together.
Would you like a progressive career at the leading edge of transformation and innovation? Come and join our diverse global team of programmers and data scientists as we unlock the power of automation, analytics and visualisations to accelerate delivery of medicines and vaccines. Patients around the world are counting on us.” GSK is a world leading research-based pharmaceutical company that combines both individual talent and technical resources to support our mission to improve the quality of human life by enabling people to do more, feel better and live longer.
US Hiring Locations:
Collegeville, PA and Waltham, MA
Canada Hiring Locations
: Mississauga
UK Hiring Locations:
Stevenage, GSK House
EU Hiring Locations:
Netherlands, Belgium
Remote Working:
A variety of flexible working arrangements are available
Key Responsibilities
Principal/Lead – To lead and act as SME in your area
Provide technical contribution to complex tasks
Participate/Lead the planning and execution of multiple programming activities to deliver all required outputs
Work as a lead within own discipline to investigate new technology as directed
Act as a subject matter expert within own discipline
Initiate new directions and novel strategies to achieve department goals
Project manage or lead programming activities, including approval of plans under supervision, to achieve technical or business outcomes within own discipline
Contribute to and influence the strategic planning and direction of a project
Project manage and lead programming activities, including approval of plans under supervision, to achieve technical or business outcomes within own discipline
Programmer – to work within a team towards projects and to develop your own career
Automation of data creation, graphs, tables and certain statistical analyses using R scripts
Effectively explains technical concepts to non-technical colleagues
Apply learning from previous activities to result in quicker and more efficient completion of the current task
Share learnings with peers and contributes to internal technical discussions/forums
Active member of external professional/ industry organization
Ensure the collection of programs/outputs and issues are adequately managed for programming activities to achieve business outcomes
Contributes to and influences the strategic planning and direction of a project
When applying for this role, please use the ‘cover letter’ of the online application or your CV to describe how you meet the competencies for this role, as outlined in the job requirements above. The information that you have provided in your cover letter and CV will be used to assess your application.
During the course of your application you will be requested to complete voluntary information which will be used in monitoring the effectiveness of our equality and diversity policies. Your information will be treated as confidential and will not be used in any part of the selection process. If you require a reasonable adjustment to the application / selection process to enable you to demonstrate your ability to perform the job requirements, please contact 0808 234 4391. This will help us to understand any modifications we may need to make to support you throughout our selection process.
Why you?
Basic Qualifications
We are looking for professionals with these required skills to achieve our goals:
BSc (or equivalent) in mathematics, statistics, computer science (or related discipline)
Experience in R, SAS programming, and script/macro code development
Working knowledge of relevant therapeutic area or industry to GSK projects such as oncology or clinical trials
Preferred Qualifications (varies on level applied for)
If you have the following characteristics, it would be a plus:
MSc (or equivalent) in mathematics, statistics, computer science (or related discipline)
Experience with programming language(s)
Experience leading multiple studies
Experience with writing and applying Metadata Specifications/Derivations
Experience with products such as R-Shiny, Python, JMP, SAS/GRAPH, SAS Output Delivery System
Knowledge of GxP, ICH requirements, internal processes and external regulations that govern drug development (where applicable)
Takes responsibility for oversight of others work as assigned by manager
Demonstrated effectiveness in both oral and written communications, able to express ideas and incorporate feedback to produce a completed quality deliverable
Able to explain technical approaches to peers and non-technical colleagues/settings
Deliver presentations with clarity in internal forums and/or external professional industry meetings
Experience with Tidyverse programming
Why GSK?
GSK is a place where outstanding people do amazing things. As a science-led global healthcare company, we exist to help people do more, feel better, live longer. This special purpose – along with our goal of being one of the world’s most innovative, best performing and trusted healthcare companies – helps us attract some of the best and brightest minds in the world.
We take pride in providing access to all and continually focus on our opportunity and obligation to do more to improve inclusion and diversity: for our people inside GSK; in the way we do business; and in the communities where we operate.
We want our company to be a place where diversity of people and thought is valued everywhere and where we’re all able to be ourselves and feel a sense of belonging. An inclusive organization where we all feel valued, engaged and supported, knowing that our work makes an important contribution to our mission. Reinforced by our clear values and expectations, it is part of our DNA. Together we achieve extraordinary things for our patients and consumers, who rely on us each and every day.
LI-GSK
#Programming2021
As a company driven by our values of Patient focus, Transparency, Respect and Integrity, we know inclusion and diversity are essential for us to be able to succeed. We want all our colleagues to thrive at GSK bringing their unique experiences, ensuring they feel good and to keep growing their careers. As a candidate for a role, we want you to feel the same way.
As an Equal Opportunity Employer, we are open to all talent. In the US, we also adhere to Affirmative Action principles. This ensures that all qualified applicants will receive equal consideration for employment without regard to race/ethnicity, colour, national origin, religion, gender, pregnancy, marital status, sexual orientation, gender identity/expression, age, disability, genetic information, military service, covered/protected veteran status or any other federal, state or local protected class*(*US only).
We believe in an agile working culture for all our roles. If flexibility is important to you, we encourage you to explore with our hiring team what the opportunities are.
Please don’t hesitate to contact us if you’d like to discuss any adjustments to our process which might help you demonstrate your strengths and capabilities. You can either call us on 0808 234 4391, or send an email ukdiversity.recruitment@gsk.com
As you apply, we will ask you to share some personal information which is entirely voluntary. We want to have an opportunity to consider a diverse pool of qualified candidates and this information will assist us in meeting that objective and in understanding how well we are doing against our inclusion and diversity ambitions. We would really appreciate it if you could take a few moments to complete it. Rest assured, Hiring Managers do not have access to this information and we will treat your information confidentially.
Important notice to Employment businesses/ Agencies
GSK does not accept referrals from employment businesses and/or employment agencies in respect of the vacancies posted on this site. All employment businesses/agencies are required to contact GSK's commercial and general procurement/human resources department to obtain prior written authorization before referring any candidates to GSK. The obtaining of prior written authorization is a condition precedent to any agreement (verbal or written) between the employment business/ agency and GSK. In the absence of such written authorization being obtained any actions undertaken by the employment business/agency shall be deemed to have been performed without the consent or contractual agreement of GSK. GSK shall therefore not be liable for any fees arising from such actions or any fees arising from any referrals by employment businesses/agencies in respect of the vacancies posted on this site.
Please note that if you are a US Licensed Healthcare Professional or Healthcare Professional as defined by the laws of the state issuing your license, GSK may be required to capture and report expenses GSK incurs, on your behalf, in the event you are afforded an interview for employment. This capture of applicable transfers of value is necessary to ensure GSK’s compliance to all federal and state US Transparency requirements. For more information, please visit GSK’s Transparency Reporting For the Record site."
"CNC Machinist - Kelowna, BC - Indeed.com","At Waterplay and WMI, we’re passionate about play. We believe that bringing play to communities
makes the planet more livable and socially just. With thousands of installations across the world,
we’re excited to be a part of the movement toward a healthier, happier, global community by offering
innovative aquatic play solutions designed for developing minds, thrill-seekers, budding explorers,
and the young at heart.
Our work culture is important to us and we believe that with a team of individuals that demonstrate
an ICARE attitude we can achieve amazing things. From tacking a weld to putting the final touches
on a piece of ad copy, we believe that every task we undertake is important and should be
completed with an INNOVATIVE approach, a solid COMMITMENT, and an ATTITUDE that anything is
possible, along with mutual RESPECT, and a level of EQUALITY that invites collaboration.
Our Production team is growing, and we need to add another CNC machinist to keep up with the
global demand for our custom creations that bring joy and delight to kids across the planet.
As part of our Operations Division, you’ll join a Production team of fabricators, welders, and
machinists, a fun group of pros with experience as diverse as their musical tastes.
We have brand new, state-of-the-art equipment, that we’re told, is the stuff of a machinist’s dreams:
a HAAS Lathe ST-35 and HAAS Mill VF4-SS. You’ll get to use both. And when you’ve had enough of
programing jigs and fixtures to produce parts, you’ll get to go “old school”, and drill, groove, cut, turn,
face and knurl with band saws and our manual lathe and milling machines.
If you know what feed rate, rpm and depth-of-cut means, and when and how to adjust all of that in
pursuit of perfection, you probably have the analytical and creative mindset we need. Combined with
your unwavering commitment to safety, ability to interpret drawings to confirm dimensions are
accurate, perform quality checks and preventive maintenance, you’re confident to contribute to
troubleshooting and collaborating with the team to find solutions.
You have the patience, persistence and tolerance to create intricate pieces, solve coding problems
or develop complex schematics. A good sense of humour helps too, in finding the lessons in
“learning experiences”.
On your resume, under your Education and Experience highlights, here’s what we’re hoping to see:
Grade 12 (or equivalent)
Journeyperson Machinist Certification (Red Seal)
Mastercam certification (nice to have)
At least two (2) years of CNC programming experience and at least five (5) years of similar
experience in machining
Comfortable working in a manufacturing and fabrication shop, ideally with aluminum and
stainless steel alloys and processes
Knowledge of machines preventive maintenance
Experience in CAM (Computer Aided Manufacturing), Mastercam, CAD software, CNC
Machining simulation software
We want to get to know you better—what motivates you, your communication style, how you make
decisions—so ask all applicants to complete this short assessment by following this link to the
Predictive Index. We promise: The Predictive Index is not an aptitude test, and there are no right or
wrong answers.
Please apply to careers@waterplay.com with “Machinist” in the subject line or via mail, to:
Careers
Waterplay Solutions Corp.
805 Crowley Ave
Kelowna BC V1Y 7G6
WMI has a COVID-19 plan in place to ensure the health and safety of our employees, customers, and
vendors. We continue to adjust this plan in compliance with WorkSafeBC and provincial health
guidelines.
We’re grateful for everyone who invests time and energy to apply and we will directly contact those
of you we’re keen to learn more about."
"Electronics Lab Technician - Oakville, ON - Indeed.com","Who we are:
Geotab is a global leader in IoT and connected transportation and certified “Great Place to Work.” We are a company of diverse and talented individuals who work together to help businesses grow and succeed, and increase the safety and sustainability of our communities.
Geotab is advancing security, connecting commercial vehicles to the internet and providing web-based analytics to help customers better manage their fleets. Geotab’s open platform and Marketplace, offering hundreds of third-party solution options, allows both small and large businesses to automate operations by integrating vehicle data with their other data assets. Processing billions of data points a day, Geotab leverages data analytics and machine learning to improve productivity, optimize fleets through the reduction of fuel consumption, enhance driver safety and achieve strong compliance to regulatory changes.
Our team is growing and we’re looking for people who follow their passion, think differently and want to make an impact. Ours is a fast paced, ever changing environment. Geotabbers accept that challenge and are willing to take on new tasks and activities - ones that may not always be described in the initial job description. Join us for a fulfilling career with opportunities to innovate, great benefits, and our fun and inclusive work culture. Reach your full potential with Geotab. To see what it’s like to be a Geotabber, check out our blog and follow us @InsideGeotab on Instagram, Twitter or Facebook. Join our talent network to learn more about job opportunities and company news.
At Geotab, all staff must be fully vaccinated in order to be eligible to work in our North American offices at this time. Accordingly, any job offer for an onsite position resulting from this posting will be conditional upon the successful candidate providing evidence of full vaccination. Accommodations may be made for those who cannot be vaccinated based on medical or other legally protected grounds.
Geotab policies and requirements are subject to change based on local or federal guidelines.
Who you are:
We are always looking for amazing talent who can contribute to our growth and deliver results! Geotab is seeking a Electronics Lab Technician who will be focused on preparing devices for network certification testing and building jigs for production/automotive teams. Emphasis is placed on quick turnaround of requests finding ways to improve the quality of production test equipment. If you love technology, and are keen to join an industry leader — we would love to hear from you!
What you’ll do:
As a Electronics Lab Technician your key area of responsibility will to troubleshoot and repair production jigs and equipment, swap components, solder wires, apply labels and load appropriate firmware on devices. You will need to work closely with with team members to understand the required goals for each project and become part of the production/NPI/automotive support team. To be successful in this role you will be a self-starter, self-learner and have the ability to quickly understand technical concepts.
This position is not eligible for remote work. You will be required to come into the office.
How you’ll make an impact:
Troubleshoot and repair production jigs and equipment (mechanical + electrical).
Understand how to build, program and test the core Geotab line of product.
Swap components, solder wires, apply labels.
Load appropriate firmware on devices as requested by certification specialist.
Run devices through test procedure to validate compliance with lab requirements.
Document all device details relevant to lab entry.
Participate in documenting procedures, establishing best practices, templates, and tools to expand team capabilities.
Travel to contract manufacturers to assist in equipment set up and maintenance.
What you’ll bring to this role:
Electronics / Computer Engineering Diploma.
IPC certification (IPC-A-610, J-STD-001, IPC-7711 & IPC-7721).
Experience in electronics testing and troubleshooting is an asset.
Familiar with troubleshooting techniques and the ability to read technical drawings and schematics.
Strong manual dexterity and experience working with test measuring tools.
Ability to diagnose and correct root causes of equipment and product/process related failures.
Excellent verbal and written communication skills, problem solving ability, and time management skills.
Enjoy working in a fast-paced environment.
Self-motivated, decisive, with the ability to adapt to change and competing demands.
#LI-BP1
Why job seekers choose Geotab:
Work from home and flex work arrangements
Baby bonus
Home office reimbursement program
Online learning and networking opportunities
Electric vehicle purchase incentive program
Competitive medical and dental benefits (full-time employees only)
Retirement savings program (full-time employees only)
How we work:
At Geotab, we understand that the world is always changing and that we need to change with it. Geotab has adopted a hybrid model for working, including a flexible work from home program, with the opportunity to work in our safe, clean offices. When working from home, you are required to have a reliable internet connection with at least 50mb DL/10mb UL. Virtual work is supported with cloud-based applications, collaboration tools and asynchronous working. The health and safety of employees are a top priority. We encourage work-life balance and keep the Geotab culture going strong with online social events, chat rooms and gatherings. Join us and help reshape the future of technology!
We believe that ensuring diversity is fundamental to our future growth and progress and is an integral part of our business. We believe that success happens where new ideas can flourish – in an environment that is rich in diversity and a place where people from various backgrounds can work together. Geotab encourages applications from all qualified individuals. We are committed to accommodating people with disabilities during the recruitment and assessment processes and when people are hired. We will ensure the accessibility needs of employees with disabilities are taken into account as part of performance management, career development, training and redeployment processes. If you require accommodation at any stage of the application process or want more information about our diversity and inclusion as well as accommodation policies and practices, please contact us at careers@geotab.com. Click here to learn more about what happens with your personal data."
"Data Scientist - Mississauga Valley, ON - Indeed.com","CJR Wholesale Grocers have been serving Ontario for over 30 years. We pride ourselves in offering one stop shop for customer’s grocery, cooler and freezer needs. We strive to offer a best in class customer experience.
Career Opportunity:
The role of our Data Scientist will be responsible to design data modeling processes to create algorithms, perform custom analysis. and predictive modeling.
Responsibilities
1. Acquire data from the existing ERP system
2. Process and clean the information and data
3. Initial data investigation and exploratory data analysis
4. Choose one or more potential models and algorithms
5. Apply data science techniques, such as machine learning, statistical modeling and artificial intelligence
6. Measure and improve results
7. Present final result to stakeholders
8. Make adjustments based on the feedback
9. Continue the process to solve multiple problems
Skills and
Qualifications:
Statistical analysis: Identify patterns in data. This includes having a keen sense of pattern detection and anomaly detection.
Machine learning: Implement algorithms and statistical models to enable a computer to automatically learn from data.
Business intuition: Connect with stakeholders to gain a full understanding of the problems they’re looking to solve.
Analytical thinking. Find analytical solutions to abstract business issues.
Inquisitiveness: Look beyond what’s on the surface to discover patterns and solutions within the data.
Degree in a STEM discipline (applied mathematics, computer science, statistics, engineering, machine learning, econometrics etc.)
Job Types: Full-time, Permanent
Schedule:
8 hour shift
Monday to Friday
Education:
Master's Degree (preferred)
Experience:
machine learning: 1 year (preferred)
Machine: 4 years (preferred)
Process and clean the data: 3 years (preferred)
Statistical modeling: 3 years (preferred)
Artificial Intelligence: 2 years (preferred)"
