Title,Description
"Mechanical Thermal Engineer - Brampton, ON - Indeed.com","Job Responsibilities:
As our Thermal Engineer you will need:
Experience in impact of different thermal environmental conditions (natural and induced thermal loads) on thermal and mechanical design
Support manufacturing, and validate and prove the thermal design by conducting thermal and thermal-vacuum tests on the product hardware according to the thermal environment.
Generate analysis reports and create thermal test plans and reports.
Experience in a major CAD tool (such as NX, Pro-E or Catia)
Basic Qualification:
Interested candidates should have a Bachelor’s degree in Mechanical Engineering, Aerospace Engineering or related field and 3-5 years of post-graduate experience in the Aerospace industry. Master’s degree is preferred.
3-5 years direct experience on thermal analysis - conceptual design, sizing, verification and validation of thermal control systems
Strong problem solving skills and initiative-takingMulti-tasking and task-prioritizing capability
Knowledge and understanding of thermal and general mechanical design
Ability of working under tight schedule and pressure
Experience in the design of thermal control systems and analysis for spacecraft would be considered an asset
Experience with NX Space Systems Thermal or Thermal Desktop would be an asset
Strong programming skills in Python, MatLab or similar would be an asset
Strong communication and negotiation skills
:
Job Type: Full-time"
"656418 - Staff Environmental Geochemist or Engineer - Toronto, ON - Indeed.com","We are seeking a
Staff Environmental Geochemist or Engineer
in
Ontario
to support the continued growth of our Mining Practice. You will have the opportunity to apply your academic knowledge to real-world situations while also learning the business skills needed for a successful consulting career.
Our clients ask us to address their new ventures and most challenging problems involving the environment, natural resources, and civil infrastructure. Geosyntec is internationally known for its technical leadership, broad experience, and exceptional client service. Learn more by visiting www.geosyntec.com
ESSENTIAL DUTIES AND RESPONSIBILITIES
Is this the right position to help you achieve your professional goals? Some of the key responsibilities for the position include:
Fieldwork such as rock, soil, surface water, and groundwater sampling, drilling and contractor oversight, and remediation system O&M;
Providing support for geochemical and water treatment projects, specifically in mining;
Geochemical data and contaminant fate & transport evaluation;
Conducting treatability, bench-scale and pilot-scale water treatment studies;
Geochemical and water quality modelling;
Environmental due diligence, regulatory compliance services, and permitting;
Data analysis, including preparing maps, tables, and figures; and
Preparation of technical reports, letters, memoranda, plans, specifications, and proposals.
Collaboration and mentoring are cornerstones of Geosyntec s culture. You should expect to work closely with experienced professionals who will guide and integrate you into Geosyntec s culture.
Here are some other things you should know about our typical practitioner position:
Training:
This position requires OSHA/MSHA health and safety, first aid, and CPR training and medical monitoring, paid for by the firm. We also offer professional development opportunities including technical conferences, in-house seminars, webinars, and mentoring, that allow our professionals to build the technical and business skills necessary to become successful consultants.
Fieldwork:
Typically, approximately 20%
Overnight travel:
Typically, approximately 20%
Your success is our success. We encourage our professionals to continually develop their interests and skills. Advancement is based on an individual s own performance and initiative.
EDUCATION AND LICENSURE
Bachelor s degree in geology, geochemistry, engineering or environmental science (required)
Advanced degree in geology, geochemistry, engineering or environmental science with a focus on geochemistry or treatment technologies (preferred)
SKILLS, EXPERIENCE AND QUALIFICATIONS
Prior research experience in geochemistry or water treatment with a focus on mining. (preferred)
Prior internship experience in environmental consulting. (preferred)
Experience with PHREEQC, Geochemist s WorkBench and GoldSim. (preferred)
Experience with data manipulation tools including Excel, Python, R and Access. (preferred)
Eligible to work permanently in Canada, possess a valid driver s license and a satisfactory driving record for business travel. (required)
CULTURE/EEO STATEMENT
Geosyntec strives to hire and retain the best and brightest people in their fields. We look for exceptional interpersonal skills, communication skills, and problem-solving abilities, plus the passion for technical excellence and quality. We seek individuals with leadership potential, a commitment to lifelong learning and growth, and the desire to build a long and rewarding career with a growing Firm.
Geosyntec is a great place to build a career. If you're looking for an exciting place to work, a place with challenging and rewarding projects, and a place that has been nationally recognized for its employees' quality of life, technical expertise, and business success, then Geosyntec may be the place for you. You can learn more about careers and employment at Geosyntec by visiting http://www.geosyntec.com/careers/
Geosyntec offers excellent compensation packages commensurate with experience, along with a comprehensive employee benefits package."
"Process Engineer - Georgetown, ON - Indeed.com","Howmet Aerospace is the world leader in the manufacture of Structural Aluminum Investment Castings to the Aerospace Industry.
Howmet is currently looking to recruit a Process engineer. The position is based in Georgetown, Ontario and does report to the Manufacturing Manager. Below are the main duties and responsibilities of the position as well as our requirements.
Duties & Responsibilities
Work in collaboration with process engineering, product engineering and manufacturing teams in all aspects of product development, production implementation and data collection. Responsibilities include the evaluation and reduction of casting defects/failures, rework, scrap and addressing other quality issues in all areas of manufacturing. Functions include root cause and corrective action to ensure a robust process and repeatable casting quality.
Provide technical oversight and process ownership responsibilities in assigned areas of materials, testing labs, (e.g. tensile, chemistry, hardness) and special processes (e.g. chemical etching, welding), including calibration, operation, customer/industry specification reviews and technical manufacturing flow down implementation, equipment servicing, problem resolution, and internal/external auditing functions.
Work with quality and engineering teams to provide technical support and corrective action relating to customer complaints and returns, including improving on-time delivery. This includes rework, scrap and non-conformance analysis, oversight, weekly/monthly reporting and initiating job and/or process specific improvement activities based on trends, and manufacturing and/or financial priorities.
Develop and implement best practice approaches in wax, shell, foundry, welding, and heat treat departments.
Responsible for Process Management aspects such as document control, implementation, and monitoring of process controls in various manufacturing processes, including daily review of process inputs/outputs, as well as identifying and correcting significant or unacceptable process variation and excursions.
Analysis and characterization of casting defects.
Document, maintain, revise, and approve technical process, product-specific, manufacturing instructions and procedures critical to finished product quality (e.g. wax assembly, shell molding recipes, casting, welding, and heat treat requirements).
Participate and lead all assigned research & development projects as required, conduct manufacturing tests/experiments, including project related activities such as planning, scheduling, performing pilot scale setups, sample preparation, testing, data collection and analyzing results.
Ensuring various daily/weekly sample collection and laboratory testing in various manufacturing areas (e.g. wax, shell molding, foundry, heat treat, etc) are developed/performed, including conducting miscellaneous laboratory or in-plant experiments (materials, process and/or product related).
Searching, selecting, testing and approving substitute or new raw materials.
Ensuring operating performance of critical casting process equipment and tools, including upgrading existing equipment or selection of new equipment.
Perform quality and process system audits.
Perform training on assigned process specific techniques and methods, casting specific procedures, and critical health and safety practices/initiatives where needed.
· Ensures effective supervision, direction, training, coaching and personnel development of personnel in order to deliver stated results. Develops and maintains effective employees, training and progression programs.
Essential Technical Qualifications:
Engineering degree (specialty in metallurgy preferred)
10 years of experience in manufacturing
10 years of experience in a Foundry is an asset
Job Type: Permanent
Benefits:
Dental care
Disability insurance
Employee assistance program
Extended health care
Life insurance
RRSP match
Schedule:
8 hour shift
Monday to Friday
Education:
Bachelor's Degree (preferred)"
"Senior Project Coordinator/Engineer - Toronto, ON - Indeed.com","At Aecon, we’re building the future and our people are at the heart of everything we do. We're always looking for exceptional talent to work on our exciting and ever-expanding project portfolios. We are focused on being the #1 Canadian Infrastructure Company and the first choice employer in our industry.
Position Overview
Aecon is currently seeking Intermediate to Senior Project Coordinators and Engineers to join the Civil East Ontario team as we are expanding and bidding on new business with our Major Projects portfolio. This opportunity will allow experienced Project Coordinators to be a part of a full project from bid to execution and close out. Initially brought in with the bid team, under the supervision of a Managing Estimator, the Project Coordinators/Engineers will primarily be responsible for the delivery of organized estimates, budgets, and schedules and ensure the necessary systems and procedures are implemented to manage Aecon’s risk. They will be responsible for providing direction and mentor junior estimators. Once a project is awarded, the Project Coordinators/Engineers could further develop their skills and work on-site in various roles on the field, within project controls, contracts, operations or more!
Key Responsibilities:
Work closely with Estimating Managers, Project Managers, Construction Managers in the development and delivery of design and engineering activities.
Attend and participate in scheduling and planning meetings.
Support projects from the beginning design phase until completion.
Attend customer meetings and perform site surveys or walk-outs as necessary to comply with customer requirements.
Advise management of risks that may affect project profit, costs, schedules, and client relations.
Continuously perform value engineering to improve the installation and reduce cost.
Additional duties as required.
Required Knowledge & Experience:
Minimum of 5-10 years of construction site experience; multi-disciplinary, large scale projects would be an asset.
Design experience would be an asset.
Preference for P.Eng (or currently working towards P.Eng)
Proficient in managing and mentoring junior estimators and engineers.
Understanding of estimating software such as HeavyBid, Bid2Win and HardDollar
Sound understanding of construction scheduling logic.
Post-secondary degree in Engineering or equivalent is an asset.
Proficient with the use of computers and software, including MS Office (Word, Visio, Excel). Basic understanding of Primavera would be an asset.
Excellent verbal, written and communication skills.
Excellent time management skills.
Tolerance to ambiguity.
Self-motivated, ability to learn new skills and assume new responsibilities.
Ability to work independently and cooperatively in a team environment.
Ability to travel across Ontario as required
Liaise with customers and clients to resolve any challenges."
"Coop/Summer Student - Mechanical Engineering - Selkirk, MB - Indeed.com","Who we are
We are the leading company in the production of long steel in the Americas and one of the major suppliers of specialty long steel in the world. With more than 45,000 employees, Gerdau has an installed capacity of more than 25 million metric tons of steel and it is the largest recycler in Latin America, and around the world, it transforms millions of metric tons of scrap into steel every year.
Gerdau Long Steel North America is a leader in mini-mill steel production and steel recycling in North America, with an annual manufacturing capacity of approximately 10 million metric tons of mill finished steel products. We serve customers throughout the U.S. and Canada, through a vertically integrated network of mini-mills, scrap recycling facilities and downstream operations offering a diverse and balanced product mix of merchant steel, rebar, structural shapes, fabricated steel, flat rolled steel and wire rod.
Gerdau's growth is based on our values and on a vision focused on excellence. Gerdau proudly offers internship programs, through which students can jump start their career with hands-on experience with one of the largest steel producers in the world. Working at Gerdau is an opportunity to be part of a team that is a benchmark in the industry in which it operates.
An Intern with Gerdau must have an eagerness to grow personally and professionally, being a part of a global company with more than 110 years of entrepreneurship and achievements in the steel industry. This program is for individuals with high learning agility and willingness to adapt and develop continuously , who aim at consistently outperforming in a variety of settings and circumstances.
Gerdau offers competitive wages, on-the-job experience, organization orientation, work assignments and projects with clear and targeted goals that allow young professionals to earn invaluable experience.
Mechanical Intern:
Responsibilities:
The successful candidate will be working with either our Engineering Team or Maintenance & Reliability Team. Following on-the-job training and orientation, the candidates may:
Update equipment /facility drawings
Work with outside vendors and consultants, assist in managing contractors
Assist Engineers on capex improvement projects
Manage smaller non-capex projects
Planning maintenance jobs and ordering parts
Design projects
Requirements:
Have completed at least two years of a degree from a recognized university in an Mechanical discipline
Record of high academic achievement (Minimum GPA 2.5; preferred GPA 3.0 or higher)
Experience with Solid works design software, Autocad would be a benefit
Well-rounded applicants with leadership roles in student organizations or extra-curricular activities
Must be legally authorized to work in the Canada without requiring current or future sponsorship for employment
Strong verbal and written communication skills
Detail-oriented with great organizational qualities
Ability to work independently and be a fast-learner
Gerdau believes in equal employment opportunity for all and strongly encourage applications from all qualified candidates including members of the visible minority community, Indigenous peoples, persons with disabilities, and women in non-traditional roles. All external applicants must be legally eligible to work in the country of hire without current or future sponsorship."
"Project Engineer - Calgary, AB - Indeed.com","The individual assigned to this role will be accountable for ensuring assigned projects meet the desired results through strong relationships with internal and external stakeholders. Project Engineers will work on one or multiple assigned projects and client accounts to support the project team through execution. Construction Deliverables, Material Requisitions and other engineering deliverables will be areas of responsibility as will managing the scope, budget and schedule for their assigned projects. More specific responsibilities include:
RESPONSIBILITIES
Support senior personnel with the execution of projects including the design of plans, preliminary estimations and details – with the use of guidelines.
Develop and maintain DBM; using it as a roadmap throughout the life of the project. Verify and complete requests for proposals, estimates and other technical documents as required by the Client.
Technically competent to review detailed engineering calculations such as pressure drops, vessel sizing and major package design.
Interface with project controls on an on-going basis – i.e. scope control, cost control, schedule control and risk control.
Demonstrate improved autonomy with regards to project management as well as critical path project management.
Additional responsibilities include:
Developing project deliverables (regulatory, cost estimating, PEP’s and DBMs) Reporting and scheduling
Engineering/Design Support
Procurement Support
Construction Support
Review and stamp drawings as required.
Interpret and apply applicable regulatory requirements to safely and successfully execute assigned projects.
Proactively manage deadlines and ensure appropriate communication is provided (to relevant parties) when schedule and cost conflicts arise.
Ability to run computer simulation programs as well as in-house engineering spreadsheets.
QUALIFICATIONS
Degree in Engineering with 3-5 years of engineering experience. Eligibility to register with APEGA.
Preference will be given to those candidates who have prior oil and gas, manufacturing or construction experience.
Ability to work independently and with minimal direction.
Excellent verbal and written communication skills coupled with the ability to work effectively with all clients, both internal and external.
Job Types: Full-time, Permanent
Job Types: Full-time, Permanent
Benefits:
Dental care
Disability insurance
Extended health care
Flexible schedule
Life insurance
Vision care
Work from home
Schedule:
8 hour shift
Education:
Bachelor's Degree (preferred)
Experience:
Oil & Gas: 3 years (preferred)
Licence/Certification:
EIT or P.Eng. registration (preferred)
Work remotely:
Temporarily due to COVID-19"
"Research Council Officer, Semiconductor Electron-Beam Lithography Engineer - Ottawa, ON - Indeed.com","Help bring research to life and drive your career forward with the National Research Council of Canada (NRC), Canada's largest research and technology organization.
We are looking for a Semiconductor Electron-Beam Lithography Engineer to work for the Canadian Photonics Fabrication Centre (CPFC) within our Advanced Electronics and Photonics (AEP) Research Centre. The successful candidate would be someone who shares our core values of Integrity, Excellence, Respect and Creativity.
This position will focus on activities related to system processes and actively contribute to the lithography engineering team.
Working with clients and partners, the National Research Council Canada provides strategic research, innovation support, scientific, and technical services to develop and deploy solutions to meet Canada's current and future industrial and societal needs. The CPFC offers our clients and partners access to cutting-edge photonics device fabrication services providing simulation, design, fabrication, testing, characterization, and prototyping services to help move innovative photonic and electronic devices to market. It plays a key role in NRC’s Challenge Programs.
The key activities of the Semiconductor Electron-Beam Lithography Engineer are:
Ensure that Electron-Beam Lithography goals are met and effectively contribute to overall CPFC goals.
Maintain a comprehensive record keeping and the provision of detailed reports to clients, and publications where appropriate.
Establish validation and verification criteria for new processes and products to address new client/project needs and Identify opportunities for process improvements.
Create and revise documentation detailing production processes.
Assist in the maintenance of the associated electron beam lithography computer software (design layout and proximity correction) and metrology equipment.
Take a leadership role in the training and support of more junior technical staff across multiple shifts.
Provide expert advice and guidance to researchers looking to incorporate Electron-Beam lithography into the device designs.
Perform other related duties as assigned.
Maintain a safe work environment.
Screening Criteria
Applicants must demonstrate within the content of their application that they meet the following screening criteria in order to be given further consideration as candidates:
Education
Bachelor’s degree in the Physical, Chemical, Materials Sciences; or Chemical or Electrical Engineering.
A PhD or Master’s in one of these disciplines will be considered an asset.
For information on certificates and diplomas issued abroad, please see Degree equivalency
Experience
Extensive relevant hands-on experience in an R&D or semiconductor production environment.
Significant and recent experience in semiconductor Electron-Beam Lithography (EBL) and processes (process optimization, CD control, and photoresist process optimization).
Significant experience in Statistical Process Control (SPC).
Experience with Raith EBL system would be considered an asset
Condition of Employment
Reliability Status
All employees of the National Research Council are required to be fully vaccinated against COVID-19 and attest to their vaccination status unless accommodated based on a medical contraindication, religion, or another prohibited ground of discrimination as defined under the Canadian Human Rights Act.
Language requirements
English
Information on language requirements and self-assessment tests
Assessment Criteria
Candidates will be assessed on the basis of the following criteria:
Technical Competencies
Solid knowledge in Electron-Beam Lithography and its characterization techniques as they relate to other processes.
Advanced knowledge of resist chemistries and processing.
Solid knowledge of the use of design of experiments, process control checks, trend charts, WIP tracking and paperless MES.
Solid knowledge of process improvement, optimization to ensure robustness and reliability.
Solid knowledge of safe practices for working with chemicals, compressed gases, liquid nitrogen, and electrical, mechanical, and vacuum systems.
Ability to plan, schedule, and carry out all steps needed for the prototyping of microfabricated semiconductor devices.
Demonstrated ability to recognize problems with complex processes or fabrication tools and assist with/determine possible causes and solutions.
Demonstrated ability to understand the dynamic interaction of process steps across various fabrication areas
Behavioural Competencies
Research - Communication (Level 2)
Research - Creative thinking (Level 2)
Research - Partnering (Level 1)
Research - Results orientation (Level 2)
Research - Teamwork (Level 2)
Competency Profile(s)
For this position, the NRC will evaluate candidates using the following competency profile: Research
Relocation
Relocation assistance will be determined in accordance with the NRC's directives.
Salary Range
This position is classified as a Research Council Officer (RCO), a group that is unique to the NRC. The RCO group uses a person-based classification system instead of the more common duties-based classification system. Candidates are remunerated based on their expertise, skill, outcomes and impacts of their previous work experience. The salary scale for this group is vast, from $56,374 to $159,364 per annum, which permits for employees of all levels from new graduates to world renowned experts to be fairly compensated for their contributions.
Notes
A pre-qualified list may be established for similar positions for a one year period.
NRC employees enjoy a wide-range of benefits including comprehensive health and dental plans, pension and insurance plans, vacation and other leave entitlements.
Preference will be given to Canadian Citizens and Permanent Residents of Canada. Please include citizenship information in your application.
The incumbent must adhere to safe workplace practices at all times.
The incumbent is expected to work in a clean room laboratory environment and follow the established health and safety guidelines.
Willingness to work with hazardous materials and/or situations.
We thank all those who apply, however only those selected for further consideration will be contacted.
Please direct your questions, with the requisition number (11681) to:
E-mail: NRC.NRCHiring-EmbaucheCNRC.CNRC@nrc-cnrc.gc.ca
Telephone:
343-552-7798
Closing Date:
2 December 2021 - 23:59 Eastern Time"
