Title,Description
"Security Analyst - Halifax, NS - Indeed.com","This is your opportunity to join AXIS Capital – a trusted global provider of specialty lines insurance and reinsurance. We stand apart for our outstanding client service, intelligent risk taking and superior risk adjusted returns for our shareholders. We also proudly maintain an entrepreneurial, disciplined and ethical corporate culture. As a member of AXIS, you join a team that is among the best in the industry.
At AXIS, we believe that we are only as strong as our people. We strive to create an inclusive and welcoming culture where employees of all backgrounds and from all walks of life feel comfortable and empowered to be themselves. This means that we bring our whole selves to work.
All qualified applicants will receive consideration for employment without regard to race, color, religion or creed, sex, pregnancy, sexual orientation, gender identity or expression, national origin or ancestry, citizenship, physical or mental disability, age, marital status, civil union status, family or parental status, or any other characteristic protected by law. Accommodation is available upon request for candidates taking part in the selection process.
The Security Analyst plays a critical role in enterprise monitoring within the AXIS SNOC. The candidate is part of a larger team which is responsible for 24X7X365 Monitoring, Detection, Response, and Remediation in a highly dynamic, fast paced and rewarding environment. The successful candidate will work within the security spectrum of the SNOC actioning alerts, performing content development, tuning recommendations, proactive hunting, and applying security intelligence to the technology stack.
CORE JOB RESPONSIBILITIES:
Able to analyze security events from multiple sources and prioritize alerting. Understand detection tools and methods for correlating events following established procedures. Dispositions events with a high degree of confidence, flags opportunities for tuning, escalation, and communication of high severity events to leadership.
The SOC analyst is essential in execution of mission critical projects. Interfaces with stakeholders, and prepares plans, including but not limited to, quality, risk and communications. Maintains documentation of activities against the project schedule and provides deliverables to SOC leadership.
Works in close coordination with Senior SOC and Security Operations Leadership for security solutioning selection and content development (tuning and use case development). Designs and builds dashboards and reporting as needed for SOC and other lines of business.
Understand company culture and business processes; is empowered to identify alternative solutions and recommends new approaches. Assists in the requirements for the implementation of changes in the business process. The SOC Analyst is a driver for security awareness.
Receives and addresses requests for support. Contributes to creation of support documentation.
ADDITIONAL RESPONSIBILITIES:
Provides security guidance and is an escalation contact for IT analysts in other towers.
Collaborate with other members of the Security and Networking organizations to create and maintain standards and operating procedures, and provide information as appropriate to manager, project manager, and various departments within the Company.
Able to work in development of security solutions, implementations of proposed solutions, and continuous tuning and development.
REQUIREMENTS FOR CONSIDERATION:
Bachelor’s degree in Computer Science, a related field, or applicable work experience.
3-5+ years of cyber security experience in SIEM, Vulnerability Assessment, Incident Response, Firewall Management/Auditing, Endpoint, and/or IDS/IPS
Preferred certifications include GIAC, OSCP, CEH, Security +, CCNA/IE Security
Strong desire and aptitude to learn new technologies
Motivated to continually provide input to enhance the Security Program
Experience in working in a Security Operations Center (SOC) is preferred
Experience reviewing and hardening OS and network configuration
Understanding of BGP, MPLS, OSPF, etc. – Routing and switching
Experience with Python and other scripting languages.
Knowledge of SIEM platforms including content, tuning recommendations, as well as alert response is desired
Knowledge of UNIX/LINUX systems
Demonstrates decision making, problem solving and analytical skills with attention given to detail and accuracy
Strong team player with ability to work with IT teams beyond the Security Tower
Ability to work with a large degree of autonomy and minimal supervision.
Excellent communication skills
Follow-up, follow through, and deliver quality results within defined SLAs
Able to prioritize events and provide guidance in alert management priority
Experience with targeted cyber-attack analysis.
In-depth knowledge of HTTP and headers, SMTP and headers and FTP, SSH and, TLS.
IDS monitoring/analysis and content creation with tools including Snort, Regex and Yara signatures at an intermediate/advanced level.
Ability to read and interpret PCAP data both in a GUI and in hexdump format.
Ability to perform both static and dynamic malware analysis at a basic level preferred.
Able to adapt to rapidly changing technologies and apply them to evolving business needs
On call support is required 24X7 in rotational schedule
Minimal travel required (training/conferences)"
"IT Service Desk Analyst - Windsor, ON - Indeed.com","We at Leggett & Platt Automotive are looking for an
IT Service Desk Analyst
to join our growing Automotive Team at our facility in
Windsor, ON
. We are a multi-billion-dollar globally diversified company that designs and manufactures various engineered components and products. Our growing automotive business unit, which exceeds one billion dollars in sales, is comprised of four main product segments with operations on three continents. Our customers include OEM and Tier 1 automotive companies.
What you will be doing?
· Identify Incidents and Tickets, Ticket Prioritization, Providing User Support and Trouble Shooting via different
· Communication Channels
· Provide Level 1 Support for User Hardware and user Software Incidents
· Do User Provisioning/Deprovisioning. Grant Access Rights to Applications
· Installing User Hardware and User Software, maintain Software and Hardware Repositories
· Fulfill Project Work in IT-Projects according to the LPA Global IT Frameworks
· Maintain overall IT Documentations
We're looking for someone with:
· Bachelor's Degree or equivalent experience in Computer Technology
· Minimum experience of 3 years
· Knowledge in IT service management
· Operating systems: Server and PC
· Applications: Windows Services and Server based Applications, MS Office, CAD-Systems, Communication
Systems
· Analytical and trouble shooting skills
· Excellent communication skills both written and verbal
· Ability to work within teams based across multiple time zones
· Excellent customer service skills
· Willingness to take directions and work with external Service Providers
Reasons you’ll love it here:
Our company culture reflects values like integrity, ownership, and authenticity. We take these to heart, and if you do as well, you’ll fit right in.
In this role, you will report to the
IT Support Manager.
Job Types: Full-time, Permanent
Benefits:
Company pension
Dental care
Employee assistance program
Extended health care
On-site parking
Vision care
Schedule:
Monday to Friday
Work remotely:
No"
"Portfolio Analyst - North York, ON - Indeed.com","You are as unique as your background, experience and point of view. Here, you’ll be encouraged, empowered and challenged to be your best self. You'll work with dynamic colleagues - experts in their fields - who are eager to share their knowledge with you. Your leaders will inspire and help you reach your potential and soar to new heights. Every day, you'll have new and exciting opportunities to make life brighter for our Clients - who are at the heart of everything we do. Discover how you can make a difference in the lives of individuals, families and communities around the world.
Job Description:
Role Summary
As a member of the Service Delivery Digital Business Automation Services team, the Portfolio Analyst will work with the Business Manager in leading the process of planning, analysis and reporting for the DBAS team.
This includes support for the strategic and operational business planning process, resource planning, project finance tracking, software and hardware assets tracking and the overall service reporting.
What will you do?
Support DBAS management by executing processes for planning, budgeting, financial management and reporting.
Support the project accounting activities and work with the PMs to consolidate demand plans, adjust resource plans, analyze traction reports and adjust the forecast accordingly.
Support projects or project financial reviews as required.
Monitor and track the supply and demand.
Work closely with the delivery and operations management to enhance and continue tracking and reporting the resource allocation process.
Perform ad hoc analysis as required.
Assist the DBAS Leadership team in monthly and quarterly reporting.
Support the delivery and operations financial processes through data collection, compilation, validation, reconciliation, consolidation and reporting.
Participate in the requirements for any required tools to facilitate the automation of the planning and analysis processes.
What you need to succeed?
Ability to leverage technology to streamline processes and provide analytical support.
Financial background or qualification.
Demonstrated analysis and problem-solving skills.
Minimum two years of experience working in an IT environment
Excellent communication, presentation, interpersonal, facilitation and organization skills.
Works effectively and efficiently in a virtual, multi-site environment.
Ability to work independently with some supervision
Preferred skills
Expertise in areas of financial management, portfolio management and service delivery management
A university degree in, business, accounting or computer science degree or equivalent experience.
Experience in Excel, Power BI and Tableau.
Attention to accuracy and detail.
The Base Pay range is for the primary location for which the job is posted. It may vary depending on the work location of the successful candidate or other factors. In addition to Base Pay, eligible Sun Life employees participate in various incentive plans, payment under which is discretionary and subject to individual and company performance. Certain sales focused roles have sales incentive plans based on individual or group sales results.
Diversity and inclusion have always been at the core of our values at Sun Life. A diverse workforce with wide perspectives and creative ideas benefits our clients, the communities where we operate and all of us as colleagues. We welcome applications from qualified individuals from all backgrounds.
Persons with disabilities who need accommodation in the application process or those needing job postings in an alternative format may e-mail a request to thebrightside@sunlife.com.
At Sun Life we strive to create a flexible work environment where our employees are empowered to do their best work. Several flexible work options are available and can be discussed throughout the selection process depending on the role requirements and individual needs.
We thank all applicants for showing an interest in this position. Only those selected for an interview will be contacted.
Salary Range:
56,300/56 300 - 92,900/92 900
Job Category:
Project Management - Systems
Posting End Date:
17/12/2021"
"Security Analyst - Halifax, NS - Indeed.com","This is your opportunity to join AXIS Capital – a trusted global provider of specialty lines insurance and reinsurance. We stand apart for our outstanding client service, intelligent risk taking and superior risk adjusted returns for our shareholders. We also proudly maintain an entrepreneurial, disciplined and ethical corporate culture. As a member of AXIS, you join a team that is among the best in the industry.
At AXIS, we believe that we are only as strong as our people. We strive to create an inclusive and welcoming culture where employees of all backgrounds and from all walks of life feel comfortable and empowered to be themselves. This means that we bring our whole selves to work.
All qualified applicants will receive consideration for employment without regard to race, color, religion or creed, sex, pregnancy, sexual orientation, gender identity or expression, national origin or ancestry, citizenship, physical or mental disability, age, marital status, civil union status, family or parental status, or any other characteristic protected by law. Accommodation is available upon request for candidates taking part in the selection process.
The Security Analyst plays a critical role in enterprise monitoring within the AXIS SNOC. The candidate is part of a larger team which is responsible for 24X7X365 Monitoring, Detection, Response, and Remediation in a highly dynamic, fast paced and rewarding environment. The successful candidate will work within the security spectrum of the SNOC actioning alerts, performing content development, tuning recommendations, proactive hunting, and applying security intelligence to the technology stack.
CORE JOB RESPONSIBILITIES:
Able to analyze security events from multiple sources and prioritize alerting. Understand detection tools and methods for correlating events following established procedures. Dispositions events with a high degree of confidence, flags opportunities for tuning, escalation, and communication of high severity events to leadership.
The SOC analyst is essential in execution of mission critical projects. Interfaces with stakeholders, and prepares plans, including but not limited to, quality, risk and communications. Maintains documentation of activities against the project schedule and provides deliverables to SOC leadership.
Works in close coordination with Senior SOC and Security Operations Leadership for security solutioning selection and content development (tuning and use case development). Designs and builds dashboards and reporting as needed for SOC and other lines of business.
Understand company culture and business processes; is empowered to identify alternative solutions and recommends new approaches. Assists in the requirements for the implementation of changes in the business process. The SOC Analyst is a driver for security awareness.
Receives and addresses requests for support. Contributes to creation of support documentation.
ADDITIONAL RESPONSIBILITIES:
Provides security guidance and is an escalation contact for IT analysts in other towers.
Collaborate with other members of the Security and Networking organizations to create and maintain standards and operating procedures, and provide information as appropriate to manager, project manager, and various departments within the Company.
Able to work in development of security solutions, implementations of proposed solutions, and continuous tuning and development.
REQUIREMENTS FOR CONSIDERATION:
Bachelor’s degree in Computer Science, a related field, or applicable work experience.
3-5+ years of cyber security experience in SIEM, Vulnerability Assessment, Incident Response, Firewall Management/Auditing, Endpoint, and/or IDS/IPS
Preferred certifications include GIAC, OSCP, CEH, Security +, CCNA/IE Security
Strong desire and aptitude to learn new technologies
Motivated to continually provide input to enhance the Security Program
Experience in working in a Security Operations Center (SOC) is preferred
Experience reviewing and hardening OS and network configuration
Understanding of BGP, MPLS, OSPF, etc. – Routing and switching
Experience with Python and other scripting languages.
Knowledge of SIEM platforms including content, tuning recommendations, as well as alert response is desired
Knowledge of UNIX/LINUX systems
Demonstrates decision making, problem solving and analytical skills with attention given to detail and accuracy
Strong team player with ability to work with IT teams beyond the Security Tower
Ability to work with a large degree of autonomy and minimal supervision.
Excellent communication skills
Follow-up, follow through, and deliver quality results within defined SLAs
Able to prioritize events and provide guidance in alert management priority
Experience with targeted cyber-attack analysis.
In-depth knowledge of HTTP and headers, SMTP and headers and FTP, SSH and, TLS.
IDS monitoring/analysis and content creation with tools including Snort, Regex and Yara signatures at an intermediate/advanced level.
Ability to read and interpret PCAP data both in a GUI and in hexdump format.
Ability to perform both static and dynamic malware analysis at a basic level preferred.
Able to adapt to rapidly changing technologies and apply them to evolving business needs
On call support is required 24X7 in rotational schedule
Minimal travel required (training/conferences)"
"IT Service Desk Analyst - Windsor, ON - Indeed.com","We at Leggett & Platt Automotive are looking for an
IT Service Desk Analyst
to join our growing Automotive Team at our facility in
Windsor, ON
. We are a multi-billion-dollar globally diversified company that designs and manufactures various engineered components and products. Our growing automotive business unit, which exceeds one billion dollars in sales, is comprised of four main product segments with operations on three continents. Our customers include OEM and Tier 1 automotive companies.
What you will be doing?
· Identify Incidents and Tickets, Ticket Prioritization, Providing User Support and Trouble Shooting via different
· Communication Channels
· Provide Level 1 Support for User Hardware and user Software Incidents
· Do User Provisioning/Deprovisioning. Grant Access Rights to Applications
· Installing User Hardware and User Software, maintain Software and Hardware Repositories
· Fulfill Project Work in IT-Projects according to the LPA Global IT Frameworks
· Maintain overall IT Documentations
We're looking for someone with:
· Bachelor's Degree or equivalent experience in Computer Technology
· Minimum experience of 3 years
· Knowledge in IT service management
· Operating systems: Server and PC
· Applications: Windows Services and Server based Applications, MS Office, CAD-Systems, Communication
Systems
· Analytical and trouble shooting skills
· Excellent communication skills both written and verbal
· Ability to work within teams based across multiple time zones
· Excellent customer service skills
· Willingness to take directions and work with external Service Providers
Reasons you’ll love it here:
Our company culture reflects values like integrity, ownership, and authenticity. We take these to heart, and if you do as well, you’ll fit right in.
In this role, you will report to the
IT Support Manager.
Job Types: Full-time, Permanent
Benefits:
Company pension
Dental care
Employee assistance program
Extended health care
On-site parking
Vision care
Schedule:
Monday to Friday
Work remotely:
No"
"Supervisor, Information Management & Privacy - Waterloo, ON - Indeed.com","Career Opportunity
Date of Posting: December 3, 2021
Hours of Work: 35 hours per week
Location: 20 Weber Street East, Kitchener
Supervisor, Information Management & Privacy –
One (1) Full Time
In accordance with the Region of Waterloo’s Mandatory COVID-19 Vaccine policy, new Region of Waterloo employees are required to be fully vaccinated, (valid medical or Ontario Human Rights Code exemptions permitted), against COVID-19 as a condition of employment.
Join us in pushing the boundaries of what is possible.
Regional Council has a bold and compelling vision to build a world-class community. At the Region of Waterloo, we work towards that vision on a daily basis and strive to improve the lives of all 630,000 residents by delivering critical, high-quality and inclusive services.
Achieving Council’s vision of world-class requires employees who can collaborate, innovate and adapt as the needs of our community continue to evolve.
The Region of Waterloo has a mandate to reimagine the future and service provision. Putting residents first, we work to ensure that our community remains a great place to live and a great place to work and play – for everyone.
Learn more about why you should work for the region
Your role:
In this supervisory role within the Planning, Development and Legislative Services Department, you will provide leadership and guidance to a team of both professional staff and Students including Information & Privacy Analysts, and technicians.
The work that is to be expected includes the supervision of:
The day-to-day operation of the corporate electronic and non-electronic information management program
Advisory and training services
Policy and legal compliance reviews and audits
The role will also include providing advice on projects, strategies, and initiatives, including emergency planning and disaster recovery, assist clients with privacy breaches and incidents, reviews, identifies, and analyzes the impact of emerging legislation on the collection, use, and disclosure of personal information as well as provides recommendations on policy development, and department-specific requirements.
As Supervisor, Information Management & Privacy, you would act as Freedom of Information Coordinator for the corporation, and supervise policies, strategies, and processes to ensure corporate compliance with legislation/requirements, freedom of information responses and appeals, and prepare/submit annual reports to the Province.
Bring your experience:
If you have knowledge and skills normally acquired through a related university degree in a related field such as information studies, archival studies or public administration, we would love to hear more about you and talk to you about the role.
Apply your knowledge, skills and abilities:
To assume the role of Supervisor, Information Management & Privacy, you will have a profile that reflects the following strengths:
Knowledge of records and information management systems, theories, practices, and procedures, and related information technology.
Ability to oversee day-to-day maintenance of the corporate electronic document management system (e.g., Open Text eDOCS); design and customize systems; understand technological systems and information/protection; and operate help desk tools.
Knowledge of and ability to comply with policies, procedures, related by-laws and legislation (e.g., records retention, MFIPPA, PHIPA), and collective agreements.
Knowledge and understanding of municipal organizational structures, systems, and services.
Analytical, project management, research, and continuous improvement skills.
Leadership, human relations, communications skills and political acuity to supervise, train, develop, motivate, and support staff; promote the program and develop buy-in with staff and leaders; provide expert advice; conduct presentations and training; and participate as an effective team member.
Ability to read and understand publications, legislation, standards, and reports. Ability to write clear, concise reports, policies, procedures, correspondence, presentations, promotional and training materials.
Computer skills with ability to use software such as Microsoft Office, Microsoft Project, and database systems.
Ability to travel within and outside Waterloo Region.
Ability to support and demonstrate the Region’s values.
In addition to offering a competitive compensation package, we have a strong focus on health and wellness, including fitness facilities and family-focused benefits.
The salary of this position ranges from $90,399.40 - $113,003.80 per annum (Grade: 7 on the management/management support wage scale).
Please apply online, by the closing date
Dec 30, 2021
quoting competition number
2021-2515
."
