Title,Description
"Machine Learning Engineer (All levels) - Toronto, ON - Indeed.com","About Us
Deep Genomics is a Toronto-based startup company that is building an AI-powered discovery and development platform to significantly expand the universe of medicines available for genetically defined diseases. Founded in 2015, Deep Genomics brings together a multidisciplinary team of world-leading experts in machine learning, genomics, chemistry, and biology. Together we are on a mission to rapidly discover and develop oligonucleotide drugs for the treatment of patients with severe disorders of the liver, central nervous system, and eye.
Ideal Candidate
Our predictive systems group brings together world-leading experts in biology, genomics, medicine, and machine learning. We are working on several ambitious projects to develop pioneering AI technology for understanding complex genetic diseases and enabling the discovery of novel targets as well as therapies. We are looking for an experienced machine learning engineer to lead the design and development of new models and pipelines and the infrastructure for scaling it up to the next level.
What You’ll Be Doing:
Working with our ML scientists to develop highly scalable models and algorithms for predicting molecular phenotypes using state-of-the-art neural network methodologies.
Developing evaluation, visualization, and productivity tools for streamlining machine learning research
Adapting our algorithms and architectures to best exploit modern cloud computing environments
Working with our software engineers, biologists and geneticists to operationalize and deploy research output to match the needs of stakeholders.
What You Bring:
Solid Engineering and Computer Science fundamentals, ideally with a degree in CS, Math, or equivalent experience.
Senior candidates should have experience in architecting, developing, and deploying large software systems in a leading position
Experience in building, testing, training, and deploying production-ready ML workflows.
Experience developing machine learning algorithms or machine learning infrastructure in Python or C/C++.
Experience with frameworks like PyTorch, Caffe2, Tensorflow, Keras, JAX, Chainer, etc.
Experience in the operationalization of Machine Learning projects (MLOps) using at least one of the popular frameworks or platforms (e.g. Kubeflow, AWS Sagemaker, Google AI Platform, Azure Machine Learning).
What we offer:
Leading role in developing the future of drug development to cure genetically defined diseases.
A highly competitive salary and meaningful equity compensation.
Exceptional opportunities for learning and growth.
A bright, collegial, highly motivated team working at the intersection of the most exciting areas of science and technology.
Deep Genomics thanks all applicants, however only those selected for an interview will be contacted.
Deep Genomics welcomes and encourages applications from people with disabilities. Accommodations are available on request for candidates taking part in all aspects of the selection process."
"Senior Machine Learning Engineer - Halifax, NS - Indeed.com","Talem Health Analytics was founded with the belief and commitment that providing insights into injuries sustained in motor vehicles accidents early in an insurance claim life cycle will not only benefit insurers but will ensure customer care is at the forefront.
Led by a group of passionate and dedicated individuals focused on building technology that helps insurers accelerate the claim lifecycle and redefines customer care by understanding injuries through the science of how people move, Talem Health Analytics is innovating the auto insurance claims management process by combining clinical expertise, forensic science and artificial intelligence into one platform.
Who We Are:
Talem Health Analytics is an AI-enabled injury analysis platform that helps auto insurers make early and accurate claim management decisions by providing accurate and actionable injury and recovery insights. By placing in-depth scientific injury analysis at the insurers’ fingertips from the start of a claim, adjusters can clearly understand injury likelihood, suitable treatment protocols, and recovery timeline to make data-informed decisions promoting an efficient claims cycle and better customer experience.
Job brief
We are looking for a Senior Machine Learning Engineer to help us create artificial intelligence products.
Machine Learning Engineer responsibilities include creating machine learning models and retraining systems. To do this job successfully, you need exceptional skills in statistics and programming. If you also know data science and software engineering, we’d like to meet you.
Your ultimate goal will be to shape and build efficient self-learning applications.
Responsibilities
Translate our business needs into correct machine learning problems
Select appropriate datasets and data representation methods
Design and implement machine learning systems
Research and implement appropriate ML algorithms and tools
Develop machine learning applications and deploy them into production
Perform statistical analysis and fine-tuning using test results
Communicate the results of the study and models to non-technical stakeholders
Keep abreast of developments in the field
Requirements
Proven experience as a Machine Learning Engineer or similar role for 5+ years, having deployed models in production.
Understanding of data structures, data modelling and software architecture
Deep knowledge of maths, probability, statistics and algorithms
Ability to write robust code in Python and R
Familiarity with machine learning frameworks (like Keras or PyTorch) and libraries (like sci-kit-learn)
Excellent communication skills
Ability to work in a team
Outstanding analytical and problem-solving skills
Masters in Computer Science, Mathematics or similar field; Or equivalent industry experience
Talem Health Analytics is an affirmative action, equal opportunity employer. Our commitment is to attract, hire and retain select applicants for employment solely based on their qualifications, emphasizing selecting the best-qualified person for the job. Talem Health Analytics does not discriminate against applicants based on race, colour, religion, sex, sexual orientation, national origin, disability, or any other status or condition protected by applicable law.
Expected start date: 2022-01-03
Job Types: Full-time, Permanent
Salary: $68,554.00-$142,062.00 per year
Additional pay:
Overtime pay
Benefits:
Casual dress
Company events
Extended health care
Flexible schedule
Stock options
Work from home
Schedule:
8 hour shift
Monday to Friday
Experience:
machine learning: 1 year (preferred)
Work remotely:
Yes"
"Graduate Research Intern (Machine Learning) - Toronto, ON - Indeed.com","About us
Deep Genomics is a Toronto-based startup company that is changing the future of medicine using artificial intelligence. Founded in 2015, Deep Genomics brings together a multidisciplinary team of world-leading experts in machine learning, genomics, chemistry and biology. Together we are on a mission to develop an AI-powered platform for rapid discovery and development of the best genetic medicines, focusing on oligonucleotide drugs for the treatment of patients with rare genetic diseases.
Job Description
We are seeking exceptional graduate students for an 8 to 12-month internship in 2021. Deep Genomics is poised to become the foremost AI-powered genetic medicine company by using data-driven approaches at every step of the drug design process. This involves a series of steps from processing raw genomic data, to training and evaluating large-scale machine learning models and applying them to accelerate target discovery and drug design. With the help of experimental data generated as part of our drug discovery process, our models continuously improve by learning from both successes and failures. Successful candidates will have an opportunity to contribute to the AI revolution in Genomics and help better understand and cure genetic disease by working closely with our research scientists and engineers on problems that are highly relevant to our mission.
Our ML team works on developing our state-of-the-art AI workbench and using it to answer critical scientific questions. Collaboration is at the heart of our teams, we often:
Meet with engineers and scientists with genomics, molecular biology, and medicine backgrounds to identify unique problems and brainstorm technical solutions
Present our analyses to a broad multi-lingual audience to ensure statistical robustness and reproducibility
Organize internal hackathons to quickly prototype solutions to problems
Requirements
Currently enrolled in a graduate program at a top-tier university in Computer Science, Electrical or Computer Engineering, Mathematics, or a related discipline.
Experience with designing, training, debugging and evaluating neural networks using modern frameworks such as Tensorflow or PyTorch.
Excellent scientific writing and presentation skills.
Programming experience in at least one of Python, C or C++
Strong organizational, interpersonal, and communication skills.
What we offer
Opportunity to collaborate with leading scientists working at the intersection of ML and genomics and contribute to this rapidly advancing field
Inspiring, creative and fast-moving startup located right next to the University of Toronto and within the MaRS Discovery District – an expanding hub of research in AI and genomics
Competitive compensation package
Deep Genomics thanks all applicants, however only those selected for an interview will be contacted.
Deep Genomics welcomes and encourages applications from people with disabilities. Accommodations are available on request for candidates taking part in all aspects of the selection process."
"Deep Learning Engineering Intern, Content and Technology - Summer 2022 - Canada - Indeed.com","We are looking for Deep Learning Interns for our Simulation Technology team! Do you have a passion for computer gaming, virtual reality, computer vision, and artificial intelligence?
Ever dream about inventing your own holodeck? Do you want to work on leading-edge problems alongside some of the best and brightest people in the world? NVIDIA has continuously reinvented itself over two decades. Our invention of the GPU in 1999 sparked the growth of the PC gaming market, redefined modern computer graphics, and revolutionized parallel computing. More recently, GPU deep learning ignited modern AI — the next era of computing. NVIDIA is a “learning machine” company that constantly evolves by adapting to new opportunities that are hard to solve, that only we can pursue, and that matter to the world. This is our life’s work, to amplify human creativity and intelligence.
What you will be doing:
Apply deep learning techniques to the simulation of virtual environments, developing methods to generate synthetic data for training neural networks to achieve results comparable to networks trained on real data
Work on improving realism for agents in synthetic environments – using reinforcement learning techniques to control behavior and animation of simulated characters, crowds, and vehicles
Conduct research into novel Deep Learning network architectures and techniques for achieving the above.
Perform additional development around related technologies as applied to games, VR and visual effects applications.
What we need to see:
Currently pursuing a PhD, MS, or BS in Computer Science or related field.
1+ year experience with C++/C, CUDA, DirectX, or OpenGL in addition to Python, PyTorch and TensorFlow.
Expertise in neural networks, computer graphics, simulation or game development.
Dedication to producing high quality and creative results
Ways to stand out from the crowd
:
You are a great communicator and self-motivated towards team goals
You welcome mentoring others around you
Sharp mathematics skills
NVIDIA is widely considered to be one of the technology world’s most desirable employers. We have some of the brightest people in the world working for us and, due to unprecedented growth, our elite engineering teams are rapidly growing. If you're a creative and autonomous engineer with a real passion for technology, we want to hear from you."
"Machine Learning Geoscientist - Vancouver, BC - Indeed.com","The Role
MinePortal from DataCloud is the groundbreaking cloud-based intelligent platform that powers geotechnical knowhow of the rock in the mining industry for operational intelligence. Our mission is to push the envelope in Artificial Intelligence (AI), Geophysical IoT sensors, Machine Learning (ML), Data Management, Signal Processing, and Grade Engineering, in order to provide the best-possible blast outcomes for our customers. We are looking for a Geology, Statistics, and ML Specialist to help build industry-leading modeling technologies that the world’s largest mines will adopt.
Key Responsibilities
Reporting to the VP Software, the Machine Learning Geoscientist role will include following broad responsibilities and any other assigned work from time to time

Apply domain expertise in the development and implementation of machine learning models within the hard rock and coal mining industry

Teach internal and client teams how to integrate machine learning software into existing workflows to optimize blast design, blasthole spacing, and other engineering applications

Study and transform data science prototypes for the geoscience specific data streams

Feature extraction and identification over large data sets to feed automated algorithm development

Apply knowledge in geology, geosciences, applied mathematics, and quantitative analysis to sensor solutions for challenges facing our sponsors.

Explore promising research and maintain/gain the technical edge required for projects. Share and develop new approaches and methods.

Design machine learning systems that can automatically recognize features, extract features, and create volume models out int and sparse data

Research and implement appropriate ML algorithms and tools for mining domain specific applications

Select appropriate datasets and data representation methods

Run machine learning tests and experiments

Perform statistical analysis and fine-tuning using test results

Train and retrain systems when necessary

Extend existing ML libraries and frameworks

Keep abreast of developments in the field

Contribute to analysis of algorithmic computational complexity and memory requirements.

Work with Hardware Engineers to specify and optimize sensor and IoT device design and configuration for multiple sensing use cases.

Interface closely with Application and UX Engineers to develop compelling analytical use cases to utilize ML outputs and insights.
Key Qualifications

Master’s degree in Geosciences, statistics, mathematics, applied physics, or a related field.

Comprehensive expert level knowledge of programming and experience in C, C++, Python, R, Golang, or similar language used in geo-stat, ML, and computer vision sciences.

Proficient verbal and written communication skills necessary to effectively collaborate in a team environment and present and explain technical information.

Experience in working in distributed teams in the research, development, and implementation of machine learning, spatial modeling, and geo-stat algorithms.

Takes initiative, independent worker

Ability to manage multiple concurrent major projects with different tactical and strategic objectives

Can effectively assume an array of roles as appropriate in various kinds of organizations. These may entail different responsibilities, forms of leadership, team work, and project management.

Experience leading in environments that are highly volatile, cross-functional, and cross-organizational
Work Hours & Location

Full time, Flexible working hours, 15 days/year vacation

Work from home office and DataCloud’s office in Vancouver

Some travel to Seattle, Palo Alto, and Client offices world wide
DataCloud is an Equal Opportunity Employer. Qualified applicants will receive consideration for employment without regard to race, color, religion, sex, age, disability, military status, or national origin or any other characteristic protected under applicable local law. The Candidate must be authorized to work in Canada.
About DataCloud
Founded in 2016, DataCloud delivers high-resolution rock mass characterization data to our clients in real-time. Our innovative measurement and analysis platform provides invaluable orebody insights during drill and blast operations. Our technologies help mine planning teams to dramatically improve their extraction efficiencies.
With our unique combination of skills in both mining and technology, DataCloud is helping to solve many of the problems that have challenged the mining industry for decades. Our founders come from institutions such as Stanford, UC-Berkeley and Cambridge, who have expertise in geosciences and cloud architecture.
Our portfolio of products and services span the latest in Geo-Statistics, Geo-Physics, and advanced digital and artificial intelligence technologies, including cloud computing, machine learning, advanced visualization, and new sensor technology enabled by IoT systems."
"Machine Learning Scientist (Can be Remote Within Canada) - Ottawa, ON - Indeed.com","At BluWave-ai our mission is to deliver innovative AI solutions to accelerate the transformation towards renewable energy. We apply AI software to increase the use of clean energy in smart grids and microgrids with distributed energy resources and demand response. We are also driving the transition to electrification of transportation as the grid becomes the local gas station.
We are looking for talented people with entrepreneurial drive to seize on the ground floor opportunities, grow their careers, and make a positive impact for the environment.
1. Who you are
A machine learning engineer, with professional experience or equivalent applied research, strongly motivated by building impactful and dependable products based on pragmatic and rigorous application of ML techniques.
You have the drive to learn, evaluate, and apply a range of data science and ML techniques. The applications are real-time smart grid control and optimization solutions in the context of best scalability, availability, and security principles.
You are a pragmatic innovator who thrives in a fast-paced, disciplined, and team-oriented environment where we strive individually while supporting, learning from, and building on each other's ideas and efforts to succeed as a team. You have strong verbal and written communication skills with the ability to distill complex technical concepts to the level that non-specialists can comprehend. You are effective at teamwork, and you enjoy mentoring.
2. What you are Responsible for
Analysis, design, and implementation of ML solutions to prediction and optimization tasks.
Develop statistical and machine learning solutions for analysis, data mining, and modeling of IOT data.
Develop resilient testing strategies to monitor model performance.
Prepare documents and presentations to inform and demonstrate.
3. Your Knowledge, Experience, and Skills
Required:
Experience as a ML scientist within a commercial environment, or equivalent academic research experience with pragmatic experimentation or industry collaborative projects.
Experience with cleaning, reshaping, exploring, and visualizing data in various formats.
Strong programming knowledge and skills in Python.
Familiarity with machine learning tools and platforms such as TensorFlow, Keras, etc.
Considered an asset:
Experience in developing ML techniques for time-series prediction: e.g. regression, support vector machines, and neural networks.
Familiarity with control and optimization of modern power and energy systems.
Educational Requirements:
MSc or PhD in Mathematics, Statistics, Computer Science, or related data-intensive fields. Exceptional Candidates with a Bachelor's degree with strong relevant solution delivery experience are encouraged to apply.
4. What You Will Gain
Motivation to serve to the greater cause of climate change mitigation.
Knowledge, skills, and professional networking in one of the most exciting and positively impactful technology domains on the intersection of electrical engineering, machine learning, optimization, and software development.
Startup experience and ground floor opportunities for growth in an inter-disciplinary team that includes PhD Smart Grid and Machine Learning Scientists, recent grads, and seasoned business professionals.
Competitive compensation.
High quality of life and career in Canada's National Capital Region or remote work.
Working on a team with a serious approach towards our work, rather than ourselves, together with fun and random team events.
5. General Information
Level:
All experience ranges are encouraged to apply
Position Type:
Full-time
Location:
Ottawa, ON (can be remote for exceptional candidates)
Department:
Applied Science
Position Reports to:
Vice President of Technology
Diversity makes us stronger. BluWave-ai provides equal employment opportunities to all employees and applicants without regard to race, color, religion, sex, gender, national origin, disability, or any other characteristic protected by applicable laws, regulations, or ordinances.
Authorization to work in Canada is required for this position."
Data Scientist (Machine Learning) - Quebec Province - Indeed.com,"Events in recent years have made us all too familiar with the havoc that natural disasters can wreak, and the increasing frequency and intensity with which they are occurring. Despite record levels of losses, conventional methods of risk modeling continue to paint at best an incomplete picture of these threats.
Zesty.ai uses novel data gathering and data science methods to produce higher quality information about the risks to property from catastrophes like floods and wildfires. While AI alone may not be able to thwart these disasters, it can help us become more prepared for them, and ultimately that will lead to better outcomes.
As a
Data Scientist
, you are comfortable and excited to work closely with the engineering team to build the best AI tech possible. You will develop top tier models from unique and diverse data sources to provide strong insights and maximize the impact of our company efforts. You thrive in a collaborative, creative environment that moves fast and are comfortable setting in place structures and processes to help the company scale.
The Opportunity:
Exploring data sets and developing new InsureTech models with data science (Machine learning, Deep learning).
Develop computer vision algorithms that extract insights from aerial imagery and geospatial data
Research and model aspects of the built environment utilizing satellite imagery, LiDAR and other datasets
Help develop training and cross-validation data sets for machine learning algorithms
Translate product management, engineering, and business constraints and queries into tractable data science questions
Iterate rapidly on everything; all of the above happens in a fast paced business driven environment that you must be comfortable with
What You Bring to the Zesty.ai Lab Team:
BA / BS degree in Math, Physics, Computer Science, and Economics
MS or Ph.D. is certainly a bonus
1 - 2 years of experience working with computer vision and building and testing computer vision systems
2 - 3 years experience deploying machine learning models in production environments
2 - 3 years experience working with deep learning / neural network models (using TensorFlow, PyTorch, Keras, Caffe)
Ability to develop new models based on physics and AI sciences
Strong organizational and management skills with past experiences implementing best practices and processes
Experience working with large image datasets (great if you've already worked with satellite imagery) and related tools OpenCV, Pillow, etc.)
Proficient in SQL
Experience working with cloud platforms (AWS, Google Cloud, etc)
Must be legally eligible to work in Canada
Why Zesty.ai Lab:
Be part of a well-funded growth-stage start-up
Market competitive comp and equity incentives to give you a stake in our future
Comprehensive health care plan
Flexible Time Off
An upbeat and collaborative work culture
Company-sponsored outings and offsites
All your information will be kept confidential according to EEO guidelines."
