Title,Description
"Digital Specialist, Search Marketing - Toronto, ON - Indeed.com","Are you looking for more than a job? At World Vision Canada we offer challenging careers that change the lives of children all over the world and it will change yours too. Come and be part of a team of 400 Canadians with a vision for the world: Life in all its fullness for every child.
You will experience Christian faith in action helping to make real and lasting change in the lives of the world’s most vulnerable children. Join the World Vision Canada team and be part of a powerful and effective force for good:
For Children. For Change. For Life.
Position:
Digital Specialist, Search Marketing | Digital Marketing & Media
Reports To:
Portfolio Manager, Digital Marketing & Media
Position Term:
Full Time Permanent
Application Deadline:
Open until filled
Location:
Hybrid (Mississauga, ON)
Job Description
Working as part of the Portfolio Management team, the Digital Specialist, Search Marketing is responsible for identifying, delivering, and supporting end-user solutions across our Digital Marketing portfolio. Using their functional knowledge and familiarity with Content Creation, Organic Search, and Paid Search, they will ensure that necessary business requirements are met while providing a variety of advisory services around business process development, implementation support, troubleshooting and end-user training.
The Search Marketing Specialist supports the overall vision for digital marketing for World Vision Canada (WVC) by attracting quality traffic to our web properties for lead generation, engagement, and revenue purposes.
Duties and Responsibilities
Business Management:
Provide high-level business support, to expedite digital solutions to business requests.
Acts as the voice of authority on all matters pertaining to Search and leads the function across all teams in the marketing organization.
Research:
Researches and analyzes competitor advertising links and SERP results.
Performs keyword research to identify and prioritize opportunities to increase search engine results pages (SERP) results and traffic.
Provides input on SEM builds and strategy.
Planning & Implementation:
Develops and implements a search engine optimization (SEO) strategy (includes segmentation/targeting, gap assessment, landing pages, other site/microsite pages, web/mobile) for all WVC web properties.
Develops and implements link building strategy and trains and leads marketers in link building.
Supports paid search planning and performance across overarching WVC media activities.
Subject Matter Leadership:
Works with all content creators and members of the Digital Marketing team to develop a roadmap to optimize existing content and produce new content with the most value to WVC.
Works with the Digital & Technology team to ensure SEO best practices are properly implemented on newly developed code and existing code.
Works with the Media team to develop an integrated approach to paid and organic search.
Recommends changes to website architecture, content, linking and other factors to improve SEO positions for target keywords, in collaboration with Program and Product Managers.
Works with World Vision International (WVI) to share and learn from best practices across the partnership and to ensure that Canada leverages content from other countries.
Solution Analysis and Design:
Analyze various requests and issues to assess their validity, impact (e.g., number of users impacted), importance, and urgency.
Analyze and assess data / system / user impact, and overall system architecture to determine the best solution / implementation approach and methodology (highest value / impact + lowest effort / time + lowest risk).
Share your knowledge with various stakeholders, execution team, and/or scrum teams by providing information regarding requested changes, their impact, as well as recommended implementation approach and methodology.
Collaboration:
Must be able to work with business stakeholders at various levels to translate client business requirements into technical solutions.
Act as the Subject Matter Expert for the business processes and day-to-day support.
Works closely with Web and E-commerce Scrum teams (Agile methodology), sharing responsibility for timely delivery of solutions.
Provide support across Digital Marketing & Media.
Manage and lead key meetings, including business discussions and team meetings.
Effectiveness & Efficiency
Seeks and promotes the digitization of processes that leads to cost efficiencies.
Through their work and role, aids teams / activities to generate breakthrough ideas, fresh perspectives, and new approaches.
Creates an environment in which all systems and processes support high levels of efficiency.
Seeks new opportunities to improve business outcomes using innovative. (unique/original/untried) approaches to overcome obstacles and surpass performance.
Continually seeks and identifies areas for improvement.
Challenges self and teams to improve processes, reduction of backlog or wait times, increase response times and the reduction of non-value-added time.
Consistently strives to eliminate organizational technical debt.
Innovation:
Generates creative solutions to work situations.
Identifies different and novel ways to deal with problems and opportunities.
Research new technologies / processes to improve work deliverables.
Makes recommendations on improvements and enhancements to achieve organizational effectiveness.
Supports and encourages innovative thinking and design in daily work and within the team.
Employs organizational adopted tools and best practices to facilitate process improvement efforts and to contribute to the realization of divisional and strategic goals.
Qualifications
University degree – Bachelor’s Degree in Business, Technology, or similar discipline (Preferred).
3-5 years of relevant experience in Marketing / Technology.
2+ years’ experience with Marketing Platforms (e.g., Shopify, Kentico, etc.).
Experience in customer facing website content management related experience within a marketing environment and web data, traffic, and reporting experience.
Deep understanding of web/mobile landscape.
Deep knowledge of HTML, CSS, WCMS, SEO, SEM, Analytics, etc.
Capacity to quickly navigate the changing digital landscape.
Experience working directly with internal/external clients in a face-to-face environment.
Experience working with and managing agencies and external vendors.
Demonstrated organizational, interpersonal, communication, and analytical skills.
Marketing platform(s) experience is an asset.
Working knowledge of development process and project management is an asset.
Understanding and experience working in Scrum / Scaled Agile Framework / LEAN / Agile is an asset.
We bring life-saving support in times of disaster. We help poor communities to take charge of their futures. We provide small loans and training that boost family livelihoods. We work with policy makers to change the way the world is run. Our Christian faith teaches us that every child, regardless of gender, faith or race, is a precious gift to the entire world - and that their wellbeing concerns us all. We shall never rest while children suffer in situations that can be changed.
Canada's Top 100 GTA's Top 10
Our Core Values:
We are committed to the Poor. We are Christian. We are Stewards. We value People. We are Partners. We are Responsive.
Qualified candidates must be able to demonstrate a commitment to the core values and mission of the World Vision partnership.
World Vision Canada takes our Safeguarding responsibilities seriously and we provide an environment that is safe for our child and adult beneficiaries. We have strong recruitment procedures to make sure the safest and most suitable people work with the children in our programs. We provide our staff and volunteers with ongoing supervision, support and training in their work with child and adult beneficiaries.
World Vision Canada welcomes and encourages applications from people with disabilities. Accommodations are available on request for candidates taking part in all aspects of the selection process.
Thank you for your interest; however only those applicants selected for an interview will be contacted."
"Digital Marketing Intern - Pointe-Claire, QC - Indeed.com","ChargeHub, built by Mogile Technologies, is looking for a Digital Marketing Intern who wants to work for a brand in a fast growing industry; the electric vehicle (EV) sector. As a member of the marketing team and reporting to the Manager of Communications and Engagement, the successful candidate has the ability to work in both written and spoken English and French to work within a cross-functional, dynamic and ambitious team. The successful candidate also has basic knowledge of digital marketing platforms and terminology.
This is a paid internship starting in the Winter 2022 semester.
What you will do:
Develop
Support and coordinate the successful execution of ad campaigns for sales on home chargers and ChargeHub products
The analysis of results of ad campaigns
Assist in planning and organizing event booth requirements
Participate at events such as the Quebec Electric Vehicle Show
Learn various digital marketing disciplines: search engine optimization (SEO) marketing, email marketing, social media and more;
Gain experience using platforms such as ActiveCampaign, Shopify, OptinMonster, Instapage, WordPress and more
Stay informed about the latest trends in the EV industry;
Attend weekly marketing meetings
Create graphics and visual content using Canva
Analyze various marketing campaign results;
We are looking for a candidate that has:
Can write, speak and work in both French and English;
An ability to take ownership of problems and projects;
Strong organizational skills, excellent time management and priority setting;
A strong focus on customer service and excellent critical thinking skills;
Passion to constantly learn new things;
A creative and open mind, great curiosity, a sense of commitment, autonomy and versatility;
Communicating efficiently with the team;
Who is ChargeHub?
ChargeHub, is a Montreal-based company in the electric vehicle industry. Our mission is to simplify the electric vehicle (EV) charging experience for EV drivers across North America.
ChargeHub includes a range of consumer and industry products, including the popular ChargeHub app: a community app that helps electric vehicle drivers overcome range anxiety by helping them find more than 100,000 public charging stations in Canada and the United States. More than one million people have used ChargeHub to find charging stations and add comments and photos. Users can also see real-time status and pay for charging directly in the app, making the charging experience simple and enjoyable.
What are the benefits?
We encourage well-being above all. The ChargeHub team loves autonomy and flexibility. We have an office in Pointe-Claire, Quebec, but we also allow for a remote work environment and offer lots of paid time off.
We don't believe in micromanaging your time. After all, smart, motivated people are their own best bosses.
Keep learning. ChargeHub encourages everyone to grow professionally.
Hiring process
This is a 4 month paid internship starting in the Winter 2021 semester
Compensation based on experience
Only selected candidates will be contacted
To apply, please send us your resume
Office: The office is located in Pointe-Claire, Montreal, however a remote work environment is possible
Reporting to: Manager of Communications and Engagement
____________________________________________________________________________
ChargeHub, construit par Mogile Technologies, est à la recherche d'un stagiaire en marketing numérique qui souhaite travailler pour une marque dans une industrie en pleine croissance; dans le secteur des véhicules électriques (VE). En tant que membre de l'équipe de marketing et sous la responsabilité du directeur des communications et de l'engagement, le candidat retenu sera capable de travailler en anglais et en français, tant à l'écrit qu'à l'oral, au sein d'une équipe multifonction, dynamique et ambitieuse. Le candidat retenu a également une connaissance de base des plateformes et de la terminologie du marketing numérique.
Il s'agit d'un stage rémunéré débutant au semestre d'hiver 2022.
Ce que vous ferez :
Développer
S’assurer du bon développement et de la réussite des campagnes publicitaires pour les ventes sur les chargeurs domestiques et les produits ChargeHub.
L'analyse des résultats des campagnes publicitaires
Aider à la planification et à l'organisation des besoins en stands pour les événements.
Participer à des événements tels que le Salon du véhicule électrique de Québec
Apprendre diverses disciplines du marketing numérique : marketing d'optimisation des moteurs de recherche (SEO), marketing par courriel, médias sociaux et plus encore ;
Acquérir de l'expérience en utilisant des plateformes telles que ActiveCampaign, Shopify, OptinMonster, Instapage, WordPress et plus encore.
Restez informé des dernières tendances dans le secteur de l'EV ;
Participez aux réunions marketing hebdomadaires.
Créer des graphiques et du contenu visuel à l'aide de Canva
Analyser les résultats de diverses campagnes de marketing ;
Nous recherchons un candidat qui a :
Peut écrire, parler et travailler en français et en anglais ;
Une capacité à s'approprier les problèmes et les projets ;
De solides compétences organisationnelles, une excellente gestion du temps et l'établissement de priorités ;
Un fort accent sur le service à la clientèle et un bon avis critique ;
La passion d'apprendre constamment de nouvelles choses ;
Un esprit créatif et ouvert, une grande curiosité, un sens de l'engagement, de l'autonomie et de la polyvalence ;
Communiquer efficacement avec l'équipe ;
Qui est ChargeHub ?
ChargeHub, est une entreprise montréalaise de l'industrie des véhicules électriques. Notre mission est de simplifier l'expérience de recharge des véhicules électriques (VE) pour les conducteurs de VE en Amérique du Nord.
ChargeHub comprend une gamme de produits destinés aux consommateurs et à l'industrie, dont la populaire application ChargeHub : une application communautaire qui aide les conducteurs de véhicules électriques à surmonter l'angoisse de l'autonomie en les aidant à trouver plus de 100 000 bornes de recharge publiques au Canada et aux États-Unis. Plus d'un million de personnes ont utilisé ChargeHub pour trouver des stations de recharge et ajouter des commentaires et des photos. Les utilisateurs peuvent également voir le statut en temps réel et payer la recharge directement dans l'application, ce qui rend l'expérience de recharge simple et agréable.
Quels sont les avantages ?
Nous encourageons le bien-être avant tout. L'équipe de ChargeHub aime l'autonomie et la flexibilité. Nous avons un bureau à Pointe-Claire, au Québec, mais nous permettons également un environnement de travail à distance et offrons de nombreux congés payés.
Nous ne croyons pas à la microgestion de votre temps. Après tout, les gens intelligents et motivés sont leurs propres meilleurs patrons.
Continuez à apprendre. ChargeHub encourage chacun à se développer professionnellement.
Processus d'embauche
Il s'agit d'un stage rémunéré de 4 mois qui commence au semestre d'hiver 2021.
Rémunération en fonction de l'expérience
Seuls les candidats sélectionnés seront contactés
Pour postuler, veuillez nous envoyer votre CV.
Bureau : Le bureau est situé à Pointe-Claire, Montréal, mais un environnement de travail à distance est possible.
Relevant du : Gestionnaire des communications et de l'engagement"
