Title,Description
"ISL 21R - Network Analyst, KDC - Kamloops, BC - Indeed.com","Network Analyst – Kamloops – CISO
Information Systems R21
On November 1, 2021 the BC Public Service announced the COVID-19 Vaccination Policy that defines the conditions and expectations for BC Public Service employees regarding vaccination against COVID-19. Among other possible measures, proof of vaccination will be required by November 22, 2021. It is a term of acceptance of employment that you agree to comply with all vaccination requirements that apply to the public service. More information can be found here.
At the Liquor Distribution Branch (LDB) our vision of ‘Service. Relationships. Results.’ is all about providing a valued service, building strong relationships with our stakeholders, and achieving greater results for the province.
The LDB is one of two branches of government responsible for the cannabis and liquor industry of B.C. We operate the wholesale distribution of beverage alcohol and non-medical cannabis within the province, as well as the household retail brands of BC Liquor Stores and BC Cannabis Stores.
We employ nearly 5,000 people in over 200 communities and have hundreds of career opportunities spanning our entire wholesale, retail and corporate operations – from supply chain logistics, to high-tech solutions, and everything in between. The LDB has been named one of BC’s Top Employers 12 times over for offering exceptional places to work, flexible work hours and earned days off, extended health and dental benefits, maternity and parental leave top-up payments, a pension program, in-house professional and leadership development, and subsidies for professional accreditation.
The information technology (IT) team is highly customer focused and directly supports four distinct lines of business: retail liquor, wholesale liquor, cannabis, and corporate. These line of business IT teams are supported overall by both a Chief Information Security Officer and a Chief Technical Officer and their respective departments to ensure the organization prioritizes security and innovation.
At present the technology team consists of more than 200 full-time employees and has also adopted a multi-sourcing strategy and leverages external expertise, Cloud SaaS based services and government shared services as appropriate.
The teams integrate, maintain and enhance more than 80 business systems on a hybrid on-premises and cloud infrastructure. These include:
Merchandising and retail store systems that process 40 million plus customer transactions per year.
Wholesale, distribution and warehouse systems that enable the movement of 17 million plus cases per year.
Corporate finance systems to service an annual budget of approximately $3 billion and HR and payroll systems to service more than 5000 employees.
Reporting to the Manager, Network Engineering, the Network Analyst (NA) plan and design network communication operations and on-going enhancement of the LDB's sophisticated data and voice network communications infrastructure. The role involves leading the design, configuration, testing, installation and evaluation of network-related changes to ensure they achieve business requirements. In addition to providing Tier 2 support, the position leads the resolution of issues with external service providers. The NA works as part of a team of highly skilled specialists and collaborates with internal and external contacts to achieve objectives.
Overall, the Data Centre Operations team supports two distinct data centres, head office, three warehouses (includes server rooms), government liquor stores and cannabis stores, 2 Area Manager offices, 5000+ staff. Services are provided by a combination of internal staff and external service providers.
A criminal record check is required.
For complete details about this opportunity, including accountabilities, please refer to the attached job description, also located in the Additional Information section at the bottom of the posting.
An eligibility list for permanent or temporary future opportunities may be established.
Consider an IM/IT Career with the BC Public Service:
https://www2.gov.bc.ca/gov/content/careers-myhr/job-seekers/featured-careers/it
Jump start your Security Career
Are you interested in a career as a security professional?
Jump start your Security Career - Province of British Columbia (gov.bc.ca)
Position Requirements:
Education and Experience:
A degree or diploma in computer science or a related field, and a minimum of 1 year of recent related experience*
Or
A combination of education, training and experience may be considered, i.e., 2 years of recent, related experience* with formal course work and/or certifications.
Or
4 years of recent related experience*
Recent, related experience must have occurred in last 5 years and must include the following:
Experience with Voice Systems (Analog and / or VOIP).
Hands on experience of network systems i.e., LAN, WAN.
Preference may be given to candidates with any of the following experience:
Experience with structured cabling.
Payment Card Industry [PCI] certification.
Cisco Certified Network Associate [CCNA] or Cisco Certified Network Professional [CCNP] or other current, relevant, IT professional designation.
Experience working for an employer similar in size and scope to LDB operations (5000+ employees).
Experience with Enterprise grade LAN and WAN (Routers, Switches, Access Points such as those from Cisco, HP, Juniper etc.)
Experience in the following areas:
Load Balancers and / or DNS.
Network Virtualization (Software Defined Networks, Software Defined WAN, Cloud Networks).
VPNs and other remote access technologies.
Packet Analyser and other troubleshooting tools experience.
Monitoring and Network Optimization Tools.
How to Apply & Application Requirements:
In order to be considered for this position, your application must clearly demonstrate how you meet the education and experience as outlined in the Position Requirements section above. Applicants selected to move forward in the hiring process may be assessed on the knowledge, skills, abilities and competencies as outlined in the attached Job Description.
A cover letter is required as part of your application. The content and/or format of your cover letter may be evaluated as part of the assessment process.
Ensure your resume includes your educational accomplishments, employment history including start and end dates (month and year) of your employment, and any relevant information that relates to the job to which you are applying.
For specific position-related enquiries, please contact David Ballantyne, Manager, Network Engineering at
604 252-6222
.
Only applications submitted using the BC Public Service Recruitment System on this website will be accepted. For more information about how to create or update your profile, please refer to the attached Application Instructions or refer to the Job Application page on the MyHR website. If you are experiencing technical difficulty applying for a competition, please send an e-mail to BCPSA.Hiring.Centre@gov.bc.ca before the stated closing time, and they will respond as soon as possible to assist you.
NOTE: Applications will be accepted until 11:00pm Pacific Time on the closing date of the competition."
"QA Analyst - Mississauga, ON - Indeed.com","This position will perform system integration and test efforts, with close collaboration and support of a software development team.
Job Description:
Job Summary:
As a Quality Assurance Analyst, you will play a key role in ensuring that our software products are of high quality and meet the needs of our customers. This position will perform system integration and test efforts, with close collaboration and support of a software development team. You will develop manual and automated test cases pertinent to the product, and aid with the debugging/troubleshooting process.
Job Description:
REQUIREMENTS
BS or MS in Computer Science, software engineering or related discipline
2 years or more of software testing experience, preferably with mobile applications
Hands-on experience using MSSQL and Oracle databases and relational databases concepts
Strong written and oral communication skills, including the ability to present ideas and suggestions clearly and effectively.
Ability to work independently and as a team member
Ability to work in a fast-paced environment
1-2 years of hands-on experience with development practices and languages is desired
ASSETS
Understanding of software application code (C#, java scripting, Selenium, Visual Studio, Playwright) with the ability to write, read, and debug it
Experience in identifying high value test areas in software products
Understanding of Agile software development test practices
Experience in defining test plans, test cases and execution plans
Hands-on experience testing web, mobile and desktop applications
Hands on experience of automation frameworks and scripting languages is strongly preferred
Experience in functional and unit testing
Strong understanding of client-server architecture, three-tier application architecture and SPA architecture
Hands-on experience in validating software specifications against business requirements
Experience with common network protocols, tools such as wireshark
Experience with command line interfaces
Experience with Accessibility (WCAG) testing
Experience testing/leveraging cloud technologies
Worker Type:
Regular"
"software installation technician - Surrey, BC - Indeed.com","or equivalent experience
Specific Skills
Communicate electronically and in person with computer users experiencing difficulties to determine and document problems experienced
Provide advice and training to users in response to identified difficulties
Collect, organize and maintain a problems and solutions log for use by other technical support analysts
Supervise other technical support workers in this group
Provide business systems, network and Internet support to users in response to identified difficulties
Transportation/Travel Information
Public transportation is available
Work Conditions and Physical Capabilities
Fast-paced environment
Work under pressure
Attention to detail
Tight deadlines
Work Location Information
Relocation costs covered by employer
Computer and Technology Knowledge
Word processing software
Spreadsheet
MS Windows
Mail server software
Project management software
Software development
MS Office
Desktop applications
Personal Suitability
Accurate
Team player
Organized"
"Business Systems Analyst - Toronto, ON - Indeed.com","Business Systems Analyst
Equinix is the world’s digital infrastructure company, operating 200+ data centers across the globe and providing interconnections to all the key clouds and networks. Businesses need one place to simplify and bring together fragmented, complex infrastructure that spans private and public cloud environments. Our global platform allows customers to place infrastructure wherever they need it and connect it to everything they need to succeed.
We are a fast-growing global company with 70+ consecutive quarters of growth. Through our innovative portfolio of high-performance products and services, we have created the largest, most active global ecosystem of nearly 10,000 companies, including 1,800+ networks and 2,900+ cloud and IT service providers in over 26 countries spanning five continents.
A career at Equinix means you will collaborate on work that impacts the world and be surrounded by endless opportunities to learn new skills and grow in varied directions. We embrace diversity in thought and contribution and are committed to providing an equitable work environment that is foundational to our core values as a company and is vital to our success.
Job Summary:
Partners with Business Groups to ensure delivery of applications aligned to the business and IT strategy, as well as the support of those applications. Works with Business Groups to define their global IT requirements and to analyze appropriate solutions. Manages projects from inception to completion with matrix, global teams.
Responsibilities
Business Requirements Analysis
Perform business and systems analysis work, root cause analysis and provide forward thinking, long term technical solutions; conduct requirements gathering/analysis following Agile methodology.
A strong focus on understanding and solving for core issues in broader context, by investigating stated requirements.
Process Modeling and Design
Engage with product owners at a strategic level to frame what we need to build and how to get there.
Collaborate with user researchers to define and conduct user research to truly understand our customers and users’ goals and needs.
Work with UX designers, Business stakeholders and Engineering teams to review wireframes, prototypes to ensure UX Designs meet requirements.
Functional Design Solution
Perform impact analysis of the current business process, understand best practices, identify gaps, define future state system process flow.
Works with engineering to develop functional designs for applications, integrations with third party products and conversions.
Improves systems and processes by studying current practices and designing modifications.
Advises on solutions prepared by peers or supporting team, and champions good design practices.
Stakeholder Management
Guides stakeholders through phases of requirements definition, development, and UAT.
Interacts regularly with senior management level stakeholders and demonstrates value from realized projects.
Identify project risks, provide visibility & help mitigate risk factors.
Testing & Documentation
Contribute to the definition of user acceptance test scenarios and participate in User Acceptance testing during sprints and release preparation as needed.
Coordinates defects clarification, triage, and coordinate resolution with engineering teams.
Assists team in high-level and business-audience documentation.
Implementation Analysis
Gathers metrics to assess effectiveness of implemented solution to suggest improvements
Prepares management communications and gathers stakeholder feedback for recommendations
Analyzes adoption rates and issues and assesses business case realization and proposes solutions to improve.
Qualifications
1-3 years of experience working as a Business Systems Analyst in all phases of the software development process – including requirements gathering, design, implementation, release, and maintenance.
BS degree in Computer Science, Software Engineering, or other technical discipline or equivalent work experience is preferred.
Exhibits keen interest and experience in working with evolving business models in a large scale, complex, transformational program.
Familiarity with Order Fulfillment Systems in Telecom or Data Center Industry is preferred.
Proven experience working in Agile software development lifecycle.
Soft Skills
Exceptional problem solver who is comfortable finding and pushing solutions beyond the status quo.
Strong sense of personal ownership in the quality and effectiveness of delivered solutions.
Ability to realistically balance scope and requirements against timelines.
Capability to autonomously make effective decisions and pursue tasks based on project scope and vision.
Interest in developing an understanding of relevant technical subject matter that ensures a solid foundation for collaborating on solutions.
Ability to build relationships, influence key decision-makers, and collaborate on a cross-functional team comprised of diverse personalities, skill sets, and levels of experience.
Strong team player who can bridge gaps across Business Groups and work effectively with teams and stakeholders to establish and accomplish business objectives.
Exceptional ability to gather, organize and evaluate any information or data needed as input from stakeholders and development team to determine requirements and specifications.
Effective communicator that works well in a collaborative team setting.
Excellent written and verbal communication skills, and exceptional emotional intelligence.
At Equinix, we’re tasked with leading in the communities we serve — and doing our part to help keep our communities and our teams safe. Our #IamSafeIBelongIMatter culture transcends and informs all we do. In alignment with our culture, as well as our status as a U.S. federal contractor, as of December 8, 2021, Equinix will be mandating all US-based employees to be fully vaccinated for COVID-19. If you are unable to get a vaccine due to a medical condition, or sincerely held religious belief, Equinix will consider exemption requests as an accommodation.
Equinix is an equal opportunity employer. All applicants will receive consideration for employment without regard to race, religion, color, national origin, sex, sexual orientation, gender identity, age, status as a protected veteran, or status as a qualified individual with disability."
IT Service Desk Analyst - Ontario - Indeed.com,"We at Leggett & Platt Automotive are looking for an
IT Service Desk Analyst
to join our growing Automotive Team at our facility in
Windsor, ON
. We are a multi-billion-dollar globally diversified company that designs and manufactures various engineered components and products. Our growing automotive business unit, which exceeds one billion dollars in sales, is comprised of four main product segments with operations on three continents. Our customers include OEM and Tier 1 automotive companies.
In this role, you will report to the
IT Support Manager.
The IT Service Desk Analyst is responsible to provide Level 1 Support. This includes end user technical support for hardware and software, provide trouble shooting, monitor network performance and maintain server logs, security logs, disk space and server utilization, track user access requests, track hardware and software allocation and licensing.
What you will be doing?
Identify Incidents and Tickets, Ticket Prioritization, Providing User Support and Trouble Shooting via different
Communication Channels
Provide Level 1 Support for User Hardware and user Software Incidents
Do User Provisioning/Deprovisioning. Grant Access Rights to Applications
Installing User Hardware and User Software, maintain Software and Hardware Repositories
Fulfill Project Work in IT-Projects according to the LPA Global IT Frameworks
Maintain overall IT Documentations
We're looking for someone with:
Bachelor's Degree or equivalent experience in Computer Technology
Minimum experience of 3 years
Knowledge in IT service management
Operating systems: Server and PC
Applications: Windows Services and Server based Applications, MS Office, CAD-Systems, Communication
Systems
Analytical and trouble shooting skills
Excellent communication skills both written and verbal
Ability to work within teams based across multiple time zones
Excellent customer service skills
Willingness to take directions and work with external Service Providers
Reasons you’ll love it here:
Our company culture reflects values like integrity, ownership, and authenticity. We take these to heart, and if you do as well, you’ll fit right in."
