Title,Description
"Administrative Assistant, Monitoring & Compliance - Vancouver, BC - Indeed.com","The College of Dental Surgeons of BC (CDSBC) is the regulatory body for dentistry in BC. CDSBC’s mandate is to protect the public by ensuring that dentists, dental therapists and CDAs are registered and qualified to practise, and that they are consistently providing safe and ethical care to their patients.
Our working environment is welcoming, respectful, innovative and rewarding. We offer a competitive salary, an excellent benefits package (including RRSP, monthly transit contribution, extended health and dental benefits), a professional development allowance, and encourage reasonable work-life balance.
Our values, which demonstrate trustworthiness and promote professional excellence, include being: ethical, open and transparent; respectful and courteous; inclusive and embracing the principles of diversity, cultural safety and humility; and patient-centred and engaged with the public.
We are seeking an experienced administrative assistant to join our Monitoring & Compliance team as the Administrative Assistant, Monitoring & Compliance. The successful candidate will be one of five members of the Monitoring & Compliance team and will report to the Manager, Monitoring and Compliance.
If you enjoy a respectful and warm working environment, where teamwork is our ethos, this may be the position for you. The goal is to maintain a strong interdependent team, working together collegially to support the College delivering on its mandate and protect the public by effectively regulating registrants.
Position Accountabilities
Monitoring
Receive, process, distribute, log and acknowledge incoming department mail, email and records using Microsoft Dynamics CRM software, SharePoint, shared drives and physical paper files.
Open new monitoring files in CRM/SharePoint, update relevant spreadsheets.
Manage ‘bring forward’ system to track the receipt of required responses and prepare request and reminder letters as needed.
Draft letters/emails or respond by telephone to incoming enquires.
Arrange teleconferences, in-office and virtual meetings, including preparing supporting documents and setting up meeting rooms.
Liaise with mentors and registrants regarding reports, fee requests/invoices and payments.
Keep the Remedial Education Account up to date and log mentorship monies to be held on account.
Draft letters for chart review process, to request Insurance Statements/Information for patient selection and to request patient records.
Check patient records received from registrant to ensure completeness of records being received. Request balance information if required.
Log patient records electronically in CRM/SharePoint. Digitize incoming patient records, analog radiographs and study models.
Assist in organizing all information for chart reviews to be sent to Directed Education Monitors.
Maintain appropriate documentation and notes over the life of the file.
Close monitoring files and return records / documents to registrants as required.
Assist with administrative-related tasks for files referred to Inquiry Committee Panels and discipline hearings as required.
Health & Wellness
Open health files in CRM/SharePoint.
Review and log monthly and 6-monthly monitoring reports and Soberlink reports received from monitoring service providers.
Acknowledge and request reports from physicians and monitoring companies and provide copies to registrants.
Manage bring forward system and update health-related spreadsheets.
Close file once monitoring is no longer required.
Other Accountabilities
Provide reception back-up.
Other administrative duties as required.
Order catering for meetings as needed.
Qualifications & Skills
Minimum of 2 years of office experience.
Excellent computer skill with proficiency in Microsoft Office.
Ability to maintain tact, grace, and diplomacy in all situations.
Ability to handle sensitive and confidential information with discretion.
Strong written and verbal communication skills.
Strong organization skills with the ability to multi-task , prioritize, and work independently.
Strong attention to detail.
Strong clerical and administrative skills.
Experience using a database or customer relations management system and electronic filing system is an asset.
Previous work experience in a regulatory or not-for-profit environment would be an asset.
Must be legally eligible to work in Canada for any employer.
Our office is located on the west side of Vancouver. Due to the pandemic, the majority of our team are currently working remotely from home, however, this role will be expected to work from the office 1-2 days per week since it requires the day-to-day management of monitoring files for the Monitoring and Compliance team. We will continue to evolve and adjust our policies and health & safety measures as required by the Provincial Health Officer.
Candidates are advised that CDSBC is actively pursuing amalgamation with three other regulators with the intent of forming a single oral health professions regulator. We anticipate that this amalgamation will bring new and exciting opportunities for all staff.
How to Apply
If you are seeking a fast-paced work environment that is welcoming, respectful, and collaborative, we invite you to submit your cover letter and resume by email with “Administrative Assistant” in the subject line. For more information about this and other roles, please visit www.cdsbc.org.
Applications will be accepted until November 29, 2021.
We are conducting interviews virtually by video or telephone conferencing to support physical distancing, per the guidance of the Provincial Health Officer.
We thank all applicants for their interest; however, only those candidates selected for an interview will be contacted. No phone calls, no recruiters, please.
Reference ID: Administrative Assistant
Application deadline: 2021-11-29
Job Types: Full-time, Permanent
Benefits:
Casual dress
Dental care
Disability insurance
Employee assistance program
Extended health care
Life insurance
Paid time off
Vision care
Work from home
Schedule:
8 hour shift
Monday to Friday
No weekends
COVID-19 considerations:
We are conducting interviews virtually by video or telephone conferencing to support physical distancing, per the guidance of the Provincial Health Officer.
Experience:
Office: 2 years (preferred)"
"Child Care Worker, Full Time - Toronto, ON - Indeed.com","JOB OPPORTUNITY
Child Care Worker, Full time
Youthdale Treatment Centres is a fully accredited Children’s Mental Health organization with a mission to provide children, adolescents and their care-givers access to the best available psychiatric care and support, restoring hope, and helping individuals reach their full potential.
Youthdale is looking to fill the position of a Full Time Child Care Worker to join the 635 Huron Live-In treatment program. The Child Care Worker’s primary responsibility is to provide direct, quality client care and supervision to clients in the Live-In treatment program. The Child Care Worker must provide adequate coverage for the house at all times and be fully responsible for ensuring the client’s emotional and physical safety at all times and must stay on shift if the need arises.
*
Reports to: 635 Huron Live-in Treatment Supervisor*
Status: Full Time Permanent
Compensation: $37,949.74 per annum
Hours of work: 44 hours per week
*Overnight responsibilities will be compensated financially on the basis of a set fee. Overnight pay is in addition to the regular working time*
Job Responsibilities
Provide direct client care and supervision to clients in the live-in treatment program.
Responsible for working within the therapeutic team of the staff, supervisor, director and psychiatric consultant in making treatment plans for and with the clients and ensuring these plans are carried out on a day-to-day basis.
Assess and understand client mental health needs through a developmental and trauma informed lens and formulate methods of intervention.
Responsible for writing clients progress reports and ensure that clients records are maintained as per agency standards and in accordance with privacy policies and legislation.
Develop, implement, evaluate and fully participate in life skills and recreational programming, where necessary.
Carry out the structure and routine of the house and ensure all clients receive a high standard of care and therapeutic intervention.
Effectively utilize communication systems to convey client and program related information.
Responsible at shift change for communicating verbally as well as in the written log any significant and pertinent information regarding each client.
Responsible for all shopping for food, cooking, laundry, general cleanliness, clothes shopping, and minor repairs in the house. Also responsible for daily school contact and all doctors’, dentists’ appointments, etc.
Assist with meal preparation as required.
Represent the Agency in a professional manner when dealing with families, external professionals, general public and community partners.
Participate actively in team meetings, ongoing training and supervision sessions on a regular basis.
Work safely in compliance with the Occupational Health and Safety Act and the Agency Health and Safety Manual.
Safe preparation and administration of prescription medications.
Perform other duties as required.
*
Qualifications*
Must have degree or diploma in child and youth work or equivalent.
One-year experience in a residential setting is preferred.
Demonstrated knowledge and experience with at risk adolescents and young adults.
Understanding of the complex issues facing our clients.
Sensitivity to and ability to work with a diverse client and staff group.
Ability to exercise professionalism and sound judgement in conflictual and stressful situations.
Ability to work independently and effectively as part of a multi-disciplinary team.
Ability to resolve issues with supervisors and co-workers in a manner that is respectful and cooperative in accordance with the agency culture and philosophy.
Excellent interpersonal and conflict resolution skills.
Excellent communication skills – verbal and written.
Strong administrative and organizational skills.
First Aid/CPR certification preferred.
Completion of SMG training preferred.
Valid G License and will be required to obtain F Class License within 6 months.
Work Schedule - flexible hours within a rotating schedule, including days, nights and weekends.
*As a condition of employment, the successful candidate will have to abide by the Agency’s Vaccination and IPAC policy.*
About Youthdale Treatment Centres
Youthdale (
www.youthdale.ca
) provides comprehensive, integrated mental health services to children and their families, connecting them with the right programs and services, both at Youthdale and in their communities. We meet the complex needs of children and youth with a team of highly skilled and dedicated psychiatrists, psychologists, neurologists and neuropsychologists, social workers, nurses, and child and youth workers.
Application
At Youthdale, we are committed to fostering an inclusive and accessible environment. We are dedicated to building a workforce that reflects the diversity of the community in which we live and serve. Youthdale is committed to providing accommodation in all parts of the hiring process. If you require an accommodation, we will work with you to meet your needs.
Please submit your cover letter, with an updated resume by
November 24, 2021.
Job Type: Full-time"
"Associate Dentist - Victoria Dental Arts - Belleville, ON - Indeed.com","About us:
Conveniently located off Pinnacle Street on Victoria Avenue, dentalhouse – Victoria Dental Arts has been serving the Belleville community for many years. We are flexible to every family's lifestyle and will always take the time to offer our patients comprehensive care through our wide range of services, including preventative hygiene, general and cosmetic dentistry, oral surgery, Invisalign, periodontics, and much more.
Our team, led by Dr. Jacob Kim and Dr. Andrei Zaharia, provides quality dental care and 4.8 stars on Google reviews, evidence of our exceptional patient service, commitment to continuous learning, and innovative technology.
Additionally, through working within the dentalcorp network, you will have the opportunity to work alongside and learn from some of the industry's leading clinicians and have greater access to advanced treatment technologies, and training & development, and support.
https://www.dentalhousebelleville.ca/site/home
Services Schedule: Saturdays, 8am to 4pm
The opportunity:
We are currently looking for an Associate Dentist to provide services, on an independent contractor basis, to our busy and well-established practice. The successful individual will have a passion for building strong patient relationships and contributing to the ongoing oral health of their community. As an independent contractor at our practice, you will work with a strong group of dental professionals, with access to a variety of learning opportunities and industry-leading continuing education.
Why Should You Join?
Professional development
: You will have the support, tools, and encouragement you need to grow and evolve as a professional on your individual career path, including access to industry-leading continuing education through the award-winning DC Institute (dcinstitute.ca).
Competitive service fees
: Our service fees packages are reviewed annually in a comparative study that ensures alignment with industry standards.
Established and stable practice:
Our successful practice is a leader in patient care, providing a range of services to a loyal and established patient base.
Health & Safety and Compliance
: The practice has a strong health and safety culture, with compliance measures embedded in every aspect of the workplace.
Network of experienced dental professionals
: You will have opportunities for formal and structured mentorship with esteemed team members and colleagues and access to industry-leading experts in various dental disciplines.
Team-oriented:
When you join our practice, you join a team of supportive and like-minded professionals working together to achieve common goals that are understood and shared by all.
Respect for our people
: The team is built on a culture of respect and positivity, where we celebrate individuality and value each other's unique strengths and contributions.
Work-life flexibility
: Everyone has a life outside the practice, and we are committed to helping each team member find a healthy, sustainable balance between home and career.
About You:
Graduate from an accredited DDS/DMD Program or successful completion of the National Dental Examining Board of Canada (NDEB) Equivalency Process
Registered, licensed and in good standing with the Royal College of Dental Surgeons of Ontario (R.C.D.S.O)
Valid CPR certification
Independent contractors must be domiciled in Canada. We thank all independent contractors, but only suitable independent contractors will be contacted. Independent contractors with a disability who require reasonable accommodation for any part of the application process and thereafter can contact our Talent Team at
416-558-3883
. Reasonable accommodations will be determined on a case-by-case basis and your request will be responded to as soon as possible
."
"Product Designer (UI/UX) - Burlington, ON - Indeed.com","About Us
At Port 443 we work together, laugh together, and eat a lot of donuts together. (Have you seen our Instagram? It’s basically a food blog.) Our products (My Music Staff, TutorBird & AthletaDesk) are always evolving, making for an exciting and dynamic environment. Every day, we’re connecting with thousands of users all around the world. If you ask what they love about us, they’ll tell you that we really listen to their needs and go above and beyond to help them. Our members are at the heart of everything we do. Their feedback and ideas help to shape our products, and at the end of the day, we’re here because of them…
…and because of the donuts.
About You
You’re a curious and empathetic person who can put yourself into the shoes of our users and think of creative solutions that meet their needs. You’re a team player (don’t worry, we also hate that phrase and we promise not to use it again) who loves to collaborate with members of other departments to get things done – get ready to become fast friends with the front-end team! You’re flexible and always ready to hit the ground running, figuratively and literally – we’ve got a treadmill desk at the office! You’re a strong communicator who can translate from member-speak to developer-speak and back again. You love to dive deep into data and user insights and could run user testing all day (but don’t worry, you won’t be!). You’ve got a good sense of humour – feel free to tell us your most groan-worthy G-rated joke in your job application for bonus points (And you don’t mind that we still use the emoji even though apparently it’s not cool anymore!)
You’ve got:
Diploma or degree in UX Design, Graphic Design, Software Development or related field
3+ years experience working as a product designer, UX/UI designer or interaction designer
A customer-centric mindset
Familiarity with how designs are affected and constrained by the limitations of programming
Proficiency with current design tools such as Figma and Hotjar
Comfortable/proficient in creating and maintaining design systems on Figma using libraries and components
Strong verbal and written communication skills
Ideas! We want someone who’s excited to share their thoughts and suggestions with the team
Basic marketing/branding knowledge is a plus
Your responsibilities will include:
Conducting research, such as user interviews and user testing, to understand user needs
Turning concepts into deliverables: wireframes, user stories, user journeys, and mockups
Designing user interfaces using industry best practices
Presenting design ideas to cross-functional teams and senior leadership
Communicating your designs to developers in a clear and comprehensive manner, and addressing any of their concerns
Meet the Team!
Maram
is our Product Designer with an eye for UI (and yes, that was an intentional rhyme)! She brings a wealth of global experience to the team – and a wealth of laughs around the lunch table She’s passionate about everything she does, whether she’s working through an idea for how to improve a feature, or recommending a horror movie to her coworkers An avid explorer with dreams to go on a US cross-country road trip, ask her about her favourite places she’s travelled to!
Nicolas
is a member of the front-end development team – we have a Vick and a Nick, so our next hire will have to be a Rick! He’s focused on programming the logic that goes along with the design… and fixing the third-party text editor again when we find another bug. He’s competitive (just try to beat him in Super Smash Bros) and loves to travel! Ask him about the best ramen he had in Tokyo
Shannon
is one of our fantastic front-end developers whose curiosity and creativity make her a joy to work with! A lover of music, she’s a secret karaoke master who’d love to learn to play ukulele someday. By day, she’s hard at work helping the team take our products to the next level, but by night she loves to go home, unwind, and enjoy some delicious comfort food. (Her preference? Pierogies )
Vick
is our Star Wars enthusiast and diehard fan of Toronto-based sportball teams! As a member of the front-end development team, he’s focused on making sure that what our users see actually looks and works like it’s supposed to. In his spare time, Vick can be found watching hockey, playing hockey (NHL game series or good ol’ fashioned street hockey), reading books about hockey… look, he really likes hockey okay?!
Other Perks/Benefits
Free snacks and coffee – are you Team Hazelnut or Team Regular?
Last Friday of the Month Lunch – vote for a new lunch spot every month, and watch as your coworkers get in heated debates over burritos vs burgers
Company social events throughout the year – significant others welcome!
Cool company swag when we reach milestones – check our IG to see some of our past swag
Comprehensive health benefits plan – now you can stop putting off that dentist appointment!
When you come to work at Port 443, you’re joining a team that balances innovation, excellence, and fun. If this sounds like the perfect fit for you, we want to hear why!
To let us know why this job posting speaks to you and what you can bring to the table, send your cover letter, resume, and favourite donut flavour to
careers@port443.io"
"Dental Administrator - Lorette Dental Care - Winnipeg, MB - Indeed.com","About us:
Just a short drive from Downtown Winnipeg, Avant Dental Care has been serving the Lorette community for many years. Our team is professional and dedicated, specializing in Invisalign, dental implants, gum reshaping, cosmetic reshaping and much more. Dr. Bao-Tran Nguyen and Dr. Nathan Jeal have extensive experience in dentistry and are passionately dedicated to continuing education, regularly attending courses and earning certifications to ensure they provide the most up-to-date care.
We pride ourselves on providing quality dental care and our excellent google reviews, evidence of our exceptional patient service, commitment to continuous learning and innovative technology.
Additionally, through working within the dentalcorp network, you will have the opportunity to work alongside and learn from some of the industry's leading clinicians and have greater access to the advanced treatment technologies and training & development, and support.
http://avantdental.com/dentist-lorette-manitoba/
Schedule: Full Time
The opportunity:
We are currently looking to hire a Dental Administrator to join our busy and well-established practice. As part of the administration team, you are the face of our practice. The successful candidate will have a passion for building strong patient relationships and contributing to the ongoing oral health of their community. In this role, you will have the opportunity to work alongside and learn from a strong team of dental professionals.
Why Should You Join?
Competitive compensation & benefits
: Our compensation packages are reviewed annually in a comparative study that ensures alignment with industry standards.
Established and stable practice:
Our successful practice is a leader in patient care, providing a range of services to a loyal and established patient base.
Health & Safety and Compliance
: The practice has a strong health and safety culture, with compliance measures embedded in every aspect of the workplace.
Career development
: A career with us ensures you have the support, tools, and encouragement you need to grow and evolve as a professional on your individual career path, including access to industry-leading continuing education through the award-winning DC Institute (dcinstitute.ca)
Fast-growing and entrepreneurial environment:
Our practice is innovative, growth-oriented, and patient-focused – a combination that makes for a fast-paced, exciting, entrepreneurial atmosphere.
Respect for our people
: The team is built on a culture of respect and positivity, where we celebrate individuality and value each other's unique strengths and contributions.
Work-life flexibility
: Everyone has a life outside the practice, and we are committed to helping each team member find a healthy, sustainable balance between home and career.
Responsibilities:
Greet and assist patients as they arrive; ensure a lasting positive impression for them
Responsible for optimizing the appointment schedule by ensuring the day is full, with limited gaps
Effectively manage recall system and accurately maintain patient database
Manage patient calls and inquiries about appointments, confirmations, amendments and cancellations
Process referral letters and other patient correspondence upon receipt from provider; manage and file all patient records and charts
About You:
Minimum 1 year of administration experience
Clinical background and experience with dental software programs considered an asset
dentalcorp Total Rewards + Perks
Team members have access to a range of resources focused on enhancing their personal and professional lives. We provide annual compensation reviews, voluntary RRSP contributions, and industry-leading learning and development opportunities. Our team members also enjoy extensive discounts on many services and activities including an exclusive corporate gym membership program; reduced rates on home and auto insurance; and unlimited access to a variety of discounted entertainment, hotels, products and services. Our Employee and Family Assistance Program (EFAP) connects team members and their families with complimentary, confidential, short-term counseling and advisory services. dentalcorp is continuously evolving and enhancing the programs to offer our team members exclusive benefits that complement their lifestyle.
Candidates must be legally eligible to work in Canada. We thank all applicants, but only suitable applicants will be contacted. Job applicants with a disability who require reasonable accommodation for any part of the application or hiring process can contact our Talent Team at
416-558-8338
. Reasonable accommodations will be determined on a case-by-case basis and your request will be responded to as soon as possible."
