Title,Description
"Dental Receptionist - Thornhill, ON - Indeed.com","You will be working in a fast-paced, fun and friendly environment where we prioritize excellent customer service and positive energy. We're looking for a well-rounded individual with a passion for helping people and strong communication skills. Dental Receptionists provide administrative support and oversee the scheduling and coordination of dental appointments. Candidates should possess exceptional customer service skills and previous experience in a dental office environment.
Responsibilities:
Answer and direct phone calls.
Greet patients and visitors.
Answer questions and provide information to callers and visitors about the practice and procedures.
Generate new patient appointments.
Assist dentist with administrative work.
Assist with sterilization of instruments.
Qualifications:
Friendly, sociable, and strong English skills are a must
Ability to work in a faced-paced environment is a must
Dental or medical receptionist experience (preferred)
Experience using dental office management software (ClearDent preferred)
Ability to speak Farsi (preferred)
Job Types: Full-time, Part-time
Salary: $14.25-$18.00 per hour
COVID-19 considerations:
All patients must wear masks, and staff wear appropriate PPE. Surfaces are cleaned with disinfectant wipes regularly and all equipment and tools are sterilized/autoclaved after each use.
Work remotely:
No"
