Title,Description
"Content Marketing Intern - Oakville, ON - Indeed.com","Who we are:
Geotab is a global leader in IoT and connected transportation and certified “Great Place to Work.” We are a company of diverse and talented individuals who work together to help businesses grow and succeed, and increase the safety and sustainability of our communities.
Geotab is advancing security, connecting commercial vehicles to the internet and providing web-based analytics to help customers better manage their fleets. Geotab’s open platform and Marketplace, offering hundreds of third-party solution options, allows both small and large businesses to automate operations by integrating vehicle data with their other data assets. Processing billions of data points a day, Geotab leverages data analytics and machine learning to improve productivity, optimize fleets through the reduction of fuel consumption, enhance driver safety and achieve strong compliance to regulatory changes.
Our team is growing and we’re looking for people who follow their passion, think differently and want to make an impact. Ours is a fast paced, ever changing environment. Geotabbers accept that challenge and are willing to take on new tasks and activities - ones that may not always be described in the initial job description. Join us for a fulfilling career with opportunities to innovate, great benefits, and our fun and inclusive work culture. Reach your full potential with Geotab. To see what it’s like to be a Geotabber, check out our blog and follow us @InsideGeotab on Instagram, Twitter or Facebook.
At Geotab, all staff must be fully vaccinated in order to be eligible to work in our North American offices at this time. Accordingly, any job offer for an onsite position resulting from this posting will be conditional upon the successful candidate providing evidence of full vaccination. Accommodations may be made for those who cannot be vaccinated based on medical or other legally protected grounds.
Geotab policies and requirements are subject to change based on local or federal guidelines.
Who you are:
We are looking for amazing talent who can contribute to our efforts and deliver results! Geotab is seeking an intern who will immediately contribute to the organization and the Marketing Team efforts. If you love technology, are interested in content writing, are well organized and keen to join an industry leader — we would love to hear from you!
What you'll do:
As a Content Marketing Intern, your key areas of responsibility will be producing, creating and researching relevant content related to telematics, IoT, connected vehicles, smart cities and all other relevant topics to Geotab. You will also be helping administer and update key content deadlines. You will need to work closely with additional writers on the Marketing team, Sales and Marketplace departments, as well as technical subject matter experts at Geotab. To be successful in this role, you will be a self-starter with strong written and verbal communication skills. In addition, the successful candidate will have the ability to develop effective solutions, have strong attention to detail, and is able to meet deadlines while working under pressure.
How you'll make an impact:
Support the content marketing team with various projects, including keeping track of content calendar completion rates and follow ups, as well as developing flowchart diagrams to illustrate new process
Help edit and write content on an as needed basis for the Geotab blog, case studies, white papers and other content types
Help co-ordinate blog post updates and act as liaison between Content Team and Geotab's subject matter experts and other Marketing team members
Work with management to ensure that content delivery is on schedule
Generate and help execute on new ideas for promoting Geotab's thought leadership content on social media
Help carry out promotional activities for newly published content pieces
Schedule and publish content on an as needed basis using our content management system
Ability to create and coordinate email blasts on an as needed basis
What you'll bring to this role:
Please Note: Start date is Jan 2022. This is an 8-12 month internship opportunity.
University student studying Business - Marketing, Communications, Journalism, English, or related
Strong skill, interest and passion in content writing
Strong attention to detail and a keen sense of design
Team-player, flexible and adaptable
Must be highly organized with the proven ability to multitask
#LI-DNI
Why job seekers choose Geotab:
Work from home and flex work arrangements
Baby bonus
Home office reimbursement program
Online learning and networking opportunities
Electric vehicle purchase incentive program
Competitive medical and dental benefits (full-time employees only)
Retirement savings program (full-time employees only)
How we work:
At Geotab, we understand that the world is always changing and that we need to change with it. Geotab has adopted a hybrid model for working, including a flexible work from home program, with the opportunity to work in our safe, clean offices. When working from home, you are required to have a reliable internet connection with at least 50mb DL/10mb UL. Virtual work is supported with cloud-based applications, collaboration tools and asynchronous working. The health and safety of employees are a top priority. We encourage work-life balance and keep the Geotab culture going strong with online social events, chat rooms and gatherings. Join us and help reshape the future of technology!
We believe that ensuring diversity is fundamental to our future growth and progress and is an integral part of our business. We believe that success happens where new ideas can flourish – in an environment that is rich in diversity and a place where people from various backgrounds can work together. Geotab encourages applications from all qualified individuals. We are committed to accommodating people with disabilities during the recruitment and assessment processes and when people are hired. We will ensure the accessibility needs of employees with disabilities are taken into account as part of performance management, career development, training and redeployment processes. If you require accommodation at any stage of the application process or want more information about our diversity and inclusion as well as accommodation policies and practices, please contact us at careers@geotab.com. Click here to learn more about what happens with your personal data."
Digital Project Manager - Remote - Indeed.com,"Break it down. Build it up.
What You'll Do
You didn’t just organize Halloween candy by color, size, and overall brand sentiment — you convinced your friends to adopt your organizational schema. Today, you bring your big-picture thinking, and talents to the internet.
Kalamuna is seeking an agile project manager to lead and manage both website redesigns and retainer-based, strategic growth programs for mission-driven organizations. You should be familiar with content management systems (CMS), as most of our projects are in Drupal or WordPress, though not exclusively. We work in enterprise ecosystems and run sophisticated research and development projects too.
From Discovery to Design, and right through to Implementation and Post-launch you'll balance schedule, scope, and budget. You’ll be the connector between and across our cross-functional teams, and with our client partners and internally. You’ll also play a hand in planning team assignments across the organization that promote work-life balance, and work closely with other account and project managers to continue building a sustainable practice.
Candidates for this full-time (32-40h/wk) remote position must reside in the US or Canada. If you’re a recruiter or agency, please don’t contact us.
Qualifications
Agency experience with a proven track record managing CMS projects
2+ years of agile experience, including scrum and kanban
Ability to work in a distributed, remote team
Ability to manage concurrent emerging needs balanced against higher level priorities
Proficiency with JIRA + comfort with its reporting capabilities
Understanding of content strategy, UX, and development roles + relationships
Experience working with developers, designers, and clients
Ability to facilitate estimation practices, and measure progress against them
Experience owning project budget and accuracy of project hours for accurate client billing
Exceptional people skills
Clear, concise communication
Experience writing actionable tickets
Experience producing documentation for internal teams and client stakeholders
Ability to recognize changes in scope and act accordingly
Thorough attention to detail in providing UAT/QA support
Bonus points
Advanced JIRA/Confluence management
Higher education and/or nonprofit experience
Account management experience
Public speaking and community engagement
Analytics and Digital Marketing Strategy experience
Experience in digital accessibility
Working With Us
People are at the of everything we do.
Kalamuna is driven by a civic spirit to help socially impactful institutions, nonprofits, and governments better communicate with constituents and do right by the people they serve. We bring digital communications to life for organizations as varied as Fair Trade USA, GreenBiz, the American Foundation for the Blind, the Environmental Defence Fund, the Smithsonian, UC Berkeley, Stanford, and the Fine Arts Museums of San Francisco.
Kalamuna’s mission is to empower our clients with the research, strategy, design, and technology that will transform their organizations to better serve the needs of their audiences and communities. Kalamuna aligns itself in this manner to make each of our client’s missions our mission. We seek to be impactful, not only for our clients and partners but for the social good of our communities.
We’re committed to your excellence and continued development; we’re in this together. Kalamuna offers many benefits, including paid holidays, PTO, paid bereavement leave, parental leave, health insurance, long and short-term disability, a continued learning & travel stipend, an equipment fund, and retirement funds with 3% match. We offer flexibility in work hours and accomodations. When pandemic-free, we organize company-wide gatherings like team building workshops, conferencing, and additional fun.
We’re looking for individuals with a broad range of interests and experiences to be their authentic selves. Your story, your passion is what interests us most. Meet some of our team at https://youtu.be/K1rtt6oKGEs.
Commitment to Diversity
Kalamuna is committed to eradicating institutional discrimination and bias and to uplifting the lived experiences of all minorities.
As such, Kalamuna welcomes applications from all backgrounds, particularly from people of color; women; LGBTQ2S+ people; immigrants or refugees; people who are differently-abled; and people from low- or moderate-income backgrounds. Kalamuna is an equal opportunity, affirmative action employer and does not discriminate in its employment decisions on the basis of race, creed, color, ethnicity, national origin, religion, sex, sexual orientation, gender expression, age, height, weight, disability status, veteran status, military obligations, marital status and policy party affiliation, or on any other basis that complies with applicable laws.
If you’re a recruiter or agency, please don’t contact us. No exceptions.
TWyy6oubCF"
"Marketing Specialist - Toronto, ON - Indeed.com","This role will involve developing and managing marketing efforts and communications for Synaptop. This role will cover a wide range of duties, including maintaining digital media accounts, integrating video and text marketing efforts, advertising, blogging, and vlogging. Speaking a language other than English is considered an asset.
Requirements:
The ideal candidate will have a minimum of a Bachelor’s degree in Commerce, Business, Marketing, or the equivalent. They will have 2-5 years work experience in a similar position. They will also have experience with web analytics, content management systems, marketing automation platforms, running digital media campaigns, blogging, and advertising. The candidate must be able to work independently in a fast-paced environment as well as being a team player.
The candidate must also have:
Strong written and verbal communication skills
Exceptional creativity skills
Strong research and analytical skills
Strong Customer Service skills
Ability to multi-task, be organized, and detail oriented
Highly motivated, with a pro-active approach to their work
Ability to travel if required
Bonus:
Experience with MS Office applications, Adobe Creative Cloud Suite, specifically in Adobe InDesign, Photoshop, Illustrator, After Effects, Fireworks, Quark, and Filemaker Pro.
Experience with SEO
Icon, Illustration, and/or print design experience"
"Junior Marketing Specialist - Calgary, AB - Indeed.com","Company description
RV SnapPad, The World's Only Permanent Jack Pad. We sell motorhome accessories direct-to-consumer and to large distributor accounts. Our company is expanding rapidly in the United States and we are now starting to sell in the Canadian market.
Job description
The Junior Marketing Specialist will assist in all aspects of the marketing, graphics, web development and data management departments.
They will be expected to perform basic tasks within our standard apps and software, including G Suite, Adobe, WordPress, Shopify, and many more. Following their introduction to these tools, the Digital Marketing Specialist is expected to find ways of improving, optimizing and implementing meaningful changes across their various touchpoints.
The Junior Marketing Specialist may also be asked to perform other duties outside of marketing, including logistical management, product management, and shipping/delivery.
Core Competencies
Graphic Design
Print Media Development
Web Design & Development
Spreadsheet Management
Asset Management
Good Communicator
Open & Eager to Learn
Bonus Points for Video Editing and Social Media Management Skills
Job Duties
Graphic Design across digital and print mediums. Creation of digital assets, which will be the property of RV SnapPad.
Assistance with management of web properties. Implementing changes on Shopify & WordPress backends. Occasional work within landing page builders (Unbounce).
Creation, management and collaboration in spreadsheets. Using formulas to parse data and create visualizations.
Assistance with data management in Project Management Software (Podio), asset management within Google Drive and making further improvements to folder structures.
Learn about logistics for DTC brands, including ordering, fulfillment and shipping of product.
Communicate within our team chat software Slack. Be available to chat between 9am - 1pm.
Work within social media platforms, including Facebook and Youtube.
Work Conditions
Be expected to show up in person during the 3-month internship period. Remote work can be more flexible if full-time employment is offered.
Work 40 hour weeks, Monday to Friday, 9 am - 4 pm.
Bring your own computer, mouse, keyboard.
Expected start date: 2021-12-15
Job Types: Full-time, Internship, Permanent
Salary: $18.00 per hour
Benefits:
Flexible schedule
Work from home
Schedule:
8 hour shift
Monday to Friday
COVID-19 considerations:
All staff members are fully vaccinated. Staff are encouraged to wear masks around the office if they so choose.
Work remotely:
No"
"Marketing Coordinator - Toronto, ON - Indeed.com","With over 30,000 members, Restaurants Canada is Canada’s largest national, not-for-profit membership association, advocating, connecting and supporting the country’s diverse and dynamic foodservice industry through member programs, research, advocacy, resources and events.
Reporting to the Director, Marketing and Communications, as Marketing Coordinator, you will play an important role in the development and implementation of day-to-day marketing activities and content, supporting the marketing team in the development and execution of brand activities and performing critical tasks that support our growth agenda. This includes working and collaborating cross functionally with internal and external stakeholders to manage the end-to-end lifecycle of new and ongoing marketing, sponsorship, media and communication projects while developing and implementing process efficiencies to help our team deliver.
This is a great opportunity to take your marketing career to the next level and build your network with many of the largest foodservice and hospitality brands in Canada.
As a key contributor, and one of the main points of contact on the Marketing and Communications team, in this role, you will:
Support and help to direct all marketing activities including (but not limited to) internal and external promotions, advertising, media production, branding, public relations and social media
Attend briefings, contribute in brainstorms and client pitches, and help to develop and maintain successful marketing campaigns
Traffic all internal and external advertising efforts to appropriate marketing and advertising channels based upon plan
Intake insertion orders, creative briefs and marketing plans, organize requirements, and assist in building accurate and aid in the development of realistic workback schedules
Communicate campaign objectives, timelines, and deliverables to sales team, and provide instructions for use or promotion
Analyze and evaluate the effectiveness of projects and campaigns and provide detailed KPI based “post mortem” reports
Provide support on the administration of contracts and agreements
Regularly provide updates and reports on various marketing activities
Assist with maintenance of Restaurants Canada’s website properties with responsibilities such as general upkeep, trafficking media and content, and tracking analytics
Provide daily support on all aspects of marketing and communications as directed by the Director, Marketing and Communications
SKILLS AND QUALIFICATIONS
Degree or Diploma in Marketing/Media/Communications or related field
1-2 years of experience in the marketing, communication and/or sales field
High degree of written and verbal communication skills
Excellent time management and organizational skills
Exceptional internal and external relationship management capabilities
Excellent knowledge of MS Word, Excel, MS Project, and PowerPoint
Experience with online advertising, social media marketing, search engine marketing (SEM), and search engine optimization (SEO/Google Analytics)
Hands-on experience with Adobe Creative Suite (Photoshop, Illustrator, InDesign) or digital asset design ability (ie Canva) an asset
Working knowledge of HTML and CSS coding is not required but an asset
Job Types: Full-time, Permanent
Schedule:
Monday to Friday
COVID-19 considerations:
As a hybrid role, the successful candidate will be required at the Restaurants Canada office and/or congregate settings from time to time, therefore this position requires the candidate to be fully vaccinated for COVID-19 per current Public Health Agency
Ability to commute/relocate:
Toronto, ON: reliably commute or plan to relocate before starting work (preferred)
Experience:
marketing: 1 year (preferred)
Work remotely:
Temporarily due to COVID-19"
"Videographer and Digital Media Assistant - Toronto, ON - Indeed.com","Part Time - Flexible Schedule 15-20 hours per week
*
Chai Lifeline Canada is looking for a passionate and enthusiastic Videographer and Digital Media Assistant to photograph, film and edit videos for various events and programs for our digital media presence on our social media platforms. The ideal candidate is media savvy and able to produce engaging content that appeals to a wide audience. They are currently attending, or have completed, film school or a related program and have a broad interest in marketing and social media.
*
*
The successful candidate should have the appropriate equipment to capture and edit footage.
*
*
Our Core Values A job at Chai Lifeline Canada is being a part of a team that is dedicated to integrity and mutual respect for one another. We provide care and love to our families in need and in doing so, we work beyond our roles by showing empathy, dedication and humility at every turn.
*
*
Responsibilities for this position include but are not limited to:
Create and edit short videos for our social channels and website
Creatively select audio visual effects and music for videos
Photograph clients, staff and volunteers as needed
Keep up to date on current trends online
Attend events and programs to capture clients, staff and volunteers
Collaborate with departments to produce quality podcasts on an as needed basis
Understand, reflect and enhance organizations ‘voice’
Creative design and direction
*
*
Key Requirements for this role are as follows:
Creative and passionate
1+ year in videography and photography is an asset
Experience in producing podcasts is an asset
Proficient in editing software such as Adobe Premiere Pro or Final Cut Pro
Excellent communication and interpersonal skills with a focus on customer service
Ability to work independently, comfortable in being self-directed
Skilled at collaborating with several teams
Experience in creative design and direction would be advantageous in this role
*
*
Personal traits:
Highly organized and able to multitask efficiently
Outgoing, energetic and positive
Reliable, trustworthy
Flexible and results-oriented
A confident, clear and succinct communicator
Able to work independently, driven and self-motivated
Please note, only applicants selected for an interview will be contacted.
Chai Lifeline Canada is committed to inclusive and accessible recruitment practices to applicants with accessibility needs in accordance with the Ontario Human Rights Code and the Accessibility for Ontarians with Disability Act (AODA). Reasonable accommodations are available on request for candidates with disabilities taking part in all aspects of the selection process.
To learn more about Chai Lifeline Canada please visit our website www.chailifelinecanada.org
*
Part-time hours: 15-20 per week
Job Types: Part-time, Permanent
Schedule:
Monday to Friday
Weekend availability
COVID-19 considerations:
We ensure staff are safe. All staff and volunteers are required to be vaccinated
Experience:
video editing: 1 year (preferred)
Work remotely:
Yes"
"Digital Coordinator - Vancouver, BC - Indeed.com","Luma is looking for talented Digital Coordinators to join our new Vancouver team!
PLEASE NOTE:
All positions are Work From Home roles.
You Can
Review all incoming notes for department relevance and distribute as needed with the supervisors & leads
Track/manage notes, receivables, artist tasks and assignmentsWalk the floor, gather artist needs, follow up on action items
Evaluate incoming media & breakdown information with supervisors
Take notes & action items at internal and client meetings
Set up Cinesync & RV sessions
Multitask
Work well under pressure
Relocate if necessary
You Have
At least 2 years of VFX production experience
Experience working in & knowledge of the VFX pipeline
Proactive mindset with communicating priorities & completing tasks quickly & efficiently
Exceptional organizational and communication skills
A team player mentality with a 'get it done' attitude
Ability to take direction positively
Meticulous attention to detail
Time management skillsInterpersonal skills
A strong work ethic
*
Come as you are. Luma is a committed equal opportunity employer.*
Job Type: Full-time"
