Title,Description
Bilingual (French) Customer Service Representative - Canada - Indeed.com,"When you see someone struggling to open a door, you instinctively reach out to lend a hand. You’ve always been one of those people: a helper.
No matter what your experience, you’ll be in your element in a job where you help people, speaking with them over the phone, and making their stress and confusion disappear.
We’re Manion, a Canadian third-party administrator of group benefits. We provide solutions to streamline the benefits process for large carriers and small businesses. Our work makes it possible for more Canadians to live healthy lives.
We’re looking for
Bilingual (French) Customer Service Representatives
to join our growing team, and we hope our search ends now, with you. Our Customer Service Department is different than the norm. We don't work weekends, 8:00PM EST is the latest you would work, and your shifts would be set!
We also offer competitive benefits, pension and group RRSP plans, and access to Goodlife Fitness at the discounted corporate rate
Your primary goal in this role will be to help clients and professionals by answering questions about our Extended Health and Dental, Pension and Administration of benefits plans and policies.
Success here means providing callers with a great experience. You’ll help a variety of people each day, from policy holders to medical professionals to union representatives. All call centre or customer service experiences will be valuable as you listen carefully, show empathy, and respond correctly. Sometimes you’ll have the answer, sometimes you’ll escalate the issue. You’ll always handle your calls professionally and with care.
As you master our processes, you’ll find yourself becoming somewhat of a subject matter expert on specific policies. We’ll use our system to send calls to you when they’re within your developed specialty. You’ll grow in value as your interests and talents clarify over time.
You will direct response to all Extended Health/Dental Claims, Administration and Pension queries by using the automated claims system and other related systems as required and will keep Claims Examiners/Administrators abreast of problems, errors and corrections to make.
At all times, you will communicate in a professional manner with insurance agencies, doctors, dentists, trustee members, management, lawyers, and others, ensuring that only allowable information is released to recognized recipients and that all information is released in writing.
From time-to-time, you will assist in special projects such as booklets and comparison of benefits and reports.
Success in this role would be the mastery of the processes you touch on a day-to-day basis and your ability to keep up-to-date on industry and government requirements.
Qualifications
Here is our list of “must-haves:”
Fully fluent in written and spoken English AND French
Experience in a customer service or customer facing role
Knowledge of Microsoft Word and Excel for data entry and document creation
These would be considered assets:
Experience in answering in-bound client requests
Experience working in benefits administration
Experience in third party benefits administration
The Right Fit
We’re looking for more than just customer service experience. We want to find the right fit for our team. You’ll be a perfect fit if you are:
Independent
– you’ll grow to work more and more independently. We’ll give you the support you need along the way.
A strong communicator
– you listen, speak and write well in English. You can bring clarity to complex and nuanced issues for any audience.
Detail-oriented
– you’re meticulous with every detail, knowing that the smallest things can make a big difference.
Driven
– you’re constantly trying to improve your knowledge and impact.
Resilience
– you know how to stay calm under pressure and rise to the occasion.
Technologically savvy
– You can move between multiple systems easily in a MS Windows environment, often without using your mouse. You would be comfortable helping someone install and use an App on their smartphone.
Critical thinker
– You are someone who grounds yourself in knowledge needed to do the job and uses that knowledge and common sense to provide solutions and answers to the client.
Ability to Deliver the WOW! Factor
- you expect personal performance to be nothing short of the best. You exhibit passion and excitement over your work and have a positive can-do attitude. You take ownership of the role and go above and beyond whatever it takes to get the job done!
Working @ Manion
This is a full-time, permanent position working remotely from the Calgary, AB, Vancouver, BC or Barrie, ON areas. You’ll be assigned a shift during our hours of operation which are 8:00am to 8:00pm EST (Monday-Friday). We also offer competitive benefits, pension and group RRSP plans, and access to Goodlife Fitness at the discounted corporate rate. Our offices are surrounded by amenities, and you’ll have free parking.
We don’t have a lot of turnover at Manion, and there are good reasons for that. We take care of our people, offering competitive salary and benefits, and our work is meaningful, connecting people to healthier lives. The biggest reason we love coming to work is that we love working together. That’s why finding the right fit is so important to us.
This is a fun, vibrant community to work in every day. We know each other by name, our social committee helps us celebrate achievements and mark life events. Our wellness committee facilitates fitness activities and brings in a nurse on a regular basis.
We value diversity and inclusion and encourage all qualified people to apply. If we can make this easier through accommodation in the recruitment process, please let us know.
Want to be part of a rapidly growing company that is transforming the way Canadian’s experience benefits? Apply now!
We thank everyone who applies to the Bilingual Customer Service role; however, due to the volume of applications we receive, we are only able to contact candidates who have been selected for an interview.
Customer Service; Bilingual; full-time; Full-Time; French; Call Centre; Contact Centre; in-bound calls; Customer Support; remote"
"Associate Director, Study Delivery Lead - Mississauga, ON - Indeed.com","Site Name:
Canada - Ontario - Mississauga, USA - Maryland - Rockville
Posted Date:
Oct 29 2021
In this important job, you will be where the action is. You'll decide on what resources are needed and will be accountable for study budgets. You'll be leading and overseeing the operational activities. Are you up for the challenge?
Note: This position offers the flexibility to work remotely and/or in a GSK office
RESPONSIBILITIES:
The Associate Study Delivery Lead ) is the Project Manager of a study. As such, the associate is accountable to ensure that the study team is planning and executing the study according to time, budget and quality and as defined in the Development Plans (Clinical, Epidemiology, Global and Local studies), in the study management plan, in the study protocol, and in adherence with ICH-GCP guidelines, GSK Vaccines control documents and within regulatory requirements. The SDL develops a study management plan including forecast, detailed schedule, budget and Quality Management Plan
Ensures the translation of scientific objectives in the Study Management Plan.
Uses integrated processes, tools and measures to ensure the study oversight, delivery of the study on time, according budget and with quality, using a risk-based approach methodology
Develops a study management plan including forecast, detailed schedule, budget and Quality Management Plan
Ensures a study-level risk assessment is performed, so that the identified risks are appropriately mitigated.
Develops and maintains Study Risks Management Plan
Ensures development and management of Study Quality Management Plan and conduct related quality assessment, endorses proposal for site assessments/audits, analyze and follow up assessment reports
Prepares monitoring and communication plans (including definition of study essential data for adaptive monitoring)
Ensures issue escalation and management up to resolution.
Communicates progress and escalates issues to the Asset Lead when appropriate
Defines resource requirements and ensures appropriate resourcing (including outsourcing)
Tracks delivery to time, cost and quality, ensures maintenance of standard tools such as iPlan, eTrack and SAP.
Sets up the Study Dashboard to facilitate the integrated study oversight. Each Study Core Team member has his own accountability to ensure control and monitoring of his departmental plans.
Accountable for the study budget
Ensures appropriate documentation of Oversight is available in the TMF at all times, completion of Trial Master File (collect of Essentials doc…), and archiving for paper file...
In partnership with the Clinical Research Development Lead (CRDL), Epidemiologist, Country Medical Directors (for local studies), co-ordinates all members of the study network to ensure the appropriate experts (both central and local, operational and medical/scientific) are involved at appropriate stages and outputs are delivered on time
Leads a multifunctional team to ensure study Oversight, study delivery and takes operational decisions at study level (will refer to Asset Delivery Lead as needed).
Ensures appropriate study oversight including study kick off meeting(s), regular TC with LOC/CRO, reviews protocol deviations, escalation process and ensure appropriate follow-up actions are taken
Develops and maintains, with the Study Core team, the study dashboard including key risk indicators (KRIs), key performance indicators (KPIs) and other study related reports / tools
Communicates progress to Asset Delivery Lead and study team
Leads and oversees operational activities in study design and study execution including
Inputs to concept protocol and protocol development to ensure optimal operational design
Accountable to ensure that the study feasibility process and the country/ies allocation are optimal in regards of the project strategy.
Accountable to ensure that the study execution health check is the most optimal in regards of the project strategy.
Ensures functional strategy and plans are developed, maintained and executed including clinical supplies, sample management, data management, document management and quality. Each study core team member keeps his own accountability to ensure planning and execution of his departmental plans.
Participates in country and site selection, with reference to pre-selection decisions made at Development Plans level
In coordination with the study core team, ensures that appropriate documents are available to regional teams for timely submission to Ethics Committees and/or Regulatory Authorities according to local requirements
Ensures appropriate training of country staff and sites on protocol and project specific matters - Prepare/deliver monitors meeting (when applicable)
Develops and ensures on-time execution of supportive documents, plans and manuals including the monitoring plan, study procedures manuals, core operational packages for submission and for countries
Responsible for vendor management activities including selection and contract development when outsourced activities are owned by the SDL
Develops and follows the most efficient operating model for collaborative studies, to manage appropriately the risks linked to supported/collaborative studies and has experience and skills to manage all associated requirements – Same for the management and oversight of outsourced studies (including RFP/Bid defense and contract management)
Provides input to the clinical study report / module appendix
As part of his/her development, the Associate may contribute to a small clinical development sub-program operational strategy and takes the oversight of its delivery
Responsible for >4 trials of average to very high design and protocol complexity
Maintains expertise in GCP and in clinical study management methodology and support process improvement initiatives and shares best practices within the SDL team and beyond.
BASIC QUALIFICATIONS
Bachelor’s degree in the areas of General Science or Life/Health Science
6 years of experience in managing clinical research studies, clinical operations or equivalent
Experience coordinating and managing indirectly up to 30 central and local clinical operation functions and others cross-functional experts who are involved in the preparation and delivery of the study(ies)
8+ years of significant experience in managing complex clinical research studies, clinical operations or equivalent.
Advanced understanding of the clinical research and clinical trial management, associated regulatory, processes and quality requirements.
2+ years of experience in regional clinical study leadership desirable (field experience)
Strong skills and experience in project management and tools
In depth knowledge of GCPs and ICH guidelines
Excellent communication and presentation skills
Solid experience working in teams with a broad range of cultures
Excellent leadership skills, promoting motivation and empowerment of others in order to accomplish individual, team and organizational objectives
Demonstrates an excellent understanding of the clinical study , drug development , sample management and other associated process and quality requirements, including ICH/GCP guidelines and SOPs
Strong project management skills (including scope, budget, timeline, and resource planning and management, and use of associated tools and support where available)
Able to lead and work within teams and networks across functional and geographical boundaries; leads by example and promotes collaboration, effective communication and leadership in others
Able to set and manage priorities, performance targets and project initiatives in a global environment
Operational expertise in risk management and contingency planning
Applies industry best practices to the design and execution of clinical studies to improve time and cost efficiency
Acts as role model in line with GSK Vaccines core values and Expectations
Able to understand the impact of technology on studies and to use and develop computer skills while making appropriate use of GSK Vaccines systems/software
Demonstrates conceptual, analytical and strategic thinking
Effective at problem solving and conflict resolution
Possesses excellent English language written and verbal communication skills in addition to proven negotiation skills.
PREFERRED QUALIFICATIONS
Master, Post graduate degree in a life science field (Pharmacy, Chemistry, Bio Engineer, Biology, Biomedical Sciences, Project Management
In-country CRA / monitoring/ sites experience an asset
Knowledge of French an asset
LI-GSK
GSK is an equal opportunity employer committed to diversity and inclusion. We welcome applications from all qualified individuals to apply to our career opportunities. GSK is committed to accommodating persons with disabilities. If you need accommodation at any stage of the application process or want more information on our accommodation policies, please contact us at canada-recruitment@gsk.com. Please do not send resumes to this e-mail and instead apply through the online application process of this posting.
As a health and science-based organization, GSK is committed to following the recommendations as set out by Health Canada and taking all necessary steps to help curb the spread of COVID-19 which includes getting the COVID-19 vaccine. We feel strongly that this is the best way to help protect those we value most: our employees, families, communities and the patients and consumers we serve. To that end, we are taking an important step to ensure the safety of our employees during this global public health crisis.
Only employees who are fully vaccinated against COVID-19 may attend our Mississauga and Laval corporate offices. In addition, all customer-facing employees who, as part of their job, attend healthcare settings such as hospitals, pharmacies, doctors’ offices and dentists’ offices will need to be fully vaccinated against COVID-19. Notwithstanding the foregoing, employees may seek an accommodation for human rights-related reasons, including medical or disability-related conditions, or religious beliefs.
Important notice to Employment businesses/ Agencies
GSK does not accept referrals from employment businesses and/or employment agencies in respect of the vacancies posted on this site. All employment businesses/agencies are required to contact GSK's commercial and general procurement/human resources department to obtain prior written authorization before referring any candidates to GSK. The obtaining of prior written authorization is a condition precedent to any agreement (verbal or written) between the employment business/ agency and GSK. In the absence of such written authorization being obtained any actions undertaken by the employment business/agency shall be deemed to have been performed without the consent or contractual agreement of GSK. GSK shall therefore not be liable for any fees arising from such actions or any fees arising from any referrals by employment businesses/agencies in respect of the vacancies posted on this site."
"Patient Coordinator - Cloverdale Dental Group - Etobicoke, ON - Indeed.com","About us:
We at Cloverdale Dental Group take honour in setting the standard for excellence in dentistry and patient care. We have been located inside Cloverdale Mall for over 25 years! As professional dentists in Etobicoke, we believe that everyone deserves a great smile. Therefore, our commitment to quality governs every aspect of our work and assures that we always exceed expectations.
We've been voted the Best Dental Clinic in the Etobicoke area several times and hold a place of pride at Cloverdale Mall. We are a family dental practice that incorporates an up-close and personal attitude towards our patients!
We are conveniently located inside Cloverdale Mall at 250 The East Mall in Etobicoke, ON.
https://www.cloverdaledentalgroup.com/
Schedule:
Full-Time, 3 evening shifts and 3 Saturdays per month
The opportunity:
We are currently looking to hire a Patient Coordinator to join our busy and well-established practice. As part of the Administrator team, you are the face of the business. The successful candidate will have a passion for building strong patient relationships and contributing to the ongoing oral health of their community. In this busy role, you'll have the opportunity to work alongside and learn from a strong team of dental professionals.
Why Should You Join?
Competitive compensation & benefits:
Our compensation packages are reviewed annually in a comparative study that ensures alignment with industry standards.
Established and stable practice:
Our successful practice is a leader in patient care, providing a range of services to a loyal and established patient base.
Health & Safety and Compliance:
The practice has a strong health and safety culture, with compliance measures embedded in every aspect of the workplace.
Career development:
A career with us ensures you have the support, tools, and encouragement you need to grow and evolve as a professional on your individual career path, including access to industry-leading continuing education through the award-winning DC Institute (dcinstitute.ca)
Fast-growing and entrepreneurial environment:
Our practice is innovative, growth-oriented, and patient-focused – a combination that makes for a fast-paced, exciting, entrepreneurial atmosphere.
Respect for our people:
The team is built on a culture of respect and positivity, where we celebrate individuality and value each other's unique strengths and contributions.
Work-life flexibility:
Everyone has a life outside the practice, and we are committed to helping each team member find a healthy, sustainable balance between home and career.
Key Competencies:
Front Office
Make a positive and lasting impression on the patient, from the moment they arrive at the practice to the moment they leave
Responsible for optimizing the appointment schedule by ensuring the day is full, with limited gaps
Manage all patient calls and inquiries with a smile: appointments, confirmations, and amendments
Manage potential cancellations and overcome objections to motivate the patient to keep the appointment
Bill patients as they come out of the treatment room, take payment, send a claim form to insurance, respond to all fee inquiries in a positive manner
Effectively manage the recall system and accurately maintain the patient database
Process referral letters and other patient correspondence upon receipt from the provider
Manage and file all patient records and charts
Patient Relationships
Establish genuine rapport with patients, welcoming patients warmly and by name
Establish life-long patient relationships, ensuring retention and loyalty
Demonstrate active listening and empathy to patients using effective communication skills
Responsible for the entire patient experience
Teamwork
Attends and actively participates in team meetings
Contributes to the team by working together as a cohesive unit
Maintains composure under pressure during times of change
About You:
Minimum 1 year of Administrator experience
Clinical background considered an asset
Experience with Dental software
dentalcorp Total Rewards + Perks
Team members have access to a range of resources focused on enhancing their personal and professional lives. We provide annual compensation reviews, voluntary RRSP contributions, and industry-leading learning and development opportunities. Our team members also enjoy extensive discounts on many services and activities including an exclusive corporate gym membership program; reduced rates on home and auto insurance; and unlimited access to a variety of discounted entertainment, hotels, products and services. Our Employee and Family Assistance Program (EFAP) connects team members and their families with complimentary, confidential, short-term counseling and advisory services. dentalcorp is continuously evolving and enhancing the programs to offer our team members exclusive benefits that complement their lifestyle.
We thank all applicants, but only suitable applicants will be contacted. Job applicants with a disability who require reasonable accommodation for any part of the application or hiring process can contact our Talent Team at
+91-XXXXXXXXXX
. Reasonable accommodations will be determined on a case-by-case basis and your request will be responded to as soon as possible."
"Full Time CDA - Victoria, BC - Indeed.com","Colwood Dental Group is looking for a full-time CDA permanent position. days are Monday-Thursday. We are a Multi-dentist cooperative group practice with a focus on conscientious, family-based dentistry, teamwork and a fun working environment. Extended medical, flexible holidays, and many other benefits! Please email resume to Christine to apply
Job Type: Full-time
Job Types: Full-time, Permanent
Salary: From $28.00 per hour
Schedule:
8 hour shift
Experience:
Dental Assisting: 1 year (preferred)
Licence/Certification:
Dental Assistant (preferred)
Work remotely:
No"
"Small field CBCT certified dentist - Yorkville, ON - Indeed.com","LocationCanaray Yorkville
SubtitleSupervising dentist
Job DescriptionCanaray is seeking a dentist to meet the RCDSO requirements of operating CBCT scanners. The Small Field of View CBCT course is a mandatory requirement. Job duties include acquiring CBCT scans, pans, cephs, digital impressions, polyvinyl impressions and ortho photos. Scheduling can be expected at the following locations Canaray Yorkville, Canaray Scarborough and Canaray Vaughan. Compensation is $60 per hour.
Starting hourly wage$60.00
Work days and timesMonday to Friday, part time
date of posting2017-11-09"
