Title,Description
"social media community manager - Halifax, NS - Indeed.com","Marketing, Other
Business Equipment and Computer Applications
JavaScript
HTML editing software
MS Outlook
Area of Specialization
Interactive/new media
Work Setting
Social service or charity agency
Security and Safety
Criminal record check
Own Tools/Equipment
Internet access
Cellular phone
Transportation/Travel Information
Own transportation
Work Conditions and Physical Capabilities
Fast-paced environment
Attention to detail
Tight deadlines
Work Location Information
Urban area
Personal Suitability
Initiative
Team player
Excellent written communication
Client focus
Judgement
Organized
Workplace information
Remote work available"
"Digital Marketing Specialist - Toronto, ON - Indeed.com","Every year, approximately 60% of all medical school applicants with dreams of becoming physicians are not granted admission to medical school. Those who are passionate about helping and healing others face various obstacles on their path to a medical career. At MCAT Mastery, our vision is to support passionate, smart students in achieving their dreams of becoming doctors.
About MCAT Mastery
MCAT Mastery is a fast-growing test-prep company that offers online tutoring services, courses, and many other resources to students who are looking to get into med-school and become doctors. We’re passionate about contributing to the development of future doctors, ensuring they use this phase of their professional journey to not only master med-school level exams, but also become better versions of themselves, by applying key self-growth principles we teach.
We like to foster a culture of positivity, continuous improvement personally and professionally, thinking big, open communication, authenticity, and putting the customer first.
Our plans over the next year involve expanding our company from just being about the MCAT exam, to being about everything that encapsulates the journey to becoming a physician. We also plan to expand to different product types such as creating software, physical products, and more. The next year is going to be a great learning opportunity for everyone on the team as we step into new ventures/projects together.
About The Role
We are looking for a qualified and talented
Digital Marketing Specialist
to join our expanding team at MCAT Mastery. You will work side-by-side with the CEO/Founder and will be instrumental in helping scale the business.
MCAT Mastery is growing very quickly and we need you to keep us moving forward steadily and effectively. We are looking for an ambitious, self-driven marketer who can be comfortable in a collaborative startup environment.
If you have experience with digital marketing, are a quick learner, enjoy solving problems creatively, looks forward to taking on new challenges, and are driven to continue improving as a marketer, you’ll be a great fit with our team.
As an important part of the team, you will manage and optimize the entire sales funnel. You will implement marketing ideas from the Marketing Manager, and also have the freedom to come up with your own ideas to experiment with!
Note: this is a full-time remote position (must be in Toronto, Canada)
Responsibilities
Help execute product launches and other digital marketing campaigns
Optimize various elements in the sales funnel through constant testing and analysis
Create and assess weekly and monthly marketing reports
Assist with content creation on various channels including the website blog and social media
Improve and update email automations and campaigns
Measure and analyze campaign results (A/B testing, CTR, Open Rate, Opt-Out Conversions).
Setup, implement and migrate current infrastructure to leading-edge digital marketing software
Oversee the execution of traffic-generating strategies
Create well designed, conversion-focused sales and landing pages as needed
Manage email campaigns and develop strategies and plans to drive sales, increase web traffic, and grow email subscribers and engagement
Identify opportunities to continuously improve company websites
Set up campaigns on various channels, including Facebook and Instagram
Work closely with content writer, designer, and production coordinator
Other responsibilities as needed
The Ideal Candidate
Has 2-3 years of digital marketing experience (can be work or personal projects)
Proficiency with Google Analytics, WordPress, email marketing software
Stays up to date with latest digital marketing trends and best practices
Has an eye for design when it comes websites, images, and videos
Is a creative thinker but also has a strong ability to analyze, organize and manage
Is detail oriented and customer focused
Is extremely proficient with spreadsheets and Excel
Strong time management, organizational, and project management skills
Fast learner with a knack for technology who can learn new tools quickly
Strong verbal and written communication skills
Savvy and resourceful, a problem solver who is quick on their feet, fast in finding solutions, and can manage to figure things out on their own
Thrives in a fast paced environment and can take ownerships of projects
Bonus Points If You:
You have experience with taking the MCAT and/or being a premed. You know the struggle first or even second hand.
You’ve worked in a startup environment and know what it takes to scale
You have experience working in an education based environment
Life at MCAT Mastery
Full time remote working ability and paid time off
Competitive compensation
Performance bonuses
Fun, positive, growth-oriented company culture
Small, close-knit, growing team working on projects together with a shared vision
Training culture dedicated to maximizing your learning and growth; current and new high-quality marketing and business educational material is free for every team member
Ability to make a direct, positive, and immediate impact in the lives of the future doctors of our world
Opportunity to join a growing and rapidly evolving organization early
Application Deadline: 2021-11-30
Expected Start Date: 2021-12-13
Job Types: Full-time, Permanent
Salary: $45,000.00-$55,000.00 per year
Additional pay:
Bonus pay
Benefits:
Casual dress
On-site parking
Paid time off
Work from home
Schedule:
8 hour shift
Monday to Friday
Application question(s):
What are the top 3-5 online digital marketing tools that you are most comfortable with?
Experience:
digital marketing: 2 years (required)"
Marketing Consultant (Contract - Part Time) - Remote - Indeed.com,"Quantum Mob is a Toronto-based digital innovation partner that helps ambitious companies build successful digital products. We provide custom solutions to the complex problems facing our clients, which range from innovative early-stage startups to elite Fortune 500 companies.
*
The Role*
We are looking for a dynamic Marketing Manager as a consultant/ contractor. This is a part-time contract work wherein you will be working 1-2 times a week to help position Quantum Mob as a leader in our space. This is a temporary position for 9 months as our current Marketing Manager is going on Maternity leave.
You will be reporting working closely with the QM Co-founders to develop and execute marketing strategies to align our cross functional team goals to ultimately achieve our business objectives. Amongst other things, you will be responsible for diversifying our lead generation, increasing efficiency across the funnel and coordinating the creation of content for thought leadership.
What You'll Do
Create and execute content, events (online and in-person), and demand generation marketing strategy with the Leadership Team
Work cross-functionally with the Sales Team
Plan, track, and manage entire marketing funnel
Manage content calendar and ensure social accounts are updated with relevant content regularly
Responsible for overseeing all public-facing copy and content
Identify, curate, and/or organize community events
Drive engagement across all digital channels
Identify opportunities for effective lead generation
Coordinate marketing efforts with sales team
You will have one Marketing Coordinator and one Marketing intern to manage
What You'll Bring
5+ years experience in a Marketing and/or Sales, or similar role driving inbound growth using a variety of digital marketing tactics
Experience with content creation across multiple channels (eg. Social Media, Ad Copy, Website, Blogs)
Experience organizing and planning community events and event marketing
Experience with Google Analytics and Marketing Automation Software
Strong analytical and project management skills
Experience within SaaS or services
If your interest is piqued, please apply. Also, be sure to check out other listings on our Careers page.
Hungry for more? Let's talk.
Quantum Mob is proud to be a diverse and equal opportunity employer. As such, we do not discriminate on the basis of race, colour, religion, sex, national origins, age, sexual orientation, disability or any other characteristic protected by applicable laws. Accommodations are available upon request for all applicants with a disability throughout the recruitment process.
At Quantum Mob, we are dedicated to creating an inclusive culture with a diversity of talented individuals who join, stay, and work in an environment that enables them to thrive.
_
While we sincerely appreciate all applications, only those candidates selected for an interview will be contacted._
Job Types: Temporary, Contract"
"Digital Marketing Intern - Toronto, ON - Indeed.com","Digital Marketing Intern
The Intern will be involved with planning, executing, editing and writing of marketing campaigns as well as assisting the team with any digital creative work, as instructed. The successful candidate will play an integral role for maintaining branding language consistency while delivering high-quality contributions including ideas, strategies and expected results. The Intern will develop and drive marketing content onto the web and social media to reach our target markets to drive product demand via multiple channels.
The ideal candidate will be innovative, team oriented, an effective communicator, have a desire to participate in change, and appreciate a dynamic environment with rapidly changing priorities.
The job responsibility includes but is not limited to the following:
Write, edit, publish digital content for website, videos and social media platforms
Develop and implement advertising campaigns appropriate for electronic media
Influencer reach out and communication with partnerships
Assist in the creation of marketing executions and brainstorming
Create Corporate Communications materials, while learning and understanding Company/Brand Design Guidelines
Support the development and execution of a wide range of communications materials (email communications, company newsletters, intranet postings, presentations, surveys, calendar invitations, website content, internal videos, social content, etc.)
Assist with managing the website for the company, collaborating with the management to create an even distribution of assets between all locations.
Work as a team with other interns
Qualified candidates must demonstrate the following skills:
Currently enrolled or graduated in a university degree or college diploma in business marketing/administration, media, commerce, communications, PR, digital marketing, advertising or a discipline related.
Experience with Adobe Creative Suite, Canva and knowledge in Video editing and website posting/updating is a plus but not mandatory.
Detail orientated, good time management skills in a changing environment, ability to work independently and as part of a team
Excellent attention to detail and a high motivation to learn
Understanding of brand, tone and target audience
A passion for Digital Marketing, Trends and Social Media
Ability to think and act strategically and tactically
Solid organizational skills, including prioritization and time management
Strong interpersonal, written and oral skills
Problem solving skills
Ability to summarize and communicate important data
If this sounds like something you're interested in, we'd love to hear from you!
Length: 2 week trial period, then part time permanent
Expected start date: 2021-11-08
Job Type: Part-Time
Salary: $14.35CAD - $17CAD /hr
Benefits:
Work from home
Schedule:
10-15 hours
Meetings every mon, wed, friday
Work remotely:
Temporarily due to COVID-19
COVID-19 precaution(s):
Remote interview process
Virtual meetings
Remote work
Part-time hours: 10-15hrs per week
Expected start date: 2021-11-08
Part-time hours: 10-15 per week
Expected start date: 2021-11-08
Must be enrolled in a Canadian university.
Job Types: Part-time, Internship, Permanent
Salary: $14.35-$17.00 per hour
Schedule:
Monday to Friday
Work remotely:
Yes"
"DIGITAL SERVICE SQUAD TEAM MEMBER - Whitecourt, AB - Indeed.com","Digital Service Squad – Team Member
This is a contract position with an end date of March 31, 2023
ARE YOU A RECENT GRADUATE, OR PERHAPS LOOKING TO JUMP START YOUR CAREER IN DIGITAL MARKETING & TECHNOLOGY?
Community Futures Yellowhead East, is currently seeking outgoing, enthusiastic, qualified candidates for the position of
Digital Service Squad – Team Member
located in the Community Futures Yellowhead East Region.
This is a unique opportunity to support the growth of one of Alberta’s most innovative economic development programs. Supported through The Business Link Digital Economy Program in collaboration with Digital Main Street, this is the first of its kind in Alberta and is funded by the Government of Alberta.
As a
member of the Digital Service Squad
, you will be a key contributor to the success of the platform and the growth of the program as a whole. Initially, the Digital Service Squad Member will work remotely with local small businesses in the Yellowhead East communities of Swan Hills, Fox Creek, Whitecourt/Woodlands, Mayerthorpe, Barrhead/County of Barrhead, Lac Ste Anne County, Onoway and Alberta Beach.
In the future, the Digital Service Squad Member will be required to travel independently across the Yellowhead East Region.
The focus of the role is to work one-on-one with small businesses and provide the following services:
1. On-boarding Assistance
Conduct pre-business digital assessment to best understand the neighborhood and businesses.
Working with the Coordinator to set digital appointments to onboard small businesses to the platform.
Walk-through the on-boarding survey with the business owner and use appreciative inquiry methods to best understand their business goals and how digital tools/technology can assist them in meeting their goals.
Assist the business in staying in touch with Business Link and Digital Main Street by subscribing to their e-newsletter and social channels.
2. Advisory Services
Once the business has been on-boarded, the Team Member will walk through the Digital Assessment and Recommendations with the business owner.
The Team Member will assist the business owner in identifying their first priorities and the first digital tools/technology they want to activate.
The Team Member will also review vendor recommendations made through the platform and lead the business owner to relevant deals/discounts on the platform.
3. Activation/Implementation Services
The Team Member will activate and implement free, easy-to-use digital tools and technologies that businesses would like to use (i.e.: activating social media accounts, creating an online business profile, etc.).
The Team Member may also provide some resources (articles, links, how-to guides) available through secondary sources that can help the business owner learn more about a particular tool that has been activated, or subject matter of interest.
4. Reporting and Feedback
Team Members must complete their field notes and report on a weekly basis to the Program Coordinator and Program Manager.
Team Members must attend Team Meetings as set out by the Program Manager.
Halfway through the employment term, an interim performance evaluation will occur to ensure fit.
The Team Member may be required to attend webinars, workshops and events related to Business Link and Digital Main Street. The purpose of which is to communicate the benefits of the program to business owners and to on-board them to the platform. There may be other duties, as required, that will be discussed with the Team Member should they arise.
Qualified applicants will:
Possess strong communications skills (written and verbal).
Possess strong interpersonal and relationship building/relationship management skills.
Possess excellent organizational and time management skills.
Have experience in a sales role and/or marketing environment.
Eventually be able to travel and work independently.
Be familiar with digital technologies for small business (e.g.: web, social media, e-commerce, etc.)
Be able to use basic software and collaboration tools such as Microsoft Office Suite (Word, Excel, Outlook, Power Point) and Slack.
Previous experience with online and offline marketing is considered a strong asset.
Previous experience with graphic design is considered a strong asset.
Previous experience working with small businesses is considered an asset
The successful applicant will be expected to work remotely, in the office in Whitecourt, and be able to travel independently around the region.
Please submit your resume and cover letter to Michelle Jones, Executive Director. Only those individuals selected for an interview will be contacted. Community Futures Yellowhead East thanks all applicants for their submissions.
This job opportunity will remain open until a suitable candidate is found.
Contract length: 15 months
Expected start date: 2021-12-13
Job Types: Full-time, Contract
Salary: $23.00-$25.00 per hour
Benefits:
Flexible schedule
Schedule:
8 hour shift
Monday to Friday
COVID-19 considerations:
All COVID-19 Safety Protocols are in place and required to be followed.
Education:
Secondary School (preferred)
Experience:
Digital marketing: 1 year (preferred)
Social media management: 1 year (preferred)
Small Business Supports: 1 year (preferred)
Microsoft 365: 1 year (preferred)
Work remotely:
Temporarily due to COVID-19"
Digital Marketing Internship (Content Writer) - Remote - Indeed.com,"Company description
10Adventures is a fast-growing tech company focused on Adventure Travel. Our Adventure Travel Ecosystem lets outdoor lovers plan their next adventure - whether they want to use our free, guidebook quality info to plan their trip or book a tour on a marketplace that connects them to local tour operators in over 75 countries.
Job description
We are looking for Content writers who specialize or are interested in digital marketing for an internship that ends March 31, 2022.
This is a great, paid internship for writers who are passionate about content marketing and interested in the outdoors or adventure travel.
The role will be focused on developing new outdoors-related content with an SEO-focus. The role will primarily be creating content focused on adventure travel, including hiking, cycling, snowshoeing and other types of route guides.
The ideal candidate will have the following attributes:
Experience in creation of engaging and grammatically correct content, with English as their native language.
Knowledge of SEO and understanding using digital marketing to grow an organic audience.
Attention to detail and willingness to learn.
Experience of adventure travel, ideally you have travelled extensively and regularly hike, cycle, ski etc.
Comfortable working as part of a remote team (most of whom are based in Western Canada).
Self-starter who can motivate themselves to meet their commitments.
Comfortable researching and creating content for topics they don't have first-hand experience.
Our team are all experienced outdoor-lovers who have travelled extensively, and if you are the same you'll fit in well.
In addition to contributing to 10Adventures, there are opportunities for discounted adventure travel around the world (once Covid-19 is over).
The most successful applicants do three things well:
Tell us why they would be a good fit for 10Adventures.
Have a portfolio showing some of the content they've created.
For short-listed candidates: Impress us in a simple 20-30 minute exercise to demonstrate writing and editing skills!
This position is funded by the Government of Canada under the Innovation, Science, and Economic Development of Canada, Digital Skills for Youth program. Successful candidates must be 30 years of age or younger, hold a bachelor's degree and be a Canadian citizen.
Contract length: 4 months
Application deadline: 2021-11-19
Expected start date: 2021-11-22
Job Types: Full-time, Internship
Salary: $18.00-$19.00 per hour
Schedule:
Monday to Friday
Application question(s):
This internship is funded by a government grant that requires the successful applicant be a Canadian Citizen, be 30 years of age or under, and hold a Bachelor's degree. Do you meet these criteria?
What interest you about working this role and about 10adventures?
Work remotely:
Yes"
