Title,Description
"Service Router Platform Test Dev Co-op - Ottawa, ON - Indeed.com","Position: Service Router Platform Test Dev Co-op
Duration: 4, 8 or 12 months
Date: May 2nd, 2022
Come create the technology that helps the world act together
Nokia is committed to innovation and technology leadership across mobile, fixed and cloud networks. Your career here will have a positive impact on people’s lives and will help us build the capabilities needed for a more productive, sustainable, and inclusive world. We challenge ourselves to create an inclusive way of working where we are open to new ideas, empowered to take risks and fearless to bring our authentic selves to work.
The team you'll be part of
Network Infrastructure
The pandemic has highlighted how important telecoms networks are to society. Nokia’s Network Infrastructure group is at the heart of a revolution to bring more and faster network capacity to people worldwide through our ambition, innovation, and technical expertise.
Education Recommendations
Currently a candidate for bachelor’s degree or diploma in Electrical Engineering, Computer Engineering, Software Engineering, Computer Science, or related field with an accredited school in Canada.
What you will learn and contribute to
As part of our team, you will:
Develop automated test cases to validate new hardware and software features in a Linux-based regression environment.
Learn and use network protocols to configure high-capacity routers (examples: 7750 SR-12e/7950 XRS40/7750 SR-14s/7250 IXR-e/7250 IXR-R) to route Terabits per second of IP traffic.
Perform testing on new (prototype) line cards, media adapters and platform features on the 7750 Service Router and 7250 Interconnect Router product families.
Work closely with an intermediate or senior level engineer who will act as your mentor for the duration of the term.
Monitor automated regression tests to ensure that new code does not break existing functionality.
Verify driver-level software and packet data path.
Build test networks, work with cutting-edge hardware (e.g. 400 Gigabit Ethernet) and use test equipment for traffic generation and protocol emulation.
Work closely with testers and developers to investigate and resolve bugs.
Test enhancements to functional areas such as PXC, mirroring, CPU performance, cflowd, control-plane redundancy, fabric redundancy, etc.
Test IP traffic performance on a variety of router hardware components.
Test traffic encryption and authentication at IP and/or MAC level.
Qualify high precision time and phase synchronization technologies such as PTP, SyncE, and GNSS.
Analyse the throughput limits of hardware components (running custom ASICs) on a nightly and weekly basis to ensure quality remains high.
What is Nokia looking for from me
You have:
Solid programming skills (transferable to new languages).
A curiosity to learn, reverse engineer, and tear apart a feature or a design (i.e., research and understand your feature area inside and out to test it thoroughly).
Strong analytical and troubleshooting skills.
Quick learner, self-starter, able to work independently.
Strong sense of ownership and accountability.
A solid understanding of computer hardware architectural building blocks.
Experience using source control software (Git).
Experience coding large software projects outside of typical school projects.
Excellent interpersonal, written, and verbal communication skills.
Obsessive attention to detail.
A strong passion for quality.
Why we're awesome
Nokia offers flexible and hybrid working schemes, continuous learning opportunities, well-being programs to support you mentally and physically, opportunities to join and get supported by employee resource groups, mentoring programs and highly diverse teams with an inclusive culture where people thrive and are empowered.
Company Culture: We believe our people are our greatest asset and we aim to foster a fun, challenging, positive, and inclusive work environment. We offer 1-on-1 mentorship, learning and development opportunities, global impact and interaction, and flexible work/life balance.
Meaningful Co-op Term: During your co-op term, you will have the opportunity to test out the latest technologies and work on innovative projects that could leave a global impact. You get to use skills learned in the classroom and apply it to real work situations while gaining professional hands-on experience.
Nokia is committed to inclusion and is an equal opportunity employer
Nokia has received the following recognitions for its commitment to inclusion & equality:
One of the World’s Most Ethical Companies by Ethisphere
Gender-Equality Index by Bloomberg
Workplace Pride Global Benchmark
LGBT+ equality & best place to work by HRC Foundation
At Nokia, we act inclusively and respect the uniqueness of people.
Nokia’s employment decisions are made regardless of race, color, national or ethnic origin, religion, gender, sexual orientation, gender identity or expression, age, marital status, disability, protected veteran status or other characteristics protected by law.
We are committed to a culture of inclusion built upon our core value of respect.
Join us and be part of a company where you will feel included and empowered to succeed.
See you this Summer 2022!
“My experience at Nokia has been amazing, one of the best learning experiences I ever had in my life. As Co-op student, it was an honor to be treated as any other full-time employee at Nokia. I got the freedom to design & implement my ideas. Working at Nokia as a Co-op student was the best thing that ever happened, it was a life changing opportunity.” – Ummar Tantray, Former Nokia Co-op student, Fall 2020
Follow and engage with us on social media:
LinkedIn | Facebook | Instagram | Twitter @NokiaCareers
Chat with our Nokia insiders to ask questions and learn more about us!"
"Systems Administrator - Orangeville, ON - Indeed.com","This position is responsible for the implementation and administration of Enterprise Systems within the Hospital which consists of all network operating system platforms, electronic communications, and ensuring the security and integrity of the infrastructure is maintained at all times. This position will be required to collaborate and communicate continuously with the IT team and Hospital Staff to ensure projects and initiatives are defined and successfully implemented and completed.
Responsibilities will include but not limited to:
Responsible for monitoring, deploying, maintaining and supporting the centralized computing facilities for Headwaters health information, business and scientific systems and applications.
Provide end to end planning, implementation and support of a variety of systems on a Microsoft Windows Server platform.
Manage and support VMWare ESXi, Horizon View, Physical Devices, and Thin Clients
Proposes and implements system enhancements (software and hardware updates) that will improve the performance and reliability of the system based on industry best practices.
Works closely with vendors and end users to ensure seamless support.
Installs servers and configuring hardware, applications, services and storage in accordance with best practices and project/operational requirements
Installing new software releases, evaluating and installing patches
Creating and maintaining install and configuration procedures/operational manuals
Support and maintain internal services (AD, DNS, DHCP, Network)
Creating and supporting automation scripts
Perform daily system monitoring, including verifying the integrity and availability of all hardware, server resources, systems and key processes; reviewing system and application logs; and verifying completion of scheduled jobs, such as backups
Liaises with external partners to provide and maintain access to clinical applications and networks.
Supports all computer desktops and applications along with peripherals such as printers and fax machines when required
The successful applicant will possess the following qualifications:
Post Secondary Degree or Diploma in Computer Information Systems with 5 years of relevant experience, preferably with formal training and/or education with Microsoft Windows systems security and data networking (MCSE (Microsoft Certified Systems Engineer) or CCNA or equivalent experience.)
Professional IT Certifications, such as: Microsoft MCP, MCSA, or MCSE, Fortinet NSE, or VMware VCP
Support and ongoing management of SAN storage technology such as EMC XIO, VxRAIL, VSAN
Technical services and support at the network level: WAN and LAN connectivity, routers, firewalls, and security, VPNs & WiFi (Eg. Palo Alto, Cisco, Dell, Aruba)
Experience configuring and troubleshooting a variety of virtualization products such as VMWare VSphere and Horizon View VDI. Provide escalated support services for virtualization technologies: VMware vSphere / ESXi
Experienced in organizing and overseeing the installation of data communications hardware and software.
Support services for Microsoft related technologies: O365, MS-SQL, SharePoint, Azure.
Knowledge of Cisco and Dell Switching environments
IT Support relating to issues with the internal systems and network infrastructure.
Technical experience with Windows Server including roles/features such as IIS, .NET, Active Directory
Remote access solution support: VPN and VDI.
Act as escalation point in troubleshooting and resolving Backup and DR technology such as Veeam Backup and Replication
Document maintenance for all computer systems infrastructure.
IT related project execution support as needed
Administration and maintenance of the remote monitoring and management system: update agent scripts, respond to alerts, monitor dashboard, and periodic system review.
Communication with customers as required: keeping them informed of incident progress, notifying them of impending changes, or agreed outages.
Support disaster recovery solutions.
Business awareness: specific knowledge of the customer and how IT relates to their business strategy and goals.
Be on-call rotation
Strong written and oral communications skills.
Extra Information
All job offers will require compliance with our COVID-19 Vaccination Policy for proof of full vaccination unless provided with a medical exemption or an accommodation under the Ontario Human Rights Code."
"Lead Domain Engineer - 110461 - Markham, ON - Indeed.com","What you do at AMD changes everything
At AMD, we push the boundaries of what is possible. We believe in changing the world for the better by driving innovation in high-performance computing, graphics, and visualization technologies – building blocks for gaming, immersive platforms, and the data center.
Developing great technology takes more than talent: it takes amazing people who understand collaboration, respect, and who will go the “extra mile” to achieve unthinkable results. It takes people who have the passion and desire to disrupt the status quo, push boundaries, deliver innovation, and change the world. If you have this type of passion, we invite you to take a look at the opportunities available to come join our team.
Lead Domain Engineer - 110461
The Role:
The AMD System Engineering Team is on the lookout for a dynamic, energetic Lead Domain Engineer to join our growing team. As a key contributor to the success of AMD’s product, you will be part of a leading team to drive and enhance AMD’s abilities to deliver the highest quality, industry leading technologies to market. The System Engineering team fosters and encourages continuous technical innovation to showcase successes as well as facilitate continuous career development.
The Person:
As Lead Domain Engineer, you will drive the planning, validation, and debug of various hardware IP for forthcoming AMD Discrete Graphics SOC programs.
Excellent written and verbal communication skills across multiple mediums including email, documentation, verbal presentation skills, influencing across departments, all while driving for results!
We’re looking for someone who excels and thrives in a dynamic team working environment
Leadership and mentoring skills
In addition to working in a collaborative team environment, has the ability to independently drive tasks to completion
Key Responsibilities:
Define and execute end-to-end test plan and validation strategy for a group of AMD IP
Driving technical innovation to improve AMD’s capabilities in IP and cross-IP validation, including tool and script development, technical and procedural methodology improvement, and various internal and multi-functional technical initiatives
Debugging issues found during pre-silicon, bring up, validation, and production phases of SOC programs
Validating coordinated and integrated hardware and software functionalities with all corners to ensure problem-free production
Leading and influencing a collaborative test approach with multiple teams, and tracking test execution to make sure all features are validated and optimized on
Working closely with supporting teams in design, diagnostics, emulation, firmware, and driver to ensure readiness for first silicon arrival, enablement of IP functionality, debug of critical features and full validation for production
Engaging on pre-silicon verification efforts, including but not limited to FPGA-based emulation, Design Verification (DV), and other software/hardware modeling frameworks
Develop knowledge of system architecture, technical debug, and validation strategy
Supporting issues on customer platforms as requested by customer support teams
Preferred Experience:
Multiple previous related years of validated experience in digital logic/platform design, verification, and/or post-silicon validation
Strong programming/scripting skills (e.g. C/C++, Perl, Ruby, Python)
Experience with ASIC debug techniques and methodologies
Extensive experience with common lab equipment, including protocol/logic analyzers, oscilloscopes, etc.
Extensive experience with board/platform-level debug, including clock/power delivery, sequencing, analysis, and optimization
Extensive knowledge of physical and protocol levels of common high-speed interfaces an asset
In-depth knowledge of PC architectures an asset
Academic Credentials:
Bachelors or Masters in Electrical or Computer Engineering
Location:
Markham, Ontario (Greater Toronto Area)
#LI-LB1
Requisition Number:
110461
Country:
Canada
Province:
Ontario
City:
Markham
Job Function:Design
AMD is an inclusive employer dedicated to building a diverse workforce. We encourage applications from all qualified candidates and will accommodate applicants’ needs under the respective provincial human rights codes throughout all stages of the recruitment and selection process.
Any applicant who requires accommodation should contact
AskHR@amd.com
.
AMD does not accept unsolicited resumes from headhunters, recruitment agencies or fee based recruitment services."
"Network Engineer (Design Specialist II) - Core Network Engineering - Vancouver, BC - Indeed.com","Location:
Vancouver, British Columbia, CA Calgary, AB, CA Toronto, ON, CA Edmonton, AB, CA Quebec City, Quebec, CA Montreal, Quebec, CA
Req ID: 11041
Jobs by Category: Technology Solutions
Job Function: Technology
Status: Full Time
Schedule: Regular
Join our team
Core Network Engineering (CNE) is on the forefront of the evolution of telecommunications technologies.
The CNE team is responsible for the deployment of TELUS Core Network infrastructure nationally including 5G and new wirelines solutions for our customers. The team is currently going through transformation to support new networking technologies such as software-defined networking (SDN), network functions virtualization (NFV) & Automation.
Here’s the impact you’ll make and what we’ll accomplish together
You are passionate about development and technology. Your creativity and innovative thinking knows no boundaries. Here is the opportunity to make your mark on a strong and established team going through a disruptive technology change. Contribute to our vision of the future by supporting it with your passion for technology and your will to simplify the user experience. With your strong attention to details, you will be consistently pushing yourself to build reliable next generation network infrastructure. This is the opportunity to gain knowledge and experience in the telecommunications industry by participating in the organization's digital transformation.
Here's How:
Working with a national team of highly skilled Network Engineers and DevOps Engineers to:
Logical configure IP Core Network Devices, including: Juniper, Nokia, and Cisco routers/switches
Complete logical migrations, capacity augmentation and operating system upgrades on IP Core Network devices
Develop fully automated network deployments leveraging CNE's CICD Pipeline and TELUS's Automation Framework
Leverage your Dev-Ops skills to help strengthen Dev-Ops practice within CNE and TELUS
You are the missing piece to the puzzle
Creative thinker and result driven
Hands on experience of IP Core protocols used in Service Provider networks: OSPF, BGP, MPLS, ISIS, STP
Knowledge/ Experience with the following hardware:
JUNIPER: EX, MX, QFX series
NOKIA: 7950, 7750, 7450 series
CISCO: ASR9k, NCS 5500, ME3400 series
2 to 5+ of years of experience as a Network Engineer, preferably in a DevOps environment
CCNP Certification or equivalent
Degree in Engineering, Computer Science or equivalent
Great-to-haves
Ability to program in Python and understanding of data models such as YANG / JSON / YAML
Knowledge or experience with version control systems: Git / Gitlab / Github
Understanding of Next Generation Service Provider networks including SDN & NFV
A bit about us
Our business is connecting Canadians. Our social impact is using our world-leading technology to create meaningful change, give back to help communities thrive, and help those who need it most. When you join our team, you’re helping us make the future friendly. We’re committed to diversity and equitable access to employment opportunities based on ability —your unique contributions and talents will be valued and respected here."
Senior Member of Technical Staff - Canada - Indeed.com,"Senior Member of Technical Staff -21000XGP
Applicants are required to read, write, and speak the following languages
:
English
Preferred Qualifications
Department Description:
At Oracle Cloud Infrastructure (OCI), we build the future of the cloud for Enterprises as a diverse team of creators and inventors. We act with the speed and attitude of a start-up, with the scale and customer focus of the top-tier enterprise software company in the world.
Values are OCI’s foundation and how we deliver excellence. We strive for equity, inclusion, and respect for all. We are committed to the greater good in our products and our actions. We are constantly learning and taking opportunities to grow our careers and ourselves. We challenge each other to stretch beyond our past to build our future.
You are the builder here! You will be part of a team of really smart, motivated, and a diverse group of people and given the autonomy and support to do your best work. It is a dynamic and flexible workplace
where you’ll belong and be encouraged.
“Cloud Engineering Infrastructure Development”
Are you interested in building large-scale distributed infrastructure systems for the cloud? The OCI team is building new technologies that operate at high scale in a broadly distributed, multi-tenant cloud
environment. Our customers depend on our work to run their businesses and our mission is to provide them with the best in class set of cloud-based services.
Position Overview:
We are looking for hands-on, distributed systems engineers and architects with expertise and passion in solving difficult problems within large-scale, global platforms. If this is you, at Oracle you can design and build innovative new systems from the ground up. This is an exciting time in our journey - we are growing fast, still at an early stage, and working on ambitious new initiatives. An engineer at any level can have a significant technical and business impact.
The ideal candidate will have proven experience designing, building, and implementing distributed, cloud-scale systems. You should be both a rock-solid coder and a distributed systems generalist that is
comfortable diving deep into any part of the stack, including interaction with hardware. You should value simplicity and scale, work comfortably in a collaborative, agile environment, and be excited to learn.
Minimum Qualifications:
Bachelor’s degree in Computer Science or equivalent proven experience
5-8 years experience building and operating large scale, highly available, cloud-based distributed systems
Specialist skill in a modern programming language such as Java, C, C++, C#, Go, or Python, with proficiency in additional languages preferred
Validated understanding of operating system fundamentals
Strong understanding of data models and distributed persistence technologies
Thorough understanding of the latest security principles, techniques, and protocols
Strong troubleshooting and performance tuning skills
Proficiency in network, distributed, asynchronous, and concurrent programming
Knowledge of professional software engineering standard methodologies for the full software development process
Experience building and operating scalable infrastructure software or distributed systems
Experience using Amazon Web Services such as EC2, EBS, Lambda, Dynamo, and S3 or equivalents
Proven track record to achieve stretch goals in a highly innovative and fast-paced environment
Passion for technical leadership and mentoring
Strong verbal and written communication skills
Strong analytical skills, with excellent problem-solving abilities
Preferred Qualifications
Experience in Agile/SCRUM enterprise-scale software development
Experience with big data solutions
Direct experience with fleet orchestration for both virtual and containerized workloads
Knowledge of Machine Learning fundamentals
Working familiarity with networking protocols (TCP/IP, HTTP) and standard network architectures
Working familiarity with storage principles, protocols, and practices
Working familiarity with building secure software using modern security principles
Technical leadership experience
Detailed Description and Job Requirements
Design, develop, troubleshoot and debug software programs for databases, applications, tools, networks etc.
As a member of the software engineering division, you will assist in defining and developing software for tasks associated with the developing, debugging or designing of software applications or operating systems. Provide technical leadership to other software developers. Specify, design and implement modest changes to existing software architecture to meet changing needs.
Duties and tasks are varied and complex needing independent judgment. Fully competent in own area of expertise. May have project lead role and or supervise lower level personnel. BS or MS degree or equivalent experience relevant to functional area. 4 years of software engineering or related experience.
Job
:
Product Development
Location
:
Canada
Job Type
:
Regular Employee Hire
Organization
:
Oracle"
