Title,Description
"Business Analyst - Etobicoke, ON - Indeed.com","We have an exciting opportunity for a Business Analyst. This is a 6 months contract to permanent opportunity where the selected candidate will have the opportunity to work with one of the leading-edge business units focused on development and rollout of new Technologies. This role will support business requirements gathering, identify business processes optimization, participate in sprint planning (Agile), support business users in test plans, facilitate problem solving and decision-making sessions.
Qualifications
University Degree in computer science or related discipline
Minimum of 1 to 2 years acting as BA/BSA/SA/FA, PC, PM, or similar roles
Hands-on experience in technical solution design, software specifications, conceptualization and development
Hands-on experience in Agile projects is considered an asset
Experience partnering with outsourced vendors
Excellent written and oral communication skills
Excellent presentation skills
Excellent analytical and problem-solving skills
Ability to demonstrate initiative, good judgment and effective decision-making
Strong process improvement orientation, and experience in leading discussions to drive positive results amongst inter-disciplinary groups
Responsibilities
Business Application
Subject matter expert in business practice and processes for assigned business domain(s) while understanding their interface points with all other domains.
Analyze business partner’s operations to understand their strengths and weaknesses to determine opportunities to automate and/or improve processes and functions.
Possess expertise in assigned business areas, as well as, an understanding of systems and capabilities.
Demonstrate an informed knowledge of a business area to advise opportunities for competitive advantage and efficiency.
Drive and challenge business units on their assumptions and support them to successfully execute their plans.
Participate in all phases of software development lifecycle including requirement gathering, analysis, solution design, configuration, development, testing and support
Create scope documents, write business requirement documents and document functional specifications. Adjust documentation style / template depending on delivery approach e.g. Waterfall (Requirements Documents), Agile (User Stories)
Lead the gathering of functional and non-functional requirements for the project. Interpret business needs and translate them to software requirements.
Analyze requirements, and design appropriate business process models to support business solutions, and perform impact analysis on proposed changes.
Coordinate acceptance tests to ensure quality of deliverables, adherence to business expectation and timely delivery of business applications
Critically evaluates information gathered from multiple sources and reconcile conflicts.
Able to decompose high-level information into details, abstract up from lower-level information to a general understanding, and distinguish users requests from true needs.
Collaborate with other business and IS team members to establish business solutions.
Stakeholder Engagement
Work with business units’ users to identify improvement opportunities, plan medium and long-term enhancements and assist users in determining priorities
Take initiative to recommend processes improvements and demonstrate creative thinking
Interact with other member of Enterprise Business Solutions to ensure that questions and discrepancies about specifications are resolved during the solution development process
Partner with business and technology stakeholders to improve collaboration and overall alignment
Work with third party vendors to develop and/or integrate their applications into in-house application landscape
Project Assignment
Support business to build business case for study and/or project approval.
Participate in projects as role assigned. May play the project leader role to lead and coordinate project activities.
Lead User Acceptance Testing activities including defining approach, planning, coordination, and supporting business users to ensure deliverables meet business expectations.
Support transition of project to operations to ensure smooth integration."
"Business Systems and Data Analyst - Toronto, ON - Indeed.com","ABOUT ONEX:
Founded in 1984, Onex invests and manages capital on behalf of its shareholders, institutional investors and high net worth clients from around the world. Onex' platforms include: Onex Partners, private equity funds focused on larger opportunities in North America and Europe; ONCAP, private equity funds focused on middle market and smaller opportunities in North America; Onex Credit, which manages primarily non-investment grade debt through collateralized loan obligations, private debt and other credit strategies; and Gluskin Sheff's actively managed public equity and public credit funds.
ABOUT GLUSKIN SHEFF & ASSOCIATES:
Gluskin Sheff + Associates Inc. is one of Canada's pre-eminent wealth management firms. Founded in 1984 and acquired by Onex in 2019, we are dedicated to meeting the needs of our clients by delivering strong, risk-adjusted returns together with the highest level of personalized client service to high net worth private clients and institutional investors.
THE OPPORTUNITY:
As a member of the Application Development and Support team, the
Business Systems & Data
Analyst
will be responsible to provide a broad range of services in business, systems and data analysis that support the effective and efficient delivery of quality solutions that meet the needs of the business.
The position is embedded in the development and delivery process and includes a range of responsibilities for working with the business and data requirements and converting them to system and data specifications used for developing technical solutions.
WHAT YOU WILL DO:
Understand the current business architecture, processes and models and relating them to data, systems and applications; identifying system and data requirements specifications for implementing IT solutions.
Interacting with business users and system stakeholders to identify business, functional and data gaps and needs, gather and elicit comprehensive functional, data and technical requirements for system development.
Conducting gap analysis between current systems and new business requirements and collaborating with system architects and developers to estimate impact to the system architecture, system/data design and development activities and tasks required to support the new functionality.
Delivering quality functional and technical requirements documentation and detailed system specifications to be used for the development and maintenance of the new and existing software applications, databases, systems and solutions, including: Use Case descriptions, User Stories, System / Data Models, Data Dictionaries, Data Flows, Interface Specifications, Data Mapping and Business rules etc.
Collaborating with Development, QA, and Operations team members to communicate, verify, and test the desired functionality changes.
Working with the QA team to assure that QA and testing process and activities provide sufficient coverage and assurance of the system software meeting functional and technical requirements and agreed quality criteria.
Working with the business stakeholders and product owners to demonstrate and review changes to the systems to ensure all relevant business needs and functions are addressed as expected.
Recommending and institutionalizing BA/BSA best practices, methodology and tools.
WHAT YOU BRING:
University degree in Computer Science/Engineering and/or Business/Commerce/Finance.
At least 3 years of experience as a Business Systems / Data Analyst.
Highly organized, ability to multi-task and work well under pressure.
Strong critical thinking skills, including systems, business analysis, risk analysis, conflict resolution and decision-making abilities, keen attention to detail.
Strong analytical and product management skills, including a thorough understanding of how to interpret business requirements into data models, data flows, functional and operational requirements.
Experience with planning and execution of data conversion and migration projects.
Understanding of the relational database design and modeling, data queries and reporting, data integration and ETL.
Database querying and data reporting - familiarity with SQL Server / SQL Management Studio, SQL etc.
Proficient skills in Microsoft Office (Word, Excel, Visio, Access).
Knowledge of the application development practices working as a member of an application development team practicing software development lifecycle methodologies – ""waterfall"", Agile/Scrum etc.
Experience working with Planning, Agile or DevOps tools – Azure DevOps, Atlassian (Jira), Asana etc.
Experience working in Financial Services or Wealth Industry is strongly preferred."
"Quality Assurance Analyst - Toronto, ON - Indeed.com","Description
Angus Systems is the leading provider of mobile and cloud based work order and operations management solutions for commercial real estate teams. We help our clients shine.
Our success as a company isn’t possible without our talented team. As a result, we’re committed to a work environment where each team member feels challenged, respected and valued.
We are looking for a
Quality Assurance Analyst
to join our team! The successful applicant will have expert analytical and communication skill, and will become a key contributor to the quality of our software product suites.
What you’ll get to do:
Work closely with development team based on company defined development processes and methodologies
Contribute in sprint planning and user story grooming
Design test plan and test cases from user stories
Execute test plans and test scripts to certify the application and data correctness
Participate in post deployment testing
Assess risks and escalate to team on impediment
Provide estimates for testing tasks
Work with development team to achieve balance of test coverage and agility
Analyze and troubleshoot application / test environment issues
Create and maintain automated test suites
Requirements
Who you are:
You have a University degree or college diploma in IT related or Math related field, or equivalent industry experience
You have
minimum 2 years QA experience with SaaS application (website and mobile app)
You have worked in an Agile environment as QA
You have knowledge of a spectrum of software development methodologies
You have knowledge in SQL and have written queries
You are familiar with computer programming language and concepts
You have excellent multiple tasking and time management skills
You are an excellent problem solver who enjoy challenges
You are comfortable working off hours occasionally
Benefits
What we offer:
An opportunity to work in a stable and exciting work environment with growth opportunities
Tuition reimbursement program
Medical and dental benefits without a waiting period
Three (3) weeks paid vacation
Location! We are in Don Mills with free parking, close to the 401 and DVP, with bike racks, and a TTC stop outside our office
Defined Benefit Pension Plan
Employee Assistance Program
Various perks such, gym membership, fitbit for monthly team challenges, Perkopolis and socials for everyone from book club to sports
A culture that encourages volunteering, giving back, team activities, and teamwork
An open concept, bright office with access to Wilket Creek and Sunnybrook Park
We thank all applicants for your interest; however only selected candidates will be contacted.
Angus Systems is an equal opportunity employer, and is committed to building a diverse workforce representative of the communities we serve. We encourage all qualified candidates to apply. No recruiters please."
"Service Desk Analyst - Moncton, NB - Indeed.com","For over 75 years, Medavie Blue Cross has been a leading health and wellness partner for individuals, employers and governments across Canada. We are proud to be a not-for-profit organization dedicated to giving back to the communities where we live and work, and to ensuring our employees thrive in our award-winning, collaborative culture. We are one of Canada’s Most Admired Corporate Cultures and are recognized as a Caring Company, a designation for national leaders in community investment and social responsibility.
Our team of 2,100 professionals work across six provinces. We excel by living our shared values of being caring, accountable, responsible, innovative and community-minded. We’re committed to ensuring the health and wellness of our employees and their families, along with personal and professional growth, through a variety of programs and support at all levels of our organization.
Along with Medavie Health Services, we are part of Medavie — a national health organization with over 6,400 employees. Together, our mission is to improve the wellbeing of Canadians.
Job Title:
Desktop Support Analyst
Department:
Enterprise Architecture
Competition:
35401
Internal/External:
Internal/ External
Employment Type:
Full time, 6 month term
Location:
Moncton, NB
Salary:
Competitive Compesation
Reports To:
Manager
Position Summary
The primary function of the Desktop Support Analyst is to administer a variety of technical projects related to the setup, maintenance, and support of Medavie Blue cross assets. Duties for this position include but are not limited to the support of all IT assets. This position also includes the troubleshooting and installation of different external and in-house built software and different versions of MS Windows and Mac OS Operating systems.
Key Responsibilities
Install and troubleshoot software and hardware in a Windows and Mac OS environment
Provision (image, test) desktops, laptops, monitors, printers, and other related hardware.
Troubleshoot network connectivity, for both local and remote employees
Provision and support mobile devices (iPhone, iPad), and video conferencing equipment
Provide technical support and training to video conference users.
Provide extended support to executive team
Manage the lifecycle of computers, laptops, and other devices
Train other staff and stakeholders on technical solutions as needed
Support key projects across the organization, completing tasks as assigned
Frequently lift and carry computer equipment averaging 20 pounds
Required Qualifications
Education: Applicants must possess a post-secondary education in a computer technology related program, or equivalent experience.
Work Experience: One to three years’ experience in a customer service environment in a technical support role; experience providing technical support would be an asset.
Other Qualifications: The ability to work independently; strong written and spoken communication skills and troubleshooting/problem-solving ability.
Technical Skills: Familiarity with Active Directory, Powershell, Windows 10 policies and administration, and Cherwell (or an equivalent IT Service Management system) would be an asset.
Language Skills: Professional level written and spoken bilingualism in English & French is an asset.
We would like to thank all candidates for expressing interest. Please note only those selected for interviews will be contacted.
Medavie Blue Cross is an equal opportunity employer.
In order to keep our employees, candidates, and community safe during the COVID-19 pandemic, the majority of our employees are working from home within Canada. All interviewing, onboarding and most work takes place remotely at this time. For those employees who must work in our offices, we have taken every precaution to ensure the health and safety of our people by providing strict protocols/practices to meet legislated client and company needs, as well as modifications to the worksites to mitigate the risks for everyone's protection.
Job Segment:
Information Technology, IT Architecture, Service Desk, Testing, Technical Support, Technology, Customer Service"
"Technical Business Analyst and QA - Mississauga, ON - Indeed.com","Job Summary
As a Quality Assurance and Technical Support Analyst at Clear Spider, you will be working on interesting projects with world leading companies that employ the latest technologies. We are looking for a detail-oriented team player who thrives in a fast paced work environment. The ideal candidate will be a self starter with a client-focused attitude and demonstrated experience in a similar function.
Pursue your career in a growing and rewarding environment while working alongside a great group of professionals. We strongly believe in giving our team members the platform to make a significant impact. In this role, we want you to grow with us, and make the biggest contribution you can possibly make.
RESPONSIBILITIES:
Develop and communicate detailed business requirements through written documentation, process flows and use cases
Identify, trace, isolate and replicate problems and successfully conduct root cause analysis as required
Deliver highly detailed reproduction steps to developers for defects
Document, track and escalate issues as appropriate, and maintain knowledge base
Communicate status, open issues and issue resolution to project teams and manager in a timely manner
Participate in the analysis, design, implementation and ongoing support requirements and prepare accurate testing estimates
Provide advice on the testing strategy, test plans, the selection of testing tools, and the identification of resources required for testing.
Plan and organize testing efforts that incorporate all of the activities required to effectively test the system, e.g. regression testing, systems integration testing, stress testing, user acceptance testing etc
Create and execute test plans to ensure development outputs meet defined business requirements and technical specifications
Write test cases and update test cases on requirement updates
Compose manual and automated test scripts for new and existing functionality
Execute test cases and document the results
Coordinate and facilitate regular defect review meeting with stakeholders, and provide defect status reports
Required Education, Skills and Qualifications
REQUIREMENTS:
B.COMM, BS, Computer Science or equivalent
Strong background in, and at least 2+ years of working in QA
2+ years experience in functional analysis and business requirements identification
Some experience in bug tracking tools
Excellent analytical and interpersonal skills; excellent English language verbal and written communication skills
Scripting (perl, javascript, jquery), JSON, XML, SQL, data migration and upload, web services
Demonstrated understanding of complex e-commerce businesses
Demonstrated ability to meet deadlines and manage multiple projects
Articulate, detail oriented, hard-working, team player being able to work under pressure
Inventory/distribution/logistics industry experience is a plus.
COMPENSATION & BENEFITS
Generous compensation with paid vacation days, as well as health and dental benefits
Registered Retirement Savings Plan (RRSP) and Deferred Profit Sharing Plan (DPSP) available for you to participate in (Clear Spider adds to your RRSP contributions)
A positive, growth-oriented team environment and frequent office social events
Company Profile
ABOUT CLEAR SPIDER
Clear Spider is the market leader in enterprise cloud-based inventory management solutions.
Over 100,000 companies around the world use Clear Spider. Our clients include Fortune 500 companies, as well as small to medium sized businesses. Our solutions include inventory management, warehouse management, and order management. Clear Spider is available through the cloud on desktops, tablets, and smart phones.
Job Types: Full-time, Permanent
Salary: $46,922.00-$102,409.00 per year
Benefits:
Extended health care
Schedule:
Monday to Friday
Experience:
Quality Assurance: 2 years (preferred)
Technical Analysis: 2 years (preferred)
Work remotely:
Temporarily due to COVID-19"
