Title,Description
"Project Analyst, IT Business Line Support - Gatineau, QC - Indeed.com","Public Service Commission of Canada - Corporate Affairs Sector - Information Technology Services Directorate
Gatineau (Québec)
CS-02 - CS positions are under review and will be converted to the IT group in December 2021
$75,129 to $91,953
For further information on the organization, please visit Public Service Commission of Canada
Closing date: 13 December 2021 - 23:59, Pacific Time
Who can apply:
Persons residing in Canada and Canadian citizens residing abroad.
Apply online
Important messages
We are committed to providing an inclusive and barrier-free work environment, starting with the hiring process. If you need to be accommodated during any phase of the evaluation process, please use the Contact information below to request specialized accommodation. All information received in relation to accommodation will be kept confidential.
Assessment accommodation
At the Public Service Commission of Canada, we foster a healthy, modern, diverse and inclusive workplace. Our efforts to create and maintain an outstanding workplace have been recognized. According to Forbes magazine, we are one of Canada’s Best Employers in 2021. Apply for a job today to join a great team.
As a result of the global pandemic, PSC employees are currently working from home. Should the current telework environment no longer apply, and contingent on the operating model adopted by the PSC, you may be required to report into and work onsite from our Gatineau office. However, as our telework arrangements are evolving, we encourage you to apply.
Intent of the process
The intent of the process is to staff one (1) indeterminate position. The language requirement of the position we are staffing is English or French. A pool of qualified candidates may be established to staff similar bilingual positions within the PSC and other government departments.
Positions to be filled:
1
Information you must provide
Your résumé.
In order to be considered, your application must clearly explain how you meet the following (essential qualifications)
EDUCATION
ED1: Successful completion of two years of an acceptable post-secondary educational program in computer science, information technology, information management or another specialty relevant to the position to be staffed.
Notes:
1. Indeterminate period incumbents of positions in the CS group on May 10, 1999, who do not possess the education prescribed above, are deemed to meet the minimum education standards based on their education, training and/or experience. They must be accepted as having met the minimum education standard whenever this standard is called for when staffing positions in the CS group.
2. It is the recognized educational institution (e.g. community college, CÉGEP or university) that determines if the courses taken by a candidate correspond to two years of a post-secondary program at the institution.
3. At the manager’s discretion, an acceptable combination of education, training and/or experience may serve as an alternative to the minimum post-secondary education stated above. Whenever the minimum education is met using this alternative, it is met for the specific position only and must be re-assessed for other positions for which this alternative has been specified by the manager.
Degree equivalency
EXPERIENCE
E1: Experience contributing to the creation or maintenance of an IT project plan integrating activities from multiple IT functions and units, including but not limited to: (Business Analysts, Developers, and Database administrators, Quality Assurance, Infrastructure, Help Desk and Support)
E2: Experience establishing and maintaining working relationships with multi-disciplinary stakeholders and teams
E3: Experience researching and synthesizing information to prepare IM/IT-related reports or presentations for management
If you possess any of the following, your application must also clearly explain how you meet it (other qualifications)
ASSET EDUCATION
AED: Bachelor’s degree from a recognized post-secondary educational program, with a specialization in computer science or a similar technical field of study
Degree equivalency
ASSET EXPERIENCE
AE1: Experience facilitating or leading consultations with clients and stakeholders
AE2: Experience using MS Project Online software
AE3: Three (3) or more years of experience creating and maintaining artifacts for IM/IT projects according to a project governance framework
The following will be applied / assessed at a later date (essential for the job)
Various language requirements
English or French Essential
Bilingual - imperative (BBB/BBB)
Information on language requirements
Second Language Writing Skills Self-Assessment
In order to help you decide if you should apply to a bilingual position, an optional self-assessment of your writing skills in your second official language is available for you to take before completing your application.
For more information, please consult:
Unsupervised Internet Test of Second Language Writing Skills
KNOWLEDGE
K1: Knowledge of software development lifecycle (SDLC)
COMPETENCIES
COMP1: Analytical thinking
COMP2: Initiative
COMP3: Effective interpersonal skills
COMP4: Reliability
ABILITIES
A1: Ability to communicate effectively orally
A2: Ability to communicate effectively in writing
A3: Ability to manage conflicting priorities under tight deadlines
The following may be applied / assessed at a later date (may be needed for the job)
Selection may be limited to members of the following Employment Equity groups: persons with disabilities, women
Information on employment equity
Willingness and ability to work overtime as required
Conditions of employment
Reliability Status security clearance
All employees of the core public administration are required to be fully vaccinated against COVID-19 and attest to their vaccination status unless accommodated based on a medical contraindication, religion, or another prohibited ground for discrimination as defined under the Canadian Human Rights Act.
Other information
The Public Service of Canada is committed to building a skilled and diverse workforce that reflects the Canadians we serve. We promote employment equity and encourage you to indicate if you belong to one of the designated groups when you apply.
Information on employment equity
On October 6, 2021, the Government of Canada announced details* of its plans to require vaccination across the federal public service.
As per the new Policy on COVID-19 Vaccination for the Core Public Administration Including the Royal Canadian Mounted Police,** federal public servants in the Core Public Administration and members of the RCMP must attest to their vaccination status. The requirement for employees to be fully vaccinated applies whether they are teleworking, working remotely or working on-site. This is a condition of employment and it applies to indeterminate (permanent), determinate (term), casual, and student hiring. Should you reach the point in the selection process where it is necessary to verify terms and conditions of employment then the hiring manager or a human resources representative will contact you in order to complete an attestation.
Details on Vaccination Requirements : https://www.canada.ca/en/treasury-board-secretariat/news/2021/10/backgrounder-covid-19-vaccine-requirement-for-the-federal-workforce.html
**Policy on COVID-19 Vaccination : https://www.tbs-sct.gc.ca/pol/doc-eng.aspx?id=32694
Candidates have the right to be assessed in the official language of their choice.
Candidates must clearly demonstrate in the screening questionnaire how they meet the education and experience criteria listed as essential and asset qualifications on the statement of merit criteria. In order to do so, the candidate must provide the information as part of their answer to the pertinent screening question, using concrete examples, in the textbox provided. The assessment board cannot and will not make any assumptions about your experience. Note that it is not sufficient to only state that the qualifications are met or to provide a listing of current or past responsibilities. Resumes may be used as a secondary source to validate the experience described in the experience questionnaire. Failure to clearly demonstrate in the questionnaire how you meet the education and experience, both essential and asset, where applicable, may result in the rejection of your application. Candidates will not be solicited for incomplete or missing information.
Communication for this process will be sent via email. It is the responsibility of the candidate to ensure accurate contact information is provided and updated as required. Candidates who apply to this selection process should include an email address that accepts email from unknown users (some email systems block these types of email).
Volume management mechanisms may be used.
All the information collected during the selection process, from the time of application until the end of the process, will be used to assess the candidates.
Asset qualification(s) may be applied in this selection process.
Written communication will be assessed via the candidate's job application.
You will be asked to provide a minimum of two (2) references.
Preference
Preference will be given to veterans first and then to Canadian citizens and permanent residents, with the exception of a job located in Nunavut, where Nunavut Inuit will be appointed first.
Information on the preference to veterans
We thank all those who apply. Only those selected for further consideration will be contacted."
"Business Analyst (Bedford, NS) - Bedford, NS - Indeed.com","What is the opportunity?
The business analyst (BA) responsibilities will included understanding the liquidity measure for various products; mapping source data to internal liquidity risk reporting (e.g. Net Cash Flow Report, etc.) and regulatory liquidity reporting for various regions (e.g. LCR, NSFR, NCCF and H4 for Canada, 2052a for US, LCR for EBA, etc.); and supporting product related items.
Primarily, the BA will create mapping logic for liquidity risk reporting or create requirement document and liaise with IT developers to communicate those requirements; and plan/coordinate all user testing, coordinate implementation/migration as necessary and communicate (written and verbally) to project leadership team and or senior management on project status throughout the project lifecycle.
What will you do?
Understanding various product attributes from upstream.
Performing data gap analysis, systems, processes and procedures as required for the project.
Create reporting mapping logic or requirement document
Communicating requirement to development and QA, performing testing, coordinating UAT testing and assisting production implementation
Contributing to the process re-engineering and process improvement where applicable.
Supporting user’s training and documentation as needed.
Report the BA team working status and raise concerns or issues that may hinder the project progress as planned to management and PMs
What do you need to succeed?
Must-have
Experience in systems implementation, process improvements or systems re-engineering projects with a banking organization or consulting company.
Undergraduate degree or higher, preferable in Mathematics, Computer Science, Engineering or Finance
Knowledge of SDLC lifecycle, Agile, others
Experience in SQL
Advance MSWord, MS Project, MS PowerPoint and MS Excel, Visio, MS Access
Nice-to-have
Understanding of Liquidity Risk reporting
Experience in data sourcing and mappings to cover major Capital Market and Retail financial instruments for both on and off –balance sheet.
Tableau
Learn more about RBC Tech Jobs"
"Technology Service Analyst - Toronto, ON - Indeed.com","Address:
4100 Gordon Baker Road
Job Family Group:
Technology
The Technology Service Analyst is accountable to identify and address service issues throughout the bank’s technical systems. Using advanced analytical skills, produces and assesses data from various sources to proactively identify trends that indicate service improvement opportunities while managing risk. Exhibiting strong leadership, the Analyst coordinates efforts across multiple COEs to drive forward and resolve problem investigations, and support Specialist led initiatives.
Lead Service Improvement Initiatives:
Form/Oversee cross functional teams to manage stabilization of services that are experiencing multiple, ongoing, or repetitive issues.
Regularly meet with partners. Helpdesks, SDMs, SOC, Problem team, Support and development teams.
Liaise with reporting team and other partners as required to identify and address issues proactively. Provide leadership and representation for all Escalations, organizational and MIM initiatives and improvements. This includes new processes and tools for future state.
Lead Major Problem investigations and be accountable to own problem investigations through to resolution, as defined by the Problem Management Key Performance Indicators.
Identify trends and improvement opportunities.
Collaborate with all teams to identify opportunities in terms of people, process, and technology to improve the overall effectiveness of the team.
Manages follow up from MIM managed incidents, ensuring successful root cause investigations by Problem Management, with a focus on incidents that have a high risk of reoccurrence.
Schedule and lead meetings as required.
Reporting:
Daily updates, Huddle Reports and input to REO
Develop and report on key metrics. Produce Daily, weekly and monthly summary reports for upward consumption & awareness; identify trends and required improvements with assigned owners. (Huddle, REO reports and Monthly MIM reports)
Develop an automation strategy and lead initiatives to implement automation enhancements.
Back up Technology Service Specialist and Incident Manager as required.
Lead the operations management team Daily Huddle meeting when required.
Facilitate PIR’s when required.
Assume ownership of activities as requested by the TSI
Specialist.
Responsible to drive activities forward to resolution.
Provides technical expertise and oversight on the production floor, understanding the full process requirements (compliance, equipment, regulatory) in order to best understand and resolve production issues.
Manages complexity across business value, technology and interaction models.
Recommends and implements solutions based on analysis of issues and implications for the business.
Identifies emerging issues and trends to inform decision-making.
Conducts independent analysis and assessment to resolve strategic issues.
Establishes deep relationships at all levels within IT and business units, to effectively collaborate in business strategy.
Monitors and tracks performance and addresses any issues.
Breaks down strategic problems, and analyses data and information to provide insights and recommendations.
Participates in both internal and external regulatory inspections.
Works with other operations personnel to develop and implement the counter-measures necessary to improve production and equipment reliability as well as the compliance posture of the team.
Provides end to end technology support including computer, applications, network and storage, and root-cause analysis etc.
Drives and/or promotes new processes, systems, technology, and operations and expanded capabilities for performance, with the flexibility to align to the unique requirements of the project teams and deliverables.
Proactively monitors system performance and identifies operational improvements, in ensuring smooth and consistent customer and business partner delivery.
Monitors technical infrastructure, applications and/or business transactions through automated systems and instrumentation across the environment.
Collaborates and engages with the appropriate areas across the bank.
Promotes adherence to standards and industry best practices.
Stays abreast of industry technical and business trends through participation in professional associations, practice communities & individual learning.
Focus is primarily on business/group within BMO; may have broader, enterprise-wide focus.
Provides specialized consulting, analytical and technical support.
Exercises judgment to identify, diagnose, and solve problems within given rules.
Works independently and regularly handles non-routine situations.
Broader work or accountabilities may be assigned as needed.
Qualifications:
Possesses a university degree/college diploma in Computer Science or equivalent work experience, and/or 5 to 7 years experience in Banking applications or technical support environment
Understanding of Information Technology operating processes used for systems to ensure effective delivery including but not limited to IT Operations mandatory operating standards for monitoring, logging, and alerting.
Demonstrates solid knowledge of supported operating systems (Windows, HP UX, SUN Solaris, IBM AIX, Linux)
Displays sound knowledge of infrastructure applications and services (Cloud Technologies, Windows Sharepoint/Portal Services, IIS, Databases, MQ Services, Websphere)
Contains applied knowledge of ITIL processes including Problem and Change Management, and Configuration and Release Management
Working knowledge of ServiceNow
Possesses solid communication and interpersonal skills
Displays applied problem solving and analytical skills
Illustrates sound customer service skills
Demonstrates solid teamwork skills
Exhibits solid coaching and leadership skills
Is self-motivated, goal-oriented, and customer-service oriented
WORKING CONDITIONS
The working environment provides minimal exposure to discomfort or risk to safety. Work hours include normal business hours with on-call and off-hour/weekend support as required.
We’re here to help
At BMO we are driven by a shared Purpose:
Boldly Grow the Good in business and life. It calls on us to create lasting, positive change for our customers, our communities and our people. By working together, innovating and pushing boundaries, we transform lives and businesses, and power economic growth around the world.
As a member of the BMO team you are valued, respected and heard, and you have more ways to grow and make an impact. We strive to help you make an impact from day one – for yourself and our customers. We’ll support you with the tools and resources you need to reach new milestones, as you help our customers reach theirs. From in-depth training and coaching, to manager support and network-building opportunities, we’ll help you gain valuable experience, and broaden your skillset.
To find out more visit us at
https://jobs.bmo.com/ca/en
.
BMO is committed to an inclusive, equitable and accessible workplace. By learning from each other’s differences, we gain strength through our people and our perspectives. Accommodations are available on request for candidates taking part in all aspects of the selection process. To request accommodation, please contact your recruiter."
"IT Service Desk Analyst II - Saint John, NB - Indeed.com","What you can expect in a typical day
The IT Service Desk Analyst II provides moderate to complex technical support and exceptional customer service to all employees of Irving Oil. They are the single point of contact for all issues and requests and interact with employees in various ways, including phone calls, chats, emails, and in person. As the face and voice of IT, this role provides a positive attitude and willingness to help employees get back to work as quickly as possible by providing excellent first call resolution, troubleshooting, analyzing root causes and resolving moderate to complex problems. They have the ability to adapt to an ever-changing environment, multitask, and provide both remote support through various tools as well as hands on support of devices. Please note that this role requires shift flexibility.
What you’ll need to succeed:
Provide troubleshooting and problem resolution for software and hardware issues that vary from moderate to complex avoiding escalation
Provide training and technical assistance on MS Windows operating systems, MS Office suite (including MS Outlook), and Web Browsers
Demonstrate competency in an adaptive and rapidly changing IT environment
Troubleshoot the cause of problems, not just the symptoms, and taking action to prevent problems from recurring and to mitigate risk exposure
Analyze, determine root causes and implement solutions to resolve support requests according to the service level agreements with the caller, and handle escalate issues when applicable
Logging of all calls into an ITSM Ticketing tool with clear and concise language
Build supporting documents and provide ‘how to’ instructions and guidance regarding all business applications
Follow communication procedures, guidelines, and policies
Interact with customers via phone, chat, email and in person.
Assist on Metric Reporting and analysis of the IT Service Desk when necessary
Recommend improvement and optimization opportunities to meet or exceed departmental targets and service-level agreements (SLAs)
Provide guidance and support to less experienced analysts.
Professional skills
Previous experience working in an enterprise environment with 3-4 thousand users
Experience with Remote support tools, and monitoring tools including SCCM and SolarWinds
Experience using ServiceNow for ticketing to manage Incidents and Service Requests
Experience with Active Directory, Domain Services; Windows operating systems, MS Office/365 applications; Network (LAN/WAN) concepts, VPN technologies; Mobile Technologies (Smartphones/Tablets)
Demonstrate excellent interpersonal, oral, verbal, and written communication skills in dealing with all levels of staff, as well as the ability to manage user expectations.
Bilingual in both French and English is an asset
Travel
Travel is not a requirement for this position.
Education and experience
Degree or diploma in a computer-related program. Windows-based certifications such as MCP or MCSE is an asset
Minimum 3 years’ prior experience in IT or Helpdesk environment. Deskside experience is an asset. In-depth technical experience working with Intel-based PCs and laptops
Irving Oil supports a diverse and inclusive work environment and welcomes applications from all qualified applicants.
Job Requirements - Work Experience
Information Technology
Job Requirements - Education
Diploma / Certification: Information Technology
Location
Saint John, NB"
