Title,Description
Brand Marketing Lead - British Columbia - Indeed.com,"The
Brand Marketing Lead
plays an essential role in
growing talent
in our business through collaboration and sharing best practices with the Brand Marketing team. You know how to
be curious
about their opportunities and how to
be real
with feedback and support.
The Brand Marketing Lead creates engaging, consumer-insight driven marketing initiatives to increase brand discovery, traffic and brand consideration leading to sales. As the lead business brief creator for a POD, you collaborate with creative and consumer insight peers to create omnichannel, brand and marketing department strategies for use across multiple digital channels and in-store.
As a growing business, Lush needs people that can
adapt and evolve
to the needs of our business, analyse and respond to your learner's needs. Our Lush staff
live with purpose
, finding their personal value connection with the values of our business, bringing their work and life paths into one holistic journey. #mylushlife
Reporting to the
Senior Brand Marketing Manager
, the
Brand Marketing Lead
undertakes the following
RESPONSIBILITIES:
Support the Senior Brand Marketing Manager and Brand Director by creating short, mid and long-term marketing strategies/briefs to support brand marketing goals, sales targets and content calendar for a designated POD or projects
Use both consumer and marketing insights to develop relevant strategic approaches built on SMART planning that identifies marketing goals and bench-marked social metrics, sales targets, overall market opportunities and consumer insights
Manage POD specific, strategic development of seasonal and monthly product campaigns and new product launches including collaborating with other PODs for department-wide launches
Ensure POD marketing initiatives are successful, metrics-driven, goal-oriented and true to the Lush brand
Develop brand briefs that collaborate with and consider the business needs of retail/in-store and visual merchandising, digital (website, e-comm, app, email)
Ensure the timely execution of briefs with the collaboration of creative services and project managers
Identify distinct omni-channel opportunities and partnerships at key moments to engage, acquire and retain customers
Work closely and collaborate with creative, PR/events, social media/digital partners to ensure messaging follows brief strategies and is delivered with excellence, based on the business and brand priorities
Provide insightful, objective and relevant feedback to creative teams to deliver on brand business strategy briefs and targets
Continually raise the bar on development of compelling, data-driven storytelling with a customer focus
Develop and present campaign and all-year-round briefs to relevant stakeholders and develop various presentations for internal and external communication as needed
Analyze results of programs, draw conclusions and develop actionable recommendations
Accountable for measuring results and exploring ways to improve performance
Work closely with both consumer insights and social media lead to track and understand campaign impact on consumer sentiment and brand health to build successful strategies
Prepare and present campaign and all-year-round reporting and analytics on all marketing activity tracking the effects of marketing strategies to extract key insights for future campaign development and go-to-market strategies complete with formal proposals and recommendations on tactics
Track POD monthly and annual budget including forecasting, PO creation, invoice processing and monthly reconciliation and identifying variances between actual and budgeted financials each month with the Senior Brand Marketing Manager and Brand Director.
You bring the following
QUALIFICATIONS:
6 - 7 years of experience in one or more of the following: marketing, public relations or social media.
3+ years' experience in successfully building marketing strategies
Success in building, executing and scaling cross-functional marketing programs
General management/strategic mindset and brand management training at a consumer-packaged goods company
Ability to operate at both a strategic and execution level
Experience creating marketing briefs and working with Creative teams
Experience presenting metrics and progress to goal to senior leadership
Strong oral and written communication skills with proven ability to influence
Strategic understanding of brand, digital and social media marketing in addition to appropriate metrics of success
Proven success in developing social/digital marketing approaches
Fluency in digital/social, paid and organic marketing and ability to identify and proactively understand emerging channels
Tenacity for trying new types of story-telling and taking creative risks
Ability to move easily between generating big, creative ideas and driving ongoing process improvement
Proven ability to problem solve, think critically and in an integrated manner, while presenting outside- the-box ideas
Strong ability to analyze results of programs, draw conclusions and develop actionable recommendations
Ability to interpret data, draft recaps/presentations, and make actionable recommendations
Strong problem solving and analytical skills, including comfort with data
Proven project management and planning skills, with ability to manage, prioritize, multi-task and thrive in a fast-paced, high-growth environment
Experience using data and metrics to measure impact and determine improvements
Preferred:
Bachelor's degree (or higher) in related field (communications, marketing, journalism or public relations) or equivalent
Direct experience working within cosmetics/beauty industry
Thriving with a diverse company culture, celebrating the uniqueness of our staff and committed to inclusion. We are proud to be an equal opportunity employer.
We thank all interested applicants; however, only qualified candidates will be contacted."
"Digital Marketing Specialist - Milton, ON - Indeed.com","COMPANY: PHOENIX CONTACT CANADA
LOCATION: Milton, ON
JOB TITLE: Digital Marketing Specialist
REPORTING TO: Marketing Manager – Industrial Components & Electronics
DESCRIPTION:
The Digital Marketing Specialist will support collaborative efforts in the distribution of integrated marketing services used to attract, engage, and convert customers online. This position will utilize social media, mobile apps, paid media, content marketing, SEO optimization, in addition to other emerging tools and platforms to develop and deploy cohesive messages for the market, such that all outbound messages have the look and feel that reinforces the company brand (Examples: YouTube, Facebook, Twitter, LinkedIn, Google AdWords). This position will assist in the strategic planning and execution of multi-year messages across digital and online media to support the individual product and industry needs in the core functions of business including Industrial Components & Electronics, Industry Management & Automation, Device Connections and E-Mobility.
RESPONSIBILITIES:
Perform digital landscape analysis, competitive audits, target audience analysis for brand Planning and new business opportunities.
Stay abreast of new media and digital trends
Strategy and execution of the digital marketing including SEO, Paid Search, Paid Social, Social Media and Content Marketing.
Ensure best practices are met across all digital tactics including paid search, SEO, display media, social media, and emails.
Assist in the development of advertising campaigns that most effectively utilize the resources to address the needs of the Product Marketing Managers (PMMs), Vertical Market Managers (VMMs), and Distribution in delivering a cohesive message.
Incorporate the strategic plan into messages placed on YouTube, Facebook, Twitter, and LinkedIn while monitoring emerging social platforms and advising on Phoenix Contact's engagement within them.
Measuring and reporting on the performance of all digital marketing campaigns
Research and identifying target audiences and devising digital campaigns that engage, inform and motivate.
Ensure all content and digital assets meet all defined brand and legal standards, following established procedures and tools/workflows.
Coordinate and develop the electronic/digital messaging and management for the PMMs and with the VMMs while incorporating lead collection practices.
Develop targeted marketing programs to advance sales penetration at the small/medium customers.
Maintain effective communication channels and working relationships.
Provide digital strategy insights and recommendations based on analysis from analytical tools such as Google Analytics and Retargeted Marketing program in place.
Other duties as assigned.
Develops new and improved methods, products, procedures, or technologies.
QUALIFICATION REQUIREMENTS:
Marketing or Business Administration degree/diploma or equivalent related work experience.
Advanced technical knowledge of YouTube, Instagram, Facebook, Twitter, LinkedIn.
Understanding and experience working with SEO and SEM
Proficient with Adobe Photoshop, Illustrator, InDesign, HTML, HTML 5
Basic understanding of Industrial Control Applications is an advantage.
Experience in project and campaign management
Excellent communication, analytical & multitasking skills
Working knowledge of Microsoft Office: Microsoft Excel, Word and PowerPoint.
Bilingual
(English / French) an asset
ABOUT THE COMPANY
Phoenix Contact's roots are in Germany. Our headquarters are in Blomberg. Originally founded in Essen in 1923, we have grown over the years. With over 50 subsidiaries worldwide, we truly have Global reach.
Together with customers and partners, we design solutions for the future using trend-setting connection and automation technology. Wherever they are needed – for example, in transportation infrastructure, electromobility, for clean water, regenerative energies and intelligent supply networks, or energy-efficient machine building and systems manufacturing.
We face up to technological developments and the associated changes in society. With almost 100 years of experience in the field of machine building and automation, we are working on tomorrow's intelligent production today.
We appreciate your interest; however only candidates selected for interviews will be notified.
Phoenix Contact Ltd welcomes and encourages applications from people with disabilities. Accommodations are available on request for candidates taking part in all aspects of the selection process."
"Email Marketing Specialist - Richmond Hill, ON - Indeed.com","Email Marketing Specialist
Wired Messenger, is a Canadian Digital Marketing agency based out of Richmond Hill that specializes in email marketing, web design, web development, print and social marketing. We are a team of thinkers, creators and doers with over 18 years of experience that have completed some awesome projects and campaigns for some of the biggest brands in Canada.
Currently, we are looking for an Email Marketing Specialist that thrives in a fast-paced environment and will bring his or her own unique energy, talent, innovation and passion for email marketing. The ideal candidate has strong hands-on HTML coding skills, coupled with a deep understanding and interest in the quirks and limitations of email environments.
What you will be doing:
Performing day-to-day email marketing activities including, but not limited to, design and development of HTML newsletters, email campaign set-up, joining client meetings, scheduling, testing, tagging and deployment of one-time, recurring, triggered and dynamic content-driven campaigns
Ensuring overall client satisfaction through timely and accurate execution of all email marketing campaigns/projects, client customer service issues, client program errors and frequent status communications
Performing quality control checks and document best practices to produce work that is error-free
Troubleshooting technical issues related to HTML templates, list segmentation and other aspects of email execution, as required
Participating in the quality assurance process to ensure final product meets client's expectations by deploying and evaluating test emails to a variety of ISPs
Maintaining email standards including opt-in/out processes, email size, HTML, format, etc.
Participating in regular strategy discussions, occasional client calls, and client presentations
Staying up-to-date on current trends and establish best practices in email marketing through research and testing new technologies for possible implementation
Building responsive HTML emails (both custom and templates) from provided designs
Ensure consistency of email campaigns across multiple clients and browsers and Debug cross-browser web problems for desktop, tablets and mobile devices
What you must have:
2+ plus years experience in HTML5, CSS3, and related technologies in the context of email and interactive web applications.
Strong proficiency and experience with Adobe Photoshop, and responsive design techniques and principles.
Knowledge and experience with debugging email clients.
Hands-on experience with email marketing service providers and marketing automation platforms
Post-secondary education in web development, digital media arts, information technology or related program
What you will bring:
Solid understanding of email best practices and mobile optimization principles
Ability to work effectively on teams and independently, as well as be self-motivated, task-oriented and organized
Skills in planning, organizing, prioritizing and executing simultaneous projects.
Passion and enthusiasm for email marketing and web design.
Attention to detail and ability to work under pressure and manage multiple tight deadlines.
Superb communication skills with the ability to express ideas with professionalism.
Innovative thinker with the ability to implement ideas from inception to execution and to problem solve with a can-do attitude.
This position is currently remote"
"Digital Marketing Coordinator - Toronto, ON - Indeed.com","Canlan Sports
is an organization of
Gamechangers
. We bring best-in-class leagues, programs, camps and tournaments across Canada and the US, and as purveyors of play, we want to tell that story to the world.
We’re only as good as the talent in the room, so our first -line talent is the
cream of the crop
; we frown on complacency; we look for fearless, passionate people, dedicated to their craft and growth.
We provide you the tools to learn and grow within your role, guiding you on a path to improve yourself, because we never settle for less, and you shouldn’t either. And that’s the tip of the iceberg of what makes Canlan
Gamechangers
About the role:
We are looking for a passionate a
Digital Marketing Coordinator
.
Through the combination of creative, content, data and analytics, this role is responsible for developing and supporting robust, intuitive digital marketing deliverables that ultimately drive revenue and customer engagement. Working alongside a team of passionate marketing and creative professionals, this key team member will promote the Canlan Sports experience and products, while growing its digital footprint.
Assisted by creatives, content specialists, and product owners, your knowledge of community building, storytelling, data, analytics, and project management allow you to launch effective digital marketing campaigns, contribute to, and create relevant and engaging conversations, and consistently improve the form and function of Canlan Sports’ digital channels.
This role is accountable for:
Assist in the planning, development, management, and execution of digital marketing plans including campaigns, search engine marketing strategies, third-party and internal ad maintenance, social media publishing, and email marketing campaign deployment.
Support new CanlanSports.com features, eCommerce, product launches and contribute to revenue-driving initiatives
Monitor and track performance of active campaigns and content, with the ability to make recommendations, exceeding targets for our key performance indicators
Report on trends, research and identify new opportunities, and test new strategies to continually improve upon the performance of digital advertising and content development.
Communicate consistently, creatively, and effectively for all internal and external copy writing for, but not limited to, websites, social media & email.
Qualifications & Education
College Diploma or University Degree in Sales & Marketing, Digital Marketing, Communications, Media relations/technology, or equivalent required.
Minimum of 2 years work experience in a digital marketing role with an agency, sports organization, or similar industry, with a proven and successful track record
Abilities, Attributes & Experience
Communication is key; the ability to communicate effectively and efficiently across various channels, using tone of voice appropriate for intended audience.
Enthusiastic with a passion for creativity within the sports industry
Ability to conceptualize digital marketing campaigns that are compelling while adhering to brand standards and buyers’ persona
Excellent interpersonal and writing skills, with demonstrated ability to collaborate across cross-functional teams
Strong attention to detail with meticulous grammar skills
Ability to manage and prioritize projects based on level of importance while establishing deadlines and workback schedules based on key project dates
Driven self-starter, autonomous with capability to multi-task & function well under pressure
Exceptional at disseminating key findings within the digital landscape
Social listening skills coupled with thought leadership to provide comprehensive competitive analysis for bettering digital presence
Proven experience using CMS, SMM, Google Analytics and project management software
Deep technical knowledge of efficient content promotion strategies
Flexibility to adapt to new technologies or processes and develop efficiencies for utilization.
NOTE:
Only those applicants under consideration will be contacted. Please accept our utmost appreciation for your interest. We are an Equal Employment Opportunity employer. Employment decisions are based on merit and business needs, and not on race, color, creed, age, sex, gender, sexual orientation, national origin, religion, marital status, medical condition, physical or mental disability, military service, pregnancy, childbirth and related medical conditions or any other classification protected by federal, provincial and local laws and ordinances. Reasonable accommodation is available for qualified individuals with disabilities, upon request. This Equal Employment Opportunity policy applies to all practices"
VP Of Marketing/GM - Canada - Indeed.com,"An international operator who is launching in Ontario, Canada early 2022 and will be launching in NJ, US shortly after. As such, they are looking for a business leader, a strong marketer, to launch the brand in North America and lead the operation.
We are looking for an energetic individual who has interest in brand development and acquisition-based marketing. You will work closely with the central brand marketing, digital marketing, affiliates, and CRM teams and be the champion of all local advertising and player communication channels in North America.
You must have worked within the online gaming/gambling industry for 2+ years to qualify for this role as the experience is crucial for this operator! This role reports directly to the COO.
Key skills and experience
5+ years’ experience working in a similar marketing leadership role agency or client side in high transactional volume industry.
2+ years’ experience working in B2C online gaming in the US is mandatory with Canadian experience an advantage.
Proven track record of successfully launching a new brand and achieving rapid business growth in the US.
In-depth knowledge of the US and Canada advertising and media space including establishing and maintaining business relationships with specialist media agencies and media owners.
Demonstrating hands on approach proven track record in managing significant above the line marketing budgets, campaigns ownerships from beginning to end, including briefing, forecasting, tracking, reporting and performance analysis.
Experience is people management including recruitment, training, and personal development.
Location:
This role is open to both US and Canadian iGaming candidates. There is an option to start in Canada and relocate in 2022 subject to being able to meet US work permit requirement. You must be willing to relocate to the US, however in the future.
Apply for the VP Of Marketing role at Pentasia."
"Digital Marketing Specialist - Burlington, ON - Indeed.com","Summary
Noah Digital is looking to fill a full-time
Digital Marketing Specialist
, reporting to the VP of Client Success and Training, position within our head office in Burlington Ontario. The candidate will collaborate with our digital marketing team in all stages of marketing campaigns. Your valuable contribution will help us provide quality services to our clients. The ideal candidate would have a solid knowledge of digital marketing, including SEO, social media, and PPC, and good at following directions. The ability to meet deadlines and work in a fast-paced environment independently is a must.
Company Description:
Noah Digital is a full-service data-driven digital agency specializing in search engine optimization (SEO), paid search (PPC), website development, programmatic advertising, social media, content marketing, and conversion rate optimization, located in the heart of Burlington, Ontario. We work with a range of amazing companies that share a common goal – growing their business. We fuel our company off driven and energetic individuals who are motivated to learn and grow every day. We’re currently experiencing high growth and expanding our strong team. We want our Digital Marketing Specialist to be a part of an innovative, strategic and fun company to work for. We work hard, have fun and love what we do. Join us!
Responsibilities
Perform website audit, SEO audit, and marketing research on the competition
Write blog posts and email marketing messages, and prepare social media posting
Work on SEO tasks such as on-page SEO, technical SEO, and link building
Prepare monthly report and analyze data to draw valuable insights
Keep current with SEO, search engine, social media and digital marketing industry trends and development
Coordinate with other team members on various projects
Support the marketing team in daily administrative tasks
Desired Skills & Expertise
3-5 years of digital marketing experience
In-depth knowledge of Google Analytics, SEO tools, and best practices
Proficiency with MS Office, HTML, CSS, WordPress, and basic programming skills
Strong verbal and written communication skills in English is a must
Bilingual, English and Mandarin, is an asset
Benefits and Perks:
Flexible working schedule
Competitive salary
Casual work environment
Please email your resume and a brief paragraph of why you think you’d work well with us to info@noahdigital.ca"
