Title,Description
"Associate Market Manager-Digital Content - Mississauga, ON - Indeed.com","Associate Market Manager-Digital Content
As an owner of the tactical and digital aspects of the marketing plan, this role will drive awareness of genomic testing and Bayer’s TRK fusion cancer treatment across various Oncology audiences. The Associate Market Manager – Digital Content owns aspects of the Health Care Practitioner engagement plan that include TL support, agency coordination, material development, use of content factory, digital campaign execution, and ensures SOP and compliance processes are adhered to.
What you will do:
Marketing tools: Tactical execution of marketing tools. This includes, content factory, agency coordination, internal MAP meetings, PAAB, print (if applicable), translation (if applicable) distribution and communication to field
Digital campaign execution: Tailor marketing material within content factory and with agencies to develop digital materials in oncology across a variety of tumour types
Diagnostic testing programs and materials: Develop relevant diagnostic testing materials for non-rep driven channels to support NTRK gene fusion testing. Support field team with various projects and logistics to implement diagnostic testing programs within hospitals
Website maintenance: Lead and manage FastTRK website, chatbot maintenance and all aspects of the site to be kept up to date and compliant
Who you are:
Post-secondary education in marketing, sales or business
1-3 years’ experience in a marketing support function, an asset
Strong digital acumen to navigate digital projects and campaigns
Good understanding of omnichannel approach and content creation
Strong interpersonal and communication skills – strong team player
Ability to handle multiple projects and deadlines
Strong organizational skills, detail oriented
Solid understanding of internal functions
Ability to speak French would be an asset
Bayer is committed to a flexible hybrid working environment. This is a 12-month term position as a Short-term Assignment or a Contract position.
This position requires full vaccination against COVID-19.
What we offer:
Competitive compensation and rewards package
Collaborative, diverse and inclusive culture
Career development and global opportunities
Work-life flexibility programs such as flex hours, employee discounts, volunteer days, wellness, and other employee offerings
Bayer is committed to fostering, cultivating and preserving a culture of Inclusion and Diversity. We embrace and encourage our employees’ differences and believe that our people are our most valuable asset. The collective sum of individual life experiences, knowledge, innovation, self-expression, unique capabilities that our employees invest in their work represents our culture, reputation, and Bayer’s values and purpose.
Learn more about our values and purpose at: https://www.bayer.com/en/ca/canada-our-purpose-values
All referral candidates must first be submitted via our internal referral system by a current Bayer employee in order to participate in the referral program. Once a Bayer employee has successfully referred you in our system, you will receive an automated email with instructions on how to complete your application.
Application Deadline: November 30th
#LI-CA
Bayer welcomes and encourages applications from people with disabilities. Candidates participating in our selection process requiring accommodation due to a
disability or medical need are encouraged to notify the Bayer representative that they will be meeting with to ensure appropriate arrangements can be made.
Location:
Canada : Ontario : Mississauga
Division:
Pharmaceuticals
Reference Code:
515461"
"Content Marketing Manager - Montréal, QC - Indeed.com","Job Description
As the primary writer and content marketing lead you will play a key role in Vention’s content marketing strategy, from thought leadership to bottom-up user education. Through various content initiatives you will grow awareness of the Vention brand, communicate the value proposition, and strengthen the brand stewardship. The ideal candidate has experience working in the robotic and industrial automation space, is a storyteller at heart, and has the ability to see multiple angles, formats, and ways to tell a story so that it gets the reach it deserves.
More specifically you will:
Shape and maintain the content roadmap, in support of various marketing initiatives, from product launches to new market development efforts
Work in close collaboration with technical and commercial teams to generate new content ideas, translate technical jargon into stories, and review relevance of developed content
Produce clear and consistent content in line with Vention’s brand tone of voice and values
Build authority and brand trust with thought leadership content geared toward decision makers and leaders in manufacturing industries
Engage a community of manufacturing professionals and engineers with practical, educational, and relevant technical content
Oversee, support, and develop copy for various product launches and marketing campaigns across a variety of digital platforms (i.e. web, social media, blogs, email, etc.)
Continuously update existing content to maintain relevancy while increasing impact and conversion
Qualifications
3+ years of experience in scientific or technical writing role, ideally in the context of manufacturing automation and/or robotics
3+ years of experience as content marketer with track record of creating successful bottom-up and top-down content for a variety of digital platforms
Ability to interview customers, executives, and partners to create engaging stories from sometimes complex technical content
Demonstrated editorial mindset that understands how to create content based on audience needs (aligned with personas and stages of buyer journey)
Familiar with SEO and how to incorporate strategies to improve content performance
Location: 4767 Rue Dagenais, Montréal, QC
Job Type: Full-time"
"Digital Marketing Coordinator (Top 20 Music Company Globally on Crunchbase) - Vancouver, BC - Indeed.com","Digital Marketing Coordinator (Top 20 Music Company Globally on Crunchbase)
Beatdapp is a venture-backed startup delivering the most advanced music tracking technology in the world. Our industry-leading software helps music labels and artists track and audit their media streams for royalty payments. Plus, who doesn't love working for the world's best music labels and artists all day!
Digital Marketing Coordinator
As a Digital Marketing Coordinator, you'll be working on several different initiatives and projects alongside the Marketing/Growth team. Working within the Marketing/Growth team, your duties will require you to assist the team, as needed, on projects related to SEM, SEO, Email, Social Media and more.
Responsibilities
Maintain a content calendar for Beatdapp's social media channels and ensure all channels are being actively posted on and growing
Report and analyze data from several digital marketing channels
Work across internal teams to coordinate different marketing projects across the company
Communicate clearly and effectively with all members of the team
Work on ad-hoc projects as needed by the executive team
Successful Candidates will have
Bachelor's Degree required
Proactive personality, and a desire to deliver your best work
Willingness to learn and create actionable insights from feedback given by our team
A love for marketing and growth processes and improving workflow
A basic understanding of digital marketing
Proficiency in Excel/Google Sheets
The ability to execute on clearly articulated requirements
Confidence in their skills to solve novel problems
This specific role is supported by the Digital Skills for Youth Program through Innovate BC."
"Senior Manager, Performance Marketing - Oakville, ON - Indeed.com","Who we are:
Geotab is a global leader in IoT and connected transportation and certified “Great Place to Work.” We are a company of diverse and talented individuals who work together to help businesses grow and succeed, and increase the safety and sustainability of our communities.
Geotab is advancing security, connecting commercial vehicles to the internet and providing web-based analytics to help customers better manage their fleets. Geotab’s open platform and Marketplace, offering hundreds of third-party solution options, allows both small and large businesses to automate operations by integrating vehicle data with their other data assets. Processing billions of data points a day, Geotab leverages data analytics and machine learning to improve productivity, optimize fleets through the reduction of fuel consumption, enhance driver safety and achieve strong compliance to regulatory changes.
Our team is growing and we’re looking for people who follow their passion, think differently and want to make an impact. Ours is a fast paced, ever changing environment. Geotabbers accept that challenge and are willing to take on new tasks and activities - ones that may not always be described in the initial job description. Join us for a fulfilling career with opportunities to innovate, great benefits, and our fun and inclusive work culture. Reach your full potential with Geotab. To see what it’s like to be a Geotabber, check out our blog and follow us @InsideGeotab on Instagram, Twitter or Facebook.
At Geotab, all staff must be fully vaccinated in order to be eligible to work in our North American offices at this time. Accordingly, any job offer for an onsite position resulting from this posting will be conditional upon the successful candidate providing evidence of full vaccination. Accommodations may be made for those who cannot be vaccinated based on medical or other legally protected grounds.
Geotab policies and requirements are subject to change based on local or federal guidelines.
Who you are:
We are always looking for amazing talent who can contribute to our growth and deliver results! Geotab is seeking a Senior Manager, Performance Marketing to join Geotab’s Global Digital Marketing team to support the expansion of the paid media practice across the globe. If you love technology, and are keen to join an industry leader — we would love to hear from you!
What you’ll do:
As a Senior Manager, Performance Marketing your key area of responsibility will be on process, strategy, optimisation and analytics. You will consult with teams across the organization to recommend, implement, analyze and optimize media budgets. The ideal candidate is someone who has 10 years of demonstrated digital marketing experience, with a focus on SEM, Paid Social, and deep analytics expertise.
How you’ll make an impact:
Develop the strategy, planning and execution of Geotab’s paid media campaigns across search, display, and social media.
Work cross-functionally with numerous internal teams, such as Regional and Segment marketing, on paid media campaigns with the goal to generate demand and continuously improved on-page conversion rates at the lowest possible cost, and with a deep understanding of audience building and lead nurturing.
Manage Geotab’s digital marketing agency and ensure strong performance with a daily assessment of all campaigns, and determine the budget and goals.
Define the ideal operating model for Geotab’s global regions and assist in the evaluation and selection of local digital marketing agency resources as needed.
Develop, deploy, and maintain comprehensive performance reporting and metrics for all campaigns, including but not limited to the creation of attribution models and paths to conversion.
Lead the detailed analysis of campaign effectiveness by analyzing campaign metrics on a daily basis, and summarizing top results and key recommendations for improvement regularly, with an ongoing focus to improve the quality and quantity of conversions from all paid media programs. This includes but is not limited to segmentation, creative targeting, and cohort analysis.
Ensure each campaign has a throughout A/B testing strategy for optimal performance.
Coordinate with creative and content teams to ensure all campaigns are in alignment with our brand standards.
Communicate best practices and new updates to the marketing team for training purposes.
Stay in the know of the latest trends and tactics for advertising platforms such as Google Ads, Bing Ads, Facebook Ads, and more.
Explore new tools, technologies, and approaches to paid media at Geotab, including but not limited to intent data and Account Based Marketing.
Research and analyze industry changes/developments in Search Engine Marketing.
What you’ll bring to this role:
10 years of digital marketing experience, with deep experience in ad platforms including Google Ads, Facebook Ads Manager and others.
Paid media certification is considered an asset, including Google Ads.
Strong analytical skills with superior attention to detail and demonstrated ability to drive insights into actionable recommendations.
Previous people leadership experience is an asset.
Experience managing agency relationships, directing their work and holding agencies accountable for deliverables.
Experience implementing repeatable processes and driving automation or standardization.
Proven track record of implementing campaign attribution across multiple channels, web, phone, chat, offline etc.
Bias towards using data and metrics to drive improvements.
Proven ability to translate often vague business objectives into clear digital strategies with clear KPIs.
Experience developing and implementing a consistent test and learn process and culture.
Expert understanding of Google Analytics, A/B testing principles.
Highly organized and goal-oriented and business minded.
Experience developing and implementing campaigns on a global scale is an asset.
Excellent command of G-suite applications (docs, sheets, slides).
Exemplary organization and time management skills with the ability to handle multiple projects simultaneously.
Excellent communication skills with a passion for using data to tell compelling stories to executives.
#LI-GF1
Why job seekers choose Geotab:
Work from home and flex work arrangements
Baby bonus
Home office reimbursement program
Online learning and networking opportunities
Electric vehicle purchase incentive program
Competitive medical and dental benefits (full-time employees only)
Retirement savings program (full-time employees only)
How we work:
At Geotab, we understand that the world is always changing and that we need to change with it. Geotab has adopted a hybrid model for working, including a flexible work from home program, with the opportunity to work in our safe, clean offices. When working from home, you are required to have a reliable internet connection with at least 50mb DL/10mb UL. Virtual work is supported with cloud-based applications, collaboration tools and asynchronous working. The health and safety of employees are a top priority. We encourage work-life balance and keep the Geotab culture going strong with online social events, chat rooms and gatherings. Join us and help reshape the future of technology!
We believe that ensuring diversity is fundamental to our future growth and progress and is an integral part of our business. We believe that success happens where new ideas can flourish – in an environment that is rich in diversity and a place where people from various backgrounds can work together. Geotab encourages applications from all qualified individuals. We are committed to accommodating people with disabilities during the recruitment and assessment processes and when people are hired. We will ensure the accessibility needs of employees with disabilities are taken into account as part of performance management, career development, training and redeployment processes. If you require accommodation at any stage of the application process or want more information about our diversity and inclusion as well as accommodation policies and practices, please contact us at careers@geotab.com. Click here to learn more about what happens with your personal data."
"Content Analyst - Toronto, ON - Indeed.com","Spaulding Ridge is a best-in-cloud advisory and IT implementation firm. We help global organizations get financial clarity into the complex, daily sales, and operational decisions that impact profitable revenue generations, efficient operational performance, and reliable financial management.
At Spaulding Ridge, we believe all business is personal. Core to our values is our relationships with our clients, our business partners, our team, and the global community. Our employees dedicate their time to helping our clients transform their business, from strategy through implementation and business transformation. We hire passionate individuals who have the same values as we do. We look for driven individuals who seek to continue solving client problems and bringing innovative ideas to our team. As a small firm with plans to grow rapidly – you will be given the unique opportunity to provide strategic support to the growth of our company.
What You Will Do
The Junior Technical Writer will create marketing copy and assist with other content-driven assets. This person will be a member of the marketing team but will work with a variety of teams throughout the entire company.
Undergraduate degree in English, writing, communications, marketing or other related major preferred. No work experience is required since this is an entry-level position, but we’d love to see or hear about any projects you’ve worked on during your undergraduate degree, as well as any internships, jobs, or activities that make you stand out.
Responsibilities:
Conduct research for content projects
Proofread marketing materials for the broader marketing team, ensuring quality and accuracy of all copy, as well as retrieve any missing information.
Write content for articles, emails, PowerPoints, and other marketing materials as needed
Brainstorm with the marketing team to create campaigns, email journeys, and other helpful content to promote Spaulding Ridge, our services, and our Partners
Requirements:
Bachelor’s degree required (English, writing, communications, marketing or other related major preferred)
Excellent writing, grammar, and proofreading skills
Loves collaborating and working as part of team, but is also a go-getter and able to work independently
Interested Candidates
Please include a cover letter in your application.
What else to expect
As an employee of Spaulding Ridge, you will part of a company that is providing innovative opportunities to impact our clients in a meaningful way. We believe giving back is core to our values and as part of this effort, you will be given the opportunity to participate in different opportunities throughout the year including SR’s day of service, giving back to our global community. We offer a competitive benefit package, including flexible time off, medical, dental, vision and life insurance and much more.
We take care of you!
Here are some our great perks and top benefits to highlight:
Competitive benefits package, including medical, dental, vision, 401(K) and Life insurance
Flexible Time Off
Paid holiday time
Paid maternity and paternity leave
Spaulding Ridge’s Diversity Commitment
Spaulding Ridge invests in the development of its diverse employees. We appreciate the unique skills and experience that each person brings to the company.
Equal Employment Opportunity
The company is committed to offering Equal Employment Opportunity and to providing reasonable accommodations to applicants with physical and/or mental disabilities. If you are interested in applying for employment with Spaulding Ridge and are in need of accommodation or special assistance to navigate our website or to complete your application, please send an e-mail with your request to our Director of Human Resources, Cara Halladay (
challaday@spauldingridge.com
) Requests for reasonable accommodation will be considered on a case-by-case basis.
Vaccination Policy
Given the travel and onsite work with customers required for this position, applicants must be vaccinated and produce valid proof of vaccination for the COVID-19 virus prior to employment. Proof of Covid-19 vaccination is recognized by either providing a government issued COVID-19 vaccination card or proof of vaccination from your health provider. If you are unable to be vaccinated due to a medical condition or religious belief, please submit a written request to Human Resources for additional consideration, but exceptions will be extremely limited."
