Title,Description
"Digital Project Manager - Toronto, ON - Indeed.com","Major Tom is the next iteration of digital marketing — a full-service agency that's been purpose-built to help organizations thrive in an increasingly complex landscape. With headquarters in Vancouver, Toronto, and New York, you can find us on Zoom during either Pacific or Eastern Daylight Time.
Who We Are:
We're a group of people who create work we're proud of for folks we believe in. Our team is made up of industry specialists covering the spectrum of strategy, marketing, development, and creative.
We all share a belief that passion and accountability are critical to delivering exceptional work. Our biggest heroes bring humility, an open mind, and a positive attitude to our team every single day. An informal — yet professional — group, we truly care about one another and you can bet that we'll care about you, too. For more on our culture, check us out on Glassdoor (https://www.glassdoor.ca/Overview/Working-at-Major-Tom-EI_IE2157894.11,20.htm), Facebook (https://www.facebook.com/ItsMajorTom), and Instagram (https://www.instagram.com/MajorTomAgency/).
Who We're Looking For:
We are looking for a Project Manager to join our Delivery team. For this role, past experience should include managing marketing projects with proven skills in both digital project management and client service.
The ideal candidate is highly organized with a demonstrated ability to manage a variety of project types. This role will focus primarily on media, branding, creative, and social media projects. Experience managing website projects is an asset. Being an articulate communicator with an ability to adapt is key. This role involves navigating questions and challenging situations on the spot, while providing solid rationales for recommendations made throughout a project.
What We're Looking For:
3 years experience in project management
A familiarity with common best practices in the worlds of digital marketing
Confidence in following project management best practices, well-versed in project management methodologies, and a whiz at creating project plans
Ability to take ownership of increasingly complex projects with minimal guidance
Experience briefing and working with digital strategists and creative teams
High proficiency with Google Suite, particularly Sheets and Slides
Experience using project managements tools (eg: Mavenlink, Asana, Monday, Basecamp)
What We're Looking For
Not deal-breakers, but assets:
Agency experience
Knowledge of AdobeCreative Suite
Proficiency with Google Analytics
Experience managing website projects
eCommerce experience
What You'll Get To Do:
You will be the linchpin for the media, creative, and social media teams, managing all the moving parts in the process for paid media, branding, social media, and creative projects
Own client relationships, ensuring excellent service, managing expectations, and facilitating communication at all touch points
Participate in a variety of workshops to get to the crux of client needs
Help facilitate presentations, aligning the project team and contributing to decks
Coordinate internal project teams, closely managing resourcing and traffic while preserving project health
Conscientiously manage project budgets and timelines while meeting objectives and producing quality deliverables
Stay up-to-date on current trends and technologies in project management, marketing, design, branding, and social media
As a member of our account services team, you will work closely with a variety of people across the agency, including designers, strategists, and marketing experts
Some of the Benefits & Perks You'll Get:
Paid time off
and
bonus time off
during the holiday season to spend time with your loved ones without thinking about work.
Flexible working hours
and work-from-home options. You know how and when you work best, and we trust you to do it.
Comprehensive medical benefits
, including a
healthcare spending account
, so you can take care of yourself and your family.
Access to
LinkedIn Learning and support in your professional development
because we want to help you achieve your goals.
A wellness program
including weekly meditation so you can take care of your mind.
Regular Lunch and Learns
covering a vast array of topics all designed to keep you informed on the industry and our agency.
Access to internal committees led by subject matter experts
that are designed to tackle plans or solve problems. These committees ensure that everyone within our agency has the opportunity to learn about the different facets of our organization. Are you a project manager fascinated by work in the creative department? No problem, sign up and see how it's done.
Major Tom is committed to equal opportunity and fair treatment for all. The company prohibits discrimination on the basis of age, race, disability, ethnicity, marital or family status, national origin, religion, gender, sexual orientation, veteran status, genetic information, gender identity, medical condition or any other characteristic protected by law.
Major Tom welcomes and encourages applications from people with disabilities. Accommodations are available on request for candidates taking part in all aspects of the selection process. Should you require accommodations, please let us know and we'll work with you to ensure that you have a positive experience."
"Marketing numérique et médias sociaux / Digital Marketing and Social Media - Vaudreuil-Dorion, QC - Indeed.com","Digital Marketing and Social Media Specialist
New Roots Herbal is a leading manufacturer and distributor of high-quality natural health products in Canada. Based in Vaudreuil-Dorion, the company is growing and looking for dynamic and motivated people. Are you currently looking for a new challenge that will have a direct positive impact on the well-being of thousands of people? Join our team and help us make a difference.
Main Tasks and Responsibilities
- Implement, improve and oversee a cohesive digital and social marketing strategy
- Bring out-of-the-box marketing strategies and campaigns
- Analyze digital and social analytics, KPIs, etc.
- Provide market trends, competitor analyses and suggestions for marketing initiatives
- Content creation / marketing text – development and revision (English/French)
- Support and promote brand awareness and recognition
- Participate in product launches
- Responsible for external and internal marketing events
- Contribute to optimize the user experience of the corporate websites
- Various marketing projects
Experience, Skills and Qualifications
- Bachelor or college’s degree in marketing (or equivalent)
- Minimum of three (3) years’ experience with digital marketing and social media
- Good verbal and written communication skills (English/French)
- Solid knowledge of social platforms and analytical skills tracking social, brand, and community metrics
- Experience with media/advertising strategies and execution such as Facebook Ads, SEO, influencer, Google Ads,
- Proven experience with MS Office, Google Suite
- Data-driven and attention to detail
- Exceptional time management skills: ability to organize, prioritize, and multitask
- Proven team player who is both flexible and adaptable
- Interest in naturopathy / natural products is an asset
Work Schedule
- Full-time permanent position
- 40 hours / week
- Monday to Friday, 9:00 a.m. to 5:00 p.m. (at the office)
Submit your résumé to Marie-Ève Descôteaux
By mail:
Human Resources
3405, F.-X.-Tessier, Vaudreuil-Dorion (QC) J7V 5V5
By email:
See email address provided on Indeed
-------------------------------------------
Spécialiste marketing numérique et médias sociaux
New Roots Herbal est un chef de file dans la fabrication et la distribution de produits de santé naturels de haute qualité au Canada. Basée à Vaudreuil-Dorion, l’entreprise est en pleine croissance et recherche des personnes dynamiques et motivées. Vous êtes présentement à la recherche d’un nouveau défi qui aura un impact positif direct sur le bien-être de milliers de personnes? Joignez-vous à notre équipe et aidez-nous à faire une différence.
Principales tâches et responsabilités
- Implanter, améliorer et assurer la cohérence de la stratégie marketing digitale et des réseaux sociaux
- Mettre en œuvre des stratégies et des campagnes de marketing innovatrices
- Analyser les données numériques et celles des réseaux sociaux, les KPI, etc.
- Étudier les tendances du marché, les analyses concurrentielles et apporter des initiatives marketing
- Créer du contenu / texte marketing – développement et révision (anglais/français)
- Soutenir et promouvoir la notoriété et la reconnaissance de la marque
- Participer aux lancements de produits
- Responsable des événements marketing externes et internes
- Contribuer à optimiser l’expérience utilisateur des sites Web de l’entreprise
- Divers projets de marketing
Expérience, compétences et habiletés
- Baccalauréat ou diplôme collégial en marketing (ou l’équivalent)
- Minimum de trois (3) ans d’expérience en marketing numérique et en médias sociaux
- Compétences exceptionnelles en communication verbale et écrite (français/anglais)
- Solide connaissance des plateformes sociales et des compétences analytiques de suivi des mesures sociales, de marque et communautaires
- Expérience avec les stratégies/ publicités et l’exécution des médias telles que les annonces Facebook, le référencement naturel sur les moteurs de recherche (SEO), influenceur, Google Ads, etc.
- Expérience éprouvée avec MS Office, Google Suite
- Axé sur les données et le souci du détail (compétence en marketing par bases de données)
- Excellente gestion du temps : capacité d’organiser, de prioriser et d’effectuer plusieurs tâches à la fois
- Détenir un excellent esprit d’équipe tout en étant flexible et agile
- Intérêt pour la naturopathie et/ou les produits naturels est un atout
Horaire de travail
- Poste permanent à temps plein
- 40 heures / semaine
- Lundi au vendredi, de 9h00 à 17h00 (au bureau)
Envoyez votre CV à Marie-Ève Descôteaux
Par la poste :
Ressources humaines
3405, F.-X.-Tessier, Vaudreuil-Dorion (QC) J7V 5V5
Par courriel :
Voir le courriel indiqué sur Indeed
Type d'emploi : Temps Plein, Permanent
Type d'emploi : Temps Plein, Permanent
Salaire : 14,00$ à 27,00$ par heure
Horaire :
8 Heures
Du Lundi au Vendredi
Quart de jour
Capacité à faire le trajet ou à déménager:
Vaudreuil-Dorion, QC: Faire le trajet sans problème ou prévoir un déménagement avant de prendre son poste (Souhaité)
Expérience:
marketing numérique et médias sociaux: 3 ans (Souhaité)
Langue:
Français (Souhaité)
Anglais (Souhaité)
Télétravail:
Non"
Digital Media Specialist - Remote - Indeed.com,"Here’s what we do and why we do it:
Simply put, we will work together to simplify businesses' IT with cloud technology so they can focus on what really matters, making people’s lives better. Discover how we do that here:
www.sherweb.com/about/
.
Here’s how you will contribute to the company’s success:
As part of our Marketing Performance team, you will act as a digital media specialist for various marketing platforms. In addition to creating our media placement strategies, you work with a multidisciplinary team to maximize the reach and results of our campaigns. By using your analytical mind and intellectual curiosity, you are constantly optimizing our North American marketing campaigns and setting up practical examples within the marketing department.
Here's what your day-to-day will look like in this role:
Contribute to the success of our different brands (Sherweb, C2, GMS, PurelyHR and Pulsar360) in digital media channels
Be in charge of the media campaigns, including ad placement, delivery, evaluation, the coordination of content, contracts/agreements and all other pertinent documents
Manage the purchase of keyword campaigns and banners (e.g., on Google Adwords, Bing Ads)
Manage campaigns on social media (e.g., LinkedIn, Facebook, Twitter, Reddit)
Establish our web presence to boost brand awareness
Ensuring brand consistency across all digital media channels
Define the strategy to distribute digital media for our various campaigns
Collaborate with the Product Marketing managers and the Creative team during the creation, follow-up and optimization of digital campaigns
Do A/B testing of the CPL in our campaigns and suggest improvements
Create weekly and monthly reports to track key metrics (CPL, CTR, Conversion Rate, etc.), monitor the budget and all other initiatives in the Marketing campaigns
Analyze the campaign results, optimize the results to improve performance and propose new recommendations for keywords, campaign structure, targeting and other facets
Monitoring impact and return on investment of digital marketing campaigns.
Regularly track and get insights into competitors' strategies
Stay up-to-date with digital media technologies and latest trends, paid platforms and digital media channels
Use various tools (CRM, Google Analytics, Marketo, Power BI) to track campaign performance and ensure campaigns are optimized
All other tasks related to the department’s needs
Here's what you need to master and know to get the job:
If you have at least half, you have a great chance to receive a call from us.
Minimum of 2 years of experience in a similar role
University degree in marketing or e-commerce or any other relevant training
Bilingualism (French and English), both oral and written
Proficiency in digital marketing using Search and Display networks
In-depth knowledge of Google Analytics, Google AdWords, LinkedIn and social media advertising (LinkedIn, Facebook, Twitter, etc.)
Strong command of Microsoft Excel
Knowledge of Power Bi considered an asset
Google Analytics and AdWords certifications considered an asset
Strong interest in the Web and its evolution
Excellent organizational skills and ability to manage multiple projects simultaneously under tight deadlines
Conscientious, self-critical, methodical and meticulous in the settlements
Ability in research and analysis
Ability to synthesize the results of complex campaigns into concepts easy to understand and great ease with statistics
Intellectual curiosity and analytical mind
If you have these skills, you will fit right in with us:
Communication skills
– Why? Because you will be expected to explain and vulgarize concepts by adapting the style and content of your messages to your audience (whether it’s internal clients, external clients or your teammates).
Organization and resourcefulness
– Why? Because we don’t believe in micromanagement. You will need to figure out solutions on your own by using your skills, your knowledge and any relevant information you can get your hands on.
Problem-solving skills
– Why? Because when you will face a problem, you will first analyze the information before identifying the possible causes. You will then explore and implement the most efficient and logical solutions.
Adaptability
– Why? Because our industry constantly evolves. You will have to adjust your thinking and methods to better suit new or unplanned situations (whether it’s for your daily tasks or your working environment).
Here’s what you can expect from us:
We believe professional success is based on one's ability to build genuine relationships, to showcase her/his talent at every opportunity and to be a lifelong learner. If you share this vision, you will be pleased to find among us highly experienced professionals who will be happy to mentor or coach you. We will invest in your development. We will also provide you with the compensation and the opportunities that will help you make your aspirations a reality. So, if you have a head full of ideas and a soul full of hopes, here the floor is yours.
This is our team philosophy:
Relationships are the core of our practice, not commissions. What unites our team is the sense of purpose we get from providing tools for people to work better. That's who we are, not just what we do. If you share this philosophy, you might just be one of us. Send us your resume to tell us your story.
#LI-PL1
#LI-REMOTE"
"Internship - Jr. Marketing Coordinator - Newmarket, ON - Indeed.com","Newmarket, ON
As a potential member of the MediaTown team, you have a passion for digital marketing and are looking for a company that can help you grow into a professional, successful Inbound Marketer. At MediaTown, we eat, drink & sleep Inbound Marketing. During our 10+ years in the digital marketing space, we have had the pleasure to have worked with some exciting clients, on some great campaigns – If you share this passion, please read on.
MediaTown Marketing is expanding. As a boutique style Inbound Marketing & Design Firm, we are looking for someone who is energetic, organized and can confidently execute a spectrum of web development projects. The role is
ideal for a graphic designer
looking to grow into a well rounded marketing professional, or graduate/post-graduate, or junior professional seeking work experience while making income. The Jr. Marketing Coordinator will support both our developers and our digital marketing team with executing projects, managing scope, managing development, content as well as designing.
Although we are looking for a Jr. Marketing Coordinator, the ideal candidate will have some digital marketing experience, as well as a strong design background. We want to see examples of campaigns that you have created and run, as well as the results of those campaigns. Ideal candidates will have proven knowledge (college / university experience is acceptable) and skills in running online advertising campaigns on platforms such as Google, Bing/Yahoo, Facebook, Twitter, YouTube, LinkedIn, etc. Bonus consideration to those who can prove a proficiency at tracking these campaigns in Google Analytics, and/or other analytics tools. In addition the candidate will have expert-level experience with graphic design.
Responsibilities:
Communicate with multiple clients, client managers and staff across the organization to ensure projects stays up to date and produces ROI.
Design for web (print is a plus).
Work with and support our social media team with design documents as needed to support client campaigns.
Manage digital marketing tools including but not limited to: Email Marketing, Marketing Automation Systems, Project Management Applications, +
Compile actionable metrics report for marketing activities and share with teams across the business as well as present to clients.
Assist in executing digital marketing strategies and best practices for web across different industries
Assist sales staff on initial meetings with potential clients
Create and drive innovative initiatives and solutions to help our clients realize the best possible results for the digital campaign being delivered.
Qualifications:
Basic knowledge of Adobe Creative Suite: Photoshop, InDesign, &(or) Illustrator (Or equivalent).
Knowledge of HTML (basic understanding)
Proven analytical skills and strategic thinking. Demonstrated ability to develop creative / non-traditional solutions
Prior experience with QA, Graphics, Web Development, Project Management
Prior experience of implementing Marketing strategies and experience measure success of campaigns a plus
Excellent written and verbal communications skills. Ability to translate technology features into business benefits.
Self-starter, problem-solver and proven team player in a high achievement-oriented environment
Degree or Diploma or equivalent work experience
Nice to Haves
Experience working in the online industry with a proven understanding of web technologies, browser compatibilities and limitations, content and process management, and site implementation.
Knowledge of search engine optimization
Knowledge of PHP, Advanced HTML, CSS, +
Advanced level knowledge of social media platforms (Facebook, Twitter, Pinterest, Google+, Instagram, Yo, etc.)
2-5 years of work experience in web, project management, design, product management, product marketing, or equivalent experience in the enterprise software technology industry a plus
This is an exciting opportunity that has great potential to lead to a leadership role. We are looking for candidates that are looking to grow and take on a leadership position as our agency grows..
If you want to work remote, that’s cool. If you want to work near others, that’s cool too. The MediaTown team can be found around the world; including Canada, The United States, as well as Asia & India. We really don’t care where you’re located, you just have to be talented! The position is full-time."
"Digital Coordinator - Kelowna, BC - Indeed.com","The Flowr Corporation
Start Date:
Winter 2021
Location:
Toronto, ON or Kelowna, BC
The Flowr Corporation is a cannabis company with operations in Canada and Europe. Our Canadian operating campus, located near Kelowna, BC, includes a purpose-built, GMP-designed indoor cultivation facility, and an outdoor greenhouse cultivation site. From this campus, we produce recreational and medicinal products. Internationally, we intend to service the global medical cannabis market through our subsidiary Holigen, which has a license for cannabis cultivation in Portugal where they will operate GMP-designed manufacturing facilities.
Our purpose is to Cultivate Better:
People, Plants, Products. To this end, we aim to support improving outcomes through responsible cannabis use and, as established experts in cannabis cultivation, strive to be the brand of choice for consumers and patients seeking the highest-quality craftsmanship and product consistency across a portfolio of differentiated cannabis products. All of this can only be achieved through the hard work of our passionate team, who share the core values of being Pioneers, Champions, and Students, in all that we do. Visit www.flowr.ca for more information.
LET’S TALK ABOUT THE ROLE:
We’re excited to be expanding our internal shared services team to enable our business to scale up while being agile and responsive to our consumer demands. To ensure we have the in-house resources to get the job done, we’re adding three exciting roles to our team, including a Marketing Manager, Digital Coordinator, and Photographer/Videographer.
In this new role, the Digital Coordinator will be responsible for all things execution within our digital space. Working closely with our marketing and design functions, this self-motivated individual will contribute to bringing our digital programs and campaigns to life. The ultimate measure of success for this role will be media measurements and its conversions to revenue.
How will you make an impact?
Execute the social media and digital strategy, coordinating with stakeholders across all channels of Flowr to ensure its effectiveness and maximizing consumer engagement and reach.
Assists in the development of digital media presentations and tactical POV’s.
Execute social media content and campaigns and related day-to-day activities including monitoring on and off network social media activity, crafting and posting content and commentary as well as responding directly to customer feedback and communicating to other internal departments where necessary
Ensures key information is provided to stakeholders throughout the campaign activation and maintenance process.
Analyze, review, and report on effectiveness of social media by monitoring performance again effective benchmarks to maximize results
Contributes to strategizing ways to improve and optimize campaign performance to meet our KPIs.
Supports strong working relationships with vendors to achieve campaign objectives and fulfill campaign goals.
Conducts research and development of media measurements – Audience, Ratings, Etc.
Assists with reporting commentary that is easy to understand, compelling and persuasive.
Who we’re looking for!
You have post-secondary education in Marketing, Communications or Business Administration
You’ve started your career in a digital/social media capacity, ideally B2C (Business to Consumer)
The digital media space is your second home – you have gained foundational knowledge, and understanding of the world of digital
As bonus points, you may have experience and knowledge of social media platforms, successful communication strategies and paid marketing opportunities within social media
You can leverage your understanding and appreciation of cannabis to best express our product through creative and engaging content
You are motivated through results and have a strong ability to manage multiple projects simultaneously in a fast-paced environment
You are motivated by a strong sense of initiative, and you naturally have a solution-oriented mindset"
