Title,Description
"Developer Specialist - Toronto, ON - Indeed.com","Address:
55 Bloor Street West
Job Family Group:
Technology
We are seeking an enthusiastic and passionate professional for a Development Lead position with BMO US credit card application team for mobile and online banking. BMO US Credit Card Next Generation is the digital sales tool that enables new and existing BMO customer to digitally apply for a credit card with BMO. You must have extensive experience in full-stack development – web app and Java back-end development with microservice architecture integrating to AWS and Azure cloud services. This role will support short- and medium-term business and technology roadmaps for retail sales in online banking to deliver self-service capabilities to BMO customers. It also focuses on the digital channels’ technology roadmap, facilitating innovation and adoption of next-generation technologies. We collaborate with Enterprise Architecture, other ETO teams, and business technology stakeholders, connecting subject matter experts with business, information, domain and solution architects.
Your skills are broad – designing, developing and implementing application solutions to support mobile and online banking under the Channels Technology group. You will lead and collaborate to integrate code to create software solution that aligns with architecture patterns and technology strategy. Understands the implications of various components (including technology strategy & architecture) to the overall design of a program, system, or eco-system. Evaluates new technologies for fit with the program/system/eco-system and the associated upstream and downstream impacts on process, data and risks (e.g., security). Works toward the objective of defect free software. Ensures that systems functionally meet requirements, align with architecture and promote the development of common assets. Supports the resolution of production issues and problems. Makes recommendations to improve BMO processes & systems.
As a qualified candidate, you will be part of the team driving BMO’s Self-Services for retail online banking initiatives. As a member of this team, you should possess the ability to inspire yourself and all of our team. Based on your previous experiences you will inject new knowledge and skills into an already high performing team thus excelling our efforts to new heights.
Your Responsibilities
Leads and implements initiatives as required to deliver business objectives
Decomposes business requirements and translates them into detailed design specifications and code.
Assesses impact of design decisions to the computer solution/product/service being developed (i.e. performance, schedule, budget, downstream component/system impact, quality, etc.) and recommends alternate/creative solutions for mitigation/optimization if required.
Recommends and implements solutions based on analysis of issues and implications for the business for informed decision-making.
Drive meetings with subject matter experts from all areas of the business including infrastructure, operations, applications, vendors and leads to seek input from and plan/coordinate development, define requirements and timelines.
Conducts independent analysis and assessment to resolve strategic issues.
Builds effective relationships with internal/external stakeholders and ensures alignment.
Monitors and tracks performance, and addresses any issues.
Leads/conducts detailed code-reviews and provides feedback in a constructive manner.
Interacts with key business & technology stakeholders to define, analyze, and deliver requirements that reflect the needs of both the business and end-customers.
Assesses the costs and benefits for different solutions and recommend/decide on appropriate designs.
Designs solutions, writes code, performs unit testing, develops appropriate artefacts / documentation, and facilitates final delivery.
Supports production issues, includes independently completing root-cause analysis and diagnosis.
Builds solutions that are supportable, scalable and achieve our aspiration of common assets.
Recommends or automates approaches to streamline and integrate technological processes and/or systems to improve operational efficiency and effectiveness.
Identifies opportunities to strengthen the development capability, such as: sharing expertise to promote technical development, mentoring employees, building communities of practice and networks.
Stays abreast of industry technical and business trends through participation in professional associations, practice communities & individual learning.
Your Mindset
You are a self-starter, driven and can handle multiple projects and priorities.
You are passionate about driving customer values with digital acceleration mindset and culture in a fast-paced, challenging environment where you get the opportunity to work with a spectrum of latest tools and technologies to drive forward continuous improvement.
You are actively looking to improve the solutions you implement, understand the efficacy of collaboration and reaching out across functional borders and are keen to work in a team in an Agile environment.
As a member of this team, you should possess the ability to inspire yourself and all of our team. Based on your previous experiences you will inject new knowledge and skills into an already high performing team thus excelling our efforts to new heights.
Required Core Skills:
Degree in Computer Science, Engineering and or equivalent industry experience
Strong interpersonal, communication and leadership skills
5 - 7 years of relevant experience and/or certification in related field of study or an equivalent combination of education and experience.
Demonstrated strong programming skills and hands-on experience in full-stack development with mobile app development (Angular v5 & up, Cordova), mobile native features (push notification, notification centre, etc) and Java back-end development (SpringBoot, APIs, REST/JSON, SOAP/XML, Swagger, OpenAPI, Microservices architecture)
Experience with Cloud services and DevOps concepts: OpenShift, Docker, Kubernetes, Artifactory, BitBucket, Bamboo, Ansible, IaaS/PaaS technologies, etc.)
Proven and demonstrable experience designing and implementing high volume, high availability applications with a very high degree of automation
Comfortable working in an Agile/SCRUM setting – ability to manage multiple priorities; ability to adapt to changing priorities
Demonstrate strong facilitation, negotiation, interpersonal, communication and collaboration skills.
Demonstrate ability to easily deal with both abstract and concrete concepts and be able to reconcile them for the appropriate audience and context
Quickly understand organizational dynamics and management priorities, and to be able to work effectively in a fast-paced, results-driven company.
Other Skills:
A critical thinker with strong analytics, and problem-solving skills
Self-motivated with a positive attitude and an ability to work independently and or in a team
Ability to communicate across business units and the ability to interface with and communicate complex technical concepts to a broad range of internal and external stakeholders
Time management skills with the ability to manage multiple priorities and mentor junior developers
We’re here to help
At BMO we are driven by a shared Purpose: Boldly Grow the Good in business and life. It calls on us to create lasting, positive change for our customers, our communities and our people. By working together, innovating and pushing boundaries, we transform lives and businesses, and power economic growth around the world.
As a member of the BMO team you are valued, respected and heard, and you have more ways to grow and make an impact. We strive to help you make an impact from day one – for yourself and our customers. We’ll support you with the tools and resources you need to reach new milestones, as you help our customers reach theirs. From in-depth training and coaching, to manager support and network-building opportunities, we’ll help you gain valuable experience, and broaden your skillset.
To find out more visit us at https://jobs.bmo.com/ca/en .
BMO is committed to an inclusive, equitable and accessible workplace. By learning from each other’s differences, we gain strength through our people and our perspectives. Accommodations are available on request for candidates taking part in all aspects of the selection process. To request accommodation, please contact your recruiter."
"Sr. Cloud Security Engineer - Toronto, ON - Indeed.com","Thomson Reuters Information Security & Risk Management (ISRM) team is looking for a Sr Security Cloud Engineer / Security Cloud architect to define and drive cloud security principles and requirements into our global architecture for the various cloud platforms. This role will work closely with key centralized technology teams such as Infrastructure Hosting and Networks, Information Security Risk Management, and the Business Unit Architects to establish and provide guidance on secure development and migrations to the public cloud. This role will require the establishment of strong relationships with these key technology teams, and the ability to vocalize the ISRM Policy, identify appropriate industry best practices, and meet regulatory requirements.
The ideal candidate will possess the right demeanor, skillset, and experience to integrate well into other technical teams, whilst having the ability to effectively utilize ISRM team members for strategy and technical expertise. Experience in driving cloud-native security solutions, practices, and policies through standard architecture and relevant technologies. Working as part of a security organization, ensuring peers are fully versed in common security patterns through knowledge sharing and regular presentations
About the Role
In this opportunity as a Sr Security Cloud Engineer / Security Cloud architect, you will:
Maintain a deep understanding of core public cloud security disciplines, with close attention to developing industry trends in the context of networking, identity, and platform security technologies
Serve as the Cloud Security Lead in the design, implementation, and integration phases of business products and services to meet business security requirements, address corporate risks and exposures in cloud-based solutions across multiple cloud platforms.
Serve as the Cloud Security Lead working in conjunction to product security teams and should have av deep knowledge and hands-on experience in container security, SecDevOps principles etc.
Serve as subject matter expert in designing audit checks against deployed infrastructure in multiple cloud platforms (Azure, AWS, GCP, OCI or any other platform) to ensure appropriate guardrails are being followed
Act as Subject Matter Expert to Cloud Compliance and able to get deeper into the issues to support integration team (Oracle Cloud in particular and other cloud platforms in general)
Act as an influencer in cloud-native development best practices, which includes continuous delivery, security, infrastructure as a code, automation, immutable infrastructure, and service discovery
Maintain a deep understanding of capabilities and patterns to secure the public cloud through access controls, logging, monitoring, data protection, and networking
Collaborate with business and technology peers to understand business goals, use cases for cloud-native deployments or lift-and-shift, and consistently apply appropriate controls from NIST CSF, PCI-DSS, HIPAA, and other relevant industry documentation to enable use cases
Thoroughly interact with teams across the enterprise such as DevOps, platform engineering, network security engineering, identity engineering, and security operations. Should be able to guide the teams to drive results and maturity
Perform threat modeling, risk assessments, and gap analysis against existing and new solutions
Drive security design principles and requirements to enhance ISRMs ability to streamline the implementation of security controls into new and existing solutions
Identify, advise on, and track metrics against strategic cloud security initiatives to improve maturity ratings over time
Serve as a security subject matter expert during discussions and meetings with key stakeholders within the business unit and infrastructure teams
Interact with peers, project teams, technical specialists, and other senior members of the company to provide advice on cloud security. Provide technical security expertise, including communicating security architectural decisions, benefits, risks, and other activities including security requirement definition, and facilitation of security testing and management of residual risk with the product or application teams
About You
You’re a fit for the role of
Sr Security Cloud Engineer / Security Cloud architect
if you are:
Cloud Architect and have experience in architecture using Oracle Cloud and or other cloud providers services
Experience with engineering or operations of common security services
In-depth knowledge on how to establish secure connectivity between on-prem and public cloud and other relevant tools
Familiarity with Cloud Security and experience in infrastructure, data protection, identity, or auditing security
Ability to document design patterns coherently for peers to follow
Ability to understand others approaches to solving problems, and guide them into a secure thought pattern
Team player and can flex styles to work well technical team members and non-technical business leader
Working and hands-on knowledge of:
Various cloud platforms including Oracle, AWS, Azure or GCP and experience with APIs, compute, network, and security services
Migrate various workloads or into the cloud and should be conversant with the majority of cloud security-focused areas
Common integrations needed to support security in the cloud such as centralized logging, configuration management, identity, vulnerability management, secrets management, and networking
Splunk, Prisma, CyberArk is a plus
Cloud automation will be a big plus including but not limited to Terraform, Ansible, etc
Preferred Qualifications
:
5+ Years experience in a security-related domain and technologies
3+ Years experience in security architecture space preferably as a cloud security architect
1+ Years experience in Oracle Cloud Platform (preferably engineering or security-focused). Multi-Cloud experience preferred
Experience building or integrating services following cloud-native architecture methodologies running in the public cloud.
CISSP, CCSP, or equivalent certification is preferred
Basic Qualifications
Bachelor’s degree in Computer Science, Computer Engineering, or related field required
Oracle Cloud Infrastructure Foundations Architect, Oracle Cloud Infrastructure Foundations Associate, Certified Oracle Cloud Infrastructure (OCI) professional
Knowledge of other cloud vendors such as Amazon, Azure, and Google Cloud
Familiarity with:
Privacy laws, such as GDPR and CCPA
Regulatory compliance with PCI-DSS, HIPAA, SOX
Security frameworks such as NIST, CSF
What's in it For You
At Thomson Reuters, our people are our greatest assets. Here are some of the benefits we offer for your personal and professional growth:
Learning & Development:
Exposure to a wide breadth of leading-edge technology
Career growth - the ability to work on multiple projects and/or with various teams
Professional growth and development opportunity through various training programs, conferences, networking events, in-house speaker series etc.
Access to Hackathons, Unconferences, Harvard Manage Mentor and more, we offer learning opportunities for everyone
Benefits/Perks:
Health benefits
Savings/investment plans
Paid time off (including time off to volunteer and extended parental leave)
Flexibility:
We've been named as one of Forbes, Best Companies for Work/Life Balance
Global Opportunities:
We have employees in over 90 countries, working across three different industries
Your well-being:
We offer a program that focuses on making our lives healthier
Do you want to be part of a team helping re-invent the way knowledge professionals work? How about a team that works every day to create a more transparent, just and inclusive future? At Thomson Reuters, we’ve been doing just that for almost 160 years. Our industry-leading products and services include highly specialized information-enabled software and tools for legal, tax, accounting and compliance professionals combined with the world’s most global news services – Reuters. We help these professionals do their jobs better, creating more time for them to focus on the things that matter most: advising, advocating, negotiating, governing and informing.
We are powered by the talents of 25,000 employees across more than 75 countries, where everyone has a chance to contribute and grow professionally in flexible work environments that celebrate diversity and inclusion. At a time when objectivity, accuracy, fairness and transparency are under attack, we consider it our duty to pursue them. Sound exciting? Join us and help shape the industries that move society forward.
Accessibility
As a global business, we rely on diversity of culture and thought to deliver on our goals. To ensure we can do that, we seek talented, qualified employees in all our operations around the world regardless of race, color, sex/gender, including pregnancy, gender identity and expression, national origin, religion, sexual orientation, disability, age, marital status, citizen status, veteran status, or any other protected classification under applicable law. Thomson Reuters is proud to be an Equal Employment Opportunity/Affirmative Action Employer providing a drug-free workplace.
We also make reasonable accommodations for qualified individuals with disabilities and for sincerely held religious beliefs in accordance with applicable law.
Protect yourself from fraudulent job postings
click here
to know more.
More information about Thomson Reuters can be found on thomsonreuters.com."
