Title,Description
"Maintenance Worker V/Power Engineer (FM) - Mission, BC - Indeed.com","New collaborations are taking place across the Lower Mainland Health Authorities in order to share resources, and optimize care and service.
Facilities Management (FM) provides services for Fraser Health (FH), Providence Health Care (PHC), and the Provincial Health Services Authority (PHSA). It is a vibrant and dynamic portfolio and one of the largest full-service FM organizations in the country. Its goal is to provide a wide range of effective and sustainable services to support the delivery of health care. We employ individuals in locations across Metro Vancouver and the Fraser Valley.
Facilities Maintenance and Operations provides hospital site-based stewardship of physical assets including structural, mechanical and electrical systems through programs of preventative, predictive and demand maintenance and long-term infrastructure renewal.
Effective October 26th, all new hires to Fraser Health will need to have full COVID 19 vaccination (have received a full series of a World Health Organization “WHO” approved vaccine against infection by SARS-COV-2, or a combination of approved WHO vaccines). Please note this applies to all postings, and individual medical exemptions must be approved by the Provincial Health Officer.
This is your opportunity to perform a variety of maintenance and repair functions in a
casual
Maintenance Worker V/Power Engineer
position within
Plant Services & Construction
at
Mission Memorial Hospital
located in
Mission, British Columbia
.
Build on your career experience as you:
Monitor, maintain and repair electrical systems and related equipment.
Troubleshoot electrical circuits and make repairs within capabilities.
Maintain safe lighting throughout the entire physical plant.
Operate boilers, air conditioning units and emergency power equipment.
Perform electrical and mechanical repairs to equipment and appliances such as beds, wheelchairs, autoclaves, washers, sterilizers and dryers by replacing and/or repairing items such as drive units, electric motors and control valves, changing seals and bearings.
Adjust HVAC controls to keep building within specified comfortable limits.
Performs plastering, painting and decorating by selecting a variety of paint, plaster and wall coverings.
Operate the steam and hot water plant as required by boiler and pressure vessel safety act by monitoring, adjusting and testing of related equipment and safety devices.
Perform emergency removal of snow and ice from entrances, walkways and service driveways for safety of visitors and staff.
To join our team, you have:
A certificate of competency as a 4th Class Power Engineer recognized by the Province of B.C.
Two years recent related experience or an equivalent combination of education, training and experience.
If
this
sounds
like
the
ideal role
for
you,
here
are
more
reasons
why
you
should
apply:
A career that offers you the opportunity to work in a fast growing and exciting organization with professionals who are excellent in their respective fields.
Fantastic opportunities for support and mentorship into supervisory and management roles are available as you advance within the organization.
An opportunity to make a difference every single day in the world of health care.
Competitive salary package, including comprehensive health benefits coverage.
Take
the
next
step
and
apply
so
we
can
continue
the
conversation with you."
"Product Designer - Toronto, ON - Indeed.com","Are you ready to make a change? This year has given us all the opportunity to reevaluate how we’re growing our careers and if we’re having the impact we want on the world while doing so.
This Intermediate role sits at the heart of both those missions. Our UX team is just getting started on growing and we are looking for strong team members who have a passion for purposeful work, thinking big, and teamwork. The opportunities for leadership here are endless as we build out both the UX practice and team in service of amazing experiences for our customers.
We're embedded on product teams so that we can be involved with projects from the get-go and work really closely with other disciplines at every stage of the process. Designers are an integral part of evolving and defining how Humi makes the world better for employers and employees.
Who are we?
Humi’s mission is to help organizations throughout Canada foster their greatest asset – their employees. Starting with a powerful yet intuitive HR, payroll, benefits, and insurance platform, Humi has established a leadership position as the only company addressing all of these needs in one place. With a potential reach spanning every business in Canada, and a platform that touches every employee at every business that uses it, Humi is reimagining the future of work.
Humi is backed by the same group who funded Slack, Carta, and more (Tribe Capital), the top value-based U.S. accelerator (Y-Combinator), as well as several of the world’s leading angel investors.
We’re hiring across Canada and are open to applicants who prefer to work remotely!
We are an equal opportunity employer and value diversity. We strive to create a culture that does not discriminate on the basis of race, religion, colour, national origin, gender, sexual orientation, age, marital status, veteran status, or disability status.
Why join Humi?
As a team that services the HR world, we are a team that understands you perform best in an environment that cares about their employees
Be part of a high performing team of critical thinkers that thrive on problem solving
Access leadership and growth opportunities as the company rapidly scales
Maintain work-life engagement with flex hours and our Long(er) weekend initiatives
Opportunity to work fully remote across Canada if you choose to
https://www.humi.ca/about
What will you be doing as a Product Designer?
You’ll work closely with your product and engineering team members to ensure we’re solving the right problems and designing elegant solutions through an iterative, data-informed process. As a team member, you’ll contribute to creating the conditions for world-class work to be delivered every day.
In your first 30 days, you will:
Participate in Humi’s immersive onboarding program to learn about all aspects of the business while meeting with cross-functional collaborators
Build empathy through direct access to customers in sales and customer support calls
Be assigned to and get to know the problem space, product vision, and members of your product team
Work with your lead to build out tailored goals and an education plan in place to set you in the right direction for the upcoming quarter
In your first 60 days, you will:
Work with a product manager to learn about more about a specific a problem space
Present your work and insights to stakeholders and team members many times
Participate in pair design sessions with other design team members
Contribute to the UX team’s culture, processes, and practices
In your first 90 days, you will:
Ship your first feature in partnership with your product and engineering counterparts
Have formed opinions on feature strategy and shared them with stakeholders
Participate in recruitment and onboarding activities for the UX team
What are we looking for in a Product Designer?
A keen eye for good design and attention to detail
A passion for solving core product problems while owning all facets of a user experience (strategy, IA, interaction design, and research)
Appreciation for the end to end iterative UX product design process, including researching user needs, user stories, journey mapping, content modelling, wireframing and prototyping, and user testing
Experience collaborating with multiple disciplines including product and engineering, in pursuit of the best outcomes for customers
A deep empathy for the user, advocating for them, always
An interest in executing a data-informed approach to design
Let’s do this! We can’t wait to hear from you.
Please note that all successful candidates will only receive offers through the Humi platform and we do not issue offers outside of our platform. We do not make any offers of employment via social media. Please see our resource library for the best ways to detect fraud and fraudulent activity.
KRdOORwCjH"
"Ingénieur avionique - Dorval, QC - Indeed.com","Description
Appartenir à Air Canada, c'est appartenir à un symbole canadien, Air Canada récemment élue meilleur transporteur aérien en Amérique du Nord. Faites décoller votre carrière en vous joignant à notre équipe novatrice et diversifiée à l'avant-garde du transport aérien de passagers.
Nous sommes à la recherche d'une personne très compétente pour le poste d'ingénieur - Avionique au sein de l'équipe de l'Ingénierie - Gestion des flottes de Maintenance Air Canada. Le titulaire sera responsable de la navigabilité et de la fiabilité en service des systèmes avioniques et électriques des appareils. De plus, il appuiera différents services au sein et à l'extérieur de Maintenance Air Canada.
Principales fonctions et responsabilités
Définir et examiner les conditions réglementaires obligatoires de navigabilité et les inspections de maintien de la navigabilité et obtenir les approbations financières nécessaires à leur mise en œuvre.
Examiner la fiabilité et les défaillances des avions et de leurs composants, déterminer les causes fondamentales des pannes et voir comment améliorer le rendement et l'expérience client.
Fournir du soutien technique à la maintenance des avions, des hangars et des ateliers aux emplacements désignés, et agir à titre de personne-ressource technique pour la Société et les fabricants d'équipement d'origine ou les fournisseurs.
Représenter l'Ingénierie aux réunions multidisciplinaires et formuler des commentaires à titre d'expert dans son domaine.
Soutenir des enquêtes sur la sécurité relativement aux avions et à leurs composants.
Contribuer à la réduction des coûts d'exploitation et de maintenance.
Soutenir les activités liées à l'avionique dans le cadre du programme de maintenance.
Qualifications
Baccalauréat en génie aéronautique ou électrique reconnu par une université canadienne ou une association provinciale d'ingénieurs
Au moins trois années d'expérience en génie aéronautique
Esprit d'équipe, talent avéré pour la communication et grand souci du client
Habileté à rédiger des descriptions et des instructions techniques de même que des fiches d'information et des rapports dans un style clair et concis
Habileté à faire des dessins techniques, y compris des schémas de câblage
Minutie et souci du travail bien fait, à la satisfaction des clients internes
Esprit d'initiative, besoin minimal de supervision et habileté à prendre des décisions
Excellent esprit d'analyse et habileté à coordonner les détails pour arriver avec succès au résultat final
Disponibilité à faire des heures supplémentaires et à travailler sur appel ou à l'extérieur de sa base d'affectation, selon les besoins quotidiens
Disponibilité à voyager à l'étranger pour de la formation, des réunions de l'industrie, etc.
Bonne connaissance des logiciels courants pour PC ainsi qu'AutoCAD
Liberté d'entrer dans d'autres pays sans restriction
Atouts
Connaissance des normes réglementaires de certification de la conception de Transports Canada et de la FAA
Connaissance de la conception d'une suite d'avionique de bord
Connaissance en gestion de la configuration logicielle
Connaissance de la technologie d'accès à Internet sans fil dans les avions
Conditions d'emploi :
Les candidats doivent avoir le droit de travailler dans le pays choisi au moment où un emploi leur est offert. Il incombe entièrement aux employés posant leur candidature d'obtenir les permis de travail, les visas ou toutes autres autorisationsrequises pour le poste.
Vaccination contre la COVID-19 requise
Exigences Linguistiques
À compétences égales, la préférence sera accordée aux candidats bilingues.
Diversité et inclusion
Air Canada est résolument engagée en faveur de la diversité et de l'inclusion et vise à créer un milieu de travail sain, accessible et gratifiant qui met en valeur la contribution unique de nos employés au succès de notre entreprise.
En tant qu'employeur qui garantit l'égalité d'accès à l'emploi, nous encourageons les candidatures les plus diverses afin de pouvoir nous doter d'un effectif varié et représentatif de nos clients et des communautés où nous vivons et offrons nos services.
Air Canada remercie tous les candidats de leur intérêt, mais seules les personnes sélectionnées pour une entrevue seront contactées
."
"Operating Engineer - Greater Napanee, ON - Indeed.com","Area of Assignment:
Maintenance
Basic Function and Scope:
As a member of a multidisciplinary team, the incumbent is responsible for the safe, overall efficient operation and maintenance of Hospital heating, ventilation, air conditioning (H.V.A.C.), refrigeration and plumbing systems.
Hours of Work:
Monday to Friday days, with on-call responsibilities
Pay Rate:
Will be in accordance with the S.E.I.U. Local 1, Canada Service Workers Collective Agreement.
Qualifications:
Education:
Secondary School Graduation Diploma;
3rd or 4th Class Operating Engineer Certificate.
Experience:
A minimum of two years mechanical and engineering in a certified plant environment;
Working knowledge of H.V.A.C systems.
Required Skills:
Ability to analyze and troubleshoot equipment;
Excellent interpersonal skills with demonstrated ability to communicate effectively, courteously and tactfully;
Ability to work in a team environment;
Ability to organize work assignments, deal with frequent interruptions, meet deadlines and work independently;
An ability to work with minimal supervision;
The incumbent must demonstrate a commitment to continuing education and professional development throughout his/her term of employment;
Must have previous proven good performance and attendance record.
Physical Requirements:
The applicant must be able to meet the physical demands of this position.
Reference ID: SW/2021/67
Job Type: Full-time
Salary: $27.08-$28.88 per hour
Benefits:
On-site gym
On-site parking
Schedule:
Monday to Friday
On call
Work remotely:
No"
"Mechanical Engineer - Vancouver, BC - Indeed.com","Reporting to: Electrochemical Operations Manager
The Electrochemical Group at NORAM designs, builds and demonstrates pilot plants using NORAM’s electrochemical cell platforms. NORAM is currently expanding the pilot plant facilities and requires an experienced, motivated, and enthusiastic mechanical engineer to participate in the design and to manage project technical progress. Portions of the work would be performed at NORAM’s subsidiary, BC Research, located on Mitchell Island.
This role will be a dynamic role that involves engineering, management and supervision of pilot plant projects. We encourage anyone with relevant skills in mechanical engineering to apply.
Responsibilities and Duties
Work directly with the Electrochemical Group leadership to help progress individual electrochemical pilot plant projects
Develop detailed engineering designs for pilot plant expansions and modifications. This will include equipment specification and design, plant design and layout and working with instrumentation technicians to select instrumentation.
Manage equipment / materials procurement working with purchasing department
Manage assembly technicians and external contractors
Qualifications and Skills
A successful candidate will have the following qualifications and skills:
A mechanical engineering degree
3+years engineering work experience in a project engineering environment
Industrial process or manufacturing experience (preferred)
Process or equipment design
Commissioning / plant operations
Pilot plant engineering / design
Focus on safety
Independent self-starter with an ability to work cooperatively in a fast paced and dynamic environment and complete tasks with minimal supervision
Send resumes by email to careers@noram-eng.com"
"Aeronautical / Aerospace Engineer - Langley, BC - Indeed.com","JOB SUMMARY: The responsibility of an Aeronautical Engineer is to assist in ensuring aircraft maintenance repair
duties and Quality Assurance is carried out in accordance with the Clearwater Defense UH-60 Maintenance
Procedures and our UH-60 Quality Manual and any other applicable Company policies and procedures
pertaining to the UH-60/SH-60 Blackhawk/Seahawk.
MAJOR RESPONSIBILITIES:
Maintain Quality Assurance Program for the UH-60/SH-60 Helicopter
Working with AMCOM on new manuals and MEO’s
Certify and maintain maintenance processes and procedures on the UH-60/SH-60 Helicopter
Communicate with and support the Material Review Board, Transport Canada, FAA
Work closely with Transport Canada on the Research and Development of PMA parts
Assist in miscellaneous duties as directed
Maintain and ensure a safe working environment
Provide mentoring and direction to junior employees
ACCOUNTABILITY:
Contribute to the ongoing improvement of the UH-60/SH-60 Helicopter
Maintain the high morale and sense of shared direction of the Company
Project a positive image of your work and Company
A sense of ownership
Ongoing personal and professional growth
JOB REQUIREMENTS:
Bachelor’s degree in Aeronautical/Aerospace Engineering
2-3 years experience working with the UH-60 and/or SH-60 Helicopter
2-3 years of Quality Assurance/Maintenance work on either UH-60 and/or SH-60 Helicopter
Candidate must speak fluent Spanish and English
High level of professionalism, maturity and confidence
Team oriented with creativity and ability to see projects through
Commitment to professional and personal growth
Highly efficient, effective and creative
To apply for this position please submit your resume and contact information to jobs@cwdsys.com quoting the
Job Title in the Subject line."
"Senior QA Engineer - Montréal, QC - Indeed.com","A quick snapshot…
We are looking for an individual who is passionate about quality assurance and automation. The senior quality assurance (QA) engineer will participate as part of a cross-functional Agile team and will advocate for and ensure quality for their team. You will participate in development design sessions and provide feedback from a quality perspective. You will coordinate best quality practices across other teams including offshore. You will lead and define transitions to embed quality practices within our new platform. And most importantly, you will be designing and developing automated testing for all layers of the solution (front and back end).
Why it's a big deal...
We are building a new team, platform and solutions and are looking to grow this area of expertise! This is an opportunity to come in and participate as we establish our standards and best practices.. This is a brand new platform and set of solutions, all developed in the latest technology stack -we're not just talking about putting automation in a legacy application. We're also working to establish modern DevOps practices - and this is a chance to be a key player in that process, as well.
Are you the person we're looking for?
Proven success with both automated and manual testing tools and technologies.
This is a must! Your test automation experiences include planning, assessments, script development and maintenance. You have hands-on experience with Cucumber and Selenium (or similar) automation frameworks and developing automation scripts. The technologies we are looking for include some of the following:
Gherkin
Cucumber
TestRail
CircleCI
BDD
TDD
TestNG
Restful APIs
Atlassian suite (Jira, Confluence, Bitbucket)
SQL
Natural collaborator.
You work effectively with developers, BA's, Product Managers, and customers to draft test plans and test cases from an established set of requirements. You are proficient with Agile and a collaborative cross functional approach to building awesome software. You are comfortable working with offshore teams and collaborating on best practices across multiple Agile teams. You constantly seek opinions and solicit feedback in an effort to create the best work possible. You don't know any other way. It's a team effort - and you completely appreciate that.
Confident and deliberate communicator.
You have a point of view and you're completely comfortable defending it to any person or group, regardless of level or status. It's a confidence that comes from experience. And that's not to say you aren't open to different views; but, when you feel strongly about a particular matter, you don't give up easily. You're at ease with lively debate - in fact, you welcome it. Your points are clear and concise. And you're equally as respected for your knowledge and expertise as for your style and approach.
Quality orientation.
You rarely make mistakes because you have good processes in place to ensure that every last detail is correct. But in those rare occasions when errors are realized (let's face it, it happens to the best of us from time to time), you own them, correct them, learn from them, and then quickly adjust and communicate processes to ensure the same mistake doesn't happen twice. It's your transparency, authenticity and humility is what sets you apart from the rest.
Stays cool when things get crazy.
We're growing fast - which translates to an ever-changing, super fast-paced work environment. This may involve immediate changes to plans and timelines. Your ability to quickly analyze situations and effectively prioritize tasks is what sets you apart from the rest. Rest assured: you've got this.
Did we pique your interest?
If this sounds like the kind of job you would love in the kind of environment you would thrive in, please drop us a line - we'd love to hear from you!
#LI-TM1
*
Did we pique your interest?*
If this sounds like the kind of job you would love in the kind of environment you would thrive in, please drop us a line - we'd love to hear from you!
Job Type: Full-time"
"Ingénieur civil / mécanique junior - Boisbriand, QC - Indeed.com","Boisbriand, Qc, Canada
Compagnie en forte croissance, équipe dynamique, conditions et environnement de travail exceptionnels. Vous êtes une personne passionnée de la gestion de marketing en plus d’être à l’affût de tout ce qui se fait de nouveau en matière de marketing numérique? Vous souhaitez vous joindre à une compagnie dont la croissance est en mode accéléré en plus d’offrir des conditions de travail et un environnement des plus stimulants? Un poste chez Damotech pourrait être pour vous!
À PROPOS DE DAMOTECH
Depuis plus de 30 ans, Damotech est le plus grand fournisseur et spécialiste des solutions de sécurité des palettiers en Amérique du Nord. Damotech a développé une gamme de produits brevetés pour répondre aux besoins de ses clients dont 200 entreprises faisant partie des
Fortunes 500
. De plus, Damotech est un leader de la croissance au Canada et est classé dans le palmarès
Growth 500
!
Une culture d’entreprise unique qui récompense la collaboration, l’innovation et l’engagement.
Un taux de rétention parmi les plus haut de l’industrie.
Opportunités d’apprentissage et de progression professionnelle inégalées.
Apprenez-en davantage sur Damotech en visitant nos pages à propos et carrières.
LE POSTE
Sous la supervision du Directeur de l’ingénierie, l’ingénieur civil / mécanique a pour rôle de procéder aux inspections de conformité et de déterminer les capacités de charges des systèmes d’entreposage (palettiers) des clients de Damotech. En plus de réaliser ses mandats, l’ingénieur voyagera à travers l’Amérique du Nord.
VOTRE QUOTIDIEN
Vous voulez en savoir plus? Voici ce qui vous attend :
Réaliser des inspections de palletiers et rédiger les rapports destinés aux clients.
Effectuer les calculs de capacité de charge des systèmes d’entreposage.
Assurer une bonne communication entre le client et Damotech.
Participer aux activités de développement des logiciels.
Agir à titre la personne ressource au niveau technique.
EXPÉRIENCE REQUISE
Baccalauréat en génie civil / mécanique (ou en voie d’obtention).
Parfaite maîtrise de l'anglais et du français (parlé et écrit).
Être passionné pour les voyages (Amérique du Nord).
BESOIN DE QUELQUES DERNIERS ARGUMENTS?
4 semaines de vacances.
Implication communautaire auprès de l’organisme Sun Youth.
Abonnement corporatif à un gym local.
Voyage de compagnie si les objectifs d’équipe sont atteints.
Veuillez soumettre votre candidature en remplissant le formulaire"
