Title,Description
"STAGE - Spécialiste SEO - Montréal, QC - Indeed.com","My Little Big Web est une agence Web spécialisée en création de sites Web, référencement sur Google (SEO) et publicité en ligne. Comme vous le remarquerez en visitant notre site Web, nous sommes une équipe sérieuse qui ne se prend pas au sérieux. Nous pensons que l’humilité et le côté humain manquent parfois dans le discours de certaines agences. Nous voulions donc afficher notre différence et assumer pleinement nos valeurs qui sont la créativité, le perfectionnisme, l’humilité et le fun.
SOMMAIRE DU POSTE::
Le spécialiste SEO sera en binôme avec le chef de pôle SEO chez My Little Big Web afin de l’accompagner dans les tâches suivantes :
Analyser les sites Web des clients au niveau expérience utilisateur / SEO et faire des recommandations.
Identifier les nouvelles tendances SEO, faire des tests et analyser les résultats.
Réaliser des audits SEO complets (selon une liste de critères définis par My Little Big Web).
Mettre en place une partie des recommandations SEO issues des audits réalisés.
Conseiller les clients sur la stratégie SEO la plus optimale pour eux.
Accompagner l’équipe de rédaction dans la mise en place des recommandations SEO.
Rédiger (au besoin) du contenu pour les clients (articles de blogues, pages services).
Optimiser des articles au niveau SEO.
Participer à la stratégie d’acquisition de liens en développant le réseau de sites partenaires de My Little Big Web.
Accompagner l’équipe de programmation de My Little Big Web dans la mise en place des recommandations SEO.
Créer et envoyer les rapports de performances aux clients à la fin de chaque mois.
Faire des suivis réguliers aux clients de l’agence (appels ou rencontres à l’agence) pour parler de leurs performances SEO.
EXIGENCES / COMPÉTENCES RECHERCHÉES ::
Volonté d’être formé par le chef de Pôle pour acquérir les méthodes de travail qui font le succès de My Little Big Web.
Connaissance et intérêt pour le SEO.
Informé des dernières tendances SEO.
Capacité à travailler en équipe.
Rigoureux.
Humble.
Pédagogue (aussi bien pour les clients que les membres de l’équipe).
LES PETITS PLUS DU QUOTIDIEN ::
Horaires flexibles (dans la limite du raisonnable).
Télétravail possible.
Un responsable de la bonne humeur (voir la page équipe (https://mylittlebigweb.com/little-big-team/)).
Un environnement décontracté.
Un nouveau local lumineux tout beau et tout neuf (nous avons hâte de te le montrer !).
Une terrasse sur le toit.
Des 5 à 7 réguliers : tournois de Poker, Mario Kart, Laser Game, activités extérieures, jeux virtuels (COVID oblige!), etc.
Boissons et collations.
Machine à Smoothies.
Salle de détente de 700 pieds carrés.
Console de jeux.
Espace salon / sieste.
Des fauteuils confortables (pour éviter les problèmes de dos).
À 5 min à pied de la station Joliette.
Etc.
NOTRE PROCESSUS DE SELECTION ::
Des tests de compétences en lien avec le poste
2 entrevues
Une prise de décision
1 retour : )
Tout au long du processus, la qualité du français (syntaxe et orthographe) sera évaluée et considérée.
POURQUOI TRAVAILLER CHEZ MY LITTLE BIG WEB::
Parce que nous aussi nous avons été salariés, pigistes, stagiaires (etc.) et que nous savons ce que vous recherchez : apprendre des choses, vous sentir utile sans vous faire exploiter, si possible dans un environnement jeune et plutôt fun.
NOTE : NOUS AVONS RENCONTRÉ 3 TYPES DE COLLABORATEURS::
Celui qui est là uniquement pour le salaire. Il fait ses heures, point.
Celui qui peut rester toute la journée sans rien faire si personne ne lui a confié de tâche.
Celui qui a compris qu’une entreprise comme My Little Big Web est pleine d’opportunités et qu’une évolution de poste est très probable. Il va donc rapidement s’intégrer et se rendre indispensable pour les autres membres de l’équipe.
Et vous, comment êtes-vous ?
Le masculin est utilisé pour alléger le texte, et ce, sans préjudice pour la forme féminine."
