Title,Description
"Senior Manager - Crypto and KMS Engineering - Toronto, ON - Indeed.com","Address:
100 King Street West
Job Family Group:
Technology
Develops, tests and implements information security platform/infrastructure strategies for the Bank. Provides cybersecurity subject matter expertise and advanced technical support. Builds the plans and roadmaps for future-focused information security solutions based on technical and business strategies, organizational growth and anticipated changes in the threat landscape. Works with stakeholders to recommend information security solutions based on engineering requirements. Ensures that information security systems and infrastructure align with business value and are technically sound and well-integrated. Provides timely response to escalations of critical issues to evaluate solutions, coordinate recovery and ensure resolution.
Fosters a culture aligned to BMO purpose, values and strategy and role models BMO values and behaviours in all that they do.
Ensures alignment between values and behaviour that fosters diversity and inclusion.
Regularly connects work to BMO’s purpose, sets inspirational goals, defines clear expected outcomes, and ensures clear accountability for follow through.
Builds interdependent teams that collaborate across functional and operating groups to create the highest value for all stakeholders.
Attracts, retains, and enables the career development of top talent.
Improves team performance, recognizes and rewards performance, coaches employees, supports their development, and manages poor performance.
Provides strategic input into business decisions as a trusted advisor.
Contributes to strategic plans, technology roadmaps, and standards and promotes adherence to them.
Anticipates and reduces complexity for others.
Acts as the prime subject matter expert for internal/external stakeholders.
Ensures alignment between stakeholders.
Breaks down strategic problems, and analyses data and information to provide insights and recommendations.
Leads detailed design reviews and makes recommendations for changes/enhancements.
Takes a leadership role in projects to implement new capabilities, significant upgrades, and product retirement.
Works with vendors and architects to understand technology roadmaps for incorporation into security platform planning.
Explores opportunities for innovation using new and existing security platforms.
Contributes to thought leadership at BMO in areas of subject matter expertise and shares expertise at industry forums.
Designs, develops, tests, implements & maintains information security platforms to meet requirements for security functionality, performance, scalability and resiliency.
Researches and tests new cybersecurity products and innovations to support tactical and strategic decision making.
Provides advice, counsel and support on information security platforms and services and recommends solutions.
Develops and implements changes to streamline and integrate security processes and systems in the organization.
Leads continuous improvement activities and root cause analysis with the goal of strengthening information security capabilities.
Builds effective relationships with internal/external stakeholders.
Troubleshoots complex issues with internal and external stakeholders as required.
Breaks down strategic problems, and analyses data and information to provide insights and recommendations.
Identifies opportunities to strengthen the information security capability at BMO, such as: sharing expertise to promote technical development, mentoring employees, building communities and professional networks across BMO.
Stays abreast of industry technical and business trends through participation in professional associations, practice communities & individual learning.
Ensures consistent, high quality practices/work and the achievement of business results in alignment with business/group strategies and with productivity goals.
Understands the scope of complexity that exists in the computing environment and the ways which security platforms impact that environment.
Operates at a group/enterprise-wide level and serves as a specialist resource to senior leaders and stakeholders.
Applies expertise and thinks creatively to address unique or ambiguous situations and to find solutions to problems that can be complex and non-routine.
Implements changes in response to shifting trends.
Broader work or accountabilities may be assigned as needed.
Qualifications:
Typically 7+ years of relevant experience and a post-secondary degree in Computer Science, Engineering, Information Systems, Information Security, or a related field of study or an equivalent combination of education and experience.
Multiple Information Security certifications from a well-recognized institution (e.g. (ISC)2, ISACA, SANS). Additional certifications in related fields preferred.
Understanding of multiple information security platforms and able to solve complex issues - In-depth/Expert.
Sought out across the business/industry as a subject matter expert in Information Security.
Technical and system-level expertise in one or more information security solutions and/or extensive background in IT design and engineering.
Knowledge of information security design and engineering concepts, practices, and technology obtained through formal training and work experience - In-depth/Expert.
Knowledge of the technical/business environment and the corporate processes and procedures - In-depth/Expert.
Seasoned professional with a combination of education, experience and industry knowledge.
Verbal & written communication skills - In-depth / Expert.
Analytical and problem solving skills - In-depth / Expert.
Influence skills - In-depth / Expert.
Collaboration & team skills; with a focus on cross-group collaboration - In-depth / Expert.
Able to manage ambiguity.
Data driven decision making - In-depth / Expert.
We’re here to help
At BMO we are driven by a shared Purpose: Boldly Grow the Good in business and life. It calls on us to create lasting, positive change for our customers, our communities and our people. By working together, innovating and pushing boundaries, we transform lives and businesses, and power economic growth around the world.
As a member of the BMO team you are valued, respected and heard, and you have more ways to grow and make an impact. We strive to help you make an impact from day one – for yourself and our customers. We’ll support you with the tools and resources you need to reach new milestones, as you help our customers reach theirs. From in-depth training and coaching, to manager support and network-building opportunities, we’ll help you gain valuable experience, and broaden your skillset.
To find out more visit us at https://jobs.bmo.com/ca/en .
BMO is committed to an inclusive, equitable and accessible workplace. By learning from each other’s differences, we gain strength through our people and our perspectives. Accommodations are available on request for candidates taking part in all aspects of the selection process. To request accommodation, please contact your recruiter."
"Senior Automation Lead - Toronto, ON - Indeed.com","Address:
120 Bloor Street East
Job Family Group:
Technology
Key Accountabilities:
Build technical end to end architecture; define strategic direction for testing automation practices across various team and for new business initiatives
Deliver automation strategy design and execution for assign portfolio to uplift API, web and desktop UI automation
Deliver automation solutions to align with business strategies
Manage automation development run and maintenance targets.
Lead proof-of-concept (POC) projects and the development of major test components in the systems including critical ""thick client"" and ""legacy"" applications
Analyze technical feasibility, determine tools for testing, provide optimum solutions and design for Automation framework and define best CI-CD approach
Build and lead ""Automation Testing Solutions (Center of Excellence)"" to help and guide projects under Personal and Business Banking by defining strong intake process and implement Governance
Lead heads down development of automation script for Web, Desktop, Mobile and API applications
Initiate lead testing assessment of assign projects including identifying other QA stakeholders
Support design of test strategy, test planning and test cases development review and approval
Demonstrate automation ROI to showcase short term investment vs long term benefits for stakeholders
Knowledge, Experience, and Skillset
Possesses a university degree and/or 8 to 10 years relevant work experience, computer science degree preferred
Industry-specific knowledge and experience is an asset
Possesses solid business knowledge in the Finance, Every Day Banking, Investment, and Lending
Java and Java Script
Experience as an Automation Architect delivering designs, solutions, framework and tools
Experience with Jira, Confluence, ALM
Prior experience with BMO
Good communication skills
End to End, Integration, Functional experience in testing enterprise wide banking and web applications, cross-browser and mobile devices (iOS and Android) testing.
Experience working in Agile/Hybrid teams.
QA lead experience capable of handling projects individually and also executing Test Cases.
Experience handling triage calls
Accessibility Testing
Banking domain like personal & business / cards / branch channel apps / self-serve / lending and mortgages banking work experience
Git/Bitbucket and Maven
CI/CD implementation experience with Bamboo/Jenkins
Docker/openshift/Kubernetes experience
Web Browser
Selenium-Webdriver
JUint/TestNG
Cucumber and BDD
API
Rest Assured with TestNG (Mandatory)
READYAPI/SoapUI with groovy scripting (secondary skillset)
Desktop/Thick Client:
RPA Base Tools
Test Complete or any similar tool experience
Mobile:
Appium and Perfecto
We’re here to help
At BMO we are driven by a shared Purpose: Boldly Grow the Good in business and life. It calls on us to create lasting, positive change for our customers, our communities and our people. By working together, innovating and pushing boundaries, we transform lives and businesses, and power economic growth around the world.
As a member of the BMO team you are valued, respected and heard, and you have more ways to grow and make an impact. We strive to help you make an impact from day one – for yourself and our customers. We’ll support you with the tools and resources you need to reach new milestones, as you help our customers reach theirs. From in-depth training and coaching, to manager support and network-building opportunities, we’ll help you gain valuable experience, and broaden your skillset.
To find out more visit us at https://jobs.bmo.com/ca/en .
BMO is committed to an inclusive, equitable and accessible workplace. By learning from each other’s differences, we gain strength through our people and our perspectives. Accommodations are available on request for candidates taking part in all aspects of the selection process. To request accommodation, please contact your recruiter."
"Ingénieur(e) électrique sénior en systèmes d'alimentation / Senior Power Systems Electrical Engineer - Montréal, QC - Indeed.com","***English will follow***
Ingénieur(e) électrique senior en systèmes d'alimentation
SACO est un leader dans le domaine de l'éclairage innovant, des écrans vidéo LED et des solutions et contrôles pour les médias. Notre expertise est appliquée dans une variété de projets remarquables dans le monde entier, allant de l'éclairage architectural aux installations d'art multimédia, en passant par les expériences de tournées musicales pour les plus grands artistes.
Nous sommes actuellement à la recherche d'un(e) ingénieur(e) sénior en systèmes d'alimentation électrique pour rejoindre notre équipe.
L'ingénieur senior contribue à définir les spécifications d'alimentation des produits et l'architecture des systèmes d'alimentation des projets en partenariat avec nos équipes de conception et d'architecture. Pour cette raison, le candidat idéal doit être un joueur d'équipe avec de fortes capacités multitâches et des compétences techniques supérieures qui comprend l'importance des responsabilités individuelles dans le succès des efforts de groupe.
Tâches
Concevoir les plans détaillés des systèmes de distribution d'énergie et d'éclairage du projet, du réseau électrique jusqu'à chaque luminaire, en passant par tout l'équipement de contrôle.
Travailler en étroite collaboration avec l'équipe de conception architecturale et informatique pour la définition des principes de conception des systèmes électriques et l'automatisation de la génération des dessins de topologie des systèmes électriques.
Produire et maintenir les dessins du système électrique et la documentation technique.
Travailler avec l'équipe de vente, les architectes et les chefs de projet pour déterminer plus précisément les spécifications des systèmes d'alimentation et les stratégies de conception du projet.
Travailler en étroite collaboration avec la R&D, la conception électronique et la conception mécanique pour mener à terme les nouveaux projets.
Préparer le rapport sur les quantités et les spécifications des composants pour le matériel des systèmes d'alimentation des projets.
Soutenir les chefs de projet dans la préparation et la publication des demandes de propositions (RFP) et des bons de commande (PO) pour les projets et le matériel des systèmes d'alimentation.
Guider et diriger les phases de test des lancements de nouveaux systèmes.
Assurer la conformité opérationnelle aux spécifications du système pendant les lancements de projets.
Soutenir les efforts de certification des projets et la conformité aux codes des systèmes d'alimentation en coordonnant, si nécessaire, le travail de consultants locaux tiers.
Assister les groupes d'ingénierie, de production, d'achat et de gestion de projet pour toute évaluation liée aux systèmes.
Exigences
Baccalauréat en génie électrique ou en génie des systèmes essentiel, maîtrise préférable.
Minimum 5 ans d'expérience dans un rôle similaire.
Expérience en éclairage, construction et architecture, un atout.
Expérience des réseaux / systèmes basse tension - requise.
Interprétation des dessins et procédures techniques.
Connaissances informatiques avancées.
Expérience avec Autocad, Solidworks et/ou Revit.
Capacités de programmation, un atout.
Compétence en conception de systèmes basse tension selon le US National Electrical Code et/ou le Canadian Electrical Code
Capacité à rédiger une documentation variée pour des publics ayant des aptitudes techniques différentes.
Compétences techniques étendues - mécanique, électrique, électronique, matériel/logiciel informatique, web/internet.
Flexibilité et autonomie.
Excellentes aptitudes à la communication.
Capacité à travailler sous pression.
Excellente attention aux détails, tant textuels que visuels.
Bilingue français-anglais, requis
Ce que nous offrons
L'opportunité de travailler sur des projets d'éclairage unique et battant des records, exposés autour du monde.
Une équipe expérimentée, dynamique et en pleine croissance.
Des salaires concurrentiels, une assurance collective et un programme de cotisation égale au REER
Des horaires de travail flexibles
Un code vestimentaire décontracté
Une grande diversité culturelle.
On ne fait qu’un, rejoignez SACO!
SACO n'est pas seulement une marque, c'est un état d’esprit, une culture. Nous réunissons des technologues, des experts de l'éclairage et des experts médias de divers domaines pour former une communauté de connaissances et de passion, dans le but de réaliser des projets extraordinaires.
Veuillez noter que sur lecture cette description de poste, nous avons employé le masculin comme genre neutre pour désigner aussi bien les femmes que les hommes.
******************************************
Senior Power Systems Electrical Engineer
SACO is a leader in innovative lighting, LED video displays, and media solutions and controls. Our expertise is applied in a variety of remarkable projects worldwide ranging from architectural lighting to multimedia art installations, to music touring experiences for top artists.
We are currently looking for a Senior Power Systems Electrical Engineer to join our team.
The Senior Power Systems engineer helps define the product power specifications and project power system architecture in partnership with our elite design and architecture teams. For that very reason the ideal candidate must be a team player with strong multitasking abilities and superior technical skills that understands the importance of individual ownership of tasks in the success of group efforts.
Tasks
Design project’s power distribution and lighting systems detailed layouts, from the power grid to each individual fixture, and including all control equipment.
Work closely with the architectural computational design team for the definition of power system design principles and automatization of the power system topology drawings generation.
Produce and maintain electrical system drawings and technical documentation.
Work with the sales team, architects, and project managers to further determine project power systems specifications and design strategies.
Work closely with R&D, Electronics design, and Mechanical design to lead the successful delivery of new projects.
Prepare project Bill-of-Quantities (BOQ) and component specifications report for projects power systems hardware.
Support Project Managers in the preparation and release of Request-For-Proposal (RFP) and Purchase Orders (PO) of power system projects and hardware.
Guide and lead testing phases of new system launches.
Ensure operational compliance with system specifications during project launches.
Support project certification efforts and power systems code compliance coordinating, when required, the work of third-party local consultants.
Assist Engineering, Production, Purchasing and Project management groups with any system related assessments.
Requirements
Bachelor’s degree in Electrical or Systems Engineering essential, Master’s preferred.
Minimum 5 years’ experience in a similar role.
Lighting, construction, and architectural experience, an asset.
Experience in low voltage networks / systems - required.
Interpretation of technical drawings & Procedures.
Advanced computer knowledge.
Experience with Autocad, Solidworks and/or Revit.
Programming abilities, an asset.
Proficiency in low voltage systems design under US National Electrical and/or Canadian Electrical Code/s.
Ability to write a variety of documentation for audiences with different technical aptitudes.
Broad technical competency — mechanical, electrical, electronic, computer hardware/software, web/internet.
Flexibility and autonomy.
Excellent communication skills.
Ability to work under pressure.
Excellent attention to details, both textual and visual.
Bilingual French English, required
What we offer
The opportunity to work on world-class and record-breaking lighting projects displayed across the world.
An experienced, dynamic, and rapidly growing team.
Competitive salaries, group insurance and an employer-matched RRSP plan.
Flexible working hours
Casual dress code
Great cultural diversity.
We come together as one, join SACO!
SACO isn’t just a brand, it’s a mindset, a culture. We bring together technologists, lighting and media experts from various fields to form a community of knowledge and passion with the same goal to do extraordinary things."
