Title,Description
"Territory Manager, iTero - Vancouver - British Columbia - Indeed.com","Join a team that is changing millions of lives.
Transforming smiles. Changing lives.
Transforming an industry.
At Align Technology, we are an industry leader and innovator in medical devices revolutionizing general practice dentistry with Invisalign® system and iTero® intraoral scanners. Our teams continue to push the boundaries of what is possible, never losing sight of who our customers are and how we can change their world through innovation.
After more than 15 years of providing products and services across the country, Align Canada opened its first office in the heart of downtown Toronto in 2017, and was certified as a Great Place to Work in 2019, again in 2020 and included on their Best Companies list in 2021.
Ready to join us?
About this opportunity
This is an opportunity for a Territory Manager, Edmonton/Vancouver/Central Ontario, who wants to play an integral role selling high-end transformative technology. You will take a consultative approach to understand the needs of your prospects and customers, creating a bespoke plan for each account leveraging a portfolio of technological solutions. You will grow revenue and expand market penetration through strategic account and territory management, building partnerships with professional business owners (Dentists & Dental Service Organizations) as well as key market stakeholders such as dental labs and associations.
What’s in it for you
Impact.
Our cutting-edge technology has helped create over 10 Million Smiles. Dentists are an integral part of our doctor-driven business. Our continued growth and success depend on enabling doctors to thrive. Joining us now is a chance to be part of the collaborative culture of the Align Canada team, working to grow business by selling directly to practice owners, transforming workflows from an analogue process to innovative digital solutions that help practitioners grow their business and increase patient satisfaction and standard of care. The dental industry is currently undergoing a monumental digital transformation and Align is a leader in driving this change.
Ownership
.
This is an opportunity to grow and expand new business in a market that has been disrupted. You will be the foundational voice and strategist, creating solutions that meet the needs of dentists seeking practice growth and digital solutions for patients. You will guide decisions as you form relationships and earn trust, providing advice on the benefits of a sizable financial commitment. And you will earn a rewarding commission in doing so. This is one of the most lucrative medical sales roles out there.
Career growth.
Align Technology is transforming an industry, growing from 5,000 employees five years ago to over 20,000 today. As we continue to innovate products and expand globally, the opportunities for a permanent position with advancement and leadership positions exist.
In this role, you will need…
The strategic sales approach.
You have 5 years of proven success in outside business-to-business (B2B) sales, meeting or exceeding your targets. You have experience selling technology products or services, capitalizing on data and analytics to present how your offering can make an impactful difference to your clients’ success. You know how to drill down to understand their unique needs, and tailor solutions. You are results-focused with the initiative to build out highly effective territory plans and account management strategies; and have hands-on expertise with a CRM for lead and account management. Ideally, you have exposure building relationships with small business owners in a health-related industry (i.e., dentistry, optometry, veterinary, chiropractic, etc.).
The interpersonal skills.
You are collaborative and can influence decision-makers. You can gain the trust of your clients, building relationships and leveraging insights to prioritize customer service and maximize growth opportunities. You have exceptional oral, written, and presentation skills, with the ability to adjust your approach for diverse audiences. Additionally, you have shown yourself to work well with internal cross-functional stakeholders to align on shared plans as to how to pull through sales opportunities.
The flexibility.
You embrace change and are comfortable adapting to changing market dynamics and new ways of doing things. Finally, you have a valid driver's license, a clean driving record, and access to a vehicle. You are willing and able to drive to various customer sites daily within your assigned geographical territory. You understand that infrequent overnight travel is required, including travel to the US occasionally.
Sound like a good fit?
Great! Click the ""Apply"" link to let us know you are interested. Not the right fit? Don’t worry, Align is quickly growing so we are creating more opportunities to expand our Align family. Please consider joining our Talent Network to receive notifications about future jobs or sharing this opportunity with others in your network.
About Align
Guided by our values of Agility, Customer, and Accountability, we foster a vibrant and inclusive employee culture that drives innovation and professional development.
Our beliefs, our actions.
Both teams and individual employees participate in a number of volunteer and community-focused activities, including food drives, school backpack drives, and other initiatives, including Operation Smile that provides access to cleft lip and palate corrective surgery for children.
Your growth and ours.
As we continue to expand, employees are provided with opportunities in their career journey. We have extensive continuous learning through our online education platform and support for development opportunities.
Our teams and our communities.
Every employee is as unique as their smile.We foster an environment across all of our locations and remote teams that is respectful, open-minded, and supports our core values. This includes employee resource groups for our diverse workforce through the REACH@Align initiative, with programs focused on diversity, and inclusion and our Women@Align resource group dedicated professional development and support for women in leadership roles.
Your benefits.
Our competitive compensation, benefits, health, and wellness programs are locally relevant and designed to meet you and your family's immediate and long-term needs. In addition, the Employee Invisalign® Discount Program serves as an additional perk for full-time employees and eligible dependents.
Join us
At Align, we live our company values by promoting healthy people and healthy communities, and we continuously pursue innovation that will benefit our customers - all with the intent of transforming smiles and changing lives. If you believe you possess most of these qualifications, we encourage you to express your interest here. We can't promise it will be a fit, but we do promise to consider your experience.
Global Diversity Statement
At Align, we believe in the power of a smile, and we know that every smile is as unique as our employees. As we grow, we will continue building a workforce of diverse cultural backgrounds and life experiences and fostering a culture of open-mindedness and compassion for all our employees. We live our company values by promoting healthy people and healthy communities. All with the intent of changing millions of lives, one unique smile at a time.
We welcome and encourage applications from people of all abilities. Accommodations are available on request for candidates taking part in all aspects of the selection process.
Equal Opportunity Statement
It is our policy to provide equal employment opportunity in all of our employment practices without regard to race, color, religion, sex, national origin, ancestry, marital status, protected veteran status, age, individuals with disabilities, sexual orientation or gender identity or expression or any other legally protected category. Applicants for positions with Align must be legally authorized to work in the country which they are applying for and verification of employment eligibility will be required as a condition of hire."
"Territory Associate - Niagara - Mississauga, ON - Indeed.com","Site Name:
Canada - Ontario - Mississauga
Posted Date:
Nov 8 2021
PRIMARY RESPONSIBILITIES
Develop sales plan for individual customers to grow the business including setting of appropriate short term objectives for customer calls to achieve long term goal
Execute territory business plans for product mix in order to achieve/surpass sales objectives in the Respiratory Division
Regular territory business reviews to evaluate impact of current plan and make adjustments as needed
Effectively integrate product knowledge into a relevant informative dialogue which brings customers an insightful perspective
Thoroughly understand GSK products, strategies, positioning and POA as well as those of key competitors
Understand how patients and health care professionals navigate the health care system and integrate these insights in the dialogue with the customer
Build and Maintain network of health care professionals to grow sales of product mix
Allocate budget and effectively use available resources (internal and external) to create customer value
Ensure your work contributes to the goals of the business and use your judgment to influence decisions
Find the best solutions for the business by working with people both inside and outside the organization
Work collaboratively with others and develop effective relationship to create new ideas together to get the best results
Contribute to a great working environment by bringing energy and commitment
Be open to learning, adapting quickly to new ways of working and identifying opportunities for development
BASIC QUALIFICATIONS
Minimum of a Bachelor’s Degree
Working knowledge of computer technology, especially Excel, CRM, Concur and agility to learn new programs
Willingness to relocate throughout Ontario an asset but not required.
Previous sales experience in pharmaceutical industry is an asset (1-3 years minimum)
Bilingualism an asset (not required).
PREFERRED QUALIFICATIONS
High sense of initiative, drive for performance, and have a Business Owner mindset
Highly developed verbal and written communication skills and communicating with clarity, structure and passion with high sense of listening skill
Working knowledge of interpretation of scientific research studies
In-depth knowledge of data analysis techniques
This position requires the employee to drive routinely on Company business and allows for the provision of a company – leased vehicle. However, to be eligible for this position and a company vehicle, GSK will need to obtain acceptable results from a license verification inquiry and drivers abstract review against its safe driver program requirement
GSK is an equal opportunity employer committed to diversity and inclusion. We welcome applications from all qualified individuals to apply to our career opportunities. GSK is committed to accommodating persons with disabilities. If you need accommodation at any stage of the application process or want more information on our accommodation policies, please contact us at canada-recruitment@gsk.com. Please do not send resumes to this e-mail and instead apply through the online application process of this posting.
As a health and science-based organization, GSK is committed to following the recommendations as set out by Health Canada and taking all necessary steps to help curb the spread of COVID-19 which includes getting the COVID-19 vaccine. We feel strongly that this is the best way to help protect those we value most: our employees, families, communities and the patients and consumers we serve. To that end, we are taking an important step to ensure the safety of our employees during this global public health crisis.
Only employees who are fully vaccinated against COVID-19 may attend our Mississauga and Laval corporate offices. In addition, all customer-facing employees who, as part of their job, attend healthcare settings such as hospitals, pharmacies, doctors’ offices and dentists’ offices will need to be fully vaccinated against COVID-19. Notwithstanding the foregoing, employees may seek an accommodation for human rights-related reasons, including medical or disability-related conditions, or religious beliefs.
Important notice to Employment businesses/ Agencies
GSK does not accept referrals from employment businesses and/or employment agencies in respect of the vacancies posted on this site. All employment businesses/agencies are required to contact GSK's commercial and general procurement/human resources department to obtain prior written authorization before referring any candidates to GSK. The obtaining of prior written authorization is a condition precedent to any agreement (verbal or written) between the employment business/ agency and GSK. In the absence of such written authorization being obtained any actions undertaken by the employment business/agency shall be deemed to have been performed without the consent or contractual agreement of GSK. GSK shall therefore not be liable for any fees arising from such actions or any fees arising from any referrals by employment businesses/agencies in respect of the vacancies posted on this site."
"Locum Family Physician - North Vancouver, BC - Indeed.com","Locum commencing January 2022 with flexible arrangements; workdays and hours to be discussed.
IMG SUPPORT AVAILABLE at this fantastic location for a more permanent/long-term arrangement. IMGs eligible for provisional licenses to practice family medicine in BC are welcome to apply!
Clinic in Vancouver’s Beautiful North Shore
Located in North Vancouver, British Columbia Lynn Valley Medical clinic is looking for a full-time and/or part-time Family Physician to join their Family Practice/Walk-in clinic. The clinic uses Oscar EMR and offers billing support.
The payment structure is fee-for-service and the split arrangement is 70/30.
Clinic Details: The clinic is open 7 days a week, has a pharmacy next door and laboratory, physiotherapy and dentist in the same building. There is a small procedures room for lumps and bumps. Virtual consultations are available, although the clinic is looking for an onsite family physician. There are 2 full-time and 2 part-time Family Physicians currently working at the facility, and an incoming Registered Nurse starting in January.
The clinic is located in a stunning area of Metro Vancouver, known for it is outdoorsy lifestyle, west coast vibe, and surrounding hiking and biking trails.
Hold or soon to attain Certification in the College of Family Physicians (CCFP). Hold or eligible for a full license to practice medicine in BC. Good standing with BC College of Physicians. No hospital privilege's required. Provisional license eligible applicants are welcome to apply.
Get in touch with the recruitment team at the North Shore Divisions of Family Practice today to learn more about this opportunity and to discuss your preferences for other similar opportunities throughout the North Shore, Sea to Sky, and Sunshine Coast region.
Part-time hours: 20-40 per week
Job Types: Full-time, Part-time, Contract
Salary: From $1,000.00 per day
Benefits:
Casual dress
Flexible schedule
Schedule:
Day shift
Monday to Friday
COVID-19 considerations:
All measures are in place.
Work remotely:
No"
"Registered Nurse - Sarnia, ON - Indeed.com","Company Biography
**Please Note:
This is an open job posting. Applications will be reviewed when vacancies become available. The County of Lambton has 3 Long-Term Care Homes, which include Marshall Gowland Manor (ONA MGM) in Sarnia, Lambton Meadowview Villa (ONA LMV/NLL) in Petrolia, and North Lambton Lodge (ONA LMV/NLL) in Forest. A Registered Nurse position is only required to work at one Home.**
The County of Lambton is an urban-rural area in southwestern Ontario that is home to over 126,000 residents. The Corporation's seven divisions operate programs and services for the residents of Lambton County such as land ambulance, provincial offences court, three Long-Term Care Homes, 25 library branches, two museums, an art gallery, archives, local roadways, public health services, housing services, social services, building services and planning and development services. Lambton County is a community dedicated to economic growth, environmental stewardship and an enhanced quality of life through the provision of responsive and efficient services and collaborative efforts with its municipal and community partners.
Position Overview
The Registered Nurse (RN) is registered annually with the College of Nurses of Ontario and has a Certificate of Competence. The RN oversees the care of residents following the guiding principles of the College of Nurses Standards of Care and is responsible for, and accountable for providing nursing care to residents, directing work of Personal Support Workers (PSW), and Registered Practical Nurses (RPN) as required. The RN is a member of the Health Care Team in the home interacting with other disciplines such as the Nurse Practitioner, Physician, Dietician, and Physiotherapist to develop the residents' plan of care.
Duties and Responsibilities
Resident Care:
Develops the plan of care in collaboration with team members for each resident in the home area as assigned
Completes the resident care plan and assessments as required in an electronic documentation system using the MDS- RAI assessment tools
Documents care provided to residents in the progress notes in an electronic documentation system
Directs the PSW/HCA; regarding their resident assignment, dining room assignment and documentation of the flow sheets
Administration of Medications and Treatments:
Administers medications and treatments as prescribed by the resident's physician, dentist and other health disciplines according to the pharmacy policy for medication administration and the College of Nurses Medication Standards
Records responses to PRN medications on the back of the MAR as per the policy
Conducts wound assessments weekly for each wound treated in an electronic documentation system
Reports wound progress to the Nurse Practitioner who monitors and orders the treatment protocols for wound treatment
Communication:
Deals tactfully and courteously with residents, residents' families and visitors
Establishes and maintains good working relationships with all departments and personnel
Communicates resident information to the team and completes the plan of care to enable resident care goals be met for each resident in the area assigned
Communicates any unusual occurrences and critical incidents on the nursing unit to the Director of Nursing and Personal care in order to complete notification to the MOH as required
Administration:
Works with the team to perform the ""MDS RAPS"" for each resident for each quarterly review
Assists in maintenance of good standards of cleanliness for residents and the Home and reports problems to appropriate personnel
Assists with orientation, evaluation and performance appraisals of PSW
Supports, encourages and provides meaningful clinical experiences to all nursing students as assigned
Complies with fire and safety regulations including all alarm notification, evacuation, use of fire extinguishing equipment and disaster plan procedures
Chairs and is a member of various committees in the Home as requested. For example, Infection Control, Professional Advisory Committee, Resident Safety Committee, professional advisory and pharmacy and therapeutics, Health and Safety, resident reviews of quality assurance
Knowledge Maintenance:
Studies trends and developments in nursing practice and evaluate their adaptability to specific nursing duties in conjunction with the Director of Nursing and Personal Care
Equipment Inspection/Cleaning:
Ensures proper care of equipment used in providing care to residents
Charge Nurse
When Delegated as In-Charge in the Absence of the Director of Nursing and Personal care:
Oversees the operation of the home
Assists peers through trouble shooting, educating, providing support, leadership and notifying the On - Call Administration person as required
Reviews, records and replaces staff call ins and illness as able
Assists staff in completing WSIB paper work, arranges for medical treatment if required and offers modified work according to the home policy
General:
Incumbents must keep up-to-date on all relevant legislation, collective bargaining agreements, County Policies and Procedures, etc. ensuring that these are implemented as prescribed
Incumbents must possess the physical ability to meet the duties and responsibilities of the job description and/or the requirements identified within the position's Physical Demands Analysis
These describe the general nature and level of work being performed by incumbents in this classification. They are not an exhaustive list of all job duties in the classification. Other duties may be assigned.
Supervision Requirements
Direct Supervision:
None
Indirect Supervision:
None
Functional Authority:
Provides direction, consultation and advice to Registered Practical Nurses and Personal Support Workers.
Qualifications
Minimum Formal Education:
Current Certificate of competence as a Registered Nurse with the College of Nurses of Ontario
Completion of a course in gerontology and/or other related courses are desirable
Experience:
None required"
