Title,Description
"Personal Support Worker/Nurse - Toronto, ON - Indeed.com","Seeking a trustworthy, responsible, competent and compassionate PSW for various shifts, including overnights and weekends, to take care of an elderly, bedridden woman on a feeding tube at a private condo in the East end of Toronto.
Please NOTE the following:
You will not have your own room; need to stay with client in the same space
For all shifts, including overnight, you are expected to stay awake and attentive
It's a clean and comfortable condo and should stay this way; do not expect a spacious house, large institution or facility
You will be expected to interact with the client who doesn't speak but is still expressive and very aware so requires a conscientious and diligent PSW who will keep her comfortable throughout the shift. She is very stiff and fragile. Because she can easily aspirate, we require a PSW who will be knowledgeable and competent to become familiar with her facial expressions to ensure she is safe from gagging.
DUTIES include:
massaging her legs and foot when she gets painful spasms
gentle ROM exercise or light massaging of her limbs usually twice per shift
personal hygiene/oral care and peri-care
maintaining feeding tube which runs all night
repositioning her while paying extra attention to the feeding tube
checking blood pressure 3X/day
medication administration via feeding tube
helping incoming PSW with putting her in a wheelchair on some mornings using a hoyer lift
During the overnight shift, the PSW must be able to handle changing and repositioning her in the middle of the night on his/her own. This is not a cash nor sponsorship job. You should live in the GTA.
We are interested in serious inquiries only as would like to contract someone for at least three months. Training is necessary and will be provided. Willing to pay for training and negotiate with the right candidate as there is some flexibility with time and rates.
Part-time hours: 25-35 per week
Expected Start Date: 2021-11-27
Job Types: Full-time, Part-time, Contract, Permanent
Salary: $140.00-$215.00 per day
Benefits:
Casual dress
Discounted or free food
Flexible schedule
On-site parking
Schedule:
10 hour shift
12 hour shift
8 hour shift
Day shift
Holidays
Monday to Friday
Night shift
Weekend availability
COVID-19 considerations:
Rapid antigen test is administered weekly and PPE is provided to be worn throughout the shift. There is an air purifier running throughout the shifts.
Application question(s):
Are you currently working in LTC, a hospital or retirement home?
Are you willing to train and then work regular shifts? When can you start?
Experience:
caregiving: 2 years (preferred)
Language:
tagalog or chinese (preferred)
Work remotely:
No"
"REGISTERED NURSE, RPTA - Welland, ON - Indeed.com","Working to promote nursing excellence, quality patient/client-centered care and high professional standards, the Registered Nurse will be responsible for the assessment, nursing diagnosis, integrated care plan development, implementation and evaluation of nursing care. The objective of the Registered Nurse is to provide safe and competent care through the application of nursing knowledge, the technical aspects of professional practice and the demonstration of compassion, professionalism and respect. The incumbent will perform all other relevant duties assigned to ensure the efficient operation of the unit to which s/he is assigned. The successful candidate's home site will be the Site listed above and must be willing to work at two or more sites.
QUALIFICATIONS:
o Current registration with the College of Nurses of Ontario
o Two years related clinical experience in the past five years in hemodialysis
o Current BCLS certification
o Certification in advanced nursing skills related to hemodialysis
o Demonstrated knowledge and skill in physical assessment
o Performs to the full scope of practice as outlined by the College of Nurses of Ontario
o Current knowledge of the pathophysiology of the Kidney Care Program
o Demonstrated knowledge, skill and judgment in the application of hemodialysis
o Demonstrated knowledge and understanding of nursing standards as they apply to the care of patients/clients with Chronic Kidney Disease
o Demonstrated commitment to patient/client centred care
o Applies leadership skills by providing, facilitating and promoting quality patient care
o Demonstrated ability to perform effectively as most responsible nurse in a total patient care model
o Demonstrated commitment to patient and family education and the ability to promote health and wellness
o Evidence of accurate, timely and appropriate documentation according to best practice guidelines and CNO standards
o Applies knowledge, skills, judgment and competencies required for safe practice as outlined by the College of Nurses of Ontario
o Consistent and regular attendance required
o Proficiency in both official languages (English and French) will be considered an asset
o Vaccines (COVID-19 and others) are a new hire requirement of the job unless you have an exemption based on medical or on a ground pursuant to the Ontario Human Rights Code.
Recruitment Specialist: Emily Fabiano
It is Niagara Health policy to give consideration to qualified internal applicants.
We are especially interested in connecting if you...
Value diversity, equity and inclusion;
Are excited about being part of a respectful and hard-working team in the beautiful Region of Niagara;
Identify as a member of one or more of the following groups: equity-seeking group, Indigenous persons, persons with disabilities, persons of diverse sexual orientations and gender identities and all others who may contribute to the further diversification of ideas.
Have background or expertise in the healthcare environment, supporting patient care and providing extraordinary customer-service
In accordance with the Accessibility for Ontarians with Disabilities Act, 2005 and the Ontario Human Rights Code, Niagara Health will provide accommodations through the recruitment process to applicants with disabilities. If selected to participate in the recruitment and selection process, please inform Human Resources of the nature of any accommodation(s) that you may require in respect of any materials or processes used to ensure your equal participation."
