Title,Description
"Software Analyst - Int - Toronto, ON - Indeed.com","Location: Toronto, Canada
Thales people architect solutions that support 85 million mainline and suburban passenger journeys, worldwide, every day. Our Rail Signalling and Communication systems are used on metro lines across major cities, and 72,000 kms of route, 52,000 trains per day in 16 countries are controlled by our Traffic Management Systems. Together We deployed the first-ever nationwide ticketing system which processes over 50 million ticketing transactions in 100 cities daily.
Thales provides world-leading Communications-Based Train Control (CBTC) and interlocking for mass rail transit applications globally. The Centre of Competence for Urban Rail Signalling is located right before you at mid-town Toronto. As the largest office in Canada, we house a department for every step of the Software Development Lifecycle (SDLC)! This includes Software, Hardware, Systems Design, Verification & Validation, Operations, etc. The supporting corporate shared services teams in Finance, Human Resources and IT is also located at the office. Our office space was designed to provide a sustainable, healthy workplace that expresses TRSS’s brand while increasing collaboration. Features include Greenguard furniture, EnergyStar appliances, low-emitting adhesives, sealants, and sliding glass doors on internal offices provide daylight and views to the outside. Come join the big Transport family, here in Toronto!
To design, create, analyze, debug and deliver software for train control systems of Thales Rail Signalling Solutions.
Key Responsibilities:
Understands and follows the company’s processes and procedures for developing mission critical software
Implements near real time systems in C++
Designs, codes, debugs, write test procedures and tests software code.
Reviews code, test procedures and test results
Analyses and implements correction for defect reports
Perform engineering testing in the field and investigates problems in the field.
Provides some input for cost estimates.
Required Qualifications:
Good command of C++ language including templates, STL, Boost, MFC usage
Good command of C#, WPF
Knowledgeable of HTML5, Responsive CSS3, JavaScript, Typescript coding skills,Front End web development frameworks like Polymer, Angular, WebSockets, RxJS, WebGL, Canvas and other rendering technologies, Pixi.js
Knowledgeable of software building tools like NPM, Gulp
Good command of the scripting languages Perl and Ruby
Knowledgeable of object oriented techniques, multithreading, socket programming, Windows
Good analysis skills, able to diagnose issues based on field logs and correlate events to failures
Able to handle assignments within a medium to large scale software application
Knowledgeable of the software development process
Able to quickly integrate with the team and work independently
Knowledge of software development environment (Microsoft Visual Studio, desktop simulator, target simulator , etc)
Preferred Qualifications
B. Sc., in Electrical Engineering, Computer Science for equivalent,
Minimum 3 years relevant working experience – or equivalent
Thales is required to follow mandatory customer policies as well as Federal and Provincial legislation, now and in the future. This includes, but is not limited to, vaccination mandates and travel requirements. This role requires you to work on a customer site and/or travel. Therefore you must follow all mandatory customer policies and Federal and Provincial legislation as a condition of employment.
Thales is an equal opportunity employer which values diversity and inclusivity in the workplace. Thales is committed to providing accommodations in all parts of the interview process. Applicants selected for an interview who require accommodation are asked to advise accordingly upon the invitation for an interview. We will work with you to meet your needs. All accommodation information provided will be treated as confidential and used only for the purpose of providing an accessible candidate experience."
"IT Service Delivery Analyst - Edmonton, AB - Indeed.com","Keyera Career Opportunity
Job Type:
Independent Contractor
THE POSITION
We are currently seeking an IT Service Delivery Analyst (Deskside Analyst) to join our Service Delivery team in our Alberta EnviroFuels (AEF) office in Edmonton. The successful candidate will work within a dynamic team environment while being personally committed to providing the highest standard of technical support services to the Keyera corporate community.
IT Service Delivery Analysts divide their time between Tier 2 Service Desk, project work and deskside support. The position also requires occasional travel to Keyera facilities; providing on site assistance related to system upgrades, new installations and various IT software, hardware, and mobility issues.
This a Six Month Contract position with an opportunity to extend.
RESPONSIBILITIES
Provide a high level of professional customer service to our extended Keyera community.
Install, support, and maintain various IT software and hardware to ensure compatibility, integration, and reliability of service.
Comfortable providing support: face to face, over the phone and remotely for desktops, laptops, and mobile devices (iOS and Android).
Courteously obtain and record concise issue information for external and internal service personnel.
Provide accurate and timely reporting of issues and their resolution using our ITSM system.
Respond to Service Desk calls via telephone, online or in person.
Escalate and triage issues and problems as required.
Create, review and update knowledge base and other documentation as assigned.
Ability to take initiative and work independently.
Undertake any training required in order to maintain competency.
Contribute to and work within a safe working environment.
Occasional travel will be required to facilities within Alberta.
QUALIFICATIONS
The successful candidate will be well-organized, energetic, and service oriented with the following qualifications:
Diploma in Information Systems or related field.
5 years experience in PC support.
A+ or other appropriate certifications a plus.
Excellent customer service, communication and interpersonal skills.
Windows 10, Microsoft M365 and computer hardware and software experience.
Excellent customer service, communication and interpersonal skills.
Ability to achieve successful outcomes in handling difficult situations and customers.
Demonstrated analytical and troubleshooting skills.
Ability to take initiative and work independently.
Demonstrated commitment to customer satisfaction.
Experience working in midstream facilities with Personal Protection Equipment and safety training an asset.
Experience with ITIL based processes an asset.
Experience in AV or associated technologies an asset.
Demonstrated ability to manage multiple priorities and follow through on projects to completion.
Valid Alberta Driver’s License
Posting Expiry Date:
Dec 17, 2021
Keyera prioritizes the health, safety and wellbeing of workers and, in accordance with our Workplace COVID-19 Vaccination Policy, Keyera requires workers to be vaccinated against COVID-19 in an effort to ensure Keyera workplaces are safe and secure. Being fully vaccinated against COVID-19 is a condition of employment and the successful candidate will be required to submit proof of vaccination documentation within 3 business days of their start date. Workers who are unable to be fully vaccinated may be eligible for accommodations.
If you are interested in an opportunity to join a winning culture that fosters innovative thinking, open communication, integrity, and mutual respect then you'll enjoy your career with us!
We thank all applicants for their interest; however, only those considered for an interview will be contacted."
"Data Conversion Developer - Vancouver, BC - Indeed.com","Staff - Non Union
Job Category
M&P - AAPS
Job Profile
AAPS Salaried - Information Systems and Technology, Level D
Job Title
Data Conversion Developer
Department
Data Migration | Security, Access, Data & Reporting | Leadership | Integrated Renewal Program Student
Compensation Range
$7,278.33 - $11,372.33 CAD Monthly
Posting End Date
December 17, 2021
Note: Applications will be accepted until 11:59 PM on the day prior to the Posting End Date above.
Job End Date
There are 4 vacancies for the Data Conversion Developer position.
Job Summary
UBC has embarked on a multi-year journey to transform its academic and administrative support processes and system environments for the entire UBC community. In November 2020, UBC successfully went live with its new HR and Finance implementation of Workday. The Integrated Renewal Program (IRP) is now focused on the journey to renew the Student information ecosystem, anchored by the implementation of Workday Student.
The Integrated Renewal Program—Student (IRP Student) vision is to transform the way UBC supports learning and research, and how UBC works, to create a cohesive, integrated, and enriched experience for students, staff, and faculty. This implementation will result in superior support for UBC students, a better user experience, a new set of tools, a new way of working, and improved reporting for informed decision-making. IRP Student will leverage the industry-leading cloud enterprise solution Workday to replace our current core Student administration systems with a new integrated, user friendly, mobile-enabled platform.
For more information on the IRP, please visit www.integrated-renewal.ubc.ca .
The Data Conversion Developer designs computer application solutions for existing complex or campus-wide computer systems.
This position will contribute to the implementation of large-scale Data Migration/Conversion solutions for UBC's IRP Student. The incumbent will focus on the design and implementation of Data Migration/Conversion processes and components including Data Quality analysis, Master Data Management, Data Retention strategies and workflows, Data Cleansing strategies and workflows, Data Augmentation, Data Mapping using logical and physical data models, ETLs for Data Migration/Conversion strategies and workflows, and Data Reconciliation strategies and workflows.
The incumbent will work closely with end users, analysts, technical leads, managers, and developers to Clean, Augment and Migrate millions of UBC-related records. The applicant will understand complex data, relationships, and dependencies inherent in enterprise-class systems and understand how translate these complexities into high quality data migration solutions.
This is a hands-on delivery role within a multi-disciplinary technical and business team.
Organizational Status
Interacts directly with other University technology professionals and with faculty, staff and students. Reports to the Senior Manager, Data Conversion.
The position will work with other Programmer Analysts, Build Engineers, Business Analysts and Quality Assurance staff in ensuring the highest quality of solution delivery.
Work Performed
Specific Duties:
Design robust, highly disciplined and maintainable data migration/conversion processes; build master data repositories; develop data profiling, quality and cleansing requirements.
Serve as a data quality/cleansing consultant for functional analysts to help define, estimate, and propose solutions for functional data issues.
Develop proof-of-concepts and prototypes to help illustrate approaches to technology and functional problems.
Contribute to designing detailed data migration/conversion strategies, approaches, and plans under the guidance of the Data Conversion Lead.
-Contribute and adhere to standards, structures, and techniques for capturing data from a variety of sources -including data cleansing, migrating, validating, and auditing data.
Create technical design documents to communicate solutions that will be implemented by the development team.
Facilitates and conducts design and code reviews for other Data Developers to ensure efficiency and adherence to development standards.
Gather scope and requirements of assigned data migration/conversion units.
Contributes to the development of data specifications.
Build and maintain working relationships and collaborates with others to achieve client objectives.
Core Duties:
Designs, develops and programs custom software, defines detailed application specifications, standards, and diagrams and develops coding logic flowcharts.
Develops overall systems design, researches and evaluates vendor supplied applications, provides customize or develop recommendations, and implements accordingly.
Analyzes and reviews existing or proposed system features and integration, security, scalability and performance requirements with clients, business analysts, and team members.
Manages small to medium sized projects and related budgets.
Packages in house developed applications for production or integrates vendor supplied applications.
Provides technical expertise, training, and consultation to other staff.
Develops or modifies software application design and specific modules.
Conducts testing of new or customized application modules to ensure application meets specifications.
Documents functions and changes to new or modified modules, tests activities/results, error handling and backup/recovery procedures.
Provides ongoing maintenance and operational support for applications.
Supports software development lifecycle and applies and follows appropriate programming/development methodologies and best practices.
Maintains appropriate professional designations and up-to-date knowledge of current information technology techniques and tools.
Performs other related duties as required.
Consequence of Error/Judgement
The position takes an active, participatory role in ensuring the reliability and high availability of UBC mission critical 7x24 systems including application monitoring, tier 2 support, problem analysis and resolution, and ensuring services meet or exceed customer service levels at all times.
Errors in judgment, poor planning, or failure to act decisively could have a detrimental effect on these systems. Unreliable systems and code errors that disrupt the operations of these system, or failure to meet contractual obligations for performance and availability will damage the reputation of UBC and UBC-IT. This could adversely impact the University community, including the large majority of students, faculty and staff, and could cost hundreds of thousands of dollars in lost productivity, funding and revenue.
Supervision Received
Works with considerable latitude and with regard to methods and procedures. Work is reviewed in terms of achievement of broad objectives and goals.
Reports to the Senior Manager, Data Conversion and may work under the direction of a Data Conversion Lead for specific project tasks.
Supervision Given
May provide guidance, coaching and technical leadership to, and provide feedback on performance of less experienced Programmer Analysts.
In a project leader role, the Data Conversion Developer may direct and supervises work of other Data Developers, Business Analysts, Testers, users and other staff assigned to projects.
May provide input/recommendations into the hiring and evaluation of staff.
Minimum Qualifications
Undergraduate degree in a relevant discipline. In-depth knowledge of applications and the business requirements supporting them. Minimum of five years of related experience, or the equivalent combination of education and experience.
Preferred Qualifications
Demonstrated knowledge of Data Migration, Data Quality, Data Cleansing, and Extract-Transform-Load (ETL) concepts, principles, and tuning strategies; experience with SQL programming including advanced queries in multiple database technologies such as Oracle and SQL Server.
Experience with data analysis and modeling tools and concepts.
Experience performing technical analysis, technical design, implementation planning and delivery, and technical and end-user documentation.
Practical experience with delivery of two large scale enterprise-class Data Migrations and Data Quality best practices.
Ability to work in a matrix team environment.
Knowledge of Student Information Systems is an asset.
Knowledge of Enterprise Resource Planning (ERP) systems with multiple modules (e.g. CRM, Sales, Invoicing, Financial Accounting) is an asset.
Collaboration - Actively solicits ideas and opinions from others to efficiently and effectively accomplish specific objectives targeted at defined business outcomes. Openly encourages other team members to voice their ideas and concerns. Shows respect for differences and diversity, and disagrees without personalizing issues. Utilizes strengths of team members to achieve optimal performance.
Communication for Results - Conducts discussions with and writes memoranda to all levels of colleagues and peer groups in ways that support troubleshooting and problem solving. Seeks and shares relevant information, opinions, and judgments. Handles conflict empathetically. Explains the context of interrelated situations, asks probing questions, and solicits multiple sources of advice prior to taking action when appropriate.
Problem Solving - Applies problem-solving methodologies and tools to diagnose and solve operational and interpersonal problems. Determines the potential causes of the problem and devises testing methodologies for validation. Shows empathy and objectivity toward individuals involved in the issue. Analyzes multiple alternatives, risks, and benefits for a range of potential solutions. Recommends resource requirements and collaborates with impacted stakeholders.
Accountability - Sets objectives that meet organizational needs. Provides recommendations to individuals and teams on ways to improve performance and meet defined objectives. Monitors and provides feedback on individual and team performance against defined standards.
Business Process Knowledge - Maps full business processes and designs operational process flow. Facilitates group input and drafts proposals for process improvements. Identifies resource implications. Implements process improvement recommendations within the context of overall business processes.
Information Systems Knowledge - Resolves escalated problems of technical support. Identifies root causes. Sets up and integrates new and enhanced information systems. Identifies customer needs and determines the appropriate approach to apply and ensure resolution. Solicits the input of appropriate technical experts and managers as required."
"Product Analyst - Toronto, ON - Indeed.com","Performs analysis of business requirements for new or existing systems. Confers with business units to analyze current procedures, identify problems, and learn specific requirements. Design of business improvement processes for new or existing systems. Writes detailed descriptions of user needs, program functions and prepares design documents ensuring proper IT standards are followed. Reviews and evaluates capabilities and benefits of existing systems and processes and determines if requested program or program change is possible. Maintains application through the life cycle of systems. Provides support by ensuring stability of the application, addressing and resolving the issues in a timely manner. Coordination of testers, internal and external, and execute system and coordinate and support user acceptance tests. Provides reference material by writing and maintaining online help, and super user training. Provides the business to use systems and software by conducting super user training sessions. Manages relationship with the business ensuring quality and timely business solutions while seeking to continuously improve current business and system processes and providing quality customer service. Direct and provide guidance to junior team members. Mentors and coaches team members to ensure quality results for our customers
Qualifications:
Post-secondary education in Computer Science, Business or relevant discipline
Knowledge of business analysis, systems analysis and quality assurance methodologies
Experience in SQL and creating SQL scripting, reporting, advances analytics and experience in retail industry
Intermediate knowledge with Networking
Intermediate knowledge on Windows Servers
Intermediate knowledge with virtual systems
Experience with Pharmacy Dispensing systems and Retail systems, preference will be given to those with Kroll Applications experience
Ability to be creative and innovative thinker
Excellent written and verbal communication, including strong presentation skills. Analytical thinker
Exceptional relationship building skills
Excellent planning and organization skills
Ability to write high quality technical and functional system specifications
7-10 years’ experience in a related information services role
Experience working on an agile team is preferred
Contract length: 12 months
Job Types: Full-time, Contract
Benefits:
Work from home
Schedule:
Monday to Friday
Work remotely:
Temporarily due to COVID-19"
"IT Support Analyst - Cambridge, ON - Indeed.com","Job Description:
60% Computing Systems Analysis & Design
Exercise independent judgement and logic in prioritization of tasks and developing solutions to technical problems
Systems analysis, including consulting with users, and application of industry knowledge to determine functional requirements for
new computer systems and system enhancements
Design, develop, document, and test computer systems or programs relating to user or system design specifications
Research commercially available software to identify products that might meet departmental requirements; investigates products'
ability to meet user, functional, and technical requirements
Evaluates impact of solution alternatives and assesses risk to support decision-making
Adhere to and identify potential shortcomings related to SOX and PCI requirements and inform staff on established Company
policy
Document and share knowledge with staff and other team members
Remain abreast on industry changes and advancements in technology
40% Systems Support & Administration
Resolve technical issues while providing excellent Customer Service by effectively communicating with user during support
process
End user equipment ordering, imaging, configuration, delivery, relocation and repair
Configure corporate smartphones for email and access to vital business applications
Microsoft Teams and Office 365 support and deployments
File restoration, file and folder permission, & Active Directory management
Printer troubleshooting and Print Server administration
Assist and Manage Cisco Video Conferencing equipment, scheduling, and execution
Asset management and tracking
Provide 24/7 on-call system support and after-hours maintenance
Required Experience:
Bachelor’s Degree or 1+ years of equivalent experience in a Desktop Support or similar role
Knowledge of Acrobat, Microsoft Office, Anti-Virus, Cisco VPN, Mobile Device Management, Data Encryption
Ability to troubleshoot issues related to Java, Internet browsers, and Citrix to support web-based Enterprise applications
Familiarity with Microsoft server management tools including Active Directory, DHCP, DNS, File and Folder permissions
management and others
Understanding of a hybrid Windows 7/10 and Mac Enterprise environment
Troubleshoot and configure Distribution Center technologies: thin clients, mobile computing devices, label printers
Familiarity with Distribution Center applications: WMOS, BarTender, Sterling, Jesta, DemandWare
Strong communication skills required for face-to-face client interaction and intra-team collaboration
Must be able to travel between multiple sites within Ontario
Maintain updated knowledge of new technology
Handle multiple assignments simultaneously
Ability to troubleshoot unfamiliar and bespoke software applications
Ability to communicate and function as a thought leader in the Technology Services team
Must be able to lift 50 lbs
Primarily support the afternoon shift at Carter’s Distribution Center
Typical hours will be from 3 PM to 11 PM with some flexibility
Some travel and support to our Mississauga head office may be required"
