Title,Description
"Manager, Capital Projects Electrical - Windsor, ON - Indeed.com","Manager, Capital Projects (Electrical)
File# CHC 46 21
Salary Range $66,340 - $95,000/annum
Permanent Full Time Position
Windsor Essex CHC provides well-maintained, safe and affordable community housing in a respectful and fair manner. We are leaders in the housing sector and contribute to the development and support of strong communities in the City of Windsor and County of Essex.
The ideal candidate will be confident, professional,
optimistic, and energetic, must be customer service focused and be committed to our organization and values. The Manager, Capital Projects (Electrical) must exercise tact and diplomacy when dealing with CHC customers and represent CHC in a positive manner.
Reporting to the Senior Manager, Systems, or designate, the Capital Projects Manager (Electrical) will assist in preserving the integrity, safety, and habitability of CHC owned housing stock and the Regeneration of CHC’s Portfolio, including both new and existing stock.
The ideal candidate will be confident, professional, must be committed to our organization, our values, and can motivate others. Management experience in a large Property Management or Human Services environment or in Facility Management would be an asset.
Primary Duties and Responsibilities:
Ensure delivery of assigned contracted corporate projects on time, within budget, in accordance with specifications and within applicable regulatory, accreditation and Municipal requirements. Perform the critical tasks throughout each project's lifecycle, including the efficient delivery of project deliverables, effective quality control, clear communication of expectations to stakeholders, and upward reporting to senior management.
Prepare and review technical drawings, specifications of newly installed systems, and topographical maps, and monitor the operation of existing systems to ensure that installation and operations conform to standards and CHC requirements – systems include but not limited to Fire Alarm, Security, Building Automation, Heat Management, Solar, Elevator, Generator, Interphone, Electrical, Controls and Telecommunication Systems.
Investigate service requests, determine nature and extent of problem, recommend remedial measures, and provide oversight to ensure that all building Life Safety Systems are inspected, operational and repaired as needed within a timely manner to ensure ongoing compliance with all codes and regulations; liaise with the Fire Department, Electrical Safety Authority (ESA), and Technical Standards and Safety Authority (TSSA), as required.
Participate in the planning, organizing, implementation and review of the goals and objectives of the department in consultation with the Senior Manager, Systems.
Research and prepare public, invitational and short-form tender documentation as assigned, including specifications and drawings; review contracts and cost estimates for Projects, general conditions, and various appendices, in accordance with accepted standards and CHC policies, and applicable Code, by-law and legislative requirements.
Provide direct supervision to assigned staff and Interns; work collaboratively with administrative staff and assist with supervision of other students in the Asset Management department.
Provide consultation and technical expertise in identifying building requirements, developing an overall portfolio plan for capital improvement requirements and a strategy for the overall preservation of asset.
Liaise with other departments to assist in analyzing problems and issues related to area of expertise; provide technical advice and expertise to other departments in a resource capacity.
Develop effective relationships with other departments.
Meet corporate targets regarding service quality, cost efficiency, and responsiveness to residents, district offices and asset management staff.
Develop Project programs for new equipment and major repairs and construction.
Develop Project budgets, including estimates for labour, material, and construction costs.
Review project documents and processes to propose cost saving measures and reduce overall project costs.
Coordinate with internal stakeholders for pre-, during, and post-project activities.
As directed, assist with the management of outside consultants, contractors, building officials and others to successfully guide the project to completion.
Participate in the improvement of project management, procurement, and other processes at CHC as related to the position.
Work in preparation and maintenance of a risk register; manage risk such that it is reduced where possible.
Represent CHC at tenant, community or public meetings, as required.
Actively participate in or facilitate committees relating to risk or asset management safety, corporate legislation compliance and quality improvement.
Collect data relating to commercial and residential development, population, and power system interconnection to determine operating efficiency of electrical systems, and plan layout of electric power generating plants and distribution lines and stations by conducting field surveys; study maps, graphs, diagrams, and other data to identify and correct power system problems.
As assigned, oversee the design of project quality processes, implement processes, and ensure they are followed, and address all quality concerns and issues, and review designs and specifications ensuring they meet CHC’s standards and overall goals and objectives.
Work in organizing and conducting meetings and preparing action planning documents.
Coordinate change requests in a way that optimizes impact to scope, budget, schedule, and quality.
As directed, perform inspections, and observe operations to ensure compliance with design, installation and equipment specifications and safety standards.
Cover, on a rotational basis, “after hours” calls by remaining available on an on-call basis after normal work hours (including weekends and holidays) to address after hour’s maintenance emergencies.
Other related duties as assigned from time to time.
Minimum Requirements
:
University degree, in Electrical Engineering required.
Progressive project management and administrative experience in a large organization required.
Good knowledge of design techniques and tools, and able to read Single Line Diagrams (SLD), Schematic Wiring Diagrams (SWD), Blueprints, and layout for Instrumentation and Power Systems, and ability to interpret all building component blueprint drawings e.g., electrical, mechanical, structural drawings and specifications.
Knowledge of Circuit Boards, Processors, Chips, Electronic Equipment, and Computer Hardware and Software, including applications and programming.
A comprehensive working knowledge of contract administration and specification coordination and demonstrated ability to read, understand and apply standard documents affecting projects, including contracts, project charters, surveys, construction, and other technical documentation.
Good knowledge of Planned Maintenance and Safety Administration, Building Code and Associated by-law's, Fire Code, Health and Safety Act, WHMIS, and the Collective Agreement. Ability to communicate with architects and professional engineers.
Demonstrated knowledge of residential and high-rise building maintenance and construction procedures including safety and energy conservation items.
Strong attention to detail and problem-solving skills and demonstrated initiative that improves service or business results.
Ability to recognize special problems that could lead to or affect structure and determine appropriate solutions to a wide range of technical problems.
Excellent communication, presentation, and interpersonal skills to deal effectively with staff, political representatives, Board of Directors, consultants, contractors, residents, and the public.
Strong communication and negotiation skills to direct staff, contractors, and consultants.
Demonstrated ability in developing and maintaining positive working relationships with internal and external stakeholders at all levels.
Strong analytical and quantitative skills with proven experience in developing strategic solutions that have a direct impact on project success.
Strong organizational skills, and ability to work well under pressure and meet strict deadlines.
Proficient in Microsoft Programs, and the ability to utilize in house software.
Working knowledge of AutoCAD.
Possession of a valid Ontario Driver’s License class “G”, current valid insurance, and the use of a personal vehicle for work purposes.
Registered with Professional Engineers Ontario (PEO) as Professional Engineer (P.Eng.) or Engineer In Training (EIT) considered an asset.
PMP Certification considered an asset
CHC is an equal opportunity employer servicing our diverse communities. Although we appreciate all applications, only those selected for an interview will be contacted. The successful candidate will be required to supply a current satisfactory criminal reference check, before work can commence, if applicable. CHC has implemented a mandated COVID-19 vaccination policy whereas all employees are required to be fully vaccinated (14 days after second dose) by November 26, 2021.
Accessibility
CHC is committed to meeting it obligations under the Ontario Human Rights Code and the Accessibility for Ontarians with Disabilities Act. If you require disability related accommodation to participate in our recruitment process, please contact Human Resources. Accommodation may be provided in all steps of the recruitment process.
To apply for this position, you must use the link provided on our website at www.wechc.com (Corporate),
In the Employment Opportunities section.
Applications must be received by 11:59 p.m., Sunday December 12, 2021"
"VP Fulfillment, OMS & Integration - Toronto, ON - Indeed.com","Location
TORONTO, Ontario, Canada
Category
Technology
Job Opened
October 7th, 2021
Education
Bachelor's Degree
Job Number
2100064X
Job Type
Full-Time
Remote
No
job description
The Vice President role over Fulfillment & Order Management Technology, and Integration Services will be a highly technical leadership role within the technology organization. The leader is responsible for the evolution of a centralized order management system, all the technology that powers the fulfillment and logistics operations for TheBay.com along with related integration services.
This position will lead the strategy, innovation, architecture, engineering and maintenance of all technology systems powering successful operations of TheBay.com’s eCommerce fulfillment centers. The leader is expected to build a team of OMS, WMS and WCS engineers, software and hardware engineers, and other roles as needed to grow and optimize TheBay.com’s fulfillment and supply chain operation.
The leader will work closely with the SVP, Supply Chain & Logistics and Supply Chain to design effective technology solutions for all distribution centers, as well as fulfillment and delivery optimization solutions. In addition, this position will work closely with the technology leads in our 3rd party carrier delivery network.
The responsibilities over integration services include supporting the current services while developing a target state that simplifies the overall architecture, increases fault tolerance and stability, and moves the organization to a more modern API based integration architecture.
Key Responsibilities
Oversee build out of the teams, including developing hiring, training, retention and employee engagement plans
Implement operating models and team structures to support agile delivery methods, speeding time to delivery while increasing quality of deliverables
Partner with other technology leaders to enable fast, efficient delivery of large and small projects
Develop a technology roadmap that aligns to overall business objectives and roadmap,while yielding a more stable and simplified omni channel architecture
Develop execution plans on how to deliver on the technology roadmap over a period of 2 - 3 years to enable 50% year over year digital channel growth.
Develop maintenance, backup and recovery plans for all technology in the distribution centers. Oversee implementation of technology and processes necessary to ensure continuity during any failures.
Develop integration architecture and strategy for simplifying the system environment. Oversee migration to API based architecture.
Manage software vendors, licenses, contracts applicable for assigned portfolios, ensuring adherence to SLAs and budget
Coach, mentor and develop leaders on the team to enable a world class, high performing engineering team
Skills and Requirements
Bachelor’s degree in computer science, mathematics, engineering, or related area. Masters is preferred.
15 + years of professional experience, including systems design and analysis, application development, project management, and managing teams.
Demonstrated senior leadership and decision making with leading agile based teams in a high dynamic environment with the need to both enhance existing systems while migrating platforms to a new target state.
Results driven personality with a successful track record planning, executing and achieving strategic growth objectives.
Strong knowledge of Omni Channel Order Management in a retail setting, integration techniques and technology to include: Order Management Systems such as IBM Sterling or Manhattan, integration and streaming technologies such as Kafka, Akka, queuing technology and API development best practices.
Experience with integrated automated fulfillment systems such as Perfect Pick, Autostore, Locus, Swisslog or Kiva and dynamic last mile delivery networks in large scale, multi-site fulfillment operations.
Proven ability to identify, analyze, and solve ambiguous problems with extreme attention to detail
The desire and ability to work collaboratively and virtually with staff members across teams
Strong leadership skills, with an ability to lead a cross-functional group in a unified direction as well as an ability to influence and move top business leadership and executives.
Demonstrated ability to successfully influence stakeholders at all levels
Your Life and Career at HBC:
Be part of a world-class team; work with an adventurous spirit; think and act like an owner- operator!
Exposure to rewarding career advancement opportunities, from retail to supply chain, to digital or corporate.
A culture that promotes a healthy, fulfilling work/life balance.
Benefits package for all eligible full-time employees (including medical, vision and dental).
An amazing employee discount!
Thank you for your interest with HBC. We look forward to reviewing your application.
HBC provides equal employment opportunities (EEO) to all employees and applicants for employment without regard to race, color, religion, sex, national origin, age, disability, or genetics. In addition to federal law requirements, HBC complies with applicable state and local laws governing non-discrimination in employment in every location in which the company has facilities. This policy applies to all terms and conditions of employment, including recruiting, hiring, placement, promotion, termination, layoff, recall, transfer, leaves of absence, compensation, and training.
HBC welcomes all applicants for this position. Should you be individually selected to participate in an assessment or selection process, accommodations are available upon request in relation to the materials or processes to be used."
"IT Technician - Senior Tier 3 - Richmond, BC - Indeed.com","Salary: $60,000.00/Annually
Job Type: Full Time, Permanent
Start Date: As soon as possible
Language: English
Minimum Education: Bachelor's Degree
Positions Available: 1
NOC Group: Computer Network Technicians (2281)
NOC Job Title: Computer Network Technician
Expires in 118 days
Expires: 2022-04-02
Posted: 2021-12-03
Last Updated: 2021-12-03
Job Location(s)
Richmond, British Columbia
Job Description
We are seeking an enthusiastic Level 3 Technical support Engineer to work in our NOC located in Richmond BC.
The Tier 3 Technicians are the upper level of the escalation path for our Tier 1 and 2 support, as well as key resources for internal and external projects. to a growing and changing environment. This is a full-time position, weekdays from 8:30 am to 5:00 pm.
What Innovation Networks is Looking For?
Strong oral and written communication skills
The ability to deal with all levels of management
Strong leadership skills to be able to assist the Service Manager in leading the team members
Skill and Attributes Qualifications
The qualified candidate must have:
MUST have a working reliable vehicle and valid BC driver's license
Minimum 3-5
years of experience in IT Service and Support industry
Advanced troubleshooting ability and analysis
Ability to take a technical lead with projects if required
Completion of multiple professionally recognized certifications (A+, Network+, Security, Microsoft, Cisco)
Strong knowledge of MS Office applications; Office 365 support experience
Extensive Microsoft environment knowledge that includes Windows Servers, licensing, AD, & DHCP
3rd party cloud services / knowledge
RMM tools and resources
Key Responsibilities:
Handling ticket escalations from Tier 1 and other technicians, through to resolution
Completing root cause tickets to find permanent and effective solutions, while recommending infrastructure improvements
Moving clients onto a cloud-based system such as Azure
Providing server infrastructure: build networks, set up of DNS, DHCP, domain hosting, and visualization software (Hyper V and VMWare)
Project work and lead with them
Communicating ticket status and updates directly to clients
Proactively assisting with training of existing and new staff on Tier 1 and Tier 2 and on solutions to escalated tickets to mentor the teams and reduce escalations over time
Tracking time and submitting time sheets for work completed
A willingness to work flexible hours when required to meet client deadlines, with most work being within regular office hours 0830am to 5pm PST
Visit client sites when required, to discover issue solutions or complete issue resolution
Consistently display superior customer service skills and telephone etiquette
Quickly assess and troubleshoot complex problems and devise effective solutions
Perform work in a high-pressure team environment
Incident management (logging incidents, managing workload, documenting support issues)
Active Directory user management (user accounts, security groups, distribution lists, passwords)
Asset management (inventory, repairs, configuring new machines)
Troubleshooting and maintenance of IT hardware (iOS devices and Windows)
Audio visual support (projectors, video conferencing, Skype for Business)
Additional Skills or Assets
Experience with Cisco IOS, Cisco Meraki, or Cisco Meraki certified
Experience with VDI, virtualization technologies, and cloud hosting
Experience with SolarWinds RMM tools (Nable)
Experience in Citrix environments is advantageous
Understanding of DNS, especially as related to web and mail service
Required Languages:
Fluent in English, both spoken and written, additional language is an asset.
We are only reviewing applicants that currently live in the Lower Mainland area and are legally entitled to work in Canada.
How to Apply
Expiring: Apr 02, 2022"
"AWS Application Security Engineer - Toronto, ON - Indeed.com","BS in Computer Science or related field, or equivalent work experience.
Minimum of 2 years of experience with any combination of the following: threat modeling experience, secure coding, identity management and authentication, software development, cryptography, system administration and network security.
Minimum of 2 years of experience with security engineering, system and network security, authentication and security protocols, cryptography, or application security.
Help us protect not only the Amazon Web Services (AWS) cloud computing environment but all of our customers as well! Since 2006, our great team at AWS has been enabling our customers to bring great ideas to life in ways that aren’t possible in traditional IT environments. With AWS you can flexibly harness compute, storage, security, and other services from across the globe as your business demands them.
AWS Security is on the cutting edge of many security issues for a wide variety of platforms and technologies including cloud services, Internet of things (IoT), identity and access management, mobile devices, virtualization and custom hardware, all operating at massive scale. Similarly, our highly collaborative team is committed to each team member’s growth as our business grows.
AWS Security is looking for an Application Security Engineer to help validate that our services, applications, and websites are designed and implemented to the highest security standards. You will be responsible for analyzing the security of applications and services, discovering and addressing security issues, building security automation, and quickly reacting to new threat scenarios. You will have the opportunity to learn from, and be mentored by, those who are building and securing our cutting-edge services.
You are expected to be strong in multiple domains and provide significant contributions to the AWS IT Security team and to multiple groups throughout Amazon. You are expected to develop elegant solutions to complex business problems and apply appropriate technologies while following security engineering best practices. You are also expected to mentor more junior engineers and be a security thought leader for the organization.
You will foster constructive dialogue and seek resolution when confronted with discordant views. Engineers in this role are expected to participate fully in the planning of the AWS IT Security team's work and constantly seek opportunities for process improvement. You should also have a deep understanding of at least one specialty for which they are a sought out resource (both within AWS Security and by groups throughout Amazon), while having an understanding of the application of information security in a broad range of technical areas.
You will need a combination of troubleshooting, technical, and communication skills, as well as the ability to handle a mix of disparate tasks which may include project and software development work. This role will provide career growth opportunities as you gain new security skills in the course of your duties.
Responsibilities:
Application security reviews
Mobile security reviews
Secure architecture design
Threat modeling
Projects and research work as needed
Security training and outreach to internal development teams
Security guidance documentation
Security tool development
Security metrics delivery and improvements
Assistance with recruiting activities and administrative work
Our team also puts a high value on work-life balance. Striking a healthy balance between your personal and professional life is crucial to your happiness and success here, which is why we aren’t focused on how many hours you spend at work or online. Instead, we’re happy to offer a flexible schedule so you can have a more productive and well-balanced life—both in and outside of work.
Our team is dedicated to supporting new members. We have a broad mix of experience levels and tenures, and we’re building an environment that celebrates knowledge sharing and mentorship. We care about your career growth and strive to assign projects based on what will help each team member develop into a better-rounded engineer and enable them to take on more complex tasks in the future.
Here at AWS, we embrace our differences. We are committed to furthering our culture of inclusion. We have ten employee-led affinity groups, reaching 40,000 employees in over 190 chapters globally. We have innovative benefit offerings, and we host annual and ongoing learning experiences, including our Conversations on Race and Ethnicity (CORE) and AmazeCon (gender diversity) conferences. Amazon’s culture of inclusion is reinforced within our 14 Leadership Principles, which remind team members to seek diverse perspectives, learn and be curious, and earn trust.
Meets/exceeds Amazon’s leadership principles requirements for this role
Meets/exceeds Amazon’s functional/technical depth and complexity for this role
Experience implementing security solutions at the business division level
An understanding of network and web related protocols (such as, TCP/IP, UDP, IPSEC, HTTP, HTTPS, routing protocols)
An understanding of web services
Experience with multiple programming languages (such as, Java, C++, Ruby, Python, Perl, etc.)
Excellent written and verbal communication skills
Demonstrable teamwork skills and resourcefulness
Possess self-drive to keep moving things forward even in the face of ambiguity and imperfect knowledge (avoid “analysis paralysis”)
Strong sense of ownership, urgency, and drive
Sharp analytical abilities and proven design skills
Amazon is committed to a diverse and inclusive workplace. Amazon is an equal opportunity employer and does not discriminate on the basis of race, national origin, gender, gender identity, sexual orientation, disability, age, or other legally protected status. If you would like to request an accommodation, please notify your Recruiter.
#AppSec"
