Title,Description
"Marketing Manager, Front-Line Care - Acute - Mississauga, ON - Indeed.com","Marketing Manager, Front-Line Care - Acute
-
21125267
Hillrom is a $3.0B (US) leading worldwide manufacturer and provider of medical technologies and related services for the health care industry, including patient support systems, safe mobility and handling solutions, non-invasive therapeutic products for a variety of acute and chronic medical conditions, medical equipment rentals, surgical products and information technology solutions. Hillrom's comprehensive product and service offerings are used by health care providers across the health care continuum and around the world in hospitals, extended care facilities and home care settings to enhance the safety and quality of patient care.
Description
JOB SUMMARY
Hillrom Canada is seeking a Marketing Manager for our Front-Line Care, Acute Care business, who will be accountable for all associated downstream marketing activities in Canada. Reporting to the Canadian Head of Marketing, the Marketing Manager will be responsible for developing regional Go-To-Market strategies and implementing strategic and tactical plans designed to capitalize on market opportunities and generate demand.
The Front-Line Care portfolio includes patient vital signs monitors and respiratory products. The Marketing Manager will also be responsible for the life cycle management of the portfolio, including forecasting; developing and managing the annual operating plan and marketing budget for planning and performance management, determining the optimum pricing strategy, developing and implementing differentiated value propositions to drive product adoption, utilization and customer loyalty, identifying key opinion leaders within industry that influence the market, developing and implementing a KOL engagement strategy, managing and executing product line maintenance activities, measuring and driving performance metrics such as market share, market image and conversion rate, launching new products/services or existing products in new geographies in a timely and effective manner, market insights – gathering, analyzing and interpreting information about the market, product and competitive environment, and developing co-marketing programs and initiatives with specific partners.
ESSENTIAL DUTIES AND RESPONSIBILITIES:
– Other duties may be assigned:
Develop annual Marketing strategy and execute selected tactics to drive financial growth for this suite of product solutions
Develop launch plans and execute Go-To-Market strategy with programs and campaigns
Serve as the subject matter expert on product features and benefits, market trends, voice of customer, competitive landscape, and in collaboration with global colleagues, the product development roadmap, while being the Canadian advocate at that table
Create and introduce innovative content including sales tools, digital marketing assets, and customer-facing content aimed to drive demand generation, funnel acceleration, and product and brand awareness
Lead, coordinate, and organize company presence at regional, national, and international customer events and conferences, as well as support sales team in various customer interactions including site visits, participation in presentations, demonstrations, and tradeshows
Develop customer relationships to create reference sites, testimonials and case studies for the assigned product line(s)
Qualifications
QUALIFICATIONS
Bachelor’s degree in Business, Healthcare, Life Science, &/or the equivalent is required. An MBA is an asset.
At least five years Marketing experience in Medical Devices
Sales and/or clinical experience in these areas are assets
Experience in quantitative and analytical problem-solving skills
Strong written, verbal, and presentation communications skills with the ability to communicate confidently with customers and multiple external and internal stakeholders
Demonstrated planning, organizational and project management skills
Ability to balance and lead multiple, competing priorities and projects
Excellent computer skills including, but not limited to Microsoft Office Suite and SalesForce.com
Ability to travel up to 25% of the time, including domestic and international
Comfort with ambiguity and entrepreneurial spirit
Written and verbal fluency in French is also an asset
Job
:
Marketing
Primary Location
:
Canada-Ontario-Mississauga
Schedule
:
Full-time
Travel
:
Yes, 25 % of the Time
Posting Entity
:
Hillrom"
Content Manager - Youtube - Remote - Indeed.com,"Location: Montreal, Full Time, Entry to Mid-Level Experience
Who we are:
Valnet Inc. is a digital media company that specializes in content distribution. Valnet has rapidly grown to become a leader and global trendsetter in content creation and distribution.
A place of cutting edge innovation and fierce digital content experts, Valnet is taking editorial and video publishing to the next level. Our overarching vision and mission statement: distribute editorial and video content to millions of viewers daily across our websites, YouTube Channels, and Social Media platforms
.
The position:
Valnet’s major entertainment brands, CBR and Screen Rant, are looking for a talented Content Manager to oversee popular entertainment content (comics, movies, TV, gaming, anime) for their YouTube Channels. We are looking for candidates dedicated to generating the highest audience engagement for the channels, and who are committed to working alongside a team of motivated and passionate creators.
The day-to-day:
Team Management
Manage and motivate a team of remote creators
Act as point of contact for creator queries about scheduling, compensation, performance, internal development
Implement processes that ensure efficiency, stability, and website authority
Oversee quarterly mandates and daily output goals in different categories
Liaise with key internal parties (HR, Training, I.T, business analysts) for different projects (e.g. training initiatives, SEO trends)
Actively participate in talent acquisition and talent management efforts in tandem with Screen Rant and CBR’s dedicated HR team to ensure the team maintains a motivated and passionate roster of creative talent
Content Creation
Update and maintain brand style guidelines
Stay updated on current trending topics in pop culture, specifically in comics, movies, television, anime and gaming
Use analytics/internal dashboards to gain insights on top performing content, share findings with team
Evaluate video performance, and that of competitors, to identify areas of opportunity and improvement
Consult on optimizing the channel’s content strategies from a data first viewpoint
Knowledge of producing (live-action preferred) series, film, etc.
Requirements
A Bachelor’s degree in journalism, communications, film, media, marketing or another related field
Minimum 2 years experience in content creation (equivalent experience in a managing editorial position may also be considered)
Strong knowledge of major movie, comics, and anime franchises
Excellent analytical skills, leadership qualities, and good judgement
Excellent written and oral English communication skills
Sharp attention to detail and solid problem-solving skills
Strong understanding of content production
Assets
Familiarity with SEO best practices, Google Analytics, and traffic driving strategies in general
Basic Adobe Photoshop/image editing skills
Experience using WordPress, Asana, and Slack, and GSuite
Experience with Adobe Premiere Pro, After Effects, DaVinci Resolve.
You may also know this role as: Publications Manager, Content Marketing Manager, Content Specialist, Content Coordinator, Publications Specialist, Publications Coordinator, Content Lead, Digital Content Specialist, Digital Content Coordinator, Digital Content Manager, Web Content Manager, Web Content Coordinator.
t9xmpXzSJw"
"Digital Marketing Specialist - Vancouver, BC - Indeed.com","We're building our bench of folks who are interested in what we're creating at Neon and who are aligned with our values. Although we're not actively hiring for this role, it doesn’t mean we don’t want to connect, in fact, if you’re interested in speaking with us, we’d love for you to apply for when things start to pick up again.
We believe the world needs a redesign.
Our vision is to build a better world through purpose-driven products. This vision rallies us, guides us, and informs every part of the process – from an idea scribbled on a napkin to shipping a product.
Ultimately, we take pride in partnering with exceptional people to create products that matter. People, planet, and profits should thrive and grow together. This is how we do business.
Based in Vancouver, Canada, Neon is growing and we’re always looking for amazing people to join our team. If you’re ready to do the best work of your career, we’d love to meet you.
Digital Marketing Specialist
Vancouver, BC, Canada
As our Digital Marketing Specialist, reporting to and working closely with our Director of Growth & Insights, you'll be responsible for planning, building and maintaining campaigns that increase partner visibility and revenue. You'll oversee campaign setup, optimizing content for social through content calendars, websites and microsites. With expertise in SEO and digital marketing, you will be responsible for conceptualizing and creating content marketing campaigns that strengthen the presence of our partners.
Our non-negotiables
You leave your ego at the door and judge ideas based on their merit
You have a deep sense of curiosity; eager to learn about our partners and their businesses
You care deeply about building products that matter
What you bring
You have a successful track record of creating B2B and B2C digital marketing campaigns
You have worked in a fast-paced digital agency environment
You are creative; you know digital campaigns are equal parts data analytics and creative design
You have an eye, ear, and nose for detail; your data-driven approach helps set you and your partners up for success
You are on top of the latest marketing tools, trends and applications
You are comfortable navigating Google Analytics, Search Console, Facebook Business Manager, Linkedin and Google Ads platforms
You enjoy testing new ideas, analyzing results, and experimenting with changes to find success
We’re big believers in empowering our team to do their best work by offering:
Competitive salary and benefits plan
Health Care Spending Account
Wellness program
RRSP matching
Beautiful new offices in downtown Vancouver, featuring bright, open-plan workspaces
Partnerships with interesting and engaging partners who align with our values
Fun and collaborative work environment with a focus on growth
Collectively, we are committed to cultivating and preserving an environment of inclusion and connectedness. Our team’s strength is in the sum of our diversity of thought, self-expression, innovation, life experiences, knowledge, and talent.
In hiring our team at Neon, we welcome the unique contributions that candidates can bring in terms of education, opinions, ethnicity, race, sex, gender identity and expression, nation of origin, age, languages spoken, veteran’s status, colour, religion, disability, sexual orientation and beliefs. We value the perspectives and leadership of people who have been historically and systemically marginalized. Neon is an equal opportunity employer, and we particularly encourage applications from individuals from diverse backgrounds to apply for this role. If you require special accommodations at any stage of the recruitment process, please indicate this in your cover letter."
"Digital Marketing Specialist - Kamloops, BC - Indeed.com","ABOUT THE ROLE
We’re looking for a Digital Marketing Specialist to join Digital Convergence! In this role, you’ll get the chance to work closely with both internal and external stakeholders.
You’ll work with external clients, primarily SMBs to help drive their business growth through strategic marketing initiatives and activities. You’ll be responsible for copywriting, managing social media accounts and launching Ad campaigns. At the same time, you’ll work with the internal operations team to refine Digital Convergence’s sales and marketing strategy and activities.
If you’re passionate about helping businesses accelerate their growth through strategic marketing initiatives and pursuing a career in digital marketing, we would love to hear from you! This position is open to local and/or remote work-from-home in Canada.
ROLE SPECIFICS
RESPONSIBILITIES
Write, edit and publish original and creative content including, but not limited to website content, blogs, case studies, social media posts, newsletters, emails, infographics, posters, presentations, etc.
Develop, execute and manage Google, Facebook and Omni-Channel Ad campaigns.
Create and manage social media content across multiple platforms (LinkedIn, Twitter, Instagram, etc).
Leverage the use of marketing tools such as Google Analytics, Adwords, SemRush to monitor and track performance.
Analyze performance trends to design, drive and streamline Marketing Qualified Leads (MQLs) and Sales Qualified Leads (SQLs).
Establish effective relationships with potential and existing clients by attending and participating in stakeholder meetings.
Work with clients to establish or refine their marketing content, objectives, and strategy.
Conduct industry research to better inform new sales strategy, marketing strategy and activities to generate leads, brand awareness and to drive business growth.
Provide ad-hoc sales and marketing support as needed.
Other tasks and duties as assigned.
REQUIREMENTS
What you need to be successful in the role:
Post-secondary diploma or degree in Marketing, Communications, English or related field.
Minimum of 2 years of marketing experience in a similar role, preferably at a high-growth tech or digital consulting company.
Experience with developing, executing and managing Google Ad and Omni-Channel campaigns.
Experience with using marketing tools such as Google Analytics, Adwords, SEMrush.
Experience with Social Ads management (e.g. Facebook Business Manager, LinkedIn).
An analytical mindset with the ability to design, drive and streamline Marketing Qualified Leads (MQLs) and Sales Qualified Leads (SQLs).
Strong copywriting skills with the ability to convey meaningful content to generate leads and brand awareness.
Excellent written and verbal communication skills in the English language.
Strong interpersonal skills with the ability to build trust and relationships with both external and internal stakeholders.
Working knowledge of User Experience and Design.
Nice-to-have:
Google Adwords, Analytics or SemRush certifications.
HubSpot Certifications or experience using HubSpot
Experience with design software (Adobe products, Figma, Sketch)
Bilingual (French and English), with French not required, but an asset
Contractor or consulting experience
APPLY IF YOU:
Enjoy working in a face-pace, growth-focused business.
Use a consultative approach at each interaction with clients and stakeholders.
Are a results-driven individual who uses data to inform and adapt tactics for desired outcomes.
Are a self-starter who has a proven track record of delivery, especially with small-medium businesses.
ABOUT DIGITAL CONVERGENCE
Digital Convergence believes in challenging the status quo, thinking differently, and using a no-nonsense approach to reimagining business capabilities with technology.
Headquartered in Kamloops, British Columbia, Digital Convergence is a boutique digital consultancy with our team spanning coast to coast across Canada. We work with small-medium businesses to help adopt and leverage big business capabilities. This is done through establishing and executing forward-thinking digital strategies with proven tactics that create meaningful experiences for customers and employees.
We are 100% remote with team members located across Canada. Visit us @ https://digitalconvergence.ca/.
WHY JOIN DIGITAL CONVERGENCE
Competitive compensation package and salaries
Comprehensive benefits plan with an added bonus of a sizable Health Spending Accounts
100% Remote Workforce with Flextime Policy
Access to the latest technology and tools, including a brand new MacBook Pro
To be a part of a growing team that believes in holding each other accountable for our success.
Ongoing available Professional Development and additional training opportunities
Company and team events (e.g. Monthly Lunch 'N Learns)
Open and Honest Communication – No Bullshit!
-
Thank you for your interest in a career with Digital Convergence. Please note that only those selected for an interview will be contacted.
Digital Convergence is an equal opportunity employer and committed to diversity and inclusion.
We encourage applications from all qualified candidates and accommodations are available upon request through the recruitment process."
"Digital Marketing Coordinator - Toronto, ON - Indeed.com","About PheedLoop:
PheedLoop is dedicated to developing critical systems for the events industry. From virtual event technology critical during these times and solutions to automate, simplify and monetize events, to new hardware products such as self-check-in systems and smart badges, we're always building awesome tech. Located in Toronto, PheedLoop is one of Canada's fastest-growing event technology companies.
We're obsessed with listening to customer feedback, because we're able to build extremely creative solutions at light speed as soon as we hear good ideas. We love working hard, learning new things, building great products, and closing deals. If you're looking for an experience that will test your limits, accelerate your career, and allow you to dream big, we'd love to work with you and change an industry forever.
We're on a very exciting growth trajectory right now with events going hybrid, and we're looking for someone who wants to take great ownership over marketing at PheedLoop. We're a highly collaborative, extremely hard working, and fun loving team. We're really looking for someone who will be a great cultural fit at PheedLoop, with ambitions to grow with us for the next few years.
Requirements:
1+ years of growth marketing experience in the tech industry
Experience with Google tools (Analytics, AdWords, Optimizer, Keyword Planner, etc.)
Experience with Webflow or equivalent website building tools
Collection of published written content (e.g. blog posts, personal website)
Experience with marketing automation tools (e.g. HubSpot, Zapier)
Knowledge of of SEO and SEM, and experience with tools (e.g. SEMRush, Ubersuggest)
Nice to Haves:
Graphic design experience (Adobe Suite, Canva)
Basic web coding experience (HTML, JS, CSS)
Passion for, and detailed knowledge of the events industry
Workplace Benefits:
Employee health care plan, 100% coverage fully paid by PheedLoop
Accessible office, right on the subway line
Awesome workplace - snacks, team outings (from retreats to go-karting and beyond), books, learning opportunities, open workspace
Who We're Looking For:
We are looking for people to join our team who are ambitious, hard workers, thrive in environments where they are required to solve problems, and love to have fun. We want to work with people who feel they have a lot more potential within themselves to unlock, because we want to be a part of their journey and help them reach their goals. Your work, just like everyone else's at PheedLoop, will make a massive difference - we can guarantee it. Know that you are likely to find your teammates at PheedLoop to be the hardest working group of people you’ll ever meet. If you feel you have a strong work ethic and career ambitions, you will thrive. If you’re just looking for a job, PheedLoop is almost certainly not going to be the right cultural fit.
This is a full-time role in-person at our Toronto office located on the Yonge-University subway line."
"Digital Marketing Manager - Markham, ON - Indeed.com","JOB DESCRIPTION
POSITION DESCRIPTION
:
The Digital Marketing Manager will interact with cross border & cross functional teams (CFTs)/internal and external stakeholders to also develop customer facing marketing initiatives against predefined key performance indicators (KPI). He/she will provide analytics and insights for improving the performance of digital programs to maximize sales, grow profitability and ensure budgets are optimized.
KEY DUTIES AND RESPONSIBILITIES:
Act as a mentor/ coach and lead to 2 Marketing associates
Create end-to-end processes to support an expansive audience strategy within and across channels that is rooted in performance and business objectives
Support in driving maximum revenue across core digital marketing channels
Lead diversification efforts by expanding and growing existing customers and acquiring new customers
Executing with Excellence on the Supplier Partner Program
Social Media Support and Execution
EXPERIENCE/QUALIFICATIONS:
Bachelor’s degree in Business /Commerce or equivalent
7+ years’ experience in digital marketing and eCommerce
Experience in multi-channel B2B sales-oriented environment
8 years of leadership experience
Ability to manage projects and multiple priorities,
Successful development and execution of comprehensive, innovative and successful digital campaigns.
Experience with Adobe Suite – Audience Manager, Target, DTM, Campaign, Analytics and Media Optimizer
Experience with DV360
Solid experience managing 3rd party email service providers
Strong knowledge of various marketing automation software platforms and technologies
Strong knowledge of various campaign tracking and data management tools
Strong knowledge of customer service management tools
Grainger strives to be an employer of choice, to attract and retain top diverse talent, and to provide a safe and positive work environment for all of its team members. As part of Grainger hiring process, pre-employment background checks will be required for all external candidates. Internal candidates will be required to undergo a pre-employment background check when they move from a non-driving role to a driving role and/or a director role and above position.
In accordance with Performance Excellence guidelines, team members are encouraged to apply for positions closely matching their experience/background and that are aligned with their Individual Development Plan. Grainger is committed to the principles and practices of employment equity. We invite all qualified women and men, including persons with disabilities, visible minorities, and Aboriginal Peoples to apply for our career opportunities. Accommodations are available on request for all persons with disabilities taking part in the selection process."
"Junior Digital Marketing Assistant - Vancouver, BC - Indeed.com","Looking for an energetic individual to work within our small but dynamic team of balloon artists/professionals. Candidate will be report to the Director Business Development and will be involved in advising, updating and ensuring all social media sites used by the business are regularly updated and maintained, help, implement existing/new Marketing strategies, and must be able to creatively assist with web site enhancements and daily maintenance and updating of content on various platforms and must be adaptable and intuitive as you will have to learn to be a balloon artistry as it is a necessary and critical daily function (we can and will teach the successful candidate).
Being able to think quickly and have some excellent insights into the digital world that we all live in today and some vision of marketing strategies and being able to take business owners thoughts and concepts and put them into real world strategy is essential.
Strong written and interpersonal skills as well as managing your own time as needed, as well as being able to communicate with the rest of the team is critical.
The candidate will be expected to have good information technology skills to handle tasks on a computer, be proficient at managing, creating and nurturing social media and web sites (not just a user of social media or a shopper on web sites).
Should be able to work 2 - 3 days per week.
Responsibilities and Duties
Being a critical team member is a small, dynamic team of individuals who maintain a store front on a busy and vibrant street you will need to have some real world digital services and marketing savvy and web site management .
Qualifications and Skills
Must have the ability to speak/write English, Cantonese and or Mandarin fluently , hands on experience in the customer service/retail industry is a bonus. We currently are using Shopify platform so any experience with this platform is a beneficial. We also have accounts on Tik Tok, WeChat and Little Red Book so any actual experience on these social media sites as an administrator or a creator is useful to us as well.
This is Junior entry level position that will allow the individual to be able to grow into a position that will help better define the business over a longer period of time.
To know more about what we do at Balloon Atics Designs Inc. please go to our web site and look around to see if this is the kind of work experience you would like to be involved in
www.balloonaticsdesigns.com and or go to our instagram account @vancouverballoons
Part-time hours: 15 - 20 per week
Expected start date: 2023-01-04
Job Types: Part-time, Casual
Salary: $17.00-$19.00 per hour
Benefits:
Casual dress
Schedule:
Monday to Friday
Language:
English, Cantonese and/or Mandarin (preferred)
Work remotely:
No"
