Title,Description
Implementation Specialist - Remote - Indeed.com,"Implementation Specialist
CityView - Victoria, BC
CityView has an exciting opportunity for an Implementation Specialist within our Professional Services department. In your role as Implementation Specialist you will be a primary agent of change, taking customers from paper-based and legacy systems into our modern CityView software and providing them with the means to serve their communities and help them grow.
CityView solves real-world business problems that local governments face in serving their constituents expeditiously. It does this by streamlining the complex business processes of permit, license and land management applications and approvals by providing constituents with online self-service and government employees with software that creates efficiencies of workflow management. We seek individuals with long-term career goals, because we believe in sustaining our growth and profitability long-term. We also seek people who are not afraid of change and who can endure the brisk pace set by our rate of growth and evolution. Reporting to the Director of Professional Services the successful Business Analyst will work closely with customers to collect business requirements, configure the software and deliver training for our CityView product.
WHAT WILL BE YOUR NEW ROLE?
Define and analyze client business requirements; interpret and apply the information within the scope of the project.
Configure the software using workflow and business rules to allow clients to conduct their business processes.
Work with Data Conversion Specialist to achieve a smooth transition of legacy data.
Train the end-users in how to use the software in both remote and classroom-led sessions.
Be an expert on the functionality and capabilities of the software, making enhancement requests to our product development team when appropriate.
Provide outstanding customer service and resolve client issues throughout the implementation process.
Work with cross-functional team members including Project Managers, Data Conversion Specialists, Quality Assurance, Technical Support Analysts and other Implementation Specialists.
WHAT WE ARE LOOKING FOR?
3+ years of technical experience and software training experience is preferred.
Post-secondary education in a technology-related discipline or equivalent work experience.
Outstanding oral and written skills, as well as telephone manner.
Ability to travel up to 30-40% throughout North America, with some weekend travel, once travel restrictions are lifted.
WHAT WOULD MAKE YOU STAND OUT
Experience with local government
An understanding of database (installed and web-based) applications.
Experience with MS SQL Reporting Services (or equivalent)
WHAT WE OFFER?
o Compensation will consist of base salary, group performance incentive, and annual bonus
o RRSP matching program and employee stock options
o Health Insurance from day 1 (medical, dental, vision, life, short and long-term disability, AD&D)
o 3 weeks’ vacation
BUSINESS OVERVIEW
At CityView ( http://www.municipalsoftware.com ) the work is not mundane, the learning never stops and you will be provided with both personal and professional growth, travel, and a chance to learn about yourself and what you are capable of. In exchange for consistent performance, you will have the benefit of working largely autonomously and with reasonable flexibility to accommodate personal demands into your work life. You get to live in beautiful Victoria, which is a dream destination for many. The office is in a setting surrounded by green space and is a convenient commute with parking always available and reasonably priced. This is an opportunity to begin a long-term vocation with career prospects that go beyond CityView to Harris Computer Systems and further to the ultimate parent, Constellation Software. Constellation Software is publicly traded, owning over 400 vertical market software companies across the globe and is the largest software company in Canada. Seize the opportunity!
Reference ID: R0013718
Job Type: Full-time
Schedule:
Monday to Friday
Experience:
software implementation: 3 years (preferred)
SQL Server: 3 years (preferred)
Willingness to travel:
25% (preferred)
Work remotely:
Yes"
"Senior Systems Specialist, IMITS - Burnaby, BC - Indeed.com","As per the current Public Health Order, full vaccination against COVID-19 is a condition of employment with PHSA as of October 26, 2021.
Reporting to the Corporate Manager, Technology Support, the Senior Systems Specialist is responsible for the day-to-day management and administration of the Provincial Health Services Authority’s (PHSA) enterprise server infrastructure and related systems. This includes all file, print, application, web, messaging and database systems, as well as core infrastructure applications and functions such as storage, anti-virus and Active Directory. The Senior Systems Specialist provides second and third level support for Client and Application Support Teams, related to hardware and operating systems. In addition to developing specialized solutions to meet the organization’s server infrastructure and communication requirements, the Senior Systems Specialist is responsible for the coordination, control, testing, maintenance and support of infrastructure systems to achieve the highest level of server and system and availability throughout the PHSA.
Scope and Complexity
The Senior Systems Specialist provides health authority-wide support for designated hardware infrastructure and operating systems across all PHSA agencies. The Senior Systems Analyst provides direct hands-on support for all aspects of the PHSA’s server and operating system infrastructure, including second level and after-hours technical support, and training and orientation for Information Management/Information Technology (IM/IT) technical staff members related to the PHSA technical environment. Providing technical advice and receiving feedback from users of support systems, desktop images and technical standards, the Senior Systems Specialist may also assign tasks to designated staff in conjunction with the Technical Lead to maintain a 7*24 operating environment. Participates in maintaining and testing disaster recovery plans across PHSA.
The Senior Systems Specialist provides complex and varied functions in an environment that requires a high level of specialized technical skills to fulfill responsibilities for the most efficient and effective use of the designated service. The Senior Systems Specialist is responsible for ensuring that all server infrastructure systems are maintained by the highest levels of service availability and performance. Decision-making involves complex and diverse issues. Innovative solutions are required to position the organization to receive full benefit from this service and provide integrated solutions to support a patient centric care environment.
Communications
The Senior Systems Specialist communicates with staff at all levels throughout the health authority to ensure problem resolution and customer satisfaction. Internal contacts primarily include technical team members providing specialized technical support, information and knowledge to define, clarify and provide suggestions on sustaining and improving the PHSA server infrastructure. The Senior Systems Specialist serves on a variety of authority-wide, health service delivery area and departmental committees, task groups, internal working teams and corporate projects.
External communication includes contact with external peer groups and vendor partners to obtain technical advice and support to maintain PHSA business relationships and purchase equipment, services and resources.
What you'll do
Provides specialized technical troubleshooting and support in all aspects of server infrastructure and operating systems including file and print, web, database, messaging, anti-virus, storage environments. Implements solutions that promote the integration of technologies based on industry standards, and are compatible with PHSA’s network environment.
Coordinates and implements system upgrades and system tuning to ensure maximum performance, security and stability of servers, including capacity planning (storage, processor, memory, bandwidth, etc) for current and anticipated loads in response to policy, client requirements or technology related to server systems.
Develops technical support procedures, for such areas as hardware/software installation and testing, and ensures system documentation is developed and maintained, including backup schedules and disaster recovery planning. Develops and communicates plans for planned downtime. Provides after hour support related to server hardware and applications.
Provides technical consulting related to the acquisition of new systems and standards or the implementation of new applications on existing systems. Prepares technical whitepapers and develops business cases that assist decision making processes. Installs, configures, tests and maintains hardware and software in support of approved projects.
Provides staff training and orientation, and develops supporting instructional material.
Maintains an awareness of current information system trends and issues through literature review, contact with peers at other organizations and attendance at seminars, workshops and educational programs.
Performs other related duties as assigned.
What you bring
A level of education, training and experience equivalent to a Bachelor of Science Degree in Computer Science or related field, plus five (5) years recent related experience in an information systems technical environment. Proven hands-on specialized project experience with UNIX, VMS or Microsoft’s infrastructure tools and technologies including HP-UX, Solaris, Windows NT/2000/2003 operating systems.
Expert knowledge and understanding of core Microsoft technologies and strategies, including technology design, implementation equipment and support functions related to Exchange, SMS, Visual Basic, IIS, Active Directory, SQL Server, DNS, VPNs and general networking. Strong enterprise-level experience in the systems administration and implementation in a large-scale environment, including backup and recovery methods. Excellent interpersonal, oral and written communication skills with the ability to communicate complex ideas in simple terminology. Ability to understand and clearly relate technical information and principals of operation to other members of the organization. Ability to analyze operational problems and recommend innovative solutions, demonstrating time management skills. Proven ability to plan and execute complex projects with stringent budgets and timelines. Communications certification such as Microsoft MCSE/MCDBA or Cisco CCNA would be an asset.
What we bring
Every PHSA employee enables the best possible patient care for our patients and their families. Whether you are providing direct care, conducting research, or making it possible for others to do their work, you impact the lives of British Columbians today and in the future. That’s why we’re focused on your care too – offering health, wellness, development programs to support you – at work and at home.
Join one of BC’s largest employers with province-wide programs, services and operations – offering vast opportunities for growth and development.
Access to professional development opportunities through our in-house training programs, including +2,000 courses, such as our San’yas Indigenous Cultural Safety Training course, or Core Linx for Leadership roles.
Enjoy a comprehensive benefits package, including municipal pension plan, and psychological health & safety programs and holistic wellness resources.
Annual statutory holidays (13) with generous vacation entitlement and accruement.
PHSA is a remote work friendly employer, welcoming flexible work options to support our people (eligibility may vary, depending on position).
Perks include access to fitness classes and discounts to 350 BC-wide recreational programs, travel, technology, car and bike sharing, and more.
Job Type:
Regular Full-Time
Location:
1795 Willingdon Avenue, Burnaby, V5C 6E3
Closing date:
Open until filled
Hours of Work:
0800-1600, Monday through Friday
Requisition #
118575E
What we do
The Provincial Health Services Authority (PHSA) plans, manages and evaluates specialized health services with the BC health authorities to provide equitable and cost-effective health care for people throughout the province. Our values reflect our commitment to excellence and include: Respect people – Be compassionate – Dare to innovate – Cultivate partnerships – Serve with purpose.
Learn more about PHSA and our programs: jobs.phsa.ca/programs-and-services
PHSA is committed to employment equity, encouraging all qualified individuals to apply. We recognize that our ability to provide the best care for our diverse patient populations relies on a rich diversity of skills, knowledge, background and experience, and value a safe, inclusive and welcoming environment."
"Service Desk Analyst - Welland, ON - Indeed.com","Help us boldly shape retail in Canada
Canadian Tire Corporation’s (CTC) rich heritage of serving Canadians from coast-to-coast dates to 1922. Our vision is to become the #1 retail brand in Canada, and we are focused on innovating and making important investments in our business, especially when it comes to our people. To reach our goal, we need the best talent to help us evolve and drive change across our business – and boldly help shape Canada’s retail industry. As we strive to be at the forefront of a complex and vastly changing retail industry, it is an exciting time to join the Canadian Tire family of companies.
A Service Desk Analyst’s primary role/responsibility are to provide both corporate and store employees with proficient first level technical support and incident resolution for hardware/software issues that cover a variety of platforms. Service Desk Analyst’s should be focused on providing solutions to end user incidents to ensure they have a smooth experience using their technology.
What you’ll do:
Serves as the key technical reference when troubleshooting and operating technology components
Service oriented with expert communication skills (both verbal and written) in dealing with employees and partners.
Experience using remote control technologies for managing mobile devices (example: Personal Device Terminals), Server and POS Registers ; experience using a Remote Desktop Management Tool (ie. SMS, Tivoli) for software distribution to desktops
Skilled utilizing ticketing tools (Service Now, Remedy, etc.)
Strong team player
Self-motivated/demonstrates initiative
Flexible work hours as we are 24/7 operation
What you bring:
2+ Years’ experience supporting an end user computing environments
Minimum of 2 years’ experience in a retail environment
Superior troubleshooting skills for Retail devices (Personal Device Terminal, Access Point Units, Registers, Receipt Printers)
Microsoft suite of products, Operating System software and application software
Mac OS experience
Experience with IOS and Android
Ability to support users in a Microsoft Office 365 environment
Knowledge of Active Directory
Familiar with Citrix infrastructure components and Clients for troubleshooting
Experience with Microsoft exchange / Outlook configurations for troubleshooting
Analytic / Problem solving Skills
Customer Service Skills
Organizational Skills
Desired Skills/Certification :
Bilingual (French/English). - preferred
Work experience in a Service Desk environment
College education in computer technologies
Excellent knowledge of store cash registers hardware
Strong hardware and networking experience
Excellent analytical and synthesis capacity
Able to make good decision under pressure
Fast learner with strong ability to mentor others
Strong troubleshooting skills
Ability to prioritize activities
Able to remain positive in all circumstance
Must have a high level of confidence in own abilities
About Canadian Tire Corporation
Canadian Tire and its family of companies are boldly shaping retail in Canada and we continue to deliver a positive experience for our customers. As one of the most trusted brands in Canada, our employees take pride in the work we do across the country. It’s more than the iconic triangle that keeps our employees around. From benefits and perks, to learning and development opportunities, to our commitment to Jumpstart – these are some of the many reasons why Canadian Tire Corporation is one of Canada’s Top Employers.
To learn more about this team and the Canadian Tire family of companies follow us on LinkedIn.
#LI-RD1
FGL Corporate
Ontario-Welland
Remote/Mobile
Permanent
Full-time
Job Posting
: Nov 15, 2021, 2:50:29 PM"
"Portfolio Analyst - North York, ON - Indeed.com","You are as unique as your background, experience and point of view. Here, you’ll be encouraged, empowered and challenged to be your best self. You'll work with dynamic colleagues - experts in their fields - who are eager to share their knowledge with you. Your leaders will inspire and help you reach your potential and soar to new heights. Every day, you'll have new and exciting opportunities to make life brighter for our Clients - who are at the heart of everything we do. Discover how you can make a difference in the lives of individuals, families and communities around the world.
Job Description:
Role Summary
As a member of the Service Delivery Digital Business Automation Services team, the Portfolio Analyst will work with the Business Manager in leading the process of planning, analysis and reporting for the DBAS team.
This includes support for the strategic and operational business planning process, resource planning, project finance tracking, software and hardware assets tracking and the overall service reporting.
What will you do?
Support DBAS management by executing processes for planning, budgeting, financial management and reporting.
Support the project accounting activities and work with the PMs to consolidate demand plans, adjust resource plans, analyze traction reports and adjust the forecast accordingly.
Support projects or project financial reviews as required.
Monitor and track the supply and demand.
Work closely with the delivery and operations management to enhance and continue tracking and reporting the resource allocation process.
Perform ad hoc analysis as required.
Assist the DBAS Leadership team in monthly and quarterly reporting.
Support the delivery and operations financial processes through data collection, compilation, validation, reconciliation, consolidation and reporting.
Participate in the requirements for any required tools to facilitate the automation of the planning and analysis processes.
What you need to succeed?
Ability to leverage technology to streamline processes and provide analytical support.
Financial background or qualification.
Demonstrated analysis and problem-solving skills.
Minimum two years of experience working in an IT environment
Excellent communication, presentation, interpersonal, facilitation and organization skills.
Works effectively and efficiently in a virtual, multi-site environment.
Ability to work independently with some supervision
Preferred skills
Expertise in areas of financial management, portfolio management and service delivery management
A university degree in, business, accounting or computer science degree or equivalent experience.
Experience in Excel, Power BI and Tableau.
Attention to accuracy and detail.
The Base Pay range is for the primary location for which the job is posted. It may vary depending on the work location of the successful candidate or other factors. In addition to Base Pay, eligible Sun Life employees participate in various incentive plans, payment under which is discretionary and subject to individual and company performance. Certain sales focused roles have sales incentive plans based on individual or group sales results.
Diversity and inclusion have always been at the core of our values at Sun Life. A diverse workforce with wide perspectives and creative ideas benefits our clients, the communities where we operate and all of us as colleagues. We welcome applications from qualified individuals from all backgrounds.
Persons with disabilities who need accommodation in the application process or those needing job postings in an alternative format may e-mail a request to thebrightside@sunlife.com.
At Sun Life we strive to create a flexible work environment where our employees are empowered to do their best work. Several flexible work options are available and can be discussed throughout the selection process depending on the role requirements and individual needs.
We thank all applicants for showing an interest in this position. Only those selected for an interview will be contacted.
Salary Range:
56,300/56 300 - 92,900/92 900
Job Category:
Project Management - Systems
Posting End Date:
17/12/2021"
