Title,Description
"Digital Marketing/Advertising Specialist - Winnipeg, MB - Indeed.com","You will be joining a talented, innovative team working on creative projects that help make a difference. We’re looking for creative and strategic minds who share our desire to find and realize potential.
Who You Are:
Expertise in digital marketing including social media channels, Google Ads, etc.
Experience with Facebook and Instagram Ads, Google Analytics
Good general understanding of advertising, communications, and design
Experience with Microsoft office and google suite
Strong proficiency in managing and analyzing data
Positive attitude and enjoy working in a team environment
Self-starter with ability to ‘own’ your projects
Strong communication (written and verbal), comprehension and interpersonal skills
Attention to detail, creative problem solving, quick learner, ability to multitask, highly organized
Strong computer skills and the ability to learn new technology
Certification in HubSpot, Google, or Facebook are all assets.
Proven ability to work well in a fast-paced environment and can handle multiple tasks
Responsibilities:
Builds and presents media plans and makes necessary adjustments.
Setting up and managing multi-channel digital Ad campaigns
Manage digital media across a range of channels
Develops basic target profiles/insights
Integrate and combine best practices from direct marketing, promotional marketing, and CRM (customer relationship management) to provide sound strategic planning for highly effective, fully integrated online / offline campaigns
Optimize client marketing automation and lead nurturing processes through email, content, and social channels
Study demographic data and consumer profiles to identify desired target audiences for cross media campaigns
Building and coordinating marketing plans
Providing guidance and recommendations for emerging technologies and industry trends
Qualifications:
1+ years’ experience in digital marketing field preferred
Experience working with digital marketing campaigns (Google, Facebook/Instagram, etc.)
Creative writing skills, and knowledge implementing digital marketing best practices considered an asset
*Salary is based on experience
Job Type: Full-time
Salary: Up to $50,000.00 per year
Schedule:
Monday to Friday
Work remotely:
No"
"Marketing Manager - Lake Louise, AB - Indeed.com","Marketing Manager
Under the leadership of the Director of Sales & Marketing and collaborating with the PR and Content Manager, key responsibilities will include planning, creating, executing and supporting the hotel, Canadian Western Mountain Region and corporate in all marketing efforts, with the goal of increasing destination awareness and maximizing revenue. This role will specialize in digital marketing in supporting the hotels key revenue streams by implementing strategies to increase web traffic, engagement and conversion. Oher responsibilities include all in-house marketing creation and support to ensure brand consistency and messaging within the hotel.
Embrace your passion for nature and enjoy hiking, skiing/snowboarding, biking and many other activities in Banff National Park while pursuing a fulfilling career at Fairmont Chateau Lake Louise. Take a risk, make a change and experience a new adventure while further developing your career. To live and work in a National Park is a once in a lifetime opportunity. Our team is a network of empowered individuals with a strong sense of themselves and the hospitality industry. Live, work, play and learn and receive extraordinary benefits including subsidized onsite accommodations. To learn more about life in Lake Louise visit: https://bit.ly/3E1dW59.
What is in it for you:
Experience living in Banff National Park in the iconic location of Lake Louise
Subsidized staff accommodation provided on-site for full time status
Access to our Lifestyle Program activities
One duty meal in our newly renovated staff cafeteria
Competitive extended benefits package including medical, vision and dental for full time permanent status
Employee Travel Program
Comprehensive Wellness Platform (LifeWorks)
Discounts on food & beverage/fitness centre/spa/golf
Opportunity to develop your talent and grow within Fairmont Chateau Lake Louise and over 5,100 properties with Accor
What you will be doing:
Plan, coordinate & execute key marketing campaigns for all business segments (leisure, group, tour, wedding, wellness, food & beverage, spa)
Prepare campaign re-cap reports showing performance, ROI and learnings
Create, review, asses and present monthly digital analytics reports along with insights and recommendations
Strategically prepare and execute media buys for digital and print, working with key partners and suppliers
Manage Fairmont property website along with all hotel microsites focusing on UX and SEO
Design ad creative for campaigns (print and digital)
Liaise with partners on seasonal marketing strategies (Travel Alberta, BLLT, Ski Louise, etc.)
Create and oversee all hotel and corporate email marketing
Responsible for all guest facing signage (elevator posters, guestroom TV’s, weekly and seasonal resort guides, pre-arrival communications, digital displays, welcome booklets, etc.) – including design, coordination and printing
Produce copy for websites, digital advertising, print advertising and in-house collateral
Promotes and adheres to Fairmont Brand Standards in all guest facing material
Assist Content Marketing Manager with posting to social media channels (Instagram, Facebook, Twitter, LinkedIn Pinterest, YouTube)
Active participant in hotel rev pro meetings and other such activities to innovate, create and review marketing opportunities and content creation (and or use).
Participate in hotel events, festivals and seasonal activities to maximize social media and content generation opportunities
Working with Content marketing manager and hotel executive team, support Talent & Culture marketing efforts including content creation, social channel management, microsite updates and assistance with monthly reporting (similar to guest marketing efforts)
Provide marketing support to the group sales and tour/travel sales teams, special events and wellness. This includes support towards sites (in person and virtual)
In coordination with the DOSM, various duties when and as they arise based on hotel business needs.
Your experience and skills include:
Marketing, Graphic Design, Communications, Digital/Online Marketing post-secondary education
Previous hotel marketing experience required
Excellent knowledge and proficiency of Microsoft Office (Outlook, Word, Excel, Powerpoint)
Previous Graphic Design experience using Adobe Creative Suite (InDesign, Photoshop, Illustrator), portfolio samples will be requested
Knowledgeable in CMS tools (Wordpress, Wix, Custom Builds)
Experience creating SEO, SEM and PPC campaigns
Experience managing programmatic display, remarketing, and paid social campaigns
Googles Analytics certification required
Understanding of email campaign and database management
Articulate, self-motivated, energetic team-player
Knowledge of commercial printing processes and techniques
Management of third party vendors and suppliers
Project management expertise
You may be required to work on holidays, weekends, overnights and other non-day shifts. Submission of your application to Fairmont Chateau Lake Louise indicates that you are able to meet these requirements as needed.
Your team and working environment:
Fast-paced, upscale, luxury hotel
Close proximity to multiple ski resorts in winter and world-renowned hiking trails in summer
Hospitality employees worldwide making this a great place to develop lifelong connections
Visa Requirements:
Must be legally eligible to work in Canada. The hotel is unable to assist candidates in obtaining Canadian work authorization.
Our commitment to Diversity & Inclusion:
We are an inclusive company and our ambition is to attract, recruit and promote diverse talent.
Why work for Accor?
We are far more than a worldwide leader. We welcome you as you are and you can find a job and brand that matches your personality. We support you to grow and learn every day, making sure that work brings purpose to your life, so that during your journey with us, you can continue to explore Accor’s limitless possibilities.
By joining Accor, every chapter of your story is yours to write and together we can imagine tomorrow's hospitality. Discover the life that awaits you at Accor, visit https://careers.accor.com/
Do what you love, care for the world, dare to challenge the status quo!
#BELIMITLESS"
"Social Media Assistant - Markham, ON - Indeed.com","Position Description:
Social Media assistant
""MUST SEND US YOUR CREATIVE PORTFOLIO"" or application will not be reviewed.
Responsibilities
Create Social Media content and implement social posting schedules
Prepare monthly brokerage Newsletters & Flyers – print and electronic
Assist with the maintenance of social media sites, pages, profiles and groups.
Design promotional pieces, marketing and assisting with the coordination of special events
Preparing PowerPoint presentations for meetings, seminars, etc.
Websites Maintenance – agent profile maintenance, updating online calendar, etc.
Maintenance of multiple databases
Preparation of monthly stats and reports
Qualifications:
Comfortable working in an office setting and communicating via phone/email. (Temporary can work from home)
Copy writing - Ads / Social Media posts
Knowledge of SEO a plus but not required.
Content creation Adobe Suite (Photoshop / Illustrator / Premiere Pro & Canva)
Ability to work as a part of a team or independently
Outstanding communication skills (written and verbal)
Strong time management capabilities
Strong analytical skills and attention to detail
Strong data entry and reporting skills
Minimum high school education, with a preference to college level courses/ diploma
Ideally 1 to 2 years working experience in the real estate industry
Working knowledge of Microsoft Office (Word, PowerPoint, and Excel), Word Press Websites, Adobe Photoshop / Premiere Pro / Illustrator / Canva
Schedule:
4 hour shift
Day shift
Monday to Friday
Education:
Bachelor's (Preferred)
Experience:
Worked for other companies as a social media assistant
Work Location:
Work from home temporarily due to COVID-19
This Job Is Ideal for Someone Who Is:
Dependable -- more reliable than spontaneous
Adaptable/flexible -- enjoys doing work that requires frequent shifts in direction
Detail-oriented -- would rather focus on the details of work than the bigger picture
Autonomous/Independent -- enjoys working with little direction
Part-time hours: 30 per week
Application deadline: 2021-11-30
Expected start date: 2021-12-01
Job Types: Full-time, Part-time, Freelance, Permanent
Salary: $14.50-$16.50 per hour
Additional pay:
Commission pay
Benefits:
Casual dress
Company events
Work from home
Schedule:
Day shift
Night shift
Weekend availability
Experience:
Social Media Marketing: 1 year (preferred)
Work remotely:
Yes"
"Internal Content & Brand Marketing Lead - Winkler, MB - Indeed.com","As the Internal Content & Brand Marketing Lead, you will have the freedom to expand and lead marketing programs for our internal audiences aimed at promoting brand awareness, attracting talent, and contributing to overall employee experience.
ROLES/RESPONSIBILITIES
Understand, communicate and commit to Triple E’s vision, goals and strategies and translate them into action plans
Understand People & Culture programs and internal communications channels and methods, with a focus on creating engaging campaigns and experiences
Design, develop and execute effective plans and approaches for increasing employee engagement with People & Culture related programs and resources
Act as primary point of contact and coordinate interaction with the People and Culture Lead to define and deliver engaging experiences for employees and potential employees
Liaise with our marketing team to deliver coordinated and consistent experience across channels and campaigns
Qualifications:
Degree/Diploma in Communications, Graphic Design, Marketing, Business or equivalent
Experience producing content for the web and social media with a strong portfolio
Experience In the digital communication space with knowledge of social media platforms and demonstrated digital strategic planning skills
Graphic design skills, including working knowledge of Adobe Creative Suite and other current technologies used for creative work
Strong communication skills – written and verbal
Independent and well organized with strong project management skills
Photography and video skillset a plus
Together we:
Provide customers with an opportunity to experience joy, love, companionship, adventure, awe, comfort, connections and safety in a hand-crafted Leisure Travel Van."
"Webmaster SEO - Quebec City, QC - Indeed.com","Description du poste
Crakmedia est un leader mondial en marketing web de performance. Grâce à une équipe d’acheteurs médias chevronnée et sa propre plateforme de marketing d’affiliation, la compagnie connaît une phase de forte croissance depuis les 3 dernières années et vise à maintenir ce rythme pour les années à venir!
Chez Crakmedia, un Webmaster est en charge de:
Créer, maintenir et améliorer un réseau d’une trentaine de sites, principalement Wordpress;
Développer des stratégies de créations de liens et d’optimisation qui stimulent les performances des visites de recherche organique;
Analyser la performance des boutons de conversions existants;
Effectuer des audits SEO, des analyses et la mise en œuvre de recommandations techniques pour aider à améliorer les performances globales du site, découvrir et résoudre les problèmes d'exploration Web, etc.
Pour avoir du succès dans ce rôle il faut:
Être passionné de SEO;
Avoir minimum 3 ans d'expérience dans un rôle silimaire;
Être compétent en
priorisation et en diagnostique;
Connaître Google Search Console, Bing Webmaster Tools, Google Analytics, SEMRush, Ahrefs et Screaming Frog;
Connaître HTML, CSS, PHP, Javascript (Un atout);
Être bilingue (oral et écrit)."
"Demand Generation & Digital Marketing Manager - London, ON - Indeed.com","Responsibilities Include
:
Content Creation
Collaborate with industry thought leaders, global and regional marketing colleagues, and agency partners to produce compelling written and visual content including, but not limited to, blog articles, social and web content, case studies, and white papers
Partner with internal team, stable of agencies, medical writers, and other relevant freelancers to create compelling content
Demand Generation
Execute a successful content marketing strategy that is integrated with the organization’s value proposition messaging, business objectives, and brand development goals.
Own digital campaign strategies to increase touchpoints within a prospect’s journey to optimize conversion rates; reporting on Key Performance Indicators and expected return
Create, manage, and report on lead generation and nurture campaigns in the Salesforce ecosystem, consisting of the optimization and implementation of buyer personas and journeys, A/B testing, and dissemination of marketing content
Maintenance
Actively engage with external audiences to build online communities and driving conversation on applicable social media platforms
Monitor social media channels to recognize competitive and market behaviours and execute follow up actions
Ensure the organization’s web portfolio is consistently updated and accurate
Success Measurement and Reporting
Ensure that all content and digital initiatives meet or exceed business objectives by establishing actionable insight reports with clear metrics for all content and digital campaigns
Evaluate and refine overall work systems and processes and implement best practices for lead generation to remain at the forefront of content marketing and digital communications trends.
Contribute to continuous improvements by presenting new approaches and solutions to problems through monitoring the marketplaces to stay up to date on new and upcoming trends, campaigns, technologies, and best practices.
Support other marketing communications-related initiatives as necessary.
QUALIFICATIONS
5 years of digital marketing, digital communications, or demand generation
Undergraduate degree in business, marketing, or a related discipline
A growth-focused mentality; always looking to improve results and know how to move quickly
Ideal candidate thrives in a collaborative environment
Exceptional writing and storytelling skills (comfortable posting on social and web platforms, blogging, etc.) is required
Expertise with CRM and Inbound Marketing tools—Salesforce ecosystem (Pardot, Marketing Cloud, Social Studio, Ad Studio) are preferred
Proficiency working with business functions of social media platforms including LinkedIn, Facebook, Instagram, Vimeo, YouTube, and Twitter
Expertise in Social Media Advertising, Search Engine Marketing, and Search Engine Optimization
Advanced knowledge of Google Analytics
Knowledge of user experience (UX) design and usability principles
Experience with web CMS systems (Drupal, WordPress, etc.)
Proficiency in Microsoft Office [Word, Excel, PowerPoint, Outlook]; Adobe Creative Suite is preferred
Job Type: Full-time
Schedule:
Monday to Friday"
"Graphic Designer / Website Designer / SEO / Ads - Burlington, ON - Indeed.com","We are in need of a passionate designer that specializes in Website Design, Graphic Design, SEO rankings, and google ads to join our Marketing Agency Team.
Wild Media Marketing Agency is developing from Alyssa Raye Productions; we are a growing full service content marketing agency with the coolest clients. Our clients are in the fitness, athletics, and health & wellness industry, with our main focus being videography, content creation, and social media management and marketing.
Many of our clients have needed newly designed websites, sales & landing pages, ads management, and SEO rankings - and we have had to push this off until we find a suitable designer.
This is contract work, and would be minimal work to begin with; however, the agency is growing fast, and we are looking for someone excited, passionate, and talented, who wants to grow along with us.
The role allows you to work from wherever you like, at whatever hours work for you, however we do require the occasional team meeting in the Burlington area. Many of our meetings can be virtual.
Thank you for considering Wild Media !
Job Types: Part-time, Contract
Salary: $20.00-$27.00 per hour
Benefits:
Work from home
Experience:
Web design: 2 years (preferred)
Work remotely:
Yes"
"Digital Marketing Manager - Toronto, ON - Indeed.com","Purpose:
OsgoodePD is a revenue-generating professional education business designed to serve working legal professionals and others who have a need for current legal information both in Canada and internationally. OsgoodePD offers both degree and non-degree programs. The Digital Marketing Manager will oversee the development of strategic initiatives and tactical plans to effectively promote OsgoodePD's Continuing Legal Education (CLE) and LLM (Masters) Graduate programs. The ideal candidate will be an experienced metrics-driven digital marketing leader with a proven track record of developing digital campaigns across multiple channels. Using advanced working knowledge of data analytics and implementation, they will define data collection parameters, refine tracking, and inform strategies to promote OsgoodePD while improving conversions and increasing ROI. They will manage, evaluate, and continuously improve marketing assets and campaigns. This role will serve as OsgoodePD's digital expert with experience managing social media, CRM, data, analytics and web. Reporting to the Director, Marketing & Enrolment Management, overseeing 2 direct reports, and collaborating cross-functionally within OsgoodePD, the Digital Marketing Manager will be responsible for revamping all digital strategy and campaigns.
Education:
Undergraduate degree in a related field such as business, marketing, journalism or communications. Professional certificates in Google Analytics, Google Tag manager, Facebook campaigns, AdWords an asset.
Experience:
Minimum 5 years of experience in senior or managerial digital marketing role.
Experience managing staff, preferably in a unionized environment.
Advanced, in-depth knowledge and experience with paid social (LinkedIn, Facebook, Twitter, YouTube), CRM (Salesforce), SEO, BI (PowerBI), web analytics (Google Analytics) and implementation (Google Tag Manager).
Experience developing strategic and measurable digital marketing campaigns (planning and execution).
Experience managing external agencies and RFP processes.
Experience overseeing website functionality and design, with understanding of UX/UI best practices, preferably within WordPress.
Experience managing email campaigns and lead nurturing communications.
Skills:
Strong analytical skills with the ability to capture marketing performance data, manipulate in Excel, and distill into clear insights that will guide future decisions.
Excellent verbal and written communication skills, with experience writing marketing copy.
Excellent project management skills, with ability to prioritize and handle multiple tasks and deadlines.
Financial/budget planning, forecasting and management.
Demonstrated leadership skills. Ability to work effectively and collaboratively within a team environment and with multiple stakeholders. Exceptional service orientation.
Conflict resolutions skills pertaining to project planning, prioritization and scheduling with internal stakeholders and external vendors.
Good pricing, scheduling and negotiation skills to work with multiple external suppliers.
Additional Notes:
The position is situated at Osgoode Hall Law School at the York University Keele Street Campus. However, the individual is required to attend meetings and events at OsgoodePD's facility in Downtown Toronto. There is the need to participate in meetings with internal and external personnel via Zoom, Skype and WebEx.
Please note: This position requires the candidate to produce a verification of degree(s), credentials(s), or equivalencies from accredited institutions and/or international equivalents at the time of interview.
Compensation:
York implemented a revised CPM Compensation Framework in 2019. The Framework is a salary grid consisting of 6 or 8 steps (depending on job grade) which is reviewed annually with possible adjustments, and a lump sum Performance Based Recognition Award. Employees will receive the grid adjustment and depending on performance, eligible permanent employees may move to the next step of the grid and may receive a lump sum Performance Based Recognition Award.Visit the CPM Compensation page on the HR Website to find out more about York's CPM Compensation Program.
NOTE: York University requires all community members, including employees and visitors who attend our campuses be fully vaccinated against COVID-19, subject to medical and human rights exemptions, in accordance with all applicable laws and regulations. The University's
vaccine policy
is integral to our ongoing commitment to health and safety. Offers of employment require that you comply with the COVID-19 Vaccination Mandate by providing proof of vaccination prior to your start date. For information on how York University is responding to COVID-19 please visit the
YU Better Together
website.
The University welcomes applications from all qualified individuals, including, but not limited to women, persons with disabilities, visible minorities (racialized), Indigenous Peoples and persons of any gender identity and sexual orientation. York University is committed to a positive, supportive and inclusive environment.
York University offers accommodation for applicants with disabilities in its recruitment processes. If you are contacted by York University regarding a job opportunity or testing, please advise if you require accommodation.
We are committed to enhancing our environmentally and socially responsible practices for the benefit of all members of the York community. Our long term perspective recognizes our responsibility to be innovators and to continually work as a community to reduce our ecological impact.
York University employees must apply to jobs through the Employee Career Portal - YU Hire. If you are a current York University employee and/or are using your rights under a collective agreement to view and/or apply to jobs, you MUST log into YU Hire to access the York University Employee Career Portal.
PLEASE NOTE: Applications must be received by 11:55 pm EST on the posted deadline date, if applicable."
