Title,Description
Chief Marketing Officer - Canada - Indeed.com,"CaseWare is a remote first company with opportunities in Canada, the United States and a few other countries across the globe. Since the global pandemic we have adapted an Agile Work Strategy, which aims to give people the option to work from home or work from a CaseWare office. Feel free to ask us questions about our approach at any point in the interview process.
Following Hg’s recent investment into CaseWare, the business has ambitious aspirations to continue to grow and expand its product offering and customer base throughout Canada, the United States, Europe, Middle East, Africa, Latin America and Asia Pacific. CaseWare now requires an experienced Chief Marketing Officer to lead the marketing function and continue CaseWare’s growth.
The Chief Marketing Officer will be responsible for defining, implementing and owning an end-to-end marketing strategy across all channels. This strategy will be aligned with the overall business objective to deliver revenue growth by focusing on increased demand generation and increased brand awareness in its markets. They will work closely with other members of the leadership team in this strategic, operational and highly visible role in the business.
Responsibilities
Own the full marketing plan & go to market strategy, with full accountability over execution and input into the overall business strategy as part of the leadership team
Create a digital marketing funnel in a way that differentiates CaseWare from the market and its competitors
Create a marketing centre of excellence, to facilitate the understanding of CaseWare’s messaging, brand and marketing best practices across all geographies and amongst the distributor base
Build and manage a motivated team with digital and customer experience expertise. Clearly define roles, responsibilities and KPIs for the corporate and field teams ensuring the strong collaboration and alignment for consistent and relevant, local execution
Build, define and refine CaseWare’s product marketing capability. This function should conduct market segmentation, competitive research, understand competitive threats and customer buying needs and journeys
Build and differentiate CaseWare’s brand globally and digitally in order to enter into new markets, increase digital footprint and brand recognition
Strategically develop a consistent, unified branding strategy that builds a unique narrative that resonates with CaseWare customers in all territories, customer segments and product sets
Build brand recognition globally. Through value proposition, brand proposition and brand architecture
Work with key stakeholders to identify, lead, and drive and support incremental and transformational operational change
Build a corporate marketing capability that puts the company in the industry conversation, including devising the corporate messaging
Work closely with the sales organization to understand their objectives and challenges across geographies, segments and channels
Utilize and optimize technology to reengineer and standardize marketing processes, particularly around productizing and professionalizing CaseWare’s service offering
Requirements
Commercially oriented, strategic B2B marketing leader, adept in combining strategic thinking and strong execution qualities
Extensive experience in B2B marketing in SAAS technology, software or SaaS environment
Experience in managing international teams demonstrating ability to build and align a team and develop people
Extensive marketing expertise with a deep understanding of driving lead generation at scale, focusing on how the marketing strategy impacts revenue
Experience with acquisitions and integration, specifically in brand sunsetting and rationalization
Expert influencer and proven communicator with the ability to develop new capabilities to meet business outcomes
Hands-on, detail orientated leader who is highly analytical and data-driven while retaining their creativity and allowing team members autonomy
Strong executive presence, capacity to influence, high emotional intelligence, resilience and agility as well as the ability to assess situations and make critical/high impact decisions
Functional competencies; strategic marketing, demand generation, digital marketing, social media, brand management, public relations, campaign management, event marketing, customer experience, CRM, web management, digital (inbound), lead generation, marketing ops, pricing, data analytics, marketing automation, reporting
Intellectual dexterity; ability to deal with complexity and think analytically with a structured and metrics-oriented approach
Comfortable in an entrepreneurial environment, while maximizing value from relatively limited resources
Self-motivated, hands-on and results oriented team player who leads by example, holds him or herself accountable for performance and takes absolute ownership of the function
Strong project management skills focused on delivery and capability in running multiple initiatives in parallel
About CaseWare
With a head office in Toronto, CaseWare is one of Canada's original Fintech companies, having led the industry for over 30 years, with more than 500,000 users across 130 countries and available in 16 different languages.
While you might not have heard of us (yet) over 36,000 accounting and audit professionals list CaseWare as a skill on their LinkedIn profiles!
CaseWare's cutting-edge software products are meticulously designed for accounting firms, corporations and governments. Our teams are continually collaborating, innovating and building upon our existing suite of products. With a customer focused mindset we are building technology that is shaping what the future of audits, financial reporting and financial data analytics will look like.
With a recent strategic investment from Hg Capital in 2020, CaseWare is now in its next major growth phase as we double down on the people and products that have made CaseWare so successful to date.
One of CaseWare's core values is that we believe Our People Make Us Great and with that in mind, we're dedicated to building teams as diverse as our customers in an equitable and inclusive way. We welcome and encourage candidates of all backgrounds to apply. Should you require accommodations or have any questions at any point during the application or interview process, please e-mail our People Operations team at careers@caseware.com.
Any candidates successful in obtaining an offer for a position will need to successfully complete a background check through
Certn.co
which typically includes an Identity Verification and Criminal Record Check. Executives and Senior Managers will undergo a Soft Credit Check as well.
#LI-remote"
"Marketo Specialist (Remote Position) - Ottawa, ON - Indeed.com","If you enjoy working with Marketo, this is an opportunity of a lifetime to work with some of the best Marketo practitioners in the world.
Revenue Pulse is looking for an exceptional Marketo Specialist, who is passionate about helping clients execute programs and succeed with Marketo. We are looking for someone who has experience working with Marketo on the client-side, ideally at a large enterprise.
The successful candidate will get to work with some of the most well known brands in the world, and become an extension of their team. The majority of the work is virtual, however some travel may be required to go on-site with clients.
Please note: Revenue Pulse is a 100% remote team and this is a remote position. We are looking for someone who can support clients during regular business hours. Open to candidates in Canada and the USA.
Responsibilities
Work directly with clients to assist them execute their marketing campaigns
Create emails, landing pages, and perform general program setup in Marketo
Take ownership of project tasks to deliver the desired results in a timely manner
Collaborate with clients to gather requirements, get feedback and present results
Required Skills & Experience
At least 2-3 years experience using Marketo
Marketo Expert Certification
Deep expertise in marketing automation execution
Extreme attention to detail
Excellent client management skills, strong written and verbal communications
Strong project management and organizational skills"
"Marketing Manager - Victoria, BC - Indeed.com","About FREmedica
We’re a fast-growing company that manufactures and sells disruptive wearable technology that is helping people with Lyme Disease to live a fuller life, symptom-free. This is a game-changing technology with a proven track record. We’ve even got some A-list celebrities that have recovered from their symptoms and they’re ready to talk about it!
About You
We’re looking for an experienced, dynamic leader that’s ready to take their career to new heights, and help us make a big difference in people’s lives. You’re a digital marketing expert, can write brilliant, persuasive, engaging copy, and you know your way around SEO, Social Media and Content Strategy. You understand the value of video and how to put it together. You understand how to support an Affiliate Network with excellent marketing tools and you are full of ideas. You’re a team player, will contribute to business planning and you’re also excellent at managing a budget.
You’re a self-starter, motivated to succeed and want to be around inspiring people. You love tracking results and making every dollar count. You’re a get-it-done person with the ability to be flexible and welcome ideas from an engaged team.
You’re experienced at working with agencies and provide clear briefs and direction and you’ll also have a creative team reporting to you.
What You’ll Receive
We’ll welcome you to the office and there’s also an option to work partially remotely too. Your compensation will be related to your experience and expertise, but will include profit sharing and participation in an option plan. We do offer a nice vacation and benefits package, too.
Interested? Tell Us More.
1. Tell us why this job intrigues you.
2. Tell us more about your experience and expertise.
3. Share a few examples of campaigns you’ve worked on and tell us what you personally contributed.
4. What does your dream job look like?
And naturally, you’re adept at using all kinds of software and nothing intimidates you. If you’ve got Hubspot expertise, that’s a real asset too.
Job Types: Full-time, Permanent
Salary: $65,000.00-$91,960.00 per year
Benefits:
Casual dress
Company events
Dental care
Disability insurance
Employee assistance program
Extended health care
Life insurance
On-site parking
Paid time off
Profit sharing
Work from home
Schedule:
8 hour shift
COVID-19 considerations:
Masks worn in all common areas, regular office sanitizing, rotating work from home schedule.
Work remotely:
Temporarily due to COVID-19"
"Social Media Manager/Marketing Assistant - Montréal, QC - Indeed.com","Job Summary
Pin Media Inc. is growing and we're looking for a Social Media Manager/Marketing Assistant to join our team!
This individual will possess a strong understanding of the social media space and will be on top of all things social. They will use their expertise and passion to help develop and execute integrated social media plans to drive consumer engagement. They will have strong marketing skills to help execute strategies.
If this sounds like you, send us your resume and cover letter today!
Job Type / Category
Work closely with the marketing team to develop social media campaigns that help to achieve client marketing goals
Generate, edit, publish and share engaging content daily (e.g. original text, photos, videos, and news)
Develop monthly reports on emerging social media trends that will be provided to clients
Monitor the client's social media accounts and offer constructive interaction with users
Create methods for finding and saving online customer reviews
Help with copywriting and correspondence
Perform research on current benchmark trends and audience preferences
Collaborate with Project Manager to ensure brand consistency
Oversee social media accounts’ design (e.g. Facebook timeline cover, profile pictures, and blog layout)
Suggest and implement new features to develop brand awareness, like promotions and competitions
Stay up-to-date with current technologies and trends in social media, design tools, and applications
Required Education, Skills and Qualifications
.
2 years of experience in social media management
Exceptional multi-tasking skills and a strong sense of initiative
Able to explain complex social media data in an understandable way
Strong problem-solving skills
Knowledge of Facebook’s advertising platform is a plus
Hands-on experience in content management
Excellent copywriting and communication skills
Ability to deliver creative content (text, image, and video)
Knowledge of online marketing channels
Fluent in French and English
Company Profile
Pin Media Inc. is a digital marketing agency with over 10 years of combined experience in digital marketing and advertising. Our goal is to create engaging content to build our clients' audiences and keep them captivated.
Our services include social media management and advertising, website development, SEO, Google Ads, and email marketing. We’re ready to help businesses leave a lasting impression in the online sphere.
Job Types: Part-time, Contract, Casual, Freelance
Reference ID: Oct 2021
Part-time hours: 15 per week
Job Types: Part-time, Contract, Freelance
Salary: $17.00-$20.00 per hour
Benefits:
Casual dress
Flexible schedule
Work from home
Experience:
Social media management: 1 year (preferred)
Work remotely:
Yes"
"SEO Manager - Toronto, ON - Indeed.com","On or Off Page Operations
Do you have experience working in the search engine marketing industry? Have you held a position which allowed you to create, manage and test Search Engine Optimization results for various clients? Do you have experience helping companies improve there SEO results using both On Page and Off Page techniques?
TechWyse is a Toronto based, North American leader in Search Engine Marketing. With core competencies in Web, Traffic Building and Analytics Measurement, TechWyse is looking for an expert to lead the companies Search Engine Optimization division.
Desired Skills and Experience
Skills Required
Expert level knowledge of both On and Off page SEO techniques.
Provide expert technical instruction to support staff and technical team.
HTML and coding experience.
Expert level abilities in Copy Writing and Editing.
Strong communication and fluent in English.
Strong interest in research.
Knowledge and understanding of White Hat SEO techniques.
Knowledge of Google Content Experiments (Google Website Optimizer)
Knowledge of Google+, Google Places & Local Business.
Participation in client and staff meetings.
Detail oriented.
Process driven.
Ability to work in a fast paced environment.
Nice to Have
GAIQ and Google Ads accreditations
Knowledge of any of the following programs;Adobe Products including Photoshop, Dreamweaver, Visio, MS Office, Google Apps
Experience in Project Management.
Strong presence in video presentations.
50+ words /minute.
TechWyse has locations in both Canada (management) and India (production). The ability to manage this process will be in large part determine your ability to excel at this position. We are looking for out of the box thinkers that enjoy working with people. Some light travel to visit team members is possible with this position."
"Manager, Digital Marketing - Toronto, ON - Indeed.com","About Us
:
Established over 30 years ago, Medcan is a global leader in assessing clients' overall well-being and inspiring them to live well. Medcan has a comprehensive range of diagnostic assessments, which, in combination with innovative programs tailored to specific needs, are designed to successfully reach improved health outcomes.
Over 80 physicians and specialists, alongside a broad roster of complementary health care disciplines, provide health and lifestyle management services on site and by video consult for individuals, families and organizations. Our team of 500 staff see clients physically and virtually from our downtown Toronto location.
The Digital Marketing Manager position reports to Director of Sales and Client Success and is a key role on our broader Sales and Marketing team. As the Digital Marketing Manager, you will work along-side Sales, Product, and Marketing stakeholders to identify the greatest opportunity to improve the conversion, engagement and retention of our B2B and B2C clients. The role requires a deep understanding of full lifecycle marketing to prioritize, launch, manage and optimize segmented paid digital campaigns and to manage and optimize our marketing tech stack.
You are passionate about driving results through digital marketing tactics and strive to continuously learn to ensure you’re making efficient cost decisions with your paid media budget. You’re not afraid to roll up your sleeves and drive execution across a wide variety of projects including, but not limited to: website optimization/improvements, e-commerce, paid media campaign set-up, and optimization and reporting, as well as collaborate with key stakeholders in the development of advanced analytics and digital attribution.
You are a data-driven marketer, but don’t suffer from analysis paralysis - combining knowledge of best practices with a bias for action, with results being the focus. You partner well with a diverse group of internal stakeholders, helping them deliver results quarter-by-quarter, while balancing the need to play the long game. And you enjoy working in a fast-paced, changing environment at a continuously evolving company, with the opportunity to help define success and how to get there.
The key accountabilities of the role are as follows:
Work with the Director of Sales and Client Success on the development of B2B and B2C acquisition, retention, engagement and reactivation strategies
Manage the day-to-day operations and performance of our digital client experience: email journeys, landing page development, website optimization and e-commerce including KPI tracking and driving continuous improvements of our client journeys
Manage Salesforce Marketing Cloud clearly articulating usage best practices, product roadmap and its relationship to the Salesforce Ecosystem
Champion greater adoption and optimization of our marketing tech stack to help identify and predict customer behaviours, working with the analytics team to create and validate CRM models and client journeys
Build, test and execute paid search, social, display, video and mobile advertising campaigns through the full account management
Set goals, KPI’s and provide ROI transparency. Includes development of CPA/CPL and monitor budgets
Lead keyword research to help inform SEO strategy and copy development process
Collaborate with internal partners (e.g. CRM, Copywriters, Creative, Product, Sales, Operations, etc.) and lead external partners (e.g., designers, copywriters, agencies, etc.) to deliver campaigns and assets that deliver results
Ensure all digital marketing activities align to brand position, voice and standards with consistent messaging and quality
Lead and participate in internal/external meetings to represent digital marketing, and develop strong stakeholder relationships
The nature of the role requires that a successful candidate has the following desired attributes:
Analytical – expert analytical and quantitative problem-solving skills, analyzing data, developing hypotheses, and synthesizing insights and recommendations
Intuitive – asks great questions and uncovers client pain points quickly
Self-starter – thinks several steps ahead, anticipates potential outcomes and makes things happen with limited direction
Pragmatic - focuses on business and revenue impact
Interest in marketing technology trends and best practices
2+ years experience with Salesforce Marketing Cloud
Salesforce Certified Marketing Cloud or Email Specialist or Marketing Cloud Administrator
Strong knowledge of Email Studio, Content Builder, Social Studio, Ad Studio, and Automation Studio, Journey Builder experience preferred
Understanding of Marketing Cloud best practices
Understanding of A/B testing functionality within Marketing Cloud
Highly proactive – curious about results of all Marketing efforts, driven to capture and communicate results and key learnings
Full of positive energy and unstoppable in the face of obstacles, a resourceful problem-solver
Excellent written and verbal communication – takes pride in being accurate, clear and concise
Principled team player – stands behind what is proven to work, while incorporating other perspectives and seeking alignment/understanding, if not consensus
The Requirements:
Bachelor’s degree in business (marketing focus preferred) or other relevant area of study
5+ years of hands-on performance marketing experience – health & wellbeing and/or employee benefits industry experience is an asset
Experience with website, landing page and onboarding conversion optimization
Solid understanding of digital CRM journey’s, including campaign list management, deliverability, segmentation, and triggered journey’s
Mixture of media/creative agency and client-side experience is desirable
Strong knowledge of marketing technology platforms (e.g. Salesforce Marketing Cloud, Google Analytics, Google Tag Manager, etc.) and comfort with major CRM platforms (e.g. Salesforce)
Advanced knowledge of Microsoft Office
Expert knowledge of Excel or similar tools to help transform and manipulate data to report on it in a meaningful way
A highly collaborative individual that combines a strategic mindset with a hands-on approach
This is a full-time role that is scheduled during business hours Monday through Friday.
INDMED
In your cover letter please include why you wish to align yourself with Medcan and how you believe you can add value to our organization.
We thank all applicants for their interest; however only those selected for an initial interview will be contacted. No phone calls and no agencies please.
Medcan is an equal opportunity employer committed to the principles of employment equity, diversity, and inclusion. We continuously work to provide a fair opportunity for all staff to participate and succeed at work, creating a sense of belonging, respect and a place that values the unique perspectives and lived experiences of each member of our team. We recognize the value of diversity in attributes such as age, gender identity and expression, sexual orientation and attractionality, ethnicity, race, colour, nationality, family and marital status, ability, religion and belief, freedom of thought, and any other characteristic that makes you unique. If these principles resonate with you, we encourage you to apply!
If contacted for an employment opportunity, please advise your Talent Management Specialist if you require accommodation."
