Title,Description
"Networking Embedded Software Engineer- Level 3 - Ottawa, ON - Indeed.com","Since 1992, Ciena has been driven by a relentless pursuit of network innovation. We believe in a network that grows smarter, more agile, and more responsive every day. This means that when you digitally interact in your world - picking up the phone, streaming video, texting a friend or loved one – your interactions are being enabled by Ciena technologies. Ciena makes your social / entertainment / business existence REAL.
.
NOTE: We are looking to hire for multiple roles from intermediate to senior level.
What we’re looking for:
We believe in the power of people. We are a network strategy and technology company that is motivated by making a difference in people’s lives – their efficiency, their creativity, their health and comfort. That’s why our test engineers help sanitize technologies that allow people to do great things.
We’re looking for a highly motivated, hardworking and experienced engineer who is passionate about manual and automation test activities and is ready to assume a leadership position within the team in addressing future projects.
What will you do at Ciena?
Engage engineering teams, product line managers and product owners to transform high-level requirements into optimized test coverage.
Develop test strategies to fully exercise Packet Optical Transport product; System level, Routing and Switching, Provisioning, Performance and Scale, Fault management, Network traffic integrity.
Execution and Delivery of Manual and Automation end-to-end feature testing, tracking testing using Agile. Due diligence to ensure complete feature coverage, availability of required test environment (i.e., traffic generators, cards, system set up and ready), and the testing is within given quality parameters.
Analyze test results and prepare test reports.
Investigate software defects, highlight critical issues, and advise software development engineers in finding a resolution.
Share your experience while mentoring more junior members of the team.
You will be responsible for becoming the local subject matter expert for the features you are testing; related standards knowledge and customer requirements.
Provide support for Field Engineers through software upgrades, execution of the assigned test cases, debugging and collecting log files.
From time to time, ownership of internal/external customer prototype demonstration. Assist in standardization and interoperability lab testing.
Develop customer deliverable requirement use cases. Interact with PLM, architects and release managers to harden requirements. Understand the landscape of competitive usage of a feature.
Contribute to IETF and company's intellectual properties (Patents, White papers). Monitor industry standards and data application trends & alert senior management of potential roadblocks in product development
Required Skills:
Excellent troubleshooting and problem-solving skills associated with service provider, enterprise and carrier software solutions in general.
Excellent written (documentation) and interpersonal communication skills (English).
Strong abilities to work as part of a team or independently with little supervision.
Strong abilities to rapidly learn new complex technological concepts and apply knowledge in daily activities.
Knowledge and experience working with UNIX/Linux/RHEL/Ubuntu and/or any other server OS, be it on bare metal and/or Virtual Machine, and system admin functions.
Knowledge and experience working with system level, Layer 2 and Layer 3 protocols (like MPLS, IGP, BGP, Segment Routing, EVPN etc).
Knowledge and/or work experience with Python, Java, JavaScripting, CORBA, TCL/TK/Expect, Oracle, WebLogic and/or REST API and associated tools is highly desirable.
Knowledge and/or work experience related to network virtualization software like Open vSwitch, vRouter, etc. is highly desirable.
Knowledge and/or experience working with Layers 2 and/or 3 technologies on Ciena’s CES, 54XX and/or 6500 platforms would be an asset.
Preferred Qualifications
:
BS/MS degree in Computer Science/Electrical Engineering or equivalent
4+ years of dynamic experience in System & Networking Testing role
Experience with one or more general purpose programming languages including but not limited to: Java, C/C++, C#, Objective C, Python, JavaScript, or Go.
Interest and ability to learn other coding languages as needed.
Experience in development environments – GIT, Jenkins, Perforce, Clearcase, etc
Experience working in Agile and Waterfall models of development
Experience in both manual and automated testing environments
About Ciena
Ciena is a network strategy and technology company with a passion to provide an experience, to you and our customers that is as rewarding as the
outcome. We
attract the best and brightest– those with outstanding talent, motivation, and the right attitude to contribute to our success. Our culture balances our openness and informality with professionalism and trust and is built on the foundation of our core values: Customer First, Integrity, Velocity, Innovation, and Outstanding People.
Ciena enables everyone to have a voice and a network that supports them while on the journey to discovering their passion and purpose. We trust each individual to do what they can to reach their full potential and make an impact on the business, whenever, wherever they are in the
world. With
Ciena’s highly innovative, forward-thinking
business practices,
we reward people for pushing the
boundaries. Unlock
your potential at Ciena!
Being You @ Ciena
As part of our commitment to diversity and inclusion, we want to foster an environment that values and respects all individual’s strengths, perspectives, ideas, and ability to meet the needs of our customers globally. Ciena values the diversity of its workforce and respects its employees as individuals, regardless of race, ethnicity, religion, gender, age, national origin, disability, sexual orientation, veteran or marital status or any other category protected by applicable law. We do not tolerate any form of discrimination.
Ciena is also committed to compliance with all fair employment practices regarding citizenship and immigration
status.
If contacted in relation to a job opportunity, you should advise Ciena in a timely fashion of the specific accommodation
measures required for you
to be assessed in a fair and equitable manner.
We do not charge any fee for employment and the same applies to the Recruitment Partners we work with. Additionally, we do not ask for any refundable security deposit to be paid in bank accounts for employment purposes. We request candidates to be cautious of misleading communications and not pay any fee/ deposit to individuals/ agencies/ employment portals on the pretext of attending Ciena’s interview process or seeking employment with us."
"Associate Partner, Hybrid Cloud Services - Canada - Indeed.com","421026BR
Why Kyndryl
We design, build, manage and modernize the mission-critical technology systems that the world depends on every day. Our people are at the center, discovering, co-creating, and strengthening. We push ourselves and each other to seek better, to go further, and we carry this energy to our customers. In October 2020, IBM announced it's intention to separate the IT Infrastructure Services unit of its Global Technology Services division into a new, separate public company, creating two industry-leading companies - IBM and Kyndryl. The spin-off is expected to be completed by the end of 2021. To find out more about Kyndryl, including information relating to privacy, please visit Kyndryl.com.
Please be aware Kyndryl will continue to use some IBM systems for a certain period after spin-off. This means when you sign up to either the IBM or Kyndryl candidate portal, you will have the benefit of being able to see and apply for IBM and Kyndryl jobs and to access information about IBM and Kyndryl jobs you have applied to, for a limited period from either candidate portal. If you have already signed up as a candidate on IBM’s portal, please continue to use this account to access IBM and Kyndryl jobs.
Your Role and Responsibilities
IBM is looking for leaders who are passionate about helping some of the world’s biggest companies make their Journey to the Cloud and Digital Transformations. Do you know enough about the public cloud, RedHat technologies or Consulting to help the workloads that run the world find fit-for-purpose infrastructure in today’s cutting-edge cloud paradigms? Can you break that knowledge down for our clients to show them their opportunities and solve their risks?
Our Hybrid Cloud professionals are leaders. They’ve gained 10+ years’ experience in technology, 10+ years’ experience in Cloud and Cloud Multicloud Infrastructures and are ready to make a meaningful impact on our clients. Sometimes that leadership manifests in such deep technical expertise that they can lead and perform hands-on technical build, migration, and technical designs for projects to achieve client’s transformations and to help rescue clients from blocked or difficult projects. Translating client requirements, understanding client’s circumstances, and executing project services to support the design and implementation of converged infrastructure solutions, in order to deliver cloud operations, consolidate and protect workloads. You will use assets and reference architectures, build proof-of concepts, build and execute implementation plans, testing plans and deployment plans to address client requirements and work with products or solutions based on partner hardware and/or partner software.
IBM is making a big bet on cloud and we need people who have a deep technical background expertise in the technologies that will make our customers successful. To be a Hybrid Cloud Infrastructure Architect at IBM you should be ready to be hands on from technical solutioning, project startup, implementation and project close.
Ideal Candidate Profile:
Deliverable based driven
Bi-Lingual
Canadian Security L2 Cleared
Client Facing Success Driven
Client Satisfaction Focused
Strong & Trusted relationships with clients
Business Growth Passion
Problem Solver & Creative Thinker
Desired Outcome Focused
Diligent and Engaging Communicator
Timely and Accurate information keeper
Works without supervision and strong collaboration
Performs and Balances tasks on multiple concurrent projects across multiple customers
Understands department/ functional mission and vision
Exposed to demands of travel and irregular work hours
Responsibilities:
Review and validate the BOM, assess client's requirements, and product's specifications/features.
Create the required artifacts (design document, diagrams, build book, etc..)
Design and Implement the infrastructure to support the solution
Work closely with various teams to gather business and technical requirements.
Accountable for successful delivery of highly complex, multi-disciplined consulting engagements that deliver lasting and measurable value to clients
Develop a point of view, capture, prioritize and analyze technical (functional and non-functional) requirements
Possess strong leadership skills and further the evolution of intellectual capital assets and developing architectural resources
Manage the technical architectural contract terms and conditions
Educate, mentor and coach teams in applying architectural techniques
Facilitate and capture lessons learned from projects to update methodologies and assets
Conduct architectural lunch and learns to disseminate knowledge
Be a recognized as a technical though leader inside and outside of IBM
Support company initiatives for offerings, contracts, technologies, and go-to-market
Set priorities to build technical architectural and project assets/deliverables for repurposing
Outcomes:
Provided professional services (Design, Deployment, Troubleshooting, Assessment)
Provided professional services to reinforce client's security governance, and to improve and manage the client's cybersecurity exposure.
Implementation of clients' technical strategy
Designed and implemented a secure and compliant design and infrastructures solution meeting delivery criteria
Increasing the quality, quantity and frequency of client conversations and engagements for project and implementation services opportunities
Increase the awareness, applicability and value of consulting services with our clients, sales force and delivery organization
Achieve a “trusted advisor” personas as viewed by our clients, seller and delivery organization
Instill a sense of urgency and drive to close consulting practice deals
Maximize the project and architecture practice abilities and capabilities to increase project and solution success
Technology Experience:
Microsoft Azure Cloud
AWS Cloud
Google Cloud
IBM Cloud
Virtualization Infrastructures
Red Hat Openstack, Openshift, Ansible, RHEL
Multicloud Management
Project Experience:
Leading teams towards an outcome and break down impediments
Applied Implementation “Hand on” using best practices to deliver cloud, network and/or security solution.
Applied Mature Architecture design framework, principles and methodologies (high-level technical design, low-level technical design, and technical solution design integration)
Strong Applied Azure Cloud infrastructure engineering and designing skills
Strong Applied Azure Cloud connection and networking to other cloud skills
Strong Applied Azure Cloud and Azure Cloud Connection problem determination skills
Strong Applied Azure Cloud and Azure Cloud Connection performance analytical skills
Strong Applied Azure Cloud Architecture design and best practice Azure infrastructure cloud and connectivity solutions
Strong Applied Azure Cloud Security and CyberSecurity engineering and designing skills
Strong Applied Redhat Openstack engineering, designing, implementation skills
Applied Journey to Cloud Transformations (to IaaS, PaaS, SaaS) strategies and principles
Applied Enterprise Automation strategies and principles
Applied Enterprise Resiliency strategies and principles
Applied Agile principles
Applied Project Management practices
Applied Managed Services principles
Ability to Interpret requirements and create solutions
Ability to Facilitate workshops
Managing technical project workstreams to completion
Ability to articulate key technologies’ impact on security, availability, cost, capacity, transformation, risk, business enablement and transformation objectives
Ability to evaluate risk and merit to make recommendations
Applied Client Facing Ability to understand and provide guidance and recommendations on solutions to address clients’ needs, challenges and transformations
Evaluate risk and merit to make recommendations on available and speculative information
Kyndryl_NorthAmerica
Required Technical and Professional Expertise
Bilingual in English and French.
Canadian Security L2 Cleared.
University graduated in Computer Science, Information Technology, Telecommunications, Electronics & Electricals or any other related field.
CyberSecurity and Firewall Certifications, Accreditations, or Badges
Agile Fundamental Certifications, Badges or equivalent
Azure Cloud Certifications
AWS Cloud Fundamentals
Google Cloud Fundamentals
IBM Cloud Fundamentals
Red Hat Openstack Accreditations
Preferred Technical and Professional Experience
Red Hat Openshift, RHEL, Ansible Fundamentals or equivalent
Terraform and Python Fundamentals or equivalent
MS Windows Server Fundamentals or equivalent
IBM AIX, Linux, RHEL, UNIX Fundamentals or equivalent
VMware and Citrix Fundamentals or equivalent
Oracle Database Management Fundamentals or equivalent
Required Education
Associate's Degree/College Diploma
Preferred Education
Bachelor's Degree
Eligibility Requirements
Must have the ability to work in Canada without sponsorship.
Country/Region
Canada
State / Province
MULTIPLE
City / Township / Village
MULTIPLE CITIES
City / Township / Village 1
CA_QC_MONTREAL
City / Township / Village 2
CA_AB_CALGARY
Being You @ Kyndryl
Kyndryl is committed to creating a diverse environment and is proud to be an equal opportunity employer. All qualified applicants will receive consideration for employment without regard to race, color, religion, gender, gender identity or expression, sexual orientation, national origin, genetics, pregnancy, disability, age, veteran status, or other characteristics. Kyndryl is also committed to compliance with all fair employment practices regarding citizenship and immigration status.
Other things to know
For additional information about location requirements, please discuss with the recruiter following submission of your application.
Primary job category
Consultant
Role ( Job Role )
Associate Partner Incentive
Employment Type
Full-Time
Contract type
Regular
Position Type
Professional
Travel Required
No Travel
Company
(Y009) Kyndryl Canada Limited
Is this role a commissionable/sales incentive based position?
No"
"Software Engineer - Backend - Consul Ecosystem, API Tooling - British Columbia - Indeed.com","About HashiCorp
HashiCorp is a fast-growing startup that solves development, operations, and security challenges in infrastructure so organizations can focus on business-critical tasks. We build products to give organizations a consistent way to manage their move to cloud-based IT infrastructures for running their applications. Our products enable companies large and small to mix and match AWS, Microsoft Azure, Google Cloud, and other clouds as well as on-premises environments, easing their ability to deliver new applications for their business.
About the team
The Consul team, like all of HashiCorp, is fully distributed (100% remote). We have been a remote company since our founding in 2012.
Consul helps organizations automate network configurations, discover services, and enable secure connectivity across any cloud or runtime. The Consul API Tooling team creates critical tools that live outside of the Consul repository for our Consul practitioners and customers. These tools include Consul Template, Consul Terraform Sync, Envconsul and more.
About the role
On the Consul team, we help organizations automate network configurations, discover services, and enable secure connectivity across any cloud or runtime. The customers and large community of users of our tools are operators, infrastructure engineers, and software developers that encounter novel performance, scaling, and usability challenges that we help them solve.
Consul started as an infrastructure management tool for service discovery and health checking, and has evolved to become a full-featured service mesh. You'll be an active contributor to the tooling that supports Consul. At a high level, a subset of what these tools do are: enable our practitioners and customers to dynamically update their network infrastructure devices, monitor services and render templates based off of updates to those services, monitor external nodes and launch subprocesses with environment variables.
You'll be following new developments in emerging technology and competitive offerings, looking for opportunities for product differentiation, and rethinking product architecture to meet new global scale and organizational demands.
In this role you can expect to:
Build and architect distributed systems for the Consul API tools.
Interface directly with internal teams, users and HashiCorp customers, as well as the larger Consul community.
Participate in discussions with product managers and customers to better understand the network topologies, challenges, and constraints for which operators are trying to solve, and leverage those insights when approaching feature design and implementation.
Propose new functionality or substantive changes through written documents in an async process, describing the problem background, proposed implementation and example UX, then iterating on peer feedback collaboratively.
Own the full lifecycle of feature development from design through testing and release.
Program mostly in Golang, learning from and contributing to a team committed to continually improving their skills.
You may be a good fit for our team if you have:
Familiarity with service-oriented architectures, and ideally have worked on an infrastructure or platform team building internal tooling to deploy, connect and monitor them.
Empathy for the people operating, learning, teaching and supporting software you write, and consider their experience when making design decisions and performance, security or complexity tradeoffs.
Experience in a lower-level language like
Go
.
Awareness of the broader service mesh ecosystem and an interest in contributing to a full-featured product offering while reducing complexity and barriers to adoption for practitioners.
Curiosity for academic computer science research, particularly distributed systems papers such as Raft and Paxos variants, and enjoy learning more about the challenges of consistency at global scale.
About the application process
Please note, as collaboration and communication are a critical aspect of how we work, a cover letter is a great way to provide a sample of how you communicate.
In your cover letter, please describe why you're interested in working at HashiCorp, and what draws you to this role in particular. Specifics of your past experience that are relevant to this role are great to include, too.
#LI-TW1
#LI-Remote
HashiCorp embraces diversity and equal opportunity. We are committed to building a team that represents a variety of backgrounds, perspectives, and skills. We believe the more inclusive we are, the better our company will be.
For more information regarding how HashiCorp collects, uses, and manages personal information, please review our Privacy Policy."
