Title,Description
"Content Analyst - Toronto, ON - Indeed.com","Spaulding Ridge is a best-in-cloud advisory and IT implementation firm. We help global organizations get financial clarity into the complex, daily sales, and operational decisions that impact profitable revenue generations, efficient operational performance, and reliable financial management.
At Spaulding Ridge, we believe all business is personal. Core to our values is our relationships with our clients, our business partners, our team, and the global community. Our employees dedicate their time to helping our clients transform their business, from strategy through implementation and business transformation. We hire passionate individuals who have the same values as we do. We look for driven individuals who seek to continue solving client problems and bringing innovative ideas to our team. As a small firm with plans to grow rapidly – you will be given the unique opportunity to provide strategic support to the growth of our company.
What You Will Do
The Junior Technical Writer will create marketing copy and assist with other content-driven assets. This person will be a member of the marketing team but will work with a variety of teams throughout the entire company.
Undergraduate degree in English, writing, communications, marketing or other related major preferred. No work experience is required since this is an entry-level position, but we’d love to see or hear about any projects you’ve worked on during your undergraduate degree, as well as any internships, jobs, or activities that make you stand out.
Responsibilities:
Conduct research for content projects
Proofread marketing materials for the broader marketing team, ensuring quality and accuracy of all copy, as well as retrieve any missing information.
Write content for articles, emails, PowerPoints, and other marketing materials as needed
Brainstorm with the marketing team to create campaigns, email journeys, and other helpful content to promote Spaulding Ridge, our services, and our Partners
Requirements:
Bachelor’s degree required (English, writing, communications, marketing or other related major preferred)
Excellent writing, grammar, and proofreading skills
Loves collaborating and working as part of team, but is also a go-getter and able to work independently
Interested Candidates
Please include a cover letter in your application.
What else to expect
As an employee of Spaulding Ridge, you will part of a company that is providing innovative opportunities to impact our clients in a meaningful way. We believe giving back is core to our values and as part of this effort, you will be given the opportunity to participate in different opportunities throughout the year including SR’s day of service, giving back to our global community. We offer a competitive benefit package, including flexible time off, medical, dental, vision and life insurance and much more.
We take care of you!
Here are some our great perks and top benefits to highlight:
Competitive benefits package, including medical, dental, vision, 401(K) and Life insurance
Flexible Time Off
Paid holiday time
Paid maternity and paternity leave
Spaulding Ridge’s Diversity Commitment
Spaulding Ridge invests in the development of its diverse employees. We appreciate the unique skills and experience that each person brings to the company.
Equal Employment Opportunity
The company is committed to offering Equal Employment Opportunity and to providing reasonable accommodations to applicants with physical and/or mental disabilities. If you are interested in applying for employment with Spaulding Ridge and are in need of accommodation or special assistance to navigate our website or to complete your application, please send an e-mail with your request to our Director of Human Resources, Cara Halladay (
challaday@spauldingridge.com
) Requests for reasonable accommodation will be considered on a case-by-case basis.
Vaccination Policy
Given the travel and onsite work with customers required for this position, applicants must be vaccinated and produce valid proof of vaccination for the COVID-19 virus prior to employment. Proof of Covid-19 vaccination is recognized by either providing a government issued COVID-19 vaccination card or proof of vaccination from your health provider. If you are unable to be vaccinated due to a medical condition or religious belief, please submit a written request to Human Resources for additional consideration, but exceptions will be extremely limited."
"Marketing Intern, TSN - Toronto, ON - Indeed.com","Req Id: 338869
At Bell, we do more than build world-class networks, develop innovative services and create original multiplatform media content - we advance how Canadians connect with each other and the world.
If you’re ready to bring game-changing ideas to life and join a community that values professional growth and employee wellness, we want you on the Bell team.
The Bell Media team creates and delivers the best Canadian and international content across our digital media, television, radio, and out-of-home advertising platforms. We’re looking for innovative team players ready to take some of the most well-known entertainment brands in the country to the next level.
An Internship within the TSN Marketing team will not only provide an opportunity to be an integral part of the marketing department, but will also provide a 360o overview of the TSN business with cross-departmental experiences to further provide a comprehensive understanding of the TSN broadcasting environment. Interns will also have their pulse on the weekly programming and promotional priorities executing a number of on-going marketing, promo & advertising tasks/responsibilities.
Responsibilities:
Working with the TSN Marketing Coordinator, the TSN marketing intern will:
Create in-game promotions for TSN produced events - highlight upcoming key promotional priorities and providing scripting for voiceover (Track content on an on-going basis)
Ensure promotional assets are updated across TSN’s broadcast and digital platforms to convey accurate programming information.
Schedule daily snipes which promote coverage between simultaneous programs across TSN networks
Implement the creation of web banners promoting upcoming network priorities across TSN and external websites. Create and deliver trafficking instructions for digital promotional assets.
Updating schedule for TSN’s outdoor digital billboard with creative and trafficking instructions
Ongoing tracking of creative requests and trafficked assets
Work with TSN Graphics department to create promo assets to run within live TSN broadcasts, studio shows and SportsCentre
Qualifications:
University/College education in sports marketing / marketing
Internship must be a requirement for course credit.
Sports knowledge, keep up with daily sporting events & social media.
Demonstrated collaborative and writing skills
Demonstrated attention to detail
Self motivated, enthusiastic
Ability to meet deadlines and work under pressure
Ability to work well in a team environment
Maturity, strong work ethic, engaged, and openness to learning.
Location:
Agincourt & Work From Home
Length:
16 weeks (January through April 2022)
Hours of Work:
40 Hours/week (9am – 5pm Monday to Friday)
Bilingualism is an asset (English and French); adequate knowledge of French is required for positions in Quebec.
Additional Information:
Position Type:
Non Management
Job Status:
Intern
Job Location:
Canada : Ontario : Toronto
Application Deadline:
11/26/2021
Please apply directly online to be considered for this role. Applications through email will not be accepted.
At Bell, we don’t just accept difference - we celebrate it. We’re committed to fostering an inclusive, equitable, and accessible workplace where every team member feels valued, respected, and supported, and has the opportunity to reach their full potential. We welcome and encourage applications from people with disabilities.
Accommodations are available on request for candidates taking part in all aspects of the selection process. For a confidential inquiry, simply email your recruiter directly or recruitment@bell.ca to make arrangements. If you have questions regarding accessible employment at Bell please email our Diversity & Inclusion Team at inclusion@bell.ca.
Created: Canada, ON, Toronto
Bell, one of
Canada's Top 100 Employers."
"Marketing Manager- Secure Digital Markets - Toronto, ON - Indeed.com","Job Title: Marketing Manager
What We Offer
At Secure Digital Markets (SDM), you can build a career out of making things happen! Secure Digital Markets provides institutions, miners and individuals with a custom pathway to digital asset liquidity and off-exchange transactions. As one of Canada’s largest and fastest growing digital assets brokerage, Secure Digital Markets has streamlined the acquisition and liquidation of digital assets to ensure that all of our customers' needs are met in a secure and compliant manner. This is an exciting time to join our growing team.
We have an interesting opportunity for an ambitious
Marketing Manager
to join our company. Reporting to the Head of Marketing, the Junior Marketing Manager will demonstrate a proactive and creative approach, working in close collaboration with the members of the Marketing Team and other key stakeholders. You will apply creativity, resourcefulness and critical thinking skills to make things happen.
If you possess strong organization and detail skills as well as excellent business acumen, are self-driven and have an outstanding work ethics, we would love to hear from you! Prior experience in finance, institution or heavily channel driven vertical markets is preferred.
This role would be ideally suited for a tech-savvy individual able to self-manage and work independently and remotely, set priorities and efficiently manage day to day processes with a high degree of detail, accuracy, and organization.
Responsibilities & Expectations
Based anywhere in North America or Europe and reporting to the Head of Marketing, you will have direct contact with everyone in your department and in our clients’ teams. You will have the opportunity to take on an ownership role within your department and develop and optimize many of our clients’ marketing processes. Here is a breakdown of what will be expected of you.
Marketing Manager:
Create channel driven marketing campaigns for distribution internally and through channel partners.
Maintain annual conference and exhibition schedule, marketing and follow through.
Network within vertical channels to relevant Key Opinion Leaders and contacts.
Strategize, Oversee and Optimize paid ad campaigns on Social, Banners, Adwords and other advertising aggregators
Support the marketing department's initiatives with the planning, executing, and tracking of marketing programs such as email, event, social media, or content marketing
Manage and develop sales and marketing team collateral needs.
Assist with developing and managing content and social media marketing programs, including blogs and public relations efforts
Evaluate and monitor campaign performance on an ongoing basis by analyzing key metrics and creating comprehensive reports
Conduct market research and identify trends
Identify, plan and prepare for relevant exhibition, show, media and podcast opportunities to promote overall brand development.
Curate the overall voice of the brand to develop our positioning.
Continuously develop and close global partnerships with PR firms, influencers, marketing agencies, design agencies, event management agencies, cryptocurrency exchanges, and social media communities - adding them to a well-organized readily available partner database.
Required Qualifications
Undergraduate degree, preferably in marketing or business
Located in North America is highly preferred
5+ years of post-undergraduate or post-graduate work experience leading at-scale performance marketing programs for digital agencies or client marketing organizations. Preferably in a mid-to-large-sized corporate environment; in banking, finance or blockchain industry
Excellent computer skills including advanced knowledge and competency with Microsoft Excel
Knowledge and experience in setting up and implementing company-wide project management tools, such as Asana
Ability to manage a global remote team, and to handle multiple projects/ clients and marketing campaigns simultaneously
Knowledge and experience in the blockchain and/or traditional financial markets space is a plus.
Ability to handle sensitive and confidential information and issues with tact and diplomacy.
Exceptional organizational and delegation skills
Knowledge in establishing and developing remote work processes and a relevant remote work culture.
Detail oriented with the ability to check documents for accuracy and communicate detailed changes.
Strong interest in coaching and mentoring team members
Highly skilled in learning on the job and continuously learning
Excellent interpersonal, written, and verbal communication skills.
Mature, professional, driven, empathetic.
Compensation
We offer competitive salaries and are committed to see our employees succeed.
Salary Range: 75K CAD
Bonus: Discretionary
Stock Options Plan: Company-wide
Top notch benefits plan
Why Secure Digital Markets (SDM) ?
The level of growth that is expected in the coming years is staggering, and we need the right person to come on board to help support this growth and be a part of our success story.
The number one quality we value is teamwork, and everyone pulls together to give our best. With a focus on continued growth and industry leadership, exciting long term career possibilities are available for the driven energetic team member that joins out team.
Joining SDM today means joining a team of ambitious and caring individuals. Become a key part of our growth by applying today.
Please note, SDM receives a high volume of applicants thus only those selected to move forward in our interview process will be contacted.
SDM
is an equal opportunity employer, we value diversity and are committed to creating an inclusive environment for all employees."
"Manager, Marketing - Toronto, ON - Indeed.com","Summary:
At Greenwin, we believe that everyone deserves a safe, comfortable home. Our apartments add value to the lives of our renters, but it’s our people who make the rental experience extraordinary.
The Marketing Manager is constantly thinking about pushing the envelope when it comes to Greenwin’s position as an innovator in the real estate marketing space. Collaborating closely with our Leasing, Customer Service, Research and Communications teams, this person lives and breathes thought leadership and data-driven thinking. They can identify target audiences and devise digital and traditional marketing activations that engage, inform and motivate. They are able to track and optimize strategies that drive traffic to our website and properties, ultimately optimizing occupancy rates. They keep an eye on the competition and maintain obsessive market oversight to ensure Greenwin’s marketing activities are targeted, curated and best-in-class.
What you’ll get to do:
Enforce brand and information consistency across all platforms, including signage, print ads and online platforms
Conduct regular site tours and provide actionable improvement plans for signage, curb appeal, marketing materials, and overall perception
Develop all site-specific marketing collateral to drive traffic and improve retention
Pitch site-specific media/PR opportunities to Communications Team
Leverage Greenwin Cares initiatives in marketing exercises where relevant
Research potential relationships with key influencers/businesses in collaboration with Communications team
Own and manage Greenwin’s corporate website, including all associated microsites and ILSs
Initiate research, development and implementation of site-specific marketing activations, including paid, owned and earned sales and advertising programs
Develop and implement SEO/SEM/PPC, email and display advertising campaigns to increase online visibility, particularly for “hot-spot” properties; collect quantitative data to measure and report on campaign effectiveness
Build, execute and own monthly digital content calendars that incorporate micro-sites, blogs, social media, videos, photos, graphics and text
Monitor on-site reputation using social listening tools; field inquiries to appropriate teams
Provide monthly reports to department head, including analysis for insights, optimizations and future strategy development
Explore opportunities for additional revenue streams and make strategic recommendations to Operations and Partnership teams
Collaborate with Customer Service Coordinator and Communications team on resident contest development and ideation
Collaborate with Greenwin’s Communications, Leasing, HR and Operations teams to prepare awards submissions
Collaborate with agencies and other vendor partners
Work with Operations team to develop annual marketing budgets for each property
Who you are:
5+ years of experience in a senior-level digital marketing position
Experience leading and managing B2C SEO/SEM/PPC, email and display advertising campaigns
Exceptional writing/story-telling skills, specifically pertaining to writing for the web
Project management experience, with a focus on driving the creative process from ideation through to production
Deep knowledge and understanding of social media platforms (Instagram, TikTok, YouTube, Twitter, LinkedIn, Facebook) and their respective best practices, KPIs, and emerging trends
Experience with social listening tools and software products for inbound marketing, sales, and customer service
Strong knowledge of graphic design tools like Canva, InDesign, Photoshop and Illustrator
Strong analytical skills and data-driven thinking
Ability to effectively lead and execute with minimal supervision
Comfortable “switching gears” or changing focus on a whim
Ability to bring clarity to unclear situations
Driver’s license and vehicle
Greenwin Corp. is an equal opportunity employer committed to building a diverse workforce representative of the communities we serve and providing an accessible environment. Accommodation is available upon request by contacting accessibility@greenwin.ca. We encourage all qualified candidates to apply."
"Marketing Manager - Toronto, ON - Indeed.com","About the job
Volanté is an Enterprise SaaS Point-of-Sale company that prides itself on developing leading-edge hospitality technology. For the past two years, we have made Deloitte’s Fast50 and Fast500 lists, in addition to Growth500’s list of fastest growing companies in Canada. With a never-ending thirst for innovation and an increased workload, we’re calling on Toronto’s top tech talent to join the family! This role will be an addition to our Marketing team, working alongside our Sales, Products and Strategic Accounts teams.
We are searching for a highly-creative and entrepreneurial marketing manager to join our marketing team. In this position, you will be responsible for all aspects of our marketing operations. Your central goal is to help grow revenue by generating qualified leads while also increasing brand awareness and loyalty. You will be a high-impact contributor working in a fast-paced environment, anticipating creative requirements and providing proactive, strategic marketing recommendations.
Your deep understanding of our products and the competitive landscape will make you a trusted partner to sales, business development and account teams. Your duties will include creating and managing content and marketing materials as well as monitoring marketing campaigns across all channels. Our ideal candidate has experience in B2B product marketing, lead generation and graphic design. In addition to being an outstanding communicator, you will also demonstrate excellent interpersonal and analytical skills and thrive in a fast-paced environment.
Key responsibilities include
· Lead the execution of marketing programs from start to finish and own their implementation from ideation to execution leveraging internal support and driving collaboration
· Analyze customer insights, consumer trends, market analysis, and marketing best practices to build successful programs including performing industry and competitive analysis to help with positioning and messaging
· Create, maintain, and conduct analytics reporting across multiple platforms and extract key insights for future campaign development and go-to-market strategies and tactics
· Design, test and evolve lead nurturing tactics
· Develop creative briefs and guide creative direction to meet objectives for all communications, including print, digital, and video assets
· Ensure the alignment of communications and messaging across all channels
· Manage content and updates for customer and internal touch points, establishing budget guidelines, participating in events, documenting business processes, and providing additional sales support
· Identify effectiveness and impact of current marketing initiatives with tracking and analysis, and optimize accordingly
· Lead and ensure the consistency in messaging, branding, content and look and feel of all communications and marketing materials
· Additional marketing-related tasks as required
Required skills and experience
· Post-secondary education preferably in a related field (e.g., marketing, communications)
· Highly proficient in Microsoft Office and Adobe Suite
· Proficient in WordPress
· 5 years of experience in a B2B marketing role
· Strong understanding of digital marketing and campaign management
· A good attitude – you like to have a great time! It’s all about making our customers and partners happy, which in turn will make us happy
What You’ll Get Out Of It
· Work with some awesome, fun-loving, and diverse people!
· Perks – Health, Dental, Vision, Vacation + PTO, Free parking, Company socials, Flexible work hours, Casual office environment, Free snacks and more!
· Career Growth – Goal-setting and open discussions on how Volanté can help you achieve your goals!
· Covid safety measures in place along with remote working
· Meaning out of your work – Everyone’s contributions are critical to our growth and success!
Job Types: Full-time, Permanent
Salary: $31,160.00-$114,023.00 per year
Schedule:
8 hour shift
Work remotely:
Yes"
