Title,Description
Engineering Student (4 months) – Field Operations - Canada - Indeed.com,"Engineering Student (4 months) – Field Operations
- (2111316)
The Opportunity:
Build and expand your practical knowledge through working in a live environment at one of Canada’s largest independent oil and gas producers! You will have the chance to ask questions, develop meaningful relationships and add value. This student opportunity has historically been a 4 month term from May to August, located at one of Canadian Natural’s Western Canadian Operations. As a Relief Operator Summer Student (ROSS) at Canadian Natural you will gain a fantastic learning experience and exposure to a wide range of oil and gas operating systems. Work outdoors for the summer alongside experienced industry professionals on light oil, heavy oil, gas plants, oil batteries, water floods, and pump jacks and join a company culture that fosters a fun working environment!
Key Accountabilities:
Gain insight and experience into how the Oil and Gas industry operates
Utilize your hands-on mechanical aptitude and experience to solve daily problems in an effort to increase and maintain production volumes
Be accountable for light oil, heavy oil, gas, gas plants, and oil batteries
Work with water floods, EOR, pump jacks, and PC pumps
Perform well testing techniques and production reporting
Other Details:
Term length: 4 months
Start: May 2022
Job location: one of our various field locations throughout Alberta, Northern BC, and Saskatchewan
Shift schedule: work in the field is typically one of a variety of schedules such as 8 days on, 6 days off or 7 days on, 7 days off; the schedule may include night rotations
Must be prepared to remain on-call during off-hours
This is a safety sensitive position
Skills & Qualifications:
Currently enrolled in your 1st, 2nd, or 3rd year of an engineering degree program. Chemical, Mechanical, Energy, and Petroleum/Oil & Gas disciplines preferred.
Possess a valid Class 5 Alberta driver’s license or equivalent out of province license and feel comfortable driving work trucks in a safe manner
Strong mechanical aptitude is an asset
Your application must include an uploaded cover letter, resume and transcripts (in ONE document).
Only the selected candidates will be contacted for an interview.
Successful applicants must provide acceptable evidence of being fully immunized against COVID-19 (two doses of Health Canada approved COVID-19 vaccine, plus 14 days after your second vaccination) before a start date can be set.
Why Canadian Natural?
CANADIAN NATURAL is a senior independent crude oil and natural gas exploration, development and production company based in Calgary, Alberta, Canada. Our strong, diversified asset base is comprised of a balanced portfolio of light, synthetic, and heavy crude oil and natural gas. Canadian Natural operates in Canada, the United Kingdom and Offshore Africa.
At Canadian Natural, we strive to live through our mission statement: ""To develop people to work together to create value for the Company's shareholders by doing it right with fun and integrity."" We are committed to a long-term presence in the communities where we operate. Our activities create value by providing employment, business development opportunities, revenues to governments that contribute to spending on goods and services, and essential resources for public services, including health, safety, education and training.
Over the last 30 years, we have grown from a Company with nine employees to over 10,000 employees. We have increased our production from approximately 400 BOE/d in 1989 to more than one million BOE/d today.
Safety is a core value at Canadian Natural. We conduct all of our operations in a way that identifies, minimizes and mitigates harm to the health and safety of employees, contractors, the public and the environment.
Canadian Natural Resources Limited - CNRL - is a publicly traded company on the TSX and NYSE as CNQ
Apply today!
.
Primary Location
Alberta
Other Locations
AB-Fairview, AB-Drumheller, SK-Estevan, AB-Edson, BC-Tumbler Ridge, AB-Bonnyville, AB-Grande Prairie, AB-Slave Lake, SK-Lloydminster, AB-Medicine Hat, AB-Lloydminster, AB-Elk Point, AB-Peace River, BC-Fort St. John, AB-Rocky Mountain House, BC-Dawson Creek
Job
Campus Program & Student Positions"
"Electrical Engineer - Sarnia, ON - Indeed.com","An Electrical / Documentation Engineer that is experienced, detail-oriented to join our growing team. As well as being a key member of the team that further strengthens the foundation of our business, you will have the opportunity to add value that is felt throughout our customer base. The successful candidate will have the opportunity to immediately impact on the performance of the business and will be given exposure to critical orders from sizeable, global customers, becoming an integral member of the Hughes Safety Showers team.
This position will aid the production & service departments and be called upon to review potential non-conformity issues as well as improving information available to both Operations and Sales.
Principal Duties and Responsibilities
Serve as one of the engineering design and technical experts to sales and production teams as well as internal and external customers.
Work directly with the Operations Manager and Hughes Engineering Team to answer questions and resolve issues brought forth Sales and Operations.
Interpret/develop client’s standards and technical specifications to enable the sales team to offer the best solutions to the customer.
Ensure the design output complies with client’s specifications.
Complete datasheets for electrical/instrumentation devices/equipment.
Review and approval of sub-vendor/sub-supplier’s technical quotations (tender package) and evaluate it against projects requirements and client’s specifications.
To transfer electrical designs to 2D CAD drawings, submitting completed drawings to the customers documentation controllers and reviewing returned customer comments and making the relevant amendments.
To provide support to the sales team when quoting for and finalizing orders.
To lead the documentation team when resolving technical queries that arise for the approval process with the end user
To work closely with production team and the purchasing department, providing proactive support during the procurement and manufacturing stages of an order.
To work alongside the Purchasing and quality team for suppler selection and approval.
Assist in various research and development initiatives to identify opportunities for new projects and improved processes.
Communicate and collaborate with operations team and production to ensure process flow of current projects are on time.
Prepare and deliver various engineering-related presentation both internally and externally.
Knowledge, Skills and Abilities Required
An industrial electrical design qualification or similar
Knowledge of 2D AutoCAD and Microsoft Office (including word, excel, outlook)
At least 5 years’ experience in Engineering/Manufacturing.
Experienced in working within high variation, high complexity, and low volume manufacturing environments.
Knowledge of different LV Voltage Levels / Power Supplies (3-Phase and Single Phase)
Able to read and understand electrical schematic diagrams and electrical circuits’ control philosophies.
Able to recognize major devices and their functions in the schematic diagrams including fuses/circuit breakers, contactors, switches etc.
Able to select proper electrical and instrumentation cables and cable glands, familiarity with different types of cables and cable glands as well as different manufacturers
Familiarity with different types of change-over contacts in instrument devices like position switches
Familiarity with control systems and PLC devices, earthing systems, Electrical Trace Tape Heating System & immersion heating systems
Familiarity with Field Instruments such as Switches, Temperature Sensors, Transmitters, etc.
Knowledge of industrial standards such as UL, CSA and Electrical codes are essential. Worldwide marking and approvals of electrical equipment.
Working knowledge of ERP System (Global Shop).
Awareness of ISO 9001.
Organizational competencies and project management skills.
Self-motivated attitude with the ability to multitask and thrive in a timeline-driven environment.
Strong Sense of Urgency.
Ability to work individually or as part of a team
Diligently follow safe work practices for yourself and team members at all times
Working Conditions
Able to lift and carry 30 lbs to waist and over head
Ability to bend, twist, squat, stand and walk up to 8 hours per day.
Ability to sit in an office setting up to 8 hours per day.
Wear all required PPE including: steel toed shoes and safety glasses.
Ability to work in high heat conditions.
The above declarations are not intended to be an all-inclusive list of the duties and responsibilities of the job described, nor are they intended to be such a listing of the skills and abilities required to do the job. Rather, they are intended only to describe the general nature of the job."
"Electrical / Electronics Engineers / Technologists - Pickering, ON - Indeed.com","Located next to Toronto in the GTA, Yorkville Sound is an industry leader with a wide range of professional audio products used primarily in sound reinforcement applications. To expand our next generation of product offerings, we are looking for enthusiastic music lovers with a technical background join our engineering team.
At Yorkville Sound we are passionate about the products we create. Our products are used at home and at small and midsize venues. We have a large product line under brand names such as Yorkville, Traynor and ART.
Yorkville has been creating and manufacturing products in Canada for over 50 years and have been serving Long & McQuade, the largest musical equipment retailer in Canada, along with other distribution partners worldwide. With over 250 employees, most of our products are designed and manufactured onsite in Pickering, Ontario.
If you are passionate about creating new products, we invite you to consider joining our team.
What You’ll Do
Support senior engineering staff on internal manufacturing and design activities
Create, perform or support product verification tests
Creation of engineering documentation and processes
Support production on new product introduction in the factory
What We are Looking For
A strong passion for audio products
You have an Electrical/Electronics Engineering/Technologist degree or a strong technical background with audio products
A willingness for hands-on work in product support and development
A desire for innovation and introducing new technologies
An ability to collaborate and bring new ideas to life
Strong time management and an attention to details
A self-starter able to drive tasks to completion
Ability to effectively work on electrical and mechanical prototypes
What Yorkville Offers
An opportunity to gain skills in a variety of engineering disciplines and technologies (electronics, mechanical design, metal, wood and plastic fabrication, 3D printing, embedded firmware development, DSP)
Extended health care, life, and disability benefit package after three months of employment
Dental plan after 12 months of employment
Optional pension plan after two years of employment, 2% with company match
Profit sharing after two years of employment
On-site fitness facility
Half-day Fridays
We thank all applicants, but due to the volume of applications we receive, we are unable to personally contact each applicant. If selected for an interview, you will generally be contacted within 2 weeks of submitting your application.
Email to apply."
