Title,Description
"Service Desk Analyst I - Markham, ON - Indeed.com","If you’re passionate about being a part of a team that is, committed to the Team Member Experience and driven by innovation and growth, then join us!
The IT Service Desk Analyst, Tier 1 role demonstrates our commitment to the Team Member Experience by providing integral services and support to our communities and their teams.
As an IT Service Desk Analyst, Tier 1 your typical day will impact in the following ways:
Intake of telephone calls, email and portal requests for IT related incidents, problem, service requests and changes; entering them into the Service Desk system, assigning priority, triaging and resolving or escalating to a Tier 2 resource or their manager.
Providing support to end users on a variety of IT related issues by researching, identifying and resolving technical problems.
Tracking and monitoring end user IT related issues to insure timely resolution; following up and communicating frequently.
Installing, maintaining, managing, servicing, troubleshooting and resolving hardware, software, network, operating systems, desktop PCs, printers and laptops issues.
Playing a role in management of Office 365, Active Directory, System Centre Configuration Manager, Anti-Malware and other IT tools, as assigned.
Managing security on business applications such as PCC, Yardi, UltiPro; as assigned.
Playing a role in asset management – ordering, inventorying, and tracking both for hardware and software.
Participating in team projects as assigned.
24/7 on-call once every 3-4 weeks.
Performing other duties as assigned.
Must haves:
Degree or Diploma in a Computer Related Field from a University, College or Technical School.
Minimum 3 years’ experience in the field of information technology.
Minimum 3 years’ experience in a high volume Service Desk Environment assisting users via Phone, Email, or in person.
ITIL knowledge or certifications.
Able to multitask in a fast-paced environment.
Strong communication skills both written and verbal.
Valid driver’s license and access to reliable vehicle.
All applicants must successfully pass the prescribed Criminal Record and Judicial Matters Check.
Roles which will be within Sienna’s Communities on a reoccurring basis will also be required to obtain a Vulnerable Sector Check.
Bonus points for having:
A+, Network+ and Microsoft certifications are an asset.
Act upon your desire to help others and Join Sienna Senior Living as we continue to enhance the lives of those we serve.
For Ontario locations, in accordance with the Accessibility for Ontarians with Disabilities Act 2005, upon request, support will be provided for accommodations throughout the recruitment, selection and assessment process."
Product Designer - Remote - Indeed.com,"Notice:
Several false job solicitations are circulating via email and social media purporting to be official Getty Images communications. While our staff may initially contact you via social media if your experience is relevant to a posted role, we will
never
issue job offers or request personal financial information via social media. Further, all outreach will include the Getty Images’ employee email and phone contact. As a reminder, all career opportunities can be found here.
Covid-19 Company Statement:
Getty Images does not require employees to be vaccinated against Covid-19, but vaccination or testing may be mandated by the relevant local laws with which Getty Images will comply. If this position involves contact with third parties, attendance on site for events, travel and/or work in our offices, those actions will be subject to any to relevant local laws, venue or customer requirements, or travel requirements regarding vaccines or testing (and exemptions thereto).
US Specific:
Getty Images does not require employees to be vaccinated against Covid-19, but vaccination or testing has been mandated by the Biden administration and that mandate applies to our US workforce. If this position involves contact with third parties, attendance on site for events, travel and/or work in our offices, those actions will be subject to any to relevant local laws, venue or customer requirements, or travel requirements regarding vaccines or testing (and exemptions thereto).
Who We Are:
For over 25 years, Getty Images has embraced disruption and change; riding the digital wave to evolve from a fragmented, analog stock photo business into a multi-billion dollar, global e-commerce industry leader and trusted brand. The breadth and quality of our content has always allowed our customers and partners to tell their stories with greater creativity and accuracy, eliciting more emotion and enabling more action.
Help us move the world with images!
Getty Images is the most trusted and esteemed source of visual content in the world available through its industry-leading sites www.gettyimages.com and www.istock.com. The Getty Images website serves creative, business and media customers in almost 200 countries and is the first-place people turn to discover, purchase and share powerful content from the world's best photographers and videographers.
Getty Images works with over 360,000 contributors and image partners to provide comprehensive coverage of more than 160,000 news, sport and entertainment events, impactful creative imagery to communicate any commercial concept and the world's deepest digital archive of historic photography. With
over 440 million assets
, of which over
320 million are digitized
, encompassing the latest global news, sports, celebrity, music and fashion coverage; exclusive conceptual creative images; and the world’s largest commercial archive. New content is added daily, with
8-10 million new assets added each quarter
.
Getty Images offers the most exclusive and unique creative and editorial visual content globally. The breadth and quality of our content allows our customers and partners to tell their stories with greater creativity and accuracy, thereby eliciting more emotion and enabling more action. Getty Images moves the world —whether the goal is commercial or philanthropic, revenue-generating or society-changing, market-disrupting or headline-driving. Getty Images offers the
highest quality and most diverse visual content
, based on industry-leading
expertise and innovation
.
Senior Product Designer - Remote
Duration: Permanent
Location: Remote Canada or US
Start: ASAP
Due to the current conditions and impact of Covid-19, this key position will initially work from home, until such a time we open our offices. At the time of the local office opening, employees and managers will partner to determine the work site location in line with our Flexible working policy.
Who You Are:
You’re an accomplished Product Designer looking for your next challenge. You flourish with close collaboration within cross-functional teams, relishing the opportunity to bring the customer perspective into team reviews and discussions. You’ll draw on all aspects of your design skills as you shift between product design, interaction design, and visual design projects. And you’ll help elevate your team’s work by engaging in regular, constructive critiques as you iterate and collaborate on defining the best possible solution. You’re a confident designer who backs up design decisions with well thought-out rationale and you’re just as comfortable leading projects as you are supporting them.
Your Next Challenge
Influence your team’s roadmap and give to high-level strategic decisions in collaboration with design, product and engineering leadership.
Partner closely within a cross-functional team of designers, product managers, engineers, analysts and researchers to directly impact and drive solutions for problems of large scope and complexity from conception to launch (and then some).
Create thoughtful solutions that consider the entire customer experience journey/narrative.
Bring clarity to ambiguity as you facilitate team discussions and activities, exercising high customer-centric judgment in your day to day design decisions.
Support and mentor team members at varying levels, providing feedback and guidance to help them develop professionally.
Navigate a fast-paced agile environment with team members in different offices by balancing independent self-direction with frequent collaboration and open communication.
Work within an established design system while chipping in to its evolution – crafting consistent, high-quality designs that are both highly aesthetic and easy to use.
Understand and incorporate relevant narratives into proposals and presentations, translating insights into unique solutions.
Tell compelling stories with a solution-selling approach when sharing designs and decisions with internal teams, partners, and senior leadership.
Adopt a culture of feedback by giving and soliciting feedback from other designers, managers, customers and your cross-functional team to continually raise the bar on quality.
What You'll Need
3-4 years of demonstrated ability in Product Design with products that have been released to market.
Excellent communication skills.
Positive, collaborative demeanor with a passion for design excellence.
Broad understanding of end-to-end design and the many skills that fit under the title of Product Designer, with deep expertise in at least two product design subject areas including: interaction design, visual design, information architecture, visual design, and front-end development.
A solid history of outstanding design work and a portfolio of strong examples with stories of how your end-to-end design approach and role led to significant improvements.
Proven ability to lead multiple and distinct projects at the same time.
Ability to balance being a key partner, who is empathetic towards their peers and seeks consensus, with being a strong advocate and champion for design.
Experience growing in an agile/lean development environment.
Mental and Physical Demands:
Frequent communication with others to exchange information.
Occasionally moving objects up to 20 lbs and frequently moving objects up to 10 lbs.
Frequent sedentary work that primarily involves sitting/standing; Time of each will vary.
Constant operation of computer and frequent usage of other office machinery, including (but not limited to) calculator, copy machine, computer printer, etc.
Constant assessment of accuracy and thoroughness of the work assignment.
Leadership Principles
As a company, we're committed to living these Principles every day. Here's how we support our mission to be the best place to work globally.
We are trustworthy, transparent, and honest
We love character, authenticity, and integrity.
We always raise the bar
Excellence is our norm; we get better through endeavor, curiosity, and speed.
We collectively bring solutions
We love debate, but collaborating to solve problems for ourselves and our customers is everyone’s responsibility.
We care, are kind, courteous, and respectful
We will not tolerate rudeness.
We reject biased behaviour and discrimination
We seek to understand biases in all forms. We call out biases and discrimination when observed and take action where responsible.
We are inclusive of different voices, perspectives, and experience
Diversity and inclusion are never done, but we are passionate in their pursuit.
We are one Getty Images with no silos
We share goals and accountability; we and actively seek information and expertise; we make time for our peers.
We deliver on our commitments, and commercial goals
With one voice and shared accountability.
We put the customer at the heart of everything we do
We listen to, anticipate, and exceed customer needs, adapting as they evolve.
We celebrate our inclusive work environment and welcome members of all backgrounds and perspectives. Women, gender-nonbinary, people of color, LGBTQIA+ people and people with disabilities are encouraged to apply.
Getty Images is committed to providing Reasonable Accommodations and will work with you to meet your needs. If you are a person with a disability and require assistance to search for a job opening or to submit an online application, please email
RecruitingAccommodations@gettyimages.com
.
Visit Getty Images at
www.gettyimages.com
to learn more about how the company is advancing the unique role of still and moving imagery in communication and business, and enabling creative ideas to come to life.
For company news and announcements, visit our
Press Room
, and for the stories and inspiration behind our content, visit
Stories & Trends
.
Find Getty Images on
Facebook
,
Twitter
,
Instagram
,
LinkedIn
,
Pinterest
and
Tumblr
,
or download the
Getty Images app
where you can explore, save and share the world's best imagery.
Getty Images is an equal opportunity employer. All qualified applicants will receive consideration for employment without regard to age, ancestry, color, family or medical care leave, gender identity or expression, genetic information, marital status, medical condition, national origin, physical or mental disability, political affiliation, protected veteran status, race, religion, sex (including pregnancy), sexual orientation, or any other characteristic protected by applicable laws, regulations and ordinances. Getty Images believes that diversity is critical to our success in moving the world with images and is committed to creating an inclusive, mutually respectful environment which celebrates diversity. We seek to hire on the basis of merit, competence, performance, and business needs."
"QA Analyst for Automation - Toronto, ON - Indeed.com","OTT Financial Group is the parent organization of a group of financial services and investment companies. We leverage cutting-edge fintech innovations to bring excellent financial advice and best-in-class wealth management to our customers and business partners. Empowering 5,000+ merchants and hundreds of thousands of individual clients across Canada, we are the home to a wealth of expertise in forex and securities trading, mobile and cross-border payment, and investment fund management.
We are ambitious, results-focused, and forward-looking. At OTT, you’ll get numerous opportunities to learn and grow, alongside a cohort of talented people from diverse backgrounds and industries. Tackling business challenges in a collaborative and innovative environment, you’ll be encouraged to be your best self and make a meaningful impact.
The E-commerce division of OTT Financial Group has been working with Internet giants and financial service providers such as Alibaba, Tencent, and China Union Pay, as well as well-known local payment technology companies in North America. We are committed to building an e-commerce and financial services ecosystem serving our clients and merchants covering daily life needs from all angles. Innovators and dreamers, especially those with specialized skills in IT, artificial intelligence and market development are welcome to join us to achieve our common success and vision.
We are currently looking for one (1)
QA Analyst
for Automation
to join our growing E-commerce Team in Toronto! You will be involved in many exciting and innovative projects designed to the industry forward and enhance our clients’ experience.
Responsibilities
Build test automation framework, as well as play a part in Creating, Executing, debugging, and maintaining automation test scripts to be used by the entire Agile squad
Develops and maintains functional test cases, system & integration test cases and test artifacts like test data, test cases and automated scripts used in SDLC
Reviews functional requirements and determines the data requirements for executing the use cases end to end from creating functional manual cases to automating the cases for regression
Design, develop, execute automation scripts using Selenium and/or Appium and/or Katalon Studio and/or Postman and analyze automation test results.
Expertise in Selenium, Python or Java
Executes automated test cases that validate the functionalities, code quality and reports test results, following all formal test architectures and project processes
Improve system integration efficiency and performance
Diagnose problems and report bugs and enhancements to the Agile squad
Requirements:
Bachelor’s in Computer Science, Engineering, Information Systems, or related experience
2+ years of experience with Agile and Scrum methodologies in software development
3+ years of test automation experience developing and maintaining automated test cases at various levels; API, front-end UI, etc.
3+ years of experience writing automated tests using Selenium( Java or Python)
Experience designing and implementing testing tools and systems is an asset
Experience testing and working with multi-browser and mobile application platform
Advanced experience with Java testing frameworks, like (e.g., Apium, Junit, TestNG and others)
Extensive experience with API testing tools (e.g., Postman and others).
Experience with a performance test, monitoring and metrics collection tools.
Using bug tracking and test case management tools (JIRA)
A self-motivated quick learner
A team player with excellent interpersonal skills
Ability to work independently with minimal supervision
Strong written and oral communicator
Fluency in English and Marian are mandatory
Nice to have:
Experienced with web and mobile automation testing, using tools such as Katalon Studio
Experience in E-commerce Application automation testing
We provide a comprehensive compensation package and a variety of opportunities for you to grow in a dynamic, collaborative, progressive, and high-performing team. Apply now to unleash your full potential.
We thank all applicants for their interest; however, only those candidates selected for an interview will be contacted.
Accommodations for job applicants with disabilities are available upon request."
"ENTERPRISE SYSTEMS ANALYST TECHNOLOGY SERVICES REGULAR, FULL TIME - New Westminster, BC - Indeed.com","Date:
September 9, 2021
Competition: #21-28B
APPLICATIONS ARE INVITED FOR THE FOLLOWING FULL-TIME REGULAR POSITION
Position: Enterprise Systems Analyst
Division: Technology Services
Location: New Westminster Campus
Reporting To: Senior Manager, Enterprise Systems
Justice Institute of British Columbia:
Justice Institute of British Columbia (JIBC) is Canada’s leading public safety educator with a mission to develop dynamic
justice and public safety professionals through its exceptional applied education, training and research. JIBC offers
internationally recognized education that leads to certificates, diplomas, bachelor’s degrees and graduate certificates;
exceptional continuing education for work and career-related learning and development; and customized contract
training to government agencies and private organizations worldwide. Each year, over 36,000 students study at one of
JIBC’s six campuses in B.C., through online education, and at locations in more than 150 BC communities, as well as sites
across Canada and around the world. Our education contributes to safer communities and a more just society by
providing professionals with the knowledge, skills and abilities to excel at every stage of their careers and make a
difference every day.
Summary:
Under the general direction of the Senior Manager, Enterprise Systems, the Enterprise Systems Analyst is responsible for
assisting with the design, creation, research, implementation and management of JIBC’s critical and non-critical
applications, in order to support the organization’s business needs and to ensure security and integrity of data across all
platforms.
Primary Responsibilities:
Develops, implements and maintains processes, procedures, standards and methodologies necessary to support
application management activities;
Understands key technical environments to effectively identify integration, security, scalability and performance
requirements;
Project manages application and systems projects and supports system implementation initiatives using project
management disciplines;
Maintains and supports Unit4 Business World application environments and supports Finance staff in operational
activities;
Applies change management disciplines when making changes to system structures, business process and
application enhancements;
Provides technical support of applications, and general troubleshooting to all the schools/academies/divisions at the
JIBC;
Communicates with stakeholders of varying technical ability and subject matter expertise;
Analyses the impacts of proposed changes to technology services and or processes;
Primary Responsibilities (continued):
Provides technical expertise, advice and consultation to peers and others, including senior managers of the
organization regarding Applications, Student Information, Finance, Database and Learning Management Systems;
Maintains security and disaster recovery procedures with respect to business applications and databases;
Evaluates the performance of new technologies and recommends changes to improve operational performance of
applications and databases;
Provides technical expertise, advice and consultation to peers and others, including senior managers of the
organization regarding applications and database systems;
Participates in the coordination of IT activities with other Colleges and institutions, software vendors and in the
management of vendor contracts;
Develops and implements procedures that will ensure accuracy, integrity, completeness, and timeliness of data
stored in production databases;
Assists in monitoring performance of mission critical applications & databases and responding to degradation of
performance issues to ensure targets are being met. Identify areas of improvement to supervise and coordinate
implementing those changes;
Ensuring SQL (MySQL & MS SQL) databases are able to serve front ends (PHP, C#, SOAP, JavaScript, JQuery, Ajax)
applications and web services;
Maintains a comprehensive library of all supporting documentation and initiates corrective action to ensure all
database servers meet or exceed processing requirements for performance and reliability;
Performs database management activities including device and storage allocations, monitoring, security, integrity
checks, indexing, re-organizations, capacity planning, backups/restores and scripting;
Assists with Data Warehouse and Data Mart development and maintenance activities;
Participates as a member of the Enterprise Systems Team on projects and day-to-day activities, as required;
Assists with the installation of Infrastructure to host applications, databases and utilities;
Installs, tests and implements application and database releases in Development and Production environments;
Keeps abreast of technology, Enterprise Resources Planning (ERP) tools, techniques and related technologies;
Conducts workflow and gap analysis for operational support processes;
Other related duties, as assigned.
Qualifications & Requirements:
• A degree in Computer Science or related discipline, with a minimum of 5 (five) years’ current experience in database
development and application maintenance in an evolving environment where security and operational maintenance
is required; or an acceptable equivalent combination of education, training and experience;
Successful completion of at least one accounting course at an accredited Canadian post-secondary institution, as
well as minimum of 2 (two) years of experience supporting an enterprise financial system, or an acceptable
equivalent combination of education and experience. Please note, if the successful candidate has not completed a
post-secondary accounting course, one must be successfully completed within the first six months of employment;
Certification or demonstrated knowledge the following technologies; T-SQL & Database Administration, MS SQL
Server, ASP.Net, Visual Studio.NET, data security methodologies, relational database management, business
intelligence, SDLC, web services, and application lifecycle management;
Ability to assess the business needs of the organization and understand the impact of system changes in a complex
integrated systems environment;
Must have an affinity to effectively and efficiently communicate and translate business requirements into technical
requirements;
Must be a self-directed team player with strong collaboration, analytical and report writing skills, as well as excellent
interpersonal and organizational skills;
Knowledge of ITIL frameworks is an asset.
We offer a total compensation package that includes Extended Health and Dental Benefits, and enrollment in the
Municipal Pension Plan after six months. In addition, we offer 15 vacation days annually (pro-rated in first year), as
well as generous other leave entitlements.
Salary Range: $65,440 to $74,746 annually
(BCGEU Salary Grid 25) based on a 35 hour work week
Posting Date: September 9, 2021
Closing Date: Open until Filled
Please submit a resume/CV, cover letter and copies of academic credentials, quoting Competition #21-28B,
via email to hr@jibc.ca.
Please feel free to contact Mike Fabri (mfabri@jibc.ca) for more information about this position.
Justice Institute of British Columbia is an equal opportunity employer and is interested in broadening the
diversity of its staff. We encourage applications from visible minorities, Indigenous people, and persons
with disabilities."
