Title,Description
"Digital Marketing Specialist - Vancouver, BC - Indeed.com","Who we are
Recognized as one of Canada’s fastest-growing companies, Lumen5 is an online video creation platform powered by machine learning and designed for businesses, brands, and creatives.
Launched in 2017, our mission is to make video marketing accessible to everyone. We believe that video is the most powerful tool for storytelling, but not everyone has the skills or resources required to produce thumb-stopping videos. We created Lumen5 to solve this problem.
We currently have over 700,000 users and work with notable brands including Salesforce, SAP, Siemens, and The Economist. Our company has won growth awards from Canadian Business and the Globe and Mail, and we were crowned the winner of the New Ventures BC Competition 2019 which recognizes innovation in BC’s tech sector.
We now have our sights set on revolutionizing how businesses create video and we’re looking for like-minded folks to join us in elevating Lumen5 to the next level.
What we're looking for
We're looking for a Digital Marketing Specialist that is both creative and data-driven to scale our growth strategy and drive results and new business through paid channels, PPC, and email.
You’ll monitor and manage Lumen5's advertising platforms and track the performance of each digital campaign. As a Digital Marketing Specialist, you’ll bring advertising expertise and a go-getter attitude to Lumen5 in order to work effectively with and build an efficient user funnel with other teams in the organization, including, UX/Design, Engineering, and Sales. You will report directly to the Head of Growth and have a major hand in scaling Lumen5's user acquisition.
What you'll do
Create, maintain, and optimize successful PPC campaigns to drive new sales using paid search and social (Google Ads, Facebook, Microsoft ads, and more): Strategize, develop, implement, launch and monitor PPC campaign
Identify performance targets, project milestones, and resource needs.
Monitor the overall performance of paid search and social efforts and report key indicators.
Track, report, and, analyze website analytics and PPC initiatives and campaigns.
Manage ad-spend budgets, keyword list management, and oversight of ad copy.
Conduct keyword research and analysis to provide keyword recommendations, audience targets, and measurement criteria.
Perform competitive audits of paid search campaigns including positioning, bids, and messaging tactics.
Develop ad and email copy and lead ongoing optimization efforts and refreshes for campaign success.
Experiment and A/B test new messaging, positioning, and new offers through email campaigns
Support paid content amplification efforts - how can we get more engagement and downloads to our whitepapers, subscribers to our podcast, and readers to our blog
Implement Google Tag Manager Scripts in order to track new events on the website.
Strategize, create and deploy creative campaigns on new ad channels such as Reddit, TikTok, etc, as well as inform us which channels we should test!
Experience & Skills
2+ years experience in Performance, Digital, or Growth marketing
Experience managing large ad budgets
SEO/ SEM background
Proficient with Excel/Google Sheets, data analysis
Proficient with social media platforms
Bonus points if you have:
Google Analytics, AdWords certification
Experience with Mixpanel, html/css/javascript
Compensation
The starting salary band for this role for candidates
at the targeted skill and experience level
is $58,790 - $69,080.
Our compensation structure is market-based, and we pay fair market rate for all roles. We value transparency, which is why we share our starting salary bands for all roles at Lumen5. Starting salaries will vary within this range based on experience and skill level.
Why Work for Lumen5?
Impact
Global significance - Our product reaches millions of people around the world. You’ll be a part of something genuinely impactful and exciting. Uncharted territories - We’re using machine learning to assist with human creativity, making for plenty of fascinating technical challenges. Small team, big influence - When you talk, we listen. Opinions will always be heard, and we empower our team to act as owners and leverage outcomes.
Progress
Work with the best - We don’t toot our own horn often, but we will say that our team is built of experts in cutting-edge fields. Learn from industry leaders in business, product, and engineering (AI, NLP, Computer Graphics). Learn and grow - Our team thrives personally and professionally through competitive benefits, career development opportunities, and a $2,000 per year learning budget for every employee.
Connections
Get to know everyone - It’s the relationships and bonds we form that make our workdays exciting and meaningful. We cultivate and nurture high-quality relationships at Lumen5 and within the local community.
Join a company that’s got your back
Rest and recharge.
Every employee gets four weeks of vacation
Health = happiness.
We have unlimited personal and sick days, allowing you to take care of your physical and mental health. We offer full medical, dental, and generous paramedical.
Flexible work environment.
Our office in Vancouver or your home, at a time that suits you.
Family first.
Generous parental leave, so you can relax with your little one and have peace of mind.
Bring your authentic self.
We’re committed to supporting diversity, equity, and inclusion through initiatives like our pay equality program and D&I employee group.
Hotline bling.
We’ll cover your cellphone bill, no sweat.
Donation matching.
You have causes that you care about. We’ll help your donations go that little bit further.
Self-improvement.
Want to get stuck into the latest business book, attend a conference, or take a course? We’ve got you covered with a $2,000 learning budget each year.
Tech.
Whether you’re Apple, Windows, Linux, or otherwise — we’ve got your tech covered.
Music.
Free jams, on us! We’ll cover your music streaming service of choice.
✨ Lifestyle.
Monthly spending account for your health & wellbeing, whatever that means to you.
Joining Lumen5 means that you’ll surround yourself with smart, creative individuals and work on a product that reaches millions of people around the world. We celebrate our differences and encourage those from marginalized communities to apply."
"Commercial Marketing Assistant - Toronto, ON - Indeed.com","Commercial Marketing Assistant – Contract 2021-22
Reporting to the Director of Commercial Marketing Strategy, this role will assist in the creation and execution of marketing materials to promote the sale of Unilock products for use in commercial projects. Targeting architects, landscape architects, engineers and commercial property owners, the Commercial Marketing Assistant will support the efforts of in the field commercial sales representatives in the U.S. and Canada with wide variety of marketing initiatives.
Our ideal candidate has a passion for marketing and an understanding of architectural sales or construction industry, marketing tactics and operations. If you are a multi-talented individual, with outstanding writing and verbal skills, who thrives in the details, we’d love to learn more about you.
About Unilock
Unilock was the first company to introduce the concept of interlocking segmental paving stones to North America in 1972 and continues to lead the industry with proprietary manufacturing technologies and designs for outdoor pavers and walls.
Unilock products are relied on by architects, landscape architects and engineers to create world-class commercial spaces across North America, as well as by homeowners and contractors for residential projects.
A family-owned, Canadian company, the Unilock corporate headquarters is located in Toronto Ontario with six regional operations located in New York, Boston, Chicago, Cleveland, Detroit, and Georgetown Ontario.
The corporate marketing group operates as a shared service which provides strategic marketing leadership and supports the business efforts of the six regional offices, each with its own General Manager and financial targets.
Job Description
Support the marketing director and team with project organization
Update and maintain online and digital resources, including but not limited to website, collaborative platforms, CRM leads system and external sources
Perform administrative tasks to ensure the functionality of marketing activities
Compile and produce marketing, lead and direct mail reports
Create, maintain and/or coordinate production of digital marketing initiatives
Coordinate various advertising media schedules and placement for both digital and print
Assist in the development, execution and analysis of market research and program evaluations.
Support the development of product education webinars, workshops and presentations
Support logistics of trade shows and events
Qualifications
University or college degree, ideally in a business and/or marketing program
1-2 years of Marketing experience
An understanding of the architectural or construction industry and the decision-making processes
Proven ability for research, analysis, fact-finding and copywriting
Strong communication, time management, planning and organizing skills, and attention to detail
Ability to work independently and as part of a team
Creative skills and experience in graphic design including proficiency in Adobe Creative Suite - InDesign, Photoshop, Illustrator, Bridge.
Strong computer skills including proficient use of Microsoft Office specifically Outlook, Word, Excel, PowerPoint, SharePoint and Dynamics
Contract length: 12 months
Job Types: Full-time, Contract
Salary: $45,000.00-$50,000.00 per year
Benefits:
Work from home
Schedule:
8 hour shift
Day shift
Monday to Friday
Work remotely:
Yes"
Social Media Content Transcription - Iraqi Arabic - Canada - Canada - Indeed.com,"Basic Information
Description and Requirements
Project Overview:
TELUS International AI is currently looking for transcribers who speak Iraqi Arabic at a native level, are fluent in English and are living in Canada to listen to short audios and type down what is heard.
Additional detailed guidelines will be provided to all selected annotators at the beginning of the collaboration.
Social Media Content Transcribers will work remotely from the comfort of their own home on a self-directed schedule.
Work Schedule:
Expected Project Duration: beginning of December 2021- February 2022
Work from home on self-directed schedule
Requires consistent participation during weekdays (Monday-Friday) at minimum 4h per day (20h/week)
Requirements:
18+ years old
Native level of Iraqi Arabic
Fluency in English
Availability for consistent participation (during weekdays Mon-Fri, minimum 4h per day)
Attention to detail and ability to follow guidelines
Previous experience in transcription and/or annotation is a bonus
Recent computer/laptop and headphones
Stable Internet connection
Preferably active user of social media
Compensation:
16 USD per hour - 20 USD per hour
Payment rate will depend on the task type you will be assigned to
Additional Job Description
TELUS International AI is currently looking for transcribers who speak Iraqi Arabic at a native level, are fluent in English and are living in Canada to listen to short audios and type down what is heard."
