Title,Description
"electrical engineer - Ayr, ON - Indeed.com","Area of Work Experience
Specification or technical writing
Quality assurance or control
Project management
Project planning
Operations or production
Installation, maintenance and inspection of equipment or facilities
Design
Computer software development
Business Equipment and Computer Applications
AutoCAD
Networking hardware
Supervisory control and data acquisition (SCADA) system
MS Office
Program programmable logic controllers (PLCs)
Power Line Systems, computer aided design and drafting (PLS-CADD)
Communication Protocols
WAN
LAN
Additional Skills
Supervise technicians, technologists, programmers, analysts and other engineers
Area of Specialization
Plant maintenance engineering
Industrial robotics
Computer design
Communications
Electrical
Control system
System integration
Work Setting
Electrical or electronic equipment manufacturing
Specific Skills
Supervise and inspect the installation and operation of electrical and electronic systems and equipment
Prepare material cost and timing estimates, reports and design specifications
Develop maintenance and operating standards for electrical and electronic systems and equipment
Design electrical and electronic components, systems and equipment
Conduct feasibility, design operation and performance research of electrical generation and distribution networks
Investigate electrical or electronic failures
Conduct micro or nanodevices simulations, characterization, process modeling and integration in the development of new electronic devices and products
Transportation/Travel Information
Own vehicle
Willing to travel
Valid driver's licence
Travel expenses paid by employer
Willing to travel internationally
Work Conditions and Physical Capabilities
Fast-paced environment
Work under pressure
Attention to detail
Combination of sitting, standing, walking
Tight deadlines
Ability to Supervise
5-10 people
Computer and Technology Knowledge
Programmable logic controller (PLC)
Personal Suitability
Effective interpersonal skills
Accurate
Team player
Excellent oral communication
Client focus"
"Engineer MW5/SE4 - White Rock, BC - Indeed.com","Fraser Health continues to be recognized as one of
BC's Top Employers
, come join our team!
Fraser Health is responsible for the delivery of hospital and community-based health services to over 1.9 million people in 20 diverse communities from Burnaby to Fraser Canyon on the traditional territories of the Coast Salish and Nlaka’pamux Nations. Our team of nearly 40,000 staff, medical staff and volunteers is dedicated to serving our patients, families and communities to deliver on our vision: Better health, best in health care.
We hire great people for outstanding jobs. We are searching for a
Full Time Engineer MW5/SE4
to provide support within our Plant Services and Construction department at
Peace Arch Hospital
located in
White Rock, BC.
If you are someone who is looking for a rewarding challenge, then this is the ideal position for you!
Position Highlights:
Under the direction of the Chief Engineer or delegate, operate and maintain a variety of computerized building automated systems; operate and maintain the facility HVAC systems, emergency power systems and other utilities; perform operational and maintenance duties associated with buildings, equipment, furnishings and grounds as required.
This is your opportunity to:
Operate and maintain a variety of computerized building automated systems.
Perform preventative maintenance on computerized building automated systems by testing.
Operate steam and heating boilers/air conditioning systems by starting up and shutting down boilers and related pumps, fans, air compressors and chillers.
Test and maintains auxiliary power generators and repairs/adjusts as required.
Follow a preventative maintenance program by inspecting, servicing or overhauling a variety of Hospital equipment and machinery.
Your qualifications include:
Certificate of Competency as a 4th class Power Engineer recognized by the Province of B.C.
Two years' recent related experience or an equivalent combination of education, training and experience.
Valued Benefits
A career with Fraser Health will offer you the opportunity to be a part of a dedicated team of experts in a dynamic and rewarding health care environment. We offer a competitive compensation and benefit package, including comprehensive health benefits coverage.
Take the next step and apply so we can continue the conversation with you.
Come work with dedicated health care providers who are hardworking and committed to provide quality healthcare to our clients/patients/residents. We invite you to find out why more than 95% of new employees recommend Fraser Health as an excellent place to work. Work hard and have fun while you do it.
Curious to learn what it’s like to work here? Like us on
Facebook
(@fraserhealthcareers), follow us on
Twitter & Instagram
(@FHCareer), or connect with us on
LinkedIn
(fraserhealthcareers) for first-hand employee insights."
"NG22 - Junior Piping Engineer - Mississauga, ON - Indeed.com","Requisition ID:
47794
Job Category:
Metals
With over six decades of business and technical experience in the mining, energy, and infrastructure sectors, we understand that challenges are changing rapidly in every industry. We respond quickly with solutions that are smarter, more efficient, and innovative. We draw upon our 9,000 staff with experience in over 150 countries to challenge the status quo and create positive change for our clients, our employees, and the communities we serve.
Hatch has been serving the world’s mining and metals industry with studies, design, engineering, development of innovative technologies, and project and construction management through to commissioning and operations for both greenfield and brownfield facilities.
As the mining industry faces new challenges, our focus is on innovation. Join us in helping our clients create measurable improvements to their operations throughout the entire mining lifecycle value chain.
Title: Mechanical/Piping EIT (High Pressure Metallurgy) - Mississauga
Position Summary:
The Hatch Metals & Mining group is seeking a Mechanical EIT with an interest in High Pressure Metallurgy. Reporting to the High Pressure Metallurgy Lead Mechanical or Lead Piping Engineer, you will support projects locally and globally based out of our Mississauga Head Office location.
What Will a Career at Hatch Offer You:
You will:
Be given opportunities to contribute to complex projects around the world in meaningful ways
Work on problems and gain experience in the office and on project sites when applicable
Collaborate with diverse teams locally and globally
Work in an exciting environment where you can apply your academic learning on a daily basis
Gain relevant experience and support in obtaining your professional designation
Benefit from formal and informal mentorship from some of the leading minds and authorities in the industry
Participate in local Professional Development Programs, Sustainability Week, Toastmasters, and more to develop your skills
Join in charitable, social, and sports activities with other Hatch employees
We’re entrepreneurs with a technical soul. Our flat organizational structure creates an atmosphere of openness and participation. We build practical solutions that are safe, innovative, and sustainable. Our ultimate goal is to achieve no harm for our people, our clients, and our communities.
General Responsibilities:
Assist in studies for various commodity related projects, including projects involving proprietary high pressure and high temperature autoclave technology for extraction of copper, gold, silver, nickel, alumina and other metals.
Preparation of design calculations, documentation and development of equipment/piping calculations and technical specifications for purchase of a wide range of mechanical and piping related equipment.
Evaluate Process Alternatives and/or Equipment/Technology Selection trade-off studies.
Participate in equipment design reviews and plant layout developments.
Perform mechanical/piping equipment sizing, and provide input to drawings, prepare process equipment data sheets, and specifications including technical details and duties as required.
Participate in process hazard review studies (e.g. HAZID / HAZOP)
Prepare technical reports and presentations.
Working with the project team to provide input to capital and operating cost estimates.
Providing technical input/direction and assigning work to designers, technicians and others, as required for various projects.
Liaise with clients, equipment suppliers/vendors, contractor representatives and/or project field personnel as necessary to assist with meeting key project deliverables.
Specific Mechanical Role Responsibilities:
Evaluate suitable Materials of Construction (MOC) for various pieces of process mechanical equipment (pressure vessels, heat exchangers, flash vessels, agitators, tanks, pumps, process piping, etc.)
Ensuring mechanical process equipment specifications portray the appropriate information and process design intent.
Potential to specialize in Finite Element Analyses (FEA) to perform thermal and stress analysis of different equipment and components.
Specific Piping Role Responsibilities:
Model piping systems using hydraulic design tools such as AFT Fathom, Impulse and Arrow for incompressible, viscous, and compressible fluids.
Design Piping and Instrumentation Drawings (P&ID).
Specialize in piping systems and inline component specification and design, including: ANSI and Slurry pumps, manual and automated on/off valves, pressure safety relief valves, piping stress analysis, etc.
Education and Experience:
Must be working towards graduating in 2022, or recently graduated, with a Mechanical Engineering degree from an accredited University.
Excel academically while being actively involved in extra-curricular and/or volunteer activities at school or in the community.
Previous coop or summer work terms within a mechanical engineering team is an asset.
Academic or work experience with mechanical/piping equipment design related to metallurgical process equipment and piping, including ASME pressure vessel, piping and heat exchanger design, tanks, and/or other process equipment is an asset.
Willingness and ability to travel to project sites including remote sites.
Competencies (knowledge, skill, attributes):
Good understanding of engineering and business fundamentals as they apply to engineering problems and projects.
Ability to learn quickly and to take on new challenges.
Collaborative team player with excellent interpersonal skills.
Excellent organizational skills and attention to detail.
Strong written and verbal communication skills.
Shows critical and creative thinking and problem solving, and brings forward solutions for our clients' toughest challenges.
Adapts and embraces change.
To be considered you must submit a Resume, Transcript (official or unofficial) and a cover letter.
We are committed to fostering a workforce in each of our locations that reflects the diversity of the communities in which we operate. Hatch is an Equal Opportunity Employer that considers employment applicants without regard to age, race, colour, national origin, citizenship, religion, creed, sex, sexual orientation, marital status, disability or any other protected status. If you have any special needs requirements, please let us know. We will do our utmost to accommodate, in accordance with applicable local legislation."
"Process and Manufacturing Engineer - Newmarket, ON - Indeed.com","Company description
GPI Biotech is a food ingredients manufacturer that specializes in natural anti-microbials for the food processing sector.
Job description
Purpose: The Process and Manufacturing Engineer is responsible for commissioning and managing a manufacturing plant that produces biochemical products for the food ingredients industry.
1) Assist with the design and commissioning of a food ingredients manufacturing facility.
2) Review layouts for existing and new products. Make recommendations for process flow, product assembly and equipment.
3) Develop and manage projects to reduce cost, improve efficiency and increase profit.
4) Maintain product quality of all products produced and sold by the Company by coordinating, planning and implementing all Quality assurance and Quality Control procedures and policies
5) Implement GMP (Good Manufacturing Practices), Total Quality Management and Waste Minimization to ensure that the plant stays within internationally recognized Food Processing standards
6) Perform analytics and ad hoc analyses.
7) Provide support on existing tasks as required.
Minimum Education and Certifications required: Successful completion of an undergraduate degree in Engineering or equivalent. Minimum 5+ years experience within Process Engineering, Biochemical Engineering or Manufacturing Engineering or a related field. Experience with food manufacturing is a plus.
Experience and Skills: Has excellent communication skills. Ability to work effectively independently or as part of a team. Ability to pay attention to detail. Proficient with AutoCAD and Microsoft Office applications.
Physical requirements and working conditions: Office and production environments
Reference ID: 211102 Process and Manufacturing Engineer
Application deadline: 2021-12-01
Expected start date: 2022-01-03
Job Types: Full-time, Permanent
Salary: $54,814.00-$108,917.00 per year
Additional pay:
Bonus pay
Benefits:
Dental care
Paid time off
Vision care
Schedule:
8 hour shift
COVID-19 considerations:
A temperature check and Covid questionnaire must be filled out daily as part of our food safety program. Personal Protective Equipment (PPE) is required in the production area. Masks are required in public office spaces.
Ability to commute/relocate:
Newmarket, ON: reliably commute or plan to relocate before starting work (preferred)
Education:
Bachelor's Degree (preferred)
Work remotely:
No"
"Junior Engineer - Thornhill, ON - Indeed.com","WSP
is one of the world's leading professional services firms. Our purpose is to future proof our cities and environments.
We have over 48,000 team members across the globe. In Canada, our 8,000+ people are involved in everything from environmental remediation to urban planning, from engineering iconic buildings to designing sustainable transportation networks, from finding new ways to extract essential resources to developing renewable power sources for the future.
The excellence we bring to our work and to our workplace has been recognized far and wide. We are among the LinkedIn Top 25 Companies two years in a row, one of the Top 100 Sustainable Companies in the World (and among the Top 10 in Canada), and we earned Platinum Elite Recognition through our participation in more than half of Canada's Top 100 Infrastructure Projects.
At
WSP
:
We value our people and our reputation
We are locally dedicated with international scale
We are future focused and challenge the status quo
We foster collaboration in everything we do
We have an empowering culture and hold ourselves accountable
TORONTO
WSP is currently looking for a Junior Engineer (Electrical/Mechanical) to join our Rail and Transit department, located at our construction site offices of a major LRT project. Reporting to the Department Manager, this position will be responsible for assisting the Segment Lead in providing guidance and support to Junior Engineers / Site Monitors in the performance of daily work activities..
RESPONSIBILITIES
Assist Segment Leads and Intermediate Engineers in the performance of daily work activities, undertake audits, and non-conformance reporting.
Participate in the development of risk-based multidisciplinary Segment Audit Plans to prioritize construction activities for monitoring and/or auditing.
Visit the locations of any ongoing work on-site, each day, to monitor activities on-site and collect information and photographs of the work.
Perform monitoring and auditing across multiple disciplines with the support of discipline leads.
Notify Segment Leads and Intermediate Engineers, by exception, of any issues or concerns as soon as they are identified.
Provide input as required for a monthly report to the client.
QUALIFICATIONS
Bachelor's Degree in Engineering preferred.
Eligible for P.Eng. in Ontario or a Certified Engineering Technician (CET).
Minimum 3 years of work experience in a similar capacity preferred.
Requires basic engineering knowledge in one or more disciplines and will be required to perform monitoring and auditing across multiple disciplines with the support of discipline leads.
Ability to work within multi-disciplinary technical teams and maintain effective working relationships. Experience with construction drawings, site work, construction quality control, and reporting.
Sound judgment; effective organizational, analytical and problem-solving skills; strong interpersonal, oral, and written communication skills including technical report writing skills.
Working knowledge of personal computers and computerized applications related to the work.
Valid Province of Ontario Class “G” Driver’s license and use of own vehicle for attending project sites, etc.
Health and Safety is a core paramount value of WSP. Given the importance of keeping one another safe and the growing list of our clients including vaccination status as part of their mandated health and safety requirements to work with them,
you will be required to provide proof of full COVID-19 vaccination to WSP as a condition of employment.
You may also be required to undergo additional immunization to maintain a fully vaccinated status against COVID-19 whenever local Public Health Authorities recommend additional immunization.
Offers of employment for safety-sensitive positions involving fieldwork are contingent upon candidates being able to perform key physical tasks of the job as described in the job posting and interview. This may include the ability to work in a variety of environmental conditions, such as remote or isolated areas, working alone, and in inclement weather (within safe and reasonable limits).
WSP welcomes and encourages applications from people with disabilities. Accommodations are available on request for candidates taking part in all aspects of the selection process.
WSP is committed to the principles of employment equity. Only the candidates selected will be contacted.
WSP does not accept unsolicited resumes from agencies. For more information please READ THE FULL POLICY.
WSP Canada Inc.
Thornhill, ON"
"Engineering Trainee/ Engineer (Nuclear Safety Analysis and Support) - Tiverton, ON - Indeed.com","Posting Start Date: November 16, 2021
Posting End Date: November 30, 2021
Are you looking for a meaningful career that makes a difference in your community and beyond? Are you an outdoors person who enjoys the benefits of small town living? At Bruce Power, we offer exciting careers that provide you the opportunity to have the small-town lifestyle.
As part of our team, you will work in a Safety First environment supporting challenging and impactful nuclear projects like the Life Extension program. Ongoing training and development are part of every job, ensuring constant growth and skill-building potential.
What will you be responsible for?
Reporting directly to Section Manager, Major Component Programs, the successful candidate will provide technical support to Reactor Safety Engineering Division in one of the core areas in, Component Engineering of the Calandria Shield Tank Assembly as well as the Auxiliary Fuel Channel Components (Shield and Closure plugs).
This position will be based on site, Tiverton, Ontario.
Specific Accountabilities:
Development, management and oversight of Calandria Shield Tank Assembly and Fuel Channel Auxiliary Component activities in support of safe and reliable station performance to end of life.
Support Reactor Safety Engineering with subject matter expertise, engineering and analysis.
Manage the component health through Life Cycle Management Plan and Periodic Inspection Plan.
Define corrective actions associated with the Component, and maintain good Configuration Management.
Work with Outage Maintenance Services (OMS) and vendors to deliver high quality inspection, replacement and repair campaigns. Advocate for completion of the full scope and any discovery items
Work with Nuclear Safety Analysis and Support (NSAS) and vendors to assess inspection results and pursue analysis to demonstrate fitness for service
Maintain good communication with Licensing and the CNSC to accurately communicate information and reports.
Contribute to the resolution of design and technical problems and implementation of approved solutions. Advocate towards accepting optimum approaches that support business needs
Keep informed regarding internal and external operating experience and industry technology trends to maintain/improve the long-term performance of the Component
Support Major Component Replacement (MCR) activities on an as needed basis
Provide technical evaluations and advice, solve problems and coordinate technical work as required, in a number of major work areas.
Maintain and/or update specified department/divisional procedures as required or requested.
Prepare reports to provide information and data in answer to external requests or for historical purposes. Prepare reports, for distribution to various groups, outlining technical details, results or conclusions. Provide explanations and answers to questions received from recipients of reports.
Provide technical interface with specialist regulatory staff, as required.
Review and analyze plant events to evaluate the effects on reactor safety, fitness for service or operability.
Prepares submissions including cost justification or financial evaluation as appropriate; recommends adoption of the proposal and steps required to incorporate it. Submits these for approval or forwarding if necessary.
Cooperates with other departments and organizations in arranging tests and providing appropriate documentation as required.
Keeps abreast of new developments in the field and incorporate as appropriate.
Prepare regulatory strategies and interface with regulatory agencies as needed
Provide recommendations and inputs into R&D programs
Provide oversight, guidance and advice on strategic initiatives and projects
Performs other duties as required.
Skills, Knowledge and Qualifications
Must have necessary skills, knowledge and experience in nuclear component life cycle management.
Preference will be given to candidates with Outage experience managing inspection results and assessments.
Strong personal commitment to customer, department and corporate objectives.
Effective organizational, analytical, problem solving and decision making skills.
Excellent verbal and written skills.
Excellent interpersonal skills.
Self-starter, shows initiative.
Anticipates the safety implications of actions and ensures safety issues are addressed.
Adapts well to a changing and challenging work environment, and demonstrates a willingness to learn new skills.
Requires knowledge and experience in the design, operation, or maintenance of nuclear plants.
Proven problem solving skills and experience with technical studies and evaluations are required.
Education and Experience Minimum Requirements:
Engineer (Occupation Code 670325)
Completion of a 4 year University degree in Mechanical, Metalurgical, Nuclear or Chemical Engineering.
An Ontario Professional Engineering designation (P.Eng.) is required.
A period of over 6 years of experience is considered necessary
Engineer Trainee (Occupation Code 670207)
Completion of a 4 year University degree in Mechanical, Metalurgical, Nuclear or Chemical Engineering.
Required to be working towards a valid Professional Engineers of Ontario certification within 4 years.
A period of up to and including 4 years of experience is considered necessary.
Are you ready for a change?
Please attach a cover letter and resume, indicating your education and experience as it relates to the Engineering Trainee/Engineer (Nuclear Safety Analysis and Support) opportunity. We look forward to receiving your application and will be in contact with you, should you be selected for an interview.
The successful candidate will be selected based on related and required education, experience, knowledge and skills, a competency based interview and background reference checks.
We thank all candidates for their interest, however only those selected to move forward will be contacted.
In order to ensure you are given full consideration for this position, please ensure your candidate application is completely filled out and up to date. The information in the candidate application will be used in the selection process to assess candidacy for this position.
Bruce Power is proud to be an equal opportunity employer; valuing and respecting diversity. We encourage applications from qualified members of the four designated groups."
