Title,Description
"Marketing Intern - Toronto, ON - Indeed.com","Tasks
Position Objective:
Porsche Cars Canada’s Marketing Intern will support the department in the areas of Communications and Retail Marketing. The intern will be reporting to the Manager, Marketing Communications.
Primary Responsibilities:
Support Digital Marketing Specialist with coordination of local content initiatives for Porsche Canada’s social media channels
Assist Manager, Marketing Communications with campaign planning and agency briefing
Assist the Marketing team with Roadshow event planning for the dealer network (local campaigns, email & direct mail invitations, dealer communication)
Build campaign reports (KPI’s) and presentation reviews for Marketing team
Assist Retail Marketing Manager with coordinating creative production and media planning requests submitted by dealers as part of the Porsche Dealer Marketing Service (PDMS) program
Assist Retail Marketing Manager with dealer website inquiries and support
Secondary Responsibilities:
Provide support to the marketing department with administrative and procurement tasks, including purchase requisitions/ invoicing
Support the Marketing team in writing/proofing copy in various communications
Support Retail Marketing Manager with coordinating dealer POS material orders, distribution and invoicing
Set-up and prepare monthly dealer calls for the Marketing team
Assist with posting updates and bulletins to dealer network on an ongoing basis
Assist with annual marketing conference planning and execution
Qualifications
Education:
Bachelor’s Degree student or recent graduate with a specialization in Marketing, Communications, Procurement, Automotive, or related field
Fluency (written and oral) in English,
French language skills (Fluent) an asset
Experience:
Previous relevant internship or work experience in the automotive industry or marketing premium brands is welcome
Automotive dealership experience is an asset
Website management experience is an asset
Skills/Competencies:
Interest in automotive and prestige/luxury
Excellent communication skills, both written and verbal
Strong motivation and willingness to learn
Rigorous
Excellent attention to detail
Process oriented
Ability to proactively solve problems and work independently
Strong interpersonal skills, with demonstrated ability to work in a team environment
Advanced knowledge of MS Office, especially Excel and PowerPoint
Strong understanding of website content management systems and graphic design is an asset
At a Glance
Porsche is an equal opportunity employer and we take pride in our diversity. In order to provide equal employment and advancement opportunities to all individuals, employment decisions at Porsche will be based on merit, qualifications and abilities. Porsche does not discriminate in employment opportunities or practices on the basis of race, national or ethnic origin, religion, age, sex, sexual orientation, marital status, family status, disability, a conviction for which you have been granted a pardon, or any other characteristic protected by federal or provincial law"
"Digital Marketing Specialist - Toronto, ON - Indeed.com","Every year, approximately 60% of all medical school applicants with dreams of becoming physicians are not granted admission to medical school. Those who are passionate about helping and healing others face various obstacles on their path to a medical career. At MCAT Mastery, our vision is to support passionate, smart students in achieving their dreams of becoming doctors.
About MCAT Mastery
MCAT Mastery is a fast-growing test-prep company that offers online tutoring services, courses, and many other resources to students who are looking to get into med-school and become doctors. We’re passionate about contributing to the development of future doctors, ensuring they use this phase of their professional journey to not only master med-school level exams, but also become better versions of themselves, by applying key self-growth principles we teach.
We like to foster a culture of positivity, continuous improvement personally and professionally, thinking big, open communication, authenticity, and putting the customer first.
Our plans over the next year involve expanding our company from just being about the MCAT exam, to being about everything that encapsulates the journey to becoming a physician. We also plan to expand to different product types such as creating software, physical products, and more. The next year is going to be a great learning opportunity for everyone on the team as we step into new ventures/projects together.
About The Role
We are looking for a qualified and talented
Digital Marketing Specialist
to join our expanding team at MCAT Mastery. You will work side-by-side with the CEO/Founder and will be instrumental in helping scale the business.
MCAT Mastery is growing very quickly and we need you to keep us moving forward steadily and effectively. We are looking for an ambitious, self-driven marketer who can be comfortable in a collaborative startup environment.
If you have experience with digital marketing, are a quick learner, enjoy solving problems creatively, looks forward to taking on new challenges, and are driven to continue improving as a marketer, you’ll be a great fit with our team.
As an important part of the team, you will manage and optimize the entire sales funnel. You will implement marketing ideas from the Marketing Manager, and also have the freedom to come up with your own ideas to experiment with!
Note: this is a full-time remote position (must be in Toronto, Canada)
Responsibilities
Help execute product launches and other digital marketing campaigns
Optimize various elements in the sales funnel through constant testing and analysis
Create and assess weekly and monthly marketing reports
Assist with content creation on various channels including the website blog and social media
Improve and update email automations and campaigns
Measure and analyze campaign results (A/B testing, CTR, Open Rate, Opt-Out Conversions).
Setup, implement and migrate current infrastructure to leading-edge digital marketing software
Oversee the execution of traffic-generating strategies
Create well designed, conversion-focused sales and landing pages as needed
Manage email campaigns and develop strategies and plans to drive sales, increase web traffic, and grow email subscribers and engagement
Identify opportunities to continuously improve company websites
Set up campaigns on various channels, including Facebook and Instagram
Work closely with content writer, designer, and production coordinator
Other responsibilities as needed
The Ideal Candidate
Has 2-3 years of digital marketing experience (can be work or personal projects)
Proficiency with Google Analytics, WordPress, email marketing software
Stays up to date with latest digital marketing trends and best practices
Has an eye for design when it comes websites, images, and videos
Is a creative thinker but also has a strong ability to analyze, organize and manage
Is detail oriented and customer focused
Is extremely proficient with spreadsheets and Excel
Strong time management, organizational, and project management skills
Fast learner with a knack for technology who can learn new tools quickly
Strong verbal and written communication skills
Savvy and resourceful, a problem solver who is quick on their feet, fast in finding solutions, and can manage to figure things out on their own
Thrives in a fast paced environment and can take ownerships of projects
Bonus Points If You:
You have experience with taking the MCAT and/or being a premed. You know the struggle first or even second hand.
You’ve worked in a startup environment and know what it takes to scale
You have experience working in an education based environment
Life at MCAT Mastery
Full time remote working ability and paid time off
Competitive compensation
Performance bonuses
Fun, positive, growth-oriented company culture
Small, close-knit, growing team working on projects together with a shared vision
Training culture dedicated to maximizing your learning and growth; current and new high-quality marketing and business educational material is free for every team member
Ability to make a direct, positive, and immediate impact in the lives of the future doctors of our world
Opportunity to join a growing and rapidly evolving organization early
Application Deadline: 2021-11-30
Expected Start Date: 2021-12-13
Job Types: Full-time, Permanent
Salary: $45,000.00-$55,000.00 per year
Additional pay:
Bonus pay
Benefits:
Casual dress
On-site parking
Paid time off
Work from home
Schedule:
8 hour shift
Monday to Friday
Application question(s):
What are the top 3-5 online digital marketing tools that you are most comfortable with?
Experience:
digital marketing: 2 years (required)"
"Digital Marketing Intern - Toronto, ON - Indeed.com","Job Description
The position available is for students only who are required to complete an internship with their University, College or any Post-Secondary program. It is an unpaid Internship. The internship is done remotely from home. College or University credit will be provided for this internship.
About Caiden Media
We are a growing digital marketing firm based out of Toronto. Our services include Google Virtual Tour, Web Design, SEO, Social Media Marketing, PPC, E-Commerce and Local Services by Google. We are looking to expand our team with a few interns that are interested and looking to get some real experience within the digital marketing industry.
Benefits of an Internship with Caiden Media
Flexible Hours to accommodate your school schedule
Coaching from industry professionals
Be a part of a motivated team that's always looking to grow
Students can earn their college credit upon the completion of this internship.
Duties / Responsibilities might include some or all of the following
Work on SEO for different projects
Create Social Media posts for different clients
Requirements
Entrepreneurial mentality
Be able to work well individually or as a part of a team
Ability to multitask
www.caidenmedia.com
Contract length: 3 months
Part-time hours: 20 per week
Job Types: Part-time, Internship
Salary: $15.00-$20.00 per hour
Schedule:
Monday to Friday
Work remotely:
Yes"
"Digital Marketing Specialist - Toronto, ON - Indeed.com","Heart & Stroke is a place that values championing health and has a bias for action as we tackle heart disease and stroke. Our mission is to promote health, save lives and enhance recovery. We are committed to a culture that exemplifies our core values:
CHAMPION Health, PRACTICE Humility, EMBRACE Change, DRIVE impact, LEARN and GROW and BE HEARTFELT.
Please note Heart and Stroke (H&S) is committed to supporting the health, wellbeing, and safety of our employees and their families. As such, temporary remote work arrangements are currently in place and we are regularly reviewing this as we monitor public health guidelines.
Who we need
Reporting to the Senior Marketing Manager, the Digital Marketing Specialist, Lottery role is responsible for the flawless delivery of the Lottery’s digital marketing tactics which results in the achievement of the Lottery sales revenue targets. The Digital Marketing Specialist, Lottery will manage digital media campaigns from briefing stage through to implementation to reporting.
Accountability areas will focus on planning and execution of digital media (Display, Native, Paid Social and Search), offline media (TV, radio) and the Heart & Stroke Lottery website (Content development and Vendor Management). This position will also help plan and lead the management of the Lottery’s organic social channels.
How you will make an impact every day
Leads Development and Implementation of Digital Marketing Campaigns and Website
Contributes to the development of core/key messages and overall campaign look/feel.
Works closely with creative agency(s) to ensure core messages and brand equity elements are delivered across all digital tactics consistently and effectively
Responsible for the development of creative digital briefs and campaign media briefs
Day-to-day creative vendor management, creative approvals, and scheduling.
Responsible for the implementation and project management of digital media strategies, while providing recommendations on paid media plans
Ensures media plan meets objectives and KPIs
Owns and executes SEM and SEO initiatives including keyword research, content recommendations, website optimizations and link building activities
Manages day-to-day Lottery website operations, content strategy & execution
Responsible for the organic social media strategy, helps plan the content calendar, and oversees development and execution of content on Heart & Stroke Lottery social media channels
Develops and executes “off-season” communication plans and materials
Contributes to the Lottery post assessment and key lessons learned and recommends business improvement ideas and solutions
Project Management of Digital Marketing Campaigns
Leads, prepares, and manages critical path and asset deliverables for all mass channels– offline and online
Oversees all media trafficking during campaign execution
Ensures projects are managed within agreed budget and course corrects where required to deliver planned outcomes
Participates in departmental meetings
Ensures online storage of assets and approvals are kept up to date
Works to ensure annual budgets are tracked and achieved and supplier contracts are adhered to and kept updated
Data and Results Monitoring and Evaluation
Ensures clear and measurable goals are created for each campaign and aligned with overall marketing and revenue objectives
Oversees and manages all performance media campaigns.
In partnership with Sr. Analyst, analyzes data in real time, monitors traffic numbers, bounce rates, channel performance, optimizes paid/organic search results (website architecture, keywords, links)
Acts as key point of contact for digital media agency for ongoing efficiencies & optimizations
Continuously develops optimization strategies to improve the performance of organic and paid search results
Ensures Lottery website is up to SEO standards, accessibility laws and oversees site architecture
Manages on-site optimization – including A/B testing, meta tags, content, site architecture, internal linking, sitemaps, load speed, URL paths etc.
Identifies opportunities for keyword expansion and constantly tests new features/approaches
What you bring
University degree with specialization in Marketing or Digital Marketing preferred
Google AdWords or Bing certification preferred
5+ years of work experience specifically in digital marketing roles (executing digital paid and SEO campaigns)
Agency background or in-house experience in digital marketing or eCommerce environment an asset
Proven ability to apply data and market research to marketing tactics and communication design
Anticipates and plans for future events, trends, challenges, and opportunities
Evaluates opportunities and develops creative solutions, stimulating new ways of thinking and solving problems.
Strong project management skills, delivery of successful projects on time with attention to detail
Excellent communication (writing, editing, and verbal) and interpersonal skills
Excellent organizational skills and ability to meet deadlines
Ability to establish solid working relationships with external and internal stakeholders
Ability to work flexibly, effectively, and efficiently under pressure
Self-initiative is a must
Experience using Ad Management and Analytic Tools (Adwords, Facebook Ad Manager, Google Analytics, Google Tag Manager, Google Optimize)
Experience with 3rd party Audit tools (Moz, Siteimprove, etc.)
Experience with CMS platforms (Sitecore preferred)
Basic HTML, CSS and Photoshop skills an asset
Apply now
Beat as one. If you want to join the fight to beat heart disease and stroke while building an engaged and giving community, apply by
December 15, 2021.
To learn more about our mission, our values and the difference our foundation makes in the lives of Canadians at every age, visit our website.
Candidates from diverse groups are encouraged to apply.
We are committed to fostering an inclusive, barrier-free and accessible environment. If you have been contacted for an interview and require an accommodation to participate in the recruitment and selection process, please advise and we will work with you to meet your needs.
YSTWT4PMd4"
"Stagiaire, marketing digital - Montréal, QC - Indeed.com","Où la mode rencontre la technologie...
Ne regardez pas plus loin, votre prochain défi se trouve sous vos yeux
Voici une excellente opportunité si vous souhaitez joindre les rangs d’une entreprise innovante qui vous offrira la chance de grandir dans vos fonctions.
Si vous êtes créatifs, à l’affût des dernières tendances numériques dans votre domaine et maîtriser l’art de la rédaction, ce mandat de stage est l’opportunité rêvé afin de faire vos preuves dans un univers innovateur conjuguant le B2B et B2C.
La vie chez Aspex c'est:
§ Évoluer au sein d’une compagnie avant-gardiste et stylisé, créateur de marques révolutionnaires dans le domaine de l'optique
§ Une culture de performance où chacun peut se réaliser et se développer
§ Bénéficier d’exclusivité sur les nouvelles collections de lunettes
§ Un espace de travail collaboratif permettant une tenue vestimentaire décontractée
§ Travailler dans l’artère effervescente du quartier Royal-Mount tout en ayant accès à une place de stationnement
§ Et surtout travailler avec des gens passionnés par l’innovation et le progrès
§ Et bien plus!
Votre mandat
Votre mandat principal sera de supporter les initiatives du plan marketing numérique du Groupe Aspex et ainsi que de celui de la chaîne de lunetterie Optik Farhat. Vous collaborez à l’élaboration et à la mise en œuvre des stratégies liées à la production des outils de communication, à la gestion du site web et des réseaux sociaux. Votre savoir-faire dans le développement et la coordination de contenu créatif afin de rejoindre la clientèle ciblée permettra de faire rayonner nos marques à l’échelle nationale et à l’internationale.
Vos défis
Aider à la conception, rédaction, production et diffusion de supports de communication (brochures, affiches promotionnelles, vidéos, newsletters, moodboards, etc.) et mise en ligne de campagnes publicitaires sur les principales plateformes de publicité numérique (TikTok, Facebook, Instagram, Likedin, Google, Bing, YouTube, Pinterest, etc.)
Réaliser des contenus rédactionnels convaincants et créatifs sur nos différentes plateformes tout en veillant à la qualité du contenu et à son adéquation avec l’image de marque de la compagnie
Effectuer une veille concurrentielle sur les tendances marketing dans le marché de l’optique et cartographier les meilleures pratiques et contenu de nos concurrents
Évaluer les indices de performance clés (KPI) des initiatives marketing sur le Web et les réseaux sociaux
Répondre aux clients et abonés sur toutes nos différentes plateformes de médias sociaux
Profil recherché
Études en cours en marketing, communications ou dans un domaine connexe
Expertise approfondie des réseaux sociaux et des initiatives de marketing numériques
Excellente maîtrise du français et de l’anglais à l’oral et à l’écrit, avec de fortes habiletés de rédaction
Créativité et originalité dans la création du contenu web
Bonne maitrise des médias sociaux et être à l’affut des technologies émergentes
Excellente maîtrise des logiciels de la suite Office de Microsoft
Connaissance en graphisme (un atout)
Être organisé, attentif aux détails et en mesure de travailler sur plusieurs projets à la fois
Aptitudes éprouvées à créer des relations, à convaincre et à influencer l’auditoire
À propos de nous:
Le groupe Aspex est l’un des plus importants distributeurs de lunettes de vue et de lunettes solaires de qualité au monde, servant des marchés en Amérique du Nord, en Amérique Centrale, dans les Caraibes et en Europe. Depuis sa création en 1965, Aspex s’est bâtit une solide notoriété à travers le monde faisant d’elle un joueur prédominant dans l’industrie de l’optique. Aspex détient actuellement des brevets exclusifs aux technologies de lunettes qui ont changé le concept du port de celles-ci. Aspex a plus de 50 000 clients dans plus de 80 pays et est à l’origine de plusieurs innovations de styles et technologiques telles que le clip magnétique (Easyclip, Takumi, Paradox, etc.), le métal à mémoire de forme et les technologies brevetées Turboflex et Easytwist.
Nous accueillons et encourageons la diversité. Joignez-vous à notre équipe! Votre succès sera le nôtre.
Job Type: Full-time"
"Digital Marketing Specialist - PPC / FB Advertising / Freelance - Toronto, ON - Indeed.com","H2O Digital Marketing, one of Canada’s Fastest Growing companies listed on Canadian Business is seeking a Facebook Ads Specialist to help us support our growing client base.
The Role:
The SEM/PPC Digital Marketing Specialist is responsible for coordinating and executing social & digital media marketing related projects; the primary focus of the position is to manage digital advertising campaigns for clients primarily on Facebook Ads Manager.
Duties and Responsibilities:
· Setup, manage and optimize advertising campaigns on Facebook
· Ad creation and deployment
· Monitor, analyze and report on client KPIs
· Research industry trends, best practices, and emerging technologies and platforms.
· Coordinate all digital assets (i.e. copy, text, imagery, branding) for all online properties including websites and apps
· Meet with Paid Ads Team Lead to discuss performance of campaigns
· Update and manage client landing pages and lead distribution setup
· Troubleshoot any errors to ensure all aspects of campaigns are performing correctly
Part-time hours: 10-25 per week
Job Types: Part-time, Freelance
Salary: $15.00-$30.00 per hour
Benefits:
Flexible schedule
Work from home
Schedule:
Monday to Friday
Experience:
Facebook Advertising: 1 year (preferred)
Work remotely:
Temporarily due to COVID-19"
"Digital Marketing Intern - Toronto, ON - Indeed.com","Digital Marketing Intern
The Intern will be involved with planning, executing, editing and writing of marketing campaigns as well as assisting the team with any digital creative work, as instructed. The successful candidate will play an integral role for maintaining branding language consistency while delivering high-quality contributions including ideas, strategies and expected results. The Intern will develop and drive marketing content onto the web and social media to reach our target markets to drive product demand via multiple channels.
The ideal candidate will be innovative, team oriented, an effective communicator, have a desire to participate in change, and appreciate a dynamic environment with rapidly changing priorities.
The job responsibility includes but is not limited to the following:
Write, edit, publish digital content for website, videos and social media platforms
Develop and implement advertising campaigns appropriate for electronic media
Influencer reach out and communication with partnerships
Assist in the creation of marketing executions and brainstorming
Create Corporate Communications materials, while learning and understanding Company/Brand Design Guidelines
Support the development and execution of a wide range of communications materials (email communications, company newsletters, intranet postings, presentations, surveys, calendar invitations, website content, internal videos, social content, etc.)
Assist with managing the website for the company, collaborating with the management to create an even distribution of assets between all locations.
Work as a team with other interns
Qualified candidates must demonstrate the following skills:
Currently enrolled or graduated in a university degree or college diploma in business marketing/administration, media, commerce, communications, PR, digital marketing, advertising or a discipline related.
Experience with Adobe Creative Suite, Canva and knowledge in Video editing and website posting/updating is a plus but not mandatory.
Detail orientated, good time management skills in a changing environment, ability to work independently and as part of a team
Excellent attention to detail and a high motivation to learn
Understanding of brand, tone and target audience
A passion for Digital Marketing, Trends and Social Media
Ability to think and act strategically and tactically
Solid organizational skills, including prioritization and time management
Strong interpersonal, written and oral skills
Problem solving skills
Ability to summarize and communicate important data
If this sounds like something you're interested in, we'd love to hear from you!
Length: 2 week trial period, then part time permanent
Expected start date: 2021-11-08
Job Type: Part-Time
Salary: $14.35CAD - $17CAD /hr
Benefits:
Work from home
Schedule:
10-15 hours
Meetings every mon, wed, friday
Work remotely:
Temporarily due to COVID-19
COVID-19 precaution(s):
Remote interview process
Virtual meetings
Remote work
Part-time hours: 10-15hrs per week
Expected start date: 2021-11-08
Part-time hours: 10-15 per week
Expected start date: 2021-11-08
Must be enrolled in a Canadian university.
Job Types: Part-time, Internship, Permanent
Salary: $14.35-$17.00 per hour
Schedule:
Monday to Friday
Work remotely:
Yes"
