Title,Description
"Development Specialist - Toronto, ON - Indeed.com","Address:
55 Bloor Street West
Job Family Group:
Technology
We are seeking an enthusiastic and passionate professional for a Development Lead position for next phase of predictive personal finance management feature. This feature allows customers to proactively understand their spending and provides options to save money. Phase 1 of this feature is live for BMO customers and has been received very well by customers. You must have extensive experience in full-stack development - Mobile hybrid app and Java back-end development with microservice architecture integrating to AWS and Openshift cloud services. This role will support short- and medium-term business and technology roadmaps for retail online banking to deliver self-service capabilities to BMO customers. It also focuses on the digital channels’ technology roadmap, facilitating innovation and adoption of next-generation technologies. We collaborate with Enterprise Architecture, other ETO teams, and business technology stakeholders, connecting subject matter experts with business, information, domain and solution architects.
Your skills are broad – designing, developing and implementing application solutions to support mobile and online banking under the Channels Technology group. You will lead and collaborate to integrate code to create software solution that aligns with architecture patterns and technology strategy. Understands the implications of various components (including technology strategy & architecture) to the overall design of a program, system, or eco-system. Evaluates new technologies for fit with the program/system/eco-system and the associated upstream and downstream impacts on process, data and risks (e.g., security). Works toward the objective of defect free software. Ensures that systems functionally meet requirements, align with architecture and promote the development of common assets. Supports the resolution of production issues and problems. Makes recommendations to improve BMO processes & systems.
As a qualified candidate, you will be part of the team driving BMO’s Self-Services for retail online banking initiatives. As a member of this team, you should possess the ability to inspire yourself and all of our team. Based on your previous experiences you will inject new knowledge and skills into an already high performing team thus excelling our efforts to new heights.
Your Responsibilities
Leads and implements initiatives as required to deliver business objectives
Decomposes business requirements and translates them into detailed design specifications and code.
Assesses impact of design decisions to the computer solution/product/service being developed (i.e. performance, schedule, budget, downstream component/system impact, quality, etc.) and recommends alternate/creative solutions for mitigation/optimization if required.
Recommends and implements solutions based on analysis of issues and implications for the business for informed decision-making.
Drive meetings with subject matter experts from all areas of the business including infrastructure, operations, applications, vendors and leads to seek input from and plan/coordinate development, define requirements and timelines.
Conducts independent analysis and assessment to resolve strategic issues.
Builds effective relationships with internal/external stakeholders and ensures alignment.
Monitors and tracks performance, and addresses any issues.
Leads/conducts detailed code-reviews and provides feedback in a constructive manner.
Interacts with key business & technology stakeholders to define, analyze, and deliver requirements that reflect the needs of both the business and end-customers.
Assesses the costs and benefits for different solutions and recommend/decide on appropriate designs.
Designs solutions, writes code, performs unit testing, develops appropriate artefacts / documentation, and facilitates final delivery.
Supports production issues, includes independently completing root-cause analysis and diagnosis.
Builds solutions that are supportable, scalable and achieve our aspiration of common assets.
Recommends or automates approaches to streamline and integrate technological processes and/or systems to improve operational efficiency and effectiveness.
Identifies opportunities to strengthen the development capability, such as: sharing expertise to promote technical development, mentoring employees, building communities of practice and networks.
Stays abreast of industry technical and business trends through participation in professional associations, practice communities & individual learning.
Your Mindset
You are a self-starter, driven and can handle multiple projects and priorities.
You are passionate about driving customer values with digital acceleration mindset and culture in a fast-paced, challenging environment where you get the opportunity to work with a spectrum of latest tools and technologies to drive forward continuous improvement.
You are actively looking to improve the solutions you implement, understand the efficacy of collaboration and reaching out across functional borders and are keen to work in a team in an Agile environment.
As a member of this team, you should possess the ability to inspire yourself and all of our team. Based on your previous experiences you will inject new knowledge and skills into an already high performing team thus excelling our efforts to new heights.
Required Core Skills:
Degree in Computer Science, Engineering and or equivalent industry experience
Strong interpersonal, communication and leadership skills
5 - 7 years of relevant experience and/or certification in related field of study or an equivalent combination of education and experience.
Demonstrated strong programming skills and hands-on experience in full-stack development with mobile app development (Angular v5 & up, Cordova), mobile native features (push notification, notification centre, etc) and Java back-end development (SpringBoot, APIs, REST/JSON, SOAP/XML, Swagger, OpenAPI, Microservices architecture)
Experience with Cloud services and DevOps concepts: OpenShift, Docker, Kubernetes, Artifactory, BitBucket, Bamboo, Ansible, IaaS/PaaS technologies, etc.)
Proven and demonstrable experience designing and implementing high volume, high availability applications with a very high degree of automation
Comfortable working in an Agile/SCRUM setting – ability to manage multiple priorities; ability to adapt to changing priorities
Demonstrate strong facilitation, negotiation, interpersonal, communication and collaboration skills.
Demonstrate ability to easily deal with both abstract and concrete concepts and be able to reconcile them for the appropriate audience and context
Quickly understand organizational dynamics and management priorities, and to be able to work effectively in a fast-paced, results-driven company.
Other Skills:
A critical thinker with strong analytics, and problem-solving skills
Self-motivated with a positive attitude and an ability to work independently and or in a team
Ability to communicate across business units and the ability to interface with and communicate complex technical concepts to a broad range of internal and external stakeholders
Time management skills with the ability to manage multiple priorities and mentor junior developers
We’re here to help
At BMO we are driven by a shared Purpose: Boldly Grow the Good in business and life. It calls on us to create lasting, positive change for our customers, our communities and our people. By working together, innovating and pushing boundaries, we transform lives and businesses, and power economic growth around the world.
As a member of the BMO team you are valued, respected and heard, and you have more ways to grow and make an impact. We strive to help you make an impact from day one – for yourself and our customers. We’ll support you with the tools and resources you need to reach new milestones, as you help our customers reach theirs. From in-depth training and coaching, to manager support and network-building opportunities, we’ll help you gain valuable experience, and broaden your skillset.
To find out more visit us at https://jobs.bmo.com/ca/en .
BMO is committed to an inclusive, equitable and accessible workplace. By learning from each other’s differences, we gain strength through our people and our perspectives. Accommodations are available on request for candidates taking part in all aspects of the selection process. To request accommodation, please contact your recruiter."
"Sr. Software Engineer - Backend - Consul Ecosystem, Kubernetes - British Columbia - Indeed.com","About HashiCorp
HashiCorp is a fast-growing startup that solves development, operations, and security challenges in infrastructure so organizations can focus on business-critical tasks. We build products to give organizations a consistent way to manage their move to cloud-based IT infrastructures for running their applications. Our products enable companies large and small to mix and match AWS, Microsoft Azure, Google Cloud, and other clouds as well as on-premises environments, easing their ability to deliver new applications for their business.
About the team
The Consul team, like all of HashiCorp, is fully distributed (100% remote). We have been a remote company since our founding in 2012.
Consul helps organizations automate network configurations, discover services, and enable secure connectivity across any cloud or runtime. The charter of the Consul Ecosystem team is to support platforms and runtimes that integrate with Consul with a focus on delivering a seamless UX for our practitioners and customers.
About the role
On the Consul team, we help organizations automate network configurations, discover services, and enable secure connectivity across any cloud or runtime. The customers and large community of users of our tools are operators, infrastructure engineers, and software developers that encounter novel performance, scaling, and usability challenges that we help them solve.
Consul started as an infrastructure management tool for service discovery and health checking, and has evolved to become a full-featured service mesh. You'll be an active contributor to the service mesh ecosystem, following new developments in emerging technology and competitive offerings, looking for opportunities for product differentiation, and rethinking product architecture to meet new global scale and organizational demands.
In this role you can expect to:
Build and architect distributed systems for service connectivity focusing on Kubernetes
Interface directly with internal teams, users and HashiCorp customers, as well as the larger Consul community.
Participate in user research studies and discussions with product managers and customers to better understand the network topologies, challenges, and constraints for which operators are trying to solve, and leverage those insights when approaching feature design and implementation.
Propose new functionality or substantive changes through written documents in an async process, describing the problem background, proposed implementation and example UX, then iterating on peer feedback collaboratively.
Own the full lifecycle of feature development from design through testing and release
Program mostly in Golang, learning from and contributing to a team committed to continually improving their skills.
Coach and mentor other team members within HashiCorp's engineering teams
You may be a good fit for our team if you have:
Familiarity with service-oriented architectures, and ideally have worked on an infrastructure or platform team building internal tooling to deploy, connect and monitor them.
Empathy for the people operating, learning, teaching and supporting software you write, and consider their experience when making design decisions and performance, security or complexity tradeoffs.
Experience in a lower-level language like
Go
.
Awareness of the broader service mesh ecosystem and an interest in contributing to a full-featured product offering while reducing complexity and barriers to adoption for practitioners.
Curiosity for academic computer science research, particularly distributed systems papers such as Raft and Paxos variants, and enjoy learning more about the challenges of consistency at global scale.
You have expertise with Kubernetes/K8s, or deep experience working with other container orchestrator platforms (e.g., Docker, Mesos, ECS, EKS, GKE, etc).
What is our hiring process like?
The below serves as a basic outline; we may choose to add or remove steps based on the information that we gather during the process.
Introductory Call with someone from our recruiting team.
First Interview with an Engineering Manager
Interview Loop with additional team members, with the following panel:
Technical Code Pairing interview
Code Review interview
Communication and Collaboration interview
Systems and architecture interview
If applicable, a final conversation with the Engineering Manager for the team you would be joining
Offer
We do our best to accommodate your programming language of choice for technical interviews.
About the application process
Please note, as collaboration and communication are a critical aspect of how we work, a cover letter is a great way to provide a sample of how you communicate.
In your cover letter, please describe why you're interested in working at HashiCorp, and what draws you to this role in particular. Specifics of your past experience that are relevant to this role are great to include, too.
#LI-TW1
#LI-Remote
HashiCorp embraces diversity and equal opportunity. We are committed to building a team that represents a variety of backgrounds, perspectives, and skills. We believe the more inclusive we are, the better our company will be.
For more information regarding how HashiCorp collects, uses, and manages personal information, please review our Privacy Policy."
"Senior Manager, Data Ops and Engineering, Bell Media - Toronto, ON - Indeed.com","Req Id: 338900
At Bell, we do more than build world-class networks, develop innovative services and create original multiplatform media content - we advance how Canadians connect with each other and the world.
If you’re ready to bring game-changing ideas to life and join a community that values professional growth and employee wellness, we want you on the Bell team.
The Bell Media team creates and delivers the best Canadian and international content across our digital media, television, radio, and out-of-home advertising platforms. We’re looking for innovative team players ready to take some of the most well-known entertainment brands in the country to the next level.
Bell Media’s Data Science and Infrastructure team is building out the next generation of experience for customers across Digital and Linear properties. We lead strategic development and execution of day-to-day operations, develop tools and processes to drive performance enhancements, manage customer loyalty and retention, and leverage big data and artificial intelligence to create intellectual property.
Bell Media’s Data Science & Infrastructure team is responsible for the management and optimization of BI systems used to analyze customer behavior, automate business insight processes, target marketing and provide insight to drive optimal business decisions.
Our Data Ops & Engineering group builds and maintains the platform that delivers accessible data to power decision-making.
Key Responsibilities
Build and maintain data pipelines, provision infrastructure and secure reliable data centric services and applications in AWS and Google Cloud Platform
Own the Data Engineering and ops roadmap
Assist in extracting, loading, transforming, cleaning and validation of data
Support data pipelines feeding into ML algorithms and models
Support ad-hoc data analysis requests to advance our digital analytics practice
Minimum Qualifications
AWS Professional Solution Architect Certification
Minimum 5 years of hands-on experience analyzing, re-architecting and re-platforming on-premise data warehouses to data platforms on AWS / GCP
Minimum 3-5 years of designing and building production data pipelines from ingestion to consumption within a hybrid big data architecture, using Java, Python, Scala etc.
Minimum 3-5 years of architecting and implementing next generation data and analytics platforms on AWS / GCP
Minimum 3-5 years of designing and implementing data engineering, ingestion and curation functions on AWS / GCP or custom programming
Minimum 3-5 years experience in performing detail assessments of current state data platforms and creating an appropriate transition path to AWS / GCP
Preferred Qualifications
Bachelor's degree in Computer Science, Engineering, Technical Science or 5+ years of technical architecture and build experience with large scale solutions
Experience with CDPs and Looker for data visualization an Asset
Minimum 5 years of experience in architecting large-scale data solutions, performing architectural assessments, crafting architectural options and analysis, finalizing preferred solution alternative working with IT and Business stakeholders
5 years of hands-on experience designing and implementing data ingestion solutions on AWS / GCP using custom approaches
3-5 years of hands-on experience architecting and designing data lakes on AWS / GCP cloud serving analytics and BI application integrations
3-5 years of experience in designing and optimizing data models on AWS / GCP
3-5 years of experience integrating security services with AWS / GCP data services for building secure data solutions
3-5 Architecting and implementing data governance and security for data platforms on AWS / GCP
Designing operations architecture and conducting performance engineering for large scale data lakes a production environment
Bilingualism is an asset (English and French); adequate knowledge of French is required for positions in Quebec.
Additional Information:
Position Type:
Management
Job Status:
Regular - Full Time
Job Location:
Canada : Ontario : Toronto
Flexible work profile:
Mobile
Application Deadline:
12/31/2021
Please apply directly online to be considered for this role. Applications through email will not be accepted.
At Bell, we don’t just accept difference - we celebrate it. We’re committed to fostering an inclusive, equitable, and accessible workplace where every team member feels valued, respected, and supported, and has the opportunity to reach their full potential. We welcome and encourage applications from people with disabilities.
Accommodations are available on request for candidates taking part in all aspects of the selection process. For a confidential inquiry, simply email your recruiter directly or recruitment@bell.ca to make arrangements. If you have questions regarding accessible employment at Bell please email our Diversity & Inclusion Team at inclusion@bell.ca.
Created: Canada, ON, Toronto
Bell, one of
Canada's Top 100 Employers."
