Title,Description
"Artistic Director - Calgary, AB - Indeed.com","Job Title
Artistic Director
Requisition #
997260.1
Job Type
Limited Term (for any group)
Position End Date (if applicable)
9/30/2022
Location:
MRU Main Campus - Calgary, AB T3E 6K6 CA (Primary)
Posting
About MRU
Founded in 1910 and located in Calgary, Alberta, Canada, Mount Royal University grew into a vibrant college in the 1930s and became a mid-sized university in 2009. Mount Royal has carved out a distinct niche by offering smaller class sizes, a robust liberal education and unique undergraduate programs. Currently, more than 15,000 credit students choose from 13 bachelor degrees and 38 majors.
Mount Royal University is located in the traditional territories of the Niitsitapi (Blackfoot) and the people of the Treaty 7 region in southern Alberta, which includes the Siksika, the Piikani, the Kainai, the Tsuut'ina and the Iyarhe Nakoda. We are situated on land where the Bow River meets the Elbow River. The traditional Blackfoot name of this place is ""Mohkinstsis,"" which we now call the city of Calgary. The city of Calgary is also home to the Métis Nation.
Mount Royal University is committed to removing barriers and fostering the inclusion of voices that have been historically underrepresented or discouraged in our society. In support of our belief that diversity in our faculty and staff enriches the work, learning and research experiences for the entire campus community, we strongly encourage members of the designated groups (women, Indigenous Peoples, persons with disabilities, members of visible minorities, and diverse sexual orientation and gender identities) to apply and self-identify.
About Event and Theatre Services
Events and Theatre Services supports the University’s objectives by operating the Bella Concert Hall, the Leacock Theatre and the Wright Theatre at the Mount Royal University. The theatres are operated as a revenue-generating community resource and are a strategic asset to the University.
Mount Royal University’s Box Office is responsible for regular box office sales duties in Mount Royal University Theatres and the Taylor Centre for the Performing Arts performance venues and will always provide superior customer service assistance to all theatre rental clients and event patrons.
About the Role
Reporting to the Manager, Theatre and Performance Services the Artistic Director (AD) will work with the Manager to support the artistic profile and programming of the Taylor Centre for the Performing Arts (TCPA) inclusive of digital, hybrid, and in person performance formats.
The AD will have primary responsibilities in the Education and Outreach (E&O) priorities of the TCPA including the formation and oversight of a volunteer program. They will also have significant focus on the development of external funds through granting opportunities, sponsorships, donations, and philanthropy. Working with the Manager, The Concert Season Advisory Committee, and TCPA Talent Buyer the AD will consult on programming choices ensuring they are conscious of diversity in perspective, practice, and are purposefully inclusive.
This is a full-time limited term position commencing October, 2021 and ending on September 30, 2022, 35 hours per week.
Responsibilities
Programming
Research and consult with the Manager, The Concert Season Advisory Committee and TCPA Talent Buyer on new arts presentations that can be effectively delivered in virtual format
Research current artistic works/presentations that can be adapted to digital deliver both in online live streaming, on demand, and pay per use formats
Research and consult with the Manager, and Box Office Lead on a best in class system to deliver as well as monetize digital delivery methods (pay per watch, or pay per use system)
Ensure that the TCPA’s presentations are accessible to the broadest audience possible and work to find solutions to removing barriers to access such as financial, capability, or comfort barriers.
Consult with the Manager, and TCPA Talent Buyer to ensure the TCPA’s presentations are diverse in perspective, practice, and are purposefully inclusive
Design and facilitate the development of a TCPA “Membership Program” which specifically includes exclusive digital and in person experiences to compliment the general artistic offerings of the TCPA
Education and Outreach
Design and facilitate an E&O program within the TCPA that focuses on providing patrons with inside information on the process of artistic creation, or the impacts of working through and during the COVID-19 Pandemic.
Work with the Manager, to develop offerings such as artist talk programs, special interviews, or masterclass/residencies
The E&O program should include both in person and digital offerings to both “TCPA Members” as well as the general public
Design and facilitate a volunteer program with opportunities for many communities to gain volunteer hours and exposure to arts and culture in supporting roles at the TCPA (FOH Staff, Box Office Staff, Admin Staff etc.)
Research, facilitate, and design a program of “virtual/hybrid residency” opportunities for artists to collaborate together remotely
Fund Development
Working with the Manager, and the MRU Development office the AD will research and support the development of external funds for the TCPA both operations and presentation.
Fund development areas include but are not limited to granting opportunities, sponsorships, partnerships, donations, and philanthropy.
The AD will meet and engage with community members and leaders to learn about potential funding opportunities and act as an ambassador of the TCPA’s funding needs and projects
Presentation Support
Meet with artists on site during presentation periods to ensure their needs are met including backstage or hospitality requirements
Attend all presentations and co-presentations of the TCPA and provide site support as required including volunteer support, FOH support, or client/partner relations support
Facilitate reception(s) as required for TCPA partners and VIPs
Reporting
Work with the department of Institutional Analysis to track and report on all metrics related to the TCPA’s presenting initiatives including financial, attendance, and demographic information.
Identify and implement a comprehensive reporting standard for the TCPA (i.e. CADAC)
Track and file all ad materials, recognition, and media assets for archival and reference purposes.
Qualifications
Three or four year bachelor degree or equivalent
Deep knowledge and passion for the performing arts
Minimum 3 years of related experience in a performing arts venue, theatre, or concert venue
Exceptionally high aptitude for spoken and written word including experience with grant writing and reporting
Ability to problem solving and handle time sensitive issues
Skilled with technology and at least a basic understanding of entertainment production
An aptitude for productivity related applications such as Google or Microsoft office suite
What We Offer
Talented and committed employees are the driving force behind student success. We strive to be an employer of choice among Canadian post-secondary institutions.
At Mount Royal University, we recognize that people are a combination of many intersecting identities; we work to cultivate an environment that welcomes the whole person, and harnesses the strength that is available in our diversity, creating a rich and inclusive workplace.
Investing in the learning and development of our employees benefits the individual and the University. A variety of services, resources and programs encourage a healthy, productive workplace. Mount Royal University offers a competitive total compensation package including health and dental benefits, pension, health and personal spending accounts, paid vacation, winter holiday closure, personal days and a free membership in our fully equipped recreation centre.
Our campus offers the convenience of a full medical clinic, dentist and pharmacy, as well as a variety of wellness services such as physiotherapists and massage therapists. Campus Recreation offers many activities, including personal training, fitness classes, climbing, aquatics, sports, tournaments and certifications for students, employees and the public.
Please note:
Effective January 1, 2022, Mount Royal University will require all employees to be fully vaccinated with a Health Canada approved COVID-19 vaccine. Currently, employees must be either vaccinated or provide rapid test results twice a week.
Closing Date: Open until a suitable candidate is found
A cover letter and resume should be submitted in one .pdf document. Please title your .pdf document as follows: [Last Name], [Requisition Number].pdf (ex. Smith, 999999.pdf).
We thank all applicants for their interest. Only applicants selected for an interview will be contacted. After the close date, you can check on the status of your application through your Career Centre. New career opportunities arise frequently and are posted as they become available. Please check back often to view our latest postings on our Career Opportunities page. All qualified candidates are encouraged to apply; however, Canadians and permanent residents will be given priority. Mount Royal University hires on the basis of merit and is strongly committed to fostering diversity as a source of excellence, intellectual and cultural enrichment, and social strength. We welcome applications from those who would contribute to the further diversification of our staff, faculty and their scholarship including but not limited to Indigenous Peoples, women, persons with disabilities and persons of any sexual or gender identity, ethnic, national or socio-economic background, religion or age.
Job Type: Full-time"
"Regional Manager, Toronto & East Ontario - Toronto, ON - Indeed.com","Join a team that is changing millions of lives.
Align Technology, Inc. (NASDAQ: ALGN), makers of the Invisalign® system, and iTero® intraoral scanners, is the industry leader and innovator in medical devices which focuses on revolutionizing the dental and General practitioner dentistry industry. Align Canada opened its first office in the heart of downtown Toronto in 2017 after more than 15 years servicing the Canadian market. With a trajectory accentuated by accelerated growth and innovation, Align Canada continues to reinforce its consumer presence as the most advanced clear aligner system in the world while building a highly regarded employer brand in Canada, being certified as a Great Place to Work in 2019 and again in 2020.
At Align Technology, we believe a great smile can transform a person’s life, so we create technology that gives people the confidence to take on whatever is next. We revolutionized the General practitioner dentistry industry with the introduction of the Invisalign system, and we have never lost sight of that spirit of innovation.
Our teams are constantly pushing the boundaries of what is possible…….so are you ready to join us?
About this opportunity
Your mission as a
Regional Manager, Dental
is to lead a team of Territory Managers (sales representatives) to help our customers (Dentists) deliver superior clinical outcomes with an enhanced patient experience fueling their continued growth and digitization. Our success depends on enabling doctors to thrive and applying strategies for key accounts to accelerate revenue and higher case volume.
You will lead the strategy development and execution within a specific geography to motivate and inspire a team that is responsible for selling directly to professional business owners (Dentists) transforming an analogue process with clear aligners and innovative digital solutions that make straightening teeth easier, faster, and more accessible – helping practitioners grow their business and increase patient satisfaction.
In this role, you will…
Provide leadership to a team of sales professionals to achieve weekly, quarterly and annual regional sales targets in one-on-one, region, and group settings.
Manage, direct, coach and motivate a team of 8 to 14 Sales Representatives/ Territory Managers, including development of sales plans, targets, and strategies and the removal of obstacles to success.
Hire, coach, manage and develop of all Territory Managers within the region to develop a high-performance team.
Provide training in product knowledge, selling skills, and territory management.
Evaluation and coaching of Territory Managers – thru observation during co-travel, frequent feedback and the analysis of data.
Ensure the effective fulfillment of objectives and deadlines assigned to the group.
Provide all appropriate reporting, with insights as to opportunities and risks to the National Sales Director, including feedback from customers and Sales Representatives/Territory Managers
Lead a team to apply a consultative selling approach, in either an in person or virtual context, to provide insights to customers regarding industry trends and consumer profiles to inspire them to modernize and grow their business; assisting them in implementing digital technology and refining office processes.
Utilize data/analytics to help customer’s drive decision making
Support your team to educate customers on products to ensure the practice is clinically comfortable with Invisalign and iTero products and services
Facilitate cross-functional communications (e.g., doctor, treatment coordinator, clinical assistant, education, marketing, product development) to develop an in-depth understanding of the customer’s business needs to clearly articulate fit with the specific Align products, digital platform, and solution capabilities
Orchestrate additional internal company resources to optimize the customer experience and provide ongoing promotion of Align solutions
Comply with all safety policies, practices and procedures. Report all unsafe activities to supervisor and/or Human Resources.
Participate in proactive team efforts to achieve departmental and company goals. Be creative, self-disciplined and capable of identifying and completing critical tasks independently with a high sense of urgency
In this role, you’ll need …
Bachelor’s degree and/or equivalent experience required
Minimum of 3 years of professional sales management experience in a B2B environment or 3 years of sales experience with Align Technology, Inc.
Previous experience in sales management is preferably in the health care capital equipment industry, medical device or, sales environments such as consumables or implantable to the professional channel through doctor offices, or from companies that provide a high level of management training and development, such as GE Medical or J&J.
Proven track record of leading teams to achieve sales effectiveness and targets; demonstrating a relentless drive to achieve results and self-initiative, demonstrating proficiency in both an in person and virtual environment.
Business & Marketing knowledge: Ability & comfort having business discussions (Cash Flow Analysis, ROI, P&L) and asking the right business questions
Experience selling multiple products/services and tailoring solutions to diverse customer needs; demonstrating comfort with having clinical discussions with both Invisalign and iTero Products
Strong focus on teamwork and a proven experience building and leveraging relationships with internal and external stakeholders and partners
Capacity to execute marketing plans and manage budgets and expenses
Strong organizational and prioritization skills
Ability to read, analyze, and interpret common scientific and technical journals, financial reports, and legal documents.
Ability to respond to common inquiries or complaints from customers, regulatory agencies, or members of the business community.
Proven capability to navigate through change and operate with speed and agility
Qualified candidates are strategic leaders who will prioritize and maximize business opportunities while building trust and providing great customer experience and demonstrating a high degree of integrity
Strong communicators and collaborators with exceptional oral and written communication to diverse audiences; effective & engaging presentation skills
Proficiency with full suite of Microsoft Office applications. Experience with a CRM system, Salesforce preferred.
Regular travel (up to 50%) within assigned geographical territory required with the possibility of some overnight travel required. Some travel to the US will be required.
Candidates are required to be fluently English/French for all roles in Quebec, and desirable for candidates in Ottawa and New Brunswick
Legally entitled to work in Canada and travel to the US on occasion.
Possesses a valid driver’s license and a good driving record
Sound like a good fit?
Great! Click the ""Apply"" link to let us know you are interested. Not the right fit? Don’t worry, Align is quickly growing so we are creating more opportunities to expand our Align family. Please consider joining our Talent Network to receive notifications about future jobs or sharing this opportunity with others in your network.
About Align
Align Technology is a publicly traded medical device company that is
transforming smiles and changing lives
. Our global team of talented employees develop innovative technology, tools and treatment options to help dental professionals worldwide achieve the clinical results they expect. Our digital ecosystem combines the power of technology to create beautiful smiles through the integration of AI and machine learning, digital imaging and visualization, biomechanics and material science to develop the Invisalign system, the most advanced clear aligner system in the world; iTero Intraoral Scanners and OrthoCAD digital services. Did you know? Align is the world’s largest manufacturer of custom 3D-printed materials.
By joining Align, you will be part of a global, fast-growing company in one of the most dynamic industries. Great people, innovative technologies, and meaningful work – these are just some of the things employees say make Align Technology a great place to work.
We respect your privacy. Please review our
Applicant Privacy Policies
for additional information.
Global Diversity Statement:
At Align, we believe in the power of a smile, and we know that every smile is as unique as our employees. As we grow, we will continue building a workforce of diverse cultural backgrounds and life experiences and fostering a culture of open-mindedness and compassion for all our employees. We live our company values by promoting healthy people and healthy communities. All with the intent of changing millions of lives, one unique smile at a time.
#LI-JM1
#LI-REMOTE"
"NonEmergancy Medical support Driver (For Veterans) - Fredericton, NB - Indeed.com","Wheels for wise is registered with Veteran Affairs independence program who assist Veterans and others to get to and from medical appoints, such as doctors appointments, physio, dentist, day surgeries, massage and many others. First company of its kind in the Atlantic we are ever growing to serve the needs of our clients. This is an amazing opportunity for someone semi-retired or wishes to help Veterans in your area.
We are currently looking for a driver/support worker in or around the Fredericton area.
Veteran / Retired RCMP preferred but not necessary Position is part-time / Casual 5 to 30hrs a week which depends mostly on employees request
MUST have clean drivers abstract
MUST pass vulnerable sector check
MUST be able to temporarily support someone's weight
Mileage Paid when utilizing personal vehicle
in addition to hourly wage
PREFERRED Location of driver is in Fredericton, Oromocto, Jemseg, Nackawic or Minto/Chipman areas
First Aid is considered an asset but not necessary
Polite and Caring Demeanor
Smartphone required
Experience with individuals with PTSD is an asset
More info see. www.wheelsforthewise.com
Part-time hours: 10 per week
Job Types: Part-time, Casual
Salary: From $16.19 per hour
Schedule:
Monday to Friday
No weekends
On call
Application question(s):
Are you a Veteran?
Do you have a clean drivers Abstract and Criminal Report?
Experience:
driving: 10 years (required)
Work remotely:
No"
"Graphic and Marketing Coordinator - Toronto, ON - Indeed.com","Altima Dental is hiring a Full Time Graphic and Marketing Coordinator to join our team. This role reports to the Marketing and Communications Manager and will be a remote role until December 31, 2021.
Our office is moving to Yonge and Sheppard in January 2022 and at that time we will advise of remote work status.
When you join Altima Dental, you start more than just a new job. You also join a thriving community of dental professionals and support staff that are completely dedicated to providing the best care possible to patients. The Altima Dental Family is a nation-wide network of supportive and talented people who love dentistry. Altima Dental was founded in 1993 by two dentists, Dr. Sven Grail and Dr. George Christodoulou. Their passion for dentistry has been a key factor in the growth of the Altima group of dental clinics over the past 26 years. Originally starting with just one clinic, Altima now provides compassionate dental care to more than 250,000 patients yearly at more than 150 clinic locations across Canada. With clinics in six different provinces and Altima’s promote-from-within culture there is a multitude of opportunities for employees to grow and develop. An empowering and positive environment. A spirit of giving back. A sense of belonging. Contributing to a bigger purpose. A team committed to helping you be your best. These are just some of the things that set Altima Dental apart. We would love to have you join us in our mission to provide #CareBeyondYourSmile. Start your journey with Altima Today!
Reporting to the Marketing and Communications Manager,
The Graphic and Marketing Coordinator
is responsible for the visual identity associated with internal and external marketing and communications campaigns.
A dually split role, the ideal candidate will support the department with:
Key Responsibilities:
Graphic Design
Design all marketing collateral for print and digital channels (including, but not limited to) websites, presentations, brochures, posters, banners, postcards, billboards, outdoor ads, email templates, landing pages and infographics.
Maintain brand guidelines (for Altima and Affiliates) ensuring that all collateral follows visual identity standards and maintains consistency with appropriate brands.
Manage end-to-end (including consulting with team members, designing, selecting vendors, quality checks and managing print requests) development of all internal and external marketing collateral ensuring their delivered on time and within budget.
Take projects from start to finish with minimal supervision.
Preparing files for printers and publications.
Assisting with collateral creation for monthly promotions
Manages the creative facets of newsletters, assists with email template and landing page design.
E-marketing/Social Media
Work closely Support Centre Staff and Regional Managers to develop strategic social media campaigns. Creating, managing and scheduling content across all platforms (including, but not limited to Facebook, Twitter, Instagram, and YouTube).
Measuring, analyzing and reporting on social metrics/results.
Pulling and compiling monthly trend reports, analyzing data to make sound recommendations for campaign optimization and future program strategy.
Administrative duties as required (i.e. invoice processing, administration, assistance with HR duties, etc.).
Qualifications:
A degree or diploma in Graphic Design, Marketing or another related field or equivalent experience.
Minimum 2 years’ experience in graphic with a current portfolio.
Minimum 1-3 years of experience in a social media role, focused on content development, scheduling/posting as well as managing on Facebook, LinkedIn, Twitter, Instagram and YouTube.
Superior skills using the Adobe Creative Suites (InDesign, Illustrator, Photoshop, Bridge, Acrobat)
Proficient in MS Office (predominately Word and Excel)
Positive, enthusiastic and passion for design.
Highly artistic and creative and intuitive with keen eyes, attention to detail, and consistency.
Strong interpersonal and customer service. You're a team player and understand how your skill set benefits the overall team.
Knowledge of HTML, CSS, HubSpot CRM, and video editing software is an asset.
A creative thinker, with an eye and mind for clean typography, layout and user experience
Altima strongly believes that diversity in the workplace is essential to our success. As a result, we are committed to providing equal opportunities regardless of race, color, ancestry, religion, sex, national origin, sexual orientation, age, citizenship, marital status, disability, gender identity or Veteran status.
We thank all candidates for their interest, however,
only those selected for an interview will be contacted.
#recruitaltima"
