Title,Description
"Financial Analyst - Toronto, ON - Indeed.com","RiskCheck Inc. is Canada's leading Environmental, Health & Safety risk management consulting company. Reporting to the Chief Executive Officer, the Financial Analyst will be a hands-on, self-starter who is involved in helping drive organic growth, by bringing an analytical, data driven approach to addressing business issues.
The successful candidate should be based in the Greater Toronto Area (GTA) and must be comfortable working in a stand-alone function.
Primary Functions:
The role is very broad and will involve all aspects of accounting, reporting, analysis, AP, reconciliations, HST reporting, journal entries, month/quarter/year-end reporting and working on ad hoc requests.
Key Responsibilities:
Provide analytical, forecasting, reporting, and project support to senior management
Produce monthly reports, which include key metrics, financial results, and variance reporting
Spearhead the annual and quarterly budgeting and forecasting processes
Identify opportunities for performance improvement across the organization
Identify and drive process improvements, including the creation of standard and ad-hoc reports, tools, and Excel dashboards
A/P and A/R
Various accounting reconciliations and related journal entries
Bank reconciliations
Evaluating current capital expenditures and depreciation
Establishing and evaluating profit plans
Provide creative alternatives and recommendations to reduce costs and improve financial performance
Prepare corporate income tax returns and supporting working papers.
Other duties as required
Experience and Qualifications:
Required:
Bachelor’s degree or MBA in accounting, business administration, economics, or finance
1-3 years of progressive Finance/Accounting experience
Demonstrated experience with financial analysis, reporting, budgeting, and forecasting
Experience completing Canadian corporate income tax, payroll tax, and sales tax returns
Preferred:
Achieved or working towards a professional accounting designation, e.g., Chartered Professional Accountant (CPA) or similar
Prior experience working in a stand-alone function
Skills and Abilities:
Advanced Microsoft Excel capabilities skills building budgeting and financial reporting models and related analytics
Knowledge of ERP and business intelligence software
Strong analytical skills and the ability to think through problems, assess a variety of factors and recommend solutions
Tech savvy and ability to hit the ground running
Strong working knowledge of Excel and financial modeling
Comfortable working in a stand-alone function
Superior written, verbal, and presentation skills
A self-starter, proactive, and motivated to create positive change
Detail oriented, organized, and can prioritize items quickly and pragmatically
Knowledge of QuickBooks
RiskCheck provides: Extended Health & Dental, professional development programs, growth opportunities, work from home opportunity, company social events, other benefits.
RiskCheck is an equal opportunity employer committed to diversity, equity, and inclusion. We consider all qualified applicants and are proud to create a workplace that reflects the diversity of the communities we serve. Please notify us if you require accommodation at any time during the recruitment process.
We thank all applicants for their interest, however only those selected for an initial interview will be contacted."
"Accountant - Nanaimo, BC - Indeed.com","Notice of Employment Opportunity
Accountant
Permanent Full-Time (External)
Finance
Competition No.:2021-103
ABOUT THE ROLE
The Regional District of Nanaimo has an employment opportunity for an Accountant in the Corporate Services Department. Reporting to the Manager, Capital Accounting & Financial Reporting, the Accountant assists in the coordination and maintenance of the District’s accounting records. This position exercises considerable independent judgement. Interpreting and applying accounting theory and principles to the preparation of the District’s and Hospital District’s annual financial reports, coordinating the annual audit, coordinating and maintaining capital asset accounting systems for the District, and preparing a variety of general ledger reconciliations and special projects as may be required from time to time.
QUALIFICATIONS
Qualifications include an undergraduate degree in Accounting or related discipline, CPA designation (formerly CGA, CMA or CA), plus five years of prior job related accounting experience or an equivalent combination of training and experience in a local government setting.
POSITION DETAILS
This is a permanent full time Union position. The (2021) rate of pay is $41.36 to $43.54 per hour. The position offers an attractive benefits package as provided within the Collective Agreement between the Regional District of Nanaimo and the Canadian Union of Public Employees, Local 401.
A Criminal Record Check is required as a condition of employment with the Regional District of Nanaimo.
SKILLS/EDUCATION
Excellent interpersonal, written and verbal communication
Undergraduate degree in Accounting or related discipline
Five years of prior job related accounting experience or an equivalent combination of training and experience in a local government setting.
APPLICATION DETAILS
Please quote competition 2021-103 and submit a cover letter and résumé clearly outlining your education, experience and qualifications as they relate to this position.
Click Here
to apply.
Applications will be accepted until:
4:00 pm, on November 24, 2021
.
Date Posted: November 09, 2021
We thank all applicants for their interest; however, only those selected for further consideration will be contacted.
Job Description
Education : Bachelor’s degree
Experience : 5 years or more"
"Director of Finance - Toronto, ON - Indeed.com","Location:
Toronto
Compensation: $120-130 plus package
Job Number: 3000
About This Job:
Duties & Responsibilities:
Overseeing and working through the Finance Department team;
Develop and maintain timely and accurate financial statements in accordance with generally accepted accounting principles (GAAP)
Develop, implement, and ensure compliance with internal financial and accounting policies and procedures
Develop sound financial controls, processes and policies designed to safeguard the assets and business dealings of the company
Ensure that all statutory requirements of the organization are met including, Withholding Payments (CPP, EI), Income Tax, Goods and Services Tax, Employer Health Tax
Oversee the preparation of all supporting information for the annual audit and liaise with external auditors as necessary
Document and maintain complete and accurate supporting information for all financial transactions
Develop and maintain financial accounting systems for cash management, accounts payable, accounts receivable, credit control, and petty cash
Reconcile bank and investment accounts
Review monthly results and implement monthly variance reporting
Manage the cash flow and prepare cash flow forecasts in accordance with policy
Oversee the bookkeeping function including maintenance of the general ledger, accounts payable, accounts receivable and payroll
Develop and implement policies and procedures to ensure that personnel and financial information is secure and stored in compliance with current legislation
Manage the acquisition of capital assets and ensure that assets are properly recorded, amortized, and disposed of as appropriate
Develop and manage an effective costing system for the business
Create financial models analyzing strategic business decisions
Payroll preparation and administration
Oversee all payroll functions to ensure that employees are paid in a timely and accurate manner
Negotiate and manage the employee insurance and benefits plans
Process and submit statutory and benefits remittances on time
Issue annual T4s and T4As
Budget preparation
Establish guidelines for budget and forecast preparation, and prepare the annual budget in consultation with the CEO and senior management team
Assist Managers with the preparation of budgets for funding applications
Oversee and manage a monthly and quarterly budget reporting process
Project management accounting
Maintain financial records for each project in a manner that facilitates management reports
Provide accurate and timely reporting on the financial activity of individual projects
Information technology
Oversee the Information Technology department for the company
Evaluate the need for new technology to meet the organization’s financial data processing, control, and reporting requirements
Advise on appropriate technology that meets the organization’s information requirements and financial resources
Ensure an efficient and reliable IT system
Oversee the financial side of the ERP system
Risk management
Monitor risk management policies and procedures to ensure that program and organizational risks are minimized
Advise the organization’s leadership on appropriate insurance coverage for the organization
Negotiate with Bank for lines of credit or other financial services as required and appropriate
Oversee and develop effective currency hedging strategies
Office administration
Oversee and supervise the administrative function of the organization including reception, property/facility management, safety of the work environment, and provision of furnishings and equipment necessary for effective operations
Oversee the management of all leases, contracts and other financial commitments
Monitor all legislation relevant to the organization (employment standards, occupation health and safety, human rights, etc) and all regulations on professional certification to ensure that the organization is compliant
General
Implement process improvements relating to the finance team"
"bookkeeper - Winnipeg, MB - Indeed.com","Business Equipment and Computer Applications
MS Excel
MS Windows
MS Word
Accounting software
MS Outlook
Specific Skills
Reconcile accounts
Prepare trial balance of books
Post journal entries
Maintain general ledgers and financial statements
Calculate and prepare cheques for payroll
Prepare other statistical, financial and accounting reports
Keep financial records and establish, maintain and balance various accounts using manual and computerized bookkeeping systems
Security and Safety
Criminal record check
Work Conditions and Physical Capabilities
Repetitive tasks
Attention to detail
Personal Suitability
Accurate
Dependability
Reliability
Organized"
