Title,Description
"Dental technologist ,technician - Vancouver, BC - Indeed.com","Salary: $21.00 - $25.00/Hourly
Job Type: Full Time, Permanent
Start Date: As soon as possible
Language: English
Minimum Education: Technical Training
Positions Available: 2
NOC Group: Dental Technologists, Technicians and Laboratory Bench Workers (3223)
NOC Job Title: Dental Technician
Expires in 25 days
Expires: 2021-12-18
Posted: 2021-10-19
Last Updated: 2021-10-19
Job Location(s)
Vancouver, British Columbia
Job Description
Dental Laboratory assistant
We are looking for a highly capable dental laboratory assistant to help construct dental prostheses and devices for our patients. You will assist on filling orders received from our dentists, preparing wax replicas from dental impressions, and fabricating high-quality dental prostheses and devices.
To ensure success as a dental laboratory assistant, you should demonstrate extensive knowledge of dental technologies and experience in a similar role. A top-notch dental laboratory expert will be someone whose expertise results in highly functional, safe, and esthetically pleasing dental replacements.
Responsibilities:
The candidate will assist technician and other colleagues on:
Restoring or replacing natural teeth by fabricating crowns, fixed and removable bridges, dentures, and dental implants.
Constructing dental prostheses for implantology and maxillo-facial reconstructions.
Receiving physical dental impression molds or computerized models from dental practices and studying dentists' instructions.
Encasing wax replicas of dental impressions with suitable mold materials.
Constructing prostheses and devices by replacing wax with plastic, metal, or ceramic materials.
Polishing and finishing dental prostheses and devices prior to placement by dentists.
Making adjustments to dental prostheses and devices before final placement.
Managing supply inventories, performing routine equipment maintenance and facilitating repairs.
Documenting processes, as well as adhering to industry regulations and safety standards.
Keeping informed of advancements in the field of dental laboratory technologies and techniques.
Requirements:
Accredited dental laboratory technology program.
At least 2 years of experience as a dental laboratory technician.
In-depth knowledge of dental prostheses, devices, and related technologies.
Experience in constructing, replacing, repairing, and restoring dental devices.
Manual dexterity and precision.
analytical and problem-solving skills.
Great communication and collaboration abilities.
Excellent organizational and time management skills.
How to Apply
Expiring: Dec 18, 2021
Phone:
6043409757
Email: kdlaboratory877@gmail.com"
"Dental Assistant - Richmond, BC - Indeed.com","About us
Bridgewater Richmond Dentist is a small business in Richmond, BC. We are professional, fast-paced, and supportive, and our goal is to provide a positive and happy environment for everyone to grow in this practice .
Our work environment includes:
Company perks
Modern office setting
Growth opportunities
We are seeking for a Dental Assistant or a Certified Dental Assistant who is available to work either part time 1-3 days a week or full time 4-6 days a week.
Days are:
Monday to Saturday 10-6pm at Lansdowne Location
When you apply, please kindly submit your resume and cover letter with the days you available to work. It can be an opportunity to pick up extra shifts to supplement 1-2 or even 3 days on top of your existing job during the week or it can be an opportunity for a permanent 3-6 days position.
Tracker and Chinese an asset but not required. New grad from chairside dental assisting or certified dental assisting welcome. Can also be former dentist in your original country.
Free parking all day. Skytrain access at Lansdowne station in Richmond. Very convenient location in the mall.
Part-time hours: 7-48 per week
Job Types: Full-time, Part-time, Temporary, Permanent
Salary: $19.00-$32.00 per hour
Additional pay:
Overtime pay
Benefits:
Dental care
Disability insurance
Extended health care
Life insurance
Store discount
Tuition reimbursement
Vision care
Schedule:
8 hour shift
Day shift
Monday to Friday
Weekend availability
COVID-19 considerations:
Full PPE for Covid
Experience:
Dental Assisting: 1 year (preferred)
Licence/Certification:
Dental Assistant (preferred)
Work remotely:
No"
"Moose Jaw Community Clinical Case Manager - Moose Jaw, SK - Indeed.com","ABOUT US
Turning Leaf Support Services is a non-profit, charitable organization dedicated to providing crisis and treatment
services to those experiencing intellectual challenge and mental illness.
Our services are provided by caring, skilled community members that are dedicated to helping those
experiencing intellectual challenge and mental illness. Our employees are deeply committed to working with
participants in addressing the seemingly insurmountable obstacles they face every day: addiction,
discrimination, homelessness, poverty, stigma, isolation, and loneliness. Turning Leaf Support Services builds
trusting relationships with people, helping them engage a process of change and providing a sense of hope.
Being a part of the Turning Leaf family means you will have the opportunity to make a direct and positive impact
on people’s lives every day. The work is challenging in all the best ways and deeply rewarding. Many of our
employees say they have found their life’s purpose while working here.
Turning Leaf Support Services provides ongoing, meaningful training to ensure we remain an industry leader,
that our employees have the skills and confidence to be successful in their careers, and so our participants
receive the best possible support services to help them live the life they imagine for themselves.
We are an organization that pledges to uphold a workplace culture of inclusion, diversity, compassion, and
respect. We are constantly growing, and we are always hiring. If you feel called to be a part of the Turning Leaf
team, please apply today.
COMMUNITY CLINICAL CASE MANAGER JOB SUMMARY
Turning Leaf Support Services’ Supported Independent Living Division is designed to provide person-centered
supports to adults (or individuals transitioning to adulthood) who are living with intellectual challenge,
developmental disability and/or mental illness.
Reporting to the Regional Program Manager, the Community Clinical Case Manager is responsible for the
operations of all services provided to all Turning Leaf participants within their assigned region.
Specifically, the Community Clinical Case Manager is responsible for overseeing the treatment/support service,
management, and ensuring that program objectives and individual support plans/contracts are delivered and
developed and maintained according to organizational standards.
ESSENTIAL REQUIREMENTS
Cover letter and updated resume
18 years of age or older
Available anytime 35 - 40 hours p/week (Full time)
Clear Criminal Record Check with Vulnerable Sector Check (no older than three months)
Valid Standard First Aid / CPR Certification
Completion of a Post-Secondary Education in Human Services (Certificate, Diploma or Degree) is
considered an asset
A minimum of three years’ experience in providing service to intellectually challenged adults and those
experiencing mental illness preferably in Case Management or Supervisory experience in the Human
Services field
Experience in the development of behavioural plans, risk management (organizational and participant
related) and the person-centered approach
Knowledge of behaviour modification, supportive communication, and the stages of change
Experience working with individuals struggling with addictions
Experience working with individuals with FASD, Schizophrenia, ODD, ARND, or ABI
Dedication to continuous profession/skill development
Experience effectively navigating through potentially high-risk situations through verbal de-escalation
techniques, and the ability to stay calm in potentially high stress situations
QUALITIES AND QUALIFICATIONS
Turning Leaf Community Clinical Case Manager must possess the capacity to be aware of and control one’s
emotions. Moreover, Community Clinical Case Managers must be able to handle interpersonal relationships
judiciously, empathetically, and professionally while executing their responsibilities and providing Turning Leaf’s
person-centered supports.
In addition, Community Clinical Case Managers must possess experience with and skills in:
Strong attention to detail, organization, task tracking and follow up
Self-starter and proactive approach in resolving problems and issues
Extensive knowledge of intellectual disabilities, mental health disorders and addictions
Excellent oral and written communication skills, with ability to write detailed reports
Ability to handle multiple projects and priorities in a professional and timely manner
An ability to incorporate the clinical literature pertaining to the population into practical approaches
with participants and the ability to analyze and interpret data
Ability to effectively present information in a clear manner, demonstrate procedures and respond to
questions
Ability to lead large teams utilizing a servant leadership approach
Proficient in working cooperatively with multiple departments and other Managers
The ability to create and deliver training, provide ongoing oversight and coaching to a staff team
Possess the ability to work independently and remain self-motivated
Ability to interact with all levels of personnel. Treat all with dignity and respect. Open and receptive to
their needs
SUMMARY OF JOB DUTIES AND RESPONSIBILITIES
Administrations and Documentation:
Maintain up-to-date files on participants (static and dynamic information)
Maintain daily process notes on Management activities and multi-system interactions
Maintain Semi-Annual reports on participants
Write incident reports in collaboration with Regional Program Manager with support from the service
directors
Assist the Regional Program Manager with support from the service directors in acquiring monthly
reports, bi-weekly electronic timesheets and staff logs
Attend supervision meetings and planning meetings as required
When necessary, oversee the financial management of participant funds and maintain accurate records
of such financial management in collaboration with support workers
Oversee and maintain an awareness of cumulative health care of the participant (including general
practitioner, dentist, ear and eye specialists, and psychiatrist appointments)
Maintain a list of accurate medications per participant
Report at-risk participant activities verbally (including via telephone) and in writing to Regional Program
Manager
Assist Regional Program Manager with staffing and scheduling as required
Support Supervision:
Employing a person-centered approach, work with Community Support Workers to engage with their
participants on a regular basis
In consultation with Support Team, develop an individualized profile and support plan for the
participant, using available data pertaining to the participant
Maintain an awareness (and record) of the participants’ known diagnoses and symptomatic behavior;
Develop support plans to reflect the participant’s mental health experience
In conjunction with support team, engage participant in a process of goal setting, planning and
acquisition as it pertains to living safely and independently in the community
Assist staff with or direct a process of safety plan development
When appropriate, participate in regular support team meetings
In collaboration with participant support team, address needs pertaining to participant transition as
necessary
When deemed appropriate by the support team, be responsible for the planning and implementation of
transition of participants to other programs within or outside of Turning Leaf
Implement recreation/leisure programs and oversee the non-crisis management activities for
participants as required
Supervise and schedule (as needed) community support workers with assigned participants
Assist the Community Support Workers with problem solving around providing direct service to their
participants
Other duties as assigned
COMMUNITY CLINICAL CASE MANAGER BENEFITS
Salary Paid
Health Benefits immediately
GRRSP Program (optional)
Enrolled in the company corporate cell phone plan
Three weeks vacation
Paid Wellness Time
Bereavement and Compassionate Care Time
Mileage Reimbursement (when applicable)
Employee Assistance Program (EAP)
HOW TO APPLY
Please submit your detailed cover letter and resume to hr.sask@turningleafservices.com"
"PSYCHIATRIST - London, ON - Indeed.com","CPRI is an organization, directly operated by the Ministry of Children, Community and Social Services providing trauma-informed and highly specialized treatment and targeted intervention services for children and youth in Ontario with complex combinations of special needs. These needs include severe behavioural and emotional challenges, developmental disabilities, autism, and mental health. Services are provided through both residential and outpatient interdisciplinary teams.
CPRI also conducts applied research and develops evidence-informed education to build knowledge and capacity in the mental health and developmental services sectors. We work to provide accessible and inclusive services that are culturally sensitive and trauma-informed. For additional information please see the
CPRI website.
CPRI is looking for a child and adolescent psychiatrist to work on one of our residential teams along with some outpatient care. This position is full-time and permanent with benefits through the Ontario Public Service (OPS).
Remuneration/Benefits
The position provides remuneration that is negotiated through collective agreements that exist within the OPS and competitive with similar positions elsewhere. This includes a comprehensive benefits package, 5 weeks paid vacation, 2 weeks educational time, annual financial support for professional fees and educational costs.
Location
CPRI is located in London, ON which is known as the Forest City given vast green space friendly to hikers, bicyclists, parks and many diverse activities. London is centred around multiple great lakes with close proximity to beaches, camps and equal distance to Toronto and Detroit. The city has many amenities that caters to all including the campus life of Western University. For more information about London,
please visit the official website for the city of London.
Note
: This position is within the Association of Ontario Physicians and Dentists in Public Service (AOPDPS) and the salary for this position is $262,502 to $303,878 per year.
What can I expect to do in this role?
In this role, you will:
1. Provide Paediatric Psychiatry services to children/youth that are consistent with standard practice and trauma-informed care
2. Provide teaching activities internally or externally within your expertise/interests and consider optional associated responsibilities through Western University (WU) with formal expectations outlined by the Department of Psychiatry and approved by CPRI
3. Support collaborative research initiatives with WU, CPRI and/or the Ministry, ranging from supportive to active involvement
4. Provide assistance to the Medical Director in aspects of governance, policy formation, curriculum planning, program implementation, surveillance and evaluation, as appropriate.
5. Attend relevant meetings and performing relevant administrative functions at CPRI as well as participating in Ministry initiatives
6. Maintain CPRI discipline-specific key performance indicators within clinical services;
7. Ensure documentation, charting and records retention of clinical, diagnostic and treatment information/reports in paper and/or electronic format are consistent with College of Physicians and Surgeons of Ontario (CPSO), CPRI and Ministry requirements;
Clinical Setting/Approach
Residential care includes a large inter-disciplinary team consisting of psychiatry, psychology, social work, occupational therapy, speech and language pathology, paediatrician, nursing, child/youth workers and others. Teams use evidence-informed clinical approaches in supporting children/youth which is individualized and trauma-informed. Length of service is typically up to 12 weeks with a focus on interdisciplinary assessment, strategy development to manage challenging behaviours and medication management as indicated. Outpatient services aim to provide tertiary level consultation / intervention for children/youth to community physician referrants. The provision of psychiatric services can utilize a hybrid model of virtual and in-person care. On call responsibilities are shared amongst the psychiatrists for residential and outpatient services.
How do I qualify?
Mandatory
For this role, you must be a member in good standing with the CPSO, with a valid license to practise medicine in Ontario; and certification (or eligibility) as a specialist in paediatric (child and adolescent) psychiatry and/or certification in psychiatry with the Royal College of Physicians and Surgeons of Canada (RCPSC) or specialist
standing in another jurisdiction, comparable to this certificate, such as the American Board of Psychiatry and Neurology.
Additionally, appropriate medical liability coverage is required.
Specialized Knowledge
You have specific knowledge and skills regarding all medical theory and practice related to paediatric psychiatry, as outlined in the residency training curriculum for child and adolescent psychiatry by the RCPSC.
You can assess, diagnose, treat and coordinate professional and technical treatment with staff in the management of young people with complex mental health and/or co-morbid developmental concerns.
You have knowledge of written legislation and guidelines, such as the Child and Family Services Act (CFSA), Ontario Hospitals Act (OHS), Regulated Health Professionals Act (RHPA), Hospitals Act (where applicable), Ministry directives, facility policies and procedures, and medical ethics.
Relationship Management and Interpersonal Skills
You can foster collaboration, partnership building and interpersonal skills with a diverse group of colleagues and professionals;
You have verbal and written communication skills and knowledge and skills in adult-based learning techniques and in clinical teaching to provide meaningful learning experiences for trainees.
Additional Information:
Address:
1 Permanent, London, West Region, Vulnerable Sector Check
Compensation Group:
Management Compensation Plan
Understanding the job ad - definitions
Schedule:
6
Category:
Health and Social Services
Posted on:
Tuesday, August 10, 2021
Note:
In accordance with the Ontario Public Service (OPS), Employment Screening Checks Policy (ESCP), the top candidate(s) may be required to undergo a security screening check. Refer to the above to determine the screening checks that are required for this position.
Required security screening checks along with your written consent, will be sent to the Transition and Security Office (TSO), Talent Acquisition Branch (TAB), HR Service Delivery Division (HRSDD) to evaluate the results. If applicable, the TSO, with your written consent, will request and obtain any additional employment screening checks that were not obtained directly by you.
A record under the Criminal Code and/or other federal offence record(s) does not automatically mean you will be ineligible for the position. The employment screening check(s) will only be reviewed and evaluated by the TSO for the purpose of making a security clearance decision. The details of an individual's employment screening check(s) will be considered in specific relation to the duties and responsibilities of the position being filled. Employment screening check records will be maintained by the TSO and kept strictly confidential."
"Full-Time Dental Assistant - Toronto, ON - Indeed.com","Liberty Village Dental is looking to hire a Full-Time Level 2 Dental Assistant to join our team of talented professionals. This position is permanent with working days Monday/Tuesday 9am-6pm Wednesday/Thursday1pm-8pm and Saturdays 9am-3pm. Experience working in a fast pace general dentist office is a must. Oral surgery experience is a bonus. Interested candidates can email a copy of their resume
Job Types: Full-time, Permanent
Benefits:
Extended health care
On-site parking
Schedule:
8 hour shift
Weekend availability
Work remotely:
No"
