Title,Description
"Conseiller(ère) marketing numérique - Montréal, QC - Indeed.com","SOMMAIRE DU POSTE
Pour accompagner la compagnie dans l’atteinte de ses objectifs de développement, PhysioExtra est présentement à la recherche d'un/e conseiller marketing numérique. Son rôle est d'intervenir comme personne ressource auprès des membres de la direction et du conseil d’administration.
Sous la responsabilité du directeur marketing et communication, le conseiller marketing numérique est chargé de concevoir et de réaliser les stratégies numériques visant à appuyer les orientations stratégiques du groupe, il s’assure ainsi de la planification et de l’exécution du plan marketing de l’entreprise. Il prévoit et structure la séquence des activités de manière à optimiser le déroulement des projets et d’assurer un service-conseil de haute qualité auprès des gestionnaires. Il doit également assurer la mise en œuvre et le suivi des projets et appuyer l’équipe dans le développement de stratégies visant à accroitre la visibilité de l’entreprise.
PRINCIPALES TÂCHES ET RESPONSABILITÉS
Contribuer à l’élaboration et la mise en œuvre du plan global de marketing et communication visant à promouvoir et à optimiser l’atteinte des cibles de la planification stratégique, tant sur le plan corporatif que pour chacune des cliniques;
Assurer la création et l’exécution complète des campagnes et initiatives numériques et en mesurer la performance, faire des recommandations et mettre en œuvre des actions pour une amélioration continue :
Traduire les objectifs d’affaires en objectifs de marketing numériques ;
Créer et communiquer des cibles et programmes de marketing ;
Assurer la création et la gestion de campagnes (courriel, AdWords, Facebook, etc.) dans le respect des orientations éditoriales, des budgets et des échéanciers.
Agir en tant que gestionnaire de communautés et rédiger en collaboration avec la coordonnatrice aux communications les textes publicitaires des différentes campagnes numériques (Facebook, LinkedIn, rédaction d’infolettres, etc.) ;
Participer au rayonnement de la marque principale PhysioExtra et des 4 marques affiliées au groupe;
Développer et mettre en place une stratégie de référencement pour augmenter la visibilité du groupe et ses marques affiliées sur le web afin d’assurer une exposition maximale ;
Gérer les résultats de marketing numérique, dont la planification initiale, la mise en œuvre, la surveillance, l’optimisation, l’analyse et la production de rapport ;
Développer et superviser l’ensemble des projets marketing ;
Identifier et analyser les besoins marketing nécessaires à la mise en œuvre des divers projets et en informer le directeur marketing et communication ;
Intégration de base des contenus dans les différents sites web du Groupe PhysioExtra ;
Gestion de la relation client avec l’outil Hubspot (gestion de campagnes marketing, repérer les opportunités et établir des stratégies, gestion des tableaux de bord, etc.) ;
Planifier, créer, suivre, et mesurer les indicateurs de retour sur investissements des campagnes marketing ;
Planifier, produire et réviser des contenus afin de positionner les différentes expertises du groupe PhysioExtra ;
Développer et maintenir à jour des outils de suivis (calendriers de projets, médias sociaux, contenus, événements, canevas, etc.);
Participer au développement et à la mise en œuvre de plans et campagne de relations publiques, de commandites, de communications, de responsabilité sociale d’entreprise et de marketing ;
Contribuer à l’organisation et la coordination des activités corporatives de l’entreprise avec les départements visés ;
S’assurer que les événements réalisés sont en lien avec la stratégie marketing de l’entreprise ;
Organiser des activités clients ou d’industrie et assurer une gestion de communauté en direct ;
Campagnes numériques :
rédiger et déployer la stratégie des médias sociaux et gérer les outils de communications électroniques (site web, blogue, médias sociaux, etc.) ;
Appuyer et conseiller les membres de l’équipe sur l’utilisation des médias sociaux et autres technologies du web.
Autres tâches et responsabilités
Gérer, coordonner les demandes marketing effectuées par les cliniques du Groupe PhysioExtra;
Agir à titre de conseiller expert en marketing auprès des membres de l’administration, des directeurs de groupe et des directeurs cliniques ;
Jouer un rôle décisionnel pour réaliser les objectifs de son secteur d’activité établis en collaboration avec le directeur marketing et communication ;
Émettre des recommandations et contribuer au développement stratégique à court et moyen terme de son secteur ;
Tenant compte des enjeux d’affaires, contribuer à la réalisation de la mission de l’entreprise ;
Participer à des conférences et des formations et entretenir son réseau professionnel afin de développer ses connaissances en ce qui a trait au marketing numérique ;
Effectuer toutes autres tâches nécessaires au bon fonctionnement de l’équipe marketing et communication;
Effectuer des suivis périodiques avec nos différents clients commerciaux.
HABILETÉS ET APTITUDES
Détenir de fortes habiletés en marketing numérique ;
Avoir la capacité de produire ou créer des contenus numériques pertinents pour convaincre, pour vendre, atteindre un objectif ciblé ;
Habileté rédactionnelle sur le web et les médias sociaux ;
Habileté en gestion de projet et capacité d’utiliser les outils de gestion de projet ou de partage d’information ;
Savoir gérer plusieurs projets simultanément et travailler sous pression ;
Faire preuve d’initiative, de créativité ;
Autonomie, sens de l'organisation et habileté à gérer les priorités ;
Grande capacité d’analyse et de synthèse ;
Facilité d’adaptation et bonne tolérance aux changements ;
Facilité à travailler en équipe ;
Intérêt marqué pour le milieu sportif, la santé ou la réadaptation (atout important).
QUALIFICATIONS ET EXIGENCES
Détenir un diplôme d’études universitaire en marketing avec une spécialisation en numérique, cybercommerce, communication interactive ou dans une discipline connexe;
Posséder une expérience d’au moins 5-7 ans dans un poste similaire;
Maitrise ou bonne connaissance de la suite Adobe Creative (Photoshop, InDesign) et MS Office;
Connaissance des outils Wordpress;
Connaissance du logiciel de client Hubspot (atout important);
Aptitudes en création de contenu et connaissances en marketing automatisé;
Maitrise des outils Excel;
Compétences en photographie, vidéographie, production et montage vidéo (atout);
Très bonne maîtrise de la langue française à l’oral et à l’écrit ; maitrise de la langue anglaise à l’écrit.
Pour postuler, rendez-vous sur le site du Grenier aux Emplois :
https://www.grenier.qc.ca/emplois/54758/conseillerere-marketing-numerique"
"Marketing Coordinator - Richmond, BC - Indeed.com","Fitness World is a gym for everyone. Convenient locations with new affordable memberships at a lower cost that give members access to the best of the best in fitness. We’re creating an amazing environment where every member can crush their fitness goals.
Position Summary:
Fitness World is looking for a self-motivated, highly organized Marketing Coordinator to assist with all aspects of the strategic marketing plan, from social media to events, and everything in between. This role will have a strong focus on growing Fitness World’s online brand presence through content creation and social media engagement, and will support Fitness World’s day-to-day marketing tasks.
Reporting to the Senior Marketing Manager, this position is an amazing opportunity for a high performing individual to be part of the full rebrand of BC’s largest fitness provider, plus get unparalleled experience in all aspects of marketing from digital campaigns and e-commerce to local store marketing, events and member experience initiatives.
Responsibilities:
Plan and execute marketing campaigns online and in-club and assist in the development and implementation of an effective brand strategy
Create and curate engaging photo and video content for social media, including maintaining content calendar and identifying new opportunities for social content
Work closely with the graphic designer to create engaging imagery for social media
Liaise with external agencies for digital marketing and social media initiatives, as well as promotional partners and suppliers
Support clubs in Local Store Marketing initiatives and in-club execution of marketing campaigns
Assist in inventory tracking and carry out administrative tasks, as needed
Perform competitive analysis and research on industry trends, as needed
Maintain weekly and monthly reporting on marketing initiatives
Qualifications:
Previous experience in marketing or communications
Previous experience in content creation, photography, video editing
Post-Secondary education in a discipline relevant to marketing or communications
Organization skills and the ability to multi-task and work under pressure to meet tight deadlines
Drive to succeed and willingness to creatively problem solve
Exceptional written communication skills
Strong knowledge of MS Office
Experience with Adobe Creative Suite an asset
Familiarity with HubSpot an asset
Valid Class 5 Driver’s License and willingness to travel locally to club locations
Fitness World Perks:
Competitive Pay & Paid Vacation
Group Benefits (dental, extended health & travel)
Complimentary Membership & Discounted Personal Training for You and One Other"
"Marketing Coordinator - Winnipeg, MB - Indeed.com","Marketing Coordinator
Who we are:
Creating the future vision for one of Winnipeg, Manitoba, Canada’s most prized treasures, Assiniboine Park Conservancy (APC) is the not-for-profit organization that oversees Assiniboine Park’s operations and ensures its ongoing redevelopment and financial viability. Our team is inspired to create and deliver extraordinary experiences for the people who visit and use the Park and Zoo including building friendly, supportive, effective relationships with stakeholders, community and the general public. We want to be a place where people share the wonders of nature in a way that inspires them to conserve it for the future.
Your Role:
The Marketing Coordinator will support the development and management of the marketing strategy for the Assiniboine Park Conservancy (APC), ensuring brand positioning is integrated and reflected across all consumer touchpoints and sales channels. Reporting to the Director, Marketing, the Marketing Coordinator will ensure the implementation of marketing strategies and execution across all APC brands, with the goal of supporting business objectives for Park-wide Programming and special events such as Boo at the Zoo, Brew at the Zoo, and Zoo Lights., APC Restaurants, Banquet Venues & Catering, Retail Outlets, and Education Programming & Workshops.
The Marketing Coordinator is integral in revenue generation for APC. This position will execute and provide assistance to ensure the continued growth of membership, loyalty, and ticket pricing programs across all APC brands such as, Zoo, The Leaf, and APC Signature Events. The Marketing Coordinator will collaborate with business unit leaders and assist in production coordination and installation of operational signage and other marketing campaign materials.
The Marketing Coordinator will support and coordinate marketing campaigns that drive awareness, affinity, and an emotional connection to the APC brand with a global audience design. This position will help to identify unique creative opportunities to build and integrate branding strategies and marketing campaigns that connect with people on any platform ensuring APC’s brand involves human and emotional storytelling and creates a successful landscape of educational, inspirational, and engaging content.
Qualifications:
A Bachelor’s Degree in business, marketing, or a related field.
An equivalent combination of education and experience may be considered.
Competent in all areas of marketing with 3-5 years of revenue focused business generation including strategy, plans, sales enablement, analytics, and an aptitude for leveraging digital marketing, digital advertising, and sales acceleration tools and technologies.
Proven ability to champion new ideas and initiatives and creates an environment that supports innovation; leverages fresh perspectives, breakthrough ideas, and new paradigms to create value in the market.
Excellent proficiency with computer programs including Microsoft Office software and a demonstrated aptitude for quickly learning new software programs.
What we have to offer:
Comprehensive group benefits (health, dental, life, travel) and RRSP plan
Employee Assistance Program
Free Parking
Zoo Membership
How to apply:
All interested applicants can submit their résumé and cover letter on our career website:
https://www.assiniboinepark.ca/careers
Deadline to apply:
December 8, 2021"
"Digital Marketing Specialist - Toronto, ON - Indeed.com","ABOUT STOREFORCE
StoreForce is deeply passionate about Specialty Retail – it’s in our roots. Every day we strive to help Specialty Retailers set a new standard for operational excellence and accelerate their results. We focus on building intuitive and powerful, made-for-retail software and support them with experienced, knowledgeable retail professionals who have walked in their shoes.
Our goal is to help Specialty Retailers around the world consistently deliver amazing customer experiences. With your help, Specialty Retailers will continue to look to StoreForce as the single most powerful tool they can have to run their Store Operations and maximum results.
OVERVIEW
The
Digital Marketing Specialist
is responsible for the distribution of StoreForce Marketing content through various digital channels including Website, LinkedIn, Twitter, Vimeo and YouTube. This role will also manage SEO, Digital Advertising and conduct all marketing analytics required to understand effectiveness of our initiatives. This role reports to the Director of Marketing and works collaboratively with the Content Marketing Specialist. The right candidate has experience executing digital campaigns in a B2B marketing environment, with a demonstrated ability for managing programs and tracking their performance against objectives. This role is based in our Toronto office.
RESPONSIBILITIES
Digital Marketing
– Distribute marketing content through various digital channels.
Research and identify target audiences/personas and devise campaigns that engage, inform and motivate;
Consistent distribution of content through various channels including Website, HubSpot, LinkedIn, and Google to support brand awareness initiatives;
Maintain the StoreForce Website (WordPress Gutenberg);
Prepares website analytics including site tagging;
Plans, executes and manages all social and digital communications including display and video ads, paid search and social media advertisements including organic social;
Creates and consistently manages all Google and LinkedIn Ads;
Work with Pay-Per-Lead and Referral programs on networks like G2 and Capterra to help us optimize our bids and improve our directory/page performance.
Marketing Analytics
– Conduct analytics to measure the effectiveness of our marketing efforts.
Conduct all analytics for our website, emails campaigns, events, and social media;
Maintain monthly reporting for Website;
Analyzes the performance and provides recommendations for all campaigns including organic and paid digital initiatives and eblasts;
Analyze and recommend on all SEO and PPC/SEM initiatives;
Actively building knowledge and learning the latest digital marketing trends and changes; Reports on social media success including LinkedIn followership.
Marketing Support –
Support the marketing team.
Support marketing team on all event and program execution including tradeshows, roadshows, webinars, and other events; Keep current on market and retail news/trends;
Manage HubSpot, LinkedIn, Twitter, Vimeo, and YouTube accounts;
Manages all aspects of email drip campaigns through planning, identifying target audiences and sets up distribution through HubSpot;
Create training materials and training of all marketing tools.
QUALIFICATIONS
Competencies Required:
Integrity
– Ethical and honest. Maintains principle when faced with challenge;
Communication
– Good oral and written communication skills. Able to deliver clear and concise information; demonstrates the ability to adapt to the audience;
Detail Oriented
– Able to think and articulate in very simple terms. Keen eye for detail and the ability to identify missing pieces. Organized and able to prioritize multiple responsibilities;
Self-motivated
– Identifies what needs to be done and takes action; contributes new ideas; looks for ways to add value;
Agility
– Able to manage multiple priorities and a complicated schedule; maintains focus and composure.
Team Player
- Collaborates with others; genuinely enjoys being a part of a team and shows support and interest towards co-workerS.
Results Focused
– Demonstrates a desire for achieving results; is energized by achieving the goal.
EXPERIENCE / KNOWLEDGE
Post-secondary education - University graduate marketing, communications or business;
2-5 years’ experience in marketing for a B2B technology company (retail technology an asset);
Proven track record in SEO and PPC/SEM, email marketing, Google Analytics, Google AdWords, and Marketing Automation system (HubSpot), Google Console, SEMrush Google Tag Manager HTML, CSS, JavaScript, Crazy Egg;
WordPress experience and knowledge of front-end dev an asset;
Analytical, data-driven, but trust your instincts in order to be agile;
Strong oral and written communication skills;
A proficiency in Microsoft office;
Graphic Design and video editing an asset.
WHY WORK WITH US AT STOREFORCE
StoreForce is growing quickly – it’s the kind of place you can make a real impact. We thrive on change, collaboration, and trust; and are fueled by a mutual passion for Specialty Retail. At StoreForce you’ll have the chance not only to work with some amazing people, but also with some of the world’s best retail brands.
We invest in our people, celebrate diversity, and foster a space for you to learn and grow, every day. Some of our employee’s favourite workplace perks include:
A casual work environment in a modern office space;
Employer-paid health benefits with flexible spending account;
Paid training and professional development;
GRRSP Matching.
StoreForce is an Equal Opportunity Employer and prohibits discrimination and harassment of any kind. We are committed to the principle of equal employment opportunity for all employees and to providing employees with a work environment that is diverse and inclusive.
This starts by welcoming and encouraging applications from all individuals including those with disabilities. Accommodations are available on request for candidates taking part in all aspects of the selection process.
Job Types: Full-time, Permanent
Benefits:
Casual dress
Company events
Discounted or free food
Employee assistance program
Extended health care
Life insurance
On-site parking
Paid time off
RRSP match
Schedule:
Monday to Friday
Experience:
B2B Technology Marketing: 3 years (preferred)
SEO: 3 years (preferred)
PPC/SEM: 3 years (preferred)
Google Analytics and AdWords: 3 years (preferred)
email marketing: 3 years (preferred)
marketing automation (HubSpot): 3 years (preferred)
Google Console, Google Tag Manager: 3 years (preferred)
HTML, CSS, JavaScript, Crazy Egg: 3 years (preferred)
WordPress: 3 years (preferred)
Work remotely:
No"
"Digital Marketing Coordinator - Vancouver, BC - Indeed.com","OAK + FORT is a fashion and lifestyle brand that embodies minimalist values by providing accessible luxuries consisting of modern everyday essentials. Focused on creating tomorrow’s classics, our philosophy fuses aspects of art, culture and design with contemporary elements to provide reimagined versatile products that transcend convention.
POSITION SUMMARY
As the Digital Marketing Coordinator, you will be responsible for assisting in the planning and execution for all digital marketing strategies with a focus on email and SMS marketing, in addition to paid social and search. This is a unique opportunity for an individual who has exceptional analytical skills and is driven by data and performance.
RESPONSIBILITIES
Email Marketing (30%)
Manage the day-to-day aspect of all email marketing initiatives, including but not limited to the creation and monitoring of messages, segments and workflows.
Assist in the strategy and planning for this channel.
Identify opportunities to optimize and leverage the channel.
Analyze and report on channel performance.
SMS Marketing (30%)
Manage the day-to-day aspect of all SMS marketing initiatives, including but not limited to the creation and monitoring of messages, segments and workflows.
Assist in the strategy and planning for this channel.
Identify opportunities to optimize and leverage the channel.
Analyze and report on the channel performance.
Act as a liaison between OAK + FORT and our SMS marketing partner.
Paid Social and Search (30%)
Act as a liaison between OAK + FORT and our digital ads partner.
Manage the day-to-day aspect of all digital ad initiatives, including but not limited to optimizing creative and copywriting.
Assist in the strategy and planning for this channel.
Identify opportunities to optimize and leverage the channel.
Analyze and report on the channel performance.
Other (10%)
Assist in the general activities of the Marketing department as required.
Perform other duties or projects as assigned.
Stay informed of current and changing trend in fashion, public relations and social media.
Continuously provide recommendations and contribute ideas on how to improve.
KEY KPI’s YOU WILL BE MEASURED ON:
Performance of email marketing channels including subscriber growth revenue, open rates, click rates and conversion rates.
Performance of SMS marketing channels including subscriber growth, revenue, open rates, click rates and conversion rates.
Performance of paid ads including CPM, CPC, ROAS and conversion value.
REQUIREMENTS
1-2+ years of experience in a digital marketing or related role
Post-secondary education (diploma/degree) in Marketing
Previous experience and a good understanding of email marketing
Previous experience and a good understanding of paid ads and their accompanying platforms: Facebook, Google, YouTube, etc.
Previous experience and a good understanding of SMS marketing is an asset
Previous experience and a good understanding of Google Analytics (certification is an asset)
Proficient in Microsoft Office (Word, Excel, PowerPoint) and Photoshop (InDesign is an asset)
Strong communication skills both verbal and written
Ability to communicate with industry contacts comfortably and represent OAK + FORT in a professional and polished manner
Exceptional time management skills, including the ability to prioritize, manage and meet multiple deadlines
Results driven, energetic, resourceful and proactive with superior interpersonal skills
Knowledge in fashion media landscape, both print and digital, are an asset
Connects with OAK + FORT aesthetic
Experience working in the fashion retail industry is an asset
xQb1cIeYnh"
