Title,Description
"E-Commerce Specialist - Toronto, ON - Indeed.com","Launchers Academy is a fast growing Dropshipping platform that helps people transition into online retail successfully. As an E-Commerce Specialist, you will engage directly with potential customers, qualify them and enroll them into services we offer. We’re looking for individuals who are passionate about building relationships with customers by identifying their needs and providing them with the best possible solution. Your ultimate goal is to create a very positive experience at Launchers Academy.
Responsibilities
Present and sell company products/services to new and existing customers.
Prospect and connect with potential customers.
Reach agreed upon KPI’s by the company.
Using Social Media platforms for outbound marketing.
Scheduling appointments with clients.
Run meetings from home over Zoom (video conference).
Provide daily updates & weekly results to upper management.
Working with operations to ensure a positive close for the customer.
Qualifications
Must have 1+ years in a sales role.
Previous experience in customer service or other related fields.
Positive mindset that is coachable.
Self motivated and able to work with low supervision.
Enjoys working remotely and from home.
Must be dedicated to growth.
Ability to build rapport with clients.
Strong negotiation skills.
Deadline and detail-oriented.
Punctual.
Your Reward
In exchange for your hard work and dedication to the team, you’ll be rewarded with a competitive compensation package along with some excellent bonus perks:
An amazing training process for the first two weeks to ensure success.
Ability to fly first class anywhere in the world courtesy of the company.
Win super bowl tickets, paid trips for two, all inclusive cruise trips and more!
Up to $50,000 towards your next dream car!
Be in an excellent working environment that motivates others to do their best.
_
_
*
*
About Launchers Academy
We’re a white-glove service training platform designed to help people get into E-commerce – specifically Dropshipping. Our Academy focuses on working with individuals that want to understand how to transition into Dropshipping successfully and build an online retail business. We have successfully helped clients on finding great products, build a winning online store front and run profitable advertisements.
Launchers Academy is a fast growing training platform that continues to scale rapidly. We’re currently operating globally, with over dozens of clients. We’re a mission-driven organization focused on bringing joy to people’s lives while creating great opportunities for a digital world.
Part-time hours: 25 per week
Job Types: Full-time, Part-time, Contract
Salary: From $75,000.00 per year
Additional pay:
Bonus pay
Commission pay
Benefits:
Company events
Flexible schedule
Work from home
Schedule:
Day shift
Application question(s):
How do you feel about a commission based position where you eat what you hunt?
Are you a self-motivated individual that is results driven?
Experience:
Sales: 2 years (required)
Work remotely:
Yes"
"Digital Marketer and E-Commerce Coordinator - Dollard-Des Ormeaux, QC - Indeed.com","Bebe Depot Plus is looking for a Digital Marketer and E-Commerce Coordinator to join our team. This role requires working with the E-Commerce Director to manage the e-commerce platform and as well as create quality graphics and designs. We are looking for someone who is ready and capable of helping our team develop and promote our brand. The Digital Marketing & E-Commerce Coordinator will be required to work with existing templates, and also produce a wide variety of materials that best suits the brand's requirements. In addition, this role requires someone who is capable of managing the e-commerce platform while working in accordance with our IT and marketing team.
Responsibilities:
Content creation for web, social media and in-store products, promotions, events, brands
Create and produce marketing and sales support materials including but not limited to e-mail marketing, social media, motion graphics, traditional print media, graphics support for bloggers and web/mobile development
Provide innovative design solutions using both written and visual elements in support of marketing campaigns
Build a knowledge base of current trends and best in class tactics
Keep up with industry and competitor trends
Adapt content for use across a variety of web/print needs
Complete assigned tasks throughout all stages of the design and production process in a timely manner
Present ideas (written, verbally and visually) to peers and management
Working in a team with upper management, external marketing team, and web developers
Manage and update e-commerce platform on a weekly basis
Qualifications:
Completion of a diploma/degree/certificate in Web or Graphic Design, Digital Media, Advertising, Marketing Communications or equivalent with a minimum of 1 years of related experience · Adobe Creative Suites: Photoshop, Illustrator · Microsoft Office; Word, Excel and Outlook, PowerPoint skills are essential · Knowledge of web-based technologies that apply to web design such as HTML · Knowledge of social media platforms such as Facebook, Instagram, Twitter, and Pinterest · Must be fully bilingual – capable of creating content in French and English
Job type: Full time
Please send your resume to
info@bebedepotplus.com
, or contact us at
(514) 899-1110
."
"Marketing Scientist - Calgary, AB - Indeed.com","Marketing Scientist
Who is Pod Marketing?
POD Marketing is a full-service digital marketing agency that offers clients a wide range of marketing solutions. Unlike other agencies, we specialize in 5 specific industries, which makes us true experts in both digital marketing
and
the industries we serve.
While we are committed to our clients, our number 1 priority has and always will be our employees. We believe this employee-obsessed approach is the biggest contributor to our company’s growth. In only 7+ years, we’re now working with over 200 clients across North America, which would not have been possible without employing a talented team of over 80 employees.
Office culture is not about having a beer fridge or a ping-pong table (but yes, we have those too), it’s about how being at work makes you feel. We asked our staff and here are some of the things they said they loved most about working at POD Marketing: They feel accepted for who they are, supported, challenged, enjoy the flexibility of being able to work from home, the open lines of communication with every member on the team including upper management, having physiological safety, and are energized by the opportunities to grow, develop and progress their careers.
To learn more about our culture, visit the POD Marketing YouTube channel and check out our reviews on Glassdoor.
We are looking for a full-time Marketing Scientist to join our team. If this sounds like a position that you would be interested in, please read the job description below.
Role Overview & Responsibilities
The Marketing Scientist will have 2 – 5 years of hands-on experience developing and managing advertising campaigns on platforms including Google, Facebook, Instagram, LinkedIn and Microsoft Bing Ads.
The ideal candidate is results-oriented and data-driven performance marketer with demonstrated experience managing multiple paid advertising campaigns. You take a customer-centric approach, and you're passionate about doing what's right for our customers and brand. You are highly analytical and count A/B testing, optimizing customer acquisition costs, and analyzing campaign performance among your core competencies. You likely have some deep experience in a few marketing channels, and have the aptitude to learn new channels quite quickly.
Most importantly, you are eager to roll up your sleeves to find opportunities and efficiencies in a fast-moving company at the forefront of digital marketing.
You will:
Plan, develop, build, manage and optimize all digital advertising solutions including but not limited to Pay-Per-Click (PPC), Online Display and Social Media Ads
Manage campaign expenses, staying on budget, estimating monthly costs and reconciling discrepancies
Track, report, and analyze website analytics, Pay-Per-Click (PPC) initiatives and social media campaigns
Generate necessary codes that will be placed on a client’s website to measure conversions.
Collaborate with internal teams (Marketing Science, Sales, Web Dev, Social Media, Content, SEO, etc.) to manage accounts and execute client specific marketing roadmaps
Experience & Skills
Must Have:
Bachelor’s degree in marketing/business or related field
2 – 5 years of SEM experience and success managing Pay-Per-Click (PPC) campaigns across Google
1 – 2 years of experience setting up analytics and conversion tracking codes on client websites (Google Analytics / Google Tag Manager)
Up-to-date with the latest trends and best practices in search engine marketing
In-depth experience with bid management tools
Experience with website analytics tools
Strong analytical skills and experience generating SEM reports (Excel, Google Sheets, Google Data Studio)
Familiarity with A/B and multivariate experiments
Analytical and data driven mindset
Ability to manage multiple projects and deadlines
Nice to Have:
Post-secondary degree in STEM
Mentorship and training experience
Advanced knowledge of Google Analytics and Paid Advertising (Google, Bing, Facebook/Instagram)
Basic knowledge of SEO
Prior agency experience (like a real agency, not a one-person “agency”)
Self-driven projects (websites/blogs/data science)
Compensation
:
42,000-57,000 annually based on experience & qualifications
Full health and dental benefit package
This person should have passion above all else. They are a person who wants to grow their career, not just find a job.
What's in it for you?
Competitive Salary & Health benefits
Three weeks vacation & three wellness days per year, which we sincerely hope you enjoy!
Company funded team building activities & group events
Fully stocked fridge (think snacks, wine, beer and lots of fun non-alcoholic options)
Fun office environment & very active ping pong table
Employee-led interest groups (called MyPODs - book club, wine club, fitness club, POD soccer team, board game club, weekly spin classes & many more). There is something for everyone, no matter what you are interested in.
Professional development & training budget. We love growing with you and believe that if you bring the fire to learn, grow and develop in your role, we will be there to support you every step of the way
We are a fast-growing company with lots of opportunities to grow (we've grown over 100% last year and don't plan to slow down)
Flexible work schedule and work from home opportunities
How to Apply
At Pod, we believe “that most job requirements and conceptual knowledge are easily trainable. But you can’t teach drive, ambition, or passion.” (Take a look at this article, Finding Your Unicorn, written by our President, Kevin Wilhelm). Our hiring managers consider alignment with our core values and passion for our company culture to be as valuable as experience and education.
After reading this job description, we want you to ask yourself:
Am I the exact right person for this role?
Do I align with Pod’s core values and culture?
If you’ve answered yes to both questions, we want to hear from you! Here are a few easy steps that will help us get to know you better.
Ensure your professional resume is up to date and highlights some of the key points we are looking for.
Create an
engaging
cover letter for us to read.
If you don’t include a cover letter, you will NOT be considered for this role.
Video cover letters are given extra attention.
Apply through our website
(https://www.podmarketinginc.com/careers/)
All successful candidates will be contacted via email to discuss next steps. We appreciate all applications and wish you all the best of luck."
"Account Manager - Affiliate Marketing (FULLY REMOTE) - Kitchener, ON - Indeed.com","**PERMANENT Full-Time Remote position**
Candidates must reside in the U.S. Canada or the U.K.
Description
This is an amazing opportunity for a mid-level
Affiliate Marketing Manager.
If you are a super-connector in the B2B or B2C space and you are the best-in-the-world at tapping into new opportunities while ensuring we make the right connections for our clients then this could be the perfect role for you.
Who Are We?
All Inclusive Marketing is a leading performance marketing agency offering strategically customized solutions and award-winning expertise in channels such as affiliate, search, social and content as well as strategic consulting and services. Our vision is to set the standard of excellence in affiliate program management worldwide.
We believe in leading with ethics and innovation to provide the highest level of results and performance marketing expertise for our clients. We are passionate about helping our clients reach, engage, and convert their buyers and affiliate partners to drive accelerated growth through new customer acquisition, incremental revenue buyer retention, loyalty, engagement, and brand presence.
Our team is made up of award-winning experts, who are passionate about all things digital marketing with special attention to affiliate and performance-based marketing. Our team is extremely supportive of one another. When one person succeeds, we all succeed, and we have each other’s backs to help make that happen.
Working with us will provide you with the opportunity to work with amazing clients and with thought leaders and experts in the performance and digital marketing industry.
What are the Key Points?
Competitive Compensation
Location:
100% Remote (virtual team of 30+)
Benefits:
Health/Dental/Vision/Disability/Life + 401k, Laptop, Mobile Phone, Office Expense Stipend and Unlimited Time Off
Personality
: Fun-loving, Easy Going, Honest, Flexible, Team Player and Obsessed with Details
If you’re an affiliate marketing manager looking to grow in your career and LOVE every aspect of landing super-affiliates that can make it rain, PLUS you crave the opportunity to make an impact working with a team that’s leaning into a meaningful mission, and…
You LOVE to negotiate the deals …
You LOVE brainstorming and pitching fresh new channels that explore new opportunities…
You LOVE getting your hands dirty and jumping on the phone or video calls to build new relationships…
You LOVE working in a fast-paced team environment…
You LOVE building and cultivating relationships and have a continuous appetite to learn more…
… and if the answers to all these points were “YES” then please read on as you’re an ideal fit and we’d love to talk to you ASAP!
Note: We have developed a unique, in-depth application process to help us pinpoint the best candidates. We read every application and will be in touch if there is a good fit. The more you tell, the deeper an understanding we gain and the more meaningful our first conversation will be.
What Are Your Major Objectives?
In a key client-facing position, the Affiliate Account Manager, within our Performance Marketing Division, will be responsible for driving new customer acquisition and profitable sales growth through team leadership, strategic thinking and process execution for their performance marketing programs. This will include driving the team to deliver on AIM and industry best practices around affiliate recruitment, activation, optimization, compliance, and reporting.
Responsibilities
Execute on day-to-day operations of multiple affiliate programs; including publisher recruitment, activation, optimization, compliance, and reporting.
Act as an extension to clients’ in-house team by providing expertise, guidance, expectation management and measurable execution of tasks that result in healthy program growth.
Work closely with the Account Director and Associate Account Managers to drive measurable results for your accounts.
Monitor each program’s daily performance to ensure continuous optimization and profitable sales growth.
Build strategy on recruitment efforts and new opportunities.
Ensure we are DIGGing at all times (Delight, Innovate, Grow and Give back) for our clients, team, and affiliates.
Maintain and retain key affiliate partnerships to foster growth.
Provide financial forecasting and weekly performance updates.
Represent All Inclusive Marketing at conferences and events as needed (usually 1-2 times per year).
What Key Skills and Experience are Needed?
2+ years of affiliate marketing management experience required
Previous experience thriving in a work-from-home or remote office environment
Ability to travel to visit clients and represent AIM at conferences
Advanced Excel/Google Sheets and PowerPoint/Google Slides capabilities a plus
Technical knowledge of HTML a plus
Knowledge of multiple affiliate networks and third-party tracking platforms a plus
Multi-channel digital marketing expertise a plus
Our Ideal Candidate
Ability to effectively manage and maximize personal and team outputs and results in a remote environment.
Self-motivated with a good work ethic and desire to do the right thing.
Possesses superior written and verbal communication skills, time management skills and the ability to meet deadlines.
Thrives in a fast-paced, team environment.
Possesses mature and measured judgment with the ability to develop productive solutions to problems.
Ability to analyze trends to provide key takeaways for future strategy and growth.
Committed to providing their team and clients with honest and transparent reporting, feedback, and suggestions.
Possesses incredible attention to detail and capable of multi-tasking and coordinating several projects at once.
Ability to maintain confidence and composure in client meetings with the ability to manage client expectations, and potentially high-pressure situations well.
What You'll Enjoy from Us:
A Curated Team
– A very supportive team of other high-performers who like to get things done, hold themselves accountable and help each other out wherever possible.
A Nurturing Culture
– A culture that supports and nurtures your need to learn, grow and challenge yourself to be the best you possibly can be.
A Fantastic Lifestyle
– A 100% remote work from home experience that allows you to enjoy your family, outside interests, hobbies and passions… and have a life :-)
A Robust Benefits Package
– Full Insurance (health, dental, vision, 401k) + unlimited time off and additional perks as we’re constantly upgrading them.
If this sounds like a good fit, if you’re excited to do something challenging and meaningful that preserves your ability to enjoy life to the fullest, then please apply ASAP as we can’t wait to meet you!
Applicants will receive an email confirmation from BambooHR following submittal of this application. Please check your junk folder as this email as well as any subsequent communication from us will come through the BambooHR Applicant Tracking Email System."
"Senior Manager - Digital Experiene - Toronto, ON - Indeed.com","Ensures that the experience is best in class when our customers interact with our business through the digital channel. Brings together technical, data and analytical expertise to create, deliver and integrate new capabilities and digital sales channels. Owns, develops and continuously improves the user experience, making sure that we communicate effectively with our customers and ensure we meet our regulatory obligations. Defines new customer experiences, as well as optimizes, tests and validates existing journeys, to make sure our customers are getting the best possible experience every time.
Works collaboratively with a wide range of stakeholders and managing direct reports and vendors
Applies up-to-date understanding of digital marketing and customer centric design principles in UI /UX
Delivers measurable improvements in customer experiences across our sales journeys, using a range of tools including Google Analytics, SEM Rush, and Laravel Web Application
Analyses both qualitative and quantitative data to identify insights that define the short and medium term vision for our digital products
Actively monitors and understands customer feedback and NPS, and delivers enhancements to our sales journeys as a result to help better meet customer needs and expectations
Supports the management and delivery of change through our digital properties, from inception to post-live validation and monitoring
Manages a cross-boarder team departments consisting of managers, and eCommerce professionals responsible for the digital solutions for our Safety and Restoration business
Provides digital solutions to a wide range of difficult and complex problems requiring extensive investigation and analysis; looks beyond existing methodologies and own discipline to define and resolve complex problems
Oversees bi-lingual search strategy (SEO/SEM)
Experience:
Fluent understanding of B2B eCommerce, including technology systems, data, pricing, and operations. 7+ years
Advanced knowledge of the digital environment and evolving tools and platforms used to improve online presence. 7+ years
Creating and maintaining web pricing. 5+ years
Providing marketing solutions through website(s), driving traffic (PPC, SEO, on line advertising,) email marketing, as well as social and mobile programs. 5+ years
Education:
Bachelors Degree in Business Administration, Computer Science, related disciplines is required.
Masters Degree in Business Administration, Computer Science, related disciplines is preferred.
Skills:
Fluent understanding of eCommerce, including technology systems, data, pricing, and operations. 10+ years
Advanced knowledge of the digital environment and evolving tools and platforms used to improve online presence. 10+ years
Travel:
0-25%
WESCO International, Inc., including its subsidiaries and affiliates (""WESCO""), is an Equal Opportunity and Affirmative Action Employer. It is the policy of WESCO to not discriminate against any job applicant or employee based on age, race, religion, color, handicap, sex, physical condition, disability, sexual orientation, gender identity, national origin, or protected veteran status or any other protected status. This policy includes but is not limited to the following: recruitment and employment, promotion, demotion, transfer, compensation, selection for training including apprenticeship, layoff, or termination."
