Title,Description
"Assistant au marketing digital - Saint-Urbain-Premier, QC - Indeed.com","Responsabilités :
Participe à la planification, l’élaboration ainsi qu’au déploiement des stratégies marketing et du calendrier éditorial marketing
Procède à la rédaction, correction, traduction et la création de divers contenus numériques ou autres
Gestion des médias sociaux :
Créer du contenu intéressant et pertinent pour optimiser l’impact sur les réseaux sociaux
Programmer et publier les publications
Interagir et répondre aux commentaires/questions sur les différentes plateformes
Être présent lors de différents événements (interne ou externe) pour capter les moments et ensuite les partager sur les réseaux sociaux de l’entreprise
Crée avec le département Ressources Humaine des campagnes de recrutement ou autres stratégies pour l’attraction et la rétention du personnel
Supporte les différentes équipes dans la gestion des projets de campagne média sociaux
Assure la continuité de certains dossiers lors d’absence du coordonnateur marketing
Participe à l’organisation des différentes activités de team building
Toutes autres tâches connexes au département marketing
Qualifications et expériences requises :
Avoir complété une formation collégiale, universitaire ou autre en communication, marketing
Expérience dans un poste similaire
Connaissance de la suite office et des outils d’analyse numérique
Bilinguisme essentiel du français et de l’anglais (parlé et écrit)
Sens de l’initiative, de l’autonomie et débrouillardise
Rigueur, minutie et précision dans son travail
Grand sens de la créativité
Détail sur le poste :
Type d’emploi : Temps Plein, Permanent
Lieux : Siège social – 164, chemin de la Grande-Ligne, Saint-Urbain-Premier
Horaire : Jours du lundi au vendredi
Avantages :
Emploi du temps flexible (hybride bureau/télétravail)
Assurance Dentaire
Assurance Invalidité
Assurance Maladie Complémentaire
Assurance Vie
Congés de Vacances et Compensatoires
Événements d’Entreprise
REER Collectif
Stationnement sur place
Le générique masculin est utilisé dans ce texte uniquement dans le but d’en alléger la forme et d’en faciliter la lecture."
"Digital Marketing Specialist - Toronto, ON - Indeed.com","Job Type:
Permanent
Hours of work:
35 hours / WK
Salary Range:
$63,372 - $79,926/yr.
Posting Date:
November 8, 2021
Closing Date:
November 30, 2021
Exhibition Place is Canada’s largest entertainment venue, attracting over 5.5 million visitors a year. The 192-acre site is an integral component of Toronto and Ontario’s economy, particularly with respect to conventions, sport, festivals, recreation, culture, and tourism. Located at Exhibition Place is the award-winning Enercare Centre, Canada’s largest exhibition and convention centre which is now LEED Platinum certified, and Beanfield Centre conference venue which is LEED Silver certified. Since 2004, Exhibition Place has undertaken an environmental stewardship initiative, entitled GREENSmart; which includes the promotion of sustainable development, environmental initiatives, and leading edge green technologies and practices across the site. Our environmental initiatives have resulted in award-winning recognition across North America, such as the Platinum Waste Minimization Award from the Recycling Council of Canada, and have established Exhibition Place as a world leader in energy-efficient technologies.
Our compensation package offers a competitive salary and pay-for-performance incentives. In addition, our total rewards program includes participation in OMERS – defined benefit pension plan, 100% employer paid health & dental plan, long term & short-term disability coverage, professional development opportunities, and tuition reimbursement.
Exhibition Place has adopted a vaccination policy, as a condition of employment all new hires are required to be fully vaccinated and provide proof of vaccination confirmation prior to commencing employment.
Primary Function:
The Digital Marketing Specialist will report to the Director of Sales and Marking and is responsible for implementing the strategic marketing plans, content creation for digital marketing, social media, traditional marketing, brand awareness, media relations, and communications to promote Exhibition Place to planners, organizers, attendees, tenants and public.
Major Responsibilities:
Develop, and implement digital marketing including, but not limited to: website design, content and updates, mobile site, apps, blogs, corporate and sales videos, photography, digital advertising, graphic design, and online presence, etc. for Exhibition Place, Beanfield Centre, Enercare Centre and Exhibition Place Planner sites. (Excluding any content related to the Board and Records & Archives).
Develop and implement all social media marketing and social community engagement on a variety of platforms including Facebook, Twitter, Instagram etc.
Listen to and monitor all social platforms and media feeds for Exhibition Place items trending, including meetings and exhibitions industry, tenant trends, media coverage and community engagement etc. and generate monthly reporting and analytics.
Create and implement the messaging and creative for the outdoor pixel boards, digital outdoor advertising, desktop player, photo and video library.
Write and distribute press releases, editorial content and event listings, follow-up with media outlets and prepare monthly reports of media coverage.
Develop and implement the advertising plan, including advertising placement in digital and print, advertorial, photography, collateral materials, develop and monitor ad budget, and liaise with external suppliers.
Participate in the development of the annual strategic marketing plan including digital marketing, social marketing, media relations, and brand management.
Research and analyze competitive set marketing strategies and digital marketing trends.
Coordinate special marketing projects, and other duties as assigned.
Required Qualifications:
Several years’ experience in communications, managing online communities, content creation or journalism.
Self-starter who is able to take initiative, set priorities, multi-task, possess time management skills, create a strategic vision, meet deadlines, anticipate trends and business needs and liaise with different internal/external departments.
Progressive work experience with knowledge of digital marketing, website development, social media and community engagement, analytical research, advertising and media relations.
Excellent skills in written/verbal communication and interpersonal relationships.
Knowledge of Adobe InDesign / Photoshop / Illustrator/iMovie/ Social media platforms.
Ability to be flexible in the scheduling of full time work hours to allow for social media coverage on weekdays and weekends.
Vaccination:
All Exhibition Place employees are required to be fully vaccinated as a condition of hire in accordance with the Exhibition Place Vaccination Policy.
Equity, Diversity and Inclusion:
Exhibition Place is committed to fostering an inclusive, accessible environment where all employees and members of the public feel valued, respected and supported. We are dedicated to building a workforce that reflects the diversity of the public and the communities in which we live and serve.
Accommodation:
Exhibition Place is committed to creating an accessible and inclusive organization. We are committed to providing barrier-free and accessible employment practices in compliance with the Accessibility for Ontarians with Disabilities Act (AODA). Should you require Code-protected accommodation through any stage of the recruitment process, please make them known when contacted and we will work with you to meet your needs. Disability-related accommodation during the application process is available upon request.
We thank all applicants for their interest in this opportunity. However, only those selected for an interview will be contacted."
"Digital Marketing Associate - Montréal, QC - Indeed.com","Internship summary:
Under the Digital Skills for Youth Program, sensov is looking for an intern as a passionate and professional digital marketing associate, eager to exploit his or her full potential in a growing digital business where you will have a strategic and stimulating role.
Job Description:
The Content Marketing Associate is a social storyteller that will lead content creation and day-to-day community engagement. Through research, a good understanding of each platform’s native analytics tools, and moderation of user-generated content, the Digital Marketing Coordinator will evaluate the pertinence of new posts and create original content that will be integrated into the brand’s social media pages. You will be in charge of developing and executing creative social media tactics, in partnership with the client and with the agency's creative team.
You spend your life online – you are a social native – but you are also a huge fan of culture across a range of subjects and in touch with what’s happening offline and how that can impact the social space. You know how and when to start conversations, as well as when to participate and when to just listen.
You speak through pictures, animated GIFs, emojis, short videos, memes, and capture content with everything you do. But you also understand how to speak from the perspective of a brand’s voice, not your own.
TASKS
Monitor conversation on channels such as Twitter, Facebook, Instagram, and LinkedIn — monitoring both people explicitly tagging the brand and people talking about them without tagging.
Engage with fans, influencers, and publications multiple times a day. Not just answering questions, but creating moments that will garner press and extend brand love with faves, RTs, shares, etc.
Identify daily, quick-turnaround reactive opportunities — throw lots of ideas at the wall each day with the agency & client teams and see what sticks
Identify & track larger ideas that are not necessarily reactive, but based on observations in the community, as well as contribute to a running list of brand-centric behaviors
Create excitement and proactively participate in our client’s social media platform
Develop, organize, prioritize, schedule and manage content across all platforms
Announce new content on the event channel, as well as remind people of the great experience they have had with the event
Capture & publish content (copy, photos, videos, etc) as required
Manage pages and platforms (comments and direct messages)
Attend and cover key events to create content for the platforms
Foster relationships with influencers
Work closely with creative teams to identify opportunities for innovation and drive press coverage
Route customer service inquiries to the right channels and flag opportunities to surprise and delight members
Monitor client’s social listening tools and native platform analytics for top-line insights on what is working/not working on platforms
Staying current on digital and social media trends and platform innovations and changes (such as algorithm changes)
Strong knowledge of social best practices in terms of formats to use, how to optimize formats across channels and experience boosting and targeting content
Qualifications and Competencies:
1-3 years of experience.
Educational background in new media, marketing, communications, advertising, or journalism preferred.
Event Marketing experience and knowledge are a plus.
A relevant agency, media, or independent blogging experience is considered an asset
An impressive understanding of social media. You are connected, cultured & curious about social space.
Writing samples required.
Excellent creative writing skills – you’re a writer at heart
An eye for good creative & design
Ability to produce video & photography using your iPhone or Android phone for a variety of social pages
A hands-on ability to do what it takes to get the job done
Self-starter and highly motivated; capable of working independently, yet collaboratively, within a fast-paced environment
Highly organized and able to juggle priorities, while maintaining clear communication and ownership of tasks
Ability to analyze data, summarize insights to increase social engagement, reach a qualified audience and tie into broader content strategies
Excellent social media knowledge and a capacity to adapt to user trends
Working Conditions and Benefits:
Working hours: 35h/week, Monday to Friday, flexible schedule
Duration: 4 months with the possibility of full-time employment at the end of the internship.
Expected start date: 29 November 2021
Workplace: Full remote
The intern must meet the criteria outlined below:
be between the ages of 15 and 30 years of age at the start of the internship;
be a post-secondary graduate ;
be legally entitled to work in Canada;
be a Canadian citizen, permanent resident, or person who has been granted refugee status in Canada;
self-assess as underemployed, meaning they are employed below their level of education, are unemployed, or hold part-time employment.
Interested candidates are invited to send their curriculum vitae before Nov 26th at 5:00 pm.
About us:
sensov/ event marketing is a marketing agency specializing in promoting conferences and events globally. We are a remote team culture. In addition to working on digital campaigns to help promote these events, you will also get to help promote snöball, an event tech product we run in parallel. Snöball is an influencer marketing platform for b2b events.
Only candidates selected for interviews will be contacted.
This initiative is funded by the Government of Canada.
Application deadline: 2021-11-26
Expected start date: 2021-11-29
Job Types: Full-time, Internship, Permanent
Salary: $40,000.00-$45,000.00 per year
Benefits:
Flexible schedule
Work from home
Schedule:
8 hour shift
No weekends
Work remotely:
Yes
This initiative is funded by the Government of Canada.
Contract length: 4 months
Application deadline: 2021-11-26
Expected start date: 2021-11-29
Job Types: Full-time, Internship
Salary: $40,000.00-$45,000.00 per year
Benefits:
Work from home
Schedule:
8 hour shift
Monday to Friday
Work remotely:
Yes"
"Digital Designer - Toronto, ON - Indeed.com","About Us
Hello, We are Smart Nora.
Our story started from our bedrooms, solving our problem with snoring. Fast forward 5 years, we have brought our solution to tens of thousands of couples who wake up happier and healthier every single morning. In the process, we have built a fantastic team who take pride in improving the lives of others.
The story that started with snoring, is now continuing with sleep and wellness. With a growing customer base, we are advancing our technology, and diversifying our products and services. If you are ready for your next big challenge, this might be the place for you.
On a day to day basis, we are a fast paced team that enjoys each other's company. We actively stay in touch and informed in a weekly cadence. As a distributed team, we use modern tools such as Notion, Figma, and Slack to work effectively together.
We value hard work, great judgment, and a can-do attitude. We enjoy learning about each others' interests, and spending social time together to learn and play. A sense of humour, and a curious mind are always welcome here.
about us.
About You
You have a deep passion for visual communication and storytelling. You enjoy participating in creative brainstorms informed by research, and bringing concepts to life as tangible pieces. You take pride in your craft and design to connect with your audience on an emotional level. You are keen to learn from data and iterate until the best outcomes are realized.
About the Role
As a Digital Designer you will create a wide range of assets to express our brand across all of user touch points.
Brand Expression:
Implement the Smart Nora brand consistently across user touch points.
Visual Concept Development:
Understand the marketing strategy and creative direction. Generate visual concepts grounded in customer behaviour and psychology.
Digital Asset Creation:
Produce well crafted, engaging pieces for Facebook marketing, email marketing, social media, and landing pages.
Qualifications
Formal Design Education, University or College level.
3-5 Years experience in the design/marketing industry, 1-2 years of which you have been an intermediate designer responsible for independently driven work in a D2C brand, e-commerce, or digital marketing agency.
Demonstrated expert skills:
Firm grasp of designing creatively within Brand Guidelines.
Graphic design and image making (Figma, Photoshop, Illustrator)
Video Editing (Adobe Premiere, Final Cut, After Effects)
Web Design (Responsive landing pages, )
Basic Web Development skills would be a bonus. (HTML, CSS, Javascript)
Confident in managing projects independently, working across teams in a sprint format, and comfortable in adapting to new information.
If you worked here this past month here are some things you would have been involved in:
Participating in weekly brainstorms with the team to understand the customer behaviour and needs to arrive at the facebook ad concepts for the week.
Learning from our Digital Marketing Manager on which creatives are performing well and make a plan for design variations to test in the coming week.
Participating in team wide meetings for user Beta testing to streamline communication and design landing pages and graphics to assist Customer Support and Product team.
Generating concept for the a new packaging prototype for replacement parts that get shipped to our customers. You jump on the opportunity and make this delivery and unboxing experience into a meaningful interaction with our customers.
The Dream Team as depicted on our individualized holiday cards.
Designed a landing page for a great customer testimonial video to share their story and showcase their unique personality and humour.
Read through the comment section on social media and see how we communicated with our audience, from real customers to internet trolls as inspiration for design.
Share what you have been geeking out on recently with everyone at Tea Time ️ (our weekly casual meeting) and learned who else shares your passion.
Salary and Benefits
Health Benefits
We offer health and dental insurance. Our extended benefits package also give you access to an array of services.
Remote Work Accomodation
We will ensure you have the right equipment and setup for a functional and healthy work environment.
Equipment and Tools
All employees have access to the right tools for the job including an Apple computer and software for working efficiently.
How to Apply
Please email your application to smartnora@jobs.workablemail.com with the job title in the subject line. The body of your email should include the following:
LinkedIn Profile (link)
Portfolio and Case Studies (link)
Resume (attachment)
Cover letter (if you prefer to have prompts, feel free to answer the following questions)
What made you want to apply for this role? What makes this the right job for you? Why now?
How will this role enable you to step up your career in ways that you were not quite able to do yet?
What are some of the most influential learning moments in your design career?
What are some the recent projects that you are most proud of? Why?
What is the first thing you would change on our website? How about our instagram?
Please list any needs that you have that we can accommodate throughout the hiring process. Type N/A if not applicable.
The Interview Process
Application Review:
We will carefully review your responses to our questions and review your work samples.
Interview #1 - 40 mins:
Introduction + Work Experience review.
In a 40 minute video call we will get to know you, and answer any questions you might have. We will dedicate 20 minutes to dive into your most relevant projects and experiences.
Interview #2 - 2 hours:
Your Work at Smart Nora.
We will dive deeper into the work you will be doing at Smart Nora. Make sure you fully understand how you will be an effective member of the team and how your contributions will fit into our mission. We will discuss real examples of your upcoming projects to get a sense of how you would approach and implement them.
Culture and Talent Assessment - 1 hour
We strongly believe in supporting you in finding meaningful work which is aligned with your strengths. This 1 hour activity will give you and us deep insights into your alignment with the team, the position, and your career.
Accommodations are available on request for candidates with special needs throughout the application process. Please let us know of any special needs in the application form."
