Title,Description
"Marketing Assistant Intern - Toronto, ON - Indeed.com","4 month internship starting in May 2022
ESSENTIAL RESPONSIBILITIES
This individual will gain on-hands experience in category management and the distribution business in B2B in sector. They will collaborate with the category management team and related cross-functional teams to help develop and execute marketing programs and promotions. They will use data-driven analysis to optimize results and identify opportunities.
JOB ACTIVITIES
Assist with building and executing the Monthly Sales Flyer.
Prepare and submit digital marketing requests through the marketing tool.
Assist in reviewing and approving marketing programs for final execution.
Lead the in-store merchandising programs by working closely with the Category Managers, Associate Category Managers and Supplier partners.
Work with the Marketing Communication team on printed catalogs.
Assemble insights and data from marketing programs and promotions.
Communicate promotions and program to the sales team.
Help review product assortment for correct product category, product description, and make recommendations for improvement.
Other duties as assigned.
YOU MUST HAVE
You are a college student or enrolled in a Bachelor's or Master's degree in Communication/Marketing.
WE VALUE
Attention to detail and analytic skills.
Excellent verbal and written communication skills.
Ability to work in a high-pressure environment.
Organization and time management skills.
Ability to multitask and take initiative.
Team-oriented but can work independently as needed.
Ability to take direction and absorb information quickly.
About Us: Resideo is a leading global provider of critical comfort and security solutions primarily in residential environments and distributor of low-voltage electronic and security products. Building on a 130-year heritage, Resideo has a presence in more than 150 million homes, with 15 million systems installed in homes each year. We continue to serve more than 110,000 professionals through leading distributors, including our ADI Global Distribution business, which exports to more than 100 countries from more than 200 stocking locations around the world. Resideo is a $5.0 billion company with approximately 13,000 global employees. For more information about Resideo, please visit www.resideo.com .
At Resideo, we bring together diverse individuals to build the future of homes. Resideo is an equal opportunity employer. Qualified applicants will be considered without regard to age, race, creed, color, national origin, ancestry, marital status, affectional or sexual orientation, gender identity or expression, disability, nationality, sex, religion, or veteran status."
"Digital Marketing Specialist - Toronto, ON - Indeed.com","Exhibition Place is Canada’s largest entertainment venue, attracting over 5.5 million visitors a year. The 192-acre site is an integral component of Toronto and Ontario’s economy, particularly with respect to conventions, sport, festivals, recreation, culture, and tourism. Located at Exhibition Place is the award-winning Enercare Centre, Canada’s largest exhibition and convention centre which is now LEED Platinum certified, and Beanfield Centre conference venue which is LEED Silver certified. Since 2004, Exhibition Place has undertaken an environmental stewardship initiative, entitled GREENSmart; which includes the promotion of sustainable development, environmental initiatives, and leading edge green technologies and practices across the site. Our environmental initiatives have resulted in award-winning recognition across North America, such as the Platinum Waste Minimization Award from the Recycling Council of Canada, and have established Exhibition Place as a world leader in energy-efficient technologies.
Our compensation package offers a competitive salary and pay-for-performance incentives. In addition, our total rewards program includes participation in OMERS - defined benefit pension plan, 100% employer paid health & dental plan, long term & short-term disability coverage, professional development opportunities, and tuition reimbursement.
Exhibition Place has adopted a vaccination policy, as a condition of employment all new hires are required to be fully vaccinated and provide proof of vaccination confirmation prior to commencing employment.
The Digital Marketing Specialist will report to the Director of Sales and Marking and is responsible for implementing the strategic marketing plans, content creation for digital marketing, social media, traditional marketing, brand awareness, media relations, and communications to promote Exhibition Place to planners, organizers, attendees, tenants and public.
Major Responsibilities
Develop, and implement digital marketing including, but not limited to: website design, content and updates, mobile site, apps, blogs, corporate and sales videos, photography, digital advertising, graphic design, and online presence, etc. for Exhibition Place, Beanfield Centre, Enercare Centre and Exhibition Place Planner sites. (Excluding any content related to the Board and Records & Archives).
Develop and implement all social media marketing and social community engagement on a variety of platforms including Facebook, Twitter, Instagram etc.
Listen to and monitor all social platforms and media feeds for Exhibition Place items trending, including meetings and exhibitions industry, tenant trends, media coverage and community engagement etc. and generate monthly reporting and analytics.
Create and implement the messaging and creative for the outdoor pixel boards, digital outdoor advertising, desktop player, photo and video library.
Write and distribute press releases, editorial content and event listings, follow-up with media outlets and prepare monthly reports of media coverage.
Develop and implement the advertising plan, including advertising placement in digital and print, advertorial, photography, collateral materials, develop and monitor ad budget, and liaise with external suppliers.
Participate in the development of the annual strategic marketing plan including digital marketing, social marketing, media relations, and brand management.
Research and analyze competitive set marketing strategies and digital marketing trends.
Coordinate special marketing projects, and other duties as assigned.
*
Required Qualifications*
1. Several years’ experience in communications, managing online communities, content creation or journalism.
2. Self-starter who is able to take initiative, set priorities, multi-task, possess time management skills, create a strategic vision, meet deadlines, anticipate trends and business needs and liaise with different internal/external departments.
3. Progressive work experience with knowledge of digital marketing, website development, social media and community engagement, analytical research, advertising and media relations.
4. Excellent skills in written/verbal communication and interpersonal relationships.
5. Knowledge of Adobe InDesign / Photoshop / Illustrator/iMovie/ Social media platforms.
6. Ability to be flexible in the scheduling of full time work hours to allow for social media coverage on weekdays and weekends.
Vaccination:
All Exhibition Place employees are required to be fully vaccinated as a condition of hire in accordance with the Exhibition Place Vaccination Policy.
Equity, Diversity, and Inclusion:
Exhibition Place is committed to fostering an inclusive, accessible environment where all employees and members of the public feel valued, respected, and supported. We are dedicated to building a workforce that reflects the diversity of the public and the communities in which we live and serve.
Accommodation:
Exhibition Place is committed to creating an accessible and inclusive organization. We are committed to providing barrier-free and accessible employment practices in compliance with the Accessibility for Ontarians with Disabilities Act (AODA). Should you require Code-protected accommodation through any stage of the recruitment process, please make them known when contacted and we will work with you to meet your needs. Disability-related accommodation during the application process is available upon request.
We thank all applicants for their interest in this opportunity. However, only those selected for an interview will be contacted.
Job Type: Full-time
Salary: $63,372.00-$79,926.00 per year"
"Marketing Manager - Vancouver, BC - Indeed.com","Are you our new Marketing Manager?
Lucent Biosciences is on a mission to develop solutions to mitigate the climate impact on global food security and nutrition. We have developed the first carbon-neutral, sustainable, non-polluting agricultural micronutrient fertilizer called Soileos.
We are looking for a Marketing Manager who can build our brand and is looking to make an impact on regenerative agriculture.
You like to spend your time:
Working from home or from our Vancouver and Coquitlam offices collaborating with the Chief Executive Officer, product management and business development team on marketing strategies and occasionally traveling to events in North America as needed.
Developing and implementing our company brand and messaging
Providing guidance, input, and feedback on the creative direction and briefs of all Marketing assets, including trade show/conference materials, website (including input on SEO/SEM strategy and results), landing pages, print or digital advertisements, etc to meet strategic goals, ensure effectiveness and cohesiveness, and increase brand awareness.
Owning the entire process of generating demand to meet and exceed revenue targets by researching, designing, executing, testing, tweaking, and measuring high ROI multi-channel digital marketing campaigns and initiatives across the prospect and customer lifecycle, ensuring the alignment of communications and messaging to generate top-of-funnel leads, drive traffic, and nurture opportunities to conversion for our business development teams, using SEO, content marketing, social media, email, nurture campaigns, webinars, online promotions, landing pages, etc.
Organizing, administering, and optimizing our CRM (HubSpot) and other Marketing/Sales tools for solid integration and automation.
Providing input on annual Marketing budget, tracking various marketing and sales KPIs such as conversion rates, ROI, CAC, etc, preparing monthly reports, identifying effectiveness or opportunities for improvement and making data-backed decisions to optimize accordingly.
Complete ownership of researching, identifying, and project managing events such as conferences or trade shows, including managing budgets, vendor selection and management, contract negotiations, purchasing and shipping any materials (such as furniture, booths, etc), ordering swag and assets, booking travel, and any other deadlines or deliverables.
Leading debriefs and strategy post-conference, ensuring any leads enter the funnel or nurture campaigns, helping sales team to execute, and measuring event-specific KPIs.
Collaborating with Product Management and Business Development teams to build and nurture key relationships with customers, partners, and key industry players to gain insights about prospect and customer journeys and conceptualize and execute any customer or partner marketing initiatives, product launches, or outreach campaigns.
Your Experience & Skills:
6+ years in a Demand Generation, Digital Marketing, or Marketing Manager role for a B2B company
3+ years managing a team of 2+ marketing team members
Deep understanding of prospect, buyer, and customer journeys, as well as buyer personas, and how to market to each stage and type
Strong writing skills
Expert level user in various Marketing tools, such as CRMs, SEO, Google Analytics, etc.
Comfortable working with numbers, making sense of metrics and processing figures with spreadsheets
Easily balance independent ownership of projects with collaborative team mindset
Proactive, strategic, detail-oriented, data-backed
Meeting deadlines under pressure, prioritizing multiple tasks, and communicating effectively
Multilingual abilities are a pre but not required.
Your Area of Expertise:
Direct and Digital B2B marketing
Brand messaging development and implementation
Sales funnel management through a CRM (we use HubSpot)
Customer acquisition, re-engagement, and retention strategies
Interpreting data, measuring KPIs, and forecasting trends
Conference/trade show detail planning, coordination & execution
Up-to-date with the latest trends and best practices in digital marketing and measurement
Remuneration will be commensurate with experience.
COVID PROTOCOLS - Lucent Bio cares about the health of its employees and requires proof of full vaccination to be considered for this position.
Job Type: Full-time"
"Marketing and Sales - Mississauga, ON - Indeed.com","Company description
Prokare Support Services is a leader in finding talent and identifying the
the ideal candidate for any position; we assist shelters and other businesses in
their hiring process for many roles, mainly in the social services and
shelters in Ontario. We further assist our clients in the procurement of
cleaning, safety, security, catering, industrial and technology support for
their operations.
Job description
Identify new opportunities to engage with existing and new clients
Evaluate existing marketing materials, social media and advertising, determining how successfully these target customers and generate sales
Shape company branding, the identity of a company and how well it resonates with the desired demographic (is it professional? unique? recognizable?)
Manage the brand if something happens to damage a company’s reputation – damage control so to speak
Maximize lifetime customer value by getting former customers to return more often, perhaps with new product or service opportunities
Improve client engagement through social media, creating innovative campaigns on various media that are integrated for optimal success and managing interactions with customers
Coordinate content platforms such as website, blog and landing pages
Write content mindful of Search Engine Optimization keywords to generate organic search engine rankings
Manage email and social media marketing campaigns, online advertising, mobile and local marketing
Track and review analytics and conversions to benchmark success and achieve optimal results
Reference ID: Prokare 10901
Application deadline: 2021-12-29
Job Types: Full-time, Permanent
Salary: $15.00-$24.00 per hour
Benefits:
Dental care
Extended health care
Flexible schedule
Life insurance
Vision care
Schedule:
10 hour shift
8 hour shift
Day shift
Monday to Friday
COVID-19 considerations:
Vaccination required
Experience:
marketing: 1 year (preferred)
Work remotely:
No"
"Stratège SEO - Sherbrooke, QC - Indeed.com","Si l’algorithme de Google n’a plus de secret pour toi, que tu as le sens de l’organisation et que tu trouves toujours solution à tout, on te veut dans notre équipe!
Faire partie de Standish, c’est appartenir à une grande famille animée par la passion, la curiosité et le désir de se surpasser. Tu auras la possibilité de faire du télétravail en mode hybride, même après la pandémie. La conciliation travail-famille est importante. C’est pourquoi tu bénéficieras d’un horaire flexible. Ce qu’on veut, c’est te fournir tous les paramètres nécessaires pour que tu puisses te développer, apprendre et optimiser ton travail ainsi que ta vie personnelle.
LE POSTE
En étroite collaboration avec la direction et le département Web, le ou la stratège SEO est responsable de la planification, du développement et de la gestion des projets SEO. L’analyse de la performance, la stratégie et la mise en place des actions nécessaires à l’amélioration du référencement organique de nos clients font partie de ses responsabilités.
Tu as un esprit analytique, marketing et technique? Tu souhaites évoluer dans un poste ou tu as carte blanche pour mettre en place les méthodologies de ton choix, afin d’améliorer le référencement organique des clients? Ce poste est pour toi!
TÂCHES ET RESPONSABILITÉS
Réaliser des audits SEO et formuler des recommandations d’optimisations;
Agir à titre d’expert-conseil auprès de l’équipe de développement, afin de générer des idées, des produits et des stratégies, dans le but d’améliorer le positionnement des sites de nos clients dans les moteurs de recherche;
Assurer le suivi de l’implantation des actions recommandées auprès de l’équipe de production et du client;
Configurer les outils d’analyse et élaborer les rapports de suivi des performances;
Créer une valeur mesurable pour les stratégies de référencement, suivre l’évolution des statistiques SEO et proposer des recommandations, dans le but d’atteindre les objectifs de revenus, d’acquisition et de positionnement du client;
Analyser les rapports de performance et présenter les résultats mensuels au client;
Identifier les pratiques de référencement organique innovantes et pertinentes pour le client;
Assurer la réalisation des objectifs conformément aux calendriers et budgets établis.
COMPÉTENCES ET APTITUDES
Connaissance des meilleures pratiques et des outils SEO (Google My Business, Analytics, Search Console, Tag Manager, Moz, SEMrush, GTMetrix, etc.);
Esprit d’analyse;
Approche axée sur les résultats;
Autonomie et curiosité;
Capacité à gérer plusieurs tâches simultanément et à travailler avec des échéanciers serrés;
Rigueur, soucis du détail et de la qualité;
Solide joueur d’équipe;
Être à l’affût des tendances Web et SEO;
Bonne connaissance des plus récentes pratiques du Web;
Connaissance de WordPress, un atout.
LES CARACTÉRISTIQUES DU POSTE
Télétravail et horaire flexible;
Poste à temps plein : 35 h, 37,5 h ou 40 heures par semaine;
Entrée en fonction selon tes disponibilités;
Salaire à discuter selon l’expérience;
Équipe humaine;
Formation continue;
Environnement de travail dynamique (bureau assis-debout, MacBook…);
Avantages sociaux (assurances et programmes de référencement);
Activités d’équipe (dîner potluck, cabane à sucre, pommes, souper de Noël, etc.);
Vacances et congés, dont un congé payé le jour de ton anniversaire;
Café à volonté, chocolat chaud, popcorn, desserts maison, desserts glacés…;
Bière le vendredi après-midi;
Possibilité d’avancement;
Dog friendly et plus encore!"
"Editor of English Content & Localization - Chabanel, QC - Indeed.com","Company Description
SSENSE (pronounced [es-uhns]) is a global technology platform operating at the intersection of culture, community, and commerce. Headquartered in Montreal, it features a mix of established and emerging luxury brands across womenswear, menswear, kidswear, and Everything Else™.
SSENSE has garnered critical acclaim as both an e-commerce engine and a producer of cultural content, generating an average of 100 million monthly page views. Approximately 80% of its audience is between the ages of 18 to 40. It is privately held and has achieved high double digit annual growth and profitability since its inception.
Job Description
Reporting to the Associate Manager of English Content, the Editor will ensure the best-in-class quality of our written content and localization strategies for our product-centric customer touch points. He/She will help develop and implement writing guidelines for our e-commerce and marketing channels and uphold English Copywriters to our writing consistency, accuracy and quality standards. The ideal candidate has meticulous attention to detail, a keen interest in fashion, and strong collaboration and communication skills.
Responsibilities
Quality Assurance - 75%
Revise all e-commerce English copy, as well as newsletters, SEO-driven texts, external communications and other ad hoc requests
Co-write, implement, and update tone, approach, and stylistic guidelines for the English product-centric channels, along with the Lead Editor when appropriate
Maintain strict standards of quality control and reinforce our tone of voice through editing and training workshops to improve the quality output of the team
Monitor, maintain, and update product-centric guidelines to ensure content is consistent, accurate, and continuously relevant for our English customers
Co-develop and execute on content strategies for ad-hoc requests and projects
Work closely with the English and other language teams in performing various writing and revision assignments as required
Training & Development - 15%
Hold team meetings for quality review purposes and ensure writing skills on the team are constantly improving
Provide timely individual feedback to the Copywriters and report on individual performance with respect to quality targets
Execute and lead on-boarding and training programs for Freelancers and new Copywriters
Production Management - 10%
Manage deadlines and resource allocation for e-commerce production and other ad-hoc projects
Produce written work for projects as required
Assist research efforts in support of the team’s business priorities and needs
Qualifications
Bachelor’s degree in English Literature, Creative Writing, Linguistics, Journalism, or related field/experience
A minimum of 3 years experience in writing and editing, ideally as part of a content team in a high-volume publishing environment for a English-speaking market
Excellent verbal and written skills in English
Advanced research skills
Mastery of English grammar, spelling, and usage including ability to craft culturally-sensitive texts
Good understanding of tone of voice, with an ability to adapt to different writing styles
Good understanding of SEM, SEO, and content marketing strategies
Skills
Detail-oriented and versatile writer
Demonstrated knowledge of fashion terminology & culture for the English-speaking market
Ability to articulate and present creative ideas
Ability to work effectively to meet tight deadlines
Team player with great communication and interpersonal skills
Creative and agile thinker who is self-motivated and collaborative
Desire to develop talent"
