Title,Description
"Senior C++ Developer - Montréal, QC - Indeed.com","Algolux is an industry-leading software provider with technology at the intersection of AI, computer vision, and computational imaging. Our award-winning products address mission-critical applications for the Advanced Driver Assistance Systems (ADAS), Autonomous Vehicle (AV), Smart City, and video security markets.
As a Senior C++ Developer, you will contribute to the integration of Deep Learning based Computer Vision technologies on a variety of software and hardware platforms. The ideal candidate is a Software Engineer with a proven ability to write production-quality code and who is comfortable collaborating with the R&D team.
Key responsibilities:
Integrate or port computer vision and image processing algorithms to various platforms.
Participate in the design of Computer Vision software infrastructure that:
Supports a variety of computing platforms and AI accelerators (such as PCs, embedded devices, CPUs, GPUs and VPUs)
Leverages the power of existing Neural Network inferencing frameworks like TensorRT, OpenVINO, TensorFlow, etc.
Provide constructive feedback and guidance to junior team members.
Requirements:
Knowledge in at least one of these fields is desirable: ComputerVision, Image processing, Deep learning, etc.
Experienced and comfortable dealing with technical / project uncertainty.
Pragmatic approach with a make it work attitude.
Excellent C++ programming skills:
Mastery of modern C++ standards (C++11 or more recent).
Hands-on experience with object-oriented software design patterns, and their implementation in C++.
Comfortable using language features like STL, smart pointers, move semantics, templates, etc.
Experience with debugging and using tools such as gdb, lldb, valgrind, etc.
Experienced with cross-platform build systems, like CMake.
3+ years of experience developing under a linux environment
Experience working in a collaborative work environment:
Familiarity with agile development practices such as Scrum.
Comfortable using collaborative development tools such as GitLab and Jira.
Ability to adhere to company coding standards.
Willingness to participate in code review processes.
Bachelor or Master degree in Computer Science, Software Engineering (or in similar fields), and at least 5 years of industry work experience as a Software Developer.
Proven dedication for writing production-quality code that is robust, efficient, portable, maintainable, and bug-free.
Nice To Have Skills:
CUDA
Deep Learning frameworks such as TensorFlow, PyTorch or Caffe.
Automotive or Embedded Platforms, such as NVIDIA Drive/Jetson AGX.
Good knowledge of Deep Learning and Computer Vision algorithms.
ASPICE."
Fullstack Engineer - Remote - Indeed.com,"At Blockthrough, our mission is to bring about an Internet where publishers and advertisers can build flourishing, sustainable businesses by delivering advertising experiences that respect the user’s choice.
Through our close-knit culture, transparent leadership, competitive compensation, flexibility to work remotely, and a focus on optimal work-life balance, we're proud to be a ""Great Place to Work"" certified employer, Canada's 11th fastest growing company ranked by the Globe and Mail, and recipient of the 2021 Deloitte Companies-to-Watch award.
We work with some of the biggest publishers in the world, we’re backed by some of the brightest minds in the industry, and we’re looking for curious and analytical team players who like to win!
Our Product
Our product restores publishers’ existing website monetization technologies for adblock users who consent to it, while making sure that all ads adhere to the lighter, stricter Acceptable Ads standard, a happy middle ground for users and publishers. Users also have the ability to opt out if they prefer no ads at all.
Through a complex cloud-based system, we use sophisticated algorithms and real-time analysis to determine which ads qualify for an optimal user experience, all in the time it takes for a website to load. We process vast numbers of requests, processing tens of billions of ad impressions per month.
What you're great at
We are looking for a
Full Stack Software Engineer
to join our Engineering team to drive innovation and work on our cutting-edge adblock recovery platform. This role offers you the unique opportunity to design the tech stack and make architectural decisions for a new adblock monetization product. You will work with the latest tools and technologies as you expand your technical knowledge and contribute to the business’s success. Since we are a small team, your impact will be felt almost immediately.
Be part of an amazing team
As part of a fun, close-knit and highly talented team, you'll work on building innovative products and features for our publishers. You'll have the chance to work with the brightest minds in the industry and contribute, as Blockthrough builds the internet of the future! We are looking for individuals who thrive in a fast-paced startup environment and are looking to challenge themselves, grow quickly, and make massive contributions to the company’s success.
What you’ll be doing
Design and develop proof of concept applications in the ad block recovery space.
Design and implement new features in our header bidding and monetization systems using JavaScript and modern frameworks.
Contribute to reducing latency, improving code efficiency of the front end of the application stack.
Work with modern build tools to streamline development, automation of testing and deployment of frontend code.
Participate in code review sessions and work with other engineers to build optimal solutions.
Support and debug production level issues and provide fixes in a timely manner.
What You’ll Need
2-3 years of experience working in a professional environment with full stack development.
BS in Computer Science, Engineering, or other related technical field or equivalent work experience.
-Strong fundamentals in
web applications and front-end technologies including
JavaScript, ES6 and modern frameworks such as -TypeScript, React, Angular.
Knowledge of RESTful web services.
Self starter, comfortable working with different technologies (Front end and Server code, Databases, frameworks etc).
Bonus if you have
Understanding of the ad tech ecosystem and/or ad tech experience.
Familiarity with cloud providers (GCP or AWS)
Built prototype applications from start to finish
Why you’ll love working at Blockthrough:
Close-knit and collaborative culture with transparent leadership that cares
Competitive compensation (including health benefits) and stock options at a fast-growing startup
4 weeks vacation
Top-of -the-line hardware
Optimal work-life balance
Up to $1k home office reimbursement
Professional Development Compensation
100% remote or the opportunity to work out of our central downtown Toronto office, surrounded by some of Toronto’s hottest scaleups
We value inclusiveness, diversity and are an equal opportunity employer. We do not discriminate based on race, religion, colour, national origin, gender, sexual orientation, age, marital status, veteran status, or disability status."
"Technical Writer - Ottawa, ON - Indeed.com","Numerator is a data and tech company bringing speed and scale to market research. Headquartered in Chicago, IL, Numerator has more than 2,000 employees worldwide. The company blends proprietary data with advanced technology to create unique insights for the market research industry that has been slow to change. The majority of Fortune 100 companies are Numerator clients.
Here at Numerator, we've made all corporate roles have maximum flexibility between office and remote work, except for rare situations when the role requires coming into an office regularly
.
In those situations, the recruiter of that role will clarify at the beginning of the process if that is the case. In fully remote situations, the company will provide technical equipment necessary to be successful in the role. In addition to maximum flexibility of return-to-office, the company also provides generous PTO, Internally Quiet Focus Time, and other recharge efforts to give time back to employees.
Job Description
About The Role
Numerator is a data and tech company bringing speed and scale to market research. Headquartered in Chicago, IL, Numerator has more than 2,400 employees worldwide. The company blends proprietary data with advanced technology to create unique insights for the market research industry that has been slow to change. The majority of Fortune 100 companies are Numerator clients.
Numerator is searching for a skilled wordsmith to join our team as a Technical Writer. This is a highly visible position requiring you to work closely with employees, leaders, and executives across our organization to explore, document, and provide subject matter expertise on the technical stack our products are developed upon. As an ideal candidate, you have proven experience in a highly technical field, such as software development, computer science, or engineering. Your ability to evaluate and analyze complex information is second to none, and you have a natural desire to help people understand things that are hard to understand.
What You Will Do
Work closely with engineers to produce high-quality technical documentation that engineers trust
Improve existing onboarding processes with documentation, helping engineers get up to speed quickly
Take initiative to improve the developer experience by testing tools and services, investigating problems, and channeling feedback into high-quality, impactful documentation
Accurately prioritize documentation, from the layout of content on a page to finding its accurate place in the entire documentation taxonomy, with search optimization in mind
Define standards and guidelines that help other writers and engineers
Influence and motivate partners to adopt your documentation vision
Skills & Requirements
Requirements
A minimum of 4 years of experience writing and organizing developer-facing documentation and other forms of technical content
Proven ability to quickly learn about technical concepts and write accurate, concise content
Experience writing for the web, software, hardware, or cloud technologies
Proven ability to independently propose, plan, and deliver documentation solutions to developer problems
Nice to haves
Experience mentoring writers or engineers to improve their writing skills
Experience writing about large-scale web services, data platforms, or developer ecosystems (knowledge of the various pieces of interacting technologies behind platforms)
Experience crafting API documentation or code examples
Experience with Confluence and statically generated HTML/CSS/JS content
What we offer You
An inclusive and collaborative company culture
An opportunity to have an impact on our growing teams and organization
Ownership of platforms and environments with industry leading product
Market competitive total compensation package
Volunteer time off and charitable donation matching
Strong support for career growth, including mentorship programs, leadership training, access to conferences and employee resources groups
Great benefits package including health/vision/dental, unlimited PTO, 401k plus matching, and more.
If this sounds like something you would like to be part of, we’d love for you to apply! Don't worry if you think that you don't meet all the qualifications here. The tools, technology, and methodologies we use are constantly changing and we value talent and interest over specific experience.
While this position can be remote, Numerator is only able to hire in many, but not all, states and provinces. In certain cases, if you are not located in a specific area where Numerator is able to hire, you may not be eligible for employment.
We are an equal opportunity employer. All qualified applicants will receive consideration for employment without regard to race, color, religion, sex, sexual orientation, gender identity, national origin, disability status, protected veteran status, or any other characteristic protected by the law.
#LI-AB1
#LI-Remote"
"C++ Developer - Robotics - Montréal, QC - Indeed.com","Algolux is a globally recognized computer vision company addressing the critical issue of safety for advanced driver assistance systems and autonomous vehicles. Our machine-learning tools and embedded AI software products enable existing and new camera designs to achieve industry-leading performance across all driving conditions. Founded on groundbreaking research at the intersection of deep learning, computer vision, and computational imaging, Algolux has been repeatedly recognized at industry and academic conferences and has been named to the 2021 CB Insights AI 100 List of the world’s most innovative artificial intelligence startups.
As a C++ Developer within the robotics team, you will contribute to the integration of autonomous driving modules within a robotics framework in a variety of hardware platforms, including test vehicles. The ideal candidate is a Software Engineer with a proven ability to write production-quality code and who is comfortable collaborating with an R&D team.
Key responsibilities:
Develop testing and continuous integration pipelines for the robotics codebase
Build infrastructure for regression testing, performance validation, and system maintenance
Test and deploy developed algorithms in simulation environments as well as on production vehicles
Build a platform to scale, analyze, and visualize simulations
Requirements:
Experience with ROS to design, build, and operate robotic systems
Experience with popular C++ testing frameworks
Excellent C++ programming skills:
Mastery of modern C++ standards (C++11 or more recent).
Hands-on experience with object-oriented software design patterns, and their implementation in C++.
Comfortable using language features like STL, smart pointers, move semantics, templates, etc.
Experience with debugging and using tools such as gdb, lldb, valgrind, etc.
Experienced with cross-platform build systems, like CMake.
Multi-threading
5+ years of experience as a software engineer
Experience working in a collaborative work environment:
Familiarity with agile development practices such as Scrum.
Comfortable using collaborative development tools such as GitLab and Jira.
Ability to adhere to company coding standards.
Willingness to participate in code review processes.
Bachelor or Master degree in Computer Science, Software Engineering (or in similar fields)
Experienced and comfortable dealing with technical / project uncertainty.
Pragmatic approach with a make it work attitude.
Proven dedication for writing production-quality code that is robust, efficient, portable, maintainable, and bug-free.
Nice To Have Skills:
Experience with safety-critical, real-time mobile autonomous robotic vehicles
GPGPU programming and CUDA framework"
"Controls Hardware Designer - Cambridge, ON - Indeed.com","About Eclipse
Here at Eclipse Automation, creation and innovation is at our core, and our culture reflects that. Fast-paced and continuously fostering growth, we encourage the entrepreneurial spirit that our Teams embody, and leverage each of their strengths to do better for our people, our clients and our communities.
Our teams are made up of are innovators, thinkers, and doers, with the know-how and expertise to exceed expectations, and the relentless spirit to create and reinvent. Our people are what enable us to live up to our name – to eclipse all others, inspiring and creating outcomes that change the world.
When you join
Eclipse Automation
, you become a member of a dynamic world-wide team of experts, visionaries, dreamers, and builders whose know-how is unparalleled. A team that’s helping design and build our future, one innovation at a time.
Come and see what your future has in store. Your next exhilarating career move awaits
What’s In It for YOU?
The Eclipse team is 800+ strong, working out of seventeen locations across five countries and three continents. Our people are our greatest assets and our biggest competitive advantage. That’s why we ensure that they’re taken care of with comprehensive benefit packages that support the growth and well-being of each and every Eclipse team member.
About Our Engineering Teams
Our
Engineering Teams
help bring our ideas to life. Innovators and reinventors, their know-how is unparalleled, and their endless drive keeps them striving for excellence. They push possibilities, and turn passion into world-class products to help our customers reach their ultimate potential. They’re mechanical engineers, controls software designers, applications engineers, and much more. Whether they’re building, designing, programming or testing, our engineers breathe life into the technology of tomorrow. That’s why we need deep thinkers, problem-solvers, innovators, and industry-leaders like you – the ones that can help push us forward, and never stop striving for excellence.
Duties and Responsibilities
Reporting to the Controls Engineering Manager, the Controls Hardware Designer will contribute to concept review, designing to current electrical and safety standards and maintaining customer specifications using Eclipse templates while delivering the Eclipse Vision and the Eclipse Entrepreneurial Culture
Technical
Design and develop common electrical designs as per customer and project requirements based on standard Eclipse methods
Provide electrical assistance during the various stages of integration
Select, test and integrate hardware and software components such as robots, analog devices, motion controllers, sensors, vision systems and lasers
Work with other members of the control systems design department and other groups to continuously improve methods of design, with the goals being enhanced safety, enhanced functionality and reduced cost
Work with customers, project managers, designers, toolmakers and electricians to solve problems in order to provide the customer with a complete, functional automation system
Provide accurate documentation for each project
Advise customer on solving technical problems
Project Execution
Work requires professional written and verbal communication and interpersonal skills
Ability to work within a team environment and actively participate in group meetings
Complete other duties and projects as assigned
Position requires willingness to work a flexible schedule and travel as required in varying timelines
Ensure scheduled milestones are met
Notify the appropriate departments if milestones are not projected to be met by expected due dates
Adhere to the Eclipse Project Operating Policy
Maintain good corporate citizen role in support of the Eclipse Corporate Vision
Ensure that all business activities are performed with the highest ethical standards and in compliance with the Eclipse Automation Inc. Conduct Code
Adhere to all health and safety rules and procedures
Foster the development of a culture reflective of the core values of the business
Travel
Expectation of travel to vendor/supplier locations is less than 5% of time, however may be exceeded in exceptional circumstances to meet project needs
Qualifications
Education
A post-secondary engineering degree, diploma or equivalent, specializing in mechanical, electrical, systems or computer engineering.
Experience
Experience with Eplan and AutoCAD
Knowledge of various electrical machinery standards such as NFPA 70/79, CSAZ22.1-12 would be an asset
Knowledge of various safety standards such as EN ISO 13849 OR EN 62061 would be an asset
Ability to communicate effectively, both orally and in writing
A self-starter with the ability to work as part of a team in a fast paced environment with minimal supervision
Experience in an automation environment will be considered an asset
This position is open for Eclipse in Cambridge, ON.
Eclipse is an AODA compliant organization, and accommodations are available upon request.
We support an environment where teams work together and where people can learn, grow, and thrive.
O"
"Cloud Operations Engineer - Vancouver, BC - Indeed.com","POSITION SUMMARY
This position is a member of the Cloud Operations team and will focus on system administrative efforts in support of operational excellence. Perform system automation tasks, system planning, system support, system monitoring, platform monitoring, diagnostics and troubleshooting. Contribute to the design and implementation of operational procedures and policies.
WHAT YOU'LL BE DOING
Maintain system software to latest versions and patch release levels
Proactively monitor environment utilizing best practices
Learn other technologies as necessary to develop/support other application platforms as necessary.
Perform Unix server and application instance management
Knowledge Java / Tomcat and Apache
Knowledge of databases including Microsoft SQL
Maintain operational, configuration and other procedures.
Puppet/Chef development and support along with other automation tools like Bamboo, Jenkins, etc.
Perform application release deployments and provided continuous process improvement for application releases
Expand knowledge of programming techniques and databases
Evaluate and recommend third party products to address current requirements
Work to continually to develop and improve processes, methodologies and approaches
24/7 On-Call support on a rotational basis
HOW YOU'LL STAND OUT
Extensive Unix administration experience
Experience with Unix OS system build and configuration managers such as Puppet, Chef, and Vagrant
Apache Tomcat experience
Shell and Python scripting experience
Operational experience supporting MS SQL
Support of file systems and database files.
Experience with orchestration and teaming in a DevOps culture
Strong analytical and problem solving skills
Windows servers
Amazon Web Services (AWS)
Experience with cloud delivered operations.
EXPERIENCE WE'RE LOOKING FOR
Ability to learn software and hardware tools where necessary
Ability to work on multiple projects simultaneously and good multi-tasking skills a must.
Good verbal and written communication skills.
Strong analytical and problem solving skills.
Ability to learn software and hardware tools
Ability to perform systems analysis and design and provide written specifications
Ability to consistently meet deadlines and work under pressure.
Exceptional multi-tasking skills.
WHAT IS REQUIRED FOR YOU TO APPLY?
Bachelor’s Degree in Computer Science, Engineering, Science or related fields
Must have 3+ years related work experience including activities such as user management, security management, OS installation and patching and system monitoring; or equivalent combination of education and experience.
Must be detailed and process orientated."
