Title,Description
"Marketing Assistant - Richmond Hill, ON - Indeed.com","Sunny Shutter Inc. is the GTA local window covering factory mainly focused on the production of high-quality vinyl and wooden interior shutters, zebra blinds, and roller shades. We have several years of experience in custom window shutters, blinds, and shades, we provide design-driven solutions with the highest levels of customer satisfaction.
With the launch of the new location in Richmond Hill, we are seeking an individual who is competent in digital marketing.
Responsibilities
Maintain the company's social media accounts.
Create Social Media content and implement social posting schedules.
Daily online marketing management includes responding to guest inquiries, consistent posting, and creation of content to grow social engagement and media presence.
Creative ability to generate new ideas or recommend changes to existing design processes.
Event photography including basic photo editing.
Other duties as assigned.
Assist the Sales Team in lead generation activities.
Requirements
Experience with graphic design materials and creation.
Copywriting - Email newsletter / Social Media posts.
Working knowledge of Microsoft Office and G-suit.
Knowledge of SEO is a plus but not required.
Experience in social media platforms and tools, including calendar planning, social media backends, and reporting tools.
Language:
Fluent in English, Mandarin is a plus.
Reference ID: SUNNYMA
Job Type: Permanent
Salary: From $16.00 per hour
Benefits:
Store discount
Schedule:
8 hour shift
Experience:
Digital marketing: 1 year (preferred)
Work remotely:
No"
"Junior Content Marketer - Waterloo, ON - Indeed.com","Junior Content Marketer
Please apply if you are (or capable of being) an edgy/vibrant storyteller with an eye for design, an ability to seek answers when not obvious, and a solid understanding of technology and community.
In this role, you'll be supporting Weavik’s internal content marketing efforts and working with the Director of Marketing. Each week will bring a new challenge and our hope is to help you grow into the role! As a content marketer, your goal is to help our team develop an audience that finds what we say insightful, entertaining, educational, and not at all ‘salesy.’
The below helps (but having all is not mandatory):
You have experience producing written content on the internet. It is good to know where hyphens go and be able to take constructive feedback in order to become better (because nobody is perfect).
You have produced visual content - weather that is video or infographic-based.
You have a willingness to spend 2 hours a day online, being social within Weavik’s network via LinkedIn & Twitter - but not mindlessly. You must be able to take the time to read, engage, comment, understand, and piggyback on conversations.
You have a desire to dive into articles, videos, and learning about the tech space including design, IoT, education, crypto/blockchain, community initiatives, best practices when developing/building a product, and more!
You have a willingness to help develop customer case studies, industry eBooks, and other content used to help the customer on their sales journey.
You have the ability to work in a team and distill information into themes/meaningful stories (this is also a learned skill).
You have experience working with a content calendar and hitting deadlines consistently.
You know how to build relationships across online communities and develop rapport with key stakeholders.
Hours & salary
The role is remote/blended for a total of 20 hours a week. Hours are flexible, however, we ask that a minimum of 2.5 hrs be allocated each day Monday to Thursday, between 10am-3pm (We want you to have enough time to do other things you care about). The position offers $20-$30 an hour based on experience.
About Weavik
Our priority is to educate our community and build knowledge within our team. We are a development house of 30+ located in Waterloo, supporting some of the coolest startups, companies, and local businesses around!
Equity & Diversity
Weavik values the diverse and intersectional identities of its employees and all applicants. We regard equity and diversity as an integral part of any workplace and are committed to accessibility for all. As such we are actively seeking applicants who embrace our values of equity, anti-racism and inclusion. We encourage applications from candidates who have been historically disadvantaged and marginalized, including applicants who identify as First Nations, Métis and/or Inuit/Inuk, Black, racialized, persons with a disability, women and/or 2SLGBTQ+ to apply and reach out to highlight your application.
Please acknowledge you have read this entire posting by attaching the phrase, “purple pigeon’ in your response and identify 2 areas for improvement in the writing of this job posting, as well as 1 major spelling mistake."
