Title,Description
"Senior Business Systems Analyst, Microsoft 365 and Office Digital Solutions - Toronto, ON - Indeed.com","At IMCO, our talent is among the best! IMCO offers a uniquely stimulating and rewarding environment where you can help build and drive organizational transformation, all while seeking to challenge yourself, learn, and grow your career.
We offer a culture of collaboration and passion, creating unwavering value for the clients we serve. Our vision is to be the partner of choice for Ontario’s public sector funds and build a high-performing, value-based Asset Management firm in the heart of downtown Toronto.
If you are ready to drive best-in-class service, and join a collaborative, motivated, and fun team of professionals, we’re ready to offer you a great place to work with exciting opportunities for growth and development.
If you want to use your expertise to drive strategic business outcomes, then we want you at IMCO!
IMCO is looking for a highly motivated Senior Business Systems Analyst with Microsoft 365 and Office Digital solutions experience to join our IT Enterprise Applications team!
The Senior Business Systems Analyst, specializing in Microsoft 365 and Office Digital Solutions, is responsible for providing system and solution analysis, eliciting and understanding business requirements, translating business requirements into solution design and configuration, facilitating implementation plans and testing solutions while providing a trusted liaison interface between IT and IMCO Microsoft 365 stakeholders. This individual has skills for applying, influencing and following best practice analysis and design processes and has familiarity with modern Microsoft cloud-based Information Technology capabilities and contemporary Office Digital Solutions beyond Microsoft offering.
This position will be working primarily on Microsoft collaboration solutions, including SharePoint, Teams, Exchange Online, PowerApps, Forms, Planner, Flow, OneDrive and other tools. The successful candidate may be tasked with various corporate or enterprise initiatives. Experience in other areas such as Finance ERP, HR ERP and CRM is a definite asset. The position reports to the Director, Enterprise Applications, who may assign project/solution/enhancement roles covering both tactical and strategic initiatives. The overarching organizational responsibility is to deliver value-added business solutions while ensuring adherence to IMCO’s processes and procedures and overall supportability of all applications once projects are live.
Responsibilities:
Assess clients’ business models and their integration with technology, and perform a liaison function between business, managed services vendor, Microsoft and IT. Interact with clients and vendors to discover, document and contribute to solution requirements, designs and user manuals. Analyze, document and contribute to business processes and related business requirements from various stakeholders to implement Microsoft 365 and other Office Digital solutions.
Interact with the vendors to understand software limitations and service constraints. Collaborate with the vendors during solution configuration. Manage and facilitate solution testing strategies and execute test plans. Deploy completed solutions, including documentation of setup/configuration manuals and provide training as required.
Assure continuity and transparency of the support function and timely resolution of clients’ issues. Stay familiar with multiple approaches to problem-solving. Manage issues through to completion.
Ensure that business requirements and solution designs are understood and required artifacts are completed on time with high accuracy and quality levels. Define artifact types and configuration item types, storage strategies, locations, organization and templates related to the enterprise solutions.
Apply, follow, and contribute to existing processes and procedures and create base-level requirements and design artifacts. Review and ensure that requirements reflect the current state and are signed off/approved.
Champion existing products and solutions while staying current with new offerings in the marketplace. Provide consulting support to the implementation team and conduct necessary research to provide recommendations on appropriate products and tools to develop scalable and forward-looking business solutions.
Maintain consistent communication channels between business units, technology teams and vendors through regular status updates and feedback to Project Managers and Product Business Owners.
Assure the integrity of all interoperable supported solutions across the M365 platform and other Office Digital Solutions. Coordinate and assist users during the user acceptance testing cycle of projects. Ensure that all test cases have been executed and documented according to IMCO standards and track all issues.
Develop user manuals and provide training to business users to ensure that solutions and processes are well understood during rollout. Develop understanding and knowledge of key solutions that new projects or changes will impact.
Work closely with business users, IT Operations, and the vendor during all SDLC stages. Champion using vendors’ best practices to ensure full value of selected solutions is fully aligned to business requirements and IT guiding principles.
What you need to succeed:
Bachelor’s degree in Engineering or Computer Science field or equivalent work experience of more than five years in a related role within the Microsoft 365 solution set and other Office Digital Solutions
Knowledge of Microsoft 365 suite and ability to implement collaboration solutions within the Microsoft 365 (SharePoint, Teams, Exchange Online, Power Apps, Power Automate, PowerShell, Forms, Planner, OneDrive and other tools)
In-depth knowledge and understanding of traditional Microsoft Office productivity tools, Word, PowerPoint, OneNote, and especially Excel
Familiarity with the configuration of Adobe products, especially Adobe Sign
Familiarity with the configuration of Zoom
Familiarity with Microsoft Azure Cloud Computing Services, especially Active Directory and Managed Cloud Services support models
Implementation skills in Microsoft 365 tenant, Intranet, SharePoint Online
Knowledge of solutions analysis methodologies and best practices. Strong understanding of SDLC cycle, techniques and tools
Experience in analyzing the business requirements, gap analysis and data mapping
Excellent written and verbal communications skills
Experienced with multiple project management techniques and tools and demonstrated flexibility and understanding of when to apply them. Good knowledge of software testing techniques
Exposure to Enterprise Application Integration projects and principles would be an asset, as well as exposure to other business areas and solutions
Professionalism, integrity, strong quantitative skills, and prioritizing assignments and work within a closely-knit team environment. Strong analytical and problem-solving skills. Self-starter and ability to work with minimal supervision.
Ability to manage their workload effectively and perform sound time management. Results-oriented and client-focused
Experience as a user of ERP solutions is an asset
Experience with the user, role, and security management is an asset
Practical training and educational material preparation and delivery experience is an asset
What IMCO Can Offer You:
We thrive on the challenge to be our best, to deliver an unparalleled employee experience and to work as one team to continuously improve the management of broader public-sector investment funds. In addition to offering a competitive salary and comprehensive benefit package, we pride ourselves on helping you reach your potential, making a difference in our communities, and achieving success that is mutual.
We thank all applicants, however, only those selected for an interview will be contacted.
Our employees are currently working remotely in response to COVID-19 public health guidelines. However, once the Ontario provincial restrictions have been lifted and IMCO has deemed it safe to return employees to the workplace, it shall be a condition of your employment that you perform your duties and responsibilities at the Corporation’s offices at 16 York Street, Suite 2400, Toronto, ON M5J 0E6.
IMCO is committed to providing accommodation for people with disabilities in its recruitment process. Please advise IMCO if you require an accommodation and we will work with you to meet your needs. Candidates being considered for this position will be required to submit to a background screening."
"Support Analyst (Contract) - Vaughan, ON - Indeed.com","Overview:
You’ve got big plans. We have opportunities to match, and we’re committed to empowering you to become a better you, no matter what you do.
When you join KPMG you’ll be one of over 227,000 professionals providing audit, tax, advisory and business enablement services across 146 countries.
With the support to do things differently, grow personally and professionally and bring your whole self to work, there’s no limit to the impact you can make. Let’s do this.
Overview of the Opportunity
The Support Analyst role is located onsite, in our Vaughan, Ontario office. The Support Analyst will report to the Manager of End User Support and is primarily responsible for providing internal support to KPMG Canada users.
What you will do:
Troubleshoot and resolve Level 1 & 2 support issues from various support channels (phone calls, chats, self-service tickets); document and escalate issues further as required.
Record all incident tickets under the appropriate severity into the ServiceNow call tracking system.
Configure and image PC’s with the required core environment image and practice specific software.
Provide technical support for various practice specific software applications and firm proprietary software. Install and configure software, updates and patches.
Troubleshoot various IT hardware issues with PC’s, printers, peripherals, etc.
Provide device and app support for various types of mobile devices - both iOS and Android.
Provide technology training to new hires (one-on-one or group sessions), either in-person or virtually through online sessions.
Provide support for telecom issues as required.
Assist with asset management and inventory tracking as required.
Actively participate on various local and national IT projects/virtual teams as required.
Liaise with the extended IT team country wide.
Keep up to date with innovative technologies and trends in the world of information technology.
Various other duties as required.
What you bring to this role:
Previous deskside support, virtual support and/or help desk experience a requirement.
Working knowledge of Microsoft 365, Teams, Windows 10, Project and Visio.
Mobile device knowledge and experience - iOS and Android.
Knowledge and experience with ServiceNow would be an asset.
Aptitude for learning software and standard policies with minimal instruction.
Proficient knowledge of computer hardware - PC’s, printers, peripherals, laptop imaging, etc.
Ability to work effectively, both independently and as part of a diverse team. Strong team player.
Passionate interest in user's needs and in providing customer service excellence.
Excellent interpersonal skills.
Excellent communication skills - written and oral.
Strong troubleshooting/problem solving skills and analytical ability.
Strong work ethic and thrives on challenges.
Solid organizational skills; ability to prioritize, multi-task and work in a busy, fast paced environment.
Desire to learn and expand knowledge of the firm and the technology environment in use; develop an understanding of the business requirements of the firm.
Flexibility to work shifts within the 8:00am-6:00pm, EST timeframe.
Flexibility to work on weekends and statutory holidays when required.
Learn more about where a career at KPMG can take you.
Our Values, The KPMG Way:
Integrity
, we do what is right |
Excellence
, we never stop learning and improving |
Courage
, we think and act boldly |
Together
, we respect each other and draw strength from our differences |
For Better
, we do what matters
KPMG is committed to the health and safety of our people, clients and communities. With this commitment in mind, KPMG complies with all public health mandates (provincially and/or federally, as applicable) and has implemented various safety measures, including a COVID-19 Vaccination Policy. KPMG's COVID 19 Vaccination Policy requires all employees to be fully vaccinated if they wish to or are required to attend a KPMG office and/or other congregate settings in the course of their duties (such as client sites or third-party venues).
As this role requires occasional or consistent attendance at a KPMG office and/or congregate setting, the successful candidate must be fully vaccinated (i.e. have received all doses that are recommended by Health Canada, including any boosters) and must provide KPMG with proof of vaccination. KPMG will provide reasonable accommodation if the successful candidate cannot be vaccinated due to grounds protected by human rights legislation in their province of employment.
KPMG in Canada is a proud equal opportunities employer and we are committed to creating a respectful, inclusive and barrier-free workplace that allows all of our people to reach their full potential. A diverse workforce is key to our success and we believe in bringing your whole self to work. We welcome all qualified candidates to apply and hope you will choose KPMG in Canada as your employer of choice.
For general recruitment-related inquiries, please contact the HR Delivery Centre at cafmcdnhrsthotline@kpmg.ca.
If you have a question about accessible employment at KPMG, or to begin a confidential conversation about your individual accessibility or accommodation needs through the recruitment process, we encourage you to contact us at cafmcdnhrsthotline@kpmg.ca or phone:
416-777-8002
or toll free 1-888-466-4778."
"Sr Application Support Analyst - Montréal, QC - Indeed.com","Company Description
For more than 15 years, Talan has been advising companies, supporting them and implementing their transformation projects in France and internationally. Present on four continents, Talan aims to achieve a turnover of 350 million euros for 3,500 consultants in 2021. The group puts innovation at the heart of its development and intervenes in areas linked to technological changes such as Big Data, IoT, Blockchain and Artificial Intelligence.
Job Description
Primary tasks related to
Production Support Analyst
role include but are not limited to:
Provide timely resolution of functional and technical issues and report incidents to the appropriate chain of command. End user community includes FO, MO, Product Controls, and Risk.
Troubleshoot functional issues in a complex financial environment, with various applications and architecture regionally and/or globally. Multi-tasking environment.
Provide functional and technical expertise to produce and promote maintainable and quality solutions. Includes documenting system requirements and documentation of support run book.
Communicate with users regarding application outages.
Liaise with development teams in Bangalore, New York, and Paris.
Help configure setup as requested by users and monitor platforms.
Understand regulatory environment and constraints.
Perform post-rollout testing of new releases (quality assurance).
Handle queries and one-off data research requests from users.
Respond to end users within timeframe dictated by the severity of the problem, and document and track (case histories, issues, and action steps) the response.
Research technical processes using sources such as error logs and product technical documentation; and identify solutions to resolve problems or improve efficiency.
Respect internal IT norms, standards, and processes.
Timely reporting of production and project status to client and IT management.
Effective and efficient oral and written communication to various audiences at appropriate levels.
Partner with development teams (NY/Paris) on release management.
Partner with the Global support teams (Paris/Asia) to ensure quality support to our end users.
Effectively manage the Client Relationship with the end user community.
Qualifications
Competencies Required:
Experience in application support
Knowledge of market Risk Management in Finance (Risk Analysis, VaR, SVaR, PnL, Liquidity)
Knowledge of pricing of Equity and Derivatives products (Options, ELS, Futures, …)
Experience working with relational databases
Good ability to analyze, solve and monitor problems
Good organizational and priority skills and ability to manage multiple tasks simultaneously
Desired/ Plus:
FRM Certification
ITIL Certification
Technical skills Required:
2+ years SQL (SQL Server, Oracle …)
2+ years Unix, Linux server environment
Desired/ Plus:
Knowledge in Programming (Python, Shell, Java)
Education Required:
Bachelor of Computers Science or other related university degree
Languages Required:
English
Desired/ Plus:
French
Additional Information
We are looking primarily for employees recruited in permanent positions at Talan, but are open to working with freelancers. The teleworking conditions depend on the mandates to which our consultants are assigned
Joining Talan also means:
Joining an international group (10 countries, 3000 employees) of Professional Services and IT Consulting, committed to the digital transformation of its clients for over 15 years
Joining a Canadian company, created in 1997, with more than 100 consultants, working in an agile and pragmatic way with large companies (Finance, Insurance, Telecommunications, Services, Distribution, Public Sector) by combining consulting services / technological expertise / innovation / capacity to deliver and deploy projects
Joining dynamic teams, where the employee's place is at the center of attention, with the desire to create spaces that allow each person to grow, and societal and environmental commitments.
The ""Great Place to Work"" survey conducted this year for Talan confirms that we are well above the standards in Canada.
Having the opportunity to access the various communities of practice throughout the group, to share expertise, to contribute to development and to innovate, all with a strong team and entrepreneurial spirit
Benefit from market-competitive benefits!
Talan is a great playfield, it's up to you!"
"Information Systems Manager - Langley, BC - Indeed.com","Salary: $48.00/Hourly
Job Type: Full Time, Permanent
Start Date: As soon as possible
Language: English
Minimum Education: Bachelor's Degree
Positions Available: 1
NOC Group: Computer and Information Systems Managers (0213)
NOC Job Title: Information Systems Manager
Expires in 23 days
Expires: 2021-12-30
Posted: 2021-11-30
Last Updated: 2021-11-30
Job Location(s)
Unit - 200 20457 Fraser HWY
Langley, British Columbia
V3A 4G3, Canada
Job Description
Business Name: Set It Up Technologies
Business Address: 200 - 20457 Fraser Hwy, Langley, BC V3A 4G3
Title of position: 1 Information Systems Manager
Terms of employment: Full-time year-round work
Job Description
Plan, organize, direct, control, and evaluate the operations of information systems and electronic data processing (EDP).
Develop and implement policies and procedures for electronic data processing and computer systems development and operations
Manage teams of information systems personnel to design, develop, implement, operate and administer computer and telecommunications software, networks, and information systems
Recruit and supervise computer analysts, engineers, programmers.
Skills requirement:
A bachelor's degree in computer science, business administration, connected or a related discipline, or completion of a college program in computer science is usually required.
Minimum 3 years of experience in systems analysis, data administration, software engineering, network design, or computer programming, including supervisory experience, are required.
Good command of English both written and oral.
Must be reliable, dependable, and highly motivated.
Application support and troubleshooting experience
Network management.
How to Apply
Expiring: Dec 30, 2021
Email: setituptech@outlook.com"
"IT Application Support Analyst - Merchandising - Montréal, QC - Indeed.com","Department:
Are you looking for a new opportunity? Let’s shape our future together!
WE'RE ON A JOURNEY TO CREATE A WORLD OF LOVE, CONFIDENCE AND BELONGING
The ALDO Group has been on this journey for over 40 years. We believe that our passionate associates are at the heart of our success, and that with them we will lead into our future with kindness.
The ALDO Group is committed to diversity and inclusion, not only now, but for the long term. We strongly encourage people who are Aboriginal, racialized, have disabilities, come from gender and sexually diverse communities and/or have intersectional identities to apply for employment with us. At ALDO Group, we will always strive to take steps to create a diverse and inclusive work environment that promotes equal opportunity and accountability.
#WeAreALDO
ALDO GROUP ASSOCIATE PERKS
Recognition programs to showcase your talent!
To be part of a company that takes a stand on issues affecting people, the environment, and our partners
Summer Fridays (because Summer is for fun)
Purchase discount on merchandise sold in all our divisions.
Family & Friends events with discounts on our products
Subsidized cafeteria & daycare
Subsidized public transportation, carpooling network and free parking
On campus gym with access to a trainer
Flex schedules and telecommuting
Sick days
Attractive total compensation!
YOUR ROLE
As an IT Application Support Analyst - Merchandising, you will be responsible for supporting application problems, documenting them and their potential solutions , as well as participating in testing until resolution. You will also have to ensure the proper functioning of daily activities while providing the appropriate support to the various merchandising teams. You will be responsible for measuring the quality of the support as well as improving it. The incumbent will be supported by a team of business analysts and technical analysts.
Provide troubleshooting and resolution of technical issues affecting our customers' applications.
Answer user questions and provide technical liaison between clients and the development team.
Have the motivation to find and implement innovative solutions that improve service for our customers.
Diagnose any business and complex application problem and grasp several new concepts quickly.
Report application anomalies, provide solutions for mitigation and prioritization of anomalies.
Work in synergy with various partners and stakeholders.
Proactively prevent disruption to contact center applications and infrastructure using technical and analytical skills.
Strengthen customer loyalty and satisfaction, as well as relationships with them.
Coordinate the resolution of anomalies with the technical team and respond to customers.
Take the lead and maintain the stability of solutions and the availability of services.
Perform trials and tests on different environments in order to reproduce the problem encountered,analyze the possible causes and develop solutions.
Document processes and procedures.
Closely monitor responses and problem-solving requests to ensure resolutions are implemented promptly.
Support outside regular rotating hours.
Manage service levels and the technical support service dashboard.
DO YOU HAVE THE PROFILE WE'RE LOOKING FOR?
College degree in computer science, information systems or other related field
5 years of relevant work experience
Experience in application support.
Good knowledge of merchandising and retailing processes.
Bilingual (French, English) - Speaking and writing.
Strong interpersonal communication skills oriented towards teamwork and sharing of knowledge and expertise.
Flexible approach to consider multiple options and alternatives.
Excellent analytical, conceptual and problem-solving skills.
Ability to work on multiple initiatives at the same time.
Curiosity in Computer Science and new Technologies.
Don't wait any longer, apply now, we want to meet you!
WANT TO KNOW MORE ABOUT US? HERE ARE SOME FUN FACTS.
Present in more than
100 countries
, the ALDO Group has established itself with strong brands: ALDO/ALDO Accessories, Call it Spring and Globo. Guided every day by its purpose “A journey to create a world of love, trust and belonging”, the organization is simply unique. What makes our culture so one of a kind is our people’s passion for innovation, excellence, craftsmanship, entrepreneurship and diversity, as well as their empathy and friendliness. In addition, our associates all have an insatiable curiosity!
JOB SNAPSHOT
Employee Type:
Full-Time
Location:
Montreal
Job Type:
Information Technology
Experience:
Not Specified
Date Posted:
11/25/2021"
