Title,Description
"Quality Assurance Analyst - Toronto, ON - Indeed.com","This role covers:
Maintain our Automated Regression Testing Tool to cover new features
Test new features, run manual regression and sanity tests
Certify our payment middleware software with banks
Key Responsibilities:
Maintain our scripts as inputs for the Automated Regression Testing Tool
Prepare, run the Automated Regression tests as well as provide results’ report
Write Testing Strategies, Plans and test cases
Prepare, run manually New Feature tests as well as provide results’ report
Prepare, run manually regression and sanity tests as well as provide results’ report
Prepare, run bank scripts to certify our payment middleware software with Banks, as well as provide results’ report. This involves a close collaboration with Bank employees.
Work closely with Development team for defining and sharing testing strategy and planning
To succeed, the candidate will need:
5+ years of quality assurance
Strong problem-solving abilities
Good written and oral abilities
Work well independently (from home)
Technical Skills:
Strong Knowledge of:
Testing Automation (including Test scripting)
Robot Framework
JIRA Ticketing System
Tesk Link
Linux, Windows, Android and iOS operating systems
Good Knowledge of Confluence
Payment expertise is a plus"
"Policy Analyst - Vancouver, BC - Indeed.com","Job No:
CPSBC391
Location:
Vancouver, BC
POSITION SUMMARY
Reporting to the policy and engagement lead, communications and public affairs (CPA), the policy analyst is responsible for assisting with the development and revision processes for practice standards and professional guidelines. The policy analyst will help ensure that practice standards and professional guidelines are developed in accordance with best practices and the College’s policy framework by conducting research and analysis, developing drafts, facilitating consultation processes, and ensuring practice standards and guidelines are reviewed according to their scheduled review cycle and based on changing legislation. The policy analyst coordinates effective engagement initiatives with the public, the profession and key health partners through multiple platforms such as surveys, email invitations and focus groups. The policy analyst will be responsible for developing recommendations and reports to the College’s committees, Board, and senior management team to guide the policy development process.
DUTIES AND RESPONSIBILITIES
Duties include but are not limited to the following:
conduct consistent scans of relevant environmental trends and issues, including regular monitoring of government reports, bylaw revisions, media reports, consultations by other partners, advances in technology, and literature reviews to confirm currency of existing practice standards and assess whether a new practice standard or a revision should be considered
conduct impact assessments of proposed new or revised practice standards, identify and define key goals, expected outcomes, and possible challenges
coordinate the development and review process of practice standards, professional guidelines, legislative guidance documents, and internal position statements
develop consultation communications to increase awareness internally and externally of current engagement opportunities
liaise with relevant internal and external staff and stakeholders throughout the policy development process, including coordinating messages to relevant stakeholders
participate in working groups regarding practice standards or relevant legislation with key health partner organizations
ensure practice standards and professional guidelines are aligned with other BC health regulators as appropriate, and work with other BC health regulators to promote consistency when appropriate
compile and analyze feedback received through surveys, emails, and focus groups to identify themes and prepare consultation finding reports and presentations
develop communications, such as website announcements, email updates and
College Connector
articles to inform stakeholders of policy updates
ensure appropriate version control and archiving of practice standards and professional guidelines
other related responsibilities as needs arise, such as writing briefing notes, supporting documents, articles, or correspondence in response to a particular consultation process, practice standard or professional guideline
SKILLS AND QUALIFICATIONS
Required skills and qualifications include:
a graduate degree in public policy/administration/public health/law, or a related field, and at least three (3) years of experience in public administration, planning, or program development in healthcare, legal or social services
knowledge of medical terminology, health care practices, and BC’s health-care system at-large
current registration with a relevant BC health regulator (e.g. nursing, PT, OT), education in law (e.g. JD, LLB), and/or experience working for a health authority, ministry of health, or regulator would be an asset
thorough knowledge of the principles, practices, techniques, methods, and procedures applicable to research and policy development
good understanding of International Association for Public Participation (IAP2) principles and how to apply them in a regulatory setting
exceptional analytic skills and strong attention to detail; a polished presenter
exceptional business writing, clinical document writing, and editorial abilities; strong technical abilities to create and manage complex document filing, indexing and retrieval systems
strong computer/web skills
strong project management skills, including ability to engage and manage stakeholders in a respectful, tactful and effective manner
able to establish effective working relationships with a wide variety of internal and external contacts
able to develop, implement and evaluate innovative policy and related materials, taking into consideration the impact on healthcare outcomes
excellent time management skills to prioritize and complete assignments and schedule activities; self-motivated and self-sufficient; work well independently
The College of Physicians and Surgeons of British Columbia has been recognized as one of BC’s top employers since 2011 and one of Canada’s top 100 employers since 2014. Our goal is to attract, develop and retain highly-talented employees. We offer an excellent working environment environment including a hybrid work-from-home/in-office model, opportunities for personal and professional growth, and a comprehensive benefits package.
How To Apply
All applications for this position must be submitted online via this page
Please read through all of the questions; you may wish to prepare your responses in a Word document before you start filling out the fields below.
To begin the application process, complete the questions below. You will have the opportunity to attach your resume and other documents on the next page.
Note:
You must submit your resume online. Ensure you have your resume ready to attach.
We thank all applicants for their interest; however, only those selected for an interview will be contacted. The College welcomes all applicants and is dedicated to promoting a diverse, equitable and inclusive environment."
"Senior Technical Analyst - Toronto, ON - Indeed.com","Position Profile:
Build your career at the hospital that’s building for the future
Humber River Hospital is committed to revolutionizing patient care for our diverse community. Opened October 18, 2015, the future is very exciting for our people and programs. And we’re looking for exceptional individuals to join our great team: people who share our passion to deliver excellent, patient-focused, expert care. The Hospital is formally affiliated with both the University of Toronto and Queen’s University.
We currently have an exciting opportunity for a
Full Time Senior Technical Analyst
to join our
Information Systems & Telecommunications
team.
Working collaboratively within the IS&T team and reporting to the IT Manager, the successful incumbent will deliver third level support, innovative customer focused service by analyzing, troubleshooting and resolving Infrastructure server hardware/software and application related issues to hospital Staff, Physician and Volunteers in an efficient and courteous manner.
Hours of work:
Week Days
Location:
All Sites
Job Responsibilities:
Proactively plans, creates, builds and manages the Technical Support component within the Information Systems & Telecommunications department.
Provides advice and recommendations to the CTO and Manager relative to the establishment of major project priorities.
Understands the hospital data and information needs of the corporation at a high level and liaises with the Telecommunications Manager, I.S. Applications Analysts, and Developers.
Provides the corporation with appropriate, integrate, innovative and cost-effective information systems technology solutions. Technology includes but not limited to Hardware, Operating Systems and Network components.
Ensures that all Technical areas function with full security and integrity controls.
Provides advance Sr. level Technical support, troubleshooting and Incident Management for all backend systems IT integration.
Provides Technical oversight for administration, integrity, security, storage and disaster recovery of data.
Supports continuous improvement to the ongoing services delivered by the Technical team and overall Information Systems & Telecommunications while recognizing the needs and expectations of the clients. Coaches staff respectively.
Builds and maintains a strong technical team with the overall Information Systems & Telecommunications Team. Responsible for training when necessary
Establishes and maintains vendor relationships and contractual terms to maximize return on resource expenditures for assigned areas of responsibility.
Represents the Hospital for matters related to the Technical area to all external contacts.
Develops and executes plans which service to align Technical Information Systems staff, technologies and other resources with the Humber River Hospital management strategic direction.
Contributes to the development and evolvement of the HRH Information Management strategic direction
Partners with Technical related departments to provide direction for the implementation of a total hospital-wide information system.
Supports the CTO and Manager in the continual integration enhancement and standardization of information systems, policies and procedures to maintain pace with technological progress, economic change and business needs across the enterprise.
Identifies impacts on current and planned resources in the area of responsibility.
Facilitates and achieves workload tracking, reporting and proactive maintenance. Utilizes standard methodologies and approaches (i.e. System Life Cycle, change control, project management).
Keeps the CTO and Manager aware of any item of which s/he should have knowledge
Performs other projects or duties as assigned.
Participates in the rotating On-Call support program
Qualifications:
Successful completion of University and/or Community College diploma in a computer technology program
A highly developed customer-service orientation is essential
Excellent attendance and discipline free record required
Must have strong advance Sr. level technical experience in Microsoft server administration, MS SQL, VMware, Cisco Switches/Cores/ASA Firewalls/Intrusion Prevention and Detection, Storage Area Networks (EMC, Compellent, etc.)
Must have a valid Cisco -CCIE Designation
Technical requirements:
Certified Microsoft Server 2012/SQL2012 and above
Certified Microsoft Exchange 2013 and above
Micro Soft System Center Configuration Manager
CCIE Routing and Switching/Wireless/Security
Certified VMware/VCenter Technology
Certified Dell Compellent storage and EMC storage
Certified Avaya VOIP Gateway
Certified ITIL Foundation
Interested applicants are required to submit an Application before the closing date. We thank all candidates that apply but only qualified candidates will be contacted for an interview
Humber River Hospital is an equal opportunity employer and we will accommodate your needs under the Ontario Human Rights Code. Upon individual request, hiring processes will be modified to remove barriers to accommodate those with disabilities. Should any applicant require accommodation through the application, interview or selection processes, please contact the Human Resources Department for assistance."
"Business Intelligence Analyst - Montréal, QC - Indeed.com","Business Intelligence Analyst
Full-time
Staff
Montreal, Montreal, QC, CA
Interested in being a part of the MSC family?
Who is MSC? Behind every one of our containers, our 570 container vessels, sailing on over 200 trade routes, you’ll also find a whole lot of company with people that love what they do and the company they work for.
Working at MSC, you are part of a continuously evolving organization. Employees don’t only facilitate ocean transport; they aspire and achieve professional growth.
Are you passionate or interested in learning about maritime shipping & logistics?
Are you entrepreneurial at heart and want to be a part of a family owned company?
Are you a people person who cares for others?
Are you a dedicated and committed individual who believes in continuously evolving?
If so, read below to see if this position is right for you!
Department Summary
The Business Transformation Department is responsible for the optimal execution of strategic operational projects at the heart of the organization’s transformation, while aiming to support changes to processes, people, and systems to better align to the company’s vision.
Key accountabilities
Build and manage data warehouse system using best methodology suited for respective business areas
Develop tabular and multidimensional models that are compatible with warehouse standards
Build high performance data marts and Analysis Services reporting models
Develop visual reports, dashboards, and KPIs scorecards using Power BI desktop
Connect data sources, importing data and transforming data (ETL) for business intelligence
Implement row level security on data and understand application security layer models in Power BI
Build DAX and MDX queries in Power BI desktop to support advanced calculations
Adapt in development, publishing, and scheduling Power BI reports as per Business requirements
Understand business requirements and develop data models accordingly by taking care of the resources
Manage assigned projects, develop project plans, monitor performance
Design methodology and project documentation
Have knowledge and experience in prototyping, designing, and requirement analysis
Have knowledge and skills for secondary tools such as Microsoft azure, SQL data warehouse, PolyBase, Visual Studio, PowerShell, PowerApps, Power Automate etc.
Integrate PBI reports into other applications using embedded analytics like PBI service (SAAS) or by API automation
Qualifications and Competencies
All MSC Canada employees are expected to exhibit the
MSC Values
, striving to drive customer centric results in all interactions with colleagues and customers alike.
Bachelor’s degree in computer science or information system and a minimum of 5 years of work experience in a similar field
A minimum of 2-4years experience in data preparation, data gateways, and data warehousing projects
A minimum of 2-4 years’ experience working/acquaintance with Microsoft Business Intelligence Stack having Power BI, SSAS, SSRS, SSIS
A minimum of 2-4 years’ experience with Structured Query Language (SQL)
Excellent listening, communication, interpersonal, and presentation skills
Excellent analytical, critical, and problem-solving skills
Familiarity and experience with PowerShell, JavaScript, CSS, and other Java script library
Team player with professional attitude
Experience in advanced analytics and data science using Python and R is an asset
Experience with other BI tools (Tableau, Qlik, Oracle BI, IBM Cognos, Crystal Report etc.) is an asset
Shipping experience is an asset
What We have to offer
Great people who work hard and look out for each other because we’re a team—it’s that simple!
Just to name a few of our perks:
100% health and dental benefits coverage
RRSP coverage with MSC Canada matching a portion of employee contribution
Tailored training program opportunities for employee development
Employee mentorship, leadership and assistance opportunities
An employee referral incentive program
Community Involvement
Gym facility
Health & Wellness Program
Hurry, and apply now!
MSC Canada is an equal opportunity employer and we welcome and encourage applications from all interested parties. Accommodations are available, upon request, for those with a disability or medical need during any stage of the recruitment process. We thank all candidates for their interest in MSC Canada however, only those candidates selected for an interview will be contacted."
"Senior Consulting Analyst - Ottawa, ON - Indeed.com","Duties and Responsibilities:
Reporting to the Service Desk Supervisor, and managed by the Director, Client Services, the Senior Consulting Analyst will be responsible for Microsoft 365 administration; providing End-user support and training for hardware and software and collaborating with the IT colleagues to ensure operational security, Maintenance and Governance.
The Senior Consulting Analyst installs and configures hardware and software, evaluates and installs new software packages, receives and acts upon service request calls made through the ITS Service Desk, and provides support for campus network systems.
Qualifications:
The incumbent must possess the following qualifications:
Experience with, and a thorough knowledge of, current and emerging Information technology. It includes cloud applications and services such as O365, Azure, AWS, word processing, spreadsheets, database, statistical programs, communications, and diagnostic/analysis software. It also includes hardware matters, such as the diagnosis of hardware failures, and the installation, configuration support and maintenance of mobile devices.
Ability to understand our customers goals and challenges, then explain, demonstrate and teach IT tools and services to non-technical people and to help solve their problems.
Demonstrated superior ability to communicate effectively and maintain good working relationships with professional colleagues, clients, departments, and administrators is, in this setting, essential.
Able to plan, develop and conduct training courses to clients at various levels.
Excellent knowledge of computer hardware and software technology.
Must have sufficient relevant experience to be able to identify common problems and be familiar with a wide variety of IT solutions, cloud services and applications.
Superior customer service, interpersonal and communications skills.
Ability to work well under pressure is a requirement of the position.
Education and Experience:
The above is normally acquired through the completion of:
Completion of a three year post-secondary college program in a computer related field.
Certification in, or knowledge of, ITIL Foundation principles is an asset.
Seven (7) years experience providing IT support in a customer facing role, preferably in an educational setting, including extensive consulting and some teaching activities.
HR Note:
Carleton University and CUPE 2424 are currently completing a joint job evaluation and pay equity project. The University and the Union are working together to describe the skills, effort, responsibilities and working conditions associated with every CUPE 2424 job, including this one. As a result, the job description that is currently associated with this posting (for recruitment purposes) may be revised to reflect the actual duties captured in the new job descriptions.
By applying for this job you are acknowledging that the actual duties associated with this job may differ somewhat from those identified in the job posting and that you will agree to perform the duties of this job as determined through the joint job evaluation process.
Equivalencies will be considered. Applicants are encouraged to provide information which may demonstrate equivalent qualifications. Please note that applicants may be required to complete an employment test as part of the selection process for this position. Those applicants that are selected for an interview will be requested to contact the Human Resource Advisor assigned to this competition as soon as possible to discuss any accommodation requirements. Arrangements will be made to accommodate your request in a timely manner. Carleton University is strongly committed to fostering diversity within its community as a source of excellence, cultural enrichment, and social strength. We welcome those who would contribute to the further diversification of our University including, but not limited to: women; visible minorities; First Nations, Inuit and Métis peoples; persons with disabilities; and persons of any sexual orientation or gender identity and expressions."
