Title,Description
"Full Stack Developer - Ottawa, ON - Indeed.com","ABOUT GIATEC:
Giatec is a global company revolutionizing the construction industry by bringing smart testing technologies and real-time data collection to the forefront of every jobsite. Giatec’s suite of hardware & software products has leveraged advanced technologies such as; AI, and Internet of Things (IoT), including; wireless concrete sensors, mobile apps, and advanced non-destructive technologies (NDT) to drive innovation throughout concrete’s lifecycle and reduce concrete’s carbon footprint.
We fundamentally believe that attracting and keeping smart and talented people is a key to our success. We are looking for creative and passionate people to join our rapidly expanding team. Join us and experience the challenges, rewards, and opportunities of working for Giatec, one of the world’s most innovative companies in the concrete industry.
Giatec technology has helped over 8,000 projects in 80 countries worldwide meet their construction targets on time, and this number is quickly growing. We have also been recognized by numerous organizations as one of Canada’s fastest growing companies for three years running!
Team up with us and reshape your future!
OVERVIEW:
We are seeking an enthusiastic and skilled Full Stack Developer to join our dynamic Research & Development team. As the Full Stack Developer, you will be responsible for the front-end and back-end design and development. You will be responsible for designing, developing and maintaining cross-platform software solutions using agile methodology. Ultimately, you will be partnering with other engineers to refine and build the best-in-class products!
RESPONSIBILITIES:
Analyze product requirements and define technical specifications.
Design, develop, document, test and maintain cross-platform software solutions using agile methodology.
Ensure the technical feasibility of UI/UX designs and translate UI/UX design wireframes to actual code.
Optimize applications for maximum speed and scalability.
Participate in code reviews and inspections.
Bridge the gap between graphic design and technical implementation.
Document programming tasks and procedures.
Identify troubleshooting issues and resolve bugs found through testing.
Follow software-engineering best practices in usability, code quality, test coverage, source control, and CI/CD.
Coordinate and partner with other engineers, UX designers, product owner, and customers to refine and build complex products as well to ensure the project meets business objectives and compliance standards.
REQUIREMENTS:
Bachelor’s Degree in Computer Science/Engineering or any relevant field or equivalent experience in full-stack development.
2+ years of experience of experience developing front-end and back-end enterprise web applications.
Strong grasp of unit, integration and end-to-end test development
Enthusiasm for engineering practices such as refactoring, TDD, CI/CD, pair programming, and design and code reviews.
Strong proficiency with JavaScript
Experience working with modern front-end technologies (e.g. React.js)
Experience with ES6, HTML5, CSS3, Node.js and Express.js
Programming experience with Redux , Material UI and PostgreSQL databases is considered as an asset.
NICE TO HAVE
Any of the following:
Experience working with UI Frameworks such as Material-UI or Bootstrap
Experience in using and implementing RESTful APIs
Experience with serverless software development
Knowledge of web testing frameworks like Jest or Mocha
Experience with Git
Experience with Docker
UX/UI Design tools (Axure, Adobe XD)
Experience with IoT solutions
Experience with AI/ML-based solutions
Knowledge of Python and other programming languages
Knowledge of NOSQL such as MongoDB
Knowledge of Webpack, Gulp and Yarn
WHAT'S IN IT FOR YOU:
Flexibility is very important, for this reason, we provide an opportunity to choose between a remote option and a hybrid work model. We are happy to consider candidates who are located outside of Ottawa and prefer to be fully remote.
A high-paced and creative environment, where all team members have an opportunity to contribute. Our employees have the freedom to implement new ideas and find creative solutions to help us drive our revenue engine to success!
We are a company that supports life-long learning. We support your personal and career development. We provide in-house courses, extensive training, Lunch & Learns, and many other resources to enable our employees to achieve their personal goals and be successful in their careers.
A great corporate culture where we work and have fun together. We love to have fun outside the office, from whitewater rafting to egg hunts, trivia, and football games, and much more!
We offer diverse benefits to meet everyone's needs such as a flexible health benefits plan, a gym allowance, great time off options, a snack bar in the office and unlimited coffee
Giatec is a highly collaborative environment. We believe two brains are better than one!
An opportunity to revolutionize the construction and concrete industry together!
TO APPLY:
Do you have some of these skills but maybe not all? We still encourage you to apply as we would love to review your unique application and learn more about you! Please send your cover letter and resume to us indicating why you believe you would be a good fit for this role.
At Giatec, we know that diversity, inclusion and a sense of belongingness are critical to our success. We believe that employees with diverse backgrounds and experiences strengthen our workplace culture, boost our creativity, and help us to revolutionize the concrete industry.
Giatec is dedicated to creating a barrier-free environment starting with the hiring process. If you require any special accommodation or support during the recruitment process, please indicate in your email to us."
"Scrum Master - Brossard, QC - Indeed.com","Scrum Master - WD30129719300
At Johnson Controls, we’re shaping the future to create a world that’s safe, comfortable, and sustainable.
Our global team creates innovative, integrated solutions making the people, facilities, and assets safe with our industry leading security solutions.
We are passionate about improving the way the world lives, works, and plays. This is an exciting opportunity to develop the next generation of AI-driven security solutions.
Your role will have a large impact, as the technology you develop will be used to protect people, facilities, and assets, at scale – around the world. Which is pretty world-changing!
You will be working with a talented team of architects, scientists, product managers, UI/UXD specialists, software, Hardware, and QA engineers.
Our teams are spread across several locations including Boston MA, Indianapolis IL, Belfast UK, Tel-Aviv Israel, Bangalore & Delhi India, Montreal Canada, Boca Raton FL, and Los Angeles CA. (we have some flexibility on location)
You will be using the latest cutting-edge technologies to power next-generation Access Control and Video solutions.
Our market-leading brands include Tyco AI, American Dynamics, Cloudvue, Illustra, Exacq, Software House, KANTECH, Innometriks, and CEM.
We are investing heavily for growth so looking for change agents with big bold ideas, an entrepreneurial mindset, and a highly collaborative working style. This might just be THE impactful role you have been looking for!
What you will do
We are currently looking for a Scrum Master to join our team in Brossard, QC.
The Scrum Master will be working with multiple agile teams composed of Product Owner, architect, developers and testers to deliver best in class access control KANTECH products. Job duties include, but are not limited to coach tem members on agile best practices, improve agile process, participate in daily stand-ups, animate retrospectives, and participate in sprint planning. This position would be for KANTECH brands group and reports directly to the director of Engineering.
What You will do
Lead the scrum team in using Agile methodology and scrum practices
Works with Scrum Team, as well as internal and external stakeholders, to influence and drive decision making and support organizational project or product teams.
Work closely with SAFe release train engineer and product owner to plan sprints and program increments.
Remove impediments and coach the scrum team on removing impediments.
Assess the SAFe Maturity of the team and organization and coach the team to higher levels of maturity, at a pace that is sustainable and comfortable for the team and organization.
Resolve conflicts and issues as they occur.
Lead the SAFe and development teams in self-organization.
Qualifications
What we look for
Required
Bachelor's Degree in Software Engineering, Computer Science or a closely related discipline.
Three to five years’ experience as a scrum master.
Knowledge of an agile framework or method (i.e. SAFe, Scrum, Kanban), or understanding of software development life cycle models.
Adept at refinement, story splitting, estimation, velocity, retrospection, and other Scrum techniques
Ability to quickly resolve conflicts.
Demonstrated knowledge of industry trends and standards.
Strong mentoring skills.
Strong verbal and written communication and presentation skills.
Preferred
Prior developer experience.
Bilingual French/English.
Johnson Controls and each of its Canadian subsidiaries are committed to providing reasonable accommodations to applicants, candidates and employees with disabilities, in accordance with applicable human rights legislation and in Ontario, in accordance with the Accessibility for Ontarians with Disabilities Act (“AODA”). If you are an individual with a disability and you require an accommodation during the application process, please visit www.johnsoncontrols.com/careers.
Job
Engineering
Primary Location
CAN-Quebec-Brossard
Organization
Bldg Technologies & Solutions"
"Senior Software Engineer, Distributed Systems - Vancouver, BC - Indeed.com","Who is Recruiting from Scratch:
Recruiting from Scratch is a premier talent firm that focuses on placing the best product managers, software, and hardware talent at innovative companies. Our team is 100% remote and we work with teams across the United States to help them hire.
About our Client
Join our client in transforming the way remote teams work and communicate. Their AI-powered collaborative note-taking app works across Zoom, Google Meet, and Microsoft Teams to help teams record, transcribe, search and share meeting notes. In addition, we are making virtual meetings accessible to all employees - allowing team members with disabilities to participate in a world that is now dominated by virtual meetings.
With over 10M users experiencing their product, they are making an impact at scale and we are growing fast. The team is made up of top talent from companies like Google, Facebook, Yahoo!, Microsoft, Pinterest, Spotify, and Plaid. They are backed by leading investors that include
David Cheriton
(Google’s first investor), Tim Draper (
Draper Associates
), Spectrum Equity, Horizons Ventures, GGV Capital, and Duke University.
About this role
They are seeking an experienced
Software Engineer, Backend
to help lead the development, deployment, and management of our web services and related infrastructure to join our engineering team. Members of the engineering team work collaboratively as a group and with colleagues in technology, who are devising new speech recognition solutions, and product management to deploy systems and infrastructure to serve the needs of end-user professionals and enterprise clients across a number of verticals.
Need to Have
BS/MS in Computer Science (or EE) from a top school, or have substantial production server experience (or equivalent)
At least 4+ years of experience in developing/architecting large scale systems
Hands-on coding and development in Python and C++
Strong proficiency in building business logic with Web Framework such as Django and MySQL
Experience with platforms such as Nginx, Kafka, MySQL, Cassandra, Redis, and big data platforms
Strong ability to write and debug code that is reusable, testable and efficient
Ability to communicate effectively with peers in design, product management, technology, and engineering to respond to requirements and diagnose problems
Nice to Have
PhD in Distributed Systems or related fields (including architecture/infrastructure-related)
Employee Benefits
Stock. Be a [literal] stakeholder in our company’s future.
Food. Enjoy catered meals and boundless snacks.
Fun. We host team lunches weekly and team events bi-quarterly.
People. Work with talented, collaborative, and friendly people who love what they do.
Health and Saving. Receive the benefits of comprehensive health, dental, vision and disability insurance."
"Senior Embedded Software Engineer - Vancouver, BC - Indeed.com","Job ID
: 822-N03-0321CA
Locations
: Vancouver BC
Department
: Engineering
If you are looking for an opportunity to work on the most advanced upcoming technology with new and exciting products not yet on the market, with everyday bringing something new and challenging to work on, Lantronix is the place to be. Having recently completed its acquisition of Intrinsyc Technology, Lantronix’ expanded team of engineers work with the most advanced technology available from the world’s leading technology companies to help leading global brands create the next-generation of intelligent connected devices. Lantronix engineering services team works closely with silicon-vendors to include their cutting-edge processor designs in tablets and embedded applications including; robotics, wearables, automotive, medical, videoconferencing, digital signage, augmented reality, industrial and consumer cameras, and many more.
Job Type:
Full-Time, Permanent
Salary and Benefits:
Lantronix offers an industry standard comprehensive benefits package and competitive salary in accordance with experience.
Position Overview:
Lantronix is currently seeking Senior Embedded Software Engineers with experience in developing and troubleshooting Android and Linux devices, especially in the Android framework, HAL, and Linux kernel areas.
Senior Embedded Software Engineer candidates must have a strong technical background and be capable of coming up to speed with a new team quickly. Strong analytical, problem solving, and communication skills are essential as well as the ability to work collaboratively in a team environment. Four years of industry experience in developing and debugging Linux kernel device drivers is a firm requirement.
Prior knowledge of camera drivers and MIPI display technology is useful.
Key Responsibilities:
Takes technical ownership of projects, develops system specifications and delivers quality software features to ensure schedules and objectives are met.
Assist the development of Android and Linux based devices.
Quickly ramp up and become a key contributor within a team of experienced Embedded software engineers.
Works independently to brings up new hardware and develop/integrate Linux kernel drivers.
Fixes issues and provides technical guidance on a wide range of Linux Kernel drivers and Android framework HALs from camera to display to USB to Bluetooth to WiFI.
Stays abreast of technical area and provides knowledge transfer to fellow team members.
Designs or modifies Hardware Abstraction Libraries for Android support of low-level device features.
Qualifications:
Minimum 4 years Embedded software development experience in Linux kernel drivers. Android experience desirable.
Minimum 4 years of C/C++ experience. Java experience useful, but not required.
Bachelor’s degree in computer science, electrical/software engineering or equivalent. Advanced technical degree desirable.
Requires strong leadership and communication skills (written and verbal).
Experience in the integration of a wide range of drivers, including at least one complex driver technology (HDMI/MIPI display, CSI camera, Linux dynamic power management, etc). Multimedia experience desirable.
Experience in hardware bringup, familiarity with HW documentation such as schematic and layout drawings.
Good working knowledge of embedded or mobile devices.
Good problem-solving and diagnostic skills, in a fast-paced environment.
Requires a solid understanding of the software development and project management life cycle.
Language: Strong written and spoken English required.
Company Overview
Lantronix’ product development services provide hardware, software, and solutions for next-generation embedded and wireless products. Solutions span the development life cycle from concept to production and help device makers and technology suppliers create compelling differentiated products with faster time-to-market.
We deliver superior results for clients with standards of high integrity. Our values and performance have enabled us to partner with the world’s leading OEMs to create award winning new products.
Lantronix is a leading provider of embedded solutions for Qualcomm Technologies, Inc.’s Snapdragon technology and developer of the Open-Q System on Module and reference Development Kits. These solutions are being built using the latest 64-bit 8-core ARM highly-integrated SOCs, and customized for exciting new products such as robotics, augmented reality glasses, ultra-high definition 3D televisions, and many more breakthrough products."
