Title,Description
"Corporate Controls Engineer - LaSalle, ON - Indeed.com","***Emails regarding next steps will come from Bamboo HR - Please Ensure to check your junk mail when applying for jobs***
Cleveland-Cliffs Tooling and Stamping is looking for a Corporate Controls Engineer for its Corporate Team based out of Windsor, Ontario.
Duties and Responsibilities:
Oversee and improve electrical and automated processes in multiple manufacturing facilities, throughout the corporation.
Continuously improve automated systems, to increase equipment efficiency in high-throughput operations.
Guiding Controls Teams, in supporting of the Maintenance Management
Executes broad range of PLC programming, HMI improvements, and Industrial Controls.
Ensures functional design specifications are understood and successfully delivered on time and within budget
Involvement in new project engineering and controls programming
Executes broad range of process automation, and offers leadership amongst the team
Utilize lean-manufacturing principles by improving process capability, reducing overall costs, and increasing capacity
Prepare reports on machinery deficiencies and other reports as required
Communicate and works effectively with work-team members and other members of the company.
Abide by all Company policies including, but not limited to the following: Health and Safety, Environmental, Quality, Human Resources policies, and the Employee Handbook
Requirements:
Minimum of 5 years of relevant experience in industrial process controls
Post-secondary education in engineering, instrumentation, process control or electronics
Ability to prepare technical documentation such as shop drawings, operating manuals, training manuals, equipment reports, and employee assessments
Excellent industrial mechanic knowledge.
Strong troubleshooting and diagnostic skills
Ability to work independently in a fast-paced environment with minimal supervision
Ability to mentor and lead Jr. associates
Strong sense of teamwork within the group and across the organization
Ability to travel at times, of periods up to 3 weeks.
Ability to travel throughout USA and Canada, to support the corporation.
We thank all who apply, but only applicants selected for an interview will be contacted.
As a company, we are doing what we can to keep all our employees safe and healthy. It is the current expectation that, subject to any exceptional human rights accommodations, all Cleveland-Cliffs employees will be fully vaccinated against COVID-19 as soon as possible. Before accepting an offer of employment, you must certify that you are fully vaccinated or will be before commencing employment, or you must request and be approved for a human rights accommodation. Cleveland-Cliffs reserves the right to require proof of vaccination. Failure to adhere to this requirement will render any offer of employment frustrated, null and void, and you will not be eligible for employment with Cleveland-Cliffs.
Cleveland-Cliffs Inc., including its affiliates and subsidiaries (collectively, “Cleveland-Cliffs”), is an equal opportunity employer and complies with its obligations under applicable human rights legislation. All qualified applicants will receive consideration for employment without regard to race, ancestry, place of origin, colour, ethnic origin, citizenship, creed, sex, sexual orientation, gender identity, gender expression, age, record of offences, marital status, family status or disability, or other protected grounds under applicable human rights legislation. Cleveland-Cliffs requires all prospective employees to undergo a pre-employment background check.
Cleveland-Cliffs Inc. is committed to working with and providing reasonable accommodation to individuals with disabilities or other needs based on protected human rights grounds. If you need a reasonable accommodation for any part of the employment process, please let us know the nature of your request and your contact information."
"Engineer-in-Training EIT - Oakville, ON - Indeed.com","Acuren is a trusted, single source provider of technology-enabled asset protection solutions used to evaluate the structural integrity of critical energy, industrial and public infrastructures. Committed to delivering a Higher Level of Reliability, Acuren provides an unrivaled spectrum of capabilities including inspection, traditional and advanced NDE/NDT, failure analysis, rope access, materials engineering, reliability engineering and condition based monitoring services.
Our work is critical to the integrity and safety of industrial firms, including petroleum refinery, pipeline, power generation, pulp & paper, mining, pharmaceutical, aerospace and automotive industries. Acuren employs over 4,500 dedicated professionals supporting the mechanical integrity and inspection programs of the world’s largest industrial segments.
Acuren is a market leader. Our formula for success is straightforward: be capable locally, with certified and well-equipped personnel supported by trained, experienced leaders. Continuing to build on a strong heritage of safety, quality and professionalism, Acuren strives to maintain incident free work environments, pursues advanced technical developments, and supports reliability programs that are valued by clients and employees. Acuren is a part of Rockwood Service Corporation, together with Hellier, and Tacten.
Acuren Group is currently recruiting an Engineer-in-Training to support our Engineering Department
. This position will be based out of our office in Oakville Office. In this role, the incumbent plans and carries out various material, field testing, non-destructive testing, inspection and engineering projects, typically using established technical procedures and processes, or devising new approaches to achieve objectives. Under the guidance of a supervisor or a more senior engineer, the incumbent reviews and analyses data and delivers conclusions by written report. The role also provides direction to more junior engineers or technologists and ensures work is managed within budget, meets client requirements and completed within designated timelines.
Position Responsibilities
:
Conduct engineering work including:
Assisting with engineering analysis, repair and improvements for manufactured products, welded, cast and heat-treated components, pressure vessels, pipelines, tanks, tubing, valves, shafts, and other similar industrial equipment;
Conducting field engineering services in industrial environments including chemical analysis, hardness testing, metallography and laser profilometry; note the position at times will require out of office field work up to 50% of the time, depending on client scheduling demands;
Participating in laboratory assessment techniques including photography, machining, polishing, optical microscopy, fractography, SEM/EDX analysis, hardness testing, image analysis, metallography, and chemical analysis;
Recommending materials and processes for particular service environments and writing materials specifications;
Performing engineering review of equipment integrity inspections and provide recommendations on serviceability;
Participating in technical projects:
Providing technical support to projects;
Acting as project leader for site inspections and supporting technical investigations, communicating with client to gather evidence, conducting analysis and preparing reports; and
Ensuring efficient use of resources and delivery of results.
Providing clients with support and engineering expertise by:
Proactively taking the initiative to understand customer requirements and needs to ensure expectations are met and exceeded;
Identifying additional services and products and new technologies to meet ongoing client needs;
Meeting with customers to discuss report findings, recommendations and conclusions
Following up with clients regarding implementation of recommendations; and
Continually striving for process improvements including creating comprehensive reports and reports aligned to client needs, and identifying solutions to issues and developing recommendations for implementation.
Position Requirements:
University degree in Engineering Metallurgy (Materials, Physical Metallurgy, Corrosion, Welding is preferred)
Hands on work experience; previous experience with welding, mechanical repairs, maintenance, failure analysis, pressure equipment assessment and inspection, fitness for service review, and repair design is preferred.
Background with materials standards and analysis would be an asset.
Membership in the applicable provincial association for professional engineers is required.
The position requires understanding and knowledge in the following areas:
Engineering theories, principles and practices
Industrial codes and standards related to materials, welding, tanks, and pressure equipment
Application of NDT methodologies towards optimal equipment maintenance strategies and the ability to provide a path forward based on testing results
Acuren administrative practices (e.g. contracting, purchasing, etc.)
The position requires the following skills and abilities:
Ability to resolve issues and problems that are not clearly defined
Ability to manage large amounts of data effectively
Ability to translate knowledge into practical solutions
Excellent communication skills (verbal and written) to effectively respond to different levels of understanding, and produce professional reports
Ability to demonstrate an understanding of, and compliance with, responsibilities under the provincial Occupational Health and Safety Act and Regulations, and ISO Systems, and Acuren Safety and Quality Management Systems, policies and procedures
Proficiency in MS Office programs and driver license, Class 5 (clean record) required.
We Are an Equal Opportunity Employer
Consideration for employment is based upon capabilities and qualifications without discrimination on the basis of race, color, gender, age, religion, national origin, disability, veteran status or any other protected characteristic as established by law. Applicants must be legally entitled to work in Canada
The strength of Acuren lies in its’ outstanding people. As a rapidly growing, intensely innovative, international privately held company, the opportunities to pursue challenging and diverse career development paths are vast. Complemented by an attractive and comprehensive total compensation package and a commitment to the principles of a respectful workplace, Acuren offers tremendous opportunities to those who wish to succeed.
Next steps
If you are interested in this employment opportunity, please apply in confidence through Acuren's online application process with copies of your certifications at www.acuren.com.
We appreciate your interest in a career at Acuren, however only shortlisted candidates will be contacted for further information. Agency services are not required at this time.
#LI-CM1
Education
Required
Bachelors or better in Engineering
Skills
Required
Problem Solving
Critical Thinking
Technical Writing
Behaviors
Required
Innovative: Consistently introduces new ideas and demonstrates original thinking
Team Player: Works well as a member of a group
Detail Oriented: Capable of carrying out a given task with all details necessary to get the task done well
Functional Expert: Considered a thought leader on a subject
Motivations
Required
Goal Completion: Inspired to perform well by the completion of tasks
Flexibility: Inspired to perform well when granted the ability to set your own schedule and goals
Ability to Make an Impact: Inspired to perform well by the ability to contribute to the success of a project or the organization"
"Customer Service Engineer - Quebec City, QC - Indeed.com","You are passionate about advanced optical systems. You want to contribute to bringing high-quality solutions to life science researchers. Bliq Photonics, an innovative and growing company specializing in the design, production, and marketing of advanced microscopy solutions, is recruiting a customer service engineer. You will have the exciting task of managing the technical support of our world-class customers and partners. For us, this task is highly strategic because customer satisfaction is one of our main objectives!
Main tasks
– Provides technical support to our customers and distributors (email, phone, on-site).
– Communicate with our suppliers for technical questions
– Writes technical documentation (manual, videos, training programs…) for users and distributors
– Provide installations and technical training
– Collaborate with R&D, production, and purchasing to improve our products
Profile
– Bachelor’s or Master’s degree in biophotonics, physics, electronics (or any other relevant training)
– Open-minded, rigorous, and well organized
– Resourceful, autonomous, and interested in the agility of a small company.
– Ability to easily interact with different customer profiles and build strong relationships;
– Ability and willingness to travel;
– Based in Quebec City.
Why join the Bliq Photonics team?:
– To work within a team of experts in physics, biology, and engineering in an atmosphere of cooperation and teamwork;
– For the culture of respect and listening where the management of work hours and location are flexible;
– To participate in building a high technology company where we recognize that the ultimate value lies in people;
– To give meaning to your work by developing tools that will help researchers find solutions to diseases."
"Engineer, Elevating Devices - Toronto, ON - Indeed.com","Location
Office
City/Town
Toronto
Department Name
Engineering
Description
Since 1997, the Technical Standards and Safety Authority (TSSA) has delivered public safety services on behalf of the government of Ontario. With headquarters in west Toronto, the TSSA is a self-funded, not-for-profit organization that employs approximately 400 staff across Ontario. The roles within the TSSA are as diverse as the Province we serve. It takes all kinds of people with varied skillsets and backgrounds to meet our organizational goals, but our employees share a few key traits:
We are passionate about public safety.
We are highly skilled, problem-solvers.
We are collaborators who are invested in the communities we work in.
We are more than employees; we are serving the greater good.
We are committed to life-long learning and development.
We operate with the highest integrity.
TSSA provides our employees with competitive compensation, excellent benefits, and — most importantly — a sense of purpose. Our work is vital to the success and safety of the Province, and it’s our people who make it possible.
We are seeking an
Engineer
to join our Elevating and Amusement Devices engineering team. In this role you will enhance public safety by interpreting and enforcing the codes, regulations and standards relating to the design & implementation of electric control and operating systems used on elevating and amusement devices.
Job Responsibilities:
Working within the engineering team you will:
Perform conformity assessments of client submitted controller designs to gage compliance to current codes and standards
Enforce changes to ensure required levels of safety are achieved
Register compliant designs
Lead and/or participate in the development of regulations, codes and standards;
Investigate public safety incidences; and
Proactively educate the public and industry on existing and emerging safety priorities.
Provide technical support to field staff and respond to customer inquiries
Education and Experience
Bachelor's degree in Engineering or Applied Science or its equivalent as defined by PEO;
Professional Engineers Ontario registration;
3-5 years of engineering experience with a regulator or in the elevating and/or amusement device industry
Qualified Elevator Inspector (QEI) and/or National Association of Amusement Ride Safety Officials (NAARSO)
Experience to exposure to electric, electronic and programmable electronic systems (E/E/PES) or IEC 61508, safety PLC’s, redundant or backed up control system design or SIL rated systems or sub-systems;
Experience interpreting, applying and /or establishing compliance to regulations, codes and standards specific to elevating and amusement devices; (A17.1/B44, B355, B311, Z185, Z256, Z98, Z267
Familiarity working with the application of hazard analysis and mitigation, risk assessment and performance based codes; and,
Knowledge or familiarity with OBC, NBCC, CEC (or OESC), NFPA-70
LOCATION DETAILS:
345 Carlingview Drive
Job Type: Full-time"
"Controls Engineer - Mississauga, ON - Indeed.com","Dematic has an immediate need at our Mississauga, ON facility for Controls Engineers. It is preferred that the Controls Engineer has experience working in the material handling industry, but all PLC controls industrial experience will be considered.
What we offer:
Career Development
We are here to support you for the entirety of your Dematic career. From a fast start of learning Dematic’s history and foundational training to succeed in your role to leadership development programs, technical training and certifications, and Career Navigator to identify challenging new opportunities, our goal is to help you grow beyond your borders.
Competitive Compensation and Benefits
Our attractive and market competitive total rewards packages are designed to reward high performance and to assist in managing your personal and family needs. Dematic offers robust packages based on employment status and national requirements.
Pay Transparency
Dematic is committed to pay transparency. As such, the Dematic will not discharge or in any other manner discriminate against employees or applicants because they have inquired about, discussed, or disclosed their own pay or the pay of another employee or applicant.
However, Dematic will still maintain confidentiality of your pay information. Employees who have access to the compensation information of other employees or applicants as a part of their essential job functions cannot disclose the pay of other employees or applicants to individuals who do not otherwise have access to compensation information, unless the disclosure is (a) in response to a formal complaint or charge, (b) in furtherance of an investigation, proceeding, hearing, or action, including an investigation conducted by Dematic, or (c) consistent with Dematic’s legal duty to furnish information.
Global Opportunities
As a global company, our employees are exposed to different ideas and perspectives from around the world. We offer international assignments for qualified employees and wherever possible, we offer flexible working hours and modern workspace design.
Learn More Here
: https://www.dematic.com/en-us/about/careers/what-we-offer/
Tasks and Qualifications:
This is What You Will do in This Role:
Participation in the design of automated systems that integrate hardware and software.
Experience with material specification and electrical schematic preparation
Provides full lifecycle supports within controls engineering: Hardware/electrical design, PLC programming, troubleshooting, and commissioning.
Participate in recommending ideas related to productivity improvement, cost reduction and improvement in customer satisfaction.
The ability to understand and troubleshoot mechatronic problems, both mechanical and electrical.
Provide clear and concise correspondence.
Ability to control budgets and maintain project schedules.
Ability to train and mentor junior Engineers.
Travel to customer locations (around 25% within Canada) is to be expected.
What We are Looking For:
Basic Qualifications:
Bachelor's in Electrical Engineering or similar engineering discipline
At least 5 years' experience working within a controls position
Experience with Allen Bradley Logix PLC controls platforms
Experience with full lifecycle project experience: From controls hardware design to PLC programming and to commissioning projects
Experience providing Customer Service Support
Troubleshooting experience
Preferred Qualifications:
10 years' experience preferred
Material Handling experience
Siemens PLC experience
Robotics background in education or professional field is desirable
Strong verbal communication skills over the phone
Experience working independently"
Project Engineer - Saskatchewan - Indeed.com,"Bekaert is a world market and technology leader in steel wire transformation and coating technologies. We pursue to be the preferred supplier for our steel wire products and solutions by continuously delivering superior value to our customers worldwide. Bekaert (Euronext Brussels: BEKB) is a global company with more than 27 000 employees worldwide, headquarters in Belgium and € 4.4 billion in combined revenue in 2020.
Your role:
Coordinate internal resources and third parties/vendors for the flawless execution of projects
Ensure that all projects are delivered on-time, within scope and within budget
Assist in the definition of project scope and objectives, involving all relevant stakeholders and ensuring technical feasibility
Ensure resource availability and allocation
Develop a detailed project plan to monitor and track progress
Manage changes to the project scope, project schedule and project costs using appropriate verification techniques
Measure project performance using appropriate tools and techniques
Report and escalate to management as needed
Manage the relationship with the customer and all stakeholders
Perform risk management to minimize project risks
Establish and maintain relationships with third parties/vendors
Create and maintain comprehensive project documentation
Meet with customer to take detailed ordering briefs and clarify specific requirements of each project
Delegate project tasks based on junior staff members' individual strengths, skill sets and experience levels
Track project performance, specifically to analyze the successful completion of short and long-term goals
Meet budgetary objectives and make adjustments to project constraints based on financial analysis
Develop comprehensive project plans to be shared with customers as well as other staff members
Organize project hand over to customer
Organize periodical meeting to align all stakeholder and report progress done to management
Develop spreadsheets, diagrams and process maps to document needs
Your profile:
Proven working experience in project management - 5 years+
Excellent customer-facing and internal communication skills
Excellent written and verbal communication skills
Solid organizational skills including attention to detail and multitasking skills
Project Management Professional (PMP) / PRINCE II certification is a plus
Bachelor's Degree in appropriate field of study or equivalent work experience
We offer:
Basic salary from 1360 Eur monthly, could be higher depending on experiences of candidate
Variable pay (standard 15%)
Other bonuses"
