Title,Description
"Content Marketing Manager - Richmond, BC - Indeed.com","Envisio is looking for an experienced Content Manager to join our marketing team and help grow our sales pipeline and corporate brand.
The role:
Reporting to the Vice President of Marketing, your role will be to produce high quality content that drives traffic, engagement and leads for the top of our sales funnel. You will also play an integral role in building the Envisio brand as a mission-driven govtech company.
This is an amazing opportunity to create meaningful content and have a big impact within a small team. You’ll be supported by a close-knit, highly collaborative sales and marketing team that wants you to succeed. If you are passionate about the work of local government and love telling stories that inspire and educate, this position is perfect for you.
In addition to a competitive compensation package and employee stock options, you’ll have the option to work in our beautiful Downtown Vancouver office or remotely.
In this role, you will:
Define and deliver Envisio’s content marketing program to generate leads, nurture prospects, and build the Envisio brand;
Produce high quality content in different mediums (blogs, guides, videos, case studies etc) by writing content yourself and editing/directing content from in-house thought leaders and external partners;
Develop and execute a best practices backlink strategy to boost SEO;
Create additional outbound campaign materials including email marketing, landing page copy and events materials;
Produce sales enablement collateral to support the sales process;
Work with our VP Marketing to evolve product positioning strategy, messaging, buyer personas and thought leadership themes;
Develop editorial governance so content is consistent with our brand standards.
Your skills and experience:
At least 5 years of B2B or B2G technology content marketing experience
A track record of generating demand through content
Deep experience writing for search engine optimization
Natural curiosity and a passion to learn about what makes our customers successful
A belief that quality wins over quantity
Why Envisio?
We’re a team of dedicated, friendly people working together to build something special. We are one of Western Canada’s fastest growing software companies and recently named 2020 Top 10 GovTech International companies. We’re passionate about building deep, personalized relationships with our customers to help them build safe and thriving communities.
We’re proud of our software, our inclusive team and our transparent, high-performing culture. If you’re looking for a fulfilling environment to grow professionally and personally, we think you’ll like it here."
"e-commerce manager - Concord, ON - Indeed.com","Additional Skills
Plan and control budget and expenditures
Market business services
Hire, train, direct and motivate staff
Develop promotional materials
Write and edit press releases, newsletter and communications materials
Area of Specialization
Marketing
E-commerce
Specific Skills
Plan, direct and evaluate the activities of firms and departments that develop and implement advertising campaigns to promote the sales of products and services
Plan, organize, direct, control and evaluate the design, development and maintenance of Internet and Intranet sites to manage an organization's Internet presence
Establish distribution networks for products and services, initiate market research studies and analyze their findings
Direct and evaluate establishments and departments that develop and implement communication strategies and information programs
Direct and evaluate establishments and departments that maintain media relations on behalf of businesses, governments and other organizations
Direct and evaluate establishments and departments that publicize activities and events on behalf of businesses, governments and other organizations
Personal Suitability
Initiative
Effective interpersonal skills
Team player
Dependability
Reliability
Organized
Workplace information
Remote work available"
"Marketing Coordinator - Hemlock Valley, BC - Indeed.com","Somehow going to work each day is just a little sweeter when you work for a company that sells fun. If you enjoy connecting with new people, are outgoing by nature and thrive in a fast paced, constantly changing environment, then we invite you to apply to be a part of our Team!
Sasquatch Mountain Resort is a family focused Ski Resort located in the Fraser Valley, BC- formerly known as Hemlock Resort and in operation since 1969. We are passionate about snow sports and bringing people together for outdoor fun. We pride ourselves on our strong commitment to the quality of service we offer to each guest that comes through our door through delivering a personalized experience in everything we do. Our focus is to continually build on our culture of fun that leaves a lasting impression with our guests as they create mountain memories in a whole new way at Sasquatch Mountain Resort.
Who YOU are:
You have a genuine passion for the mountains, for winter sports and outdoor activities.
You are a creative, innovative, go-getter, and a get-it-done kind of person.
You are confident, outgoing, positive and energetic. You see the bigger picture and you are not afraid to step out of your comfort zone.
You’re flexible and adaptable quickly to constantly changing environment.
You thrive under pressure and can maintain positivity amongst challenges.
You are a friendly team player, you have a great sense of humor and you can inspire and motivate those around you.
You have exceptional verbal and written communication skills, with a proven ability to translate technical information to a non-technical audience.
You have great time management skills & the ability to work both independently and part of a team.
You have excellent organizational, analytical, and problem-solving skills; you are able to manage multiple tasks at once – the faster the pace the better.
You are up to date with the latest trends and best practices in digital marketing.
The Role:
We are seeking a Marketing Coordinator who is passionate about representing our mountain to our guests, the media, and general public to enhance the company’s profile and further strengthen our brand presence in the tourism marketplace. The primary function of your role is to creatively promote the Sasquatch brand, culture and message within our surrounding communities so that Sasquatch Mountain is known as Fraser Valley’s favourite year-round playground.
This role is best suited for a self-starter with a positive, vibrant personality who enjoys the hustle and bustle found within the day to day operations of a dynamic and constantly changing work environment. Someone who can roll up their sleeves and lead on any number of projects simultaneously – and wants to be a part of our continuing development, growth and success. The successful candidate will work with the events & social media team to create, execute and promote on and off mountain events and promotions. With a focus on design, creating and build marketing strategies that grow the SMR brand and impact our guests in a way that they feel drawn to the Sasquatch culture.
Responsibilities:
Marketing
Boosting awareness of the Sasquatch Mountain brand in the Fraser Valley and Greater Vancouver area and promoting SMR as a venue of choice for year-round events, functions and activities.
Planning digital marketing campaigns, including web, SEO/SEM, email, social media and display advertising.
Measuring and reporting on the performance of all digital marketing campaigns.
Getting to know and understand our consumers, target demographics, and what influences their spending patterns/decision making.
Ensuring branding is consistent through all outlets and channels.
Tracking and analyzing the performance of advertising campaigns and adjusting accordingly.
Developing all marketing and promotional material for various departments throughout the resort
Maintaining existing partnerships and building new relationships that will support our overall goals and development.
Attending and participating in trade shows, industry and community events as required.
Assisting the day to day content management of social media, website, blogging, guest newsletters and public communication.
Creating and executing content calendar used to drive marketing efforts, connect with customers, and contribute to the SEO strategy.
Helping creatively develop and promote new programs, initiatives and events for winter and summer operations both individually and in partnership with other brands.
Utilizing any other additional programs needed to track marketing efforts and the customer purchase journey.
Measuring and reporting on the performance of marketing campaigns, gaining insight and assessing against goals.
Identifying any consumer drop off/pain points and change systems/content accordingly.
Being a positive example and brand ambassador of Sasquatch Resort both on the mountain and within the community.
Other responsibilities may be assigned.
Communications and Social Media
Working with Social/Digital Media Coordinator to reach targets and execute predetermined marketing strategies.
Assisting with writing and development of monthly email newsletters and the daily snow report in Mailchimp and tracking success of each campaign.
Creating and deploying informative and appealing content for social posts, blogs, landing pages, email newsletters, based on strategy, audience and the overall goals and objectives of the organization.
Assisting with website content and blog updates as needed.
Researching and facilitating opportunities where we can promote our brand and connect with our target demographics.
Responsible for driving audience growth and engagement.
Communicating event and promotion details to all staff team members, departments and guests through social media, email or other means to ensure all parties know what is going on at all times.
PR – deliver and present messaging, prizing and other promotions in a dynamic and enthusiastic manner.
Job Requirements/Qualifications:
Qualifications:
Post-Secondary education in the area of marketing, events and/or tourism/business management.
A minimum of 2 years of experience in marketing, brand strategy, social media management or related field preferred.
Strong copywriting skills, a creative outlook and experience with brand campaigns.
Advanced Microsoft Office skills and working knowledge of Adobe Creative Suite design software (ex. Adobe Illustrator, InDesign, Photoshop).
In-depth knowledge and experience with current social media tactics and platforms (Facebook, Instagram, YouTube, Twitter, Pinterest, etc.).
Experience with social management tools, social listening tools and google analytics (knowledge of content management and digital platforms).
Experience with WordPress and website management.
Solid understanding of content marketing, SEO, and social media analytics.
Be able to design, update and implement email campaigns/newsletters using online tools (ie. Mailchimp).
Ability to design visuals for social media with image creation software or design tools such as Photoshop, Canva or similar.
Strong written and verbal communication skills in English and ability to edit/proofread required.
Exceptional interpersonal abilities, conflict resolution skills and the proven ability to handle member feedback in a professional manner.
Time management skills & the ability to work both independently and part of a team.
Highly organized, efficient and can handle multi-tasking.
Experience and level of comfort with public speaking/addressing large groups.
Ability to make effective decisions in the interests of guests and the Company.
Strong leadership, Excellent customer service skills and superior networking abilities.
Able to work flexible hours including weekends, evenings and holidays.
Experience/familiarity with CRM systems, client database management systems an asset.
Passion for outdoor activities and the ability to have fun in everything you do!
Self-motivated, solutions-focused with a proven track record of marketing project coordination.
Excellent knowledge of the adventure tourism, travel and ski industry, considered an asset.
Other responsibilities may be assigned.
Salary/Wage: $17.00-19.00
Job Application Process:
Salary & Compensation:
$17-$19 per hour based on experience
Season’s Pass, other resort discounts, and lift ticket discounts at other resorts.
You are required to be available to work during all peak periods including but not limited to the following:
Ø All weekends in December, January, February, March & April
Ø December 18th - January 3rd for Christmas Holidays and for March Spring Break
Please submit your Resume/CV and any applicable certificates or portfolios to John Welsh, Manager of Human Resources, jwelsh@sasquatchmountain.ca."
"Group Digital Marketing Manager - Mississauga, ON - Indeed.com","POSITION: Group Digital Marketing Manager
REPORTS TO: Director, Marketing GCX Canada
LOCATION: Virtual Ontario
SUMMARY:
Reporting directly to the Director Marketing, GCX Canada
the
Group Digital Marketing Manager
your mission is to drive digital transformation across the Canadian region aligned with global digital strategy. You will lead the team in the creation of personalized experiences while gathering, enriching, and activating data across all digital media channels. You will develop the digital team across the region in developing in-house capabilities as well as manage external, digital, and social media vendors and agencies. You will be a part of strategic conversations about the most effective ways to deliver our messaging to the online users and identify online mediums that are best served to meet overall marketing objectives and bring to life real change.
You will collaborate closely with Region Leaders, and Business Unit Leadership. You will bring your exceptional analytical skills with a passion for testing and measuring results; distributed team leadership capabilities and growth mindset; and work collaboratively with the global marketing organization and international teams. Other key responsibilities:
Lead the development, planning and execution of product and services integrated digital communications strategy
Develop and communicate the digital marketing investment strategy and coordinate the evolution of the ad technology platform to deliver on business goals
Plan, design and execute digital campaigns to support various businesses goals and objectives
Work in conjunction with the Regional Leaders, Product Managers and eCommerce in the development of digital media plans and tactics that will support achieving SBD s Marketing Objectives for Canada within the context of the global digital strategy
Manage continued development of advertising technology to improve audience management, bidding, and targeting strategies
Manage external/digital and social media vendors and/or agency coordination efforts
Proactive explore and test new campaign types, tactics and strategies to create system of continual optimization and improvement
Manage regular reporting and tracking, interpret implications, report metrics appropriately and flag issues regarding all digital platforms (website, social media, etc. ) using both internal and external tools
Synthesize data to ""tell the story"" rather than just reporting numbers
Review new technologies and keep the company at the forefront of developments in digital marketing
Lead the internal digital team in the understanding and utilization of technical platforms that would make more efficient the traffic of materials for social media initiatives
Stewardship of digital campaigns and constantly exploring new means of delivery of SBD s digital message into markets
Budget reporting and management, including preparing investment reports for internal clients and producing expenditure updates for digital and social media initiatives
Work side by side with regional and local and Ecommerce teams to create synergistic plans focused on optimizing ROAS while building our Brands
Continuously evolve and understand the online competitive landscape
QUALIFICATIONS
Minimum Bachelor s degree in any discipline; MBA preferred
10+ years of experience in digital marketing, omnichannel execution; leading digital marketing teams running global campaigns in multiple languages
Prior team leadership of functional experts working globally; coaching and developing broader team members throughout Canada
Demonstrable experience leading and managing executing best practices in all digital functions, including web development, acquisition marketing (email, banner ads, online video, paid search and SEO, etc), and web analytics
Google Analytics, Social Bakers, Similar Web
Working knowledge of content management systems, product information management systems, and digital assets management platforms
Familiarity with mobile marketing and commercialization
Referenceable track record of influence across a global company, matrix environment
Stanley Black & Decker believes in giving each and every applicant an equal opportunity to succeed on their own merit. We strive to hire employees that reflect and support the diverse perspectives, experiences and needs of employees and our communities including but not limited to race, national or ethnic origin, colour, religion, age, sex, sexual orientation, gender identity or expression, marital status, family status, genetic characteristics, and disability. We remain committed to upholding the values of equity, diversity, and inclusion in our work environments. We know that diversity underpins excellence, and that we all share responsibility for creating an equitable, diverse and inclusive organization. Therefore, in pursuit of our values, we seek employees who will work respectfully and constructively with differences across the organizational hierarchy in actualizing SBD s priorities, goals and principles of equity and inclusivity. If accommodation is required at any point in the recruitment process, please contact a member of our Recruitment Team. Please note that as part of our recruitment process, candidates in the final stages will be required to complete a background check which may include a criminal background, credit and drivers abstract check.
#LI-RD1"
"Communications and Social Media Specialist - Vancouver, BC - Indeed.com","Are you looking to add to your client base?
We’re private family holding company with five focus areas: apparel, real estate, philanthropy, private equity and passive investments. We are a proudly West Coast company, with a vision to create possibilities for people to live longer, healthier, more fun lives.
We are currently in search for a Communications and Social Media Specialist.
Your primary goal would be to maintain periodic social media presence of our Company (Hold it All Inc.), and the social media of some of our subsidiaries and owners. As well, you would act as a single point of reference for specific communications projects, liaising with a variety of communication firms/agencies.
Responsibilities in more detail:
Research and develop stories to share on social media and with traditional media and influencers.
Coordinate responses on any media requests and questions with appropriate person from HIA.
Every 2 weeks, create relevant posts on Instagram, Facebook, LinkedIn to raise awareness and to grow followers.
Every 2 weeks inform our President on communications and social media actions and activity.
Monitor the marketing of an autobiography (free downloads) via pre-existing social media online marketing program.
Keep current HIA, W5F, Kits Beach Capital and Solve FSHD websites.
When needed, source and vet external PR agencies and communications vendors.
Act as a single point of reference for HIA and project manage communications projects with specialty communication firms/agencies.
Working with Us
We’re a team of outdoors-loving and health-conscious people, who take great pride in the open and inclusive work culture we have built. We encourage people to speak up and we hear all voices equally. We’re driven to maximize the potential of the people we work with, we value learning, integrity, and fun, and are passionate about working with people who share these values.
This is a part-time freelance/contractor role. We welcome you to our beautiful Gastown office in Vancouver, BC. We offer a casual working environment with amenities including a beautifully-appointed kitchen, rooftop terrace, and end of trip facilities for those of you who love to bike to work or get your workout in before your workday begins.
Part-time hours: 20 per week
Application Deadline: 2021-11-12
Job Types: Part-time, Freelance
Schedule:
Monday to Friday
Work remotely:
Yes"
"Digital Marketing Specialist - Concord, ON - Indeed.com","The Digital Marketing Specialist, Paid Media is responsible for the implementation of digital marketing campaigns including Paid Social, Search, Display, Video, Programmatic, Native and Audio to drive global student recruitment and brand awareness of Yorkville University and Toronto Film School programs.
II. DUTIES AND RESPONSIBILITIES
﻿
Coordinate and execute cross-channel digital marketing campaigns including Paid Social, Search, Display, Video, Programmatic, Native and Audio
Develop full funnel growth strategy across channels
Day-to-day campaign management
Accurately track and maintain budgets across campaigns
Collaborate with the team to optimize paid media campaigns, including bid optimizations, creative optimizations, and landing page optimizations.
Test creatives including messaging, calls-to-action, and landing pages
Implement A/B testing for ad concepts and keywords to improve campaign performance.
Work collaboratively, coordinate, and communicate with internal and external partners, including Facebook, Google, Bing, Amazon and etc.
Along with the Marketing Brand Managers, responsible for following brand guidelines, messaging, and compliance while making improvements on conversion rates, and the acquisition of quality leads.
Conduct keyword research, build keyword lists, analyze search volume and competition to provide campaign recommendations
Create digital campaign reports, analyzing campaign performance along with strategic recommendations for continual improvement
Produce weekly/monthly reports, covering all paid media channels & performance data.
Identify opportunities to improve student recruitment through paid channels.
III. POSITION PROFILE
A. Education and Experience
Bachelor’s degree in a related field (Marketing) or relevant experience
3+ years of experience in Social Media Advertising, Search Engine Marketing, Digital Analytics, Conversion Optimization, or any related field in Digital Marketing
Agency experience is considered as an asset
Search Engine Optimization experience is an asset
Experience with Adobe Analytics, Google Analytics and Google Tag Manager is an asset
B. Skills and Abilities
Ability to multi-task and adhere to deadlines
Strong organizational and project management skills
Ability to identify growth opportunities
Keen eye for detail & excellent organizational skills
Ability to think analytically, identify and solve problems through data analysis
Proven analytical skills, with the ability to summarize and present findings clearly and concisely
Strong verbal and written communication skills
Team player, able to work with global cross-functional teams
Excellent time management and prioritization skills
Highly motivated, detail oriented, and a self-starter
About Yorkville University
Founded in 2004, Yorkville University is a Canadian university with a national presence. With campuses in New Brunswick, Ontario and British Columbia, Yorkville University offers professional, practitioner-oriented masters and bachelor degree programs, delivered entirely online, in class or a blend of both.
Please visit www.yorkvilleu.ca for further information.
Diversity, equity and inclusion are a critical component of life at Yorkville University and Toronto Film School, and we are committed to making these values an integral part of our culture. Toronto Film School/Yorkville University encourages applications from all qualified applicants, including women, persons with disabilities, Black, Indigenous, and People of Colour (BIPOC), people from the Lesbian, Gay, Bisexual, Transgender, Transsexual, Queer, Questioning, Two-Spirit, Intersex, Asexual + (LGBTQ2SIA+) community, and other equity-seeking groups.
Yorkville University is committed to providing accessible employment practices that are in compliance with the Accessibility for Ontarians with Disabilities Act (‘AODA’). If you require accommodation for disability during any stage of the recruitment process, please notify Human Resources at
1-866- 467-0661 ext. 1236
."
