Title,Description
"Digital Marketing Coordinator - Halifax, NS - Indeed.com","Ensure accuracy and clarity of each property’s website, including grammar, punctuation, spelling; as well as utilizing all available merchandising opportunities.
Ensure all local listings are optimized, accurate, up to date & appealing.
Maintain third party content with content scores above 95%
Ensure all hotel digital assets are optimized, accurate and up to date with appealing offers
To become the brand subject matter expert (Marriott, Hilton & IHG)
Responsible for in bound link development from relevant sites and directories
Assist with assembling month end reports and analytics
In collaboration with the team, analyze channel performance and develop new ways to improve NCH’s online presence
Supports corporate communications including the NCH website, Facebook & Linkedin
Support the Digital Marketing Manager and VP, Digital Strategy with strategic projects
Support the annual budget planning process
Job requirements
At least 1 year of progressive experience in a hotel or a related field as well as a college degree and hotel reservations or sales experience required. In this role you will use a computer, telephone, printer, fax machine, and other office equipment. Long hours sometimes required. Sedentary work -- exerting up to 10 pounds of force occasionally, and/or negligible amount of force frequently or constantly to lift, carry, push, pull, or otherwise move objects. To be successful you must be able to convey information and ideas clearly; must be able to evaluate and select among alternative courses of action quickly and accurately; must be effective in handling problems in the workplace, including anticipating, preventing, identifying, and solving problems as necessary; must have the ability to assimilate complex information, data, etc. from multiple sources and consider, adjust, or modify to meet the constraints of the particular need; must be effective at listening to, understanding, and clarifying the concerns and issues raised by co-workers and guests; and must be able to work with and understand financial information and data, and basic arithmetic functions."
"Marketing Director - Vancouver, BC - Indeed.com","Our clients engage with Able & Howe when they recognize that next-level growth will mean moving away from “random acts of marketing”. Our senior leadership team turns marketing into a strategic, sustained and sales-aligned growth engine.
This is where you come in. We are looking to hire a senior-level marketing leader to help our clients push their marketing to the limit and achieve their growth objectives. You will be working with 2-4 client accounts at any given time, usually for a period of 18-24 months, helping to lead, build, and scale marketing programs that fuel measurable growth.
Able & Howe is built on a belief in transferable leadership—true leadership is infectious and can be shared across organizations. We foster marketing leadership, strategy, and execution within our company—and share and transfer it directly to our clients. Over time our abilities, skill sets, and knowledge become theirs.
*
The role:
Develop and champion cohesive marketing plans for clients looking to effectively scale their business
Drive the development of marketing systems involving the marketing stack (e.g. talent, tactics, the tech stack)
To succeed in this position, you must have the following:
Strong history and reference-supported track record of success in marketing leadership
Proven ability to collaborate with C-Suite leaders and elevate marketing as a strategic partner in the business, aligned to overall growth objectives
8+ years of marketing leadership experience
Must have full-time, in-house, senior-level experience for a minimum of 3+ years
Experience in building and leading marketing teams
Experience in selecting and advising on talent acquisition
Highly experienced at integrating external agency and vendor services to marketing program mix
Highly experienced at global and tactical marketing strategies
Must have experience across all core aspects of marketing leadership and the marketing stack, including:
Strategy, planning & budget-management
Staffing, management & talent resourcing
Brand & messaging
Sales & marketing alignment
Content marketing & demand generation
Channel / alliance marketing (bonus)
Experience in solution selection, integration, and strategy management for marketing technologies, including: CRM, marketing automation, social media, digital advertising, CMS, data & analytics, and more
Experience translating marketing metrics into C-Suite insights and proof of revenue impact
What makes you uniquely-equipped for this position:
Strong and compelling storytelling skills
Outstanding communication and interpersonal skills
Great sense of design and quality
Great intuition and uses foresight to spot and fix issues
Level-headed and well-intentioned person with a positive attitude
Superb analytical skills
Passionate customer advocacy
Deep understanding of changing market dynamics
Software experience:
WordPress
Google Workspace
Google Analytics or Microsoft BI
Why Able and Howe:
Unique business-model poised for disruption
Great opportunities for growth within the company
Opportunities to expand into all areas of marketing
Competitive salary and vacation time
Comprehensive benefits plan
Optional in-office, hybrid, or remote from within Canada.
*
Job Types: Full-time, Permanent
Salary: $80,000.00-$100,000.00 per year
Benefits:
Extended health care
Work from home
Schedule:
8 hour shift
Monday to Friday
Experience:
Marketing: 8 years (preferred)
Work remotely:
Yes"
"International Digital Engagement Assistant (Regular Part-time) - Scarborough, ON - Indeed.com","Job Number:
J1121-1427
Job Title:
International Digital Engagement Assistant (Regular Part-time)
Job Type:
Permanent PT Support (Regular)
Bargaining Unit:
PT Support
School/Department:
Finance & Business Development
Campus/Location:
Progress Campus/Remote
Pay Range:
$29.14 - $36.74/Hour
Hours/Week:
24
Shift Schedule:
Variable shifts between 8:30 am 4:30 pm or 10:00 am 6:00 pm. Occasional weekend work at peak periods/as needed to support virtual events
Date Posted:
November 19, 2021
Closing Date:
November 26, 2021
(This position is initially open to regular part-time, bargaining unit employees of the college)
Diversity, equity and inclusion are fundamental to our mission to educate students. We are committed to education that places strong emphasis on global citizenship, social justice and equity. We live this through the strength and richness that diversity brings to our workforce and welcome contributors from equity groups including: Visible Minorities, Persons with Disabilities, Lesbian Gay, Bisexual, Transgender and Queer persons
We also recognize that Centennial is situated on the Treaty Lands of the Mississaugas of the Credit First Nation and pay tribute to their legacy as well as that of all First Peoples that have been and remain present here in Toronto. We recognize that First Peoples come from sovereign Nations and that part of understanding our responsibilities of residing on this territory are understanding the true history, circumstances and legacy of the Treaties signed here (such as the Toronto Purchase, Robinson-Huron Treaty and Williams Treaties) and including pre-contact Treaties and Agreements between sovereign Nations and that all peoples in this area are therefore Treaty people with obligations and responsibilities to all our relations.
Position Summary
Centennial College is hiring a collaborative and creative International Digital Engagement Assistant to contribute to the College’s international digital engagement strategy. Reporting to the Recruitment Manager, International Digital Engagement, this position plays a strategic role in the virtual recruitment of international students within Canada and worldwide using interactive digital media. The incumbent will work collaboratively with the digital recruitment team, international admissions and recruitment colleagues, and college stakeholders to develop and implement innovative communications and recruitment campaigns. The incumbent communicates with prospective students and parents to assist with their information and engagement needs online. They also regularly provide skilled technical assistance to support webinars, virtual fairs, live streams, as well as in-person and hybrid events.
Note: Due to the current COVID-19 pandemic, this position will be primarily remote until further notice.
Responsibilities
Acts as a public relations representative for Centennial College; communicating effectively by utilizing a wide variety of social media, live chat, e-mail, and Customer Relationship Management (CRM) tools
Develops rapport and builds supportive customer relationships with prospects, families and representatives
Provides accurate information in responding to general and detailed information requests regarding programs, credentials, admissions requirements, student services, and the benefits of studying and working in Canada
Assists in the planning and coordination of digital outreach and engagement campaigns to support enrolment targets; integrating online events, e-mail marketing, SMS, and targeted social media advertising
Assists in the development and implementation of innovative communication and recruitment strategies
Provides specialized support for staff and partners in the planning, promotion, and hosting of virtual fairs, webinars, livestreams, and live chat events for the purpose of international student recruitment
Provides ongoing content maintenance and upkeep of the College’s program database and profile content on digital recruitment partner websites
Creates, optimizes and targets YouTube campaigns using Google AdWords
Writes and edits content for college websites, social media, and electronic and web-based publications
Collaborates with Recruitment Managers and Digital Media Designers to develop online promotional material
Provides digital support for traditional partnerships and regional recruitment operations: assists in coordinating the submission of information and content requested to support agents' own online marketing
Coordinates student and faculty guest speakers, moderates live text, and video chat sessions
Supports regional recruitment teams by providing technical assistance and moderation for online training, virtual meetings, and agent training webinars on platforms including Zoom, Skype, GoToWebinar, Easy Virtual Fair, etc.
Collects and manages data to help increase sales productivity through targeted communications plans
Works independently and collaboratively while taking the initiative to maintain their responsibilities in a multi-faceted environment.
Other duties as assigned, including support for in-person event hosting (set up and tear down)
Qualifications/Experience
Minimum 3 year Diploma/Degree related to Marketing, Communications/Writing or Digital Media Technology
Graduate certificate or specialized professional certification in a relevant field
Minimum 3 years of relevant experience in digital marketing, marketing, sales or recruitment with experience executing targeted e-mail marketing campaigns, preferably in a post-secondary environment
International study and work experience is an asset
Demonstrated experience using CRM tools to manage, clean, maintain and update database
Demonstrated data management experience; experience tracking, analyzing and reporting results
Familiarity with Canada's Anti-Spam Legislation (CASL) and General Data Protection Regulation (GDPR)
Demonstrated strong presentation skills
Experience planning, promoting, and hosting and live broadcasts using tools such as OBS studio, Facebook Live, Instagram Live, TikTok, or other international social media platforms
Strong oral and written communication
Demonstrated cross culture customer service/interpersonal skills.
Understanding and experience working effectively in a diverse environment
Proof of credentials or equivalencies from accredited regional or federal post secondary institutions and/or their foreign equivalents will be required at the time of job offer.
When applying, your cover letter and résumé must include examples that reflect all of the requested skills and qualifications and
must be submitted online by November 26, 2021 at 11:59 PM EST. Please quote Job ID J1121-1427.
Misrepresentation of applicant information will be grounds for your exclusion from the competition or for dismissal should you subsequently be hired for the position. We wish to thank all applicants for their interest and advise that only those selected for an interview will be contacted.
We are committed to providing persons with disabilities equal opportunities regarding all employment activities, including access to jobs and accommodations during employment as required, in accordance with the Ontario Human Rights Code (OHRC) and the Accessibility for Ontarians with Disabilities Act (AODA)."
"Digital Marketing Specialist - Vancouver, BC - Indeed.com","Planted in the heart of Downtown Vancouver; we do marketing, code websites, study consumer buying behaviour, write fresh stories and help cool brands grow. Named one of BC’s top 5 Best Workplaces at Small Business BC Awards, our agency would be a good fit for
ambitious and creative
individuals, who want to live their passions and talents through their 9-to-5. If you are someone who is hungry, enthusiastic, positive, and… well,
cool
– we want to hear from you!
We are on the lookout for the next
cool Digital Marketing Specialist
, to join our team downtown Vancouver.
// Responsibilities //
Independently planning and executing PPC and SEO campaigns for our cool clients
Monitoring budgets and overseeing search platforms
Tracking KPIs and producing useful reports for management and clients
Implementing fresh PPC and SEO solutions on a regular basis
// Qualifications //
3-5 years of experience in a related role
Agency experience is preferred
Proven track record of executing PPC campaigns independently
In-depth knowledge of Google Ads, Facebook and Instagram algorithms
A critical, entrepreneurial mind, attention to detail, and willingness to do what has to be done to achieve great results for our clients
We look forward to hearing from you!
—
Please note: Unfortunately, due to the high volume of applications, only qualified candidates will be contacted. We appreciate your interest!"
"Digital Marketing Strategist - Quebec City, QC - Indeed.com","About UEAT
Based in Canada, UEAT creates innovative online ordering solutions to help restaurant chains and independents across North America increase the overall lifetime value of their customers as well as their profit margins thanks to a range of online ordering and payment solutions based on artificial intelligence that personalizes each customer experience. In October 2021, UEAT became an independent subsidiary of Moneris. Moneris is Canada's largest financial technology company serving over 350,000 merchant locations processing more than 1.9 billion transactions worldwide.
We are looking for passionate and ambitious candidates ready to make life easier for restaurateurs around the world.
Tasks and responsibilities
*
Orchestrate the complete buyer’s journey of potential customers on our digital
channels. Check current processes and identify gaps in the current strategy
In collaboration with an external agency, establish and manage our investments in
digital advertising, in particular Google Ads (search and display) and advertising on
social media
Maintain a tool for web content analysis and efficiency (GA4, Zoho and Hotjar)
Collaborate with an external agency as well as our marketing and product
development teams to perfect SEO and plan new visitor journey tracking campaigns
Create demand and engagement on our website at different stages in the customer
journey
Personalize and automate the flow to move the customer through the sales funnel
Analyze data for continuous process improvement and targeting new market
segments
Analyze reports that track our digital marketing program’s ROI throughout the sales
cycle in Zoho
Work closely with our marketing and sales teams as well as partners to conduct
effective lead gen campaigns
Skills required:
Have excellent written and verbal communication skills
Be a team player and have the skills to mobilize and lead internal and external
collaborators towards the achievement of objectives
Have extensive experience in monitoring key performance indicators (KPIs)
and analyzing dashboards to track campaigns and process reports
Be an expert in SEO, SEM, Google Ads, email campaigns, digital advertising
and on social media
Ability to work well under pressure and under tight deadlines
Possess excellent skills in presenting complex concepts to a new audience
Why join UEAT?
Participate in growth and success in a dynamic work environment and a start-up atmosphere that will conquer the world;
Work in the most exciting offices in Québec City;
Get access to a gym at all times directly in the office;
Free coffee, snacks, fruit and more;
Be part of an extraordinary project and growth;
Flexible hours;
Education encouraged by management;
Management always open to new ideas and happy hour activities.
*
Type d'emploi : Temps Plein, Permanent
Salaire : à partir de 1,00$ par heure
Avantages :
Aide au Transport Quotidien
Assurance Dentaire
Assurance Invalidité
Assurance Maladie Complémentaire
Assurance Vie
Assurance Vision
Bourses d'Études
Congés de Vacances et Compensatoires
Événements d'Entreprise
Gym sur place
Horaires flexibles
Nourriture à Prix Réduit ou Gratuite
Programme d'Aide aux Employés
Programmes de Bien-être
Réductions Tarifaires
Stationnement sur place
Tenue Décontractée
Travail à Distance
Voiture de Fonction
Horaire :
Du Lundi au Vendredi
Télétravail:
Oui"
"Digital Marketing Specialist - Toronto, ON - Indeed.com","Heart & Stroke is a place that values championing health and has a bias for action as we tackle heart disease and stroke. Our mission is to promote health, save lives and enhance recovery. We are committed to a culture that exemplifies our core values:
CHAMPION Health, PRACTICE Humility, EMBRACE Change, DRIVE impact, LEARN and GROW and BE HEARTFELT.
Please note Heart and Stroke (H&S) is committed to supporting the health, wellbeing, and safety of our employees and their families. As such, temporary remote work arrangements are currently in place and we are regularly reviewing this as we monitor public health guidelines.
Who we need
Reporting to the Senior Marketing Manager, the Digital Marketing Specialist, Lottery role is responsible for the flawless delivery of the Lottery’s digital marketing tactics which results in the achievement of the Lottery sales revenue targets. The Digital Marketing Specialist, Lottery will manage digital media campaigns from briefing stage through to implementation to reporting.
Accountability areas will focus on planning and execution of digital media (Display, Native, Paid Social and Search), offline media (TV, radio) and the Heart & Stroke Lottery website (Content development and Vendor Management). This position will also help plan and lead the management of the Lottery’s organic social channels.
How you will make an impact every day
Leads Development and Implementation of Digital Marketing Campaigns and Website
Contributes to the development of core/key messages and overall campaign look/feel.
Works closely with creative agency(s) to ensure core messages and brand equity elements are delivered across all digital tactics consistently and effectively
Responsible for the development of creative digital briefs and campaign media briefs
Day-to-day creative vendor management, creative approvals, and scheduling.
Responsible for the implementation and project management of digital media strategies, while providing recommendations on paid media plans
Ensures media plan meets objectives and KPIs
Owns and executes SEM and SEO initiatives including keyword research, content recommendations, website optimizations and link building activities
Manages day-to-day Lottery website operations, content strategy & execution
Responsible for the organic social media strategy, helps plan the content calendar, and oversees development and execution of content on Heart & Stroke Lottery social media channels
Develops and executes “off-season” communication plans and materials
Contributes to the Lottery post assessment and key lessons learned and recommends business improvement ideas and solutions
Project Management of Digital Marketing Campaigns
Leads, prepares, and manages critical path and asset deliverables for all mass channels– offline and online
Oversees all media trafficking during campaign execution
Ensures projects are managed within agreed budget and course corrects where required to deliver planned outcomes
Participates in departmental meetings
Ensures online storage of assets and approvals are kept up to date
Works to ensure annual budgets are tracked and achieved and supplier contracts are adhered to and kept updated
Data and Results Monitoring and Evaluation
Ensures clear and measurable goals are created for each campaign and aligned with overall marketing and revenue objectives
Oversees and manages all performance media campaigns.
In partnership with Sr. Analyst, analyzes data in real time, monitors traffic numbers, bounce rates, channel performance, optimizes paid/organic search results (website architecture, keywords, links)
Acts as key point of contact for digital media agency for ongoing efficiencies & optimizations
Continuously develops optimization strategies to improve the performance of organic and paid search results
Ensures Lottery website is up to SEO standards, accessibility laws and oversees site architecture
Manages on-site optimization – including A/B testing, meta tags, content, site architecture, internal linking, sitemaps, load speed, URL paths etc.
Identifies opportunities for keyword expansion and constantly tests new features/approaches
What you bring
University degree with specialization in Marketing or Digital Marketing preferred
Google AdWords or Bing certification preferred
5+ years of work experience specifically in digital marketing roles (executing digital paid and SEO campaigns)
Agency background or in-house experience in digital marketing or eCommerce environment an asset
Proven ability to apply data and market research to marketing tactics and communication design
Anticipates and plans for future events, trends, challenges, and opportunities
Evaluates opportunities and develops creative solutions, stimulating new ways of thinking and solving problems.
Strong project management skills, delivery of successful projects on time with attention to detail
Excellent communication (writing, editing, and verbal) and interpersonal skills
Excellent organizational skills and ability to meet deadlines
Ability to establish solid working relationships with external and internal stakeholders
Ability to work flexibly, effectively, and efficiently under pressure
Self-initiative is a must
Experience using Ad Management and Analytic Tools (Adwords, Facebook Ad Manager, Google Analytics, Google Tag Manager, Google Optimize)
Experience with 3rd party Audit tools (Moz, Siteimprove, etc.)
Experience with CMS platforms (Sitecore preferred)
Basic HTML, CSS and Photoshop skills an asset
Apply now
Beat as one. If you want to join the fight to beat heart disease and stroke while building an engaged and giving community, apply by
December 15, 2021.
To learn more about our mission, our values and the difference our foundation makes in the lives of Canadians at every age, visit our website.
Candidates from diverse groups are encouraged to apply.
We are committed to fostering an inclusive, barrier-free and accessible environment. If you have been contacted for an interview and require an accommodation to participate in the recruitment and selection process, please advise and we will work with you to meet your needs.
YSTWT4PMd4"
"DIGITAL MARKETING AND SALES ASSOCIATE - Halifax, NS - Indeed.com","Job description
The Suitor in Park Lane Mall is HIRING a
Sales and Marketing Associate
!
Are you a motivated, energetic, and outgoing person? If so, The Suitor wants to hear from you!
The Suitor has been serving valued clients from Halifax, NS over the last 25 years and is currently hiring a
Sales and Social Media Associate!
Social Media Responsibilities:
· Develop a deep understanding of The Suitor’s and identify target customer groups.
· Create and/ or update social media profiles on all major platforms.
· Create a social media strategy for all major platforms.
· Consistently create, post, and manage photos, videos, and content for the target customer groups.
Sales Responsibilities:
· Communicate and interact with clients to understand their specific needs.
· Build long lasting relationships with new and existing clients.
· Assist with day-to-day store functions
o Schedule fittings
o Catering to walk-in clients
o Take customer payments.
o Organize the store.
The Suitor is seeking a long-term employee and willing to train the right successful candidate.
Store Hours:
Tuesday – Saturday (10AM – 5PM)
Vacation:
TBD
Pay Structure:
· Hourly wage + competitive commission structure
· 30 – 40 hours per week
3-month probationary period
Reference ID: 08-21
Expected start date: 2021-11-10
Job Types: Full-time, Commission
Salary: $34,257.00-$78,600.00 per year
Additional pay:
Bonus pay
Benefits:
Dental care
Paid time off
Schedule:
8 hour shift
Day shift
Weekend availability
Experience:
sales: 1 year (preferred)
customer service: 1 year (preferred)
Work remotely:
No"
