Title,Description
"Systems Business Analyst - Toronto, ON - Indeed.com","Experience
1 year to less than 2 years
Business Equipment and Computer Applications
Microsoft Visio, Microsoft Visual Studio
Specific Skills
Confer with clients to identify and document requirements.
Conduct business and technical studies, Design, develop and implement information systems business solutions.
Provide advice on information systems strategy, policy, management and service delivery, Assess physical and technical security risks to data, software and hardware.
Develop policies, procedures and contingency plans to minimize the effects of security breaches.
Develop and implement policies and procedures throughout the software development life cycle.
Conduct reviews to assess quality assurance practices, software products and information systems.
Education
Bachelor's degree
Personal Suitability
Client focus, Organized, Effective interpersonal skills, Team player, Excellent written communication, Initiative, Judgement, Accurate
Intended job posting audience
Anyone who can legally work in Canada can apply for this job. If you are not currently authorized to work in Canada, the employer will not consider your job application."
"Senior Business Systems Analyst - Delta, BC - Indeed.com","Senior Business Systems Analyst
Delta, British Columbia, Canada
Location:
City Hall
Employment group:
CUPE Local 454
Hours of Work:
35 Hour Work Week
Job ID:
21-89 EX (C)
One of the sunniest regions in BC’s Lower Mainland, Delta embraces three unique communities – Ladner, North Delta and Tsawwassen. The City of Delta is looking for dedicated individuals to join our team and share in our commitment to lead the way in public service excellence.
The City of Delta is currently looking for an outstanding candidate to join its Information Services Division in the exciting and challenging role of Senior Business Systems Analyst (SBSA). Reporting to the Application Services Manager, the SBSA supervises and maintains the City’s PeopleSoft 9.2 HCM (Human Resources & Payroll) and FSCM (Finance) systems. The incumbent will perform complex technical work at the Senior Systems Analysis level. The incumbent is generally responsible for overseeing the City’s PeopleSoft environments, evaluating opportunities for process and functional improvements, designing and implementing new processes and solutions, and managing PeopleSoft related projects including PeopleTools upgrades, expanded functionality, re-engineered processes, and critical patching.
The City of Delta will consider providing training to a successful candidate who is not experienced in PeopleSoft.
Specific Duties & Responsibilities
Daily supervision of one PeopleSoft Business Systems Analyst
Maintain effective working relationships with a variety of internal and external contacts including existing PeopleSoft consultant
Daily supervision, management, and coordination of the City’s Human Resources, Payroll, and Financial systems (PeopleSoft 9.2 HCM and FSCM)
Conduct requirements analyses, assess business requirements, develop and recommend solutions
Act as a project manager in the development and/or re-engineering of information systems and the implementation of information technology
Perform a variety of technical tasks and ongoing application support, monitor and evaluate the performance of enterprise systems, databases and related applications, and prepare detailed database designs
Provide on-going application support
Performs related duties as required.
Considerable independence and judgement are exercised in the technical work within the framework of established policies, objectives and guidelines. Work performance is reviewed by the Application Services Manager within Information Services in terms of achievement of desired objectives and effectiveness of services provided.
Examples of Work
Assess existing purchasing processes and integration between IBM Maximo Asset Management system and PeopleSoft 9.2 FSCM to reduce integration errors, improve performance, and expand functionality
Plan and implement new PeopleSoft functionality such as the Occupational Health & Safety module within PeopleSoft HCM
Create a roadmap to maintain PUM images and PeopleTools versions within Oracle’s support matrix
Manage maintenance roadmap and ensure PUM and newer PeopleTools versions are tested and implemented within acceptable upgrade windows
Seek out opportunities to improve client experience in their use of PeopleSoft 9.2 HCM and FSCM systems including new functionality and improved optimization of existing business practices
Required Knowledge, Abilities and Skills
Thorough knowledge of business analysis and configuration and business systems planning principles, methodologies and standards.
Preference to those with considerable knowledge and demonstrated experience in all aspects of PeopleSoft 9.2 HCM and FSCM both in a functional and a technical support capacity (PeopleSoft ERP training may be provided to a successful candidate)
Considerable knowledge of development techniques, relational databases, analytical tools and programming methodologies.
Considerable knowledge of the principles and practices of administrative management and project management.
Considerable knowledge of information technology components, processes and development techniques.
Considerable knowledge of the functions of departments served and their requirements in information technology.
Considerable knowledge of departmental functions, programming, policies and procedures.
Ability to document, analyze and assess a variety of information, identify priorities and resources, and propose alternative business processes.
Ability to act as project manager for the application and implementation of systems and information technologies.
Ability to establish and maintain effective working relationships with a variety of internal contacts and to provide advice and assistance on matters related to the work.
Ability to communicate effectively orally and in writing and to present proposals in non-technical language.
Ability to train, plan, assign, supervise and check the work of subordinates and participate in performance evaluations.
Ability to perform assigned duties under minimum supervision.
Desirable Training and Experience
University graduation at the Bachelor’s level in computer science, technology or engineering, project management certification or formal training, plus preference toward those with considerable related experience in an integrated information technologies environment supporting PeopleSoft FSCM (financial) and HCM (Human Resources); or an equivalent combination of training and experience in a similar ERP system. The City of Delta will consider providing training to a successful candidate who is not experienced in PeopleSoft.
Required Licences, Certificates and Registrations
Valid Class 5 Driver’s Licence for the Province of British Columbia
The City of Delta provides a competitive salary of approximately $88,827 - $105,172 (commensurate with experience) and an extensive benefit plan including an earned-days-off system.
Interested applicants are strongly encouraged to include cover letters with their applications.
We will be reviewing applications on an ongoing basis and this posting will remain open until filled. If you enjoy learning and challenges, have outstanding skills, and want to take a leading role in the modernization of PeopleSoft at the City of Delta, we would welcome your application for this exciting role.
Protecting the health and safety of our community and employees remains our number one priority. The City of Delta is committed to taking every precaution reasonable in the circumstances to protect the health and safety of workers from the hazard of COVID-19. The City has implemented a vaccination policy for all employees.
All new employees with the City of Delta are required to provide proof of vaccination from COVID-19, as a condition of employment. The City of Delta will evaluate and accommodate employees who are unable to be vaccinated against COVID-19 either through medical or human rights exemptions.
We thank all applicants for their interest; only those under consideration will be contacted.
Copies of relevant professional certificates, degrees, or tickets must be submitted with your application.
Preferred candidates will be required to submit a Police Information Check."
"IT Service Desk Analyst (Bedford. NS) - Part Time Weekends - Bedford, NS - Indeed.com","What is the opportunity?
A Service Desk Analyst acts as the first point of contact for customer interactions dealing with technical issues. Resolves basic technical issues via telephone or written correspondence via email or other electronic media while working with the Service Desk ticketing system. Works collaboratively with teammates and other technical support teams. The Service Desk Analyst will be required to adhere to SLAs, troubleshoot technical issues, have efficient IT documentation skills, handle interaction resolution and escalation, and provide a high level of customer support while working in this highly visible position.
What you will do?
Demonstrate thorough effective listening to identify customer technical needs, provide technical assistance and appropriate solutions through the effective use of Knowledge Base and escalation procedures; ensure client’s queries and concerns are resolved in a prompt, helpful and professional manner.
Ensures customer satisfaction by responding to and troubleshooting customer technical concerns by being a single-point-contact; ensures timely escalation of customer problems, following up with escalation partners and providing status updates to customer as appropriate.
Demonstrate commitment to first call resolution by taking ownership and accountability of reported incidents as first point of contact to put clients first when collaborating as partners; demonstrated professionalism in verbal and written communication skills.
Ability to troubleshoot technical issues dealing with computer hardware, software, mobile devices, remote access, printers, and telephony while ensuring proper documentation for each issue and resolutions via Service Desk ticketing tools for tracking, escalations, Call Back Purposes.
Maintain a firm understanding and familiarity with RBC’s common operating environment, enterprise products, infrastructure, telecom technologies, qualified software and hardware by staying up to date via News To Know and other communications.
Identify and evaluate any major operational problems or deficiencies and make recommendations for solution, automation or improvements; analytical thinking and participation in reviewing Knowledge base by submitting change request to ensure integrity of processes, procedures and eliminating non-value added steps.
Demonstrate effective call handling by achieving talk time goals, other not ready modes, post call processing, monitoring/readiness for incoming calls, first call resolution, customer satisfaction, and prompt/detailed documentation.
Ability of multitasking – technical troubleshooting, documentation via ticketing tool, Sharing important information with peers when Larger issues are detected, and monitoring open incidents and ongoing major technical issues.
Must be available weekends, shifts will be determined
What do you need to succeed?
Must have
University degree or College diploma in computer science related discipline
Technical understanding of Microsoft Windows technologies, Microsoft Office products, the internet, Remote Access, mobile device platforms (Blackberry, IOS, and Android), printers, IP telephony, and technical ticketing platforms
Nice to have
ITIL v3: Foundations, Operational Support & Analysis
1-2 years working in IT support and/or Service Desk support with phone support expertise
Technical Certification in an IT area
What’s in it for you?
We thrive on the challenge to be our best, progressive thinking to keep growing, and working together to deliver trusted advice to help our clients thrive and communities prosper. We care about each other, reaching our potential, making a difference to our communities, and achieving success that is mutual.
A comprehensive Total Rewards Program including bonuses and flexible benefits, competitive compensation, commissions, and stock where applicable
Leaders who support your development through coaching and managing opportunities
Ability to make a difference and lasting impact
Work in a dynamic, collaborative, progressive, and high-performing team
A world-class training program in financial services
Flexible work/life balance options
Opportunities to do challenging work
Opportunities to take on progressively greater accountabilities
Opportunities to building close relationships with clients
Access to a variety of job opportunities across business and geographies"
"Business Systems Analyst - Etobicoke, ON - Indeed.com","Job Address:
1425 The Queensway, Etobicoke, Ontario, M8Z 1T3
Reporting to the Senior Manager, Business Systems – North America, the person in this role is a key functional point of contact to our business partners and works to provide optimized IT solutions across all business processes, consistent with industry best practices.
The person in this role is a highly driven business systems analyst assigned to perform projects, enhancements and user support. Utilizing skills that require an understanding of business processes, requirements and technical specifications for the development team.
This role should support key company stakeholders on business efficiency improvements. The business analyst’s responsibilities involve developing new business requirement, communicating to management on how these requirements will enhance business efficiency, and creating weekly updates.
To be successful as a business systems analyst, you should be able to effectively streamline/automate processes; while working with a significant amount of independent authority and judgment.
Ultimately, a top-performing business systems analyst should be able to identify ways in which to improve user satisfaction.
A successful candidates for this role needs to proof
System development life cycle experience.
Principles, methods and techniques used in designing, developing, testing and implementing software systems.
Principles and practices of customer service.
Methods and techniques of developing and presenting technical documentation and training materials.
Principles and practices of record keeping.
Core Accountabilities:
Trains, leads, and provides technical guidance to users.
Guide development team on technical specs when development is required.
Provide Level 2 & 3 support for key business systems applications including afterhours support
Keep applications documentation up-to-date
Create/Update Knowledge Base for applications
Support continuous improvement initiatives
Drive requirements gathering for assigned initiatives.
Analyzes and evaluates business requirements, consults with personnel from various departments and identifies areas for the development of technical solutions to automate and/or improve business processes. Provides recommendations on new or enhanced systems, software, upgrades and modifications.
Evaluates and balances the requirements/needs of multiple departments/divisions in identifying the technical solution that will best meet the identified needs.
Communicate with stakeholders to define project scope and review project activities, recommendations and outcomes.
Designs and implements project testing and quality assurance processes.
Develop and update user documentation, written instructions, training guides, manuals and materials for users and applications support staff; meets with users to provide information regarding system changes and enhancements and to address any questions or issues.
Prepares complex reports, correspondence and other documents; participates on conferences and training sessions.
Provides standards and operating guidelines; provides timely input on performance evaluations and disciplinary matters.
Develops programming specifications to serve as guidelines for application development staff for system enhancements and modifications; confers with application development staff to clarify program specifications.
About You:
Relevant College or University degree in Computer Science, Business, Engineering or related discipline;
Minimum 5 years’ of IT experience in business systems analysis or equivalent;
Experience on
EAM
or any other Maintenance Management System (Implementation and support)
Experience on
Blujay
or any other Transportation Management System (Implementation and support)
Experience with
integrations with ERP systems
, preferred
SAP
;
Knowledge of best practice in Project and Software Development Life Cycle management;
Excellent analytical/problem solving;
Experience working in a fast-paced, 24x7 support environment;
Excellent customer facing skills in terms of managing expectations and resolving issues;
The ability to self-manage multiple concurrent tasks;
Results driven with a strong sense of ownership;
Strong analytical skills as well as a dedication to detail;
Excellent communication skills.
Proven experience with the following software
EAM – Enterprise Asset Management
Blujay – Transportation Management System
MES - Manufacturing Execution System
SAP – EAM integrations
SAP – Blujay integrations
Proficiency in MS Office (MS Word, Excel, PowerPoint).
Knowledge of Microsoft Visio is advantageous.
The ability to handle multiple projects in a fast-paced environment.
Effective communication and leadership skills.
Excellent problem-solving and analytical skills.
Exposure to web-based database applications, mobile apps and underlying design;
Good customer facing skills in terms of managing expectations and resolving issues.
Weston is committed to fostering a work environment with strong core values that support diversity through various policies, programs and activities that encourage sensitivity and accommodations. Weston offers employment regardless of race, colour, gender, national origin, religion, age, disability, or sexual orientation. Diversity is integral to our success as an organization and we will use diversity as a model to help identify and develop the best talent, create effective teams, and achieve overall excellence. In addition, we believe that compliance with laws is about doing the right thing. Upholding the law is part of our Code of Conduct – it reinforces what our customers and stakeholders expect of us.
Number of openings:
1
Please Note: If you have Employee Self Service (ESS) on Workday, apply to this job via the Workday application."
"Desktop Support Analyst - Kitimat, BC - Indeed.com","We are seeking a Senior Desktop Support Analyst to join our team in Kitimat!
The successful candidate will be expected to assist users based at one of the project’s engineering offices with any issues, questions, or concerns regarding Information Technology. This will include troubleshooting, training, technical support, ordering of IT equipment, managing escalations, supporting and fostering the use of IT services for collaboration, and assisting in the planning and executing of IT projects.
Skillset Required
Client-facing role, successful candidate should be able to develop positive relationships with end user, as well as articulate what they’re doing in a manner that makes sense to the client
Troubleshooting – focus on Windows 10; Microsoft Suite; Network Connectivity; Citrix;
Remote Support Experience through tools such as Windows Remote Assistance a plus
IT Asset Management
Adaptable, Fast Learner
Experience with capital projects a positive
Stakeholder management
Communication
Requirements gathering
Networking – support and configuration
IT Security and Information Security
Role will include:
Collaborate with support and procurement teams within the Account, including IMAC, PIMA, and the Service Desk, representing the interests of client
Assist with ordering of equipment and services on behalf of the organization through ServiceNow
Help and train employees in the request system and other provided systems, such as Concur and “The Hub”
Troubleshoot and escalate problems, both technical- and request- related
Manage account requests and configuration
Assist with installation of GI equipment
Assist with on- and off-boarding of staff and contractors
Set up mobile phones (both corporate and personal) for use within the organization
Assist in coming up with recommendations and solutions not necessarily available through standard service offerings to the client
Track and manage all escalations, service desk tickets submitted on behalf of users
Provide support for GI software, including Office365, SharePoint, and SmartPlant
Provide support for VPN services and help to ensure users are able to work remotely
Support and Facilitate issues with Smart Cards
Help and train users on collaboration tools, including Skype4Business, video conferencing and SharePoint
Help Line managers and project administrators understand and fulfill their roles in the on- and off-boarding processes and JML activities. Manage and track JML escalations.
Help and train users in the use of printing tools
Coordinate with necessary stakeholders to enact infrastructure changes, including network upgrades and the management of remote “SiteConnect” VPN hardware
Guide workers through the Computer Asset Refresh Cycle
Be able to step in to complete IMAC and JML requests if required by client. This can include data transfer, set up of a new PC, and diskwiping old assets for transport and disposal
Coordination of any PC modifications requiring local administrator rights
Maintain working order of conference rooms and collaboration spaces assigned to client
Maintain and manage local site “loaner laptop” pool
Engage users in a pleasant, customer-friendly manner – DST should make IT experiences as enjoyable as possible for end users
Work to proactively identify, address, and resolve issues before they become apparent to client
Job Type: Full-time
Salary: $80,000.00-$92,000.00 per year
Schedule:
8 hour shift
Work remotely:
No"
