Title,Description
"Implementation Expert - A&MS Circuit Design - Toronto, ON - Indeed.com","28739BR
CANADA - Ontario - Toronto
Job Description and Requirements
Implementation Expert
You will be part of an R&D team working with our customer in their implementation and bring up of 32Gbps NRZ and 112Gbps PAM4 serial-link transceivers. We are looking for an engineer with theoretical knowledge and practical experience to contribute to the team. You will work with a cross functional team of analog and digital designers, and hardware engineers. Due to the nature of this role, you are expected to have broad exposure to many different aspects of IC design. You are interested in challenging and varied tasks that come about from our customer requirements, implementation, and bring-up. You have excellent interpersonal skills, you are methodical and enjoy working on varied complex technical design issues.
You
will be involved in all stages of customer interaction including:
Pre-sales
: response to customer questions and determining their requirements
Implementation:
provide feedback and review of customer implementation
Bring-up
: work with our customers
You have an Master’s or PhD
degree in Electrical or Computer Engineering.
Due to the cross disciplinary nature of this position, key qualifications include one or more of the following…
Analog – solid background in high-speed analog CMOS circuit design
Digital – background in RTL design
Hardware – awareness on per-protocol handing of RX and TX adaptation ; hands on experience in measurement of transceiver performance
Communications theory – equalization, coding, noise/crosstalk filtering
Beneficial Experience:
Experience in analyzing link budgets for either NRZ and PAM4 high-speed serial links
Knowledge of circuit topologies in high-speed Rx/Tx SerDes PHY
Understanding of Tx/Rx equalization techniques.
Knowledge of CDR architectures and CDR loop dynamics
Knowledge about common high-speed serial data protocols including
PCIe5/6
10G/25G/56G/112G Ethernet
OIF-CEI 6G/11G/25G
JESD204C
CPRI
Experience in lab testing of high-speed serial links
Our Silicon IP business is all about integrating more capabilities into an SoC—faster. We offer the world’s broadest portfolio of silicon IP—predesigned blocks of logic, memory, interfaces, analog, security, and embedded processors. All to help customers integrate more capabilities. Meet unique performance, power, and size requirements of their target applications. And get differentiated products to market quickly with reduced risk.
At Synopsys, we’re at the heart of the innovations that change the way we work and play. Self-driving cars. Artificial Intelligence. The cloud. 5G. The Internet of Things. These breakthroughs are ushering in the Era of Smart Everything. And we’re powering it all with the world’s most advanced technologies for chip design and software security. If you share our passion for innovation, we want to meet you.
Synopsys Canada ULC values the diversity of our workforce. We are committed to provide access & opportunity to individuals with disabilities and will provide reasonable accommodation to individuals throughout the recruitment and employment process. Should you require an accommodation, please contact hr-help-canada@synopsys.com.
Job Category
Engineering
Country
Canada
Job Subcategory
Analog Design
Hire Type
Employee"
"Software Developer (Saskatoon/ Canada- Remote) - Saskatoon, SK - Indeed.com","Software Developer (Saskatoon/ Canada- Remote)
Vecima is looking for dynamic Software Developers to join our project focused teams in Saskatoon, SK. As a member of our R&D group, you will work in small cross-functional scrum teams consisting of software developers, engineers, and testers. You will influence the design and have a vital role in development of software components for use in Vecima’s varied product offerings. These software components may be targeted anywhere from real-time, low level processing on Vecima-designed embedded systems through to cloud computing on commodity hardware. Products created include but are not limited to: broadband video processing, DOCSIS data and video transmission, and content delivery systems. You will work with colleagues to leverage and increase your collective knowledge and skill sets, while continuously improving Vecima’s design practices, processes, and quality.
This position is based in Saskatoon, SK. However, we might consider candidates who can work remotely from anywhere in Canada.
Duties and Responsibilities:
Engage with Agile team in all aspects of software development
Work in a collaborative team environment and consistently commit to and complete software deliverables within a product development life cycle
Modify or debug code for functional and performance improvements
As part of a cross-functional team, participate in technical discussions where evaluating and executing design and development plans for products are reviewed
Apply a client-centric approach to changing requirements and demands
Generate appropriate documentation to clearly represent the software solutions being created.
Independently troubleshoot issues and provide technical guidance to team members as required
Actively contribute to efforts for continuous improvement
Required Skills & Qualifications:
Bachelor’s degree in Computer Science, Software Engineering or equivalent
5+ years experience developing software
Proficiency in C/C++, Python and object-oriented programming
User-land programming in a Linux/Unix environment
Strong experience in software development lifecycle from coding to code-reviews and builds
Capable of generating testing strategies to ensure applications are thoroughly tested to meet high quality standards
Able to build-out software test automation
Strong understanding of and experience in static and run-time analysis
Excellent skills at estimating level-of-effort and task-coding-times
Must be able to work cohesively within the local team and across geographically spread teams to accomplish results
Preferred skills:
Networking protocol implementation and analysis, with knowledge of TCP/IP, UDP/IP, SNMP, HTTP, and other networking protocols
High level software design
Experience with MPEG, DOCSIS, IEEE 802 standards
Proficient at using debugging to diagnose single and cross-service issues in software from unit to system levels
Proficient with using tools such as Git, Gerrit, Jenkins, Yocto, Bitbake, Jira, GDB, etc.
Core Competencies:
Demonstrated commitment to continuous professional development and learning
Excellent verbal and written communication skills
Demonstrated ability to work effectively under pressure
Influences project or agile team direction based on knowledge and experience
Attention to detail, initiative, productivity, teamwork and quality work are necessary to be successful within Vecima’s R&D culture
Vecima has a competitive compensation and benefits package, and strives to provide a challenging work environment that can foster skill development and personal career growth for all employees.
We consider applicants for all positions without regard to race, color, religion, creed, gender, national origin, age, disability, marital or veteran status, or any other legally protected status.
If you are looking for a challenging career move as a
Software Developer,
we want to hear from you!
About Vecima
Vecima (TSX:VCM) is a globally recognized leader in creating advanced broadband telecommunications products. Our products are shipped around the world and are used by major international companies to deliver Broadband Internet, Digital TV, Video-on-Demand and Telematics services in over 30 countries.
Technological innovation drives Vecima’s success. Vecima’s extensive Research and Development initiatives result in pioneering technology and intellectual property that flows directly into our cutting-edge products. We pride ourselves on innovative solutions and our continually expanding library of designs."
"Electrical Engineer - Edmonton, AB - Indeed.com","MOBILE DATA TECHNOLOGIES EDMONTON, AB
ELECTRICAL ENGINEER
Mobile Data Technologies, an Alberta Venture “Fastest 50” Company is seeking an
Electrical Engineer
to keep pace with expanding sales and product development. The primary responsibility for this position will be to design, create and maintain data acquisition and control systems.
MDT has become the leader in control systems for a variety of equipment in the oil and gas industry. Using a combination of robust hardware and software controls, our unique, easy-to-use control interfaces are in high demand. By building on a core framework of control products and HMI software, we are rapidly deploying an increasing number of control applications to an expanding market.
Day-to-Day Responsibilities Include:
Work with Operations and Sales personnel to understand the product requirements and then either lead a team or work within a team to develop a product that meets the requirements.
Design, implement, maintain, qualify, and improve electrical boards, instruments, equipment, facilities, components, products, and systems for usage.
Work with engineers and other MDT personnel to implement operating procedures, resolve system malfunctions, and provide technical information.
Perform detailed engineering calculations to compute and establish manufacturing, fabrication, test, and installation per specifications.
Assist designers/technicians in the development of products, using computer-assisted design/drafting equipment and software.
Direct and coordinate manufacturing, construction, installation, maintenance, support, documentation, and testing activities to ensure compliance with specifications, codes, and customer requirements.
Plan and implement research methodology and procedures to apply principles of electrical theory to engineering projects.
Prepare and study technical drawings, specifications of electrical systems to ensure that functionality and operations conform and surpass standards and customer requirements.
Work with software teams on overall product design
Manage time while juggling multiple projects and working within tight deadlines; provide sound time estimates to major stakeholders
Desired Skills & Qualifications:
Bachelor’s degree or diploma program in Electrical Engineering
5+ years Electrical design experience within the oil and gas industry
Experience with SolidWorks 3D Modeling
Experience with Electrical schematic software packages
PCB design experience
Excellent communication skills, both written and verbal, with the ability to relate effectively with all disciplines at all levels of the company
Motivated self-starter who can manage their time effectively
Personal growth potential that can keep pace with the expanding needs of the company and the business
Have a good understanding of real world electrical sensors and hardware (transducers, A/D input devices, analog outputs, etc.)
What’s in it for you?
Great potential for personal growth
An entrepreneurial environment, open to new ideas and expanding technologies
An industry leading hardware and software platform with leading edge technologies
Interesting, complex control problems to solve
A commitment to fun (are you the next foosball champion?)
An excellent remuneration package
A dynamic leadership team, fostering success
It’s true: this isn’t just your typical nine to five job. This position is for someone who is ready to take control over their career. An amazing path is ready and waiting for the right candidate. Is it you?
About MOBILE DATA TECHNOLOGIES:
Mobile Data Technologies is a high growth technology company focused on bringing the most advanced and robust data acquisition and control products to the Oil and Gas Industry. Wholly owned by oilfield services giant, NexTier Oilfield Solutions, since 2014, MDT specializes in frac fleets, pump trucks, blenders, pressure trucks, N2 pumpers and hot oilers. With an open platform control model, MDT is continually expanding their product lines into new growth markets. Mobile Data Technologies is proud to be named #22 on Alberta Venture Magazine's Fast Growth 50 list for 2013."
"Software Engineer - Data Analytics & Visualization - Vancouver, BC - Indeed.com","POSITION PURPOSE
Your position as a Software Engineer & Data Analyst is vital to Image Engine. Your intuition and experience presenting data to both technical and non-technical users empowers you to build tools and interfaces that serve data-driven decision making at all levels of VFX production.
Reporting to the Software Engineering Supervisor, you will design, develop, and maintain end-to-end data gathering, analysis, and visualization tools. You will build intuitive, visual end-user experiences that directly impact the way we approach VFX. You will have significant responsibility and influence in shaping Image Engine’s approach to data analytics. Your clients will be our internal Producers, VFX Supervisors, Art/Content Supervisors, along with Finance & various Senior Managers.
Projects may include data-driven bidding, progress tracking, and projection tools for VFX Producers; software & hardware analytics on our ~50k vCPU “private cloud” to drive purchase decisions, or to inform CG workflow changes; Render cost predictions to drive storage decisions on our 4 petabyte local storage or to detect “cloud-burst” requirements and identify cloud-capable render jobs.
Your passion, talent, and ideas will help us bring VFX at Image Engine to the next level of efficiency and performance.
DUTIES & RESPONSIBILITIES
Design, implement, and support a mixture of proprietary, open-source, and third-party software for data gathering, warehousing, transformation, analysis, and visualization
Collaborate with producers, supervisors, and managers to determine analytics & visualization needs for current and future productions
Create data visualizations that are intuitive & informative for non-technical audiences
Identify and optimize bottlenecks in data gathering & analytics algorithms and workflows
Document, test, and debug tools to ensure they meet production requirements
Provide technical support, training, and tutorials to Production Staff, Supervisors, and Managers
Stay up-to-date with industry trends for data analytics & visualization
EDUCATION AND EXPERIENCE
A university degree in Computer Science, Math, Statistics, Engineering, or a related field
2 or more years industry experience developing data warehousing, analysis, and visualization tools, or a postgraduate degree (MSc, PhD) with a strong focus on information visualization
Master's in Computer Science or a related field an asset
SKILLS AND ABILITIES
Technical skills
Experience writing software in Python required
Proficiency with SQL and elasticsearch required
Keen data sense backed by strong data visualization skills
Experience building ETLs and data pipelines within a sandboxed Linux environment
Working knowledge of DevOps practices, CI/CD, Git and GitHub
Experience with Kibana, Grafana, ReDash, or Knime an asset
Familiarity with VFX production workflows & data formats an asset
Core skills
Team oriented with good communication skills, able to work closely with non-technical coworkers
Preference for a structured work environment, with clearly outlined priorities
Expectation of upfront planning before proceeding with final implementation
Proactive with proven ability to work both independently and in a team
Ability to take direction and feedback from a supervisor or a peer
Excellent time management and communication skills
Ability to monitor and identify potential inefficiencies with production workflows
Excellent troubleshooting and debugging skills
Ability to adapt quickly to new technologies and applications
Willingness to extend beyond your current specializations to help a larger engineering effort when required"
"Graphics Core IP Design Engineer - 117481 - Markham, ON - Indeed.com","What you do at AMD changes everything
At AMD, we push the boundaries of what is possible. We believe in changing the world for the better by driving innovation in high-performance computing, graphics, and visualization technologies – building blocks for gaming, immersive platforms, and the data center.
Developing great technology takes more than talent: it takes amazing people who understand collaboration, respect, and who will go the “extra mile” to achieve unthinkable results. It takes people who have the passion and desire to disrupt the status quo, push boundaries, deliver innovation, and change the world. If you have this type of passion, we invite you to take a look at the opportunities available to come join our team.
GRAPHICS CORE IP DESIGN ENGINEER
THE ROLE:
This opportunity is for a full-time, experienced individual who has a passion for the digital design and verification of large-scale, complex computer hardware processors. The successful candidate will be working as part of an agile team developing, verifying, and delivering IP for AMD’s next generation graphics (GFXIP) cores. Our design engineers enjoy challenges making speed, area and low power tradeoffs while driving functionality to closure. We use state-of-the-art tools & methodologies to deliver into cutting-edge silicon technologies. The successful candidate will work closely with architects, other design and verification engineers to contribute to the development of new feature design and quality improvement of existing designs.
THE PERSON:
Besides a passion for modern, complex processor architecture, digital design, and verification in general, these personal qualities are essential to success in this role:
Excellent analytical skills
Outstanding critical thinking and problem-solving skills
Comfortable working closely with others as part of a team
A self-starter who excels at driving tasks to completion and enabling collaboration amongst team members
KEY RESPONSIBILITIES:
Study and analyze to gain a deep understanding of high-level architectural and micro-architecture specifications for Graphics Core IP blocks
Digital logic design in Verilog and SystemVerilog including writing SystemVerilog Assertions (SVA) and cover properties to ensure highest quality
Assist in Formal Property Verification (FPV) by working closely with FPV team to drive high confidence in the critical areas of the design earlier on during project life cycle
REQUIREMENTS:
Strong fundamentals in Digital Logic Design and Computer Architecture
Must have RTL design or SVA development experience in at least one project from beginning (concept-phase) to end (tape-out)
Several years of relevant ASIC IP design experience preferred
Experience coding with Verilog or System Verilog or similar languages
Experience with developing design assertions (SVA), coverage, lint and design methodologies
Exposure to design and verification tools - VCS or equivalent simulator, debug tools such as Verdi and waveform viewers
Familiar with Linux programming and scripting, in Perl, TCL or similar
Understanding of micro-architecture and design of blocks such as arbiters, interconnect networks and caches an asset
Exposure to Formal Property Verification (FPV) using tools such as Synopsys VC Formal or Cadence JasperGold an asset
ACADEMIC CREDENTIALS:
Bachelor’s (preferably Master’s) degree in Computer Engineering, Computer Science, Electrical Engineering or similar
LOCATION:
Markham, ON Canada
#LI-PH1
Requisition Number:
117481
Country:
Canada
Province:
Ontario
City:
Markham
Job Function:Design
AMD is an inclusive employer dedicated to building a diverse workforce. We encourage applications from all qualified candidates and will accommodate applicants’ needs under the respective provincial human rights codes throughout all stages of the recruitment and selection process.
Any applicant who requires accommodation should contact
AskHR@amd.com
.
AMD does not accept unsolicited resumes from headhunters, recruitment agencies or fee based recruitment services."
"CT114 ACS Technician - Trenton, ON - Indeed.com","Position Overview:
Perform First, Second and Third Level repairs on aircraft structural components and ground support equipment. This will include, but not be limited to, the assessment of damage, control of corrosion, repairs, modification and replacement of aircraft structures and structural components using recognized techniques and specialized tools and equipment.
Key Areas of Responsibility:
Ramp duties include, but are not limited to, pre/post flight inspection and support, elementary tasks, marshalling, parking, towing, fueling/defueling and installation/removal of required mission equipment and crash and salvage response.
Travel and work in support of mobile repair parties
Attend training for trade and personnel development and for qualification/certification purposes.
Sweep and clean hangar, shop, stores and office areas, remove all debris accumulated by tasks performed and maintain a clean, safe work area.
Adhere to policies, procedures and directives established by the Company.
Perform other tasks as may be required from time to time.
Position Requirements
:
Is a graduate of a recognized aircraft maintenance course or apprenticeship program and holds a current Aircraft Maintenance Engineers (AME) “S” license or is qualified as an Aircraft Structures Technician within the Royal Canadian Air Force or equivalent commercial experience.
Possesses a thorough knowledge of aircraft structures and structural components, inspection techniques, damage assessment, aircraft materials and hardware, use of special tools and equipment. Knowledge of corrosion control techniques and paint or coating systems.
Capable of reading and interpreting technical documentation such as maintenance manuals, work packages, drawings, blueprints and Standard Plant Procedures.
Ability to use standard computer programs and such specialized ones as may be necessary in the performances of the duties.
Ability to drive vehicles and tow tractors.
Is qualified on CT114 Tutor aircraft with Aircraft Certification Authority for Aircraft Structures and/or Shop Certification Authority for Off-Aircraft tasks.
MRA qualified, or have the ability to achieve such qualifications in short notice
Demonstrate a personal commitment to IMP Occupational Health, Safety and Environment policies. Continually focusing on your individual safety and the safety of others who may be affected by your work and to fully comply with all Federal Health and Safety Legislation.
Participate in Continuous Improvement, Lean & 8S activities in your area.
Must be eligible to meet requirements for Canadian Controlled Goods Program (CGP), U.S. International Traffic in Arms Regulations (ITAR) and Canadian Government Security Clearances.
Internal applicants please use source code: I am an IMP employee
.
IMP is committed to Employment Equity and our goal is to be a diverse workforce that is representative at all job levels. We welcome applicants from Aboriginal People, Visible Minority Groups, Persons with Disabilities and Women in occupations of positions where they are under-represented. If you are a member of one of the equity groups, you are encouraged to self identify on either your cover letter or resume"
"Embedded Engineer - Toronto, ON - Indeed.com","Responsibilities
Develop and testing the UI based on NVIDIA Jetson
Develop comprehensive test plans related to hardware and software for high availability
Design/implementing device interfaces for reading data from raw sensors
Desired skills/experience
Background in computer/electronic engineering and software development
5+ years of experience in development of embedded systems using linux based operating systems
Programming of embedded systems using C/C++, Python
Experience with hardware operations and programming interfaces
Familiarity with agile development lifecycle
Excellence in technical communication skills
Job Type: Full-time
Job Location: Toronto, ON, Canada
Recruit manager: jobs@neuronaware.com"
