Title,Description
"Support Analyst, IT - Richmond, BC - Indeed.com","Looking for an opportunity to make a real impact? We’re currently recruiting for a
Support Analyst, IT
to join our amazing team of talented employees. While we are largely working from home as we continue to navigate this pandemic and support our franchisees, our office is in Richmond, British Columbia, so we’re ideally looking for a candidate in the Greater Vancouver Area.
Boston Pizza International has been recognized as one of Canada’s 50 Best Managed Companies since 1994. Serving more than 40 million guests annually, Boston Pizza International Inc. is Canada’s No. 1 casual dining brand with more than 380 restaurants in Canada and more than $1 billion in sales. Boston Pizza has for decades enjoyed a significant takeout and delivery side to our business, which has served as a strong advantage vs. most competitors in helping us adjust to and successfully weather the significant impacts the pandemic has had on the broader restaurant industry. We hope you’ll consider joining us!
What you do:
As a key member of the Technology team, you will be responsible for providing hardware and software technical support to Boston Pizza’s corporate staff. This role requires frequent contact with various IT groups and business clients; therefore, the IT Support Analyst must be able to perform effectively and confidently with all levels of personnel to ensure timely and professional delivery of services. Effective and empathetic interaction with IT clients in addition to technical and business support is integral to the role. This individual will apply proven communication, analytical, and problem-solving skills to help maximize the benefit of IT systems.
In this role, you will be expected to:
Provide Technical Support for Boston Pizza’s corporate staff.
Provide first level ticketing support and assign tickets accordingly.
Create, manage and maintain all helpdesk process documentation.
Install, configure, support, and maintain desktops, laptops, mobile devices, printers, video conferencing equipment and network connectivity for corporate clients.
Perform Imaging, physical equipment installs, maintenance, removals, and configuration on equipment located all offices.
Manage the Active Directory user and group and Office 365.
Support the new user setup and termination process for corporate employees.
Maintain the shared directory security permissions.
Provide Exchange mailbox troubleshooting and mail flow support.
Provide orientation training for new hires on the proper use of computer hardware, software applications and the various network services available.
Resolve client hardware and software issues.
Lift and maneuver 20lb boxes.
Who you are:
You have at least 2 years’ experience with application software, hardware installation, upgrades, and repairs.
You have at least 2 years’ experience performing Microsoft AD system administration.
You may have the completed two years of college-level coursework in computer science, information technology.
You will have strong multi-tasking and organizational skills.
You are pragmatic and self-disciplined.
You are thorough, detailed and results oriented as well as exhibit professionalism and sound judgement.
You have excellent communications skills
You have expert knowledge of Microsoft Windows 10, MS Teams and Microsoft Office 365 Suite.
You are familiar with Sophos Anti-virus software, computer networking and printer technologies.
You may be a Microsoft Certified Professional (MCP), A+, Network+
Why you want to work with us:
We’re a strong Canadian brand with a hospitality focus, embracing a work-hard, play hard philosophy.
We’re an organization with a strong emphasis on team culture.
Our entrepreneurial roots support a culture of collaboration.
We’re always looking to promote internal talent.
We have a tight-knit team to support you every step of the way.
Through the “Future Prospects” Boston Pizza Foundation, we’re focused on giving back to the communities we live, work and play in.
What’s next:
If you know someone who might be interested, share this posting with them.
If you’re interested, send us your resume.
If we’re interested, we’ll reach out to you to schedule a phone screen.
If you continue to be a prime candidate, we’ll schedule a virtual interview.
If you’re our leading candidate, we’ll check your references and provided they’re as good as we expect, we’ll extend you an offer.
At Boston Pizza International, we are committed to a culture that welcomes, encourages and celebrates the diversity of our team members. We recognize that our decisions are better and our ultimate success greater when we work together as equal members of one family.
Experience
Preferred
2 year(s): Experience performing Microsoft AD system administration.
2 year(s): Experience with application software, hardware installation, upgrades, and repairs."
"Software Support Analyst - Vancouver, BC - Indeed.com","We are looking for a Support Analyst for remote position in multiple locations in north America to join our dynamic team of smart, positive, and passionate people who are appreciated for their unique talents and empowered to do their jobs well. We are looking for individuals with proven experience in client service, troubleshooting, and analytics to help us support our Utility Customers on the SmartWorx product they own. As part of the team, you will be troubleshooting and designing new solutions for customers while continuously increasing high customer satisfaction. We highly value team members who are able to communicate clearly and concisely, and who work to build a positive and enjoyable workplace. This is a remote opportunity within Canada and the US. This job is posted as British Columbia but would consider other US or Canadian locations if willing to work in PST or MST time zone.
Responsibilities
Provide timely and thorough resolution to customer issues within SLA
Monitor the support ticket queue and take ownership or re-assign new tickets.
Interact with a range of internal departments (Infrastructure, Development, Professional Services, Sales, etc.) for ticket escalation
Assist in the problem solving of data, architecture, and interface issues
Respond quickly to customer calls and provide frequent updates so customers know their problems are being addressed via phone and email ticketing system
Develop a deep understanding of the functional and technical features of our applications and use this knowledge to address application related issues and questions
Provide recommendations to customers and Product Management to prevent recurrence of the issue
Understand the support services agreement to know when requested services are outside the support agreement terms
Provide suggestions on enhancements to the product or process
Document and share knowledge through Knowledge Base, Internal Articles, and Knowledge Exchange Training sessions
Availability from 8AM-8PM Eastern time zones Monday to Friday, with some flexibility to be discussed, preferably in the PST or MST time zone.
General Qualifications
University degree or technical college degree in computer sciences, software engineering, software development or related field
Familiarity and experience in a Support Services environment with evolving change management processes
Excellent client communication skills with the ability to manage and shape customer expectations
Ability to work on multiple initiatives simultaneously with knowing how to manage time and priorities effectively
Technical Qualifications
SQL experience in at least one of this databases is required (Oracle, PostgreSQL, MSSQL, MySQL, or other RDBMS)
Must be comfortable working in Red Hat Linux operating systems primarily with some work in Microsoft Windows
Software knowledge in at least one of JAVA, JSP, jQuery is preferred. You will not be coding but understanding of code is preferred
Knowledge and troubleshooting of Apache Tomcat is required
Soft Skills:
Energetic self-starter with a positive outlook on the world. You find a true sense of accomplishment and pride in helping people. There are no issues, only challenges and opportunities to raise the customer service bar.
Positive attitude for a fast-paced environment
Travel, when appropriately safe to do so, is required for departmental events about 2 times per year
What would make you stand out:
Utility industry experience, especially with respect to Smart Grid applications is preferred.
Oracle or PostgreSQL database configuration and administration is nice to have.
Community Involvement and Social Responsibility
Job Types: Full-time, Contract
Salary: $70,000.00-$106,629.00 per year
Additional pay:
Bonus pay
Overtime pay
Benefits:
Commuter benefits
Dental care
Extended health care
Paid time off
RRSP match
Vision care
Work from home
Schedule:
8 hour shift
Ability to commute/relocate:
Vancouver, BC: reliably commute or plan to relocate before starting work (preferred)
Application question(s):
Must have one of the SQL experience in ( Oracle, PostgreSQL, MSSQL, or other RDBMS)
Must be comfortable working with red hat Linux operating systems with some work in Microsoft window
Software knowledge in a one of JAVA, JSP, jQuery is prefered
Knowledge and troubleshooting of Apache Tomcat is required.
Education:
Bachelor's Degree (preferred)
Willingness to travel:
25% (preferred)
Work remotely:
Yes"
"SENIOR DATABASE ADMINISTRATOR - Toronto, ON - Indeed.com","Job Category:
Information & Technology
Division & Section:
Toronto Water, Customer Service & Technical support
Work Location:
60 Tiffield Road
Job Type & Duration:
Permanent, Full-time Vacancies
Salary:
$95,596.80 -$112,320.00, Wage Grade 7
Shift Information:
Monday - Friday, 35 hours
Number of Positions Open:
2
Posting Period:
30-Nov-2021 to 14-Dec-2021
Job Summary:
Toronto is Canada’s largest city, the fourth largest in North America, and home to a diverse population of about 3 million people. Consistently ranked one of the world’s most livable cities, we are a global centre for business, finance, arts and culture. Join the award-winning Toronto Public Service as Business Systems Analyst within Toronto Water.
Reporting to the team lead of Application Services 3 responsible for the Production environment, the Senior Database Administrator provides senior technical expertise in database products, management, administrative tools and utilities including installation, configuration, upgrade, quality assurance, back-up, recovery, integration and analysis. With extensive experience, including a strong commitment to quality customer service, the Senior Database Administrator will maintain and optimize the Toronto Water's RDBMS database environment at a state of good repair and provide ongoing IT support. As an integral member of the Integrated Technology Management team, the Senior Database Administrator will be at the ready whenever the need for troubleshooting arises, providing clear, effective technical advice and instructions to a wide range of users.
Major Responsibilities:
Implements detailed plans and recommends policies/procedures regarding program specific requirements.
Provides business/project plans and recommends modifications, upgrades and/or acquisitions for data centre consisting of large capacity servers, Storage Area Network and Enterprise Database Management Systems through analyzing the utilization and integration of the database infrastructure, evaluating the existing and market available hardware, software and network security products, studying feasibility, assessing business requirements and communicating with different levels of management across the Division.
Establishes database standards, policies and guidelines for on-line transaction processing databases and data warehouses to ensure high availability, accessibility, security and performance through analyzing the client requirements and business practices, evaluating and applying the functions available within current market database products.
Provides senior level support of the software product installation, configuration, maintenance, upgrade, user account administration, troubleshooting, system/database monitoring, capacity planning and performance tuning for production, development, test and training databases in a distributed database environment.
Develops methodologies and techniques for the ongoing assessment of database performance, capacity monitoring, problem notification to mobile devices, e-mail, and/or on-line reporting environment
Perform Evaluation, installation, configuration, maintenance and upgrades of hardware, software and related management tools.
Leads technical project teams to determine requirements, examine data flow, research and evaluate software, build logical and physical database architecture, develop and/or acquire, implement, maintain databases and provide technical and business support for application software and information solutions to meet client and business user requirements.
Provides senior level technical expertise and consultation in the area of database administration/system architecture to business users and other technical staff to ensure consistent database architecture through adherence to proper logical and physical database design techniques, data integrity and data security.
Liaises with other divisions’ or corporate Database Administrators, technical specialists and subject matter experts to assess and control database product, software resources and database license usage.
Provides senior management with recommendations of cost-effective system resources, database license utilization and integration and optimization of IT infrastructure. Communicates and coordinate internally and externally with vendors in case of hardware, systems software, network products, Cloud and/or other services acquisition.
Assists in the preparation of Requests for Proposals/Quotations, project charters and work plans and participates in the evaluation of technical solutions. Ensures corporate standards, system security and internal processing controls (audit controls) are maintained. Prepares documentation including program, systems, security and user documentation.
Establishes database backup and recovery standards and procedures. Provides backup and recovery services. Works with business and technical specialists and subject matter experts to design and implement server consolidation, disaster recovery, business continuation and other IT policies and procedures.
Establishes guidelines and monitoring rules, Information or Resource Management Standards, data security policies and procedures to identify and address common issues through analysis of patterns and trends in problems encountered by the users.
Makes recommendations such as implementing operating changes, training users, configuring parameters, allocating memory, resolving lock and/or disk space contention.
Converts, migrates and reorganizes data among different database systems, products and applications to facilitate data consolidation, integration or expansion, legacy systems upgrade and server virtualization.
Refreshes development and training database servers to support the development life cycle and training efforts. Participates in application training, acceptance testing and project quality reviews.
Designs, develops and maintains system/database program codes required for database administration, data reorganization, database and application auditing and application support. Works with application programmers and analysts to troubleshoot the application codes.
Configures and troubleshoots multi-tier connectivity, networks and related tools and other standard industry data access products. Trains and educates programmers, analysts and the users on setting up system connectivity.
Researches new software and database releases to find effective solutions in the context of evolving information architecture, evaluates alternatives and recommends policies, modifications in the standards/procedures, common software required, and the final product acquisition including solutions for high availability environment. Introduces and implements industry best practices for major enhancements and maintenance of information system services.
Supports the Division’s production databases and must be available for standby or on-call duties afterhours, during holidays, and for emergency events.
Provides input into the budget preparation and ensures that expenditures are controlled and maintained within the approved budget limits.
Key Qualifications:
Post-secondary degree or diploma in Database System Management or Computer Sciences, or an equivalent combination of education and related experience.
Certification – Oracle Certified Professional (OCP) – most current.
Extensive experience in Oracle Database, Oracle Grid infrastructure, Oracle WebLogic Server, Oracle REST Data Services (ORDS), APEX and MS SQL Server cluster environment, including installation, configuration, administration, performance tuning, patching, maintenance and troubleshooting in a complex environment.
Extensive experience providing implementation analysis and support in data management systems, data integrity, security, backup and recovery.
Considerable experience with database concepts and design; system/network architecture, operations, protocols, design and development techniques; application support; system and services monitoring tools to support and implement database software and service activities
Considerable experience in Oracle/MS SQL Relational Database software environment, with a good working knowledge of high-availability architecture, including Oracle Real Application Cluster, Data Guard and Cloud Computing.
Considerable experience in one or more of the following tools and technical environment but not limited to: Bomgar, OEM, TOAD, SSMS,SQL Developer, Apex Admin Console, Beyond Trust; Oracle 11g to 21c including cluster environment, Oracle APEX 5.1 to 21, MS SQL 2012 to 2019 including two node cluster.
Considerable experience in Change Management processes
Considerable experience in Quality Assurance and Test processes
Experience on Windows- and Unix-based computer operating systems in physical and virtual environments, and good understanding of Oracle and MS SQL RDBMS software licensing concepts.
You must also have:
Excellent verbal and written communication skills, with the ability to convey detailed technical information clearly and effectively to a variety of audiences.
Knowledge of planning, evaluation, analysis, design, implementation and integration of enterprise products in a large, diverse computing environment.
Ability to troubleshoot incidents reported, assist with their resolution and clearly communicate the means to resolve incidents and/or enhance applications or systems.
Highly developed analytical skills to research problems, evaluate and identify business requirements and make recommendations to senior management.
Ability to lead the technical change process from planning and implementation perspectives.
Excellent interpersonal skills, with the ability to establish and maintain effective working relationships with all levels of staff and external contacts.
Commitment to customer service, performance quality, and continuous improvement.
Ability to work independently and cooperatively in a team environment.
Ability to work under time constraints and meet deadlines.
Willingness to work flexible hours and ability to work days, afternoons and nights, including weekends and holidays, as required.
Willingness to be on-call for support of production systems.
Valid Ontario Driver G license and access to a personal vehicle
Knowledge of trends in the use of current technology as it relates to data management systems.
Certification of Microsoft Certified Solution Associate (MCSA) SQL 2017 or newer, would be an asset
Notes:
All City of Toronto employees are required to be fully vaccinated as a condition of hire in accordance with the City's Mandatory Vaccination Policy. Candidates will be required to show proof of vaccination during the recruitment process.
Equity, Diversity and Inclusion
The City is an equal opportunity employer, dedicated to creating a workplace culture of inclusiveness that reflects the diverse residents that we serve. Learn more about the City’s commitment to employment equity.
Accommodation
The City of Toronto is committed to creating an accessible and inclusive organization. We are committed to providing barrier-free and accessible employment practices in compliance with the Accessibility for Ontarians with Disabilities Act (AODA). Should you require Code-protected accommodation through any stage of the recruitment process, please make them known when contacted and we will work with you to meet your needs. Disability-related accommodation during the
application process
is available upon request. Learn more about the City’s Hiring Policies and Accommodation Process."
